attempt_id	commit	parent_commit	timestamp_utc	accuracy	parameters	status	description	proposal	train_exit	verify_exit
attempt-0020	8d550788ef6f31c9db54cdec2eee0950575d4088	c1e3d8e8f01741182fa607fc590ab42cfee9ff94	2026-08-17T04:31:06.785167+00:00	99.960000%	3648	keep	Test MQA with feed-forward width 18	family: feed-forward width; retained incumbent is 3712 parameters at 99.9600%, a +0.96 percentage-point margin over 99%. Same-family accepted result: attempt-0019, MQA plus ff19 at 3712/99.96%; same-family failed result: attempt-0012, standard-attention ff19 at 4224/10.20% (with standard ff18 attempt-0011 at 10.22%); prior attempts in this family: 6. Attempt-0019 established that MQA changes the ff boundary, so this is a new condition rather than a repeat of the standard-attention failure. Hypothesis: with shared K/V attention, ff18 may still retain the carry transform, yielding 3648 parameters; it is the nearest lower width and more informative than jumping to ff16. Keep learned positions, reversed operands, and 30000-step training; retain only official accuracy >=99% and strictly below 3712 parameters.	0	0
attempt-0021	01848016461da3374b810b751cfcbbae94c43b53	8d550788ef6f31c9db54cdec2eee0950575d4088	2026-08-17T04:41:53.859056+00:00	99.170000%	3584	keep	Test MQA with feed-forward width 17	family: feed-forward width; retained incumbent is 3648 parameters at 99.9600%, a +0.96 percentage-point margin over 99%. Same-family accepted results: attempt-0019 MQA+ff19 at 3712/99.96% and attempt-0020 MQA+ff18 at 3648/99.96%; same-family failed result: attempt-0011 standard-attention ff18 at 4160/10.22% (with standard ff19 attempt-0012 at 10.20%); prior attempts in this family: 7. The MQA context has already moved the width boundary, so ff17 is a new nearest-neighbor test rather than repeating the standard-attention failure. Hypothesis: one more FF unit can be removed while preserving the accepted MQA attention and learned-position representations, yielding 3584 parameters. Retain only official accuracy >=99% and strictly below 3648 parameters.	0	0
attempt-0022	a03718c1ac1c7254c9a9b3675f8e3f29b6d531b8	01848016461da3374b810b751cfcbbae94c43b53	2026-08-17T04:52:16.865873+00:00	98.500000%	3520	discard	Test MQA with feed-forward width 16	family: feed-forward width; retained incumbent is 3584 parameters at 99.1700%, a +0.17 percentage-point margin over 99%. Same-family accepted results: attempt-0019 MQA+ff19 at 3712/99.96%, attempt-0020 MQA+ff18 at 3648/99.96%, and attempt-0021 MQA+ff17 at 3584/99.17%; same-family failed result: attempt-0012 standard-attention ff19 at 10.20%; prior attempts in this family: 8. The accepted MQA sequence supports testing the nearest ff16 boundary, yielding 3520 parameters. This is more informative than altering attention again because the current margin is narrow and a one-unit width change directly tests the remaining FF capacity. Keep all other conditions and 30000-step training fixed; retain only official accuracy >=99% and strictly below 3584 parameters.	0	0
attempt-0023	51d45d26dd598c3b280ac737c1df85c03f05258b	01848016461da3374b810b751cfcbbae94c43b53	2026-08-17T05:02:29.688317+00:00	0.030000%	3520	discard	Train MQA ff16 only on full 10-digit operands	family: training control; retained incumbent is 3584 parameters at 99.1700%, a +0.17 percentage-point margin over 99%. Same-family accepted result: attempt-0009, which raised the ff24 candidate from a 98.84% 15k result to 99.99% with a justified training-control change; same-family failed result: none; prior attempts in this family: 1. The latest architecture probe, attempt-0022, used MQA+ff16 at 3520 parameters and scored 98.50% after 30000 steps, a near miss. Hypothesis: the remaining error may be distributional because training mixed 1–10 digit operands while the official random cases use full-range 10-digit operands; set min_digits=max_digits=10 while changing no model parameters, and test whether the same 3520-parameter candidate crosses 99%. This is more informative than repeating 30000 mixed-digit steps because it changes the data exposure to match the qualification regime. Retain only official accuracy >=99% and strictly below 3584 parameters.	0	0
attempt-0024	b8476e2c57b8b001edc2792b669284c896841f5f	01848016461da3374b810b751cfcbbae94c43b53	2026-08-17T05:12:15.234132+00:00	82.120000%	2208	discard	Tie the two MQA ff17 blocks	family: parameter tying; retained incumbent is 3584 parameters at 99.1700%, a +0.17 percentage-point margin over 99%. Same-family accepted result: none; same-family failed result: attempt-0001, shared standard-attention d16/h2/L2 ff48 at 3456 parameters and 75.95% validation after 30000 steps; prior attempts in this family: 1. The current incumbent differs materially through reversed operands, MQA, and ff17, all of which changed the attention/capacity regime. Hypothesis: reuse one MQA+ff17 block for both sequential depth applications, preserving two causal self-attention passes while removing one block's parameters and yielding 2208 total parameters. This is more informative than deleting a layer because it tests whether repeated computation in the successful MQA regime can substitute for independently parameterized depth. Keep the mixed-digit training curriculum and 30000 steps; retain only official accuracy >=99% and strictly below 3584 parameters.	0	0
attempt-0025	a607a56cb4b4bada0feb469b532e1ac822693570	01848016461da3374b810b751cfcbbae94c43b53	2026-08-17T05:22:30.737995+00:00	9.990000%	2968	discard	Shrink MQA transformer width from d16 to d14	family: attention organization; retained incumbent is 3584 parameters at 99.1700%, a +0.17 percentage-point margin over 99%. Same-family accepted result: attempt-0015, d16 MQA at 3776/99.95%; same-family failed result: attempt-0018, d16 rank-6 output projection at 3648/0.01% (with attempts 0016–0017 also failing); prior attempts in this family: 4. Hypothesis: preserve two independently scored attention heads and the successful shared-K/V organization while shrinking each head channel from 8 to 7 (d14), with ff17 and learned positions unchanged; the actual model should be 2992 parameters. This is more informative than one-head deletion because it isolates channel width while retaining two-head attention and independent depth. Keep the mixed-digit curriculum and 30000-step training; retain only official accuracy >=99% and strictly below 3584 parameters.	0	0
attempt-0026	69ac0377f06431e702aaad4800cd6d6a29c794e5	01848016461da3374b810b751cfcbbae94c43b53	2026-08-17T05:32:49.357794+00:00	1.060000%	3520	discard	Prune learned positions only at special-token slots	family: position representation; retained incumbent is 3584 parameters at 99.1700%, a +0.17 percentage-point margin over 99%. Same-family accepted result: none; same-family failed result: attempt-0014, rank-8 learned-position factorization at 4136/0.11% (with attempts 0003 and 0005 also failing); prior position attempts: 4. The d14 width probe in attempt-0025 scored 9.99%, so this keeps d16 MQA and changes only position-table scope. Hypothesis: operand and answer digit columns need independent learned rows, but BOS, plus, equals, and EOS positions may rely on their distinct token embeddings; use 31 learned rows and zero position contribution at those four slots, yielding 3520 parameters. This is more informative than removing or factorizing the whole position table because every arithmetic column retains full positional capacity. Keep mixed-digit training and 30000 steps; retain only official accuracy >=99% and strictly below 3584 parameters.	0	0
attempt-0027	3d08fd3c61b5ed03c56142cc11c656fc43dae64d	01848016461da3374b810b751cfcbbae94c43b53	2026-08-17T05:42:29.069072+00:00	99.790000%	3520	keep	Remove affine parameters from FF pre-norms	family: normalization; retained incumbent is 3584 parameters at 99.1700%, a +0.17 percentage-point margin over 99%. Same-family accepted result: none; same-family failed result: attempt-0007, final-LayerNorm affine removal at 5024/2.60% after an initializer repair; prior attempts in this family: 2. The retained model now uses successful MQA, reversed operands, and ff17, while attempts 0024–0026 showed tying, d14 width, and special-position pruning are not viable. Hypothesis: the FF pre-norm scale/bias may be redundant even though final affine removal failed; make only block ln2 affine-free, saving 64 parameters and yielding 3520 while retaining attention ln1 and final normalization. This is more informative than removing all normalization affine terms because it isolates the FF interface in the successful attention regime. Keep mixed-digit training and 30000 steps; retain only official accuracy >=99% and strictly below 3584 parameters.	0	0
attempt-0028	614bf9a6378fd23b3a59741b1b26d77d0777984e	3d08fd3c61b5ed03c56142cc11c656fc43dae64d	2026-08-17T05:51:57.317625+00:00	99.920000%	3456	keep	Remove affine parameters from attention pre-norms	family: normalization; retained incumbent is 3520 parameters at 99.7900%, a +0.79 percentage-point margin over 99%. Same-family accepted result: attempt-0027, affine-free FF pre-norms in MQA+ff17 at 3520/99.79%; same-family failed result: attempt-0007, final affine-free LayerNorm under standard attention at 5024/2.60%; prior attempts in this family: 3. Hypothesis: the successful removal at ln2 may extend to attention pre-norm ln1, saving another 64 parameters while leaving normalization itself, residual paths, MQA, full attention output, learned positions, and final affine normalization intact. This is more informative than removing all remaining affine terms at once because it isolates the attention interface and retains the known-stable final norm. Keep mixed-digit training and 30000 steps; retain only official accuracy >=99% and strictly below 3520 parameters.	0	0
attempt-0029	0e8fb52ac103d293049d81900986cd50b6ea9503	614bf9a6378fd23b3a59741b1b26d77d0777984e	2026-08-17T06:00:39.914125+00:00	95.580000%	3424	discard	Remove affine parameters from final LayerNorm after block pruning	family: normalization; retained incumbent is 3456 parameters at 99.9200%, a +0.92 percentage-point margin over 99%. Same-family accepted results: attempt-0027 ln2 affine-free at 3520/99.79% and attempt-0028 ln1+ln2 affine-free at 3456/99.92%; same-family failed result: attempt-0007 final-only affine removal under standard attention at 5024/2.60%; prior attempts in this family: 4. Hypothesis: the final affine terms may only have been necessary when internal LayerNorms carried learned affine transformations; with both block pre-norms now affine-free, remove the last final scale/bias for 3424 parameters. This is more informative than repeating the old final-only test because the normalization context has changed through two accepted reductions. Keep mixed-digit training and 30000 steps; retain only official accuracy >=99% and strictly below 3456 parameters.	0	0
attempt-0030	ba7a4f9020644e7461f731689b6226af4a20fb9b	614bf9a6378fd23b3a59741b1b26d77d0777984e	2026-08-17T06:11:07.713296+00:00	100.000000%	3200	keep	Use per-head block-diagonal attention output projections	family: attention organization; retained incumbent is 3456 parameters at 99.9200%, a +0.92 percentage-point margin over 99%. Same-family accepted result: attempt-0015, full output MQA at 3776/99.95%; same-family failed result: attempt-0018, rank-6 output bottleneck at 3648/0.01% (with attempts 0016–0017 also failing); prior attempts in this family: 5. Hypothesis: the failed low-rank projections removed too much global mixing, so preserve a full-rank d_head-by-d_head output transform independently for each head and remove only cross-head output terms; at d16,h2 this reduces each projection from 256 to 128 parameters and yields 3200 total. This is more informative than another low-rank rank because it preserves exact within-head expressivity and changes only cross-head coupling. Keep affine-free block pre-norms, full final norm, learned positions, MQA, ff17, mixed-digit training, and 30000 steps; retain only official accuracy >=99% and strictly below 3456 parameters.	0	0
attempt-0031	196138df826bd6598dbc55e0729fdadba3f9b9a1	ba7a4f9020644e7461f731689b6226af4a20fb9b	2026-08-17T06:56:44.176894+00:00	99.950000%	3136	keep	Reduce FF width to 16 with block-diagonal output mixing	family: feed-forward width; retained incumbent is 3200 parameters at 100.0000%, a +1.00 percentage-point margin over 99%. Same-family accepted result: attempt-0021 MQA+ff17 at 3584/99.17%; same-family failed result: attempt-0022 MQA+ff16 with full output projection at 3520/98.50%; prior attempts in this family: 9. The latest accepted attempt-0030 changed attention output organization to per-head block-diagonal projections and reached 3200/100%, so this proposal tests ff16 in that new context rather than repeating the prior near miss. Hypothesis: the structured output mixer preserves enough specialization to allow ff16, yielding 3136 parameters. Keep affine-free block pre-norms, full final norm, learned positions, mixed-digit training, and 30000 steps; retain only official accuracy >=99% and strictly below 3200 parameters.	0	0
attempt-0032	5c7cb9a61b60333a0cd452ca07a0b631419352dd	196138df826bd6598dbc55e0729fdadba3f9b9a1	2026-08-17T07:06:51.416547+00:00	9.910000%	3008	discard	Share the head-local attention output map across heads	family: parameter tying; current retained incumbent is 3136 parameters at 99.9500%, a +0.95 percentage-point margin over 99%. Same-family accepted result: attempt-0031, block-diagonal per-head output maps with independent maps at 3136/99.95%; same-family failed result: attempt-0024, tying the two full MQA+FF blocks at 2208/82.12%; prior attempts in this family: 2. Hypothesis: after attempt-0030 showed that cross-head output mixing is unnecessary and attempt-0031 reduced FF width, the two head-local 8x8 maps may also share one transform without changing the representational partition, saving 64 parameters per block for 3072 total. This is more informative than shrinking d_head because it preserves both attention channels and tests only the remaining repeated parameterization; the nearest untested alternative is a head-dimension reduction, which changes attention statistics and capacity simultaneously. Keep d16/h2/L2, MQA, affine-free block pre-norms, final affine norm, learned positions, reversed operands, mixed-digit curriculum, and 30000 steps; retain only official accuracy >=99% and strictly below 3136 parameters.	0	0
attempt-0033	8cd5e3df1495e857ed22839a6005cee8906d6ac1	196138df826bd6598dbc55e0729fdadba3f9b9a1	2026-08-17T07:16:42.230479+00:00	56.600000%	3072	discard	Reduce FF width to 15 with independent head-local output maps	family: feed-forward width; current retained incumbent is 3136 parameters at 99.9500%, a +0.95 percentage-point margin over 99%. Same-family accepted result: attempt-0031, per-head block-diagonal output mixing with ff16 at 3136/99.95%; same-family failed result: attempt-0022, MQA with full output projection and ff16 at 3520/98.50%; prior attempts in this family: 9. Hypothesis: the new independent head-local output organization made ff16 viable, so the nearest one-unit continuation may still preserve enough nonlinear capacity at ff15, yielding 3072 parameters. This is more informative than changing token or position representations because it isolates the remaining FF width boundary while keeping the successful attention organization fixed; the nearest untested alternative is a larger architectural substitution whose effect would be confounded with FF capacity. Keep d16/h2/L2, independent 8x8 head-local maps, MQA, affine-free block pre-norms, final affine norm, learned positions, reversed operands, mixed-digit curriculum, and 30000 steps; retain only official accuracy >=99% and strictly below 3136 parameters.	0	0
attempt-0034	82c1e0661592c3540a5c4e81a67ebb24472181bb	196138df826bd6598dbc55e0729fdadba3f9b9a1	2026-08-17T07:27:40.207895+00:00	6.070000%	3113	discard	Factor tied token input and output through rank 7	family: token representation; current retained incumbent is 3136 parameters at 99.9500%, a +0.95 percentage-point margin over 99%. Same-family accepted result: attempt-0002, reversed operand token order at 5056/99.98%; same-family failed result: attempt-0013, rank-6 tied token/output factorization at 4234/9.68%; prior attempts in this family: 2. Hypothesis: the earlier rank-6 collapse was measured before the successful MQA, affine-free pre-norm, per-head output, and ff16 changes; a less aggressive rank-7 factorization may retain the token distinctions needed by this newer 3136-parameter regime while reducing the tied token representation from 240 to 217 parameters, yielding 3113 total. This is more informative than retrying rank6 because rank7 is the nearest less-compressed representation and separates rank capacity from the older attention context; the nearest untested alternative is a rank-8 factor, which is not a parameter reduction at d16. Keep reversed operands, learned positions, d16/h2/L2, independent head-local output maps, MQA, affine-free block pre-norms, final affine norm, mixed-digit curriculum, and 30000 steps; retain only official accuracy >=99% and strictly below 3136 parameters.	0	0
attempt-0035	6ef1076ad1207cceee86b20f1fe9eb4515765eb3	196138df826bd6598dbc55e0729fdadba3f9b9a1	2026-08-17T07:38:14.000121+00:00	1.000000%	2976	discard	Tie corresponding operand-column position embeddings	family: position representation; current retained incumbent is 3136 parameters at 99.9500%, a +0.95 percentage-point margin over 99%. Same-family accepted result: none; same-family failed result: attempt-0026, removing positional vectors at special-token slots while keeping digit positions at 3520/1.06% (with earlier sinusoidal and factorized position trials also failing); prior attempts in this family: 5. Hypothesis: in the reversed fixed layout, operand A and operand B use the same column index and may share one positional vector while their token identities and the plus separator retain role information. Keep every digit-column vector for answer positions, operators, BOS, and EOS distinct, but map B columns 12–21 onto A columns 1–10, reducing the position table from 35 to 25 rows and yielding 2976 parameters. This is more informative than another whole-table low-rank or special-token deletion because it tests only the A/B column symmetry while preserving all answer-column positions; the nearest untested alternative is tying answer columns to operand columns, which removes role distinctions simultaneously. Keep d16/h2/L2, independent head-local maps, MQA, ff16, affine-free block pre-norms, final affine norm, reversed operands, mixed-digit curriculum, and 30000 steps; retain only official accuracy >=99% and strictly below 3136 parameters.	0	0
attempt-0036	8e1a5ac90e6ca3edbd7dea6fff934f99636b0086	196138df826bd6598dbc55e0729fdadba3f9b9a1	2026-08-17T07:46:50.170799+00:00	6.740000%	3008	discard	Trade one transformer layer for a wider ff48 sublayer	family: attention organization; current retained incumbent is 3136 parameters at 99.9500%, a +0.95 percentage-point margin over 99%. Same-family accepted result: attempt-0030, per-head block-diagonal output projections at 3200/100.00% before the ff16 reduction; same-family failed result: attempt-0025, d14 MQA width reduction at 2968/9.99%; prior attempts in this family: 6. Hypothesis: the incumbent's two blocks each use a narrow ff16 sublayer, while a single independently parameterized MQA block with ff48 can spend a similar budget on nonlinear width and still attend over the whole fixed sequence, yielding 3008 parameters. This is more informative than repeating the failed tied-block experiment because it removes a depth copy but restores independent parameters and substantially widens the surviving block; the nearest untested alternative is a two-block partial tie, which tests reuse rather than the depth-versus-width tradeoff. Keep d16/h2, independent head-local output maps, MQA, affine-free pre-norms, final affine norm, learned positions, reversed operands, mixed-digit curriculum, and 30000 steps; retain only official accuracy >=99% and strictly below 3136 parameters.	0	0
attempt-0037	8c0f7019b05b96d9fc6205b2b1d268972c1a89e7	196138df826bd6598dbc55e0729fdadba3f9b9a1	2026-08-17T07:58:24.273797+00:00	89.010000%	2624	discard	Make FF sublayers block-diagonal across attention heads	family: feed-forward width; current retained incumbent is 3136 parameters at 99.9500%, a +0.95 percentage-point margin over 99%. Same-family accepted result: attempt-0031, full ff16 sublayers with per-head attention output at 3136/99.95%; same-family failed result: attempt-0033, the one-unit ff15 reduction at 3072/56.60%; prior attempts in this family: 10. Hypothesis: ff15 showed that removing an entire hidden unit is too abrupt, but the successful attention block-diagonalization suggests that cross-head FF mixing may be redundant. Keep each head's ff16-width capacity in the sense of two independent 8-wide nonlinear maps, but remove only cross-head FF weights, reducing each FF from 512 to 256 parameters and the model to 2624. This is more informative than another scalar width decrement because it preserves the nonlinear width per head while isolating FF connectivity; the nearest untested alternative is low-rank factorization of each full FF matrix, which changes within-head rank as well. Keep two layers, d16/h2, independent head-local attention maps, MQA, affine-free block pre-norms, final affine norm, learned positions, reversed operands, mixed-digit curriculum, and 30000 steps; retain only official accuracy >=99% and strictly below 3136 parameters.	0	0
