attempt_id	commit	parent_commit	timestamp_utc	accuracy	parameters	status	description	proposal	train_exit	verify_exit
baseline	394c657b16ab7bfd7bba1c0d7644e9b0e371d25f		2026-08-17T01:17:44.078199+00:00	100.000000%	6080	keep	initial 6080-parameter pretrained starting model	baseline qualification check		0
attempt-0001	47abdd57a118cad0694dadcea7c621660d0953f9	394c657b16ab7bfd7bba1c0d7644e9b0e371d25f	2026-08-17T01:39:58.316394+00:00			error	Tie the two depth applications to one shared d16 h2 ff48 block	family: parameter tying; retained incumbent is 6080 parameters at 100.0000%, a +1.00 percentage-point margin over 99%. Same-family accepted result: none (baseline is the starting incumbent); same-family failed result: none; prior attempts in this family: 0. Hypothesis: reusing one block twice preserves two causal self-attention applications while removing duplicate block parameters, testing parameterization-preserving compression. This is more informative than the nearest untested one-layer deletion because it isolates whether repeated depth computation is useful without removing the second attention application. Candidate uses tie_layers=True, otherwise unchanged; retain only if official accuracy is at least 99% and strictly below 6080 parameters.	0	
attempt-0002	94ab87f45bd859ad38b8dc00072401db9c27b215	394c657b16ab7bfd7bba1c0d7644e9b0e371d25f	2026-08-17T01:48:53.616882+00:00	99.980000%	5056	keep	Reverse operand columns and reduce ff width to 32 at d16	family: token representation; retained incumbent is 6080 parameters at 100.0000%, a +1.00 percentage-point margin over 99%. Same-family accepted result: none; same-family failed result: none; prior attempts in this family: 0. The latest different-family result, attempt-0001, was a 3456-parameter shared-block optimization failure at 75.95% validation after 30000 steps. Hypothesis: reversing both padded operands aligns least-significant columns with the reversed answer, reducing the positional lookup burden; the paired ff48-to-ff32 compression tests whether that alignment can support an eligible 5056-parameter model. This is more informative than the nearest untested binary-token encoding because it preserves the vocabulary and directly tests column alignment while making only one capacity reduction. The candidate uses the same d16, h2, L2 attention stack, ff32, 15000 training steps, and final-checkpoint fallback; retain only official accuracy >=99% and strictly fewer than 6080 parameters.	0	0
attempt-0003	37fcaaf07201b440cd4f8d024c519b6cefa4c268	94ab87f45bd859ad38b8dc00072401db9c27b215	2026-08-17T01:55:01.222297+00:00	0.010000%	4496	discard	Replace learned positions with fixed sinusoidal positions	family: position representation; retained incumbent is 5056 parameters at 99.9800%, a +0.98 percentage-point margin over 99%. Same-family accepted result: none; same-family failed result: none; prior attempts in this family: 0. The latest accepted result is attempt-0002, which retained reversed operands with learned positions, d16/h2/L2 and ff32 at 5056 parameters; attempt-0001 was a different-family parameter-tying optimization failure. Hypothesis: fixed sinusoidal positions retain explicit order and column information while removing the 560-parameter learned position table, yielding 4496 parameters. This is more informative than deleting positional information because it isolates learned-versus-deterministic position representation at unchanged model width and attention organization. Training remains 15000 steps with final-checkpoint fallback; retain only official accuracy >=99% and strictly below 5056 parameters.	0	0
attempt-0004	b9427ae1abceda65e37ed19aa3450a007501fe85	94ab87f45bd859ad38b8dc00072401db9c27b215	2026-08-17T01:56:12.518285+00:00			error	Factor learned positions into segment and shared column embeddings	family: position representation; retained incumbent is 5056 parameters at 99.9800%, a +0.98 percentage-point margin over 99%. Same-family accepted result: none; same-family failed result: attempt-0003, 4496 parameters at 0.01% official accuracy; prior attempts in this family: 1. The latest accepted result is attempt-0002 with learned absolute positions, reversed operands, d16/h2/L2 and ff32. Hypothesis revision after the sinusoidal nonqualification: keep learned positional features but factor them into seven segment-role rows and eleven shared column rows, preserving A/B/output roles and least-significant-column alignment while reducing positional parameters from 560 to 288, yielding 4784 parameters. This is more informative than retrying fixed sinusoids because it changes the failed deterministic basis to a learned structured basis and more directly tests whether parameter sharing across corresponding columns is safe. Training remains 15000 steps with final-checkpoint fallback; retain only official accuracy >=99% and strictly below 5056 parameters.	1	
attempt-0005	797be47e56273bd8016ee47fc56935e0cee7c882	94ab87f45bd859ad38b8dc00072401db9c27b215	2026-08-17T02:02:44.423771+00:00	8.850000%	4784	discard	Repair embedding call in structured position candidate	family: position representation; implementation repair of attempt-0004. Retained incumbent is 5056 parameters at 99.9800%, a +0.98 percentage-point margin over 99%. Same-family accepted result: none; same-family failed results: attempt-0003 nonqualification at 0.01% and attempt-0004 implementation error before scoring; prior attempts in this family: 2. Attempt-0004's train log shows the intended 4784-parameter seven-segment/eleven-column candidate failed only because an nn.Embedding module was indexed with brackets, raising TypeError before the first batch. This repair changes only those two calls to normal embedding-module invocation; it is more informative than a new position hypothesis because it recovers the already-specified candidate without altering its architecture or training conditions. Train for 15000 steps with final-checkpoint fallback; retain only official accuracy >=99% and strictly below 5056 parameters.	0	0
attempt-0006	447c70d51996606606c2d04ada6dcfa6c04b1f5b	94ab87f45bd859ad38b8dc00072401db9c27b215	2026-08-17T02:03:20.800588+00:00			error	Remove affine scale and bias from final LayerNorm	family: normalization; retained incumbent is 5056 parameters at 99.9800%, a +0.98 percentage-point margin over 99%. Same-family accepted result: none; same-family failed result: none; prior attempts in this family: 0. The latest accepted result is attempt-0002; position-representation attempts 0003 and 0005 scored 0.01% and 8.85% respectively, so this proposal keeps the learned position table unchanged. Hypothesis: final LayerNorm's learned scale and bias are redundant after the two pre-norm blocks; removing only its 32 affine parameters should preserve normalization while yielding 5024 parameters. This is more informative than removing affine terms from every LayerNorm because it isolates the final projection interface and keeps internal optimization stabilizers intact. Train for 15000 steps with final-checkpoint fallback; retain only official accuracy >=99% and strictly below 5056 parameters.	1	
attempt-0007	aa914c607b71c61b2eab8f6b4bb89092a5828b1e	94ab87f45bd859ad38b8dc00072401db9c27b215	2026-08-17T02:09:20.817163+00:00	2.600000%	5024	discard	Repair initializer for affine-free final LayerNorm	family: normalization; implementation repair of attempt-0006. Retained incumbent is 5056 parameters at 99.9800%, a +0.98 percentage-point margin over 99%. Same-family accepted result: none; same-family failed result: attempt-0006, an implementation error before training because the initializer called ones_ on None for affine-free LayerNorm; prior attempts in this family: 1. The intended candidate remains final LayerNorm with elementwise_affine=False, 5024 parameters, while block LayerNorms and all other code stay unchanged. This repair adds None checks in the initializer and re-applies only the intended final-LayerNorm change; it is more informative than a new normalization variant because it recovers the exact unscored hypothesis. Train for 15000 steps with final-checkpoint fallback; retain only official accuracy >=99% and strictly below 5056 parameters.	0	0
attempt-0008	dd4da4b1e1776d874fda3baea700956723c4fb5d	94ab87f45bd859ad38b8dc00072401db9c27b215	2026-08-17T02:15:41.474949+00:00	98.840000%	4544	discard	Reduce feed-forward width from 32 to 24	family: feed-forward width; retained incumbent is 5056 parameters at 99.9800%, a +0.98 percentage-point margin over 99%. Same-family accepted result: none; same-family failed result: none; prior attempts in this family: 0. The latest accepted result is attempt-0002 with d16/h2/L2 and ff32; normalization attempt-0007 reached only 2.6% and is not capacity evidence for this family. Hypothesis: the reversed operand representation supplies the alignment inductive bias, so the two FFNs may be narrowed from 32 to 24 without losing the learned carry transformation, yielding an eligible 4800-parameter model. This is more informative than a large width jump because it tests the nearest untested interpolation from the accepted ff32 boundary with all other mechanisms fixed. Train for 15000 steps with final-checkpoint fallback; retain only official accuracy >=99% and strictly below 5056 parameters.	0	0
attempt-0009	851e9a11e9fd0f8697628890ae3771eb6fdd1bc5	94ab87f45bd859ad38b8dc00072401db9c27b215	2026-08-17T02:26:32.987524+00:00	99.990000%	4544	keep	Retrain ff24 candidate for 30000 steps	family: training control; retained incumbent is 5056 parameters at 99.9800%, a +0.98 percentage-point margin over 99%. Same-family accepted result: none; same-family failed result: none; prior attempts in this family: 0. The latest feed-forward result, attempt-0008, was the same reversed-input d16/h2/L2 ff24 model at 4544 parameters and 98.84% after 15000 steps—near threshold but not qualified. Hypothesis: the near miss may be optimization-limited rather than a representational floor; extending only the training budget to 30000 steps tests that explanation without changing the candidate architecture. This is more informative than immediately narrowing ff again because it separates training insufficiency from capacity loss at the observed boundary. Retain only official accuracy >=99% and strictly below 5056 parameters.	0	0
attempt-0010	417f4856be561d81678c7a1b9616cf07bd72489c	851e9a11e9fd0f8697628890ae3771eb6fdd1bc5	2026-08-17T02:37:02.434624+00:00	99.910000%	4288	keep	Reduce feed-forward width from 24 to 20	family: feed-forward width; retained incumbent is 4544 parameters at 99.9900%, a +0.99 percentage-point margin over 99%. Same-family accepted result: attempt-0002, ff32 at 5056 parameters and 99.98%; same-family failed result: attempt-0008, ff24 at 4544 parameters and 98.84% after 15000 steps; prior attempts in this family: 2. Attempt-0009 accepted the same ff24 candidate at 99.99% only after the training budget was restored to 30000 steps, so the current training control is evidence-backed. Hypothesis: interpolate the capacity boundary with ff20, reducing the model to 4288 parameters while retaining the learned positional and attention organization. This is more informative than jumping to ff16 because it tests the nearest untried width under the now-validated 30000-step condition. Retain only official accuracy >=99% and strictly below 4544 parameters.	0	0
attempt-0011	20ccb2e2153343d894b3b92f08715d947e0348f3	417f4856be561d81678c7a1b9616cf07bd72489c	2026-08-17T02:47:18.665454+00:00	10.220000%	4160	discard	Interpolate feed-forward width at 18	family: feed-forward width; retained incumbent is 4288 parameters at 99.9100%, a +0.91 percentage-point margin over 99%. Same-family accepted results: attempt-0002 ff32 at 5056/99.98% and attempt-0010 ff20 at 4288/99.91%; same-family failed result: attempt-0008 ff24 at 4544/98.84% under 15000 steps; prior attempts in this family: 3. Attempt-0009 showed ff24 reaches 99.99% under 30000 steps, which is the condition used here. Hypothesis: ff18 is the nearest width interpolation below the accepted ff20 boundary, yielding 4160 parameters while preserving the same two-layer attention and learned position mechanisms. This is more informative than jumping to ff16 because it narrows the empirical capacity interval with one controlled width change. Retain only official accuracy >=99% and strictly below 4288 parameters.	0	0
attempt-0012	b8626749334e66a89f43eb6724b25cc81c2a2507	417f4856be561d81678c7a1b9616cf07bd72489c	2026-08-17T02:58:09.586356+00:00	10.200000%	4224	discard	Test single-unit feed-forward width 19	family: feed-forward width; retained incumbent is 4288 parameters at 99.9100%, a +0.91 percentage-point margin over 99%. Same-family accepted results: attempt-0002 ff32 at 5056/99.98% and attempt-0010 ff20 at 4288/99.91%; same-family failed results: attempt-0008 ff24 at 98.84% under 15000 steps and attempt-0011 ff18 at 4160/10.22% under 30000 steps; prior attempts in this family: 4. The 30k ff24 result in attempt-0009 is the validated training condition. Hypothesis: the severe ff18 collapse may occur between widths 18 and 20, so ff19 (4224 parameters) is the most informative single-unit interpolation before testing alternate mechanisms. All other source and training choices remain fixed; retain only official accuracy >=99% and strictly below 4288 parameters.	0	0
attempt-0013	f99d0298baa6529d90a1c8da45eff5175fcc73f1	417f4856be561d81678c7a1b9616cf07bd72489c	2026-08-17T03:09:30.574377+00:00	9.680000%	4234	discard	Factor tied token/output matrix through rank 6	family: token representation; retained incumbent is 4288 parameters at 99.9100%, a +0.91 percentage-point margin over 99%. Same-family accepted result: attempt-0002, which established reversed operand token order with 5056 parameters and 99.98%; same-family failed result: none; prior attempts in this family: 1. The latest feed-forward probes ff19 and ff18 both collapsed near 10%, so this proposal changes mechanism family rather than repeating that width condition. Hypothesis: represent input tokens and tied output logits through a shared rank-6 factorization, reducing the 15-by-16 token matrix from 240 to 15*6 + 6*16 = 186 parameters while preserving a shared input/output representation. The resulting model has 4234 parameters. This is more informative than rank4 as a first test because rank6 is the nearest lower-rank bottleneck and preserves more token information. Keep the accepted reversed preprocessing, ff20, learned positions, and 30000-step training; retain only official accuracy >=99% and strictly below 4288 parameters.	0	0
attempt-0014	5fb3f625146d671bf98b46b3062caa3c677a1a93	417f4856be561d81678c7a1b9616cf07bd72489c	2026-08-17T03:20:34.519849+00:00	0.110000%	4136	discard	Use a rank-8 factorized learned position table	family: position representation; retained incumbent is 4288 parameters at 99.9100%, a +0.91 percentage-point margin over 99%. Same-family accepted result: none; same-family failed result: attempt-0005, the repaired structured-position candidate at 4784 parameters and 8.85%; prior position attempts: 3 (attempts 0003, 0004, 0005, including one implementation repair). Attempt-0003 fixed sinusoidal positions scored 0.01%, so this proposal retains learned position rows instead of using a deterministic basis. Hypothesis: a rank-8 learned table plus d16 projection retains position-specific degrees of freedom while sharing only the feature basis, reducing position parameters from 560 to 35*8 + 8*16 = 408 and total parameters to 4136. This is more informative than repeating segment sharing because each of the 35 positions remains independently addressable. Keep reversed operands, ff20, and 30000-step training; retain only official accuracy >=99% and strictly below 4288 parameters.	0	0
attempt-0015	fe2361500f0474ac230e5d5326e3fda99788c78d	417f4856be561d81678c7a1b9616cf07bd72489c	2026-08-17T03:31:47.130171+00:00	99.950000%	3776	keep	Share K/V projection across two attention heads	family: attention organization; retained incumbent is 4288 parameters at 99.9100%, a +0.91 percentage-point margin over 99%. Same-family accepted result: none; same-family failed result: none; prior attempts in this family: 0. The latest position-representation probes 0005 and 0014 scored 8.85% and 0.11%, so this proposal changes the attention mechanism rather than revisiting position compression. Hypothesis: two query subspaces can attend through shared keys and values, preserving two attention heads while replacing the per-head-expanded qkv projection with a d-by-d query plus d-by-d_head shared K/V projection; at d16,h2 this removes 256 parameters per block and yields 3776 total parameters. This is more informative than a one-head deletion because it isolates K/V sharing while retaining independent queries and the same causal attention depth. Keep learned positions, reversed operands, ff20, and 30000-step training; retain only official accuracy >=99% and strictly below 4288 parameters.	0	0
attempt-0016	3eb3e9bbb1725e9b2bab0992b646a6f311fdac61	fe2361500f0474ac230e5d5326e3fda99788c78d	2026-08-17T03:42:30.715734+00:00	0.020000%	3520	discard	Share query projection across two MQA heads	family: attention organization; retained incumbent is 3776 parameters at 99.9500%, a +0.95 percentage-point margin over 99%. Same-family accepted result: attempt-0015, multi-query shared K/V at 3776/99.95%; same-family failed result: none; prior attempts in this family: 1. Hypothesis: after K/V sharing succeeded, a shared query vector expanded across the two head slots may preserve the useful attention pattern while removing 128 query parameters per block, yielding 3520 parameters. This is more informative than deleting a head because it retains two-head tensor computation and changes only query sharing relative to the accepted MQA candidate. Keep learned positions, reversed operands, ff20, and 30000-step training; retain only official accuracy >=99% and strictly below 3776 parameters.	0	0
attempt-0017	51477a7be2a116eb30b152cf42ca507fa8740ef6	fe2361500f0474ac230e5d5326e3fda99788c78d	2026-08-17T03:54:51.211040+00:00	0.000000%	3520	discard	Factor attention output projection through rank 4	family: attention organization; retained incumbent is 3776 parameters at 99.9500%, a +0.95 percentage-point margin over 99%. Same-family accepted result: attempt-0015, shared K/V attention at 3776/99.95%; same-family failed result: attempt-0016, shared Q plus K/V at 3520/0.02%; prior attempts in this family: 2. Hypothesis: retain distinct queries and shared K/V from the accepted MQA model, but factor each post-attention output projection as d16->4->d16, reducing 256 full-rank parameters to 128 per block and yielding 3520 parameters. This is more informative than repeating query sharing because it preserves head-specific attention scores and tests a different low-rank location. Keep learned positions, reversed operands, ff20, and 30000-step training; retain only official accuracy >=99% and strictly below 3776 parameters.	0	0
attempt-0018	0f046ef2bfcd95bbdc5e8cb9b1318004e5149e9b	fe2361500f0474ac230e5d5326e3fda99788c78d	2026-08-17T04:06:39.851706+00:00	0.010000%	3648	discard	Use rank 6 for factorized attention output projection	family: attention organization; retained incumbent is 3776 parameters at 99.9500%, a +0.95 percentage-point margin over 99%. Same-family accepted result: attempt-0015, shared K/V at 3776/99.95%; same-family failed result: attempt-0017, rank-4 output projection at 3520/0.0% (and attempt-0016 shared-query MQA at 0.02%); prior attempts in this family: 3. Hypothesis revision: rank4 may have crossed the usable post-attention mixing threshold, so retain distinct queries and shared K/V while using a less aggressive rank-6 output factorization, saving 64 parameters per block for 3648 total. This is more informative than repeating rank4 because it changes the tested capacity boundary while preserving the accepted attention score organization. Keep learned positions, reversed operands, ff20, and 30000-step training; retain only official accuracy >=99% and strictly below 3776 parameters.	0	0
attempt-0019	c1e3d8e8f01741182fa607fc590ab42cfee9ff94	fe2361500f0474ac230e5d5326e3fda99788c78d	2026-08-17T04:18:57.785764+00:00	99.960000%	3712	keep	Test MQA with feed-forward width 19	family: feed-forward width; retained incumbent is 3776 parameters at 99.9500%, a +0.95 percentage-point margin over 99%. Same-family accepted result: attempt-0010, standard-attention ff20 at 4288/99.91%; same-family failed result: attempt-0012, standard-attention ff19 at 4224/10.20% (with attempt-0011 ff18 at 10.22%); prior attempts in this family: 5. The accepted attempt-0015 changed attention to MQA and reached 3776/99.95%, so this proposal tests ff19 specifically in that improved attention context. Hypothesis: MQA's shared K/V organization may free optimization capacity that allows one narrower FF layer, producing 3712 parameters while retaining full-rank attention output mixing. This is more informative than jumping to ff18 because it isolates the nearest width change after the attention substitution. Keep learned positions, reversed operands, and 30000-step training; retain only official accuracy >=99% and strictly below 3776 parameters.	0	0
