attempt_id	commit	parent_commit	timestamp_utc	accuracy	parameters	status	description	proposal	train_exit	verify_exit
attempt-0053	3be8ad99ec451e5d73392c1ea9582e2605fc918a	a3adffc7be1254323fe6d42c6dc751fb5f809d5c	2026-08-17T10:35:02.346423+00:00	95.640000%	2870	discard	Repair PAD-row table construction for MPS and rerun	family: token representation; implementation repair for attempt-0052: the candidate's train log failed before optimization because MPS does not implement index_copy when materializing the fixed PAD row. Current retained incumbent is 2884 parameters at 99.9900%, a +0.99 percentage-point margin over 99%. Same-family accepted result: attempt-0002, reversed operand token order at 5056/99.98%; same-family failed result: attempt-0052, the intended PAD-row compression at 2870 parameters with train_exit 1 from the MPS index_copy error; prior attempts in this family: 4. Rebuild the identical 14-trainable-row plus fixed-zero-PAD table using torch.cat, with no architecture or acceptance-rule change. This repair is more informative than switching to fixing an active BOS/EOS row because it resolves a reproducible infrastructure/implementation incompatibility while preserving the exact unused-row hypothesis; the nearest untested alternative remains fixing another active token, which would change the tested representation. Keep d14/h2/L2, MQA, independent head-local maps, ff23, rank8 positions, affine-free block pre-norms, final learned scale without bias, reversed operands, zero weight decay, mixed-digit curriculum, and 30000 steps; retain only official accuracy >=99% and strictly below 2884 parameters.	0	0
attempt-0054	f9ad44afe2808c1554fb6f756c70279cea5349ca	a3adffc7be1254323fe6d42c6dc751fb5f809d5c	2026-08-17T10:45:41.691242+00:00	0.030000%	2870	discard	Tie the unused PAD row to digit zero	family: token representation; current retained incumbent is 2884 parameters at 99.9900%, a +0.99 percentage-point margin over 99%. Same-family accepted result: attempt-0002, reversed operand token order at 5056/99.98%; same-family failed result: attempt-0053, the repaired 14-row plus zero-PAD table at 2870/95.64% (attempt-0052 was its MPS implementation error); prior attempts in this family: 5. Hypothesis: zeroing PAD changed output calibration even though PAD is unused, so retain a learned PAD logit by tying its row to the digit-zero vector while still removing one independent row. The materialized tied table remains 15-way and saves 14 parameters for 2870 total. This is more informative than fixing BOS or EOS because it preserves a learned competing PAD direction without altering active control tokens; the nearest untested alternative is tying PAD to EOS, which would couple an unused output to the active stopping symbol. Keep d14/h2/L2, MQA, independent head-local maps, ff23, rank8 positions, affine-free block pre-norms, final learned scale without bias, reversed operands, zero weight decay, mixed-digit curriculum, and 30000 steps; retain only official accuracy >=99% and strictly below 2884 parameters.	0	0
attempt-0055	d98b86bcf32d38205f4f97d11f101ab371ac46bb	a3adffc7be1254323fe6d42c6dc751fb5f809d5c	2026-08-17T10:56:10.381282+00:00	96.170000%	2828	discard	Retest d14 ff22 with rank8 positions and zero decay	family: feed-forward width; current retained incumbent is 2884 parameters at 99.9900%, a +0.99 percentage-point margin over 99%. Same-family accepted result: attempt-0044, d14/ff23 at 2982/99.97% under standard decay; same-family failed result: attempt-0045, d14/ff22 at 2926/9.79% under standard decay; prior attempts in this family: 13. The later rank9-to-rank8 positional trials showed that removing AdamW weight decay can turn a near miss into 99.99–100%, so retest the same ff22 width with the retained rank8 positional factor and weight_decay=0.0, yielding 2828 parameters. This is more informative than moving to ff21 because it isolates the newly identified training-control variable at the nearest failed FF boundary; the nearest untested alternative is a larger optimizer change that would confound width and regularization. Keep d14/h2/L2, MQA, independent head-local maps, rank8 positions, affine-free block pre-norms, final learned scale without bias, reversed operands, mixed-digit curriculum, and 30000 steps; retain only official accuracy >=99% and strictly below 2884 parameters.	0	0
attempt-0056	35017ecb3abb7522b5caeecdc8b511ddadcfd98a	a3adffc7be1254323fe6d42c6dc751fb5f809d5c	2026-08-17T11:06:50.764400+00:00	5.470000%	2871	discard	Tie final LayerNorm scale to one global scalar	family: normalization; current retained incumbent is 2884 parameters at 99.9900%, a +0.99 percentage-point margin over 99%. Same-family accepted result: attempt-0038, removing only final LayerNorm bias at 3120/99.92%; same-family failed result: attempt-0039, removing the remaining final scale entirely at 3104/90.81%; prior attempts in this family: 7. Hypothesis: the final scale vector is necessary but may not need 14 independent coordinates. Retain final normalization and replace its learned 14-element scale with one learned scalar broadcast over channels, saving 13 parameters for 2871 total. This is more informative than deleting the scale because it preserves global output calibration while isolating per-channel calibration; the nearest untested alternative is a fixed scale, which repeats the known scale-removal failure. Keep d14/h2/L2, MQA, independent head-local maps, ff23, rank8 positions, affine-free block pre-norms, reversed operands, zero weight decay, mixed-digit curriculum, and 30000 steps; retain only official accuracy >=99% and strictly below 2884 parameters.	0	0
attempt-0057	a7ee0f8df5f3b13d0f78fad8b3e452853c830b17	a3adffc7be1254323fe6d42c6dc751fb5f809d5c	2026-08-17T11:17:57.384959+00:00	0.010000%	2688	discard	Make Q projections block-diagonal by head	family: attention organization; current retained incumbent is 2884 parameters at 99.9900%, a +0.99 percentage-point margin over 99%. Same-family accepted result: attempt-0043, d14/h2 with MQA and independent head-local output maps at 3038/99.91%; same-family failed result: attempt-0047, d12/h2 with wider ff33 at 2916/10.34% (the Q/KV tie in attempt-0042 was 10.29%); prior attempts in this family: 11. Hypothesis: the successful per-head output maps show that cross-head mixing can be removed after attention, while the Q projection remains a full 14x14 map. Replace it with two independent 7x7 head-local Q maps, retain full shared K/V mixing and all FF connectivity, saving 196 parameters for 2688 total. This is more informative than tying Q to K/V because it leaves K/V full and isolates only cross-head query mixing; the nearest untested alternative is block-diagonal K/V, which would simultaneously constrain the shared content path. Keep rank8 positions, d14/h2/L2, ff23, affine-free block pre-norms, final learned scale without bias, reversed operands, zero weight decay, mixed-digit curriculum, and 30000 steps; retain only official accuracy >=99% and strictly below 2884 parameters.	0	0
attempt-0058	830391ebe220b69b896734b5c261580a3de18fe1	a3adffc7be1254323fe6d42c6dc751fb5f809d5c	2026-08-17T11:29:53.072321+00:00	100.000000%	2856	keep	Tie one FF hidden unit's input and output weights	family: parameter tying; current retained incumbent is 2884 parameters at 99.9900%, a +0.99 percentage-point margin over 99%. Same-family accepted result: none; same-family failed result: attempt-0041, sharing the complete FF output projection across blocks at 2864/10.19% (with attempt-0040 sharing the input projection at 7.83%); prior attempts in this family: 5. Hypothesis: full inter-layer ties are too disruptive, so preserve all 23 hidden units and all cross-head connectivity while tieing only one hidden unit's d14 input row to its d14 output column within each block. This removes 14 parameters per block, yielding 2856 total. This is more informative than reducing ff23 to ff22 because it keeps the nonlinear width and tests a localized redundancy; the nearest untested alternative is tying multiple hidden units, which would skip the one-unit boundary. Keep d14/h2/L2, MQA, independent head-local maps, rank8 positions, affine-free block pre-norms, final learned scale without bias, reversed operands, zero weight decay, mixed-digit curriculum, and 30000 steps; retain only official accuracy >=99% and strictly below 2884 parameters.	0	0
attempt-0059	94f3b17653776b5f409fd3243f69dca811d74adc	830391ebe220b69b896734b5c261580a3de18fe1	2026-08-17T11:42:22.180272+00:00	30.730000%	2828	discard	Tie two FF hidden units input/output weights within each block	family: parameter tying; current retained incumbent is 2856 parameters at 100.0000%, a +1.00 percentage-point margin over 99%. Same-family accepted result: attempt-0058, tying one FF hidden unit input/output weights within each block at 2856/100.00%; same-family failed result: attempt-0041, sharing the complete FF output projection across blocks at 2864/10.19% (attempt-0040 shared the input projection at 2864/7.83%). Prior attempts in this family: 6. Hypothesis: extend the directly successful localized tie by one additional hidden unit, preserving all 23 hidden activations and all cross-head connectivity while tying two hidden units input/output weights within each block. This removes 28 parameters per block and targets 2828 total. This is more informative than the nearest untested alternative of tying three units because it measures the next incremental redundancy boundary after the accepted one-unit result; it also preserves the same initialization and optimization conditions for a clean local comparison. Keep d14/h2/L2, MQA, independent head-local maps, rank8 positions, affine-free block pre-norms, final learned scale without bias, reversed operands, zero weight decay, mixed-digit curriculum, and 30000 steps; retain only official accuracy >=99% and strictly below 2856 parameters.	0	0
attempt-0060	807f9500bc49fd8ae49f3a889a812d8aefcd690d	830391ebe220b69b896734b5c261580a3de18fe1	2026-08-17T11:53:58.484722+00:00	100.000000%	2844	keep	Use two learned final LayerNorm group scales	family: normalization; current retained incumbent is 2856 parameters at 100.0000%, a +1.00 percentage-point margin over 99%. Same-family accepted result: attempt-0038, removing only the final LayerNorm bias at 3120/99.92%; same-family failed result: attempt-0056, replacing the 14-element final scale with one global scalar at 2871/5.47%. Prior attempts in this family: 8. Hypothesis: preserve full final LayerNorm normalization and retain channel-group calibration, but replace its 14 independent scale values with two learned scalars broadcast over the two 7-channel attention-head groups. This saves 12 parameters for a target of 2844 while providing more calibration capacity than the known one-scalar failure. This is more informative than retrying a global scalar or deleting scale, because it tests the nearest intermediate granularity and aligns the groups with the retained head-local attention organization. Keep d14/h2/L2, MQA, independent head-local maps, ff23 with one tied hidden unit per block, rank8 positions, affine-free block pre-norms, reversed operands, zero weight decay, mixed-digit curriculum, and 30000 steps; retain only official accuracy >=99% and strictly below 2856 parameters.	0	0
attempt-0061	6ea4c951955b7a3e6d341f2141f0839f26e3f436	807f9500bc49fd8ae49f3a889a812d8aefcd690d	2026-08-17T12:05:15.184097+00:00	10.510000%	2843	discard	Collapse final LayerNorm group scales to one scalar	family: normalization; current retained incumbent is 2844 parameters at 100.0000%, a +1.00 percentage-point margin over 99%. Same-family accepted result: attempt-0060, two learned final LayerNorm group scales at 2844/100.00%; same-family failed result: attempt-0056, one global final LayerNorm scale from the pre-tying incumbent at 2871/5.47%. Prior attempts in this family: 9. Hypothesis: the accepted two-group scale retains more calibration capacity than needed, so test the immediate one-scalar boundary while preserving the complete final normalization and all other retained reductions. This targets 2843 parameters. This is more informative than deleting the final scale or making another large architectural change because it isolates whether the second group scalar is necessary, directly bracketing the newly accepted two-group result; the earlier scalar failure is a prior warning but was measured before the successful FF tie and grouped-scale context. Keep d14/h2/L2, MQA, independent head-local maps, ff23 with one tied hidden unit per block, rank8 positions, affine-free block pre-norms, reversed operands, zero weight decay, mixed-digit curriculum, and 30000 steps; retain only official accuracy >=99% and strictly below 2844 parameters.	0	0
attempt-0062	a23edcb008bf1a0ce799cd4d003d8500ae866864	807f9500bc49fd8ae49f3a889a812d8aefcd690d	2026-08-17T12:17:34.257395+00:00	99.980000%	2830	keep	Share the tied FF hidden-unit vector across blocks	family: parameter tying; current retained incumbent is 2844 parameters at 100.0000%, a +1.00 percentage-point margin over 99%. Same-family accepted result: attempt-0058, tying one hidden unit input/output within each block at 2856/100.00%; same-family failed result: attempt-0059, tying two hidden units within each block at 2828/30.73%. Prior attempts in this family: 7. Hypothesis: the accepted local tie identifies a redundant hidden-unit vector, so share only that tied unit input/output vector across the two depth blocks while keeping each block’s 22 free hidden units and all output projections independent. This saves 14 parameters for a target of 2830. This is more informative than sharing a complete FF input/output projection, which failed at 7.83–10.19%, because it isolates the smallest cross-block dependency around the already validated tied unit; the nearest alternative is sharing a free hidden unit, which would change a nonlinear feature rather than the validated tied path. Keep d14/h2/L2, MQA, independent head-local maps, ff23 with one tied hidden unit per block, two final LayerNorm group scales, rank8 positions, affine-free block pre-norms, reversed operands, zero weight decay, mixed-digit curriculum, and 30000 steps; retain only official accuracy >=99% and strictly below 2844 parameters.	0	0
attempt-0063	8bdd426d45e875f73c7a19d4e9f11a05ca71397c	a23edcb008bf1a0ce799cd4d003d8500ae866864	2026-08-17T12:29:20.423271+00:00	0.490000%	2816	discard	Share one free FF input vector across blocks	family: parameter tying; current retained incumbent is 2830 parameters at 99.9800%, a +0.98 percentage-point margin over 99%. Same-family accepted result: attempt-0062, sharing the already tied FF hidden-unit vector across blocks at 2830/99.98%; same-family failed result: attempt-0059, tying two hidden units input/output within each block at 2828/30.73%. Prior attempts in this family: 8. Hypothesis: one cross-block tied hidden vector is viable, so share only one additional free hidden unit input vector across the two blocks while retaining independent output columns and all other free units. This removes 14 parameters for a target of 2816. This is more informative than sharing a full FF input projection, which failed at 7.83%, because it isolates a single non-tied input row and leaves the corresponding nonlinear output weights block-specific; the nearest alternative is sharing the output column too, which would confound two small ties at once. Keep d14/h2/L2, MQA, independent head-local maps, ff23 with one within-block tied unit and one cross-block shared free input, two final LayerNorm group scales, rank8 positions, affine-free block pre-norms, reversed operands, zero weight decay, mixed-digit curriculum, and 30000 steps; retain only official accuracy >=99% and strictly below 2830 parameters.	0	0
attempt-0064	5a62431f95c1f7116561b656d0f7a6ca1b27d43c	a23edcb008bf1a0ce799cd4d003d8500ae866864	2026-08-17T12:41:22.633840+00:00	95.960000%	2816	discard	Share one free FF output vector across blocks	family: parameter tying; current retained incumbent is 2830 parameters at 99.9800%, a +0.98 percentage-point margin over 99%. Same-family accepted result: attempt-0062, sharing the already tied FF hidden-unit vector across blocks at 2830/99.98%; same-family failed result: attempt-0063, sharing one free FF input vector across blocks at 2816/0.49%. Prior attempts in this family: 9. Hypothesis: the failed one-sided input tie may be specific to depth-varying feature extraction, so share only one free hidden unit output column across blocks while retaining independent input projections and all other outputs. This saves 14 parameters for a target of 2816. This is more informative than repeating the input tie or tying both sides because it is the complementary one-sided test and isolates whether output mixing is more redundant than input feature detection; the nearest alternative is a larger full-projection tie already shown to fail. Keep d14/h2/L2, MQA, independent head-local maps, ff23 with one within-block tied unit and one cross-block shared free output, two final LayerNorm group scales, rank8 positions, affine-free block pre-norms, reversed operands, zero weight decay, mixed-digit curriculum, and 30000 steps; retain only official accuracy >=99% and strictly below 2830 parameters.	0	0
attempt-0065	448609fd45e517302b05117555b666e6aac0761b	a23edcb008bf1a0ce799cd4d003d8500ae866864	2026-08-17T12:59:46.820787+00:00	0.020000%	2816	discard	Train the free FF output-tie near miss for 50000 steps	family: training control; current retained incumbent is 2830 parameters at 99.9800%, a +0.98 percentage-point margin over 99%. Same-family accepted result: attempt-0049, rank9 positional factor retrained with zero weight decay at 2933/100.00%; same-family failed result: attempt-0023, full-digit-only training control at 3520/0.03%. Prior attempts in this family: 3. Hypothesis: attempt-0064 reached 95.96% at 2816 parameters with the exact output-only FF tie but only 30000 steps, so retain that architecture and extend optimization to 50000 steps to test whether the near miss is convergence-limited. This target remains 2816 parameters. This is more informative than changing learning rate or architecture simultaneously because it isolates additional optimization time after a measured near miss; the nearest untested alternative is a larger learning-rate change that would confound convergence and stability. Keep d14/h2/L2, MQA, independent head-local maps, ff23 with one within-block tied unit and one cross-block shared free output, two final LayerNorm group scales, rank8 positions, affine-free block pre-norms, reversed operands, zero weight decay, mixed-digit curriculum, and retain only official accuracy >=99% and strictly below 2830 parameters.	0	0
attempt-0066	74d31740304d396160a6393d7653db2132bfd1f9	a23edcb008bf1a0ce799cd4d003d8500ae866864	2026-08-17T13:17:33.644120+00:00	100.000000%	2781	keep	Share one head-local attention output map across depth blocks	family: attention organization; current retained incumbent is 2830 parameters at 99.9800%, a +0.98 percentage-point margin over 99%. Same-family most recent accepted result: attempt-0043, MQA with independent head-local output maps at 3038 parameters and 99.91%; same-family most recent failed result: attempt-0057, block-diagonal Q projections at 2688 parameters and 0.01%; prior attempts in this family: 12. Hypothesis: the accepted head-local output organization suggests that one output map may be redundant across depth, so share only head 0's 7x7 post-attention output map between the two blocks while keeping both causal self-attention applications, both Q/KV projections, and head 1's map independent. This removes 49 parameters for a target of 2781. It is more informative than the nearest untested cross-layer Q or KV tie because it isolates redundancy in the already head-local post-attention path without constraining attention scores or values. Keep the retained d14/h2/L2 MQA, ff23 with one within-block tied hidden unit shared across blocks, rank8 positions, two final group scales, reversed operands, zero weight decay, mixed-digit curriculum, and 30000 steps; retain only official accuracy at least 99% and strictly fewer parameters than the incumbent.	0	0
attempt-0067	9dcd1c366e35321820994a5eaa585eb51b633aa2	74d31740304d396160a6393d7653db2132bfd1f9	2026-08-17T13:29:06.464013+00:00	9.420000%	2732	discard	Share both head-local attention output maps across depth blocks	family: attention organization; current retained incumbent is 2781 parameters at 100.0000%, a +1.00 percentage-point margin over 99%. Same-family most recent accepted result: attempt-0066, sharing head 0's 7x7 attention output map across the two blocks at 2781 parameters and 100.00%; same-family most recent failed result: attempt-0057, block-diagonal Q projections at 2688 parameters and 0.01%; prior attempts in this family: 13. Hypothesis: because one cross-depth head-local output tie is fully qualified, share the complementary head 1 output map across both blocks while preserving both causal attention applications, all Q/KV projections, and the two distinct head-local maps as a pair. This removes the second 49-parameter map for a target of 2732. It is more informative than the nearest untested cross-layer Q or KV tie because it completes the already accepted output-map interpolation and isolates whether both heads can use depth-shared output coordinates before constraining attention-score formation. Keep d14/h2/L2 MQA, ff23 with one within-block tied hidden unit shared across blocks, rank8 positions, two final group scales, reversed operands, zero weight decay, mixed-digit curriculum, and 30000 steps; retain only official accuracy at least 99% and strictly fewer parameters than the incumbent.	0	0
