macro_attempt_id	automation_id	micro_attempt_id	commit	parent_commit	timestamp_utc	family	accuracy	parameters	status	description	proposal	train_exit	verify_exit
attempt-0078	nearest-position-unions-infra-repair	micro-0032	71469643084950c667476cf1090abc3388f42427	062e715f4d4c8a29612b2e6d10449c001e7af16d	2026-08-16T21:30:19.163652+00:00	parameter tying	99.030000%	2053	keep	Union closest position groups 65 and 399	Family: parameter tying. Current retained frontier is 2,054 parameters at 99.030000%, a +0.030000 percentage-point margin over 99%. There have been 20 prior macro-attempts in this family and 52 prior micro-trials. The most recent accepted result is attempt-0078/micro-0031 at 2054 parameters and 99.030000%; the most recent failed result is attempt-0075/micro-0001 (error, no score). This is a parameterization-preserving compression: union current position groups represented by coordinates 65 and 399, whose learned values are 0.0027315114 and 0.0027576096 (absolute difference 2.610e-05), using a multiplicity-weighted mean. Hypothesis: this preserves qualification and yields 2,053 parameters. It is more informative than the nearest untested alternative (difference 2.672e-05) because it is the minimum-distortion eligible union; exact pairs already rejected under the unchanged grouping are excluded. Acceptance and rollback remain solely governed by the official runner.	0	0
attempt-0078	nearest-position-unions-infra-repair	micro-0033	10c89543de4aa507cf9702fab2384603359d3747	71469643084950c667476cf1090abc3388f42427	2026-08-16T21:31:22.861734+00:00	parameter tying	99.030000%	2052	keep	Union closest position groups 266 and 375	Family: parameter tying. Current retained frontier is 2,053 parameters at 99.030000%, a +0.030000 percentage-point margin over 99%. There have been 20 prior macro-attempts in this family and 53 prior micro-trials. The most recent accepted result is attempt-0078/micro-0032 at 2053 parameters and 99.030000%; the most recent failed result is attempt-0075/micro-0001 (error, no score). This is a parameterization-preserving compression: union current position groups represented by coordinates 266 and 375, whose learned values are 0.0181030594 and 0.0181297828 (absolute difference 2.672e-05), using a multiplicity-weighted mean. Hypothesis: this preserves qualification and yields 2,052 parameters. It is more informative than the nearest untested alternative (difference 2.722e-05) because it is the minimum-distortion eligible union; exact pairs already rejected under the unchanged grouping are excluded. Acceptance and rollback remain solely governed by the official runner.	0	0
attempt-0078	nearest-position-unions-infra-repair	micro-0034	4426aa2cb3600386faaad1d3dff0993183940f80	10c89543de4aa507cf9702fab2384603359d3747	2026-08-16T21:32:25.380275+00:00	parameter tying	99.030000%	2051	keep	Union closest position groups 104 and 175	Family: parameter tying. Current retained frontier is 2,052 parameters at 99.030000%, a +0.030000 percentage-point margin over 99%. There have been 20 prior macro-attempts in this family and 54 prior micro-trials. The most recent accepted result is attempt-0078/micro-0033 at 2052 parameters and 99.030000%; the most recent failed result is attempt-0075/micro-0001 (error, no score). This is a parameterization-preserving compression: union current position groups represented by coordinates 104 and 175, whose learned values are -0.0038205665 and -0.0037933418 (absolute difference 2.722e-05), using a multiplicity-weighted mean. Hypothesis: this preserves qualification and yields 2,051 parameters. It is more informative than the nearest untested alternative (difference 2.723e-05) because it is the minimum-distortion eligible union; exact pairs already rejected under the unchanged grouping are excluded. Acceptance and rollback remain solely governed by the official runner.	0	0
attempt-0078	nearest-position-unions-infra-repair	micro-0035	12398914963b394cbb2fe58fcc07f1fda905f06b	4426aa2cb3600386faaad1d3dff0993183940f80	2026-08-16T21:33:28.767920+00:00	parameter tying	99.040000%	2050	keep	Union closest position groups 298 and 494	Family: parameter tying. Current retained frontier is 2,051 parameters at 99.030000%, a +0.030000 percentage-point margin over 99%. There have been 20 prior macro-attempts in this family and 55 prior micro-trials. The most recent accepted result is attempt-0078/micro-0034 at 2051 parameters and 99.030000%; the most recent failed result is attempt-0075/micro-0001 (error, no score). This is a parameterization-preserving compression: union current position groups represented by coordinates 298 and 494, whose learned values are 0.0117288586 and 0.0117560923 (absolute difference 2.723e-05), using a multiplicity-weighted mean. Hypothesis: this preserves qualification and yields 2,050 parameters. It is more informative than the nearest untested alternative (difference 2.781e-05) because it is the minimum-distortion eligible union; exact pairs already rejected under the unchanged grouping are excluded. Acceptance and rollback remain solely governed by the official runner.	0	0
attempt-0078	nearest-position-unions-infra-repair	micro-0036	2b397837b695b415aed2ed973f4c7e3766ed653c	12398914963b394cbb2fe58fcc07f1fda905f06b	2026-08-16T21:34:32.135814+00:00	parameter tying	99.030000%	2049	keep	Union closest position groups 280 and 72	Family: parameter tying. Current retained frontier is 2,050 parameters at 99.040000%, a +0.040000 percentage-point margin over 99%. There have been 20 prior macro-attempts in this family and 56 prior micro-trials. The most recent accepted result is attempt-0078/micro-0035 at 2050 parameters and 99.040000%; the most recent failed result is attempt-0075/micro-0001 (error, no score). This is a parameterization-preserving compression: union current position groups represented by coordinates 280 and 72, whose learned values are -0.0102292011 and -0.0102013918 (absolute difference 2.781e-05), using a multiplicity-weighted mean. Hypothesis: this preserves qualification and yields 2,049 parameters. It is more informative than the nearest untested alternative (difference 2.833e-05) because it is the minimum-distortion eligible union; exact pairs already rejected under the unchanged grouping are excluded. Acceptance and rollback remain solely governed by the official runner.	0	0
attempt-0078	nearest-position-unions-infra-repair	micro-0037	adbea502f36cf368360d78a94b5bb05f67821c6d	2b397837b695b415aed2ed973f4c7e3766ed653c	2026-08-16T21:35:34.347406+00:00	parameter tying	99.030000%	2048	keep	Union closest position groups 447 and 37	Family: parameter tying. Current retained frontier is 2,049 parameters at 99.030000%, a +0.030000 percentage-point margin over 99%. There have been 20 prior macro-attempts in this family and 57 prior micro-trials. The most recent accepted result is attempt-0078/micro-0036 at 2049 parameters and 99.030000%; the most recent failed result is attempt-0075/micro-0001 (error, no score). This is a parameterization-preserving compression: union current position groups represented by coordinates 447 and 37, whose learned values are -0.0080316989 and -0.0080033690 (absolute difference 2.833e-05), using a multiplicity-weighted mean. Hypothesis: this preserves qualification and yields 2,048 parameters. It is more informative than the nearest untested alternative (difference 2.850e-05) because it is the minimum-distortion eligible union; exact pairs already rejected under the unchanged grouping are excluded. Acceptance and rollback remain solely governed by the official runner.	0	0
attempt-0078	nearest-position-unions-infra-repair	micro-0038	2901bf7cd171d0308d4c62098bfdbe8fe2ce3e12	adbea502f36cf368360d78a94b5bb05f67821c6d	2026-08-16T21:36:37.275112+00:00	parameter tying	99.040000%	2047	keep	Union closest position groups 62 and 247	Family: parameter tying. Current retained frontier is 2,048 parameters at 99.030000%, a +0.030000 percentage-point margin over 99%. There have been 20 prior macro-attempts in this family and 58 prior micro-trials. The most recent accepted result is attempt-0078/micro-0037 at 2048 parameters and 99.030000%; the most recent failed result is attempt-0075/micro-0001 (error, no score). This is a parameterization-preserving compression: union current position groups represented by coordinates 62 and 247, whose learned values are 0.0153121371 and 0.0153406421 (absolute difference 2.850e-05), using a multiplicity-weighted mean. Hypothesis: this preserves qualification and yields 2,047 parameters. It is more informative than the nearest untested alternative (difference 2.862e-05) because it is the minimum-distortion eligible union; exact pairs already rejected under the unchanged grouping are excluded. Acceptance and rollback remain solely governed by the official runner.	0	0
attempt-0078	nearest-position-unions-infra-repair	micro-0039	9ce03c65b377b9fb49947f4c2f901ea06c345a4a	2901bf7cd171d0308d4c62098bfdbe8fe2ce3e12	2026-08-16T21:37:39.543554+00:00	parameter tying	99.040000%	2046	keep	Union closest position groups 478 and 264	Family: parameter tying. Current retained frontier is 2,047 parameters at 99.040000%, a +0.040000 percentage-point margin over 99%. There have been 20 prior macro-attempts in this family and 59 prior micro-trials. The most recent accepted result is attempt-0078/micro-0038 at 2047 parameters and 99.040000%; the most recent failed result is attempt-0075/micro-0001 (error, no score). This is a parameterization-preserving compression: union current position groups represented by coordinates 478 and 264, whose learned values are 0.0086001214 and 0.0086287428 (absolute difference 2.862e-05), using a multiplicity-weighted mean. Hypothesis: this preserves qualification and yields 2,046 parameters. It is more informative than the nearest untested alternative (difference 3.049e-05) because it is the minimum-distortion eligible union; exact pairs already rejected under the unchanged grouping are excluded. Acceptance and rollback remain solely governed by the official runner.	0	0
attempt-0078	nearest-position-unions-infra-repair	micro-0040	3e7c372965464e1b61c6db136a73c6501bae79ed	9ce03c65b377b9fb49947f4c2f901ea06c345a4a	2026-08-16T21:38:40.904951+00:00	parameter tying	99.040000%	2045	keep	Union closest position groups 436 and 16	Family: parameter tying. Current retained frontier is 2,046 parameters at 99.040000%, a +0.040000 percentage-point margin over 99%. There have been 20 prior macro-attempts in this family and 60 prior micro-trials. The most recent accepted result is attempt-0078/micro-0039 at 2046 parameters and 99.040000%; the most recent failed result is attempt-0075/micro-0001 (error, no score). This is a parameterization-preserving compression: union current position groups represented by coordinates 436 and 16, whose learned values are 0.0330760553 and 0.0331065468 (absolute difference 3.049e-05), using a multiplicity-weighted mean. Hypothesis: this preserves qualification and yields 2,045 parameters. It is more informative than the nearest untested alternative (difference 3.255e-05) because it is the minimum-distortion eligible union; exact pairs already rejected under the unchanged grouping are excluded. Acceptance and rollback remain solely governed by the official runner.	0	0
attempt-0078	nearest-position-unions-infra-repair	micro-0041	701a9b481a067467340096caa9c2851681e3dff3	3e7c372965464e1b61c6db136a73c6501bae79ed	2026-08-16T21:39:43.128583+00:00	parameter tying	99.040000%	2044	keep	Union closest position groups 152 and 366	Family: parameter tying. Current retained frontier is 2,045 parameters at 99.040000%, a +0.040000 percentage-point margin over 99%. There have been 20 prior macro-attempts in this family and 61 prior micro-trials. The most recent accepted result is attempt-0078/micro-0040 at 2045 parameters and 99.040000%; the most recent failed result is attempt-0075/micro-0001 (error, no score). This is a parameterization-preserving compression: union current position groups represented by coordinates 152 and 366, whose learned values are 0.0197182689 and 0.0197508186 (absolute difference 3.255e-05), using a multiplicity-weighted mean. Hypothesis: this preserves qualification and yields 2,044 parameters. It is more informative than the nearest untested alternative (difference 3.303e-05) because it is the minimum-distortion eligible union; exact pairs already rejected under the unchanged grouping are excluded. Acceptance and rollback remain solely governed by the official runner.	0	0
attempt-0078	nearest-position-unions-infra-repair	micro-0042	d4a389c4999f17db9226b572297fc440032c1f17	701a9b481a067467340096caa9c2851681e3dff3	2026-08-16T21:40:45.797687+00:00	parameter tying	99.050000%	2043	keep	Union closest position groups 154 and 288	Family: parameter tying. Current retained frontier is 2,044 parameters at 99.040000%, a +0.040000 percentage-point margin over 99%. There have been 20 prior macro-attempts in this family and 62 prior micro-trials. The most recent accepted result is attempt-0078/micro-0041 at 2044 parameters and 99.040000%; the most recent failed result is attempt-0075/micro-0001 (error, no score). This is a parameterization-preserving compression: union current position groups represented by coordinates 154 and 288, whose learned values are 0.0038395720 and 0.0038725981 (absolute difference 3.303e-05), using a multiplicity-weighted mean. Hypothesis: this preserves qualification and yields 2,043 parameters. It is more informative than the nearest untested alternative (difference 3.316e-05) because it is the minimum-distortion eligible union; exact pairs already rejected under the unchanged grouping are excluded. Acceptance and rollback remain solely governed by the official runner.	0	0
attempt-0078	nearest-position-unions-infra-repair	micro-0043	b0440b138bbacb61d68b2a311c69b5fc281b0b62	d4a389c4999f17db9226b572297fc440032c1f17	2026-08-16T21:41:50.403657+00:00	parameter tying	99.050000%	2042	keep	Union closest position groups 248 and 118	Family: parameter tying. Current retained frontier is 2,043 parameters at 99.050000%, a +0.050000 percentage-point margin over 99%. There have been 20 prior macro-attempts in this family and 63 prior micro-trials. The most recent accepted result is attempt-0078/micro-0042 at 2043 parameters and 99.050000%; the most recent failed result is attempt-0075/micro-0001 (error, no score). This is a parameterization-preserving compression: union current position groups represented by coordinates 248 and 118, whose learned values are -0.0004757667 and -0.0004426104 (absolute difference 3.316e-05), using a multiplicity-weighted mean. Hypothesis: this preserves qualification and yields 2,042 parameters. It is more informative than the nearest untested alternative (difference 3.341e-05) because it is the minimum-distortion eligible union; exact pairs already rejected under the unchanged grouping are excluded. Acceptance and rollback remain solely governed by the official runner.	0	0
attempt-0078	nearest-position-unions-infra-repair	micro-0044	248878b0d0efe204af2eb72f3a13ce4c954e9b04	b0440b138bbacb61d68b2a311c69b5fc281b0b62	2026-08-16T21:42:53.594522+00:00	parameter tying	99.060000%	2041	keep	Union closest position groups 192 and 63	Family: parameter tying. Current retained frontier is 2,042 parameters at 99.050000%, a +0.050000 percentage-point margin over 99%. There have been 20 prior macro-attempts in this family and 64 prior micro-trials. The most recent accepted result is attempt-0078/micro-0043 at 2042 parameters and 99.050000%; the most recent failed result is attempt-0075/micro-0001 (error, no score). This is a parameterization-preserving compression: union current position groups represented by coordinates 192 and 63, whose learned values are -0.0016857947 and -0.0016523860 (absolute difference 3.341e-05), using a multiplicity-weighted mean. Hypothesis: this preserves qualification and yields 2,041 parameters. It is more informative than the nearest untested alternative (difference 3.489e-05) because it is the minimum-distortion eligible union; exact pairs already rejected under the unchanged grouping are excluded. Acceptance and rollback remain solely governed by the official runner.	0	0
attempt-0078	nearest-position-unions-infra-repair	micro-0045	4a9cc99049ed9abe2c21f90a3935506ec279768c	248878b0d0efe204af2eb72f3a13ce4c954e9b04	2026-08-16T21:43:58.270672+00:00	parameter tying	99.050000%	2040	keep	Union closest position groups 7 and 166	Family: parameter tying. Current retained frontier is 2,041 parameters at 99.060000%, a +0.060000 percentage-point margin over 99%. There have been 20 prior macro-attempts in this family and 65 prior micro-trials. The most recent accepted result is attempt-0078/micro-0044 at 2041 parameters and 99.060000%; the most recent failed result is attempt-0075/micro-0001 (error, no score). This is a parameterization-preserving compression: union current position groups represented by coordinates 7 and 166, whose learned values are 0.0035137255 and 0.0035486163 (absolute difference 3.489e-05), using a multiplicity-weighted mean. Hypothesis: this preserves qualification and yields 2,040 parameters. It is more informative than the nearest untested alternative (difference 3.495e-05) because it is the minimum-distortion eligible union; exact pairs already rejected under the unchanged grouping are excluded. Acceptance and rollback remain solely governed by the official runner.	0	0
attempt-0078	nearest-position-unions-infra-repair	micro-0046	f6849791825c03503b81bda8990a8ce6008dd474	4a9cc99049ed9abe2c21f90a3935506ec279768c	2026-08-16T21:45:01.888019+00:00	parameter tying	99.060000%	2039	keep	Union closest position groups 197 and 398	Family: parameter tying. Current retained frontier is 2,040 parameters at 99.050000%, a +0.050000 percentage-point margin over 99%. There have been 20 prior macro-attempts in this family and 66 prior micro-trials. The most recent accepted result is attempt-0078/micro-0045 at 2040 parameters and 99.050000%; the most recent failed result is attempt-0075/micro-0001 (error, no score). This is a parameterization-preserving compression: union current position groups represented by coordinates 197 and 398, whose learned values are -0.0037308012 and -0.0036958514 (absolute difference 3.495e-05), using a multiplicity-weighted mean. Hypothesis: this preserves qualification and yields 2,039 parameters. It is more informative than the nearest untested alternative (difference 3.505e-05) because it is the minimum-distortion eligible union; exact pairs already rejected under the unchanged grouping are excluded. Acceptance and rollback remain solely governed by the official runner.	0	0
attempt-0078	nearest-position-unions-infra-repair	micro-0047	a484563663f1b72a0c07d64da5586352f65db7af	f6849791825c03503b81bda8990a8ce6008dd474	2026-08-16T21:46:04.168328+00:00	parameter tying	99.060000%	2038	keep	Union closest position groups 112 and 128	Family: parameter tying. Current retained frontier is 2,039 parameters at 99.060000%, a +0.060000 percentage-point margin over 99%. There have been 20 prior macro-attempts in this family and 67 prior micro-trials. The most recent accepted result is attempt-0078/micro-0046 at 2039 parameters and 99.060000%; the most recent failed result is attempt-0075/micro-0001 (error, no score). This is a parameterization-preserving compression: union current position groups represented by coordinates 112 and 128, whose learned values are 0.0059121135 and 0.0059471619 (absolute difference 3.505e-05), using a multiplicity-weighted mean. Hypothesis: this preserves qualification and yields 2,038 parameters. It is more informative than the nearest untested alternative (difference 3.524e-05) because it is the minimum-distortion eligible union; exact pairs already rejected under the unchanged grouping are excluded. Acceptance and rollback remain solely governed by the official runner.	0	0
attempt-0078	nearest-position-unions-infra-repair	micro-0048	0939e059551ad1be3572ffd89b839d3f033407c3	a484563663f1b72a0c07d64da5586352f65db7af	2026-08-16T21:47:06.500269+00:00	parameter tying	99.060000%	2037	keep	Union closest position groups 56 and 126	Family: parameter tying. Current retained frontier is 2,038 parameters at 99.060000%, a +0.060000 percentage-point margin over 99%. There have been 20 prior macro-attempts in this family and 68 prior micro-trials. The most recent accepted result is attempt-0078/micro-0047 at 2038 parameters and 99.060000%; the most recent failed result is attempt-0075/micro-0001 (error, no score). This is a parameterization-preserving compression: union current position groups represented by coordinates 56 and 126, whose learned values are -0.0200093556 and -0.0199741181 (absolute difference 3.524e-05), using a multiplicity-weighted mean. Hypothesis: this preserves qualification and yields 2,037 parameters. It is more informative than the nearest untested alternative (difference 3.527e-05) because it is the minimum-distortion eligible union; exact pairs already rejected under the unchanged grouping are excluded. Acceptance and rollback remain solely governed by the official runner.	0	0
