macro_attempt_id	automation_id	micro_attempt_id	commit	parent_commit	timestamp_utc	family	accuracy	parameters	status	description	proposal	train_exit	verify_exit
attempt-0078	nearest-position-unions-infra-repair	micro-0219	593d6b708f9a88c8d932d46d4e709ed0ac31a61b	64f168e637016b05e9597ff82dae18308bc1760b	2026-08-17T00:57:32.225150+00:00	parameter tying	99.010000%	1866	keep	Union closest position groups 25 and 370	Family: parameter tying. Current retained frontier is 1,867 parameters at 99.010000%, a +0.010000 percentage-point margin over 99%. There have been 20 prior macro-attempts in this family and 239 prior micro-trials. The most recent accepted result is attempt-0078/micro-0218 at 1867 parameters and 99.010000%; the most recent failed result is attempt-0075/micro-0001 (error, no score). This is a parameterization-preserving compression: union current position groups represented by coordinates 25 and 370, whose learned values are -0.0134095075 and -0.0132052824 (absolute difference 2.042e-04), using a multiplicity-weighted mean. Hypothesis: this preserves qualification and yields 1,866 parameters. It is more informative than the nearest untested alternative (difference 2.052e-04) because it is the minimum-distortion eligible union; exact pairs already rejected under the unchanged grouping are excluded. Acceptance and rollback remain solely governed by the official runner.	0	0
attempt-0078	nearest-position-unions-infra-repair	micro-0220	bd39d0998b6606a5207825cade0c93a7cdb30f7a	593d6b708f9a88c8d932d46d4e709ed0ac31a61b	2026-08-17T00:58:35.265932+00:00	parameter tying	99.010000%	1865	keep	Union closest position groups 296 and 185	Family: parameter tying. Current retained frontier is 1,866 parameters at 99.010000%, a +0.010000 percentage-point margin over 99%. There have been 20 prior macro-attempts in this family and 240 prior micro-trials. The most recent accepted result is attempt-0078/micro-0219 at 1866 parameters and 99.010000%; the most recent failed result is attempt-0075/micro-0001 (error, no score). This is a parameterization-preserving compression: union current position groups represented by coordinates 296 and 185, whose learned values are -0.0070916368 and -0.0068864026 (absolute difference 2.052e-04), using a multiplicity-weighted mean. Hypothesis: this preserves qualification and yields 1,865 parameters. It is more informative than the nearest untested alternative (difference 2.052e-04) because it is the minimum-distortion eligible union; exact pairs already rejected under the unchanged grouping are excluded. Acceptance and rollback remain solely governed by the official runner.	0	0
attempt-0078	nearest-position-unions-infra-repair	micro-0221	f2f06c177a113ff5476767669687d574990524aa	bd39d0998b6606a5207825cade0c93a7cdb30f7a	2026-08-17T00:59:37.803755+00:00	parameter tying	99.010000%	1864	keep	Union closest position groups 73 and 167	Family: parameter tying. Current retained frontier is 1,865 parameters at 99.010000%, a +0.010000 percentage-point margin over 99%. There have been 20 prior macro-attempts in this family and 241 prior micro-trials. The most recent accepted result is attempt-0078/micro-0220 at 1865 parameters and 99.010000%; the most recent failed result is attempt-0075/micro-0001 (error, no score). This is a parameterization-preserving compression: union current position groups represented by coordinates 73 and 167, whose learned values are -0.0165747441 and -0.0163694974 (absolute difference 2.052e-04), using a multiplicity-weighted mean. Hypothesis: this preserves qualification and yields 1,864 parameters. It is more informative than the nearest untested alternative (difference 2.084e-04) because it is the minimum-distortion eligible union; exact pairs already rejected under the unchanged grouping are excluded. Acceptance and rollback remain solely governed by the official runner.	0	0
attempt-0078	nearest-position-unions-infra-repair	micro-0222	71bd6002dec8a59ff23e532a45615a8e4e0ad21b	f2f06c177a113ff5476767669687d574990524aa	2026-08-17T01:00:39.764155+00:00	parameter tying	99.010000%	1863	keep	Union closest position groups 104 and 310	Family: parameter tying. Current retained frontier is 1,864 parameters at 99.010000%, a +0.010000 percentage-point margin over 99%. There have been 20 prior macro-attempts in this family and 242 prior micro-trials. The most recent accepted result is attempt-0078/micro-0221 at 1864 parameters and 99.010000%; the most recent failed result is attempt-0075/micro-0001 (error, no score). This is a parameterization-preserving compression: union current position groups represented by coordinates 104 and 310, whose learned values are -0.0037939230 and -0.0035854974 (absolute difference 2.084e-04), using a multiplicity-weighted mean. Hypothesis: this preserves qualification and yields 1,863 parameters. It is more informative than the nearest untested alternative (difference 2.093e-04) because it is the minimum-distortion eligible union; exact pairs already rejected under the unchanged grouping are excluded. Acceptance and rollback remain solely governed by the official runner.	0	0
attempt-0078	nearest-position-unions-infra-repair	micro-0223	0b2400ad9cf13200c82422404921d09d87f2b35c	71bd6002dec8a59ff23e532a45615a8e4e0ad21b	2026-08-17T01:01:42.631665+00:00	parameter tying	99.010000%	1862	keep	Union closest position groups 265 and 353	Family: parameter tying. Current retained frontier is 1,863 parameters at 99.010000%, a +0.010000 percentage-point margin over 99%. There have been 20 prior macro-attempts in this family and 243 prior micro-trials. The most recent accepted result is attempt-0078/micro-0222 at 1863 parameters and 99.010000%; the most recent failed result is attempt-0075/micro-0001 (error, no score). This is a parameterization-preserving compression: union current position groups represented by coordinates 265 and 353, whose learned values are 0.0063365130 and 0.0065458431 (absolute difference 2.093e-04), using a multiplicity-weighted mean. Hypothesis: this preserves qualification and yields 1,862 parameters. It is more informative than the nearest untested alternative (difference 2.170e-04) because it is the minimum-distortion eligible union; exact pairs already rejected under the unchanged grouping are excluded. Acceptance and rollback remain solely governed by the official runner.	0	0
attempt-0078	nearest-position-unions-infra-repair	micro-0224	dbe632069e76a34479cb9c87823bef0f89de1626	0b2400ad9cf13200c82422404921d09d87f2b35c	2026-08-17T01:02:45.487473+00:00	parameter tying	99.020000%	1861	keep	Union closest position groups 123 and 323	Family: parameter tying. Current retained frontier is 1,862 parameters at 99.010000%, a +0.010000 percentage-point margin over 99%. There have been 20 prior macro-attempts in this family and 244 prior micro-trials. The most recent accepted result is attempt-0078/micro-0223 at 1862 parameters and 99.010000%; the most recent failed result is attempt-0075/micro-0001 (error, no score). This is a parameterization-preserving compression: union current position groups represented by coordinates 123 and 323, whose learned values are 0.0137853287 and 0.0140023716 (absolute difference 2.170e-04), using a multiplicity-weighted mean. Hypothesis: this preserves qualification and yields 1,861 parameters. It is more informative than the nearest untested alternative (difference 2.176e-04) because it is the minimum-distortion eligible union; exact pairs already rejected under the unchanged grouping are excluded. Acceptance and rollback remain solely governed by the official runner.	0	0
attempt-0078	nearest-position-unions-infra-repair	micro-0225	38db714d53e3c2f47197a28de0588a67b78a59e3	dbe632069e76a34479cb9c87823bef0f89de1626	2026-08-17T01:03:51.388519+00:00	parameter tying	99.020000%	1860	keep	Union closest position groups 499 and 16	Family: parameter tying. Current retained frontier is 1,861 parameters at 99.020000%, a +0.020000 percentage-point margin over 99%. There have been 20 prior macro-attempts in this family and 245 prior micro-trials. The most recent accepted result is attempt-0078/micro-0224 at 1861 parameters and 99.020000%; the most recent failed result is attempt-0075/micro-0001 (error, no score). This is a parameterization-preserving compression: union current position groups represented by coordinates 499 and 16, whose learned values are 0.0328715034 and 0.0330891125 (absolute difference 2.176e-04), using a multiplicity-weighted mean. Hypothesis: this preserves qualification and yields 1,860 parameters. It is more informative than the nearest untested alternative (difference 2.186e-04) because it is the minimum-distortion eligible union; exact pairs already rejected under the unchanged grouping are excluded. Acceptance and rollback remain solely governed by the official runner.	0	0
attempt-0078	nearest-position-unions-infra-repair	micro-0226	a593872365646e6b80b7b048dd7166b2ebecd786	38db714d53e3c2f47197a28de0588a67b78a59e3	2026-08-17T01:05:10.153237+00:00	parameter tying	99.010000%	1859	keep	Union closest position groups 493 and 115	Family: parameter tying. Current retained frontier is 1,860 parameters at 99.020000%, a +0.020000 percentage-point margin over 99%. There have been 20 prior macro-attempts in this family and 246 prior micro-trials. The most recent accepted result is attempt-0078/micro-0225 at 1860 parameters and 99.020000%; the most recent failed result is attempt-0075/micro-0001 (error, no score). This is a parameterization-preserving compression: union current position groups represented by coordinates 493 and 115, whose learned values are -0.0280478820 and -0.0278293248 (absolute difference 2.186e-04), using a multiplicity-weighted mean. Hypothesis: this preserves qualification and yields 1,859 parameters. It is more informative than the nearest untested alternative (difference 2.187e-04) because it is the minimum-distortion eligible union; exact pairs already rejected under the unchanged grouping are excluded. Acceptance and rollback remain solely governed by the official runner.	0	0
attempt-0078	nearest-position-unions-infra-repair	micro-0227	f355157c04ea64a49b8000309dc969b611083b84	a593872365646e6b80b7b048dd7166b2ebecd786	2026-08-17T01:06:12.375683+00:00	parameter tying	99.010000%	1858	keep	Union closest position groups 49 and 270	Family: parameter tying. Current retained frontier is 1,859 parameters at 99.010000%, a +0.010000 percentage-point margin over 99%. There have been 20 prior macro-attempts in this family and 247 prior micro-trials. The most recent accepted result is attempt-0078/micro-0226 at 1859 parameters and 99.010000%; the most recent failed result is attempt-0075/micro-0001 (error, no score). This is a parameterization-preserving compression: union current position groups represented by coordinates 49 and 270, whose learned values are -0.0000095294 and 0.0002091415 (absolute difference 2.187e-04), using a multiplicity-weighted mean. Hypothesis: this preserves qualification and yields 1,858 parameters. It is more informative than the nearest untested alternative (difference 2.193e-04) because it is the minimum-distortion eligible union; exact pairs already rejected under the unchanged grouping are excluded. Acceptance and rollback remain solely governed by the official runner.	0	0
attempt-0078	nearest-position-unions-infra-repair	micro-0228	f448cfd2c09e781abdd2458164dd71f375320786	f355157c04ea64a49b8000309dc969b611083b84	2026-08-17T01:07:14.926216+00:00	parameter tying	99.030000%	1857	keep	Union closest position groups 109 and 7	Family: parameter tying. Current retained frontier is 1,858 parameters at 99.010000%, a +0.010000 percentage-point margin over 99%. There have been 20 prior macro-attempts in this family and 248 prior micro-trials. The most recent accepted result is attempt-0078/micro-0227 at 1858 parameters and 99.010000%; the most recent failed result is attempt-0075/micro-0001 (error, no score). This is a parameterization-preserving compression: union current position groups represented by coordinates 109 and 7, whose learned values are 0.0033222144 and 0.0035415206 (absolute difference 2.193e-04), using a multiplicity-weighted mean. Hypothesis: this preserves qualification and yields 1,857 parameters. It is more informative than the nearest untested alternative (difference 2.278e-04) because it is the minimum-distortion eligible union; exact pairs already rejected under the unchanged grouping are excluded. Acceptance and rollback remain solely governed by the official runner.	0	0
attempt-0078	nearest-position-unions-infra-repair	micro-0229	e91adb2ec954f9d622bebe42cd0056ca3f21571d	f448cfd2c09e781abdd2458164dd71f375320786	2026-08-17T01:08:21.920992+00:00	parameter tying	99.030000%	1856	keep	Union closest position groups 18 and 132	Family: parameter tying. Current retained frontier is 1,857 parameters at 99.030000%, a +0.030000 percentage-point margin over 99%. There have been 20 prior macro-attempts in this family and 249 prior micro-trials. The most recent accepted result is attempt-0078/micro-0228 at 1857 parameters and 99.030000%; the most recent failed result is attempt-0075/micro-0001 (error, no score). This is a parameterization-preserving compression: union current position groups represented by coordinates 18 and 132, whose learned values are 0.0185706783 and 0.0187984817 (absolute difference 2.278e-04), using a multiplicity-weighted mean. Hypothesis: this preserves qualification and yields 1,856 parameters. It is more informative than the nearest untested alternative (difference 2.296e-04) because it is the minimum-distortion eligible union; exact pairs already rejected under the unchanged grouping are excluded. Acceptance and rollback remain solely governed by the official runner.	0	0
attempt-0078	nearest-position-unions-infra-repair	micro-0230	80459e03084109ebc29f1963d5f8adaafe8460f3	e91adb2ec954f9d622bebe42cd0056ca3f21571d	2026-08-17T01:09:39.198554+00:00	parameter tying	99.020000%	1855	keep	Union closest position groups 21 and 484	Family: parameter tying. Current retained frontier is 1,856 parameters at 99.030000%, a +0.030000 percentage-point margin over 99%. There have been 20 prior macro-attempts in this family and 250 prior micro-trials. The most recent accepted result is attempt-0078/micro-0229 at 1856 parameters and 99.030000%; the most recent failed result is attempt-0075/micro-0001 (error, no score). This is a parameterization-preserving compression: union current position groups represented by coordinates 21 and 484, whose learned values are -0.0111777904 and -0.0109481597 (absolute difference 2.296e-04), using a multiplicity-weighted mean. Hypothesis: this preserves qualification and yields 1,855 parameters. It is more informative than the nearest untested alternative (difference 2.319e-04) because it is the minimum-distortion eligible union; exact pairs already rejected under the unchanged grouping are excluded. Acceptance and rollback remain solely governed by the official runner.	0	0
attempt-0078	nearest-position-unions-infra-repair	micro-0231	fbdf33af1e3fa3c7b6bb47aa7a0405ff4095b7c0	80459e03084109ebc29f1963d5f8adaafe8460f3	2026-08-17T01:10:40.784156+00:00	parameter tying	99.020000%	1854	keep	Union closest position groups 503 and 371	Family: parameter tying. Current retained frontier is 1,855 parameters at 99.020000%, a +0.020000 percentage-point margin over 99%. There have been 20 prior macro-attempts in this family and 251 prior micro-trials. The most recent accepted result is attempt-0078/micro-0230 at 1855 parameters and 99.020000%; the most recent failed result is attempt-0075/micro-0001 (error, no score). This is a parameterization-preserving compression: union current position groups represented by coordinates 503 and 371, whose learned values are 0.0346781388 and 0.0349099934 (absolute difference 2.319e-04), using a multiplicity-weighted mean. Hypothesis: this preserves qualification and yields 1,854 parameters. It is more informative than the nearest untested alternative (difference 2.398e-04) because it is the minimum-distortion eligible union; exact pairs already rejected under the unchanged grouping are excluded. Acceptance and rollback remain solely governed by the official runner.	0	0
attempt-0078	nearest-position-unions-infra-repair	micro-0232	ccbf8a1d26b12c4ba67b8a48aa2416039cd1c2a3	fbdf33af1e3fa3c7b6bb47aa7a0405ff4095b7c0	2026-08-17T01:11:43.165815+00:00	parameter tying	99.070000%	1853	keep	Union closest position groups 67 and 66	Family: parameter tying. Current retained frontier is 1,854 parameters at 99.020000%, a +0.020000 percentage-point margin over 99%. There have been 20 prior macro-attempts in this family and 252 prior micro-trials. The most recent accepted result is attempt-0078/micro-0231 at 1854 parameters and 99.020000%; the most recent failed result is attempt-0075/micro-0001 (error, no score). This is a parameterization-preserving compression: union current position groups represented by coordinates 67 and 66, whose learned values are -0.0120407548 and -0.0118009811 (absolute difference 2.398e-04), using a multiplicity-weighted mean. Hypothesis: this preserves qualification and yields 1,853 parameters. It is more informative than the nearest untested alternative (difference 2.428e-04) because it is the minimum-distortion eligible union; exact pairs already rejected under the unchanged grouping are excluded. Acceptance and rollback remain solely governed by the official runner.	0	0
attempt-0078	nearest-position-unions-infra-repair	micro-0233	4592a9bc2833a272c78794a093c60dac7de693d1	ccbf8a1d26b12c4ba67b8a48aa2416039cd1c2a3	2026-08-17T01:12:45.087384+00:00	parameter tying	99.080000%	1852	keep	Union closest position groups 158 and 31	Family: parameter tying. Current retained frontier is 1,853 parameters at 99.070000%, a +0.070000 percentage-point margin over 99%. There have been 20 prior macro-attempts in this family and 253 prior micro-trials. The most recent accepted result is attempt-0078/micro-0232 at 1853 parameters and 99.070000%; the most recent failed result is attempt-0075/micro-0001 (error, no score). This is a parameterization-preserving compression: union current position groups represented by coordinates 158 and 31, whose learned values are -0.0327329971 and -0.0324902013 (absolute difference 2.428e-04), using a multiplicity-weighted mean. Hypothesis: this preserves qualification and yields 1,852 parameters. It is more informative than the nearest untested alternative (difference 2.440e-04) because it is the minimum-distortion eligible union; exact pairs already rejected under the unchanged grouping are excluded. Acceptance and rollback remain solely governed by the official runner.	0	0
attempt-0078	nearest-position-unions-infra-repair	micro-0234	3a19e978bcd0c57ffb208407844c4a9b36efe9f4	4592a9bc2833a272c78794a093c60dac7de693d1	2026-08-17T01:13:47.281104+00:00	parameter tying	99.090000%	1851	keep	Union closest position groups 42 and 103	Family: parameter tying. Current retained frontier is 1,852 parameters at 99.080000%, a +0.080000 percentage-point margin over 99%. There have been 20 prior macro-attempts in this family and 254 prior micro-trials. The most recent accepted result is attempt-0078/micro-0233 at 1852 parameters and 99.080000%; the most recent failed result is attempt-0075/micro-0001 (error, no score). This is a parameterization-preserving compression: union current position groups represented by coordinates 42 and 103, whose learned values are -0.0309752114 and -0.0307311900 (absolute difference 2.440e-04), using a multiplicity-weighted mean. Hypothesis: this preserves qualification and yields 1,851 parameters. It is more informative than the nearest untested alternative (difference 2.461e-04) because it is the minimum-distortion eligible union; exact pairs already rejected under the unchanged grouping are excluded. Acceptance and rollback remain solely governed by the official runner.	0	0
attempt-0078	nearest-position-unions-infra-repair	micro-0235	78f785a908e12cfda47d3d0cc3ed7ca485ccd845	3a19e978bcd0c57ffb208407844c4a9b36efe9f4	2026-08-17T01:14:49.617491+00:00	parameter tying	99.080000%	1850	keep	Union closest position groups 56 and 414	Family: parameter tying. Current retained frontier is 1,851 parameters at 99.090000%, a +0.090000 percentage-point margin over 99%. There have been 20 prior macro-attempts in this family and 255 prior micro-trials. The most recent accepted result is attempt-0078/micro-0234 at 1851 parameters and 99.090000%; the most recent failed result is attempt-0075/micro-0001 (error, no score). This is a parameterization-preserving compression: union current position groups represented by coordinates 56 and 414, whose learned values are -0.0199553538 and -0.0197092090 (absolute difference 2.461e-04), using a multiplicity-weighted mean. Hypothesis: this preserves qualification and yields 1,850 parameters. It is more informative than the nearest untested alternative (difference 2.471e-04) because it is the minimum-distortion eligible union; exact pairs already rejected under the unchanged grouping are excluded. Acceptance and rollback remain solely governed by the official runner.	0	0
