macro_attempt_id	automation_id	micro_attempt_id	commit	parent_commit	timestamp_utc	family	accuracy	parameters	status	description	proposal	train_exit	verify_exit
attempt-0078	nearest-position-unions-infra-repair	micro-0083	d6f0339cfac8ceaea8affd363c3788113db79482	bc1c608040fb4ce2c1d739a67e34ffa0d3bbe272	2026-08-16T22:35:00.366344+00:00	parameter tying	99.080000%	2002	keep	Union closest position groups 118 and 474	Family: parameter tying. Current retained frontier is 2,003 parameters at 99.080000%, a +0.080000 percentage-point margin over 99%. There have been 20 prior macro-attempts in this family and 103 prior micro-trials. The most recent accepted result is attempt-0078/micro-0082 at 2003 parameters and 99.080000%; the most recent failed result is attempt-0075/micro-0001 (error, no score). This is a parameterization-preserving compression: union current position groups represented by coordinates 118 and 474, whose learned values are -0.0004591885 and -0.0004041397 (absolute difference 5.505e-05), using a multiplicity-weighted mean. Hypothesis: this preserves qualification and yields 2,002 parameters. It is more informative than the nearest untested alternative (difference 5.514e-05) because it is the minimum-distortion eligible union; exact pairs already rejected under the unchanged grouping are excluded. Acceptance and rollback remain solely governed by the official runner.	0	0
attempt-0078	nearest-position-unions-infra-repair	micro-0084	f131a442534dc562500b569f29d3bd3dcf07b5d5	d6f0339cfac8ceaea8affd363c3788113db79482	2026-08-16T22:36:05.886691+00:00	parameter tying	99.080000%	2001	keep	Union closest position groups 224 and 207	Family: parameter tying. Current retained frontier is 2,002 parameters at 99.080000%, a +0.080000 percentage-point margin over 99%. There have been 20 prior macro-attempts in this family and 104 prior micro-trials. The most recent accepted result is attempt-0078/micro-0083 at 2002 parameters and 99.080000%; the most recent failed result is attempt-0075/micro-0001 (error, no score). This is a parameterization-preserving compression: union current position groups represented by coordinates 224 and 207, whose learned values are -0.0031973307 and -0.0031421930 (absolute difference 5.514e-05), using a multiplicity-weighted mean. Hypothesis: this preserves qualification and yields 2,001 parameters. It is more informative than the nearest untested alternative (difference 5.563e-05) because it is the minimum-distortion eligible union; exact pairs already rejected under the unchanged grouping are excluded. Acceptance and rollback remain solely governed by the official runner.	0	0
attempt-0078	nearest-position-unions-infra-repair	micro-0085	ffd742e9805f7f06e8b6a9bb753187309dbb6aaf	f131a442534dc562500b569f29d3bd3dcf07b5d5	2026-08-16T22:37:08.943251+00:00	parameter tying	99.080000%	2000	keep	Union closest position groups 359 and 467	Family: parameter tying. Current retained frontier is 2,001 parameters at 99.080000%, a +0.080000 percentage-point margin over 99%. There have been 20 prior macro-attempts in this family and 105 prior micro-trials. The most recent accepted result is attempt-0078/micro-0084 at 2001 parameters and 99.080000%; the most recent failed result is attempt-0075/micro-0001 (error, no score). This is a parameterization-preserving compression: union current position groups represented by coordinates 359 and 467, whose learned values are 0.0289382059 and 0.0289938338 (absolute difference 5.563e-05), using a multiplicity-weighted mean. Hypothesis: this preserves qualification and yields 2,000 parameters. It is more informative than the nearest untested alternative (difference 5.575e-05) because it is the minimum-distortion eligible union; exact pairs already rejected under the unchanged grouping are excluded. Acceptance and rollback remain solely governed by the official runner.	0	0
attempt-0078	nearest-position-unions-infra-repair	micro-0086	e5b84ab0896fc9fd68cf6e9291d4b6c63efca5ed	ffd742e9805f7f06e8b6a9bb753187309dbb6aaf	2026-08-16T22:38:13.664636+00:00	parameter tying	99.070000%	1999	keep	Union closest position groups 321 and 363	Family: parameter tying. Current retained frontier is 2,000 parameters at 99.080000%, a +0.080000 percentage-point margin over 99%. There have been 20 prior macro-attempts in this family and 106 prior micro-trials. The most recent accepted result is attempt-0078/micro-0085 at 2000 parameters and 99.080000%; the most recent failed result is attempt-0075/micro-0001 (error, no score). This is a parameterization-preserving compression: union current position groups represented by coordinates 321 and 363, whose learned values are 0.0215623453 and 0.0216180906 (absolute difference 5.575e-05), using a multiplicity-weighted mean. Hypothesis: this preserves qualification and yields 1,999 parameters. It is more informative than the nearest untested alternative (difference 5.633e-05) because it is the minimum-distortion eligible union; exact pairs already rejected under the unchanged grouping are excluded. Acceptance and rollback remain solely governed by the official runner.	0	0
attempt-0078	nearest-position-unions-infra-repair	micro-0087	24cc1b9f0ebfb393febfffedc6513b81a605f04d	e5b84ab0896fc9fd68cf6e9291d4b6c63efca5ed	2026-08-16T22:39:16.103335+00:00	parameter tying	99.080000%	1998	keep	Union closest position groups 327 and 119	Family: parameter tying. Current retained frontier is 1,999 parameters at 99.070000%, a +0.070000 percentage-point margin over 99%. There have been 20 prior macro-attempts in this family and 107 prior micro-trials. The most recent accepted result is attempt-0078/micro-0086 at 1999 parameters and 99.070000%; the most recent failed result is attempt-0075/micro-0001 (error, no score). This is a parameterization-preserving compression: union current position groups represented by coordinates 327 and 119, whose learned values are -0.0272180457 and -0.0271617156 (absolute difference 5.633e-05), using a multiplicity-weighted mean. Hypothesis: this preserves qualification and yields 1,998 parameters. It is more informative than the nearest untested alternative (difference 5.679e-05) because it is the minimum-distortion eligible union; exact pairs already rejected under the unchanged grouping are excluded. Acceptance and rollback remain solely governed by the official runner.	0	0
attempt-0078	nearest-position-unions-infra-repair	micro-0088	2f6f9c6293830f5bfa9a9961bf35b53bd5b8261d	24cc1b9f0ebfb393febfffedc6513b81a605f04d	2026-08-16T22:40:18.911821+00:00	parameter tying	99.080000%	1997	keep	Union closest position groups 63 and 134	Family: parameter tying. Current retained frontier is 1,998 parameters at 99.080000%, a +0.080000 percentage-point margin over 99%. There have been 20 prior macro-attempts in this family and 108 prior micro-trials. The most recent accepted result is attempt-0078/micro-0087 at 1998 parameters and 99.080000%; the most recent failed result is attempt-0075/micro-0001 (error, no score). This is a parameterization-preserving compression: union current position groups represented by coordinates 63 and 134, whose learned values are -0.0016690904 and -0.0016123009 (absolute difference 5.679e-05), using a multiplicity-weighted mean. Hypothesis: this preserves qualification and yields 1,997 parameters. It is more informative than the nearest untested alternative (difference 5.720e-05) because it is the minimum-distortion eligible union; exact pairs already rejected under the unchanged grouping are excluded. Acceptance and rollback remain solely governed by the official runner.	0	0
attempt-0078	nearest-position-unions-infra-repair	micro-0089	d45ee23706db8d8533e00da5532012a0095700e1	2f6f9c6293830f5bfa9a9961bf35b53bd5b8261d	2026-08-16T22:41:20.501204+00:00	parameter tying	99.080000%	1996	keep	Union closest position groups 168 and 477	Family: parameter tying. Current retained frontier is 1,997 parameters at 99.080000%, a +0.080000 percentage-point margin over 99%. There have been 20 prior macro-attempts in this family and 109 prior micro-trials. The most recent accepted result is attempt-0078/micro-0088 at 1997 parameters and 99.080000%; the most recent failed result is attempt-0075/micro-0001 (error, no score). This is a parameterization-preserving compression: union current position groups represented by coordinates 168 and 477, whose learned values are 0.0296001788 and 0.0296573825 (absolute difference 5.720e-05), using a multiplicity-weighted mean. Hypothesis: this preserves qualification and yields 1,996 parameters. It is more informative than the nearest untested alternative (difference 5.753e-05) because it is the minimum-distortion eligible union; exact pairs already rejected under the unchanged grouping are excluded. Acceptance and rollback remain solely governed by the official runner.	0	0
attempt-0078	nearest-position-unions-infra-repair	micro-0090	ff2dcee09c7d726ec10129858f9783e5e5ff09c8	d45ee23706db8d8533e00da5532012a0095700e1	2026-08-16T22:42:22.491048+00:00	parameter tying	99.080000%	1995	keep	Union closest position groups 428 and 264	Family: parameter tying. Current retained frontier is 1,996 parameters at 99.080000%, a +0.080000 percentage-point margin over 99%. There have been 20 prior macro-attempts in this family and 110 prior micro-trials. The most recent accepted result is attempt-0078/micro-0089 at 1996 parameters and 99.080000%; the most recent failed result is attempt-0075/micro-0001 (error, no score). This is a parameterization-preserving compression: union current position groups represented by coordinates 428 and 264, whose learned values are 0.0085569061 and 0.0086144321 (absolute difference 5.753e-05), using a multiplicity-weighted mean. Hypothesis: this preserves qualification and yields 1,995 parameters. It is more informative than the nearest untested alternative (difference 5.809e-05) because it is the minimum-distortion eligible union; exact pairs already rejected under the unchanged grouping are excluded. Acceptance and rollback remain solely governed by the official runner.	0	0
attempt-0078	nearest-position-unions-infra-repair	micro-0091	d31fa56dca901fed7665e90379b1328f9af6ff25	ff2dcee09c7d726ec10129858f9783e5e5ff09c8	2026-08-16T22:43:34.606408+00:00	parameter tying	99.080000%	1994	keep	Union closest position groups 186 and 18	Family: parameter tying. Current retained frontier is 1,995 parameters at 99.080000%, a +0.080000 percentage-point margin over 99%. There have been 20 prior macro-attempts in this family and 111 prior micro-trials. The most recent accepted result is attempt-0078/micro-0090 at 1995 parameters and 99.080000%; the most recent failed result is attempt-0075/micro-0001 (error, no score). This is a parameterization-preserving compression: union current position groups represented by coordinates 186 and 18, whose learned values are 0.0185883921 and 0.0186464861 (absolute difference 5.809e-05), using a multiplicity-weighted mean. Hypothesis: this preserves qualification and yields 1,994 parameters. It is more informative than the nearest untested alternative (difference 5.994e-05) because it is the minimum-distortion eligible union; exact pairs already rejected under the unchanged grouping are excluded. Acceptance and rollback remain solely governed by the official runner.	0	0
attempt-0078	nearest-position-unions-infra-repair	micro-0092	99882d200221f9b82c7ca923974efdf1b5c63149	d31fa56dca901fed7665e90379b1328f9af6ff25	2026-08-16T22:44:37.406467+00:00	parameter tying	99.080000%	1993	keep	Union closest position groups 459 and 497	Family: parameter tying. Current retained frontier is 1,994 parameters at 99.080000%, a +0.080000 percentage-point margin over 99%. There have been 20 prior macro-attempts in this family and 112 prior micro-trials. The most recent accepted result is attempt-0078/micro-0091 at 1994 parameters and 99.080000%; the most recent failed result is attempt-0075/micro-0001 (error, no score). This is a parameterization-preserving compression: union current position groups represented by coordinates 459 and 497, whose learned values are 0.0181863587 and 0.0182462949 (absolute difference 5.994e-05), using a multiplicity-weighted mean. Hypothesis: this preserves qualification and yields 1,993 parameters. It is more informative than the nearest untested alternative (difference 6.003e-05) because it is the minimum-distortion eligible union; exact pairs already rejected under the unchanged grouping are excluded. Acceptance and rollback remain solely governed by the official runner.	0	0
attempt-0078	nearest-position-unions-infra-repair	micro-0093	a4ed5ccc360ef0e3894c8398bcfc9adff2168f67	99882d200221f9b82c7ca923974efdf1b5c63149	2026-08-16T22:45:39.975241+00:00	parameter tying	99.080000%	1992	keep	Union closest position groups 464 and 31	Family: parameter tying. Current retained frontier is 1,993 parameters at 99.080000%, a +0.080000 percentage-point margin over 99%. There have been 20 prior macro-attempts in this family and 113 prior micro-trials. The most recent accepted result is attempt-0078/micro-0092 at 1993 parameters and 99.080000%; the most recent failed result is attempt-0075/micro-0001 (error, no score). This is a parameterization-preserving compression: union current position groups represented by coordinates 464 and 31, whose learned values are -0.0325202122 and -0.0324601866 (absolute difference 6.003e-05), using a multiplicity-weighted mean. Hypothesis: this preserves qualification and yields 1,992 parameters. It is more informative than the nearest untested alternative (difference 6.072e-05) because it is the minimum-distortion eligible union; exact pairs already rejected under the unchanged grouping are excluded. Acceptance and rollback remain solely governed by the official runner.	0	0
attempt-0078	nearest-position-unions-infra-repair	micro-0094	b1d55a7747f32fdae05729cec6a7d9bf3d8c9c4a	a4ed5ccc360ef0e3894c8398bcfc9adff2168f67	2026-08-16T22:46:42.371286+00:00	parameter tying	99.080000%	1991	keep	Union closest position groups 346 and 254	Family: parameter tying. Current retained frontier is 1,992 parameters at 99.080000%, a +0.080000 percentage-point margin over 99%. There have been 20 prior macro-attempts in this family and 114 prior micro-trials. The most recent accepted result is attempt-0078/micro-0093 at 1992 parameters and 99.080000%; the most recent failed result is attempt-0075/micro-0001 (error, no score). This is a parameterization-preserving compression: union current position groups represented by coordinates 346 and 254, whose learned values are 0.0000061579 and 0.0000668808 (absolute difference 6.072e-05), using a multiplicity-weighted mean. Hypothesis: this preserves qualification and yields 1,991 parameters. It is more informative than the nearest untested alternative (difference 6.088e-05) because it is the minimum-distortion eligible union; exact pairs already rejected under the unchanged grouping are excluded. Acceptance and rollback remain solely governed by the official runner.	0	0
attempt-0078	nearest-position-unions-infra-repair	micro-0095	c41bb778062e5b1e9e319309e05aaac52e0084ab	b1d55a7747f32fdae05729cec6a7d9bf3d8c9c4a	2026-08-16T22:47:44.465252+00:00	parameter tying	99.080000%	1990	keep	Union closest position groups 318 and 405	Family: parameter tying. Current retained frontier is 1,991 parameters at 99.080000%, a +0.080000 percentage-point margin over 99%. There have been 20 prior macro-attempts in this family and 115 prior micro-trials. The most recent accepted result is attempt-0078/micro-0094 at 1991 parameters and 99.080000%; the most recent failed result is attempt-0075/micro-0001 (error, no score). This is a parameterization-preserving compression: union current position groups represented by coordinates 318 and 405, whose learned values are 0.0254360475 and 0.0254969317 (absolute difference 6.088e-05), using a multiplicity-weighted mean. Hypothesis: this preserves qualification and yields 1,990 parameters. It is more informative than the nearest untested alternative (difference 6.112e-05) because it is the minimum-distortion eligible union; exact pairs already rejected under the unchanged grouping are excluded. Acceptance and rollback remain solely governed by the official runner.	0	0
attempt-0078	nearest-position-unions-infra-repair	micro-0096	0ffb957839f52194b7fdbca2377996a8a6492aef	c41bb778062e5b1e9e319309e05aaac52e0084ab	2026-08-16T22:48:46.136083+00:00	parameter tying	99.080000%	1989	keep	Union closest position groups 114 and 137	Family: parameter tying. Current retained frontier is 1,990 parameters at 99.080000%, a +0.080000 percentage-point margin over 99%. There have been 20 prior macro-attempts in this family and 116 prior micro-trials. The most recent accepted result is attempt-0078/micro-0095 at 1990 parameters and 99.080000%; the most recent failed result is attempt-0075/micro-0001 (error, no score). This is a parameterization-preserving compression: union current position groups represented by coordinates 114 and 137, whose learned values are -0.0203367919 and -0.0202756710 (absolute difference 6.112e-05), using a multiplicity-weighted mean. Hypothesis: this preserves qualification and yields 1,989 parameters. It is more informative than the nearest untested alternative (difference 6.267e-05) because it is the minimum-distortion eligible union; exact pairs already rejected under the unchanged grouping are excluded. Acceptance and rollback remain solely governed by the official runner.	0	0
attempt-0078	nearest-position-unions-infra-repair	micro-0097	e56087c0deed59c89783a40d64afae31586ef771	0ffb957839f52194b7fdbca2377996a8a6492aef	2026-08-16T22:49:48.018456+00:00	parameter tying	99.080000%	1988	keep	Union closest position groups 231 and 13	Family: parameter tying. Current retained frontier is 1,989 parameters at 99.080000%, a +0.080000 percentage-point margin over 99%. There have been 20 prior macro-attempts in this family and 117 prior micro-trials. The most recent accepted result is attempt-0078/micro-0096 at 1989 parameters and 99.080000%; the most recent failed result is attempt-0075/micro-0001 (error, no score). This is a parameterization-preserving compression: union current position groups represented by coordinates 231 and 13, whose learned values are 0.0174557809 and 0.0175184477 (absolute difference 6.267e-05), using a multiplicity-weighted mean. Hypothesis: this preserves qualification and yields 1,988 parameters. It is more informative than the nearest untested alternative (difference 6.277e-05) because it is the minimum-distortion eligible union; exact pairs already rejected under the unchanged grouping are excluded. Acceptance and rollback remain solely governed by the official runner.	0	0
attempt-0078	nearest-position-unions-infra-repair	micro-0098	8e1ce73a3fe065abe54181fe77513b59fd36540b	e56087c0deed59c89783a40d64afae31586ef771	2026-08-16T22:50:49.795749+00:00	parameter tying	99.080000%	1987	keep	Union closest position groups 90 and 141	Family: parameter tying. Current retained frontier is 1,988 parameters at 99.080000%, a +0.080000 percentage-point margin over 99%. There have been 20 prior macro-attempts in this family and 118 prior micro-trials. The most recent accepted result is attempt-0078/micro-0097 at 1988 parameters and 99.080000%; the most recent failed result is attempt-0075/micro-0001 (error, no score). This is a parameterization-preserving compression: union current position groups represented by coordinates 90 and 141, whose learned values are -0.0046477029 and -0.0045849304 (absolute difference 6.277e-05), using a multiplicity-weighted mean. Hypothesis: this preserves qualification and yields 1,987 parameters. It is more informative than the nearest untested alternative (difference 6.388e-05) because it is the minimum-distortion eligible union; exact pairs already rejected under the unchanged grouping are excluded. Acceptance and rollback remain solely governed by the official runner.	0	0
attempt-0078	nearest-position-unions-infra-repair	micro-0099	219da7f67289954a6ccb36c28e6367cba9781a64	8e1ce73a3fe065abe54181fe77513b59fd36540b	2026-08-16T22:51:51.955441+00:00	parameter tying	99.080000%	1986	keep	Union closest position groups 449 and 54	Family: parameter tying. Current retained frontier is 1,987 parameters at 99.080000%, a +0.080000 percentage-point margin over 99%. There have been 20 prior macro-attempts in this family and 119 prior micro-trials. The most recent accepted result is attempt-0078/micro-0098 at 1987 parameters and 99.080000%; the most recent failed result is attempt-0075/micro-0001 (error, no score). This is a parameterization-preserving compression: union current position groups represented by coordinates 449 and 54, whose learned values are 0.0159679521 and 0.0160318278 (absolute difference 6.388e-05), using a multiplicity-weighted mean. Hypothesis: this preserves qualification and yields 1,986 parameters. It is more informative than the nearest untested alternative (difference 6.397e-05) because it is the minimum-distortion eligible union; exact pairs already rejected under the unchanged grouping are excluded. Acceptance and rollback remain solely governed by the official runner.	0	0
