macro_attempt_id	automation_id	micro_attempt_id	commit	parent_commit	timestamp_utc	family	accuracy	parameters	status	description	proposal	train_exit	verify_exit
attempt-0078	nearest-position-unions-infra-repair	micro-0049	f52ebcffe3d254340ec8fa8b7a4ecc7c6fefd35b	0939e059551ad1be3572ffd89b839d3f033407c3	2026-08-16T21:48:09.432648+00:00	parameter tying	99.060000%	2036	keep	Union closest position groups 195 and 179	Family: parameter tying. Current retained frontier is 2,037 parameters at 99.060000%, a +0.060000 percentage-point margin over 99%. There have been 20 prior macro-attempts in this family and 69 prior micro-trials. The most recent accepted result is attempt-0078/micro-0048 at 2037 parameters and 99.060000%; the most recent failed result is attempt-0075/micro-0001 (error, no score). This is a parameterization-preserving compression: union current position groups represented by coordinates 195 and 179, whose learned values are -0.0129512744 and -0.0129160043 (absolute difference 3.527e-05), using a multiplicity-weighted mean. Hypothesis: this preserves qualification and yields 2,036 parameters. It is more informative than the nearest untested alternative (difference 3.532e-05) because it is the minimum-distortion eligible union; exact pairs already rejected under the unchanged grouping are excluded. Acceptance and rollback remain solely governed by the official runner.	0	0
attempt-0078	nearest-position-unions-infra-repair	micro-0050	ba1550c3b6f514df6efca2daada76d0607bf2643	f52ebcffe3d254340ec8fa8b7a4ecc7c6fefd35b	2026-08-16T21:49:14.744523+00:00	parameter tying	99.050000%	2035	keep	Union closest position groups 317 and 336	Family: parameter tying. Current retained frontier is 2,036 parameters at 99.060000%, a +0.060000 percentage-point margin over 99%. There have been 20 prior macro-attempts in this family and 70 prior micro-trials. The most recent accepted result is attempt-0078/micro-0049 at 2036 parameters and 99.060000%; the most recent failed result is attempt-0075/micro-0001 (error, no score). This is a parameterization-preserving compression: union current position groups represented by coordinates 317 and 336, whose learned values are -0.0211009458 and -0.0210656300 (absolute difference 3.532e-05), using a multiplicity-weighted mean. Hypothesis: this preserves qualification and yields 2,035 parameters. It is more informative than the nearest untested alternative (difference 3.563e-05) because it is the minimum-distortion eligible union; exact pairs already rejected under the unchanged grouping are excluded. Acceptance and rollback remain solely governed by the official runner.	0	0
attempt-0078	nearest-position-unions-infra-repair	micro-0051	f32f98e2bc5e32ca3481410e1ab71650d68ebb15	ba1550c3b6f514df6efca2daada76d0607bf2643	2026-08-16T21:50:17.776004+00:00	parameter tying	99.050000%	2034	keep	Union closest position groups 376 and 90	Family: parameter tying. Current retained frontier is 2,035 parameters at 99.050000%, a +0.050000 percentage-point margin over 99%. There have been 20 prior macro-attempts in this family and 71 prior micro-trials. The most recent accepted result is attempt-0078/micro-0050 at 2035 parameters and 99.050000%; the most recent failed result is attempt-0075/micro-0001 (error, no score). This is a parameterization-preserving compression: union current position groups represented by coordinates 376 and 90, whose learned values are -0.0046655159 and -0.0046298895 (absolute difference 3.563e-05), using a multiplicity-weighted mean. Hypothesis: this preserves qualification and yields 2,034 parameters. It is more informative than the nearest untested alternative (difference 3.619e-05) because it is the minimum-distortion eligible union; exact pairs already rejected under the unchanged grouping are excluded. Acceptance and rollback remain solely governed by the official runner.	0	0
attempt-0078	nearest-position-unions-infra-repair	micro-0052	ddbc71ba0a9235bb21b20eebbbec5689f4416d3a	f32f98e2bc5e32ca3481410e1ab71650d68ebb15	2026-08-16T21:51:21.185679+00:00	parameter tying	99.060000%	2033	keep	Union closest position groups 244 and 488	Family: parameter tying. Current retained frontier is 2,034 parameters at 99.050000%, a +0.050000 percentage-point margin over 99%. There have been 20 prior macro-attempts in this family and 72 prior micro-trials. The most recent accepted result is attempt-0078/micro-0051 at 2034 parameters and 99.050000%; the most recent failed result is attempt-0075/micro-0001 (error, no score). This is a parameterization-preserving compression: union current position groups represented by coordinates 244 and 488, whose learned values are 0.0018376078 and 0.0018737979 (absolute difference 3.619e-05), using a multiplicity-weighted mean. Hypothesis: this preserves qualification and yields 2,033 parameters. It is more informative than the nearest untested alternative (difference 3.720e-05) because it is the minimum-distortion eligible union; exact pairs already rejected under the unchanged grouping are excluded. Acceptance and rollback remain solely governed by the official runner.	0	0
attempt-0078	nearest-position-unions-infra-repair	micro-0053	be59c78f0e3e4fde700c9994381620d5771bb92f	ddbc71ba0a9235bb21b20eebbbec5689f4416d3a	2026-08-16T21:52:23.666651+00:00	parameter tying	99.060000%	2032	keep	Union closest position groups 177 and 41	Family: parameter tying. Current retained frontier is 2,033 parameters at 99.060000%, a +0.060000 percentage-point margin over 99%. There have been 20 prior macro-attempts in this family and 73 prior micro-trials. The most recent accepted result is attempt-0078/micro-0052 at 2033 parameters and 99.060000%; the most recent failed result is attempt-0075/micro-0001 (error, no score). This is a parameterization-preserving compression: union current position groups represented by coordinates 177 and 41, whose learned values are 0.0004997810 and 0.0005369809 (absolute difference 3.720e-05), using a multiplicity-weighted mean. Hypothesis: this preserves qualification and yields 2,032 parameters. It is more informative than the nearest untested alternative (difference 3.728e-05) because it is the minimum-distortion eligible union; exact pairs already rejected under the unchanged grouping are excluded. Acceptance and rollback remain solely governed by the official runner.	0	0
attempt-0078	nearest-position-unions-infra-repair	micro-0054	b1ddd621a0b0be3bf9d6167febf14bdd24807cb6	be59c78f0e3e4fde700c9994381620d5771bb92f	2026-08-16T21:53:26.434989+00:00	parameter tying	99.060000%	2031	keep	Union closest position groups 383 and 265	Family: parameter tying. Current retained frontier is 2,032 parameters at 99.060000%, a +0.060000 percentage-point margin over 99%. There have been 20 prior macro-attempts in this family and 74 prior micro-trials. The most recent accepted result is attempt-0078/micro-0053 at 2032 parameters and 99.060000%; the most recent failed result is attempt-0075/micro-0001 (error, no score). This is a parameterization-preserving compression: union current position groups represented by coordinates 383 and 265, whose learned values are 0.0063178721 and 0.0063551543 (absolute difference 3.728e-05), using a multiplicity-weighted mean. Hypothesis: this preserves qualification and yields 2,031 parameters. It is more informative than the nearest untested alternative (difference 3.920e-05) because it is the minimum-distortion eligible union; exact pairs already rejected under the unchanged grouping are excluded. Acceptance and rollback remain solely governed by the official runner.	0	0
attempt-0078	nearest-position-unions-infra-repair	micro-0055	122cf75e819e961eb5f3fd34c33c7d635a2d6ef0	b1ddd621a0b0be3bf9d6167febf14bdd24807cb6	2026-08-16T21:54:29.625760+00:00	parameter tying	99.060000%	2030	keep	Union closest position groups 323 and 381	Family: parameter tying. Current retained frontier is 2,031 parameters at 99.060000%, a +0.060000 percentage-point margin over 99%. There have been 20 prior macro-attempts in this family and 75 prior micro-trials. The most recent accepted result is attempt-0078/micro-0054 at 2031 parameters and 99.060000%; the most recent failed result is attempt-0075/micro-0001 (error, no score). This is a parameterization-preserving compression: union current position groups represented by coordinates 323 and 381, whose learned values are 0.0139827719 and 0.0140219703 (absolute difference 3.920e-05), using a multiplicity-weighted mean. Hypothesis: this preserves qualification and yields 2,030 parameters. It is more informative than the nearest untested alternative (difference 3.927e-05) because it is the minimum-distortion eligible union; exact pairs already rejected under the unchanged grouping are excluded. Acceptance and rollback remain solely governed by the official runner.	0	0
attempt-0078	nearest-position-unions-infra-repair	micro-0056	ffcb69eea4af27e4ff787eebd4a15cc781150180	122cf75e819e961eb5f3fd34c33c7d635a2d6ef0	2026-08-16T21:55:32.667103+00:00	parameter tying	99.050000%	2029	keep	Union closest position groups 320 and 257	Family: parameter tying. Current retained frontier is 2,030 parameters at 99.060000%, a +0.060000 percentage-point margin over 99%. There have been 20 prior macro-attempts in this family and 76 prior micro-trials. The most recent accepted result is attempt-0078/micro-0055 at 2030 parameters and 99.060000%; the most recent failed result is attempt-0075/micro-0001 (error, no score). This is a parameterization-preserving compression: union current position groups represented by coordinates 320 and 257, whose learned values are 0.0212913547 and 0.0213306285 (absolute difference 3.927e-05), using a multiplicity-weighted mean. Hypothesis: this preserves qualification and yields 2,029 parameters. It is more informative than the nearest untested alternative (difference 3.943e-05) because it is the minimum-distortion eligible union; exact pairs already rejected under the unchanged grouping are excluded. Acceptance and rollback remain solely governed by the official runner.	0	0
attempt-0078	nearest-position-unions-infra-repair	micro-0057	587e12585030e5cc58dc552c528a64a95b668925	ffcb69eea4af27e4ff787eebd4a15cc781150180	2026-08-16T21:56:37.701198+00:00	parameter tying	99.060000%	2028	keep	Union closest position groups 287 and 322	Family: parameter tying. Current retained frontier is 2,029 parameters at 99.050000%, a +0.050000 percentage-point margin over 99%. There have been 20 prior macro-attempts in this family and 77 prior micro-trials. The most recent accepted result is attempt-0078/micro-0056 at 2029 parameters and 99.050000%; the most recent failed result is attempt-0075/micro-0001 (error, no score). This is a parameterization-preserving compression: union current position groups represented by coordinates 287 and 322, whose learned values are 0.0022841841 and 0.0023236161 (absolute difference 3.943e-05), using a multiplicity-weighted mean. Hypothesis: this preserves qualification and yields 2,028 parameters. It is more informative than the nearest untested alternative (difference 4.003e-05) because it is the minimum-distortion eligible union; exact pairs already rejected under the unchanged grouping are excluded. Acceptance and rollback remain solely governed by the official runner.	0	0
attempt-0078	nearest-position-unions-infra-repair	micro-0058	946bde5c0434c4e3c28c2e1fe6e42b28b25c917a	587e12585030e5cc58dc552c528a64a95b668925	2026-08-16T21:57:40.672310+00:00	parameter tying	99.040000%	2027	keep	Union closest position groups 77 and 291	Family: parameter tying. Current retained frontier is 2,028 parameters at 99.060000%, a +0.060000 percentage-point margin over 99%. There have been 20 prior macro-attempts in this family and 78 prior micro-trials. The most recent accepted result is attempt-0078/micro-0057 at 2028 parameters and 99.060000%; the most recent failed result is attempt-0075/micro-0001 (error, no score). This is a parameterization-preserving compression: union current position groups represented by coordinates 77 and 291, whose learned values are 0.0007743728 and 0.0008143999 (absolute difference 4.003e-05), using a multiplicity-weighted mean. Hypothesis: this preserves qualification and yields 2,027 parameters. It is more informative than the nearest untested alternative (difference 4.011e-05) because it is the minimum-distortion eligible union; exact pairs already rejected under the unchanged grouping are excluded. Acceptance and rollback remain solely governed by the official runner.	0	0
attempt-0078	nearest-position-unions-infra-repair	micro-0059	3d4fd36ea67fe400db31c39dd3b8eb9af6ecbef2	946bde5c0434c4e3c28c2e1fe6e42b28b25c917a	2026-08-16T21:58:44.121787+00:00	parameter tying	99.040000%	2026	keep	Union closest position groups 434 and 430	Family: parameter tying. Current retained frontier is 2,027 parameters at 99.040000%, a +0.040000 percentage-point margin over 99%. There have been 20 prior macro-attempts in this family and 79 prior micro-trials. The most recent accepted result is attempt-0078/micro-0058 at 2027 parameters and 99.040000%; the most recent failed result is attempt-0075/micro-0001 (error, no score). This is a parameterization-preserving compression: union current position groups represented by coordinates 434 and 430, whose learned values are -0.0226544142 and -0.0226143077 (absolute difference 4.011e-05), using a multiplicity-weighted mean. Hypothesis: this preserves qualification and yields 2,026 parameters. It is more informative than the nearest untested alternative (difference 4.051e-05) because it is the minimum-distortion eligible union; exact pairs already rejected under the unchanged grouping are excluded. Acceptance and rollback remain solely governed by the official runner.	0	0
attempt-0078	nearest-position-unions-infra-repair	micro-0060	6c63bbee3135e90b755a089a0445e5370172b487	3d4fd36ea67fe400db31c39dd3b8eb9af6ecbef2	2026-08-16T21:59:47.475280+00:00	parameter tying	99.040000%	2025	keep	Union closest position groups 88 and 25	Family: parameter tying. Current retained frontier is 2,026 parameters at 99.040000%, a +0.040000 percentage-point margin over 99%. There have been 20 prior macro-attempts in this family and 80 prior micro-trials. The most recent accepted result is attempt-0078/micro-0059 at 2026 parameters and 99.040000%; the most recent failed result is attempt-0075/micro-0001 (error, no score). This is a parameterization-preserving compression: union current position groups represented by coordinates 88 and 25, whose learned values are -0.0134652304 and -0.0134247188 (absolute difference 4.051e-05), using a multiplicity-weighted mean. Hypothesis: this preserves qualification and yields 2,025 parameters. It is more informative than the nearest untested alternative (difference 4.212e-05) because it is the minimum-distortion eligible union; exact pairs already rejected under the unchanged grouping are excluded. Acceptance and rollback remain solely governed by the official runner.	0	0
attempt-0078	nearest-position-unions-infra-repair	micro-0061	5e4dab977ea9deb453ff53e4c4dd4111c46bb20f	6c63bbee3135e90b755a089a0445e5370172b487	2026-08-16T22:00:50.329307+00:00	parameter tying	99.040000%	2024	keep	Union closest position groups 433 and 266	Family: parameter tying. Current retained frontier is 2,025 parameters at 99.040000%, a +0.040000 percentage-point margin over 99%. There have been 20 prior macro-attempts in this family and 81 prior micro-trials. The most recent accepted result is attempt-0078/micro-0060 at 2025 parameters and 99.040000%; the most recent failed result is attempt-0075/micro-0001 (error, no score). This is a parameterization-preserving compression: union current position groups represented by coordinates 433 and 266, whose learned values are 0.0180742983 and 0.0181164220 (absolute difference 4.212e-05), using a multiplicity-weighted mean. Hypothesis: this preserves qualification and yields 2,024 parameters. It is more informative than the nearest untested alternative (difference 4.220e-05) because it is the minimum-distortion eligible union; exact pairs already rejected under the unchanged grouping are excluded. Acceptance and rollback remain solely governed by the official runner.	0	0
attempt-0078	nearest-position-unions-infra-repair	micro-0062	bf5e78e838998c3a8e76265b6d7e60f464693c03	5e4dab977ea9deb453ff53e4c4dd4111c46bb20f	2026-08-16T22:01:52.863938+00:00	parameter tying	99.040000%	2023	keep	Union closest position groups 397 and 246	Family: parameter tying. Current retained frontier is 2,024 parameters at 99.040000%, a +0.040000 percentage-point margin over 99%. There have been 20 prior macro-attempts in this family and 82 prior micro-trials. The most recent accepted result is attempt-0078/micro-0061 at 2024 parameters and 99.040000%; the most recent failed result is attempt-0075/micro-0001 (error, no score). This is a parameterization-preserving compression: union current position groups represented by coordinates 397 and 246, whose learned values are 0.0131036239 and 0.0131458230 (absolute difference 4.220e-05), using a multiplicity-weighted mean. Hypothesis: this preserves qualification and yields 2,023 parameters. It is more informative than the nearest untested alternative (difference 4.239e-05) because it is the minimum-distortion eligible union; exact pairs already rejected under the unchanged grouping are excluded. Acceptance and rollback remain solely governed by the official runner.	0	0
attempt-0078	nearest-position-unions-infra-repair	micro-0063	cd44888bf6881fd19e9a7ffb70eb94da77168be3	bf5e78e838998c3a8e76265b6d7e60f464693c03	2026-08-16T22:02:56.044399+00:00	parameter tying	99.040000%	2022	keep	Union closest position groups 120 and 255	Family: parameter tying. Current retained frontier is 2,023 parameters at 99.040000%, a +0.040000 percentage-point margin over 99%. There have been 20 prior macro-attempts in this family and 83 prior micro-trials. The most recent accepted result is attempt-0078/micro-0062 at 2023 parameters and 99.040000%; the most recent failed result is attempt-0075/micro-0001 (error, no score). This is a parameterization-preserving compression: union current position groups represented by coordinates 120 and 255, whose learned values are -0.0020713275 and -0.0020289347 (absolute difference 4.239e-05), using a multiplicity-weighted mean. Hypothesis: this preserves qualification and yields 2,022 parameters. It is more informative than the nearest untested alternative (difference 4.253e-05) because it is the minimum-distortion eligible union; exact pairs already rejected under the unchanged grouping are excluded. Acceptance and rollback remain solely governed by the official runner.	0	0
attempt-0078	nearest-position-unions-infra-repair	micro-0064	01ac2a657e7d110d9aefce3837a9b635afdb1b7d	cd44888bf6881fd19e9a7ffb70eb94da77168be3	2026-08-16T22:03:59.453425+00:00	parameter tying	99.040000%	2021	keep	Union closest position groups 34 and 304	Family: parameter tying. Current retained frontier is 2,022 parameters at 99.040000%, a +0.040000 percentage-point margin over 99%. There have been 20 prior macro-attempts in this family and 84 prior micro-trials. The most recent accepted result is attempt-0078/micro-0063 at 2022 parameters and 99.040000%; the most recent failed result is attempt-0075/micro-0001 (error, no score). This is a parameterization-preserving compression: union current position groups represented by coordinates 34 and 304, whose learned values are 0.0218262654 and 0.0218687933 (absolute difference 4.253e-05), using a multiplicity-weighted mean. Hypothesis: this preserves qualification and yields 2,021 parameters. It is more informative than the nearest untested alternative (difference 4.263e-05) because it is the minimum-distortion eligible union; exact pairs already rejected under the unchanged grouping are excluded. Acceptance and rollback remain solely governed by the official runner.	0	0
attempt-0078	nearest-position-unions-infra-repair	micro-0065	98c39113619b4123ee67ed7b8ccfef1d9358f480	01ac2a657e7d110d9aefce3837a9b635afdb1b7d	2026-08-16T22:05:03.725050+00:00	parameter tying	99.040000%	2020	keep	Union closest position groups 463 and 138	Family: parameter tying. Current retained frontier is 2,021 parameters at 99.040000%, a +0.040000 percentage-point margin over 99%. There have been 20 prior macro-attempts in this family and 85 prior micro-trials. The most recent accepted result is attempt-0078/micro-0064 at 2021 parameters and 99.040000%; the most recent failed result is attempt-0075/micro-0001 (error, no score). This is a parameterization-preserving compression: union current position groups represented by coordinates 463 and 138, whose learned values are -0.0027563022 and -0.0027136749 (absolute difference 4.263e-05), using a multiplicity-weighted mean. Hypothesis: this preserves qualification and yields 2,020 parameters. It is more informative than the nearest untested alternative (difference 4.457e-05) because it is the minimum-distortion eligible union; exact pairs already rejected under the unchanged grouping are excluded. Acceptance and rollback remain solely governed by the official runner.	0	0
