macro_attempt_id	automation_id	micro_attempt_id	commit	parent_commit	timestamp_utc	family	accuracy	parameters	status	description	proposal	train_exit	verify_exit
attempt-0144	next-qkv-unions-at-temperature-101	micro-0012	9ec7a54622b817f6c1652e0605bbee6e8095ef1a	371e4b2f37a7aa63b2068de3ea0ce4bdabc7904d	2026-08-17T07:48:36.414345+00:00	parameter tying	99.020000%	1658	keep	Union closest shared-QKV scalar groups 439 and 428	Family: parameter tying. Current retained frontier is 1,659 parameters at 99.020000%, a +0.020000 percentage-point margin over 99%. There have been 47 prior macro-attempts in this family and 462 prior micro-trials. The most recent accepted result is attempt-0143/micro-0002 at 1,670 parameters and 99.04%; the most recent failed result is attempt-0143/micro-0001 (temperature 0.99 discarded at 98.89%). This is a parameterization-preserving compression of the depth-shared QKV transform: union flattened coordinates 439 and 428, whose learned values are -0.3489643037 and -0.3489028513 (difference 6.145e-05), with a multiplicity-weighted mean and integer reconstruction map. Hypothesis: the much larger attention tensor contains near-duplicate scalars below the token failure scale, so this union preserves qualification and yields 1,658 parameters. It is more informative than the next QKV union (difference 6.233e-05) because it is the minimum-distortion test at this new site. Acceptance and rollback remain solely governed by the official runner.	0	0
attempt-0144	next-qkv-unions-at-temperature-101	micro-0013	a32b7f7f910711054254c92ff8992b70fe9f4c76	9ec7a54622b817f6c1652e0605bbee6e8095ef1a	2026-08-17T07:49:52.066539+00:00	parameter tying	99.020000%	1657	keep	Union closest shared-QKV scalar groups 297 and 553	Family: parameter tying. Current retained frontier is 1,658 parameters at 99.020000%, a +0.020000 percentage-point margin over 99%. There have been 47 prior macro-attempts in this family and 463 prior micro-trials. The most recent accepted result is attempt-0143/micro-0002 at 1,670 parameters and 99.04%; the most recent failed result is attempt-0143/micro-0001 (temperature 0.99 discarded at 98.89%). This is a parameterization-preserving compression of the depth-shared QKV transform: union flattened coordinates 297 and 553, whose learned values are 0.0551006645 and 0.0551629961 (difference 6.233e-05), with a multiplicity-weighted mean and integer reconstruction map. Hypothesis: the much larger attention tensor contains near-duplicate scalars below the token failure scale, so this union preserves qualification and yields 1,657 parameters. It is more informative than the next QKV union (difference 6.351e-05) because it is the minimum-distortion test at this new site. Acceptance and rollback remain solely governed by the official runner.	0	0
attempt-0144	next-qkv-unions-at-temperature-101	micro-0014	b51c829ccff3031bda4d9a98f9e179904cad82a1	a32b7f7f910711054254c92ff8992b70fe9f4c76	2026-08-17T07:51:07.310401+00:00	parameter tying	99.020000%	1656	keep	Union closest shared-QKV scalar groups 625 and 683	Family: parameter tying. Current retained frontier is 1,657 parameters at 99.020000%, a +0.020000 percentage-point margin over 99%. There have been 47 prior macro-attempts in this family and 464 prior micro-trials. The most recent accepted result is attempt-0143/micro-0002 at 1,670 parameters and 99.04%; the most recent failed result is attempt-0143/micro-0001 (temperature 0.99 discarded at 98.89%). This is a parameterization-preserving compression of the depth-shared QKV transform: union flattened coordinates 625 and 683, whose learned values are 0.0101261223 and 0.0101896310 (difference 6.351e-05), with a multiplicity-weighted mean and integer reconstruction map. Hypothesis: the much larger attention tensor contains near-duplicate scalars below the token failure scale, so this union preserves qualification and yields 1,656 parameters. It is more informative than the next QKV union (difference 6.427e-05) because it is the minimum-distortion test at this new site. Acceptance and rollback remain solely governed by the official runner.	0	0
attempt-0144	next-qkv-unions-at-temperature-101	micro-0015	b8988583bda457d7adac84e6cad986a69d8de43d	b51c829ccff3031bda4d9a98f9e179904cad82a1	2026-08-17T07:52:26.067818+00:00	parameter tying	99.020000%	1655	keep	Union closest shared-QKV scalar groups 646 and 667	Family: parameter tying. Current retained frontier is 1,656 parameters at 99.020000%, a +0.020000 percentage-point margin over 99%. There have been 47 prior macro-attempts in this family and 465 prior micro-trials. The most recent accepted result is attempt-0143/micro-0002 at 1,670 parameters and 99.04%; the most recent failed result is attempt-0143/micro-0001 (temperature 0.99 discarded at 98.89%). This is a parameterization-preserving compression of the depth-shared QKV transform: union flattened coordinates 646 and 667, whose learned values are 0.0039409124 and 0.0040051811 (difference 6.427e-05), with a multiplicity-weighted mean and integer reconstruction map. Hypothesis: the much larger attention tensor contains near-duplicate scalars below the token failure scale, so this union preserves qualification and yields 1,655 parameters. It is more informative than the next QKV union (difference 6.582e-05) because it is the minimum-distortion test at this new site. Acceptance and rollback remain solely governed by the official runner.	0	0
attempt-0144	next-qkv-unions-at-temperature-101	micro-0016	eeed566eb6e1f160150c1dc9a5dae2722268c525	b8988583bda457d7adac84e6cad986a69d8de43d	2026-08-17T07:53:40.981131+00:00	parameter tying	99.020000%	1654	keep	Union closest shared-QKV scalar groups 718 and 260	Family: parameter tying. Current retained frontier is 1,655 parameters at 99.020000%, a +0.020000 percentage-point margin over 99%. There have been 47 prior macro-attempts in this family and 466 prior micro-trials. The most recent accepted result is attempt-0143/micro-0002 at 1,670 parameters and 99.04%; the most recent failed result is attempt-0143/micro-0001 (temperature 0.99 discarded at 98.89%). This is a parameterization-preserving compression of the depth-shared QKV transform: union flattened coordinates 718 and 260, whose learned values are 0.0462402590 and 0.0463060774 (difference 6.582e-05), with a multiplicity-weighted mean and integer reconstruction map. Hypothesis: the much larger attention tensor contains near-duplicate scalars below the token failure scale, so this union preserves qualification and yields 1,654 parameters. It is more informative than the next QKV union (difference 6.645e-05) because it is the minimum-distortion test at this new site. Acceptance and rollback remain solely governed by the official runner.	0	0
attempt-0144	next-qkv-unions-at-temperature-101	micro-0017	21d1a397f00c50600e5c8f0d8d672a62e51f083f	eeed566eb6e1f160150c1dc9a5dae2722268c525	2026-08-17T07:54:57.438880+00:00	parameter tying	99.020000%	1653	keep	Union closest shared-QKV scalar groups 684 and 685	Family: parameter tying. Current retained frontier is 1,654 parameters at 99.020000%, a +0.020000 percentage-point margin over 99%. There have been 47 prior macro-attempts in this family and 467 prior micro-trials. The most recent accepted result is attempt-0143/micro-0002 at 1,670 parameters and 99.04%; the most recent failed result is attempt-0143/micro-0001 (temperature 0.99 discarded at 98.89%). This is a parameterization-preserving compression of the depth-shared QKV transform: union flattened coordinates 684 and 685, whose learned values are 0.0226465017 and 0.0227129534 (difference 6.645e-05), with a multiplicity-weighted mean and integer reconstruction map. Hypothesis: the much larger attention tensor contains near-duplicate scalars below the token failure scale, so this union preserves qualification and yields 1,653 parameters. It is more informative than the next QKV union (difference 6.737e-05) because it is the minimum-distortion test at this new site. Acceptance and rollback remain solely governed by the official runner.	0	0
attempt-0144	next-qkv-unions-at-temperature-101	micro-0018	8e78fee8a3ce57b537915369632113a02c38470e	21d1a397f00c50600e5c8f0d8d672a62e51f083f	2026-08-17T07:56:12.352036+00:00	parameter tying	99.020000%	1652	keep	Union closest shared-QKV scalar groups 748 and 706	Family: parameter tying. Current retained frontier is 1,653 parameters at 99.020000%, a +0.020000 percentage-point margin over 99%. There have been 47 prior macro-attempts in this family and 468 prior micro-trials. The most recent accepted result is attempt-0143/micro-0002 at 1,670 parameters and 99.04%; the most recent failed result is attempt-0143/micro-0001 (temperature 0.99 discarded at 98.89%). This is a parameterization-preserving compression of the depth-shared QKV transform: union flattened coordinates 748 and 706, whose learned values are -0.0047784611 and -0.0047110897 (difference 6.737e-05), with a multiplicity-weighted mean and integer reconstruction map. Hypothesis: the much larger attention tensor contains near-duplicate scalars below the token failure scale, so this union preserves qualification and yields 1,652 parameters. It is more informative than the next QKV union (difference 6.846e-05) because it is the minimum-distortion test at this new site. Acceptance and rollback remain solely governed by the official runner.	0	0
attempt-0144	next-qkv-unions-at-temperature-101	micro-0019	631fd895aa3a24bfa5c3f569e6962ceec7394cca	8e78fee8a3ce57b537915369632113a02c38470e	2026-08-17T07:57:33.001197+00:00	parameter tying	98.990000%	1651	discard	Union closest shared-QKV scalar groups 564 and 699	Family: parameter tying. Current retained frontier is 1,652 parameters at 99.020000%, a +0.020000 percentage-point margin over 99%. There have been 47 prior macro-attempts in this family and 469 prior micro-trials. The most recent accepted result is attempt-0143/micro-0002 at 1,670 parameters and 99.04%; the most recent failed result is attempt-0143/micro-0001 (temperature 0.99 discarded at 98.89%). This is a parameterization-preserving compression of the depth-shared QKV transform: union flattened coordinates 564 and 699, whose learned values are -0.0023953773 and -0.0023269178 (difference 6.846e-05), with a multiplicity-weighted mean and integer reconstruction map. Hypothesis: the much larger attention tensor contains near-duplicate scalars below the token failure scale, so this union preserves qualification and yields 1,651 parameters. It is more informative than the next QKV union (difference 6.862e-05) because it is the minimum-distortion test at this new site. Acceptance and rollback remain solely governed by the official runner.	0	0
attempt-0145	next-qkv-temperature-calibration	micro-0001	f42258bab511aaa648d4bfab413c382d67954439	8e78fee8a3ce57b537915369632113a02c38470e	2026-08-17T08:00:13.479127+00:00	attention organization	98.980000%	1651	discard	Use temperature 1.005 with QKV union 564/699	Family: attention organization. Current retained frontier is 1,652 parameters at 99.020000%, +0.020000 over threshold. There have been 18 prior macro-attempts and 0 prior micro-trials in this policy. The most recent accepted result is attempt-0144/micro-0018 at 1,652/99.02%; the most recent failed result is attempt-0144/micro-0019, where QKV pair 564/699 scored 98.99% at 1,651 with temperature 1.01. Test the identical pair at absolute multiplier 1.005. This is more informative than the next scheduled temperature because it is the smallest remaining deviation around 1.01. Official acceptance/rollback is unchanged; acceptance exhausts equal-count eligibility.	0	0
attempt-0145	next-qkv-temperature-calibration	micro-0002	826490268493d9f986aab30be6f6e73cbe5374c3	8e78fee8a3ce57b537915369632113a02c38470e	2026-08-17T08:01:29.074157+00:00	attention organization	99.020000%	1651	keep	Use temperature 1.015 with QKV union 564/699	Family: attention organization. Current retained frontier is 1,652 parameters at 99.020000%, +0.020000 over threshold. There have been 18 prior macro-attempts and 1 prior micro-trials in this policy. The most recent accepted result is attempt-0144/micro-0018 at 1,652/99.02%; the most recent failed result is attempt-0144/micro-0019, where QKV pair 564/699 scored 98.99% at 1,651 with temperature 1.01. Test the identical pair at absolute multiplier 1.015. This is more informative than the next scheduled temperature because it is the smallest remaining deviation around 1.01. Official acceptance/rollback is unchanged; acceptance exhausts equal-count eligibility.	0	0
attempt-0146	next-qkv-unions-at-temperature-1015	micro-0001	484197e8c2221d53a025bc6d39e20224dcc6633a	826490268493d9f986aab30be6f6e73cbe5374c3	2026-08-17T08:03:43.981250+00:00	parameter tying	99.010000%	1650	keep	Union closest shared-QKV scalar groups 105 and 278	Family: parameter tying. Current retained frontier is 1,651 parameters at 99.020000%, a +0.020000 percentage-point margin over 99%. There have been 48 prior macro-attempts in this family and 470 prior micro-trials. The most recent accepted result is attempt-0145/micro-0002 at 1,651 parameters and 99.02%; the most recent failed result is attempt-0145/micro-0001 (temperature 1.005 discarded at 98.98%). This is a parameterization-preserving compression of the depth-shared QKV transform: union flattened coordinates 105 and 278, whose learned values are -0.0079108039 and -0.0078421850 (difference 6.862e-05), with a multiplicity-weighted mean and integer reconstruction map. Hypothesis: the much larger attention tensor contains near-duplicate scalars below the token failure scale, so this union preserves qualification and yields 1,650 parameters. It is more informative than the next QKV union (difference 7.086e-05) because it is the minimum-distortion test at this new site. Acceptance and rollback remain solely governed by the official runner.	0	0
attempt-0146	next-qkv-unions-at-temperature-1015	micro-0002	04d14a2f920a81f6a9fcb62e275dfcde3f5886d1	484197e8c2221d53a025bc6d39e20224dcc6633a	2026-08-17T08:04:56.528137+00:00	parameter tying	99.010000%	1649	keep	Union closest shared-QKV scalar groups 156 and 348	Family: parameter tying. Current retained frontier is 1,650 parameters at 99.010000%, a +0.010000 percentage-point margin over 99%. There have been 48 prior macro-attempts in this family and 471 prior micro-trials. The most recent accepted result is attempt-0145/micro-0002 at 1,651 parameters and 99.02%; the most recent failed result is attempt-0145/micro-0001 (temperature 1.005 discarded at 98.98%). This is a parameterization-preserving compression of the depth-shared QKV transform: union flattened coordinates 156 and 348, whose learned values are -0.1701130569 and -0.1700422019 (difference 7.086e-05), with a multiplicity-weighted mean and integer reconstruction map. Hypothesis: the much larger attention tensor contains near-duplicate scalars below the token failure scale, so this union preserves qualification and yields 1,649 parameters. It is more informative than the next QKV union (difference 7.225e-05) because it is the minimum-distortion test at this new site. Acceptance and rollback remain solely governed by the official runner.	0	0
attempt-0146	next-qkv-unions-at-temperature-1015	micro-0003	d7a85278dcddca6f7c683770350ff7b9447f6a57	04d14a2f920a81f6a9fcb62e275dfcde3f5886d1	2026-08-17T08:06:09.677548+00:00	parameter tying	99.010000%	1648	keep	Union closest shared-QKV scalar groups 207 and 470	Family: parameter tying. Current retained frontier is 1,649 parameters at 99.010000%, a +0.010000 percentage-point margin over 99%. There have been 48 prior macro-attempts in this family and 472 prior micro-trials. The most recent accepted result is attempt-0145/micro-0002 at 1,651 parameters and 99.02%; the most recent failed result is attempt-0145/micro-0001 (temperature 1.005 discarded at 98.98%). This is a parameterization-preserving compression of the depth-shared QKV transform: union flattened coordinates 207 and 470, whose learned values are 0.0125348568 and 0.0126071023 (difference 7.225e-05), with a multiplicity-weighted mean and integer reconstruction map. Hypothesis: the much larger attention tensor contains near-duplicate scalars below the token failure scale, so this union preserves qualification and yields 1,648 parameters. It is more informative than the next QKV union (difference 7.241e-05) because it is the minimum-distortion test at this new site. Acceptance and rollback remain solely governed by the official runner.	0	0
attempt-0146	next-qkv-unions-at-temperature-1015	micro-0004	5c88872db4e096c9a39b1ebb63d7a5b9da2e2014	d7a85278dcddca6f7c683770350ff7b9447f6a57	2026-08-17T08:07:18.852773+00:00	parameter tying	99.010000%	1647	keep	Union closest shared-QKV scalar groups 396 and 82	Family: parameter tying. Current retained frontier is 1,648 parameters at 99.010000%, a +0.010000 percentage-point margin over 99%. There have been 48 prior macro-attempts in this family and 473 prior micro-trials. The most recent accepted result is attempt-0145/micro-0002 at 1,651 parameters and 99.02%; the most recent failed result is attempt-0145/micro-0001 (temperature 1.005 discarded at 98.98%). This is a parameterization-preserving compression of the depth-shared QKV transform: union flattened coordinates 396 and 82, whose learned values are 0.0275407117 and 0.0276131239 (difference 7.241e-05), with a multiplicity-weighted mean and integer reconstruction map. Hypothesis: the much larger attention tensor contains near-duplicate scalars below the token failure scale, so this union preserves qualification and yields 1,647 parameters. It is more informative than the next QKV union (difference 7.394e-05) because it is the minimum-distortion test at this new site. Acceptance and rollback remain solely governed by the official runner.	0	0
attempt-0146	next-qkv-unions-at-temperature-1015	micro-0005	82eee16d2b605b886c3e6213f623871122a960f7	5c88872db4e096c9a39b1ebb63d7a5b9da2e2014	2026-08-17T08:08:42.146612+00:00	parameter tying	99.010000%	1646	keep	Union closest shared-QKV scalar groups 234 and 468	Family: parameter tying. Current retained frontier is 1,647 parameters at 99.010000%, a +0.010000 percentage-point margin over 99%. There have been 48 prior macro-attempts in this family and 474 prior micro-trials. The most recent accepted result is attempt-0145/micro-0002 at 1,651 parameters and 99.02%; the most recent failed result is attempt-0145/micro-0001 (temperature 1.005 discarded at 98.98%). This is a parameterization-preserving compression of the depth-shared QKV transform: union flattened coordinates 234 and 468, whose learned values are -0.3646740615 and -0.3646001220 (difference 7.394e-05), with a multiplicity-weighted mean and integer reconstruction map. Hypothesis: the much larger attention tensor contains near-duplicate scalars below the token failure scale, so this union preserves qualification and yields 1,646 parameters. It is more informative than the next QKV union (difference 7.401e-05) because it is the minimum-distortion test at this new site. Acceptance and rollback remain solely governed by the official runner.	0	0
attempt-0146	next-qkv-unions-at-temperature-1015	micro-0006	1a9b6efb7317f60f8e4c1b17d5ba76241cbac828	82eee16d2b605b886c3e6213f623871122a960f7	2026-08-17T08:09:57.957023+00:00	parameter tying	99.010000%	1645	keep	Union closest shared-QKV scalar groups 689 and 549	Family: parameter tying. Current retained frontier is 1,646 parameters at 99.010000%, a +0.010000 percentage-point margin over 99%. There have been 48 prior macro-attempts in this family and 475 prior micro-trials. The most recent accepted result is attempt-0145/micro-0002 at 1,651 parameters and 99.02%; the most recent failed result is attempt-0145/micro-0001 (temperature 1.005 discarded at 98.98%). This is a parameterization-preserving compression of the depth-shared QKV transform: union flattened coordinates 689 and 549, whose learned values are -0.0049687452 and -0.0048947390 (difference 7.401e-05), with a multiplicity-weighted mean and integer reconstruction map. Hypothesis: the much larger attention tensor contains near-duplicate scalars below the token failure scale, so this union preserves qualification and yields 1,645 parameters. It is more informative than the next QKV union (difference 7.404e-05) because it is the minimum-distortion test at this new site. Acceptance and rollback remain solely governed by the official runner.	0	0
attempt-0146	next-qkv-unions-at-temperature-1015	micro-0007	b5367a31f584c53953083fd76f4cc343866fce94	1a9b6efb7317f60f8e4c1b17d5ba76241cbac828	2026-08-17T08:11:11.537751+00:00	parameter tying	99.010000%	1644	keep	Union closest shared-QKV scalar groups 670 and 621	Family: parameter tying. Current retained frontier is 1,645 parameters at 99.010000%, a +0.010000 percentage-point margin over 99%. There have been 48 prior macro-attempts in this family and 476 prior micro-trials. The most recent accepted result is attempt-0145/micro-0002 at 1,651 parameters and 99.02%; the most recent failed result is attempt-0145/micro-0001 (temperature 1.005 discarded at 98.98%). This is a parameterization-preserving compression of the depth-shared QKV transform: union flattened coordinates 670 and 621, whose learned values are -0.0404962935 and -0.0404222570 (difference 7.404e-05), with a multiplicity-weighted mean and integer reconstruction map. Hypothesis: the much larger attention tensor contains near-duplicate scalars below the token failure scale, so this union preserves qualification and yields 1,644 parameters. It is more informative than the next QKV union (difference 7.426e-05) because it is the minimum-distortion test at this new site. Acceptance and rollback remain solely governed by the official runner.	0	0
