macro_attempt_id	automation_id	micro_attempt_id	commit	parent_commit	timestamp_utc	family	accuracy	parameters	status	description	proposal	train_exit	verify_exit
attempt-0146	next-qkv-unions-at-temperature-1015	micro-0008	4337e6e17f7df05a967367102a09f2a5ae162a79	b5367a31f584c53953083fd76f4cc343866fce94	2026-08-17T08:12:26.719009+00:00	parameter tying	99.010000%	1643	keep	Union closest shared-QKV scalar groups 682 and 499	Family: parameter tying. Current retained frontier is 1,644 parameters at 99.010000%, a +0.010000 percentage-point margin over 99%. There have been 48 prior macro-attempts in this family and 477 prior micro-trials. The most recent accepted result is attempt-0145/micro-0002 at 1,651 parameters and 99.02%; the most recent failed result is attempt-0145/micro-0001 (temperature 1.005 discarded at 98.98%). This is a parameterization-preserving compression of the depth-shared QKV transform: union flattened coordinates 682 and 499, whose learned values are 0.0330172218 and 0.0330914855 (difference 7.426e-05), with a multiplicity-weighted mean and integer reconstruction map. Hypothesis: the much larger attention tensor contains near-duplicate scalars below the token failure scale, so this union preserves qualification and yields 1,643 parameters. It is more informative than the next QKV union (difference 7.479e-05) because it is the minimum-distortion test at this new site. Acceptance and rollback remain solely governed by the official runner.	0	0
attempt-0146	next-qkv-unions-at-temperature-1015	micro-0009	cac00b2e49141a0214d536191119a5180efbd57b	4337e6e17f7df05a967367102a09f2a5ae162a79	2026-08-17T08:13:39.993216+00:00	parameter tying	99.020000%	1642	keep	Union closest shared-QKV scalar groups 740 and 529	Family: parameter tying. Current retained frontier is 1,643 parameters at 99.010000%, a +0.010000 percentage-point margin over 99%. There have been 48 prior macro-attempts in this family and 478 prior micro-trials. The most recent accepted result is attempt-0145/micro-0002 at 1,651 parameters and 99.02%; the most recent failed result is attempt-0145/micro-0001 (temperature 1.005 discarded at 98.98%). This is a parameterization-preserving compression of the depth-shared QKV transform: union flattened coordinates 740 and 529, whose learned values are 0.0084284069 and 0.0085031940 (difference 7.479e-05), with a multiplicity-weighted mean and integer reconstruction map. Hypothesis: the much larger attention tensor contains near-duplicate scalars below the token failure scale, so this union preserves qualification and yields 1,642 parameters. It is more informative than the next QKV union (difference 7.533e-05) because it is the minimum-distortion test at this new site. Acceptance and rollback remain solely governed by the official runner.	0	0
attempt-0146	next-qkv-unions-at-temperature-1015	micro-0010	79818de51350caba7702dfc95295207d574ac18e	cac00b2e49141a0214d536191119a5180efbd57b	2026-08-17T08:14:52.891542+00:00	parameter tying	99.020000%	1641	keep	Union closest shared-QKV scalar groups 346 and 419	Family: parameter tying. Current retained frontier is 1,642 parameters at 99.020000%, a +0.020000 percentage-point margin over 99%. There have been 48 prior macro-attempts in this family and 479 prior micro-trials. The most recent accepted result is attempt-0145/micro-0002 at 1,651 parameters and 99.02%; the most recent failed result is attempt-0145/micro-0001 (temperature 1.005 discarded at 98.98%). This is a parameterization-preserving compression of the depth-shared QKV transform: union flattened coordinates 346 and 419, whose learned values are 0.0881959051 and 0.0882712305 (difference 7.533e-05), with a multiplicity-weighted mean and integer reconstruction map. Hypothesis: the much larger attention tensor contains near-duplicate scalars below the token failure scale, so this union preserves qualification and yields 1,641 parameters. It is more informative than the next QKV union (difference 7.699e-05) because it is the minimum-distortion test at this new site. Acceptance and rollback remain solely governed by the official runner.	0	0
attempt-0146	next-qkv-unions-at-temperature-1015	micro-0011	462c6c42e25b52b5c63baa6f55133167cf5e9205	79818de51350caba7702dfc95295207d574ac18e	2026-08-17T08:16:06.687350+00:00	parameter tying	99.000000%	1640	keep	Union closest shared-QKV scalar groups 614 and 756	Family: parameter tying. Current retained frontier is 1,641 parameters at 99.020000%, a +0.020000 percentage-point margin over 99%. There have been 48 prior macro-attempts in this family and 480 prior micro-trials. The most recent accepted result is attempt-0145/micro-0002 at 1,651 parameters and 99.02%; the most recent failed result is attempt-0145/micro-0001 (temperature 1.005 discarded at 98.98%). This is a parameterization-preserving compression of the depth-shared QKV transform: union flattened coordinates 614 and 756, whose learned values are 0.0047282530 and 0.0048052464 (difference 7.699e-05), with a multiplicity-weighted mean and integer reconstruction map. Hypothesis: the much larger attention tensor contains near-duplicate scalars below the token failure scale, so this union preserves qualification and yields 1,640 parameters. It is more informative than the next QKV union (difference 7.761e-05) because it is the minimum-distortion test at this new site. Acceptance and rollback remain solely governed by the official runner.	0	0
attempt-0146	next-qkv-unions-at-temperature-1015	micro-0012	9fa29d2295f6893661c07ccb9c7dc9acf4b2fadf	462c6c42e25b52b5c63baa6f55133167cf5e9205	2026-08-17T08:17:19.619204+00:00	parameter tying	98.990000%	1639	discard	Union closest shared-QKV scalar groups 608 and 539	Family: parameter tying. Current retained frontier is 1,640 parameters at 99.000000%, a +0.000000 percentage-point margin over 99%. There have been 48 prior macro-attempts in this family and 481 prior micro-trials. The most recent accepted result is attempt-0145/micro-0002 at 1,651 parameters and 99.02%; the most recent failed result is attempt-0145/micro-0001 (temperature 1.005 discarded at 98.98%). This is a parameterization-preserving compression of the depth-shared QKV transform: union flattened coordinates 608 and 539, whose learned values are 0.0139486054 and 0.0140262134 (difference 7.761e-05), with a multiplicity-weighted mean and integer reconstruction map. Hypothesis: the much larger attention tensor contains near-duplicate scalars below the token failure scale, so this union preserves qualification and yields 1,639 parameters. It is more informative than the next QKV union (difference 7.888e-05) because it is the minimum-distortion test at this new site. Acceptance and rollback remain solely governed by the official runner.	0	0
attempt-0147	qkv-608-539-temperature-calibration	micro-0001	762c2e222c320d0dddada588923fda398f7cfc81	462c6c42e25b52b5c63baa6f55133167cf5e9205	2026-08-17T08:19:52.422211+00:00	attention organization	98.950000%	1639	discard	Use temperature 1.0125 with QKV union 608/539	Family: attention organization. Current retained frontier is 1,640 parameters at 99.000000%, exactly threshold. There have been 19 prior macro-attempts and 0 prior micro-trials in this policy. The most recent accepted result is attempt-0146/micro-0011 at 1,640/99.00%; the most recent failed result is attempt-0146/micro-0012, where QKV pair 608/539 scored 98.99% at 1,639 with temperature 1.015. Test the identical pair at absolute multiplier 1.0125. This is more informative than the next scheduled temperature because it is the smallest remaining deviation around 1.015. Official acceptance/rollback is unchanged; acceptance exhausts equal-count eligibility.	0	0
attempt-0147	qkv-608-539-temperature-calibration	micro-0002	16f3a8f755641d1bba5a44eeca30cb8413b66a8e	462c6c42e25b52b5c63baa6f55133167cf5e9205	2026-08-17T08:21:04.177197+00:00	attention organization	98.990000%	1639	discard	Use temperature 1.0175 with QKV union 608/539	Family: attention organization. Current retained frontier is 1,640 parameters at 99.000000%, exactly threshold. There have been 19 prior macro-attempts and 1 prior micro-trials in this policy. The most recent accepted result is attempt-0146/micro-0011 at 1,640/99.00%; the most recent failed result is attempt-0146/micro-0012, where QKV pair 608/539 scored 98.99% at 1,639 with temperature 1.015. Test the identical pair at absolute multiplier 1.0175. This is more informative than the next scheduled temperature because it is the smallest remaining deviation around 1.015. Official acceptance/rollback is unchanged; acceptance exhausts equal-count eligibility.	0	0
attempt-0147	qkv-608-539-temperature-calibration	micro-0003	2e676f11e3db61fc4975ca5de65a4cff2dea2299	462c6c42e25b52b5c63baa6f55133167cf5e9205	2026-08-17T08:22:16.001674+00:00	attention organization	98.950000%	1639	discard	Use temperature 1.01 with QKV union 608/539	Family: attention organization. Current retained frontier is 1,640 parameters at 99.000000%, exactly threshold. There have been 19 prior macro-attempts and 2 prior micro-trials in this policy. The most recent accepted result is attempt-0146/micro-0011 at 1,640/99.00%; the most recent failed result is attempt-0146/micro-0012, where QKV pair 608/539 scored 98.99% at 1,639 with temperature 1.015. Test the identical pair at absolute multiplier 1.01. This is more informative than the next scheduled temperature because it is the smallest remaining deviation around 1.015. Official acceptance/rollback is unchanged; acceptance exhausts equal-count eligibility.	0	0
attempt-0147	qkv-608-539-temperature-calibration	micro-0004	13d147ca682fb7b1b89dbc0368971701d1a2bb72	462c6c42e25b52b5c63baa6f55133167cf5e9205	2026-08-17T08:23:27.531055+00:00	attention organization	98.990000%	1639	discard	Use temperature 1.02 with QKV union 608/539	Family: attention organization. Current retained frontier is 1,640 parameters at 99.000000%, exactly threshold. There have been 19 prior macro-attempts and 3 prior micro-trials in this policy. The most recent accepted result is attempt-0146/micro-0011 at 1,640/99.00%; the most recent failed result is attempt-0146/micro-0012, where QKV pair 608/539 scored 98.99% at 1,639 with temperature 1.015. Test the identical pair at absolute multiplier 1.02. This is more informative than the next scheduled temperature because it is the smallest remaining deviation around 1.015. Official acceptance/rollback is unchanged; acceptance exhausts equal-count eligibility.	0	0
attempt-0147	qkv-608-539-temperature-calibration	micro-0005	1d1f8da0c64aa85a09dc58b86623b769099ebb7b	462c6c42e25b52b5c63baa6f55133167cf5e9205	2026-08-17T08:24:40.517177+00:00	attention organization	98.950000%	1639	discard	Use temperature 1.005 with QKV union 608/539	Family: attention organization. Current retained frontier is 1,640 parameters at 99.000000%, exactly threshold. There have been 19 prior macro-attempts and 4 prior micro-trials in this policy. The most recent accepted result is attempt-0146/micro-0011 at 1,640/99.00%; the most recent failed result is attempt-0146/micro-0012, where QKV pair 608/539 scored 98.99% at 1,639 with temperature 1.015. Test the identical pair at absolute multiplier 1.005. This is more informative than the next scheduled temperature because it is the smallest remaining deviation around 1.015. Official acceptance/rollback is unchanged; acceptance exhausts equal-count eligibility.	0	0
attempt-0147	qkv-608-539-temperature-calibration	micro-0006	45eea94ac5b51538a0759588e329b8018c1ecce2	462c6c42e25b52b5c63baa6f55133167cf5e9205	2026-08-17T08:25:52.382488+00:00	attention organization	98.920000%	1639	discard	Use temperature 1.025 with QKV union 608/539	Family: attention organization. Current retained frontier is 1,640 parameters at 99.000000%, exactly threshold. There have been 19 prior macro-attempts and 5 prior micro-trials in this policy. The most recent accepted result is attempt-0146/micro-0011 at 1,640/99.00%; the most recent failed result is attempt-0146/micro-0012, where QKV pair 608/539 scored 98.99% at 1,639 with temperature 1.015. Test the identical pair at absolute multiplier 1.025. This is more informative than the next scheduled temperature because it is the smallest remaining deviation around 1.015. Official acceptance/rollback is unchanged; acceptance exhausts equal-count eligibility.	0	0
attempt-0148	ff-output-after-attention-calibration	micro-0001	0dd043679b7b35ae1ee0744df4cf91f76bdfab92	462c6c42e25b52b5c63baa6f55133167cf5e9205	2026-08-17T08:28:24.625313+00:00	parameter tying	98.950000%	1639	discard	Union closest shared FF-output scalar groups 143 and 100	Family: parameter tying. Current retained frontier is 1,640 parameters at 99.000000%, a +0.000000 percentage-point margin over 99%. There have been 49 prior macro-attempts in this family and 482 prior micro-trials. The most recent accepted result is attempt-0146/micro-0011 at 1,640 parameters and 99.00%; the most recent failed result is attempt-0140/micro-0001 (pair 143/100 discarded at 98.97% before attention recalibration). This is a parameterization-preserving compression of the depth-shared feed-forward output map: union flattened coordinates 143 and 100, values -0.0714483783 and -0.0713087097 (difference 1.397e-04), using a weighted mean and integer reconstruction. Hypothesis: residual-stream reconstruction contains near-duplicate scalars distinct from FF-input redundancy, preserving qualification at 1,639 parameters. It is more informative than the next FF-output union (difference 1.613e-04) because it is the minimum-distortion isolated test of the complementary FF map. Official acceptance and rollback are unchanged.	0	0
attempt-0149	qkv-after-two-sensitive-pairs	micro-0001	c939fdb7fbe52fae0f26b413aaef70bacb28916d	462c6c42e25b52b5c63baa6f55133167cf5e9205	2026-08-17T08:30:28.530078+00:00	parameter tying	98.990000%	1639	discard	Union closest shared-QKV scalar groups 608 and 539	Family: parameter tying. Current retained frontier is 1,640 parameters at 99.000000%, a +0.000000 percentage-point margin over 99%. There have been 50 prior macro-attempts in this family and 483 prior micro-trials. The most recent accepted result is attempt-0146/micro-0011 at 1,640 parameters and 99.00%; the most recent failed result is attempt-0147/micro-0006 (QKV pair 608/539 discarded at 98.92%). This is a parameterization-preserving compression of the depth-shared QKV transform: union flattened coordinates 608 and 539, whose learned values are 0.0139486054 and 0.0140262134 (difference 7.761e-05), with a multiplicity-weighted mean and integer reconstruction map. Hypothesis: the much larger attention tensor contains near-duplicate scalars below the token failure scale, so this union preserves qualification and yields 1,639 parameters. It is more informative than the next QKV union (difference 7.888e-05) because it is the minimum-distortion test at this new site. Acceptance and rollback remain solely governed by the official runner.	0	0
attempt-0150	repair-qkv-sensitive-pair-filter	micro-0001	738e9987e78a614aa386bd51f9ff1ae83c5b61c0	462c6c42e25b52b5c63baa6f55133167cf5e9205	2026-08-17T08:32:55.465890+00:00	parameter tying	98.970000%	1639	discard	Union closest shared-QKV scalar groups 766 and 708	Family: parameter tying. Current retained frontier is 1,640 parameters at 99.000000%, a +0.000000 percentage-point margin over 99%. There have been 50 prior macro-attempts in this family and 483 prior micro-trials. The most recent accepted result is attempt-0146/micro-0011 at 1,640 parameters and 99.00%; the most recent failed result is attempt-0147/micro-0006 (QKV pair 608/539 discarded at 98.92%). This is a parameterization-preserving compression of the depth-shared QKV transform: union flattened coordinates 766 and 708, whose learned values are -0.0056972466 and -0.0056183636 (difference 7.888e-05), with a multiplicity-weighted mean and integer reconstruction map. Hypothesis: the much larger attention tensor contains near-duplicate scalars below the token failure scale, so this union preserves qualification and yields 1,639 parameters. It is more informative than the next QKV union (difference 7.929e-05) because it is the minimum-distortion test at this new site. Acceptance and rollback remain solely governed by the official runner.	0	0
attempt-0155	qkv-after-three-sensitive-pairs	micro-0001	db610ca4aaa64dc28219aa2cb651cbc6cb13d242	462c6c42e25b52b5c63baa6f55133167cf5e9205	2026-08-17T08:45:41.387231+00:00	parameter tying	99.000000%	1639	keep	Union closest shared-QKV scalar groups 650 and 50	Family: parameter tying. Current retained frontier is 1,640 parameters at 99.000000%, a +0.000000 percentage-point margin over 99%. There have been 52 prior macro-attempts in this family and 485 prior micro-trials. The most recent accepted result is attempt-0146/micro-0011 at 1,640 parameters and 99.00%; the most recent failed result is attempt-0150/micro-0001 (QKV pair 766/708 discarded at 98.97%). This is a parameterization-preserving compression of the depth-shared QKV transform: union flattened coordinates 650 and 50, whose learned values are 0.0052673221 and 0.0053466093 (difference 7.929e-05), with a multiplicity-weighted mean and integer reconstruction map. Hypothesis: the much larger attention tensor contains near-duplicate scalars below the token failure scale, so this union preserves qualification and yields 1,639 parameters. It is more informative than the next QKV union (difference 8.027e-05) because it is the minimum-distortion test at this new site. Acceptance and rollback remain solely governed by the official runner.	0	0
attempt-0155	qkv-after-three-sensitive-pairs	micro-0002	dc0226c5a542c3f8fa298fbab3bf02e1074bb724	db610ca4aaa64dc28219aa2cb651cbc6cb13d242	2026-08-17T08:47:04.288581+00:00	parameter tying	98.950000%	1638	discard	Union closest shared-QKV scalar groups 597 and 734	Family: parameter tying. Current retained frontier is 1,639 parameters at 99.000000%, a +0.000000 percentage-point margin over 99%. There have been 52 prior macro-attempts in this family and 486 prior micro-trials. The most recent accepted result is attempt-0146/micro-0011 at 1,640 parameters and 99.00%; the most recent failed result is attempt-0150/micro-0001 (QKV pair 766/708 discarded at 98.97%). This is a parameterization-preserving compression of the depth-shared QKV transform: union flattened coordinates 597 and 734, whose learned values are -0.0015583691 and -0.0014780960 (difference 8.027e-05), with a multiplicity-weighted mean and integer reconstruction map. Hypothesis: the much larger attention tensor contains near-duplicate scalars below the token failure scale, so this union preserves qualification and yields 1,638 parameters. It is more informative than the next QKV union (difference 8.197e-05) because it is the minimum-distortion test at this new site. Acceptance and rollback remain solely governed by the official runner.	0	0
attempt-0156	qkv-skip-four-sensitive-pairs	micro-0001	12232ed712aaaccbcc69035739279b2acce3fa28	db610ca4aaa64dc28219aa2cb651cbc6cb13d242	2026-08-17T08:49:05.558747+00:00	parameter tying	98.990000%	1638	discard	Union closest shared-QKV scalar groups 672 and 271	Family: parameter tying. Current retained frontier is 1,639 parameters at 99.000000%, a +0.000000 percentage-point margin over 99%. There have been 53 prior macro-attempts in this family and 487 prior micro-trials. The most recent accepted result is attempt-0155/micro-0001 at 1,639 parameters and 99.00%; the most recent failed result is attempt-0155/micro-0002 (QKV pair 597/734 discarded at 98.95%). This is a parameterization-preserving compression of the depth-shared QKV transform: union flattened coordinates 672 and 271, whose learned values are 0.1473598778 and 0.1474418491 (difference 8.197e-05), with a multiplicity-weighted mean and integer reconstruction map. Hypothesis: the much larger attention tensor contains near-duplicate scalars below the token failure scale, so this union preserves qualification and yields 1,638 parameters. It is more informative than the next QKV union (difference 8.205e-05) because it is the minimum-distortion test at this new site. Acceptance and rollback remain solely governed by the official runner.	0	0
attempt-0157	qkv-skip-five-sensitive-pairs	micro-0001	98f23e74adad05b5f8dc39b2cf674e4f08039fb6	db610ca4aaa64dc28219aa2cb651cbc6cb13d242	2026-08-17T08:50:52.790076+00:00	parameter tying	99.000000%	1638	keep	Union closest shared-QKV scalar groups 544 and 197	Family: parameter tying. Current retained frontier is 1,639 parameters at 99.000000%, a +0.000000 percentage-point margin over 99%. There have been 54 prior macro-attempts in this family and 488 prior micro-trials. The most recent accepted result is attempt-0155/micro-0001 at 1,639 parameters and 99.00%; the most recent failed result is attempt-0156/micro-0001 (QKV pair 672/271 discarded at 98.99%). This is a parameterization-preserving compression of the depth-shared QKV transform: union flattened coordinates 544 and 197, whose learned values are 0.0977367908 and 0.0978188366 (difference 8.205e-05), with a multiplicity-weighted mean and integer reconstruction map. Hypothesis: the much larger attention tensor contains near-duplicate scalars below the token failure scale, so this union preserves qualification and yields 1,638 parameters. It is more informative than the next QKV union (difference 8.255e-05) because it is the minimum-distortion test at this new site. Acceptance and rollback remain solely governed by the official runner.	0	0
