macro_attempt_id	automation_id	micro_attempt_id	commit	parent_commit	timestamp_utc	family	accuracy	parameters	status	description	proposal	train_exit	verify_exit
attempt-0087	next-shared-ff-output-union-band	micro-0001	684fd5c2ca674d6d04e9d861293756001d5dccfa	2753ce4cf4b2ae0a180c09885939688102954562	2026-08-17T04:33:00.791209+00:00	parameter tying	99.020000%	1703	keep	Union closest shared FF-output scalar groups 216 and 17	Family: parameter tying. Current retained frontier is 1,704 parameters at 99.010000%, a +0.010000 percentage-point margin over 99%. There have been 29 prior macro-attempts in this family and 407 prior micro-trials. The most recent accepted result is attempt-0085/micro-0020 at 1704 parameters and 99.010000%; the most recent failed result is attempt-0086/micro-0001 (discard, 3.820000%). This is a parameterization-preserving compression of the depth-shared feed-forward output map: union flattened coordinates 216 and 17, values 0.0384634472 and 0.0385649800 (difference 1.015e-04), using a weighted mean and integer reconstruction. Hypothesis: residual-stream reconstruction contains near-duplicate scalars distinct from FF-input redundancy, preserving qualification at 1,703 parameters. It is more informative than the next FF-output union (difference 1.105e-04) because it is the minimum-distortion isolated test of the complementary FF map. Official acceptance and rollback are unchanged.	0	0
attempt-0087	next-shared-ff-output-union-band	micro-0002	978642039afdf0de6b02cc6db0b7334a490839ad	684fd5c2ca674d6d04e9d861293756001d5dccfa	2026-08-17T04:34:08.279555+00:00	parameter tying	99.010000%	1702	keep	Union closest shared FF-output scalar groups 151 and 240	Family: parameter tying. Current retained frontier is 1,703 parameters at 99.020000%, a +0.020000 percentage-point margin over 99%. There have been 29 prior macro-attempts in this family and 408 prior micro-trials. The most recent accepted result is attempt-0087/micro-0001 at 1703 parameters and 99.020000%; the most recent failed result is attempt-0086/micro-0001 (discard, 3.820000%). This is a parameterization-preserving compression of the depth-shared feed-forward output map: union flattened coordinates 151 and 240, values 0.0027043121 and 0.0028148380 (difference 1.105e-04), using a weighted mean and integer reconstruction. Hypothesis: residual-stream reconstruction contains near-duplicate scalars distinct from FF-input redundancy, preserving qualification at 1,702 parameters. It is more informative than the next FF-output union (difference 1.121e-04) because it is the minimum-distortion isolated test of the complementary FF map. Official acceptance and rollback are unchanged.	0	0
attempt-0087	next-shared-ff-output-union-band	micro-0003	6740213b17a07aec6a51f6c36ccaad254c19d5ac	978642039afdf0de6b02cc6db0b7334a490839ad	2026-08-17T04:35:15.438106+00:00	parameter tying	99.020000%	1701	keep	Union closest shared FF-output scalar groups 49 and 20	Family: parameter tying. Current retained frontier is 1,702 parameters at 99.010000%, a +0.010000 percentage-point margin over 99%. There have been 29 prior macro-attempts in this family and 409 prior micro-trials. The most recent accepted result is attempt-0087/micro-0002 at 1702 parameters and 99.010000%; the most recent failed result is attempt-0086/micro-0001 (discard, 3.820000%). This is a parameterization-preserving compression of the depth-shared feed-forward output map: union flattened coordinates 49 and 20, values 0.0388002284 and 0.0389123075 (difference 1.121e-04), using a weighted mean and integer reconstruction. Hypothesis: residual-stream reconstruction contains near-duplicate scalars distinct from FF-input redundancy, preserving qualification at 1,701 parameters. It is more informative than the next FF-output union (difference 1.158e-04) because it is the minimum-distortion isolated test of the complementary FF map. Official acceptance and rollback are unchanged.	0	0
attempt-0087	next-shared-ff-output-union-band	micro-0004	a65223739c9a3ac4af44deaf6c9c5d989b20291d	6740213b17a07aec6a51f6c36ccaad254c19d5ac	2026-08-17T04:36:22.458496+00:00	parameter tying	99.030000%	1700	keep	Union closest shared FF-output scalar groups 90 and 67	Family: parameter tying. Current retained frontier is 1,701 parameters at 99.020000%, a +0.020000 percentage-point margin over 99%. There have been 29 prior macro-attempts in this family and 410 prior micro-trials. The most recent accepted result is attempt-0087/micro-0003 at 1701 parameters and 99.020000%; the most recent failed result is attempt-0086/micro-0001 (discard, 3.820000%). This is a parameterization-preserving compression of the depth-shared feed-forward output map: union flattened coordinates 90 and 67, values 0.0039254921 and 0.0040412587 (difference 1.158e-04), using a weighted mean and integer reconstruction. Hypothesis: residual-stream reconstruction contains near-duplicate scalars distinct from FF-input redundancy, preserving qualification at 1,700 parameters. It is more informative than the next FF-output union (difference 1.169e-04) because it is the minimum-distortion isolated test of the complementary FF map. Official acceptance and rollback are unchanged.	0	0
attempt-0087	next-shared-ff-output-union-band	micro-0005	dfe9e7de6b3c906f98a4e405fd3dc182438bd544	a65223739c9a3ac4af44deaf6c9c5d989b20291d	2026-08-17T04:37:29.636229+00:00	parameter tying	99.030000%	1699	keep	Union closest shared FF-output scalar groups 95 and 52	Family: parameter tying. Current retained frontier is 1,700 parameters at 99.030000%, a +0.030000 percentage-point margin over 99%. There have been 29 prior macro-attempts in this family and 411 prior micro-trials. The most recent accepted result is attempt-0087/micro-0004 at 1700 parameters and 99.030000%; the most recent failed result is attempt-0086/micro-0001 (discard, 3.820000%). This is a parameterization-preserving compression of the depth-shared feed-forward output map: union flattened coordinates 95 and 52, values -0.0073389588 and -0.0072220834 (difference 1.169e-04), using a weighted mean and integer reconstruction. Hypothesis: residual-stream reconstruction contains near-duplicate scalars distinct from FF-input redundancy, preserving qualification at 1,699 parameters. It is more informative than the next FF-output union (difference 1.223e-04) because it is the minimum-distortion isolated test of the complementary FF map. Official acceptance and rollback are unchanged.	0	0
attempt-0087	next-shared-ff-output-union-band	micro-0006	87525330ad14b996b90d90d2f4bdaab30bc099cb	dfe9e7de6b3c906f98a4e405fd3dc182438bd544	2026-08-17T04:38:37.619565+00:00	parameter tying	99.020000%	1698	keep	Union closest shared FF-output scalar groups 204 and 58	Family: parameter tying. Current retained frontier is 1,699 parameters at 99.030000%, a +0.030000 percentage-point margin over 99%. There have been 29 prior macro-attempts in this family and 412 prior micro-trials. The most recent accepted result is attempt-0087/micro-0005 at 1699 parameters and 99.030000%; the most recent failed result is attempt-0086/micro-0001 (discard, 3.820000%). This is a parameterization-preserving compression of the depth-shared feed-forward output map: union flattened coordinates 204 and 58, values 0.0001264432 and 0.0002487245 (difference 1.223e-04), using a weighted mean and integer reconstruction. Hypothesis: residual-stream reconstruction contains near-duplicate scalars distinct from FF-input redundancy, preserving qualification at 1,698 parameters. It is more informative than the next FF-output union (difference 1.243e-04) because it is the minimum-distortion isolated test of the complementary FF map. Official acceptance and rollback are unchanged.	0	0
attempt-0087	next-shared-ff-output-union-band	micro-0007	73fb80603eec0f35e9e4452b80e34e1349fa6113	87525330ad14b996b90d90d2f4bdaab30bc099cb	2026-08-17T04:39:45.271809+00:00	parameter tying	99.000000%	1697	keep	Union closest shared FF-output scalar groups 238 and 175	Family: parameter tying. Current retained frontier is 1,698 parameters at 99.020000%, a +0.020000 percentage-point margin over 99%. There have been 29 prior macro-attempts in this family and 413 prior micro-trials. The most recent accepted result is attempt-0087/micro-0006 at 1698 parameters and 99.020000%; the most recent failed result is attempt-0086/micro-0001 (discard, 3.820000%). This is a parameterization-preserving compression of the depth-shared feed-forward output map: union flattened coordinates 238 and 175, values 0.1062588394 and 0.1063831747 (difference 1.243e-04), using a weighted mean and integer reconstruction. Hypothesis: residual-stream reconstruction contains near-duplicate scalars distinct from FF-input redundancy, preserving qualification at 1,697 parameters. It is more informative than the next FF-output union (difference 1.260e-04) because it is the minimum-distortion isolated test of the complementary FF map. Official acceptance and rollback are unchanged.	0	0
attempt-0087	next-shared-ff-output-union-band	micro-0008	59535d858f8a12c1029cdbfb057b16e88d843c03	73fb80603eec0f35e9e4452b80e34e1349fa6113	2026-08-17T04:40:59.498472+00:00	parameter tying	99.010000%	1696	keep	Union closest shared FF-output scalar groups 0 and 219	Family: parameter tying. Current retained frontier is 1,697 parameters at 99.000000%, a +0.000000 percentage-point margin over 99%. There have been 29 prior macro-attempts in this family and 414 prior micro-trials. The most recent accepted result is attempt-0087/micro-0007 at 1697 parameters and 99.000000%; the most recent failed result is attempt-0086/micro-0001 (discard, 3.820000%). This is a parameterization-preserving compression of the depth-shared feed-forward output map: union flattened coordinates 0 and 219, values 0.0558532812 and 0.0559793264 (difference 1.260e-04), using a weighted mean and integer reconstruction. Hypothesis: residual-stream reconstruction contains near-duplicate scalars distinct from FF-input redundancy, preserving qualification at 1,696 parameters. It is more informative than the next FF-output union (difference 1.263e-04) because it is the minimum-distortion isolated test of the complementary FF map. Official acceptance and rollback are unchanged.	0	0
attempt-0087	next-shared-ff-output-union-band	micro-0009	28e517b2dcd2a7d2fa7f9b474399079bf38b15b2	59535d858f8a12c1029cdbfb057b16e88d843c03	2026-08-17T04:42:18.125686+00:00	parameter tying	99.030000%	1695	keep	Union closest shared FF-output scalar groups 108 and 165	Family: parameter tying. Current retained frontier is 1,696 parameters at 99.010000%, a +0.010000 percentage-point margin over 99%. There have been 29 prior macro-attempts in this family and 415 prior micro-trials. The most recent accepted result is attempt-0087/micro-0008 at 1696 parameters and 99.010000%; the most recent failed result is attempt-0086/micro-0001 (discard, 3.820000%). This is a parameterization-preserving compression of the depth-shared feed-forward output map: union flattened coordinates 108 and 165, values -0.0892156363 and -0.0890892968 (difference 1.263e-04), using a weighted mean and integer reconstruction. Hypothesis: residual-stream reconstruction contains near-duplicate scalars distinct from FF-input redundancy, preserving qualification at 1,695 parameters. It is more informative than the next FF-output union (difference 1.397e-04) because it is the minimum-distortion isolated test of the complementary FF map. Official acceptance and rollback are unchanged.	0	0
attempt-0087	next-shared-ff-output-union-band	micro-0010	aa642c84efc9c52b7b6322781e2d649b8a9c242d	28e517b2dcd2a7d2fa7f9b474399079bf38b15b2	2026-08-17T04:43:28.472501+00:00	parameter tying	98.990000%	1694	discard	Union closest shared FF-output scalar groups 143 and 100	Family: parameter tying. Current retained frontier is 1,695 parameters at 99.030000%, a +0.030000 percentage-point margin over 99%. There have been 29 prior macro-attempts in this family and 416 prior micro-trials. The most recent accepted result is attempt-0087/micro-0009 at 1695 parameters and 99.030000%; the most recent failed result is attempt-0086/micro-0001 (discard, 3.820000%). This is a parameterization-preserving compression of the depth-shared feed-forward output map: union flattened coordinates 143 and 100, values -0.0714483783 and -0.0713087097 (difference 1.397e-04), using a weighted mean and integer reconstruction. Hypothesis: residual-stream reconstruction contains near-duplicate scalars distinct from FF-input redundancy, preserving qualification at 1,694 parameters. It is more informative than the next FF-output union (difference 1.454e-04) because it is the minimum-distortion isolated test of the complementary FF map. Official acceptance and rollback are unchanged.	0	0
attempt-0088	third-shared-qkv-union-band	micro-0001	e780cbc9d925e9aa6a88d0b64617356c3f73a67f	28e517b2dcd2a7d2fa7f9b474399079bf38b15b2	2026-08-17T04:44:14.599086+00:00	parameter tying			error	Union closest shared-QKV scalar groups 633 and 422	Family: parameter tying. Current retained frontier is 1,695 parameters at 99.030000%, a +0.030000 percentage-point margin over 99%. There have been 30 prior macro-attempts in this family and 417 prior micro-trials. The most recent accepted result is attempt-0087/micro-0009 at 1695 parameters and 99.030000%; the most recent failed result is attempt-0087/micro-0010 (discard, 98.990000%). This is a parameterization-preserving compression of the depth-shared QKV transform: union flattened coordinates 633 and 422, whose learned values are 0.0216701645 and 0.0217130948 (difference 4.293e-05), with a multiplicity-weighted mean and integer reconstruction map. Hypothesis: the much larger attention tensor contains near-duplicate scalars below the token failure scale, so this union preserves qualification and yields 1,694 parameters. It is more informative than the next QKV union (difference 4.321e-05) because it is the minimum-distortion test at this new site. Acceptance and rollback remain solely governed by the official runner.	1	
attempt-0089	third-shared-qkv-union-band-repair	micro-0001	c56510c83a3fb5aff3176a205b286a46eab1893b	28e517b2dcd2a7d2fa7f9b474399079bf38b15b2	2026-08-17T04:46:21.133092+00:00	parameter tying	99.030000%	1694	keep	Union closest shared-QKV scalar groups 633 and 422	Family: parameter tying. Current retained frontier is 1,695 parameters at 99.030000%, a +0.030000 percentage-point margin over 99%. There have been 31 prior macro-attempts in this family and 418 prior micro-trials. The most recent accepted result is attempt-0087/micro-0009 at 1695 parameters and 99.030000%; the most recent failed result is attempt-0088/micro-0001 (error, no score). This is a parameterization-preserving compression of the depth-shared QKV transform: union flattened coordinates 633 and 422, whose learned values are 0.0216701645 and 0.0217130948 (difference 4.293e-05), with a multiplicity-weighted mean and integer reconstruction map. Hypothesis: the much larger attention tensor contains near-duplicate scalars below the token failure scale, so this union preserves qualification and yields 1,694 parameters. It is more informative than the next QKV union (difference 4.321e-05) because it is the minimum-distortion test at this new site. Acceptance and rollback remain solely governed by the official runner.	0	0
attempt-0089	third-shared-qkv-union-band-repair	micro-0002	53e7a9315663aac4609a8d402a657ccaf0c438d3	c56510c83a3fb5aff3176a205b286a46eab1893b	2026-08-17T04:47:33.149746+00:00	parameter tying	99.030000%	1693	keep	Union closest shared-QKV scalar groups 557 and 499	Family: parameter tying. Current retained frontier is 1,694 parameters at 99.030000%, a +0.030000 percentage-point margin over 99%. There have been 31 prior macro-attempts in this family and 419 prior micro-trials. The most recent accepted result is attempt-0089/micro-0001 at 1694 parameters and 99.030000%; the most recent failed result is attempt-0088/micro-0001 (error, no score). This is a parameterization-preserving compression of the depth-shared QKV transform: union flattened coordinates 557 and 499, whose learned values are 0.0330698788 and 0.0331130922 (difference 4.321e-05), with a multiplicity-weighted mean and integer reconstruction map. Hypothesis: the much larger attention tensor contains near-duplicate scalars below the token failure scale, so this union preserves qualification and yields 1,693 parameters. It is more informative than the next QKV union (difference 4.325e-05) because it is the minimum-distortion test at this new site. Acceptance and rollback remain solely governed by the official runner.	0	0
attempt-0089	third-shared-qkv-union-band-repair	micro-0003	c040ad60c7bfa4e6eac84cabd86107c98aea08d6	53e7a9315663aac4609a8d402a657ccaf0c438d3	2026-08-17T04:48:48.647488+00:00	parameter tying	99.030000%	1692	keep	Union closest shared-QKV scalar groups 454 and 527	Family: parameter tying. Current retained frontier is 1,693 parameters at 99.030000%, a +0.030000 percentage-point margin over 99%. There have been 31 prior macro-attempts in this family and 420 prior micro-trials. The most recent accepted result is attempt-0089/micro-0002 at 1693 parameters and 99.030000%; the most recent failed result is attempt-0088/micro-0001 (error, no score). This is a parameterization-preserving compression of the depth-shared QKV transform: union flattened coordinates 454 and 527, whose learned values are -0.0239274409 and -0.0238841884 (difference 4.325e-05), with a multiplicity-weighted mean and integer reconstruction map. Hypothesis: the much larger attention tensor contains near-duplicate scalars below the token failure scale, so this union preserves qualification and yields 1,692 parameters. It is more informative than the next QKV union (difference 4.343e-05) because it is the minimum-distortion test at this new site. Acceptance and rollback remain solely governed by the official runner.	0	0
attempt-0089	third-shared-qkv-union-band-repair	micro-0004	0763455d55a83320d1bbe6539dd743e137209662	c040ad60c7bfa4e6eac84cabd86107c98aea08d6	2026-08-17T04:49:57.653692+00:00	parameter tying	99.010000%	1691	keep	Union closest shared-QKV scalar groups 565 and 628	Family: parameter tying. Current retained frontier is 1,692 parameters at 99.030000%, a +0.030000 percentage-point margin over 99%. There have been 31 prior macro-attempts in this family and 421 prior micro-trials. The most recent accepted result is attempt-0089/micro-0003 at 1692 parameters and 99.030000%; the most recent failed result is attempt-0088/micro-0001 (error, no score). This is a parameterization-preserving compression of the depth-shared QKV transform: union flattened coordinates 565 and 628, whose learned values are 0.0007320711 and 0.0007755018 (difference 4.343e-05), with a multiplicity-weighted mean and integer reconstruction map. Hypothesis: the much larger attention tensor contains near-duplicate scalars below the token failure scale, so this union preserves qualification and yields 1,691 parameters. It is more informative than the next QKV union (difference 4.391e-05) because it is the minimum-distortion test at this new site. Acceptance and rollback remain solely governed by the official runner.	0	0
attempt-0089	third-shared-qkv-union-band-repair	micro-0005	3640bc505e454c32035de0858e69a54375da2390	0763455d55a83320d1bbe6539dd743e137209662	2026-08-17T04:51:08.852173+00:00	parameter tying	99.010000%	1690	keep	Union closest shared-QKV scalar groups 600 and 629	Family: parameter tying. Current retained frontier is 1,691 parameters at 99.010000%, a +0.010000 percentage-point margin over 99%. There have been 31 prior macro-attempts in this family and 422 prior micro-trials. The most recent accepted result is attempt-0089/micro-0004 at 1691 parameters and 99.010000%; the most recent failed result is attempt-0088/micro-0001 (error, no score). This is a parameterization-preserving compression of the depth-shared QKV transform: union flattened coordinates 600 and 629, whose learned values are 0.0105200158 and 0.0105639268 (difference 4.391e-05), with a multiplicity-weighted mean and integer reconstruction map. Hypothesis: the much larger attention tensor contains near-duplicate scalars below the token failure scale, so this union preserves qualification and yields 1,690 parameters. It is more informative than the next QKV union (difference 4.649e-05) because it is the minimum-distortion test at this new site. Acceptance and rollback remain solely governed by the official runner.	0	0
attempt-0089	third-shared-qkv-union-band-repair	micro-0006	dafb784c744b174eedf18e810ab43ab3c0ec1d29	3640bc505e454c32035de0858e69a54375da2390	2026-08-17T04:52:29.711590+00:00	parameter tying	99.010000%	1689	keep	Union closest shared-QKV scalar groups 423 and 518	Family: parameter tying. Current retained frontier is 1,690 parameters at 99.010000%, a +0.010000 percentage-point margin over 99%. There have been 31 prior macro-attempts in this family and 423 prior micro-trials. The most recent accepted result is attempt-0089/micro-0005 at 1690 parameters and 99.010000%; the most recent failed result is attempt-0088/micro-0001 (error, no score). This is a parameterization-preserving compression of the depth-shared QKV transform: union flattened coordinates 423 and 518, whose learned values are -0.1939285100 and -0.1938820183 (difference 4.649e-05), with a multiplicity-weighted mean and integer reconstruction map. Hypothesis: the much larger attention tensor contains near-duplicate scalars below the token failure scale, so this union preserves qualification and yields 1,689 parameters. It is more informative than the next QKV union (difference 4.866e-05) because it is the minimum-distortion test at this new site. Acceptance and rollback remain solely governed by the official runner.	0	0
