macro_attempt_id	automation_id	micro_attempt_id	commit	parent_commit	timestamp_utc	family	accuracy	parameters	status	description	proposal	train_exit	verify_exit
attempt-0199	ffout-final-band-two	micro-0002	2c1eaf4710bd068f176309324136ee2c5a80a483	e72f7611b7db0e58592041a10827518a1b2b3f0c	2026-08-17T14:39:03.992349+00:00	parameter tying	99.130000%	1421	keep	Union closest shared FF-output scalar groups 190 and 206	Family: parameter tying. Current retained frontier is 1,422 parameters at 99.150000%, a +0.150000 percentage-point margin over 99%. There have been 96 prior macro-attempts in this family and 733 prior micro-trials. The most recent accepted result is attempt-0199/micro-0001 at 1422 parameters and 99.150000%; the most recent failed result is attempt-0194/micro-0002 (discard, 98.910000%). This is a parameterization-preserving compression of the depth-shared feed-forward output map: union flattened coordinates 190 and 206, values -0.0061834818 and -0.0050844797 (difference 1.099e-03), using a weighted mean and integer reconstruction. Hypothesis: residual-stream reconstruction contains near-duplicate scalars distinct from FF-input redundancy, preserving qualification at 1,421 parameters. It is more informative than the next FF-output union (difference 1.106e-03) because it is the minimum-distortion isolated test of the complementary FF map. Official acceptance and rollback are unchanged.	0	0
attempt-0199	ffout-final-band-two	micro-0003	66e7669074bd7d135324b92fc42925a7c95dd86f	2c1eaf4710bd068f176309324136ee2c5a80a483	2026-08-17T14:40:41.879361+00:00	parameter tying	99.050000%	1420	keep	Union closest shared FF-output scalar groups 220 and 9	Family: parameter tying. Current retained frontier is 1,421 parameters at 99.130000%, a +0.130000 percentage-point margin over 99%. There have been 96 prior macro-attempts in this family and 734 prior micro-trials. The most recent accepted result is attempt-0199/micro-0002 at 1421 parameters and 99.130000%; the most recent failed result is attempt-0194/micro-0002 (discard, 98.910000%). This is a parameterization-preserving compression of the depth-shared feed-forward output map: union flattened coordinates 220 and 9, values 0.0137743028 and 0.0148801170 (difference 1.106e-03), using a weighted mean and integer reconstruction. Hypothesis: residual-stream reconstruction contains near-duplicate scalars distinct from FF-input redundancy, preserving qualification at 1,420 parameters. It is more informative than the next FF-output union (difference 1.129e-03) because it is the minimum-distortion isolated test of the complementary FF map. Official acceptance and rollback are unchanged.	0	0
attempt-0200	ffin-final-band-two	micro-0001	c34c364a05debe82b192fe0af2cba1e30ad34730	66e7669074bd7d135324b92fc42925a7c95dd86f	2026-08-17T14:42:38.496439+00:00	parameter tying	99.060000%	1419	keep	Union closest shared FF-input scalar groups 45 and 193	Family: parameter tying. Current retained frontier is 1,420 parameters at 99.050000%, a +0.050000 percentage-point margin over 99%. There have been 97 prior macro-attempts in this family and 735 prior micro-trials. The most recent accepted result is attempt-0199/micro-0003 at 1420 parameters and 99.050000%; the most recent failed result is attempt-0194/micro-0002 (discard, 98.910000%). This is a parameterization-preserving compression of the depth-shared feed-forward input map: union flattened coordinates 45 and 193, values 0.1019892916 and 0.1026166752 (difference 6.274e-04), using a weighted mean and integer reconstruction. Hypothesis: nonlinear feature construction contains near-duplicate scalars independent of QKV redundancy, preserving qualification at 1,419 parameters. It is more informative than the next FF-input union (difference 6.440e-04) because it is the minimum-distortion isolated test at this new mechanism site. Official acceptance and rollback are unchanged.	0	0
attempt-0200	ffin-final-band-two	micro-0002	c5957d2623fe02ab87e31eb573281399f6c78757	c34c364a05debe82b192fe0af2cba1e30ad34730	2026-08-17T14:43:55.882747+00:00	parameter tying	99.030000%	1418	keep	Union closest shared FF-input scalar groups 84 and 236	Family: parameter tying. Current retained frontier is 1,419 parameters at 99.060000%, a +0.060000 percentage-point margin over 99%. There have been 97 prior macro-attempts in this family and 736 prior micro-trials. The most recent accepted result is attempt-0200/micro-0001 at 1419 parameters and 99.060000%; the most recent failed result is attempt-0194/micro-0002 (discard, 98.910000%). This is a parameterization-preserving compression of the depth-shared feed-forward input map: union flattened coordinates 84 and 236, values -0.0154203745 and -0.0147763835 (difference 6.440e-04), using a weighted mean and integer reconstruction. Hypothesis: nonlinear feature construction contains near-duplicate scalars independent of QKV redundancy, preserving qualification at 1,418 parameters. It is more informative than the next FF-input union (difference 6.841e-04) because it is the minimum-distortion isolated test at this new mechanism site. Official acceptance and rollback are unchanged.	0	0
attempt-0200	ffin-final-band-two	micro-0003	553f9516e9e7deed44b63d56a58f41296dc07460	c5957d2623fe02ab87e31eb573281399f6c78757	2026-08-17T14:45:14.083275+00:00	parameter tying	99.030000%	1417	keep	Union closest shared FF-input scalar groups 133 and 155	Family: parameter tying. Current retained frontier is 1,418 parameters at 99.030000%, a +0.030000 percentage-point margin over 99%. There have been 97 prior macro-attempts in this family and 737 prior micro-trials. The most recent accepted result is attempt-0200/micro-0002 at 1418 parameters and 99.030000%; the most recent failed result is attempt-0194/micro-0002 (discard, 98.910000%). This is a parameterization-preserving compression of the depth-shared feed-forward input map: union flattened coordinates 133 and 155, values 0.1928634644 and 0.1935475767 (difference 6.841e-04), using a weighted mean and integer reconstruction. Hypothesis: nonlinear feature construction contains near-duplicate scalars independent of QKV redundancy, preserving qualification at 1,417 parameters. It is more informative than the next FF-input union (difference 6.886e-04) because it is the minimum-distortion isolated test at this new mechanism site. Official acceptance and rollback are unchanged.	0	0
