macro_attempt_id	automation_id	micro_attempt_id	commit	parent_commit	timestamp_utc	family	accuracy	parameters	status	description	proposal	train_exit	verify_exit
attempt-0082	nearest-shared-qkv-unions	micro-0015	c2946817ee7ad5468e2ef463832932a7bade5b56	187bcbc20ee1207f10976a452fbdabe2cc1aa423	2026-08-17T03:04:21.181035+00:00	parameter tying	99.010000%	1769	keep	Union closest shared-QKV scalar groups 538 and 742	Family: parameter tying. Current retained frontier is 1,770 parameters at 99.010000%, a +0.010000 percentage-point margin over 99%. There have been 24 prior macro-attempts in this family and 340 prior micro-trials. The most recent accepted result is attempt-0082/micro-0014 at 1770 parameters and 99.010000%; the most recent failed result is attempt-0081/micro-0007 (discard, 98.970000%). This is a parameterization-preserving compression of the depth-shared QKV transform: union flattened coordinates 538 and 742, whose learned values are -0.0061364933 and -0.0061237421 (difference 1.275e-05), with a multiplicity-weighted mean and integer reconstruction map. Hypothesis: the much larger attention tensor contains near-duplicate scalars below the token failure scale, so this union preserves qualification and yields 1,769 parameters. It is more informative than the next QKV union (difference 1.466e-05) because it is the minimum-distortion test at this new site. Acceptance and rollback remain solely governed by the official runner.	0	0
attempt-0082	nearest-shared-qkv-unions	micro-0016	1ccb4995b846e3c57a0e7624f0091d1665971c20	c2946817ee7ad5468e2ef463832932a7bade5b56	2026-08-17T03:05:31.602088+00:00	parameter tying	99.000000%	1768	keep	Union closest shared-QKV scalar groups 626 and 598	Family: parameter tying. Current retained frontier is 1,769 parameters at 99.010000%, a +0.010000 percentage-point margin over 99%. There have been 24 prior macro-attempts in this family and 341 prior micro-trials. The most recent accepted result is attempt-0082/micro-0015 at 1769 parameters and 99.010000%; the most recent failed result is attempt-0081/micro-0007 (discard, 98.970000%). This is a parameterization-preserving compression of the depth-shared QKV transform: union flattened coordinates 626 and 598, whose learned values are -0.0170360636 and -0.0170213990 (difference 1.466e-05), with a multiplicity-weighted mean and integer reconstruction map. Hypothesis: the much larger attention tensor contains near-duplicate scalars below the token failure scale, so this union preserves qualification and yields 1,768 parameters. It is more informative than the next QKV union (difference 1.629e-05) because it is the minimum-distortion test at this new site. Acceptance and rollback remain solely governed by the official runner.	0	0
attempt-0082	nearest-shared-qkv-unions	micro-0017	c37276db9f8a7d16bd86b6768345fa8be640ce86	1ccb4995b846e3c57a0e7624f0091d1665971c20	2026-08-17T03:06:43.276537+00:00	parameter tying	99.010000%	1767	keep	Union closest shared-QKV scalar groups 608 and 760	Family: parameter tying. Current retained frontier is 1,768 parameters at 99.000000%, a +0.000000 percentage-point margin over 99%. There have been 24 prior macro-attempts in this family and 342 prior micro-trials. The most recent accepted result is attempt-0082/micro-0016 at 1768 parameters and 99.000000%; the most recent failed result is attempt-0081/micro-0007 (discard, 98.970000%). This is a parameterization-preserving compression of the depth-shared QKV transform: union flattened coordinates 608 and 760, whose learned values are 0.0139445327 and 0.0139608234 (difference 1.629e-05), with a multiplicity-weighted mean and integer reconstruction map. Hypothesis: the much larger attention tensor contains near-duplicate scalars below the token failure scale, so this union preserves qualification and yields 1,767 parameters. It is more informative than the next QKV union (difference 1.711e-05) because it is the minimum-distortion test at this new site. Acceptance and rollback remain solely governed by the official runner.	0	0
attempt-0082	nearest-shared-qkv-unions	micro-0018	dac2970efde0c9ddc9cb78e7738afaed4aed15bd	c37276db9f8a7d16bd86b6768345fa8be640ce86	2026-08-17T03:07:53.303057+00:00	parameter tying	99.010000%	1766	keep	Union closest shared-QKV scalar groups 644 and 738	Family: parameter tying. Current retained frontier is 1,767 parameters at 99.010000%, a +0.010000 percentage-point margin over 99%. There have been 24 prior macro-attempts in this family and 343 prior micro-trials. The most recent accepted result is attempt-0082/micro-0017 at 1767 parameters and 99.010000%; the most recent failed result is attempt-0081/micro-0007 (discard, 98.970000%). This is a parameterization-preserving compression of the depth-shared QKV transform: union flattened coordinates 644 and 738, whose learned values are -0.0058137770 and -0.0057966672 (difference 1.711e-05), with a multiplicity-weighted mean and integer reconstruction map. Hypothesis: the much larger attention tensor contains near-duplicate scalars below the token failure scale, so this union preserves qualification and yields 1,766 parameters. It is more informative than the next QKV union (difference 1.863e-05) because it is the minimum-distortion test at this new site. Acceptance and rollback remain solely governed by the official runner.	0	0
attempt-0082	nearest-shared-qkv-unions	micro-0019	4df68c116c172d7c1bd7a6a9fce09958a54708c0	dac2970efde0c9ddc9cb78e7738afaed4aed15bd	2026-08-17T03:09:12.748637+00:00	parameter tying	99.010000%	1765	keep	Union closest shared-QKV scalar groups 764 and 727	Family: parameter tying. Current retained frontier is 1,766 parameters at 99.010000%, a +0.010000 percentage-point margin over 99%. There have been 24 prior macro-attempts in this family and 344 prior micro-trials. The most recent accepted result is attempt-0082/micro-0018 at 1766 parameters and 99.010000%; the most recent failed result is attempt-0081/micro-0007 (discard, 98.970000%). This is a parameterization-preserving compression of the depth-shared QKV transform: union flattened coordinates 764 and 727, whose learned values are 0.0101666637 and 0.0101852948 (difference 1.863e-05), with a multiplicity-weighted mean and integer reconstruction map. Hypothesis: the much larger attention tensor contains near-duplicate scalars below the token failure scale, so this union preserves qualification and yields 1,765 parameters. It is more informative than the next QKV union (difference 1.892e-05) because it is the minimum-distortion test at this new site. Acceptance and rollback remain solely governed by the official runner.	0	0
attempt-0082	nearest-shared-qkv-unions	micro-0020	0adaf7fa3562f141d80ab9757d484949c2cd4d53	4df68c116c172d7c1bd7a6a9fce09958a54708c0	2026-08-17T03:10:22.687894+00:00	parameter tying	99.010000%	1764	keep	Union closest shared-QKV scalar groups 654 and 711	Family: parameter tying. Current retained frontier is 1,765 parameters at 99.010000%, a +0.010000 percentage-point margin over 99%. There have been 24 prior macro-attempts in this family and 345 prior micro-trials. The most recent accepted result is attempt-0082/micro-0019 at 1765 parameters and 99.010000%; the most recent failed result is attempt-0081/micro-0007 (discard, 98.970000%). This is a parameterization-preserving compression of the depth-shared QKV transform: union flattened coordinates 654 and 711, whose learned values are -0.0378152244 and -0.0377962999 (difference 1.892e-05), with a multiplicity-weighted mean and integer reconstruction map. Hypothesis: the much larger attention tensor contains near-duplicate scalars below the token failure scale, so this union preserves qualification and yields 1,764 parameters. It is more informative than the next QKV union (difference 1.911e-05) because it is the minimum-distortion test at this new site. Acceptance and rollback remain solely governed by the official runner.	0	0
attempt-0083	next-shared-qkv-union-band	micro-0001	d4009559b5a9abf75573470f9e46fec82fc9039f	0adaf7fa3562f141d80ab9757d484949c2cd4d53	2026-08-17T03:12:49.020408+00:00	parameter tying	99.000000%	1763	keep	Union closest shared-QKV scalar groups 597 and 724	Family: parameter tying. Current retained frontier is 1,764 parameters at 99.010000%, a +0.010000 percentage-point margin over 99%. There have been 25 prior macro-attempts in this family and 346 prior micro-trials. The most recent accepted result is attempt-0082/micro-0020 at 1764 parameters and 99.010000%; the most recent failed result is attempt-0081/micro-0007 (discard, 98.970000%). This is a parameterization-preserving compression of the depth-shared QKV transform: union flattened coordinates 597 and 724, whose learned values are -0.0015679266 and -0.0015488117 (difference 1.911e-05), with a multiplicity-weighted mean and integer reconstruction map. Hypothesis: the much larger attention tensor contains near-duplicate scalars below the token failure scale, so this union preserves qualification and yields 1,763 parameters. It is more informative than the next QKV union (difference 1.918e-05) because it is the minimum-distortion test at this new site. Acceptance and rollback remain solely governed by the official runner.	0	0
attempt-0083	next-shared-qkv-union-band	micro-0002	3bce6eff784a71b1160a9317971b68fb988a2c39	d4009559b5a9abf75573470f9e46fec82fc9039f	2026-08-17T03:13:59.502707+00:00	parameter tying	99.000000%	1762	keep	Union closest shared-QKV scalar groups 741 and 680	Family: parameter tying. Current retained frontier is 1,763 parameters at 99.000000%, a +0.000000 percentage-point margin over 99%. There have been 25 prior macro-attempts in this family and 347 prior micro-trials. The most recent accepted result is attempt-0083/micro-0001 at 1763 parameters and 99.000000%; the most recent failed result is attempt-0081/micro-0007 (discard, 98.970000%). This is a parameterization-preserving compression of the depth-shared QKV transform: union flattened coordinates 741 and 680, whose learned values are 0.0033138623 and 0.0033330433 (difference 1.918e-05), with a multiplicity-weighted mean and integer reconstruction map. Hypothesis: the much larger attention tensor contains near-duplicate scalars below the token failure scale, so this union preserves qualification and yields 1,762 parameters. It is more informative than the next QKV union (difference 1.948e-05) because it is the minimum-distortion test at this new site. Acceptance and rollback remain solely governed by the official runner.	0	0
attempt-0083	next-shared-qkv-union-band	micro-0003	b380417874ebf4cacf106e2f9d72e0c19d16d32b	3bce6eff784a71b1160a9317971b68fb988a2c39	2026-08-17T03:15:10.556883+00:00	parameter tying	99.000000%	1761	keep	Union closest shared-QKV scalar groups 676 and 725	Family: parameter tying. Current retained frontier is 1,762 parameters at 99.000000%, a +0.000000 percentage-point margin over 99%. There have been 25 prior macro-attempts in this family and 348 prior micro-trials. The most recent accepted result is attempt-0083/micro-0002 at 1762 parameters and 99.000000%; the most recent failed result is attempt-0081/micro-0007 (discard, 98.970000%). This is a parameterization-preserving compression of the depth-shared QKV transform: union flattened coordinates 676 and 725, whose learned values are 0.0077592437 and 0.0077787205 (difference 1.948e-05), with a multiplicity-weighted mean and integer reconstruction map. Hypothesis: the much larger attention tensor contains near-duplicate scalars below the token failure scale, so this union preserves qualification and yields 1,761 parameters. It is more informative than the next QKV union (difference 2.006e-05) because it is the minimum-distortion test at this new site. Acceptance and rollback remain solely governed by the official runner.	0	0
attempt-0083	next-shared-qkv-union-band	micro-0004	1ed077f82f366402916a985790306f92dd99d6a5	b380417874ebf4cacf106e2f9d72e0c19d16d32b	2026-08-17T03:16:20.615471+00:00	parameter tying	99.000000%	1760	keep	Union closest shared-QKV scalar groups 635 and 545	Family: parameter tying. Current retained frontier is 1,761 parameters at 99.000000%, a +0.000000 percentage-point margin over 99%. There have been 25 prior macro-attempts in this family and 349 prior micro-trials. The most recent accepted result is attempt-0083/micro-0003 at 1761 parameters and 99.000000%; the most recent failed result is attempt-0081/micro-0007 (discard, 98.970000%). This is a parameterization-preserving compression of the depth-shared QKV transform: union flattened coordinates 635 and 545, whose learned values are 0.0056562019 and 0.0056762570 (difference 2.006e-05), with a multiplicity-weighted mean and integer reconstruction map. Hypothesis: the much larger attention tensor contains near-duplicate scalars below the token failure scale, so this union preserves qualification and yields 1,760 parameters. It is more informative than the next QKV union (difference 2.047e-05) because it is the minimum-distortion test at this new site. Acceptance and rollback remain solely governed by the official runner.	0	0
attempt-0083	next-shared-qkv-union-band	micro-0005	158c0903f7635f2355a40fffd9e49b232665d4bf	1ed077f82f366402916a985790306f92dd99d6a5	2026-08-17T03:17:28.323337+00:00	parameter tying	99.000000%	1759	keep	Union closest shared-QKV scalar groups 441 and 46	Family: parameter tying. Current retained frontier is 1,760 parameters at 99.000000%, a +0.000000 percentage-point margin over 99%. There have been 25 prior macro-attempts in this family and 350 prior micro-trials. The most recent accepted result is attempt-0083/micro-0004 at 1760 parameters and 99.000000%; the most recent failed result is attempt-0081/micro-0007 (discard, 98.970000%). This is a parameterization-preserving compression of the depth-shared QKV transform: union flattened coordinates 441 and 46, whose learned values are 0.0789964423 and 0.0790234357 (difference 2.699e-05), with a multiplicity-weighted mean and integer reconstruction map. Hypothesis: the much larger attention tensor contains near-duplicate scalars below the token failure scale, so this union preserves qualification and yields 1,759 parameters. It is more informative than the next QKV union (difference 2.781e-05) because it is the minimum-distortion test at this new site. Acceptance and rollback remain solely governed by the official runner.	0	0
attempt-0083	next-shared-qkv-union-band	micro-0006	d8b58665ec3f4b33060723efa08a3cbc0be195c7	158c0903f7635f2355a40fffd9e49b232665d4bf	2026-08-17T03:18:38.188271+00:00	parameter tying	99.010000%	1758	keep	Union closest shared-QKV scalar groups 588 and 731	Family: parameter tying. Current retained frontier is 1,759 parameters at 99.000000%, a +0.000000 percentage-point margin over 99%. There have been 25 prior macro-attempts in this family and 351 prior micro-trials. The most recent accepted result is attempt-0083/micro-0005 at 1759 parameters and 99.000000%; the most recent failed result is attempt-0081/micro-0007 (discard, 98.970000%). This is a parameterization-preserving compression of the depth-shared QKV transform: union flattened coordinates 588 and 731, whose learned values are 0.0059907991 and 0.0060186079 (difference 2.781e-05), with a multiplicity-weighted mean and integer reconstruction map. Hypothesis: the much larger attention tensor contains near-duplicate scalars below the token failure scale, so this union preserves qualification and yields 1,758 parameters. It is more informative than the next QKV union (difference 3.050e-05) because it is the minimum-distortion test at this new site. Acceptance and rollback remain solely governed by the official runner.	0	0
attempt-0083	next-shared-qkv-union-band	micro-0007	42074994272d396e429a17d9ec2bc287883e055b	d8b58665ec3f4b33060723efa08a3cbc0be195c7	2026-08-17T03:19:56.788970+00:00	parameter tying	99.010000%	1757	keep	Union closest shared-QKV scalar groups 481 and 545	Family: parameter tying. Current retained frontier is 1,758 parameters at 99.010000%, a +0.010000 percentage-point margin over 99%. There have been 25 prior macro-attempts in this family and 352 prior micro-trials. The most recent accepted result is attempt-0083/micro-0006 at 1758 parameters and 99.010000%; the most recent failed result is attempt-0081/micro-0007 (discard, 98.970000%). This is a parameterization-preserving compression of the depth-shared QKV transform: union flattened coordinates 481 and 545, whose learned values are 0.0056357342 and 0.0056662294 (difference 3.050e-05), with a multiplicity-weighted mean and integer reconstruction map. Hypothesis: the much larger attention tensor contains near-duplicate scalars below the token failure scale, so this union preserves qualification and yields 1,757 parameters. It is more informative than the next QKV union (difference 3.117e-05) because it is the minimum-distortion test at this new site. Acceptance and rollback remain solely governed by the official runner.	0	0
attempt-0083	next-shared-qkv-union-band	micro-0008	fa7da2c4b32e710f9d82c73ffa2ec96587d537e2	42074994272d396e429a17d9ec2bc287883e055b	2026-08-17T03:21:10.525019+00:00	parameter tying	99.000000%	1756	keep	Union closest shared-QKV scalar groups 745 and 574	Family: parameter tying. Current retained frontier is 1,757 parameters at 99.010000%, a +0.010000 percentage-point margin over 99%. There have been 25 prior macro-attempts in this family and 353 prior micro-trials. The most recent accepted result is attempt-0083/micro-0007 at 1757 parameters and 99.010000%; the most recent failed result is attempt-0081/micro-0007 (discard, 98.970000%). This is a parameterization-preserving compression of the depth-shared QKV transform: union flattened coordinates 745 and 574, whose learned values are 0.0061637256 and 0.0061948928 (difference 3.117e-05), with a multiplicity-weighted mean and integer reconstruction map. Hypothesis: the much larger attention tensor contains near-duplicate scalars below the token failure scale, so this union preserves qualification and yields 1,756 parameters. It is more informative than the next QKV union (difference 3.146e-05) because it is the minimum-distortion test at this new site. Acceptance and rollback remain solely governed by the official runner.	0	0
attempt-0083	next-shared-qkv-union-band	micro-0009	b7c5e032a34c31658ebc4e2cff94a4aa4f526194	fa7da2c4b32e710f9d82c73ffa2ec96587d537e2	2026-08-17T03:22:18.289151+00:00	parameter tying	99.010000%	1755	keep	Union closest shared-QKV scalar groups 705 and 643	Family: parameter tying. Current retained frontier is 1,756 parameters at 99.000000%, a +0.000000 percentage-point margin over 99%. There have been 25 prior macro-attempts in this family and 354 prior micro-trials. The most recent accepted result is attempt-0083/micro-0008 at 1756 parameters and 99.000000%; the most recent failed result is attempt-0081/micro-0007 (discard, 98.970000%). This is a parameterization-preserving compression of the depth-shared QKV transform: union flattened coordinates 705 and 643, whose learned values are 0.0169566497 and 0.0169881079 (difference 3.146e-05), with a multiplicity-weighted mean and integer reconstruction map. Hypothesis: the much larger attention tensor contains near-duplicate scalars below the token failure scale, so this union preserves qualification and yields 1,755 parameters. It is more informative than the next QKV union (difference 3.297e-05) because it is the minimum-distortion test at this new site. Acceptance and rollback remain solely governed by the official runner.	0	0
attempt-0083	next-shared-qkv-union-band	micro-0010	d212ca9f06af35da2ed38e3c7bbd71915b64e16b	b7c5e032a34c31658ebc4e2cff94a4aa4f526194	2026-08-17T03:23:25.840365+00:00	parameter tying	99.010000%	1754	keep	Union closest shared-QKV scalar groups 164 and 201	Family: parameter tying. Current retained frontier is 1,755 parameters at 99.010000%, a +0.010000 percentage-point margin over 99%. There have been 25 prior macro-attempts in this family and 355 prior micro-trials. The most recent accepted result is attempt-0083/micro-0009 at 1755 parameters and 99.010000%; the most recent failed result is attempt-0081/micro-0007 (discard, 98.970000%). This is a parameterization-preserving compression of the depth-shared QKV transform: union flattened coordinates 164 and 201, whose learned values are 0.1002422199 and 0.1002751887 (difference 3.297e-05), with a multiplicity-weighted mean and integer reconstruction map. Hypothesis: the much larger attention tensor contains near-duplicate scalars below the token failure scale, so this union preserves qualification and yields 1,754 parameters. It is more informative than the next QKV union (difference 3.342e-05) because it is the minimum-distortion test at this new site. Acceptance and rollback remain solely governed by the official runner.	0	0
