macro_attempt_id	automation_id	micro_attempt_id	commit	parent_commit	timestamp_utc	family	accuracy	parameters	status	description	proposal	train_exit	verify_exit
attempt-0093	nearest-final-norm-scale-unions	micro-0008	981a11dd274c525a973cd69044c45146fc9ee98c	919b51ccfb0214053066fe4527493a66477877e3	2026-08-17T05:18:18.275957+00:00	parameter tying	99.000000%	1675	keep	Union closest final LayerNorm scale groups 0 and 8	Family: parameter tying. Current retained frontier is 1,676 parameters at 99.010000%, a +0.010000 percentage-point margin over 99%. There have been 35 prior macro-attempts in this family and 441 prior micro-trials. The most recent accepted result is attempt-0093/micro-0007 at 1676 parameters and 99.010000%; the most recent failed result is attempt-0092/micro-0004 (discard, 98.980000%). This is a parameterization-preserving compression of the final normalization scales: union coordinates 0 and 8, values 8.3351602554 and 8.4383068085 (difference 1.031e-01), using a weighted mean and integer reconstruction. Hypothesis: the final affine rescaling contains a near-duplicate coordinate pair independent of matrix and positional boundaries, preserving qualification at 1,675 parameters. It is more informative than the next scale union (difference 1.110e-01) because it is the minimum-distortion test in the complete 16-scale search space. Official acceptance and rollback are unchanged.	0	0
attempt-0093	nearest-final-norm-scale-unions	micro-0009	18a35879736439a6b66630cfa1c0127ae4ae019f	981a11dd274c525a973cd69044c45146fc9ee98c	2026-08-17T05:19:25.852195+00:00	parameter tying	99.000000%	1674	keep	Union closest final LayerNorm scale groups 5 and 12	Family: parameter tying. Current retained frontier is 1,675 parameters at 99.000000%, a +0.000000 percentage-point margin over 99%. There have been 35 prior macro-attempts in this family and 442 prior micro-trials. The most recent accepted result is attempt-0093/micro-0008 at 1675 parameters and 99.000000%; the most recent failed result is attempt-0092/micro-0004 (discard, 98.980000%). This is a parameterization-preserving compression of the final normalization scales: union coordinates 5 and 12, values 7.1882600784 and 7.2992835045 (difference 1.110e-01), using a weighted mean and integer reconstruction. Hypothesis: the final affine rescaling contains a near-duplicate coordinate pair independent of matrix and positional boundaries, preserving qualification at 1,674 parameters. It is more informative than the next scale union (difference 2.010e-01) because it is the minimum-distortion test in the complete 16-scale search space. Official acceptance and rollback are unchanged.	0	0
attempt-0093	nearest-final-norm-scale-unions	micro-0010	bfb99598659a58aa148eae63b9e24e70a3013d86	18a35879736439a6b66630cfa1c0127ae4ae019f	2026-08-17T05:20:34.395606+00:00	parameter tying	98.960000%	1673	discard	Union closest final LayerNorm scale groups 0 and 2	Family: parameter tying. Current retained frontier is 1,674 parameters at 99.000000%, a +0.000000 percentage-point margin over 99%. There have been 35 prior macro-attempts in this family and 443 prior micro-trials. The most recent accepted result is attempt-0093/micro-0009 at 1674 parameters and 99.000000%; the most recent failed result is attempt-0092/micro-0004 (discard, 98.980000%). This is a parameterization-preserving compression of the final normalization scales: union coordinates 0 and 2, values 8.3557891846 and 8.5567874908 (difference 2.010e-01), using a weighted mean and integer reconstruction. Hypothesis: the final affine rescaling contains a near-duplicate coordinate pair independent of matrix and positional boundaries, preserving qualification at 1,673 parameters. It is more informative than the next scale union (difference 2.151e-01) because it is the minimum-distortion test in the complete 16-scale search space. Official acceptance and rollback are unchanged.	0	0
attempt-0094	nearest-block0-preff-scale-unions	micro-0001	df651e1438408b7b9cdfcedbc3b41f2c232aa812	18a35879736439a6b66630cfa1c0127ae4ae019f	2026-08-17T05:23:38.062359+00:00	parameter tying	99.040000%	1673	keep	Union closest block-0 pre-FF norm scales 6 and 7	Family: parameter tying. Current retained frontier is 1,674 parameters at 99.000000%, a +0.000000 percentage-point margin over 99%. There have been 36 prior macro-attempts in this family and 444 prior micro-trials. The most recent accepted result is attempt-0093/micro-0009 at 1674 parameters and 99.000000%; the most recent failed result is attempt-0093/micro-0010 (discard, 98.960000%). This is a parameterization-preserving compression of block 0's pre-feed-forward normalization scales: union coordinates 6 and 7, values 0.5387524962 and 0.5422858000 (difference 3.533e-03), using a weighted mean and integer reconstruction. Hypothesis: upstream nonlinear normalization has local scale redundancy distinct from final normalization, preserving qualification at 1,673 parameters. It is more informative than the next scale union (difference 7.483e-03) because it is the minimum-distortion isolated scale test; biases remain independent. Official acceptance and rollback are unchanged.	0	0
attempt-0094	nearest-block0-preff-scale-unions	micro-0002	9563676bf91aaea2af968f8115b3fb05333046d9	df651e1438408b7b9cdfcedbc3b41f2c232aa812	2026-08-17T05:24:49.199741+00:00	parameter tying	97.900000%	1672	discard	Union closest block-0 pre-FF norm scales 2 and 8	Family: parameter tying. Current retained frontier is 1,673 parameters at 99.040000%, a +0.040000 percentage-point margin over 99%. There have been 36 prior macro-attempts in this family and 445 prior micro-trials. The most recent accepted result is attempt-0094/micro-0001 at 1673 parameters and 99.040000%; the most recent failed result is attempt-0093/micro-0010 (discard, 98.960000%). This is a parameterization-preserving compression of block 0's pre-feed-forward normalization scales: union coordinates 2 and 8, values 0.4266473353 and 0.4341307580 (difference 7.483e-03), using a weighted mean and integer reconstruction. Hypothesis: upstream nonlinear normalization has local scale redundancy distinct from final normalization, preserving qualification at 1,672 parameters. It is more informative than the next scale union (difference 1.299e-02) because it is the minimum-distortion isolated scale test; biases remain independent. Official acceptance and rollback are unchanged.	0	0
attempt-0095	nearest-block0-preff-bias-unions	micro-0001	a1dfac6cb503f577ebebcb35e93ea9788786fa40	df651e1438408b7b9cdfcedbc3b41f2c232aa812	2026-08-17T05:27:20.056144+00:00	parameter tying	99.010000%	1672	keep	Union closest block-0 pre-FF norm biases 9 and 6	Family: parameter tying. Current retained frontier is 1,673 parameters at 99.040000%, a +0.040000 percentage-point margin over 99%. There have been 37 prior macro-attempts in this family and 446 prior micro-trials. The most recent accepted result is attempt-0094/micro-0001 at 1673 parameters and 99.040000%; the most recent failed result is attempt-0094/micro-0002 (discard, 97.900000%). This is a parameterization-preserving compression of block 0's pre-feed-forward normalization biases: union coordinates 9 and 6, values -0.0592557937 and -0.0588278063 (difference 4.280e-04), using a weighted mean and integer reconstruction. Hypothesis: additive centering has local redundancy distinct from the measured scale boundary, preserving qualification at 1,672 parameters. It is more informative than the next bias union (difference 4.007e-03) because it is the minimum-distortion isolated bias test; scales remain fixed. Official acceptance and rollback are unchanged.	0	0
attempt-0095	nearest-block0-preff-bias-unions	micro-0002	27675907cf675be35181b2fbe0cc17407c319fd0	a1dfac6cb503f577ebebcb35e93ea9788786fa40	2026-08-17T05:28:32.294997+00:00	parameter tying	98.780000%	1671	discard	Union closest block-0 pre-FF norm biases 5 and 8	Family: parameter tying. Current retained frontier is 1,672 parameters at 99.010000%, a +0.010000 percentage-point margin over 99%. There have been 37 prior macro-attempts in this family and 447 prior micro-trials. The most recent accepted result is attempt-0095/micro-0001 at 1672 parameters and 99.010000%; the most recent failed result is attempt-0094/micro-0002 (discard, 97.900000%). This is a parameterization-preserving compression of block 0's pre-feed-forward normalization biases: union coordinates 5 and 8, values 0.0430329964 and 0.0470397957 (difference 4.007e-03), using a weighted mean and integer reconstruction. Hypothesis: additive centering has local redundancy distinct from the measured scale boundary, preserving qualification at 1,671 parameters. It is more informative than the next bias union (difference 4.956e-03) because it is the minimum-distortion isolated bias test; scales remain fixed. Official acceptance and rollback are unchanged.	0	0
attempt-0096	nearest-block0-preattn-scale-unions	micro-0001	522dc824fbb6c62f5a196a442fd377600fe0ef75	a1dfac6cb503f577ebebcb35e93ea9788786fa40	2026-08-17T05:31:58.695941+00:00	parameter tying	98.900000%	1671	discard	Union closest block-0 pre-attention norm scales 6 and 14	Family: parameter tying. Current retained frontier is 1,672 parameters at 99.010000%, a +0.010000 percentage-point margin over 99%. There have been 38 prior macro-attempts and 448 prior micro-trials in this family. The most recent accepted result is attempt-0095/micro-0001 at 1672 parameters and 99.010000%; the most recent failed result is attempt-0095/micro-0002 (discard, 98.780000%). This is a parameterization-preserving compression of block 0's pre-attention normalization scales: union coordinates 6 and 14, values 0.2085438818 and 0.2194991410 (difference 1.096e-02), using a weighted mean and integer reconstruction. Hypothesis: attention-input scaling has local redundancy distinct from pre-FF normalization, preserving qualification at 1,671 parameters. It is more informative than the next scale union (difference 1.267e-02) because it is the minimum-distortion isolated test; the two fixed-zero biases remain fixed. Official acceptance and rollback are unchanged.	0	0
attempt-0115	nearest-block0-preattn-bias-pruning	micro-0001	0ff37c2a812d65894529d1dafabb6cebd3f252f1	a1dfac6cb503f577ebebcb35e93ea9788786fa40	2026-08-17T06:22:41.228580+00:00	scalar pruning			error	Fix block0-ln1-bias coordinate 3 to zero	Family: scalar pruning. Current retained frontier is 1,672 parameters at 99.010000%, a +0.010000 percentage-point margin over 99%. There were 23 prior macro-attempts in this family before this automation and 0 prior micro-trials in this policy. The most recent accepted result is attempt-0059 at 2118 parameters and 99.050000%; the most recent failed result is attempt-0061 (discard, 54.190000%). This is a localized parameterization-preserving prune at blocks.0.ln1: fix bias coordinate 3 from -0.0104501201 to its neutral value 0.0 (distance 1.045e-02), yielding 1,671 parameters. It is more informative than the next eligible coordinate (distance 1.481e-02) because it is the least checkpoint perturbation at this isolated normalization site. The helper orders remaining coordinates by current distance to neutral; the official runner alone accepts or rolls back, and the first discard or error closes the path.	1	
attempt-0116	repair-block0-preattn-bias-pruning	micro-0001	7684e2f1956695d8c2c8f24dec741597bb270e43	a1dfac6cb503f577ebebcb35e93ea9788786fa40	2026-08-17T06:25:23.925038+00:00	scalar pruning	97.300000%	1671	discard	Fix block0-ln1-bias coordinate 3 to zero	Family: scalar pruning. Current retained frontier is 1,672 parameters at 99.010000%, a +0.010000 percentage-point margin over 99%. There were 23 prior macro-attempts in this family before this automation and 0 prior micro-trials in this policy. The most recent accepted result is attempt-0059 at 2118 parameters and 99.050000%; the most recent failed result is attempt-0115 (discard, no score). This is a localized parameterization-preserving prune at blocks.0.ln1: fix bias coordinate 3 from -0.0104501201 to its neutral value 0.0 (distance 1.045e-02), yielding 1,671 parameters. It is more informative than the next eligible coordinate (distance 1.481e-02) because it is the least checkpoint perturbation at this isolated normalization site. The helper orders remaining coordinates by current distance to neutral; the official runner alone accepts or rolls back, and the first discard or error closes the path.	0	0
attempt-0117	nearest-block1-preattn-bias-pruning	micro-0001	c9fe56d84cdc7518898c986962ce78c4ea943b0b	a1dfac6cb503f577ebebcb35e93ea9788786fa40	2026-08-17T06:27:50.300448+00:00	scalar pruning	98.580000%	1671	discard	Fix block1-ln1-bias coordinate 13 to zero	Family: scalar pruning. Current retained frontier is 1,672 parameters at 99.010000%, a +0.010000 percentage-point margin over 99%. There were 23 prior macro-attempts in this family before this automation and 0 prior micro-trials in this policy. The most recent accepted result is attempt-0059 at 2118 parameters and 99.050000%; the most recent failed result is attempt-0116 (discard, no score). This is a localized parameterization-preserving prune at blocks.1.ln1: fix bias coordinate 13 from 0.0110794324 to its neutral value 0.0 (distance 1.108e-02), yielding 1,671 parameters. It is more informative than the next eligible coordinate (distance 2.006e-02) because it is the least checkpoint perturbation at this isolated normalization site. The helper orders remaining coordinates by current distance to neutral; the official runner alone accepts or rolls back, and the first discard or error closes the path.	0	0
attempt-0118	nearest-block1-preff-bias-pruning	micro-0001	e977659f26fde11241aa63c87a5ddcc47747d9eb	a1dfac6cb503f577ebebcb35e93ea9788786fa40	2026-08-17T06:29:48.467565+00:00	scalar pruning	95.220000%	1671	discard	Fix block1-ln2-bias coordinate 6 to zero	Family: scalar pruning. Current retained frontier is 1,672 parameters at 99.010000%, a +0.010000 percentage-point margin over 99%. There were 23 prior macro-attempts in this family before this automation and 0 prior micro-trials in this policy. The most recent accepted result is attempt-0059 at 2118 parameters and 99.050000%; the most recent failed result is attempt-0117 (discard, no score). This is a localized parameterization-preserving prune at blocks.1.ln2: fix bias coordinate 6 from -0.0638468191 to its neutral value 0.0 (distance 6.385e-02), yielding 1,671 parameters. It is more informative than the next eligible coordinate (distance 6.391e-02) because it is the least checkpoint perturbation at this isolated normalization site. The helper orders remaining coordinates by current distance to neutral; the official runner alone accepts or rolls back, and the first discard or error closes the path.	0	0
attempt-0119	nearest-block1-preattn-scale-pruning	micro-0001	23b1f22581bed9725ee02f867bee49960ab874ac	a1dfac6cb503f577ebebcb35e93ea9788786fa40	2026-08-17T06:32:04.472111+00:00	scalar pruning	96.550000%	1671	discard	Fix block1-ln1-scale coordinate 4 to one	Family: scalar pruning. Current retained frontier is 1,672 parameters at 99.010000%, a +0.010000 percentage-point margin over 99%. There were 23 prior macro-attempts in this family before this automation and 0 prior micro-trials in this policy. The most recent accepted result is attempt-0059 at 2118 parameters and 99.050000%; the most recent failed result is attempt-0118 (discard, no score). This is a localized parameterization-preserving prune at blocks.1.ln1: fix scale coordinate 4 from 0.9525162578 to its neutral value 1.0 (distance 4.748e-02), yielding 1,671 parameters. It is more informative than the next eligible coordinate (distance 2.200e-01) because it is the least checkpoint perturbation at this isolated normalization site. The helper orders remaining coordinates by current distance to neutral; the official runner alone accepts or rolls back, and the first discard or error closes the path.	0	0
attempt-0120	nearest-block0-preattn-scale-neutral	micro-0001	604bf47253eb65afe6af60f795ca66d8cc6f7d05	a1dfac6cb503f577ebebcb35e93ea9788786fa40	2026-08-17T06:33:57.261498+00:00	scalar pruning	91.960000%	1671	discard	Fix block0-ln1-scale coordinate 4 to one	Family: scalar pruning. Current retained frontier is 1,672 parameters at 99.010000%, a +0.010000 percentage-point margin over 99%. There were 23 prior macro-attempts in this family before this automation and 0 prior micro-trials in this policy. The most recent accepted result is attempt-0059 at 2118 parameters and 99.050000%; the most recent failed result is attempt-0119 (discard, no score). This is a localized parameterization-preserving prune at blocks.0.ln1: fix scale coordinate 4 from 1.1432663202 to its neutral value 1.0 (distance 1.433e-01), yielding 1,671 parameters. It is more informative than the next eligible coordinate (distance 3.393e-01) because it is the least checkpoint perturbation at this isolated normalization site. The helper orders remaining coordinates by current distance to neutral; the official runner alone accepts or rolls back, and the first discard or error closes the path.	0	0
attempt-0121	next-block1-preff-scale-neutral	micro-0001	e10fd0d2f45fd1dbffe2f8c8a050c5a0d1d442fa	a1dfac6cb503f577ebebcb35e93ea9788786fa40	2026-08-17T06:35:52.460540+00:00	scalar pruning	53.380000%	1671	discard	Fix block1-ln2-scale coordinate 5 to one	Family: scalar pruning. Current retained frontier is 1,672 parameters at 99.010000%, a +0.010000 percentage-point margin over 99%. There were 23 prior macro-attempts in this family before this automation and 0 prior micro-trials in this policy. The most recent accepted result is attempt-0059 at 2118 parameters and 99.050000%; the most recent failed result is attempt-0120 (discard, no score). This is a localized parameterization-preserving prune at blocks.1.ln2: fix scale coordinate 5 from 0.7474362254 to its neutral value 1.0 (distance 2.526e-01), yielding 1,671 parameters. It is more informative than the next eligible coordinate (distance 2.752e-01) because it is the least checkpoint perturbation at this isolated normalization site. The helper orders remaining coordinates by current distance to neutral; the official runner alone accepts or rolls back, and the first discard or error closes the path.	0	0
attempt-0132	remaining-operand-position-row-ties	micro-0001	10a63449c7ebdc8c1ce7b4e77a860b8268a7552b	a1dfac6cb503f577ebebcb35e93ea9788786fa40	2026-08-17T07:01:41.641453+00:00	position representation	98.440000%	1659	discard	Tie operand-position rows 19 and 20 coordinate-wise	Family: position representation. Current retained frontier is 1,672 parameters at 99.010000%, a +0.010000 percentage-point margin over 99%. There have been 9 prior macro-attempts and 0 prior micro-trials in this policy. The most recent accepted result is attempt-0030 at 2,128 parameters/99.14%; the most recent failed result is attempt-0131, whose position-1/2 row tie scored 15.91% at 1,656 parameters. Tie operand-position rows 19 and 20 coordinate-wise; their checkpoint L2 distance is 0.007489, versus 0.012288 for the next eligible column. This is the least-distortion remaining test and is more informative than the next row pair for that reason. The official runner alone accepts or rolls back; the first discard or error closes this column-invariance path.	0	0
attempt-0139	gelu-blend-with-output-union	micro-0001	06d88307073db782499be4f6c2ff2d17294940e2	a1dfac6cb503f577ebebcb35e93ea9788786fa40	2026-08-17T07:17:45.761860+00:00	feed-forward width	99.000000%	1671	keep	Blend exact and tanh GELU at alpha 0.5 with one output union	Family: feed-forward width. Current retained frontier is 1,672 parameters at 99.010000%, a +0.010000 percentage-point margin over 99%. There have been 20 prior macro-attempts and 0 prior micro-trials in this interpolation policy. The most recent accepted result is attempt-0022 at 3,040 parameters/99.85%; the most recent failed result is attempt-0138, where alpha=1 tanh-GELU plus output union 82/85 scored 98.99% at 1,671 parameters. Use activation exact_GELU + 0.5*(tanh_GELU-exact_GELU) with the identical union, retaining width 16. This is more informative than the next smaller blend because it is the largest remaining perturbation inside the measured alpha=0 incumbent/alpha=1 failure bracket. Official acceptance and rollback are unchanged; a failure makes the next smaller alpha eligible.	0	0
attempt-0140	ff-output-unions-under-blended-gelu	micro-0001	a091240170fc8a3f811477db1f020483c50b9c9d	06d88307073db782499be4f6c2ff2d17294940e2	2026-08-17T07:20:27.398301+00:00	parameter tying	98.970000%	1670	discard	Union closest shared FF-output scalar groups 143 and 100	Family: parameter tying. Current retained frontier is 1,671 parameters at 99.000000%, a +0.000000 percentage-point margin over 99%. There have been 45 prior macro-attempts in this family and 449 prior micro-trials. The most recent accepted result is attempt-0139/micro-0001 at 1,671 parameters and 99.00%; the most recent failed result is attempt-0087/micro-0010 (pair 143/100 discarded at 98.96% under exact GELU). This is a parameterization-preserving compression of the depth-shared feed-forward output map: union flattened coordinates 143 and 100, values -0.0714483783 and -0.0713087097 (difference 1.397e-04), using a weighted mean and integer reconstruction. Hypothesis: residual-stream reconstruction contains near-duplicate scalars distinct from FF-input redundancy, preserving qualification at 1,670 parameters. It is more informative than the next FF-output union (difference 1.613e-04) because it is the minimum-distortion isolated test of the complementary FF map. Official acceptance and rollback are unchanged.	0	0
