macro_attempt_id	automation_id	micro_attempt_id	commit	parent_commit	timestamp_utc	family	accuracy	parameters	status	description	proposal	train_exit	verify_exit
attempt-0189	ff-output-five-trial-revisit	micro-0001	6556cffb62bbba6c071d8fb3670dcbc5e7b25684	e3da88bd751cbdc51b33f9fe0c581ac995dc0c90	2026-08-17T13:40:43.174461+00:00	parameter tying	99.210000%	1453	keep	Union closest shared FF-output scalar groups 60 and 51	Family: parameter tying. Current retained frontier is 1,454 parameters at 99.210000%, a +0.210000 percentage-point margin over 99%. There have been 86 prior macro-attempts in this family and 699 prior micro-trials. The most recent accepted result is attempt-0188/micro-0005 at 1,454 parameters and 99.21%; the most recent failed result is attempt-0186/micro-0001 (normalization-bias pair 8/3 discarded at 98.08%). This is a parameterization-preserving compression of the depth-shared feed-forward output map: union flattened coordinates 60 and 51, values -0.1126351580 and -0.1117217839 (difference 9.134e-04), using a weighted mean and integer reconstruction. Hypothesis: residual-stream reconstruction contains near-duplicate scalars distinct from FF-input redundancy, preserving qualification at 1,453 parameters. It is more informative than the next FF-output union (difference 9.329e-04) because it is the minimum-distortion isolated test of the complementary FF map. Official acceptance and rollback are unchanged.	0	0
attempt-0189	ff-output-five-trial-revisit	micro-0002	d451d6ca20bba6f38b4650d398eb7f2650453905	6556cffb62bbba6c071d8fb3670dcbc5e7b25684	2026-08-17T13:42:05.252157+00:00	parameter tying	99.150000%	1452	keep	Union closest shared FF-output scalar groups 201 and 18	Family: parameter tying. Current retained frontier is 1,453 parameters at 99.210000%, a +0.210000 percentage-point margin over 99%. There have been 86 prior macro-attempts in this family and 700 prior micro-trials. The most recent accepted result is attempt-0188/micro-0005 at 1,454 parameters and 99.21%; the most recent failed result is attempt-0186/micro-0001 (normalization-bias pair 8/3 discarded at 98.08%). This is a parameterization-preserving compression of the depth-shared feed-forward output map: union flattened coordinates 201 and 18, values 0.0193385109 and 0.0202713683 (difference 9.329e-04), using a weighted mean and integer reconstruction. Hypothesis: residual-stream reconstruction contains near-duplicate scalars distinct from FF-input redundancy, preserving qualification at 1,452 parameters. It is more informative than the next FF-output union (difference 9.933e-04) because it is the minimum-distortion isolated test of the complementary FF map. Official acceptance and rollback are unchanged.	0	0
attempt-0189	ff-output-five-trial-revisit	micro-0003	456a9cbad2b763ea44ad0133a7fcce4adc390a4c	d451d6ca20bba6f38b4650d398eb7f2650453905	2026-08-17T13:43:19.312068+00:00	parameter tying	99.190000%	1451	keep	Union closest shared FF-output scalar groups 114 and 180	Family: parameter tying. Current retained frontier is 1,452 parameters at 99.150000%, a +0.150000 percentage-point margin over 99%. There have been 86 prior macro-attempts in this family and 701 prior micro-trials. The most recent accepted result is attempt-0188/micro-0005 at 1,454 parameters and 99.21%; the most recent failed result is attempt-0186/micro-0001 (normalization-bias pair 8/3 discarded at 98.08%). This is a parameterization-preserving compression of the depth-shared feed-forward output map: union flattened coordinates 114 and 180, values -0.0288736690 and -0.0278803911 (difference 9.933e-04), using a weighted mean and integer reconstruction. Hypothesis: residual-stream reconstruction contains near-duplicate scalars distinct from FF-input redundancy, preserving qualification at 1,451 parameters. It is more informative than the next FF-output union (difference 9.978e-04) because it is the minimum-distortion isolated test of the complementary FF map. Official acceptance and rollback are unchanged.	0	0
attempt-0189	ff-output-five-trial-revisit	micro-0004	d0fc15a7c5df0b40e5a915af616d83a5a4575072	456a9cbad2b763ea44ad0133a7fcce4adc390a4c	2026-08-17T13:44:40.344176+00:00	parameter tying	99.040000%	1450	keep	Union closest shared FF-output scalar groups 114 and 59	Family: parameter tying. Current retained frontier is 1,451 parameters at 99.190000%, a +0.190000 percentage-point margin over 99%. There have been 86 prior macro-attempts in this family and 702 prior micro-trials. The most recent accepted result is attempt-0188/micro-0005 at 1,454 parameters and 99.21%; the most recent failed result is attempt-0186/micro-0001 (normalization-bias pair 8/3 discarded at 98.08%). This is a parameterization-preserving compression of the depth-shared feed-forward output map: union flattened coordinates 114 and 59, values -0.0285425764 and -0.0276771858 (difference 8.654e-04), using a weighted mean and integer reconstruction. Hypothesis: residual-stream reconstruction contains near-duplicate scalars distinct from FF-input redundancy, preserving qualification at 1,450 parameters. It is more informative than the next FF-output union (difference 9.978e-04) because it is the minimum-distortion isolated test of the complementary FF map. Official acceptance and rollback are unchanged.	0	0
attempt-0189	ff-output-five-trial-revisit	micro-0005	50a194415599b9b29ac668b48b4620ab4a1f14e1	d0fc15a7c5df0b40e5a915af616d83a5a4575072	2026-08-17T13:45:58.425612+00:00	parameter tying	98.960000%	1449	discard	Union closest shared FF-output scalar groups 57 and 0	Family: parameter tying. Current retained frontier is 1,450 parameters at 99.040000%, a +0.040000 percentage-point margin over 99%. There have been 86 prior macro-attempts in this family and 703 prior micro-trials. The most recent accepted result is attempt-0188/micro-0005 at 1,454 parameters and 99.21%; the most recent failed result is attempt-0186/micro-0001 (normalization-bias pair 8/3 discarded at 98.08%). This is a parameterization-preserving compression of the depth-shared feed-forward output map: union flattened coordinates 57 and 0, values 0.0549184643 and 0.0559163019 (difference 9.978e-04), using a weighted mean and integer reconstruction. Hypothesis: residual-stream reconstruction contains near-duplicate scalars distinct from FF-input redundancy, preserving qualification at 1,449 parameters. It is more informative than the next FF-output union (difference 1.016e-03) because it is the minimum-distortion isolated test of the complementary FF map. Official acceptance and rollback are unchanged.	0	0
attempt-0190	ff-input-five-trial-revisit	micro-0001	18e7400f1c6478c72dd05097a82e44cbf524f2eb	d0fc15a7c5df0b40e5a915af616d83a5a4575072	2026-08-17T13:48:02.550305+00:00	parameter tying	99.030000%	1449	keep	Union closest shared FF-input scalar groups 129 and 128	Family: parameter tying. Current retained frontier is 1,450 parameters at 99.040000%, a +0.040000 percentage-point margin over 99%. There have been 87 prior macro-attempts in this family and 704 prior micro-trials. The most recent accepted result is attempt-0189/micro-0004 at 1450 parameters and 99.040000%; the most recent failed result is attempt-0189/micro-0005 (discard, 98.960000%). This is a parameterization-preserving compression of the depth-shared feed-forward input map: union flattened coordinates 129 and 128, values 0.2184612751 and 0.2189936340 (difference 5.324e-04), using a weighted mean and integer reconstruction. Hypothesis: nonlinear feature construction contains near-duplicate scalars independent of QKV redundancy, preserving qualification at 1,449 parameters. It is more informative than the next FF-input union (difference 5.382e-04) because it is the minimum-distortion isolated test at this new mechanism site. Official acceptance and rollback are unchanged.	0	0
attempt-0190	ff-input-five-trial-revisit	micro-0002	e7c7ef35fe9da2750984d757cd6dadbb1aad4ea1	18e7400f1c6478c72dd05097a82e44cbf524f2eb	2026-08-17T13:49:21.366635+00:00	parameter tying	99.020000%	1448	keep	Union closest shared FF-input scalar groups 41 and 159	Family: parameter tying. Current retained frontier is 1,449 parameters at 99.030000%, a +0.030000 percentage-point margin over 99%. There have been 87 prior macro-attempts in this family and 705 prior micro-trials. The most recent accepted result is attempt-0190/micro-0001 at 1449 parameters and 99.030000%; the most recent failed result is attempt-0189/micro-0005 (discard, 98.960000%). This is a parameterization-preserving compression of the depth-shared feed-forward input map: union flattened coordinates 41 and 159, values -0.0582801551 and -0.0577419139 (difference 5.382e-04), using a weighted mean and integer reconstruction. Hypothesis: nonlinear feature construction contains near-duplicate scalars independent of QKV redundancy, preserving qualification at 1,448 parameters. It is more informative than the next FF-input union (difference 5.406e-04) because it is the minimum-distortion isolated test at this new mechanism site. Official acceptance and rollback are unchanged.	0	0
attempt-0190	ff-input-five-trial-revisit	micro-0003	e0faa5ae317c02cc37d575d514dd35427bc73350	e7c7ef35fe9da2750984d757cd6dadbb1aad4ea1	2026-08-17T13:50:41.999615+00:00	parameter tying	99.030000%	1447	keep	Union closest shared FF-input scalar groups 235 and 56	Family: parameter tying. Current retained frontier is 1,448 parameters at 99.020000%, a +0.020000 percentage-point margin over 99%. There have been 87 prior macro-attempts in this family and 706 prior micro-trials. The most recent accepted result is attempt-0190/micro-0002 at 1448 parameters and 99.020000%; the most recent failed result is attempt-0189/micro-0005 (discard, 98.960000%). This is a parameterization-preserving compression of the depth-shared feed-forward input map: union flattened coordinates 235 and 56, values 0.0251302868 and 0.0256709103 (difference 5.406e-04), using a weighted mean and integer reconstruction. Hypothesis: nonlinear feature construction contains near-duplicate scalars independent of QKV redundancy, preserving qualification at 1,447 parameters. It is more informative than the next FF-input union (difference 5.532e-04) because it is the minimum-distortion isolated test at this new mechanism site. Official acceptance and rollback are unchanged.	0	0
attempt-0190	ff-input-five-trial-revisit	micro-0004	be6a5030583c79e10622e0e1d8d792029cee3f1d	e0faa5ae317c02cc37d575d514dd35427bc73350	2026-08-17T13:51:57.463892+00:00	parameter tying	99.030000%	1446	keep	Union closest shared FF-input scalar groups 5 and 49	Family: parameter tying. Current retained frontier is 1,447 parameters at 99.030000%, a +0.030000 percentage-point margin over 99%. There have been 87 prior macro-attempts in this family and 707 prior micro-trials. The most recent accepted result is attempt-0190/micro-0003 at 1447 parameters and 99.030000%; the most recent failed result is attempt-0189/micro-0005 (discard, 98.960000%). This is a parameterization-preserving compression of the depth-shared feed-forward input map: union flattened coordinates 5 and 49, values -0.1007174775 and -0.1001643091 (difference 5.532e-04), using a weighted mean and integer reconstruction. Hypothesis: nonlinear feature construction contains near-duplicate scalars independent of QKV redundancy, preserving qualification at 1,446 parameters. It is more informative than the next FF-input union (difference 5.643e-04) because it is the minimum-distortion isolated test at this new mechanism site. Official acceptance and rollback are unchanged.	0	0
attempt-0190	ff-input-five-trial-revisit	micro-0005	00947b23ac6e15be44538474fa0868c7504e55fe	be6a5030583c79e10622e0e1d8d792029cee3f1d	2026-08-17T13:53:20.259725+00:00	parameter tying	99.040000%	1445	keep	Union closest shared FF-input scalar groups 217 and 218	Family: parameter tying. Current retained frontier is 1,446 parameters at 99.030000%, a +0.030000 percentage-point margin over 99%. There have been 87 prior macro-attempts in this family and 708 prior micro-trials. The most recent accepted result is attempt-0190/micro-0004 at 1446 parameters and 99.030000%; the most recent failed result is attempt-0189/micro-0005 (discard, 98.960000%). This is a parameterization-preserving compression of the depth-shared feed-forward input map: union flattened coordinates 217 and 218, values 0.0155541776 and 0.0161185041 (difference 5.643e-04), using a weighted mean and integer reconstruction. Hypothesis: nonlinear feature construction contains near-duplicate scalars independent of QKV redundancy, preserving qualification at 1,445 parameters. It is more informative than the next FF-input union (difference 5.731e-04) because it is the minimum-distortion isolated test at this new mechanism site. Official acceptance and rollback are unchanged.	0	0
attempt-0191	token-three-trial-revisit	micro-0001	a2ed48fc2d77cc7b377d3fb6cf79929462dfb267	00947b23ac6e15be44538474fa0868c7504e55fe	2026-08-17T13:55:45.506570+00:00	parameter tying	99.040000%	1444	keep	Union closest token-matrix scalar groups 4 and 162	Family: parameter tying. Current retained frontier is 1,445 parameters at 99.040000%, a +0.040000 percentage-point margin over 99%. There have been 88 prior macro-attempts in this family and 709 prior micro-trials. The most recent accepted result is attempt-0190/micro-0005 at 1445 parameters and 99.040000%; the most recent failed result is attempt-0189/micro-0005 (discard, 98.960000%). This is a parameterization-preserving compression of the tied input/output token matrix: union groups represented by flattened coordinates 4 and 162, whose values are 0.0315440930 and 0.0318314619 (difference 2.874e-04), using a multiplicity-weighted mean and one integer reconstruction map. Hypothesis: token scalars have a different sensitivity structure from the positional table and this minimum-distortion union preserves qualification while yielding 1,444 parameters. It is more informative than the next eligible token union (difference 2.892e-04) because it is the least perturbing test at this new tensor site. Acceptance and rollback remain solely governed by the official runner.	0	0
attempt-0191	token-three-trial-revisit	micro-0002	d3bc2136ed9ca925708384d9941e844d0207c30b	a2ed48fc2d77cc7b377d3fb6cf79929462dfb267	2026-08-17T13:57:03.570041+00:00	parameter tying	99.040000%	1443	keep	Union closest token-matrix scalar groups 140 and 161	Family: parameter tying. Current retained frontier is 1,444 parameters at 99.040000%, a +0.040000 percentage-point margin over 99%. There have been 88 prior macro-attempts in this family and 710 prior micro-trials. The most recent accepted result is attempt-0191/micro-0001 at 1444 parameters and 99.040000%; the most recent failed result is attempt-0189/micro-0005 (discard, 98.960000%). This is a parameterization-preserving compression of the tied input/output token matrix: union groups represented by flattened coordinates 140 and 161, whose values are 0.0038956304 and 0.0041848314 (difference 2.892e-04), using a multiplicity-weighted mean and one integer reconstruction map. Hypothesis: token scalars have a different sensitivity structure from the positional table and this minimum-distortion union preserves qualification while yielding 1,443 parameters. It is more informative than the next eligible token union (difference 3.238e-04) because it is the least perturbing test at this new tensor site. Acceptance and rollback remain solely governed by the official runner.	0	0
attempt-0191	token-three-trial-revisit	micro-0003	923ed6b3d0d7741d502c582ed5656aecf15c37a0	d3bc2136ed9ca925708384d9941e844d0207c30b	2026-08-17T13:58:20.601949+00:00	parameter tying	99.060000%	1442	keep	Union closest token-matrix scalar groups 17 and 37	Family: parameter tying. Current retained frontier is 1,443 parameters at 99.040000%, a +0.040000 percentage-point margin over 99%. There have been 88 prior macro-attempts in this family and 711 prior micro-trials. The most recent accepted result is attempt-0191/micro-0002 at 1443 parameters and 99.040000%; the most recent failed result is attempt-0189/micro-0005 (discard, 98.960000%). This is a parameterization-preserving compression of the tied input/output token matrix: union groups represented by flattened coordinates 17 and 37, whose values are 0.0175426248 and 0.0178664736 (difference 3.238e-04), using a multiplicity-weighted mean and one integer reconstruction map. Hypothesis: token scalars have a different sensitivity structure from the positional table and this minimum-distortion union preserves qualification while yielding 1,442 parameters. It is more informative than the next eligible token union (difference 3.546e-04) because it is the least perturbing test at this new tensor site. Acceptance and rollback remain solely governed by the official runner.	0	0
attempt-0192	position-three-trial-revisit	micro-0001	c3f3ecf5587af584419e6f50f840a3cdb6749793	923ed6b3d0d7741d502c582ed5656aecf15c37a0	2026-08-17T14:00:32.612310+00:00	parameter tying	99.060000%	1441	keep	Union closest position groups 16 and 17	Family: parameter tying. Current retained frontier is 1,442 parameters at 99.060000%, a +0.060000 percentage-point margin over 99%. There have been 89 prior macro-attempts in this family and 712 prior micro-trials. The most recent accepted result is attempt-0191/micro-0003 at 1442 parameters and 99.060000%; the most recent failed result is attempt-0189/micro-0005 (discard, 98.960000%). This is a parameterization-preserving compression: union current position groups represented by coordinates 16 and 17, whose learned values are 0.0330455899 and 0.0335068330 (absolute difference 4.612e-04), using a multiplicity-weighted mean. Hypothesis: this preserves qualification and yields 1,441 parameters. It is more informative than the nearest untested alternative (difference 4.710e-04) because it is the minimum-distortion eligible union; exact pairs already rejected under the unchanged grouping are excluded. Acceptance and rollback remain solely governed by the official runner.	0	0
attempt-0192	position-three-trial-revisit	micro-0002	5223dd05763202fce777d065c4324ae3db3217f6	c3f3ecf5587af584419e6f50f840a3cdb6749793	2026-08-17T14:02:15.543316+00:00	parameter tying	99.050000%	1440	keep	Union closest position groups 268 and 12	Family: parameter tying. Current retained frontier is 1,441 parameters at 99.060000%, a +0.060000 percentage-point margin over 99%. There have been 89 prior macro-attempts in this family and 713 prior micro-trials. The most recent accepted result is attempt-0192/micro-0001 at 1441 parameters and 99.060000%; the most recent failed result is attempt-0189/micro-0005 (discard, 98.960000%). This is a parameterization-preserving compression: union current position groups represented by coordinates 268 and 12, whose learned values are 0.0548642911 and 0.0553352423 (absolute difference 4.710e-04), using a multiplicity-weighted mean. Hypothesis: this preserves qualification and yields 1,440 parameters. It is more informative than the nearest untested alternative (difference 4.749e-04) because it is the minimum-distortion eligible union; exact pairs already rejected under the unchanged grouping are excluded. Acceptance and rollback remain solely governed by the official runner.	0	0
attempt-0192	position-three-trial-revisit	micro-0003	08de250fbf12c37ab353e602a524027af53cbbc7	5223dd05763202fce777d065c4324ae3db3217f6	2026-08-17T14:03:50.832136+00:00	parameter tying	99.060000%	1439	keep	Union closest position groups 236 and 357	Family: parameter tying. Current retained frontier is 1,440 parameters at 99.050000%, a +0.050000 percentage-point margin over 99%. There have been 89 prior macro-attempts in this family and 714 prior micro-trials. The most recent accepted result is attempt-0192/micro-0002 at 1440 parameters and 99.050000%; the most recent failed result is attempt-0189/micro-0005 (discard, 98.960000%). This is a parameterization-preserving compression: union current position groups represented by coordinates 236 and 357, whose learned values are 0.0319925994 and 0.0324674770 (absolute difference 4.749e-04), using a multiplicity-weighted mean. Hypothesis: this preserves qualification and yields 1,439 parameters. It is more informative than the nearest untested alternative (difference 4.753e-04) because it is the minimum-distortion eligible union; exact pairs already rejected under the unchanged grouping are excluded. Acceptance and rollback remain solely governed by the official runner.	0	0
attempt-0193	qkv-final-band-one	micro-0001	2ac0955cda9f5d077abad70c8ba70478688b9d08	08de250fbf12c37ab353e602a524027af53cbbc7	2026-08-17T14:06:12.933621+00:00	parameter tying	99.120000%	1438	keep	Union closest shared-QKV scalar groups 610 and 620	Family: parameter tying. Current retained frontier is 1,439 parameters at 99.060000%, a +0.060000 percentage-point margin over 99%. There have been 90 prior macro-attempts in this family and 715 prior micro-trials. The most recent accepted result is attempt-0185/micro-0002 at 1,479 parameters and 99.20%; the most recent failed result is attempt-0186/micro-0001 (block-0 pre-FF bias pair 8/3 discarded at 98.08%). This is a parameterization-preserving compression of the depth-shared QKV transform: union flattened coordinates 610 and 620, whose learned values are -0.0168875810 and -0.0166740753 (difference 2.135e-04), with a multiplicity-weighted mean and integer reconstruction map. Hypothesis: the much larger attention tensor contains near-duplicate scalars below the token failure scale, so this union preserves qualification and yields 1,438 parameters. It is more informative than the next QKV union (difference 2.153e-04) because it is the minimum-distortion test at this new site. Acceptance and rollback remain solely governed by the official runner.	0	0
