macro_attempt_id	automation_id	micro_attempt_id	commit	parent_commit	timestamp_utc	family	accuracy	parameters	status	description	proposal	train_exit	verify_exit
attempt-0160	qkv-skip-eight-sensitive-pairs	micro-0009	f9fb349418af25eba92f61fb19ee6817b7424994	7c1af90d1bf22147ff8e50ad67cf286467f6d5e6	2026-08-17T09:33:52.119034+00:00	parameter tying	99.010000%	1608	keep	Union closest shared-QKV scalar groups 181 and 269	Family: parameter tying. Current retained frontier is 1,609 parameters at 99.010000%, a +0.010000 percentage-point margin over 99%. There have been 57 prior macro-attempts in this family and 521 prior micro-trials. The most recent accepted result is attempt-0159/micro-0016 at 1,617 parameters and 99.02%; the most recent failed result is attempt-0159/micro-0017 (QKV pair 564/572 discarded at 98.99%). This is a parameterization-preserving compression of the depth-shared QKV transform: union flattened coordinates 181 and 269, whose learned values are 0.4247437119 and 0.4248718619 (difference 1.281e-04), with a multiplicity-weighted mean and integer reconstruction map. Hypothesis: the much larger attention tensor contains near-duplicate scalars below the token failure scale, so this union preserves qualification and yields 1,608 parameters. It is more informative than the next QKV union (difference 1.324e-04) because it is the minimum-distortion test at this new site. Acceptance and rollback remain solely governed by the official runner.	0	0
attempt-0160	qkv-skip-eight-sensitive-pairs	micro-0010	eba19dc3bb6485820d58108aea80c4d06a83b547	f9fb349418af25eba92f61fb19ee6817b7424994	2026-08-17T09:35:05.594584+00:00	parameter tying	99.010000%	1607	keep	Union closest shared-QKV scalar groups 647 and 604	Family: parameter tying. Current retained frontier is 1,608 parameters at 99.010000%, a +0.010000 percentage-point margin over 99%. There have been 57 prior macro-attempts in this family and 522 prior micro-trials. The most recent accepted result is attempt-0159/micro-0016 at 1,617 parameters and 99.02%; the most recent failed result is attempt-0159/micro-0017 (QKV pair 564/572 discarded at 98.99%). This is a parameterization-preserving compression of the depth-shared QKV transform: union flattened coordinates 647 and 604, whose learned values are 0.0282304808 and 0.0283628404 (difference 1.324e-04), with a multiplicity-weighted mean and integer reconstruction map. Hypothesis: the much larger attention tensor contains near-duplicate scalars below the token failure scale, so this union preserves qualification and yields 1,607 parameters. It is more informative than the next QKV union (difference 1.346e-04) because it is the minimum-distortion test at this new site. Acceptance and rollback remain solely governed by the official runner.	0	0
attempt-0160	qkv-skip-eight-sensitive-pairs	micro-0011	7319a225e0746185b5585989f92b4c59fa484ba7	eba19dc3bb6485820d58108aea80c4d06a83b547	2026-08-17T09:36:19.324760+00:00	parameter tying	99.010000%	1606	keep	Union closest shared-QKV scalar groups 673 and 615	Family: parameter tying. Current retained frontier is 1,607 parameters at 99.010000%, a +0.010000 percentage-point margin over 99%. There have been 57 prior macro-attempts in this family and 523 prior micro-trials. The most recent accepted result is attempt-0159/micro-0016 at 1,617 parameters and 99.02%; the most recent failed result is attempt-0159/micro-0017 (QKV pair 564/572 discarded at 98.99%). This is a parameterization-preserving compression of the depth-shared QKV transform: union flattened coordinates 673 and 615, whose learned values are -0.0187780708 and -0.0186434649 (difference 1.346e-04), with a multiplicity-weighted mean and integer reconstruction map. Hypothesis: the much larger attention tensor contains near-duplicate scalars below the token failure scale, so this union preserves qualification and yields 1,606 parameters. It is more informative than the next QKV union (difference 1.366e-04) because it is the minimum-distortion test at this new site. Acceptance and rollback remain solely governed by the official runner.	0	0
attempt-0160	qkv-skip-eight-sensitive-pairs	micro-0012	b745eb878220230c4ebe1d26cccb201e66793380	7319a225e0746185b5585989f92b4c59fa484ba7	2026-08-17T09:37:38.138454+00:00	parameter tying	99.010000%	1605	keep	Union closest shared-QKV scalar groups 342 and 698	Family: parameter tying. Current retained frontier is 1,606 parameters at 99.010000%, a +0.010000 percentage-point margin over 99%. There have been 57 prior macro-attempts in this family and 524 prior micro-trials. The most recent accepted result is attempt-0159/micro-0016 at 1,617 parameters and 99.02%; the most recent failed result is attempt-0159/micro-0017 (QKV pair 564/572 discarded at 98.99%). This is a parameterization-preserving compression of the depth-shared QKV transform: union flattened coordinates 342 and 698, whose learned values are 0.0409143828 and 0.0410509706 (difference 1.366e-04), with a multiplicity-weighted mean and integer reconstruction map. Hypothesis: the much larger attention tensor contains near-duplicate scalars below the token failure scale, so this union preserves qualification and yields 1,605 parameters. It is more informative than the next QKV union (difference 1.411e-04) because it is the minimum-distortion test at this new site. Acceptance and rollback remain solely governed by the official runner.	0	0
attempt-0160	qkv-skip-eight-sensitive-pairs	micro-0013	47b41226f1571b6af03b6246cd7762baf35f5313	b745eb878220230c4ebe1d26cccb201e66793380	2026-08-17T09:39:08.765028+00:00	parameter tying	98.990000%	1604	discard	Union closest shared-QKV scalar groups 598 and 610	Family: parameter tying. Current retained frontier is 1,605 parameters at 99.010000%, a +0.010000 percentage-point margin over 99%. There have been 57 prior macro-attempts in this family and 525 prior micro-trials. The most recent accepted result is attempt-0159/micro-0016 at 1,617 parameters and 99.02%; the most recent failed result is attempt-0159/micro-0017 (QKV pair 564/572 discarded at 98.99%). This is a parameterization-preserving compression of the depth-shared QKV transform: union flattened coordinates 598 and 610, whose learned values are -0.0170287304 and -0.0168875810 (difference 1.411e-04), with a multiplicity-weighted mean and integer reconstruction map. Hypothesis: the much larger attention tensor contains near-duplicate scalars below the token failure scale, so this union preserves qualification and yields 1,604 parameters. It is more informative than the next QKV union (difference 1.429e-04) because it is the minimum-distortion test at this new site. Acceptance and rollback remain solely governed by the official runner.	0	0
attempt-0161	qkv-skip-nine-sensitive-pairs	micro-0001	06bb66b12704ff67f699bbbe1f59a42078fb901d	b745eb878220230c4ebe1d26cccb201e66793380	2026-08-17T09:41:06.210230+00:00	parameter tying	98.990000%	1604	discard	Union closest shared-QKV scalar groups 648 and 538	Family: parameter tying. Current retained frontier is 1,605 parameters at 99.010000%, a +0.010000 percentage-point margin over 99%. There have been 58 prior macro-attempts in this family and 526 prior micro-trials. The most recent accepted result is attempt-0160/micro-0012 at 1,605 parameters and 99.01%; the most recent failed result is attempt-0160/micro-0013 (QKV pair 598/610 discarded at 98.99%). This is a parameterization-preserving compression of the depth-shared QKV transform: union flattened coordinates 648 and 538, whose learned values are -0.0062563666 and -0.0061134272 (difference 1.429e-04), with a multiplicity-weighted mean and integer reconstruction map. Hypothesis: the much larger attention tensor contains near-duplicate scalars below the token failure scale, so this union preserves qualification and yields 1,604 parameters. It is more informative than the next QKV union (difference 1.443e-04) because it is the minimum-distortion test at this new site. Acceptance and rollback remain solely governed by the official runner.	0	0
attempt-0162	qkv-plateau-check-after-ten-skips	micro-0001	76254ce6f4bc0e7ae47319711ff6435a0671f52c	b745eb878220230c4ebe1d26cccb201e66793380	2026-08-17T09:42:57.184927+00:00	parameter tying	99.010000%	1604	keep	Union closest shared-QKV scalar groups 701 and 270	Family: parameter tying. Current retained frontier is 1,605 parameters at 99.010000%, a +0.010000 percentage-point margin over 99%. There have been 59 prior macro-attempts in this family and 527 prior micro-trials. The most recent accepted result is attempt-0160/micro-0012 at 1,605 parameters and 99.01%; the most recent failed result is attempt-0161/micro-0001 (QKV pair 648/538 discarded at 98.99%). This is a parameterization-preserving compression of the depth-shared QKV transform: union flattened coordinates 701 and 270, whose learned values are 0.0760830641 and 0.0762274116 (difference 1.443e-04), with a multiplicity-weighted mean and integer reconstruction map. Hypothesis: the much larger attention tensor contains near-duplicate scalars below the token failure scale, so this union preserves qualification and yields 1,604 parameters. It is more informative than the next QKV union (difference 1.459e-04) because it is the minimum-distortion test at this new site. Acceptance and rollback remain solely governed by the official runner.	0	0
attempt-0162	qkv-plateau-check-after-ten-skips	micro-0002	c40e13ff31bb4284455e1f35e3e17c6cefb2bd78	76254ce6f4bc0e7ae47319711ff6435a0671f52c	2026-08-17T09:44:11.786245+00:00	parameter tying	99.000000%	1603	keep	Union closest shared-QKV scalar groups 309 and 549	Family: parameter tying. Current retained frontier is 1,604 parameters at 99.010000%, a +0.010000 percentage-point margin over 99%. There have been 59 prior macro-attempts in this family and 528 prior micro-trials. The most recent accepted result is attempt-0160/micro-0012 at 1,605 parameters and 99.01%; the most recent failed result is attempt-0161/micro-0001 (QKV pair 648/538 discarded at 98.99%). This is a parameterization-preserving compression of the depth-shared QKV transform: union flattened coordinates 309 and 549, whose learned values are -0.0050775958 and -0.0049317423 (difference 1.459e-04), with a multiplicity-weighted mean and integer reconstruction map. Hypothesis: the much larger attention tensor contains near-duplicate scalars below the token failure scale, so this union preserves qualification and yields 1,603 parameters. It is more informative than the next QKV union (difference 1.483e-04) because it is the minimum-distortion test at this new site. Acceptance and rollback remain solely governed by the official runner.	0	0
attempt-0162	qkv-plateau-check-after-ten-skips	micro-0003	d0c9a58107dcfdf7490affc26f40673509ec08bf	c40e13ff31bb4284455e1f35e3e17c6cefb2bd78	2026-08-17T09:45:26.957232+00:00	parameter tying	99.000000%	1602	keep	Union closest shared-QKV scalar groups 111 and 177	Family: parameter tying. Current retained frontier is 1,603 parameters at 99.000000%, a +0.000000 percentage-point margin over 99%. There have been 59 prior macro-attempts in this family and 529 prior micro-trials. The most recent accepted result is attempt-0160/micro-0012 at 1,605 parameters and 99.01%; the most recent failed result is attempt-0161/micro-0001 (QKV pair 648/538 discarded at 98.99%). This is a parameterization-preserving compression of the depth-shared QKV transform: union flattened coordinates 111 and 177, whose learned values are -0.0479781106 and -0.0478297807 (difference 1.483e-04), with a multiplicity-weighted mean and integer reconstruction map. Hypothesis: the much larger attention tensor contains near-duplicate scalars below the token failure scale, so this union preserves qualification and yields 1,602 parameters. It is more informative than the next QKV union (difference 1.549e-04) because it is the minimum-distortion test at this new site. Acceptance and rollback remain solely governed by the official runner.	0	0
attempt-0162	qkv-plateau-check-after-ten-skips	micro-0004	94f14b4525495918738dc95216466761c95679e6	d0c9a58107dcfdf7490affc26f40673509ec08bf	2026-08-17T09:46:42.060909+00:00	parameter tying	99.000000%	1601	keep	Union closest shared-QKV scalar groups 55 and 505	Family: parameter tying. Current retained frontier is 1,602 parameters at 99.000000%, a +0.000000 percentage-point margin over 99%. There have been 59 prior macro-attempts in this family and 530 prior micro-trials. The most recent accepted result is attempt-0160/micro-0012 at 1,605 parameters and 99.01%; the most recent failed result is attempt-0161/micro-0001 (QKV pair 648/538 discarded at 98.99%). This is a parameterization-preserving compression of the depth-shared QKV transform: union flattened coordinates 55 and 505, whose learned values are 0.1623197794 and 0.1624746472 (difference 1.549e-04), with a multiplicity-weighted mean and integer reconstruction map. Hypothesis: the much larger attention tensor contains near-duplicate scalars below the token failure scale, so this union preserves qualification and yields 1,601 parameters. It is more informative than the next QKV union (difference 1.589e-04) because it is the minimum-distortion test at this new site. Acceptance and rollback remain solely governed by the official runner.	0	0
attempt-0162	qkv-plateau-check-after-ten-skips	micro-0005	3ea23f40715fa03116fd07c8c9b231129528c094	94f14b4525495918738dc95216466761c95679e6	2026-08-17T09:47:56.611103+00:00	parameter tying	99.000000%	1600	keep	Union closest shared-QKV scalar groups 398 and 306	Family: parameter tying. Current retained frontier is 1,601 parameters at 99.000000%, a +0.000000 percentage-point margin over 99%. There have been 59 prior macro-attempts in this family and 531 prior micro-trials. The most recent accepted result is attempt-0160/micro-0012 at 1,605 parameters and 99.01%; the most recent failed result is attempt-0161/micro-0001 (QKV pair 648/538 discarded at 98.99%). This is a parameterization-preserving compression of the depth-shared QKV transform: union flattened coordinates 398 and 306, whose learned values are -0.3367742002 and -0.3366152942 (difference 1.589e-04), with a multiplicity-weighted mean and integer reconstruction map. Hypothesis: the much larger attention tensor contains near-duplicate scalars below the token failure scale, so this union preserves qualification and yields 1,600 parameters. It is more informative than the next QKV union (difference 1.606e-04) because it is the minimum-distortion test at this new site. Acceptance and rollback remain solely governed by the official runner.	0	0
attempt-0162	qkv-plateau-check-after-ten-skips	micro-0006	603ab4fb2f1ceaea587f5d00ffaf9684846ac2c9	3ea23f40715fa03116fd07c8c9b231129528c094	2026-08-17T09:49:15.131772+00:00	parameter tying	99.000000%	1599	keep	Union closest shared-QKV scalar groups 391 and 664	Family: parameter tying. Current retained frontier is 1,600 parameters at 99.000000%, a +0.000000 percentage-point margin over 99%. There have been 59 prior macro-attempts in this family and 532 prior micro-trials. The most recent accepted result is attempt-0160/micro-0012 at 1,605 parameters and 99.01%; the most recent failed result is attempt-0161/micro-0001 (QKV pair 648/538 discarded at 98.99%). This is a parameterization-preserving compression of the depth-shared QKV transform: union flattened coordinates 391 and 664, whose learned values are -0.0085642189 and -0.0084036654 (difference 1.606e-04), with a multiplicity-weighted mean and integer reconstruction map. Hypothesis: the much larger attention tensor contains near-duplicate scalars below the token failure scale, so this union preserves qualification and yields 1,599 parameters. It is more informative than the next QKV union (difference 1.620e-04) because it is the minimum-distortion test at this new site. Acceptance and rollback remain solely governed by the official runner.	0	0
attempt-0162	qkv-plateau-check-after-ten-skips	micro-0007	1f5ae86ec78f51fc1f89287cb01afa8ff7c34c62	603ab4fb2f1ceaea587f5d00ffaf9684846ac2c9	2026-08-17T09:50:39.499133+00:00	parameter tying	98.890000%	1598	discard	Union closest shared-QKV scalar groups 644 and 708	Family: parameter tying. Current retained frontier is 1,599 parameters at 99.000000%, a +0.000000 percentage-point margin over 99%. There have been 59 prior macro-attempts in this family and 533 prior micro-trials. The most recent accepted result is attempt-0160/micro-0012 at 1,605 parameters and 99.01%; the most recent failed result is attempt-0161/micro-0001 (QKV pair 648/538 discarded at 98.99%). This is a parameterization-preserving compression of the depth-shared QKV transform: union flattened coordinates 644 and 708, whose learned values are -0.0057803672 and -0.0056183636 (difference 1.620e-04), with a multiplicity-weighted mean and integer reconstruction map. Hypothesis: the much larger attention tensor contains near-duplicate scalars below the token failure scale, so this union preserves qualification and yields 1,598 parameters. It is more informative than the next QKV union (difference 1.627e-04) because it is the minimum-distortion test at this new site. Acceptance and rollback remain solely governed by the official runner.	0	0
attempt-0163	qkv-skip-eleven-sensitive-pairs	micro-0001	6c41f5b03fb26aade7b64d012703c94b21fd9f75	603ab4fb2f1ceaea587f5d00ffaf9684846ac2c9	2026-08-17T09:52:29.517565+00:00	parameter tying	99.000000%	1598	keep	Union closest shared-QKV scalar groups 120 and 472	Family: parameter tying. Current retained frontier is 1,599 parameters at 99.000000%, a +0.000000 percentage-point margin over 99%. There have been 60 prior macro-attempts in this family and 534 prior micro-trials. The most recent accepted result is attempt-0162/micro-0006 at 1,599 parameters and 99.00%; the most recent failed result is attempt-0162/micro-0007 (QKV pair 644/708 discarded at 98.89%). This is a parameterization-preserving compression of the depth-shared QKV transform: union flattened coordinates 120 and 472, whose learned values are -0.4357135892 and -0.4355508685 (difference 1.627e-04), with a multiplicity-weighted mean and integer reconstruction map. Hypothesis: the much larger attention tensor contains near-duplicate scalars below the token failure scale, so this union preserves qualification and yields 1,598 parameters. It is more informative than the next QKV union (difference 1.640e-04) because it is the minimum-distortion test at this new site. Acceptance and rollback remain solely governed by the official runner.	0	0
attempt-0163	qkv-skip-eleven-sensitive-pairs	micro-0002	b807f6751d082ea554b2ca8915aa2b99df9e0299	6c41f5b03fb26aade7b64d012703c94b21fd9f75	2026-08-17T09:53:43.897933+00:00	parameter tying	99.000000%	1597	keep	Union closest shared-QKV scalar groups 337 and 733	Family: parameter tying. Current retained frontier is 1,598 parameters at 99.000000%, a +0.000000 percentage-point margin over 99%. There have been 60 prior macro-attempts in this family and 535 prior micro-trials. The most recent accepted result is attempt-0162/micro-0006 at 1,599 parameters and 99.00%; the most recent failed result is attempt-0162/micro-0007 (QKV pair 644/708 discarded at 98.89%). This is a parameterization-preserving compression of the depth-shared QKV transform: union flattened coordinates 337 and 733, whose learned values are -0.0319854580 and -0.0318214297 (difference 1.640e-04), with a multiplicity-weighted mean and integer reconstruction map. Hypothesis: the much larger attention tensor contains near-duplicate scalars below the token failure scale, so this union preserves qualification and yields 1,597 parameters. It is more informative than the next QKV union (difference 1.644e-04) because it is the minimum-distortion test at this new site. Acceptance and rollback remain solely governed by the official runner.	0	0
attempt-0163	qkv-skip-eleven-sensitive-pairs	micro-0003	72deec14d3608bafb41a7c694ca0b265bef9f815	b807f6751d082ea554b2ca8915aa2b99df9e0299	2026-08-17T09:54:55.713107+00:00	parameter tying	98.950000%	1596	discard	Union closest shared-QKV scalar groups 651 and 596	Family: parameter tying. Current retained frontier is 1,597 parameters at 99.000000%, a +0.000000 percentage-point margin over 99%. There have been 60 prior macro-attempts in this family and 536 prior micro-trials. The most recent accepted result is attempt-0162/micro-0006 at 1,599 parameters and 99.00%; the most recent failed result is attempt-0162/micro-0007 (QKV pair 644/708 discarded at 98.89%). This is a parameterization-preserving compression of the depth-shared QKV transform: union flattened coordinates 651 and 596, whose learned values are 0.0019581029 and 0.0021224874 (difference 1.644e-04), with a multiplicity-weighted mean and integer reconstruction map. Hypothesis: the much larger attention tensor contains near-duplicate scalars below the token failure scale, so this union preserves qualification and yields 1,596 parameters. It is more informative than the next QKV union (difference 1.651e-04) because it is the minimum-distortion test at this new site. Acceptance and rollback remain solely governed by the official runner.	0	0
