macro_attempt_id	automation_id	micro_attempt_id	commit	parent_commit	timestamp_utc	family	accuracy	parameters	status	description	proposal	train_exit	verify_exit
attempt-0078	nearest-position-unions-infra-repair	micro-0134	9b0d86ef521e95b231eece43b7b60630ca636ae1	c1b6c853e3b286925550f021dc4cb79e0357cc67	2026-08-16T23:28:22.315687+00:00	parameter tying	99.060000%	1951	keep	Union closest position groups 360 and 430	Family: parameter tying. Current retained frontier is 1,952 parameters at 99.060000%, a +0.060000 percentage-point margin over 99%. There have been 20 prior macro-attempts in this family and 154 prior micro-trials. The most recent accepted result is attempt-0078/micro-0133 at 1952 parameters and 99.060000%; the most recent failed result is attempt-0075/micro-0001 (error, no score). This is a parameterization-preserving compression: union current position groups represented by coordinates 360 and 430, whose learned values are -0.0227223244 and -0.0226343609 (absolute difference 8.796e-05), using a multiplicity-weighted mean. Hypothesis: this preserves qualification and yields 1,951 parameters. It is more informative than the nearest untested alternative (difference 8.975e-05) because it is the minimum-distortion eligible union; exact pairs already rejected under the unchanged grouping are excluded. Acceptance and rollback remain solely governed by the official runner.	0	0
attempt-0078	nearest-position-unions-infra-repair	micro-0135	9ad50114c4ec4c120d642b35c075bb1b7021f4d1	9b0d86ef521e95b231eece43b7b60630ca636ae1	2026-08-16T23:29:25.299036+00:00	parameter tying	99.050000%	1950	keep	Union closest position groups 181 and 207	Family: parameter tying. Current retained frontier is 1,951 parameters at 99.060000%, a +0.060000 percentage-point margin over 99%. There have been 20 prior macro-attempts in this family and 155 prior micro-trials. The most recent accepted result is attempt-0078/micro-0134 at 1951 parameters and 99.060000%; the most recent failed result is attempt-0075/micro-0001 (error, no score). This is a parameterization-preserving compression: union current position groups represented by coordinates 181 and 207, whose learned values are -0.0032595117 and -0.0031697620 (absolute difference 8.975e-05), using a multiplicity-weighted mean. Hypothesis: this preserves qualification and yields 1,950 parameters. It is more informative than the nearest untested alternative (difference 8.978e-05) because it is the minimum-distortion eligible union; exact pairs already rejected under the unchanged grouping are excluded. Acceptance and rollback remain solely governed by the official runner.	0	0
attempt-0078	nearest-position-unions-infra-repair	micro-0136	a5eb583539a113ddc4e9dc2392f7abadd52087a6	9ad50114c4ec4c120d642b35c075bb1b7021f4d1	2026-08-16T23:30:27.821003+00:00	parameter tying	99.050000%	1949	keep	Union closest position groups 415 and 227	Family: parameter tying. Current retained frontier is 1,950 parameters at 99.050000%, a +0.050000 percentage-point margin over 99%. There have been 20 prior macro-attempts in this family and 156 prior micro-trials. The most recent accepted result is attempt-0078/micro-0135 at 1950 parameters and 99.050000%; the most recent failed result is attempt-0075/micro-0001 (error, no score). This is a parameterization-preserving compression: union current position groups represented by coordinates 415 and 227, whose learned values are -0.0014829371 and -0.0013931614 (absolute difference 8.978e-05), using a multiplicity-weighted mean. Hypothesis: this preserves qualification and yields 1,949 parameters. It is more informative than the nearest untested alternative (difference 8.995e-05) because it is the minimum-distortion eligible union; exact pairs already rejected under the unchanged grouping are excluded. Acceptance and rollback remain solely governed by the official runner.	0	0
attempt-0078	nearest-position-unions-infra-repair	micro-0137	32da9a919c8a78b04332c9c3ba2aaa4de8cb2734	a5eb583539a113ddc4e9dc2392f7abadd52087a6	2026-08-16T23:31:29.998612+00:00	parameter tying	99.060000%	1948	keep	Union closest position groups 111 and 294	Family: parameter tying. Current retained frontier is 1,949 parameters at 99.050000%, a +0.050000 percentage-point margin over 99%. There have been 20 prior macro-attempts in this family and 157 prior micro-trials. The most recent accepted result is attempt-0078/micro-0136 at 1949 parameters and 99.050000%; the most recent failed result is attempt-0075/micro-0001 (error, no score). This is a parameterization-preserving compression: union current position groups represented by coordinates 111 and 294, whose learned values are 0.0052358620 and 0.0053258119 (absolute difference 8.995e-05), using a multiplicity-weighted mean. Hypothesis: this preserves qualification and yields 1,948 parameters. It is more informative than the nearest untested alternative (difference 9.023e-05) because it is the minimum-distortion eligible union; exact pairs already rejected under the unchanged grouping are excluded. Acceptance and rollback remain solely governed by the official runner.	0	0
attempt-0078	nearest-position-unions-infra-repair	micro-0138	7a1c92fe2c0078c0c6ef27bd15f101818dfa055d	32da9a919c8a78b04332c9c3ba2aaa4de8cb2734	2026-08-16T23:32:32.730073+00:00	parameter tying	99.060000%	1947	keep	Union closest position groups 22 and 257	Family: parameter tying. Current retained frontier is 1,948 parameters at 99.060000%, a +0.060000 percentage-point margin over 99%. There have been 20 prior macro-attempts in this family and 158 prior micro-trials. The most recent accepted result is attempt-0078/micro-0137 at 1948 parameters and 99.060000%; the most recent failed result is attempt-0075/micro-0001 (error, no score). This is a parameterization-preserving compression: union current position groups represented by coordinates 22 and 257, whose learned values are 0.0212207660 and 0.0213109925 (absolute difference 9.023e-05), using a multiplicity-weighted mean. Hypothesis: this preserves qualification and yields 1,947 parameters. It is more informative than the nearest untested alternative (difference 9.095e-05) because it is the minimum-distortion eligible union; exact pairs already rejected under the unchanged grouping are excluded. Acceptance and rollback remain solely governed by the official runner.	0	0
attempt-0078	nearest-position-unions-infra-repair	micro-0139	571d0c09f774d6c96c0f644052a4ff1ba5aad964	7a1c92fe2c0078c0c6ef27bd15f101818dfa055d	2026-08-16T23:33:35.545632+00:00	parameter tying	99.060000%	1946	keep	Union closest position groups 298 and 367	Family: parameter tying. Current retained frontier is 1,947 parameters at 99.060000%, a +0.060000 percentage-point margin over 99%. There have been 20 prior macro-attempts in this family and 159 prior micro-trials. The most recent accepted result is attempt-0078/micro-0138 at 1947 parameters and 99.060000%; the most recent failed result is attempt-0075/micro-0001 (error, no score). This is a parameterization-preserving compression: union current position groups represented by coordinates 298 and 367, whose learned values are 0.0117424754 and 0.0118334228 (absolute difference 9.095e-05), using a multiplicity-weighted mean. Hypothesis: this preserves qualification and yields 1,946 parameters. It is more informative than the nearest untested alternative (difference 9.106e-05) because it is the minimum-distortion eligible union; exact pairs already rejected under the unchanged grouping are excluded. Acceptance and rollback remain solely governed by the official runner.	0	0
attempt-0078	nearest-position-unions-infra-repair	micro-0140	157d7fc6bfa2ef700e59a6ca2c0e99035d838346	571d0c09f774d6c96c0f644052a4ff1ba5aad964	2026-08-16T23:34:37.882813+00:00	parameter tying	99.060000%	1945	keep	Union closest position groups 326 and 223	Family: parameter tying. Current retained frontier is 1,946 parameters at 99.060000%, a +0.060000 percentage-point margin over 99%. There have been 20 prior macro-attempts in this family and 160 prior micro-trials. The most recent accepted result is attempt-0078/micro-0139 at 1946 parameters and 99.060000%; the most recent failed result is attempt-0075/micro-0001 (error, no score). This is a parameterization-preserving compression: union current position groups represented by coordinates 326 and 223, whose learned values are -0.0049242694 and -0.0048332112 (absolute difference 9.106e-05), using a multiplicity-weighted mean. Hypothesis: this preserves qualification and yields 1,945 parameters. It is more informative than the nearest untested alternative (difference 9.238e-05) because it is the minimum-distortion eligible union; exact pairs already rejected under the unchanged grouping are excluded. Acceptance and rollback remain solely governed by the official runner.	0	0
attempt-0078	nearest-position-unions-infra-repair	micro-0141	867c57a68a47d3daf4c566d4450102c0bb62b826	157d7fc6bfa2ef700e59a6ca2c0e99035d838346	2026-08-16T23:35:39.445479+00:00	parameter tying	99.060000%	1944	keep	Union closest position groups 295 and 423	Family: parameter tying. Current retained frontier is 1,945 parameters at 99.060000%, a +0.060000 percentage-point margin over 99%. There have been 20 prior macro-attempts in this family and 161 prior micro-trials. The most recent accepted result is attempt-0078/micro-0140 at 1945 parameters and 99.060000%; the most recent failed result is attempt-0075/micro-0001 (error, no score). This is a parameterization-preserving compression: union current position groups represented by coordinates 295 and 423, whose learned values are 0.0098492969 and 0.0099416766 (absolute difference 9.238e-05), using a multiplicity-weighted mean. Hypothesis: this preserves qualification and yields 1,944 parameters. It is more informative than the nearest untested alternative (difference 9.413e-05) because it is the minimum-distortion eligible union; exact pairs already rejected under the unchanged grouping are excluded. Acceptance and rollback remain solely governed by the official runner.	0	0
attempt-0078	nearest-position-unions-infra-repair	micro-0142	cf1641db3955bde92e65721d25442c6634fa3b35	867c57a68a47d3daf4c566d4450102c0bb62b826	2026-08-16T23:36:41.922448+00:00	parameter tying	99.060000%	1943	keep	Union closest position groups 341 and 121	Family: parameter tying. Current retained frontier is 1,944 parameters at 99.060000%, a +0.060000 percentage-point margin over 99%. There have been 20 prior macro-attempts in this family and 162 prior micro-trials. The most recent accepted result is attempt-0078/micro-0141 at 1944 parameters and 99.060000%; the most recent failed result is attempt-0075/micro-0001 (error, no score). This is a parameterization-preserving compression: union current position groups represented by coordinates 341 and 121, whose learned values are -0.0214705728 and -0.0213764384 (absolute difference 9.413e-05), using a multiplicity-weighted mean. Hypothesis: this preserves qualification and yields 1,943 parameters. It is more informative than the nearest untested alternative (difference 9.850e-05) because it is the minimum-distortion eligible union; exact pairs already rejected under the unchanged grouping are excluded. Acceptance and rollback remain solely governed by the official runner.	0	0
attempt-0078	nearest-position-unions-infra-repair	micro-0143	508c723c0f1069213b8310bd8386d14a83cc8697	cf1641db3955bde92e65721d25442c6634fa3b35	2026-08-16T23:37:43.659935+00:00	parameter tying	99.070000%	1942	keep	Union closest position groups 243 and 272	Family: parameter tying. Current retained frontier is 1,943 parameters at 99.060000%, a +0.060000 percentage-point margin over 99%. There have been 20 prior macro-attempts in this family and 163 prior micro-trials. The most recent accepted result is attempt-0078/micro-0142 at 1943 parameters and 99.060000%; the most recent failed result is attempt-0075/micro-0001 (error, no score). This is a parameterization-preserving compression: union current position groups represented by coordinates 243 and 272, whose learned values are 0.0047449716 and 0.0048434748 (absolute difference 9.850e-05), using a multiplicity-weighted mean. Hypothesis: this preserves qualification and yields 1,942 parameters. It is more informative than the nearest untested alternative (difference 9.851e-05) because it is the minimum-distortion eligible union; exact pairs already rejected under the unchanged grouping are excluded. Acceptance and rollback remain solely governed by the official runner.	0	0
attempt-0078	nearest-position-unions-infra-repair	micro-0144	dec2eeeafd51a27fbccecc0fccf4cbf80abecc32	508c723c0f1069213b8310bd8386d14a83cc8697	2026-08-16T23:38:44.774590+00:00	parameter tying	99.090000%	1941	keep	Union closest position groups 64 and 94	Family: parameter tying. Current retained frontier is 1,942 parameters at 99.070000%, a +0.070000 percentage-point margin over 99%. There have been 20 prior macro-attempts in this family and 164 prior micro-trials. The most recent accepted result is attempt-0078/micro-0143 at 1942 parameters and 99.070000%; the most recent failed result is attempt-0075/micro-0001 (error, no score). This is a parameterization-preserving compression: union current position groups represented by coordinates 64 and 94, whose learned values are 0.0043092514 and 0.0044077607 (absolute difference 9.851e-05), using a multiplicity-weighted mean. Hypothesis: this preserves qualification and yields 1,941 parameters. It is more informative than the nearest untested alternative (difference 9.920e-05) because it is the minimum-distortion eligible union; exact pairs already rejected under the unchanged grouping are excluded. Acceptance and rollback remain solely governed by the official runner.	0	0
attempt-0078	nearest-position-unions-infra-repair	micro-0145	361f32b92c7cd06cc580ffd0d6c4840fc0345870	dec2eeeafd51a27fbccecc0fccf4cbf80abecc32	2026-08-16T23:39:46.627886+00:00	parameter tying	99.090000%	1940	keep	Union closest position groups 374 and 15	Family: parameter tying. Current retained frontier is 1,941 parameters at 99.090000%, a +0.090000 percentage-point margin over 99%. There have been 20 prior macro-attempts in this family and 165 prior micro-trials. The most recent accepted result is attempt-0078/micro-0144 at 1941 parameters and 99.090000%; the most recent failed result is attempt-0075/micro-0001 (error, no score). This is a parameterization-preserving compression: union current position groups represented by coordinates 374 and 15, whose learned values are -0.0337067358 and -0.0336075351 (absolute difference 9.920e-05), using a multiplicity-weighted mean. Hypothesis: this preserves qualification and yields 1,940 parameters. It is more informative than the nearest untested alternative (difference 1.016e-04) because it is the minimum-distortion eligible union; exact pairs already rejected under the unchanged grouping are excluded. Acceptance and rollback remain solely governed by the official runner.	0	0
attempt-0078	nearest-position-unions-infra-repair	micro-0146	259f2bdd3c9b567c35c7258eaa6a3748c819ea27	361f32b92c7cd06cc580ffd0d6c4840fc0345870	2026-08-16T23:40:48.742892+00:00	parameter tying	99.080000%	1939	keep	Union closest position groups 173 and 37	Family: parameter tying. Current retained frontier is 1,940 parameters at 99.090000%, a +0.090000 percentage-point margin over 99%. There have been 20 prior macro-attempts in this family and 166 prior micro-trials. The most recent accepted result is attempt-0078/micro-0145 at 1940 parameters and 99.090000%; the most recent failed result is attempt-0075/micro-0001 (error, no score). This is a parameterization-preserving compression: union current position groups represented by coordinates 173 and 37, whose learned values are -0.0081238542 and -0.0080222562 (absolute difference 1.016e-04), using a multiplicity-weighted mean. Hypothesis: this preserves qualification and yields 1,939 parameters. It is more informative than the nearest untested alternative (difference 1.033e-04) because it is the minimum-distortion eligible union; exact pairs already rejected under the unchanged grouping are excluded. Acceptance and rollback remain solely governed by the official runner.	0	0
attempt-0078	nearest-position-unions-infra-repair	micro-0147	058de5de30871dd8a5715eb4c65a55cdbc3ae843	259f2bdd3c9b567c35c7258eaa6a3748c819ea27	2026-08-16T23:41:53.343417+00:00	parameter tying	99.080000%	1938	keep	Union closest position groups 300 and 16	Family: parameter tying. Current retained frontier is 1,939 parameters at 99.080000%, a +0.080000 percentage-point margin over 99%. There have been 20 prior macro-attempts in this family and 167 prior micro-trials. The most recent accepted result is attempt-0078/micro-0146 at 1939 parameters and 99.080000%; the most recent failed result is attempt-0075/micro-0001 (error, no score). This is a parameterization-preserving compression: union current position groups represented by coordinates 300 and 16, whose learned values are 0.0330116749 and 0.0331149250 (absolute difference 1.033e-04), using a multiplicity-weighted mean. Hypothesis: this preserves qualification and yields 1,938 parameters. It is more informative than the nearest untested alternative (difference 1.045e-04) because it is the minimum-distortion eligible union; exact pairs already rejected under the unchanged grouping are excluded. Acceptance and rollback remain solely governed by the official runner.	0	0
attempt-0078	nearest-position-unions-infra-repair	micro-0148	dee1de579c3fa61c64d923cfdcc48a692092ce13	058de5de30871dd8a5715eb4c65a55cdbc3ae843	2026-08-16T23:42:56.216732+00:00	parameter tying	99.080000%	1937	keep	Union closest position groups 380 and 158	Family: parameter tying. Current retained frontier is 1,938 parameters at 99.080000%, a +0.080000 percentage-point margin over 99%. There have been 20 prior macro-attempts in this family and 168 prior micro-trials. The most recent accepted result is attempt-0078/micro-0147 at 1938 parameters and 99.080000%; the most recent failed result is attempt-0075/micro-0001 (error, no score). This is a parameterization-preserving compression: union current position groups represented by coordinates 380 and 158, whose learned values are -0.0327290781 and -0.0326245762 (absolute difference 1.045e-04), using a multiplicity-weighted mean. Hypothesis: this preserves qualification and yields 1,937 parameters. It is more informative than the nearest untested alternative (difference 1.050e-04) because it is the minimum-distortion eligible union; exact pairs already rejected under the unchanged grouping are excluded. Acceptance and rollback remain solely governed by the official runner.	0	0
attempt-0078	nearest-position-unions-infra-repair	micro-0149	824e2ca3e5121d1b40d9629b2b59b5a5d3052d3b	dee1de579c3fa61c64d923cfdcc48a692092ce13	2026-08-16T23:43:59.791084+00:00	parameter tying	99.080000%	1936	keep	Union closest position groups 359 and 329	Family: parameter tying. Current retained frontier is 1,937 parameters at 99.080000%, a +0.080000 percentage-point margin over 99%. There have been 20 prior macro-attempts in this family and 169 prior micro-trials. The most recent accepted result is attempt-0078/micro-0148 at 1937 parameters and 99.080000%; the most recent failed result is attempt-0075/micro-0001 (error, no score). This is a parameterization-preserving compression: union current position groups represented by coordinates 359 and 329, whose learned values are 0.0289660208 and 0.0290710703 (absolute difference 1.050e-04), using a multiplicity-weighted mean. Hypothesis: this preserves qualification and yields 1,936 parameters. It is more informative than the nearest untested alternative (difference 1.066e-04) because it is the minimum-distortion eligible union; exact pairs already rejected under the unchanged grouping are excluded. Acceptance and rollback remain solely governed by the official runner.	0	0
attempt-0078	nearest-position-unions-infra-repair	micro-0150	17f3f7db8df754d85c834c2225ce2f11ec1dc927	824e2ca3e5121d1b40d9629b2b59b5a5d3052d3b	2026-08-16T23:45:02.551756+00:00	parameter tying	99.080000%	1935	keep	Union closest position groups 287 and 217	Family: parameter tying. Current retained frontier is 1,936 parameters at 99.080000%, a +0.080000 percentage-point margin over 99%. There have been 20 prior macro-attempts in this family and 170 prior micro-trials. The most recent accepted result is attempt-0078/micro-0149 at 1936 parameters and 99.080000%; the most recent failed result is attempt-0075/micro-0001 (error, no score). This is a parameterization-preserving compression: union current position groups represented by coordinates 287 and 217, whose learned values are 0.0023039002 and 0.0024104780 (absolute difference 1.066e-04), using a multiplicity-weighted mean. Hypothesis: this preserves qualification and yields 1,935 parameters. It is more informative than the nearest untested alternative (difference 1.091e-04) because it is the minimum-distortion eligible union; exact pairs already rejected under the unchanged grouping are excluded. Acceptance and rollback remain solely governed by the official runner.	0	0
