macro_attempt_id	automation_id	micro_attempt_id	commit	parent_commit	timestamp_utc	family	accuracy	parameters	status	description	proposal	train_exit	verify_exit
attempt-0078	nearest-position-unions-infra-repair	micro-0117	e48441f7f634af3d02d15256bbd80dc4f873b41b	a94a2d02ac475765985108f175efca5a4c2f9bbb	2026-08-16T23:10:33.298399+00:00	parameter tying	99.060000%	1968	keep	Union closest position groups 315 and 331	Family: parameter tying. Current retained frontier is 1,969 parameters at 99.060000%, a +0.060000 percentage-point margin over 99%. There have been 20 prior macro-attempts in this family and 137 prior micro-trials. The most recent accepted result is attempt-0078/micro-0116 at 1969 parameters and 99.060000%; the most recent failed result is attempt-0075/micro-0001 (error, no score). This is a parameterization-preserving compression: union current position groups represented by coordinates 315 and 331, whose learned values are 0.0121872602 and 0.0122692743 (absolute difference 8.201e-05), using a multiplicity-weighted mean. Hypothesis: this preserves qualification and yields 1,968 parameters. It is more informative than the nearest untested alternative (difference 8.215e-05) because it is the minimum-distortion eligible union; exact pairs already rejected under the unchanged grouping are excluded. Acceptance and rollback remain solely governed by the official runner.	0	0
attempt-0078	nearest-position-unions-infra-repair	micro-0118	7ca97eea6dd55263cbdf96e587da96679d6e1edd	e48441f7f634af3d02d15256bbd80dc4f873b41b	2026-08-16T23:11:34.796507+00:00	parameter tying	99.060000%	1967	keep	Union closest position groups 9 and 95	Family: parameter tying. Current retained frontier is 1,968 parameters at 99.060000%, a +0.060000 percentage-point margin over 99%. There have been 20 prior macro-attempts in this family and 138 prior micro-trials. The most recent accepted result is attempt-0078/micro-0117 at 1968 parameters and 99.060000%; the most recent failed result is attempt-0075/micro-0001 (error, no score). This is a parameterization-preserving compression: union current position groups represented by coordinates 9 and 95, whose learned values are 0.0040072785 and 0.0040894244 (absolute difference 8.215e-05), using a multiplicity-weighted mean. Hypothesis: this preserves qualification and yields 1,967 parameters. It is more informative than the nearest untested alternative (difference 8.251e-05) because it is the minimum-distortion eligible union; exact pairs already rejected under the unchanged grouping are excluded. Acceptance and rollback remain solely governed by the official runner.	0	0
attempt-0078	nearest-position-unions-infra-repair	micro-0119	6b9c18c7fc5662d4845d8c5bbe97cb18a74e090e	7ca97eea6dd55263cbdf96e587da96679d6e1edd	2026-08-16T23:12:36.820758+00:00	parameter tying	99.060000%	1966	keep	Union closest position groups 151 and 410	Family: parameter tying. Current retained frontier is 1,967 parameters at 99.060000%, a +0.060000 percentage-point margin over 99%. There have been 20 prior macro-attempts in this family and 139 prior micro-trials. The most recent accepted result is attempt-0078/micro-0118 at 1967 parameters and 99.060000%; the most recent failed result is attempt-0075/micro-0001 (error, no score). This is a parameterization-preserving compression: union current position groups represented by coordinates 151 and 410, whose learned values are -0.0078653758 and -0.0077828704 (absolute difference 8.251e-05), using a multiplicity-weighted mean. Hypothesis: this preserves qualification and yields 1,966 parameters. It is more informative than the nearest untested alternative (difference 8.252e-05) because it is the minimum-distortion eligible union; exact pairs already rejected under the unchanged grouping are excluded. Acceptance and rollback remain solely governed by the official runner.	0	0
attempt-0078	nearest-position-unions-infra-repair	micro-0120	cb902451f4c67e93f8ac6af48dd25870652cbfd6	6b9c18c7fc5662d4845d8c5bbe97cb18a74e090e	2026-08-16T23:13:39.891048+00:00	parameter tying	99.060000%	1965	keep	Union closest position groups 487 and 334	Family: parameter tying. Current retained frontier is 1,966 parameters at 99.060000%, a +0.060000 percentage-point margin over 99%. There have been 20 prior macro-attempts in this family and 140 prior micro-trials. The most recent accepted result is attempt-0078/micro-0119 at 1966 parameters and 99.060000%; the most recent failed result is attempt-0075/micro-0001 (error, no score). This is a parameterization-preserving compression: union current position groups represented by coordinates 487 and 334, whose learned values are 0.0251469370 and 0.0252294540 (absolute difference 8.252e-05), using a multiplicity-weighted mean. Hypothesis: this preserves qualification and yields 1,965 parameters. It is more informative than the nearest untested alternative (difference 8.270e-05) because it is the minimum-distortion eligible union; exact pairs already rejected under the unchanged grouping are excluded. Acceptance and rollback remain solely governed by the official runner.	0	0
attempt-0078	nearest-position-unions-infra-repair	micro-0121	eb25be31a1ec19098b91aeacadc84fa620a860f0	cb902451f4c67e93f8ac6af48dd25870652cbfd6	2026-08-16T23:14:43.086455+00:00	parameter tying	99.050000%	1964	keep	Union closest position groups 222 and 50	Family: parameter tying. Current retained frontier is 1,965 parameters at 99.060000%, a +0.060000 percentage-point margin over 99%. There have been 20 prior macro-attempts in this family and 141 prior micro-trials. The most recent accepted result is attempt-0078/micro-0120 at 1965 parameters and 99.060000%; the most recent failed result is attempt-0075/micro-0001 (error, no score). This is a parameterization-preserving compression: union current position groups represented by coordinates 222 and 50, whose learned values are -0.0138137192 and -0.0137310233 (absolute difference 8.270e-05), using a multiplicity-weighted mean. Hypothesis: this preserves qualification and yields 1,964 parameters. It is more informative than the nearest untested alternative (difference 8.364e-05) because it is the minimum-distortion eligible union; exact pairs already rejected under the unchanged grouping are excluded. Acceptance and rollback remain solely governed by the official runner.	0	0
attempt-0078	nearest-position-unions-infra-repair	micro-0122	6024d362e8aba02936ef47f4211de7ef76e927dd	eb25be31a1ec19098b91aeacadc84fa620a860f0	2026-08-16T23:15:44.365617+00:00	parameter tying	99.060000%	1963	keep	Union closest position groups 96 and 297	Family: parameter tying. Current retained frontier is 1,964 parameters at 99.050000%, a +0.050000 percentage-point margin over 99%. There have been 20 prior macro-attempts in this family and 142 prior micro-trials. The most recent accepted result is attempt-0078/micro-0121 at 1964 parameters and 99.050000%; the most recent failed result is attempt-0075/micro-0001 (error, no score). This is a parameterization-preserving compression: union current position groups represented by coordinates 96 and 297, whose learned values are 0.0102503309 and 0.0103339693 (absolute difference 8.364e-05), using a multiplicity-weighted mean. Hypothesis: this preserves qualification and yields 1,963 parameters. It is more informative than the nearest untested alternative (difference 8.457e-05) because it is the minimum-distortion eligible union; exact pairs already rejected under the unchanged grouping are excluded. Acceptance and rollback remain solely governed by the official runner.	0	0
attempt-0078	nearest-position-unions-infra-repair	micro-0123	dfc8d85c31caa803786efc5b845b9b9c373cec52	6024d362e8aba02936ef47f4211de7ef76e927dd	2026-08-16T23:16:46.078186+00:00	parameter tying	99.040000%	1962	keep	Union closest position groups 483 and 214	Family: parameter tying. Current retained frontier is 1,963 parameters at 99.060000%, a +0.060000 percentage-point margin over 99%. There have been 20 prior macro-attempts in this family and 143 prior micro-trials. The most recent accepted result is attempt-0078/micro-0122 at 1963 parameters and 99.060000%; the most recent failed result is attempt-0075/micro-0001 (error, no score). This is a parameterization-preserving compression: union current position groups represented by coordinates 483 and 214, whose learned values are 0.0142071303 and 0.0142917000 (absolute difference 8.457e-05), using a multiplicity-weighted mean. Hypothesis: this preserves qualification and yields 1,962 parameters. It is more informative than the nearest untested alternative (difference 8.475e-05) because it is the minimum-distortion eligible union; exact pairs already rejected under the unchanged grouping are excluded. Acceptance and rollback remain solely governed by the official runner.	0	0
attempt-0078	nearest-position-unions-infra-repair	micro-0124	f1e0baf632852c09d3f43910a9fb1623ea167020	dfc8d85c31caa803786efc5b845b9b9c373cec52	2026-08-16T23:17:48.266976+00:00	parameter tying	99.050000%	1961	keep	Union closest position groups 283 and 373	Family: parameter tying. Current retained frontier is 1,962 parameters at 99.040000%, a +0.040000 percentage-point margin over 99%. There have been 20 prior macro-attempts in this family and 144 prior micro-trials. The most recent accepted result is attempt-0078/micro-0123 at 1962 parameters and 99.040000%; the most recent failed result is attempt-0075/micro-0001 (error, no score). This is a parameterization-preserving compression: union current position groups represented by coordinates 283 and 373, whose learned values are 0.0623870976 and 0.0624718517 (absolute difference 8.475e-05), using a multiplicity-weighted mean. Hypothesis: this preserves qualification and yields 1,961 parameters. It is more informative than the nearest untested alternative (difference 8.561e-05) because it is the minimum-distortion eligible union; exact pairs already rejected under the unchanged grouping are excluded. Acceptance and rollback remain solely governed by the official runner.	0	0
attempt-0078	nearest-position-unions-infra-repair	micro-0125	f5ba89c672f1d88d5a9381a4bcca69346e3ce799	f1e0baf632852c09d3f43910a9fb1623ea167020	2026-08-16T23:18:50.205409+00:00	parameter tying	99.050000%	1960	keep	Union closest position groups 79 and 1	Family: parameter tying. Current retained frontier is 1,961 parameters at 99.050000%, a +0.050000 percentage-point margin over 99%. There have been 20 prior macro-attempts in this family and 145 prior micro-trials. The most recent accepted result is attempt-0078/micro-0124 at 1961 parameters and 99.050000%; the most recent failed result is attempt-0075/micro-0001 (error, no score). This is a parameterization-preserving compression: union current position groups represented by coordinates 79 and 1, whose learned values are 0.0021248213 and 0.0022104338 (absolute difference 8.561e-05), using a multiplicity-weighted mean. Hypothesis: this preserves qualification and yields 1,960 parameters. It is more informative than the nearest untested alternative (difference 8.593e-05) because it is the minimum-distortion eligible union; exact pairs already rejected under the unchanged grouping are excluded. Acceptance and rollback remain solely governed by the official runner.	0	0
attempt-0078	nearest-position-unions-infra-repair	micro-0126	82e037319f0ddc74ed759d13fd0fbd19e579c42b	f5ba89c672f1d88d5a9381a4bcca69346e3ce799	2026-08-16T23:19:53.266730+00:00	parameter tying	99.050000%	1959	keep	Union closest position groups 246 and 70	Family: parameter tying. Current retained frontier is 1,960 parameters at 99.050000%, a +0.050000 percentage-point margin over 99%. There have been 20 prior macro-attempts in this family and 146 prior micro-trials. The most recent accepted result is attempt-0078/micro-0125 at 1960 parameters and 99.050000%; the most recent failed result is attempt-0075/micro-0001 (error, no score). This is a parameterization-preserving compression: union current position groups represented by coordinates 246 and 70, whose learned values are 0.0131176896 and 0.0132036200 (absolute difference 8.593e-05), using a multiplicity-weighted mean. Hypothesis: this preserves qualification and yields 1,959 parameters. It is more informative than the nearest untested alternative (difference 8.595e-05) because it is the minimum-distortion eligible union; exact pairs already rejected under the unchanged grouping are excluded. Acceptance and rollback remain solely governed by the official runner.	0	0
attempt-0078	nearest-position-unions-infra-repair	micro-0127	8099a687135ab3ee0ed89df3483fee5719cc494d	82e037319f0ddc74ed759d13fd0fbd19e579c42b	2026-08-16T23:20:55.420152+00:00	parameter tying	99.050000%	1958	keep	Union closest position groups 68 and 384	Family: parameter tying. Current retained frontier is 1,959 parameters at 99.050000%, a +0.050000 percentage-point margin over 99%. There have been 20 prior macro-attempts in this family and 147 prior micro-trials. The most recent accepted result is attempt-0078/micro-0126 at 1959 parameters and 99.050000%; the most recent failed result is attempt-0075/micro-0001 (error, no score). This is a parameterization-preserving compression: union current position groups represented by coordinates 68 and 384, whose learned values are -0.0463198125 and -0.0462338626 (absolute difference 8.595e-05), using a multiplicity-weighted mean. Hypothesis: this preserves qualification and yields 1,958 parameters. It is more informative than the nearest untested alternative (difference 8.624e-05) because it is the minimum-distortion eligible union; exact pairs already rejected under the unchanged grouping are excluded. Acceptance and rollback remain solely governed by the official runner.	0	0
attempt-0078	nearest-position-unions-infra-repair	micro-0128	c4fc633800d4a466570b3524408bc48a2faf87a4	8099a687135ab3ee0ed89df3483fee5719cc494d	2026-08-16T23:21:57.047336+00:00	parameter tying	99.050000%	1957	keep	Union closest position groups 251 and 480	Family: parameter tying. Current retained frontier is 1,958 parameters at 99.050000%, a +0.050000 percentage-point margin over 99%. There have been 20 prior macro-attempts in this family and 148 prior micro-trials. The most recent accepted result is attempt-0078/micro-0127 at 1958 parameters and 99.050000%; the most recent failed result is attempt-0075/micro-0001 (error, no score). This is a parameterization-preserving compression: union current position groups represented by coordinates 251 and 480, whose learned values are -0.0388896093 and -0.0388033688 (absolute difference 8.624e-05), using a multiplicity-weighted mean. Hypothesis: this preserves qualification and yields 1,957 parameters. It is more informative than the nearest untested alternative (difference 8.662e-05) because it is the minimum-distortion eligible union; exact pairs already rejected under the unchanged grouping are excluded. Acceptance and rollback remain solely governed by the official runner.	0	0
attempt-0078	nearest-position-unions-infra-repair	micro-0129	bc2d50707062833dccd44823b1d0de3deb151bb0	c4fc633800d4a466570b3524408bc48a2faf87a4	2026-08-16T23:22:58.683811+00:00	parameter tying	99.060000%	1956	keep	Union closest position groups 51 and 205	Family: parameter tying. Current retained frontier is 1,957 parameters at 99.050000%, a +0.050000 percentage-point margin over 99%. There have been 20 prior macro-attempts in this family and 149 prior micro-trials. The most recent accepted result is attempt-0078/micro-0128 at 1957 parameters and 99.050000%; the most recent failed result is attempt-0075/micro-0001 (error, no score). This is a parameterization-preserving compression: union current position groups represented by coordinates 51 and 205, whose learned values are -0.0115711046 and -0.0114844870 (absolute difference 8.662e-05), using a multiplicity-weighted mean. Hypothesis: this preserves qualification and yields 1,956 parameters. It is more informative than the nearest untested alternative (difference 8.682e-05) because it is the minimum-distortion eligible union; exact pairs already rejected under the unchanged grouping are excluded. Acceptance and rollback remain solely governed by the official runner.	0	0
attempt-0078	nearest-position-unions-infra-repair	micro-0130	5570529d34b5ff48078c2c90d3031d16249d23a4	bc2d50707062833dccd44823b1d0de3deb151bb0	2026-08-16T23:24:00.275742+00:00	parameter tying	99.060000%	1955	keep	Union closest position groups 104 and 197	Family: parameter tying. Current retained frontier is 1,956 parameters at 99.060000%, a +0.060000 percentage-point margin over 99%. There have been 20 prior macro-attempts in this family and 150 prior micro-trials. The most recent accepted result is attempt-0078/micro-0129 at 1956 parameters and 99.060000%; the most recent failed result is attempt-0075/micro-0001 (error, no score). This is a parameterization-preserving compression: union current position groups represented by coordinates 104 and 197, whose learned values are -0.0038001481 and -0.0037133263 (absolute difference 8.682e-05), using a multiplicity-weighted mean. Hypothesis: this preserves qualification and yields 1,955 parameters. It is more informative than the nearest untested alternative (difference 8.683e-05) because it is the minimum-distortion eligible union; exact pairs already rejected under the unchanged grouping are excluded. Acceptance and rollback remain solely governed by the official runner.	0	0
attempt-0078	nearest-position-unions-infra-repair	micro-0131	39caa8170166986b91dc68186ecd794cb8e1f392	5570529d34b5ff48078c2c90d3031d16249d23a4	2026-08-16T23:25:02.187105+00:00	parameter tying	99.060000%	1954	keep	Union closest position groups 32 and 220	Family: parameter tying. Current retained frontier is 1,955 parameters at 99.060000%, a +0.060000 percentage-point margin over 99%. There have been 20 prior macro-attempts in this family and 151 prior micro-trials. The most recent accepted result is attempt-0078/micro-0130 at 1955 parameters and 99.060000%; the most recent failed result is attempt-0075/micro-0001 (error, no score). This is a parameterization-preserving compression: union current position groups represented by coordinates 32 and 220, whose learned values are 0.0285520889 and 0.0286389198 (absolute difference 8.683e-05), using a multiplicity-weighted mean. Hypothesis: this preserves qualification and yields 1,954 parameters. It is more informative than the nearest untested alternative (difference 8.728e-05) because it is the minimum-distortion eligible union; exact pairs already rejected under the unchanged grouping are excluded. Acceptance and rollback remain solely governed by the official runner.	0	0
attempt-0078	nearest-position-unions-infra-repair	micro-0132	2ade6e83fad12b3ccce55cad0a2b6d1f034e33fc	39caa8170166986b91dc68186ecd794cb8e1f392	2026-08-16T23:26:04.891710+00:00	parameter tying	99.060000%	1953	keep	Union closest position groups 138 and 127	Family: parameter tying. Current retained frontier is 1,954 parameters at 99.060000%, a +0.060000 percentage-point margin over 99%. There have been 20 prior macro-attempts in this family and 152 prior micro-trials. The most recent accepted result is attempt-0078/micro-0131 at 1954 parameters and 99.060000%; the most recent failed result is attempt-0075/micro-0001 (error, no score). This is a parameterization-preserving compression: union current position groups represented by coordinates 138 and 127, whose learned values are -0.0027349885 and -0.0026477072 (absolute difference 8.728e-05), using a multiplicity-weighted mean. Hypothesis: this preserves qualification and yields 1,953 parameters. It is more informative than the nearest untested alternative (difference 8.771e-05) because it is the minimum-distortion eligible union; exact pairs already rejected under the unchanged grouping are excluded. Acceptance and rollback remain solely governed by the official runner.	0	0
attempt-0078	nearest-position-unions-infra-repair	micro-0133	c1b6c853e3b286925550f021dc4cb79e0357cc67	2ade6e83fad12b3ccce55cad0a2b6d1f034e33fc	2026-08-16T23:27:14.931193+00:00	parameter tying	99.060000%	1952	keep	Union closest position groups 160 and 438	Family: parameter tying. Current retained frontier is 1,953 parameters at 99.060000%, a +0.060000 percentage-point margin over 99%. There have been 20 prior macro-attempts in this family and 153 prior micro-trials. The most recent accepted result is attempt-0078/micro-0132 at 1953 parameters and 99.060000%; the most recent failed result is attempt-0075/micro-0001 (error, no score). This is a parameterization-preserving compression: union current position groups represented by coordinates 160 and 438, whose learned values are 0.0012180239 and 0.0013057381 (absolute difference 8.771e-05), using a multiplicity-weighted mean. Hypothesis: this preserves qualification and yields 1,952 parameters. It is more informative than the nearest untested alternative (difference 8.796e-05) because it is the minimum-distortion eligible union; exact pairs already rejected under the unchanged grouping are excluded. Acceptance and rollback remain solely governed by the official runner.	0	0
