macro_attempt_id	automation_id	micro_attempt_id	commit	parent_commit	timestamp_utc	family	accuracy	parameters	status	description	proposal	train_exit	verify_exit
attempt-0169	ff-output-skip-four-sensitive-pairs	micro-0017	804c93deca67c1c867490853e6e68be125a61b4a	65e45c1fa4dde0e632f9cae18accab6459267a08	2026-08-17T10:40:46.484376+00:00	parameter tying	99.010000%	1569	keep	Union closest shared FF-output scalar groups 94 and 171	Family: parameter tying. Current retained frontier is 1,570 parameters at 99.030000%, a +0.030000 percentage-point margin over 99%. There have been 66 prior macro-attempts in this family and 569 prior micro-trials. The most recent accepted result is attempt-0168/micro-0004 at 1,586 parameters and 99.02%; the most recent failed result is attempt-0168/micro-0005 (FF-output pair 183/223 discarded at 98.99%). This is a parameterization-preserving compression of the depth-shared feed-forward output map: union flattened coordinates 94 and 171, values 0.0464542173 and 0.0467854254 (difference 3.312e-04), using a weighted mean and integer reconstruction. Hypothesis: residual-stream reconstruction contains near-duplicate scalars distinct from FF-input redundancy, preserving qualification at 1,569 parameters. It is more informative than the next FF-output union (difference 3.348e-04) because it is the minimum-distortion isolated test of the complementary FF map. Official acceptance and rollback are unchanged.	0	0
attempt-0169	ff-output-skip-four-sensitive-pairs	micro-0018	3c47278b3b50a407737e93bfcc9063c41a492e0e	804c93deca67c1c867490853e6e68be125a61b4a	2026-08-17T10:42:01.137873+00:00	parameter tying	99.020000%	1568	keep	Union closest shared FF-output scalar groups 113 and 87	Family: parameter tying. Current retained frontier is 1,569 parameters at 99.010000%, a +0.010000 percentage-point margin over 99%. There have been 66 prior macro-attempts in this family and 570 prior micro-trials. The most recent accepted result is attempt-0168/micro-0004 at 1,586 parameters and 99.02%; the most recent failed result is attempt-0168/micro-0005 (FF-output pair 183/223 discarded at 98.99%). This is a parameterization-preserving compression of the depth-shared feed-forward output map: union flattened coordinates 113 and 87, values 0.0060452973 and 0.0063800495 (difference 3.348e-04), using a weighted mean and integer reconstruction. Hypothesis: residual-stream reconstruction contains near-duplicate scalars distinct from FF-input redundancy, preserving qualification at 1,568 parameters. It is more informative than the next FF-output union (difference 3.449e-04) because it is the minimum-distortion isolated test of the complementary FF map. Official acceptance and rollback are unchanged.	0	0
attempt-0169	ff-output-skip-four-sensitive-pairs	micro-0019	a260729c8baec311bd58858f932a2601f09e2c2b	3c47278b3b50a407737e93bfcc9063c41a492e0e	2026-08-17T10:43:15.480239+00:00	parameter tying	99.000000%	1567	keep	Union closest shared FF-output scalar groups 91 and 130	Family: parameter tying. Current retained frontier is 1,568 parameters at 99.020000%, a +0.020000 percentage-point margin over 99%. There have been 66 prior macro-attempts in this family and 571 prior micro-trials. The most recent accepted result is attempt-0168/micro-0004 at 1,586 parameters and 99.02%; the most recent failed result is attempt-0168/micro-0005 (FF-output pair 183/223 discarded at 98.99%). This is a parameterization-preserving compression of the depth-shared feed-forward output map: union flattened coordinates 91 and 130, values 0.0080275396 and 0.0083724242 (difference 3.449e-04), using a weighted mean and integer reconstruction. Hypothesis: residual-stream reconstruction contains near-duplicate scalars distinct from FF-input redundancy, preserving qualification at 1,567 parameters. It is more informative than the next FF-output union (difference 3.669e-04) because it is the minimum-distortion isolated test of the complementary FF map. Official acceptance and rollback are unchanged.	0	0
attempt-0169	ff-output-skip-four-sensitive-pairs	micro-0020	f2c8c1d61ff77b8a26d1c24035b599960fc4616f	a260729c8baec311bd58858f932a2601f09e2c2b	2026-08-17T10:44:32.046883+00:00	parameter tying	99.020000%	1566	keep	Union closest shared FF-output scalar groups 148 and 16	Family: parameter tying. Current retained frontier is 1,567 parameters at 99.000000%, a +0.000000 percentage-point margin over 99%. There have been 66 prior macro-attempts in this family and 572 prior micro-trials. The most recent accepted result is attempt-0168/micro-0004 at 1,586 parameters and 99.02%; the most recent failed result is attempt-0168/micro-0005 (FF-output pair 183/223 discarded at 98.99%). This is a parameterization-preserving compression of the depth-shared feed-forward output map: union flattened coordinates 148 and 16, values 0.0380850881 and 0.0384519883 (difference 3.669e-04), using a weighted mean and integer reconstruction. Hypothesis: residual-stream reconstruction contains near-duplicate scalars distinct from FF-input redundancy, preserving qualification at 1,566 parameters. It is more informative than the next FF-output union (difference 3.725e-04) because it is the minimum-distortion isolated test of the complementary FF map. Official acceptance and rollback are unchanged.	0	0
attempt-0170	ff-output-continuation-after-cap	micro-0001	a307d200933b9b119be71d0959a4d21d3896f140	f2c8c1d61ff77b8a26d1c24035b599960fc4616f	2026-08-17T10:46:26.188882+00:00	parameter tying	99.030000%	1565	keep	Union closest shared FF-output scalar groups 187 and 65	Family: parameter tying. Current retained frontier is 1,566 parameters at 99.020000%, a +0.020000 percentage-point margin over 99%. There have been 67 prior macro-attempts in this family and 573 prior micro-trials. The most recent accepted result is attempt-0169/micro-0020 at 1,566 parameters and 99.02%; the most recent failed result is attempt-0168/micro-0005 (FF-output pair 183/223 discarded at 98.99%). This is a parameterization-preserving compression of the depth-shared feed-forward output map: union flattened coordinates 187 and 65, values 0.0123685440 and 0.0127410181 (difference 3.725e-04), using a weighted mean and integer reconstruction. Hypothesis: residual-stream reconstruction contains near-duplicate scalars distinct from FF-input redundancy, preserving qualification at 1,565 parameters. It is more informative than the next FF-output union (difference 3.749e-04) because it is the minimum-distortion isolated test of the complementary FF map. Official acceptance and rollback are unchanged.	0	0
attempt-0170	ff-output-continuation-after-cap	micro-0002	4ed5d0c911279539c6c4bbb671c6e11fcfde6202	a307d200933b9b119be71d0959a4d21d3896f140	2026-08-17T10:47:37.489533+00:00	parameter tying	99.000000%	1564	keep	Union closest shared FF-output scalar groups 10 and 183	Family: parameter tying. Current retained frontier is 1,565 parameters at 99.030000%, a +0.030000 percentage-point margin over 99%. There have been 67 prior macro-attempts in this family and 574 prior micro-trials. The most recent accepted result is attempt-0169/micro-0020 at 1,566 parameters and 99.02%; the most recent failed result is attempt-0168/micro-0005 (FF-output pair 183/223 discarded at 98.99%). This is a parameterization-preserving compression of the depth-shared feed-forward output map: union flattened coordinates 10 and 183, values 0.0251302104 and 0.0255113114 (difference 3.811e-04), using a weighted mean and integer reconstruction. Hypothesis: residual-stream reconstruction contains near-duplicate scalars distinct from FF-input redundancy, preserving qualification at 1,564 parameters. It is more informative than the next FF-output union (difference 3.816e-04) because it is the minimum-distortion isolated test of the complementary FF map. Official acceptance and rollback are unchanged.	0	0
attempt-0170	ff-output-continuation-after-cap	micro-0003	5bb50ee140c295453083e43e10bf9afa315a13d3	4ed5d0c911279539c6c4bbb671c6e11fcfde6202	2026-08-17T10:48:47.526751+00:00	parameter tying	99.030000%	1563	keep	Union closest shared FF-output scalar groups 205 and 103	Family: parameter tying. Current retained frontier is 1,564 parameters at 99.000000%, a +0.000000 percentage-point margin over 99%. There have been 67 prior macro-attempts in this family and 575 prior micro-trials. The most recent accepted result is attempt-0169/micro-0020 at 1,566 parameters and 99.02%; the most recent failed result is attempt-0168/micro-0005 (FF-output pair 183/223 discarded at 98.99%). This is a parameterization-preserving compression of the depth-shared feed-forward output map: union flattened coordinates 205 and 103, values 0.0406701379 and 0.0410517864 (difference 3.816e-04), using a weighted mean and integer reconstruction. Hypothesis: residual-stream reconstruction contains near-duplicate scalars distinct from FF-input redundancy, preserving qualification at 1,563 parameters. It is more informative than the next FF-output union (difference 3.841e-04) because it is the minimum-distortion isolated test of the complementary FF map. Official acceptance and rollback are unchanged.	0	0
attempt-0170	ff-output-continuation-after-cap	micro-0004	565d301291c847f3a0d523c379e491fdc1a2ebb8	5bb50ee140c295453083e43e10bf9afa315a13d3	2026-08-17T10:49:59.895865+00:00	parameter tying	99.030000%	1562	keep	Union closest shared FF-output scalar groups 118 and 212	Family: parameter tying. Current retained frontier is 1,563 parameters at 99.030000%, a +0.030000 percentage-point margin over 99%. There have been 67 prior macro-attempts in this family and 576 prior micro-trials. The most recent accepted result is attempt-0169/micro-0020 at 1,566 parameters and 99.02%; the most recent failed result is attempt-0168/micro-0005 (FF-output pair 183/223 discarded at 98.99%). This is a parameterization-preserving compression of the depth-shared feed-forward output map: union flattened coordinates 118 and 212, values 0.0334545337 and 0.0338386111 (difference 3.841e-04), using a weighted mean and integer reconstruction. Hypothesis: residual-stream reconstruction contains near-duplicate scalars distinct from FF-input redundancy, preserving qualification at 1,562 parameters. It is more informative than the next FF-output union (difference 3.962e-04) because it is the minimum-distortion isolated test of the complementary FF map. Official acceptance and rollback are unchanged.	0	0
attempt-0170	ff-output-continuation-after-cap	micro-0005	0078bf9b56f17d49757366ec011e49dacb6c3f30	565d301291c847f3a0d523c379e491fdc1a2ebb8	2026-08-17T10:51:15.277092+00:00	parameter tying	99.060000%	1561	keep	Union closest shared FF-output scalar groups 177 and 253	Family: parameter tying. Current retained frontier is 1,562 parameters at 99.030000%, a +0.030000 percentage-point margin over 99%. There have been 67 prior macro-attempts in this family and 577 prior micro-trials. The most recent accepted result is attempt-0169/micro-0020 at 1,566 parameters and 99.02%; the most recent failed result is attempt-0168/micro-0005 (FF-output pair 183/223 discarded at 98.99%). This is a parameterization-preserving compression of the depth-shared feed-forward output map: union flattened coordinates 177 and 253, values -0.0142365936 and -0.0138404192 (difference 3.962e-04), using a weighted mean and integer reconstruction. Hypothesis: residual-stream reconstruction contains near-duplicate scalars distinct from FF-input redundancy, preserving qualification at 1,561 parameters. It is more informative than the next FF-output union (difference 4.080e-04) because it is the minimum-distortion isolated test of the complementary FF map. Official acceptance and rollback are unchanged.	0	0
attempt-0170	ff-output-continuation-after-cap	micro-0006	60cbee311ec903751da7f7abb345cba9219f0c1f	0078bf9b56f17d49757366ec011e49dacb6c3f30	2026-08-17T10:52:31.528984+00:00	parameter tying	99.080000%	1560	keep	Union closest shared FF-output scalar groups 203 and 77	Family: parameter tying. Current retained frontier is 1,561 parameters at 99.060000%, a +0.060000 percentage-point margin over 99%. There have been 67 prior macro-attempts in this family and 578 prior micro-trials. The most recent accepted result is attempt-0169/micro-0020 at 1,566 parameters and 99.02%; the most recent failed result is attempt-0168/micro-0005 (FF-output pair 183/223 discarded at 98.99%). This is a parameterization-preserving compression of the depth-shared feed-forward output map: union flattened coordinates 203 and 77, values -0.0091455076 and -0.0087374859 (difference 4.080e-04), using a weighted mean and integer reconstruction. Hypothesis: residual-stream reconstruction contains near-duplicate scalars distinct from FF-input redundancy, preserving qualification at 1,560 parameters. It is more informative than the next FF-output union (difference 4.186e-04) because it is the minimum-distortion isolated test of the complementary FF map. Official acceptance and rollback are unchanged.	0	0
attempt-0170	ff-output-continuation-after-cap	micro-0007	6c4bab76c00397a1855ccc3a021925c450504e21	60cbee311ec903751da7f7abb345cba9219f0c1f	2026-08-17T10:53:47.103754+00:00	parameter tying	99.050000%	1559	keep	Union closest shared FF-output scalar groups 179 and 167	Family: parameter tying. Current retained frontier is 1,560 parameters at 99.080000%, a +0.080000 percentage-point margin over 99%. There have been 67 prior macro-attempts in this family and 579 prior micro-trials. The most recent accepted result is attempt-0169/micro-0020 at 1,566 parameters and 99.02%; the most recent failed result is attempt-0168/micro-0005 (FF-output pair 183/223 discarded at 98.99%). This is a parameterization-preserving compression of the depth-shared feed-forward output map: union flattened coordinates 179 and 167, values 0.0593767352 and 0.0597953834 (difference 4.186e-04), using a weighted mean and integer reconstruction. Hypothesis: residual-stream reconstruction contains near-duplicate scalars distinct from FF-input redundancy, preserving qualification at 1,559 parameters. It is more informative than the next FF-output union (difference 4.230e-04) because it is the minimum-distortion isolated test of the complementary FF map. Official acceptance and rollback are unchanged.	0	0
attempt-0170	ff-output-continuation-after-cap	micro-0008	12785fff3c67bd68462461fc930544b17fd4d012	6c4bab76c00397a1855ccc3a021925c450504e21	2026-08-17T10:55:06.299715+00:00	parameter tying	99.070000%	1558	keep	Union closest shared FF-output scalar groups 222 and 7	Family: parameter tying. Current retained frontier is 1,559 parameters at 99.050000%, a +0.050000 percentage-point margin over 99%. There have been 67 prior macro-attempts in this family and 580 prior micro-trials. The most recent accepted result is attempt-0169/micro-0020 at 1,566 parameters and 99.02%; the most recent failed result is attempt-0168/micro-0005 (FF-output pair 183/223 discarded at 98.99%). This is a parameterization-preserving compression of the depth-shared feed-forward output map: union flattened coordinates 222 and 7, values -0.0040685120 and -0.0036455002 (difference 4.230e-04), using a weighted mean and integer reconstruction. Hypothesis: residual-stream reconstruction contains near-duplicate scalars distinct from FF-input redundancy, preserving qualification at 1,558 parameters. It is more informative than the next FF-output union (difference 4.330e-04) because it is the minimum-distortion isolated test of the complementary FF map. Official acceptance and rollback are unchanged.	0	0
attempt-0170	ff-output-continuation-after-cap	micro-0009	51d7c44f1c2302a61837eec5597133a3fb4e4b98	12785fff3c67bd68462461fc930544b17fd4d012	2026-08-17T10:56:29.297522+00:00	parameter tying	99.050000%	1557	keep	Union closest shared FF-output scalar groups 28 and 66	Family: parameter tying. Current retained frontier is 1,558 parameters at 99.070000%, a +0.070000 percentage-point margin over 99%. There have been 67 prior macro-attempts in this family and 581 prior micro-trials. The most recent accepted result is attempt-0169/micro-0020 at 1,566 parameters and 99.02%; the most recent failed result is attempt-0168/micro-0005 (FF-output pair 183/223 discarded at 98.99%). This is a parameterization-preserving compression of the depth-shared feed-forward output map: union flattened coordinates 28 and 66, values -0.0179589801 and -0.0175259449 (difference 4.330e-04), using a weighted mean and integer reconstruction. Hypothesis: residual-stream reconstruction contains near-duplicate scalars distinct from FF-input redundancy, preserving qualification at 1,557 parameters. It is more informative than the next FF-output union (difference 4.445e-04) because it is the minimum-distortion isolated test of the complementary FF map. Official acceptance and rollback are unchanged.	0	0
attempt-0170	ff-output-continuation-after-cap	micro-0010	2e2c85c24b9dde446f8769cf1b083749caf76edb	51d7c44f1c2302a61837eec5597133a3fb4e4b98	2026-08-17T10:57:40.965034+00:00	parameter tying	99.050000%	1556	keep	Union closest shared FF-output scalar groups 134 and 131	Family: parameter tying. Current retained frontier is 1,557 parameters at 99.050000%, a +0.050000 percentage-point margin over 99%. There have been 67 prior macro-attempts in this family and 582 prior micro-trials. The most recent accepted result is attempt-0169/micro-0020 at 1,566 parameters and 99.02%; the most recent failed result is attempt-0168/micro-0005 (FF-output pair 183/223 discarded at 98.99%). This is a parameterization-preserving compression of the depth-shared feed-forward output map: union flattened coordinates 134 and 131, values 0.0360826738 and 0.0365271308 (difference 4.445e-04), using a weighted mean and integer reconstruction. Hypothesis: residual-stream reconstruction contains near-duplicate scalars distinct from FF-input redundancy, preserving qualification at 1,556 parameters. It is more informative than the next FF-output union (difference 4.822e-04) because it is the minimum-distortion isolated test of the complementary FF map. Official acceptance and rollback are unchanged.	0	0
attempt-0170	ff-output-continuation-after-cap	micro-0011	25d46b71b9469c995267517e0771db5a1398c8c8	2e2c85c24b9dde446f8769cf1b083749caf76edb	2026-08-17T10:58:55.514241+00:00	parameter tying	99.020000%	1555	keep	Union closest shared FF-output scalar groups 25 and 128	Family: parameter tying. Current retained frontier is 1,556 parameters at 99.050000%, a +0.050000 percentage-point margin over 99%. There have been 67 prior macro-attempts in this family and 583 prior micro-trials. The most recent accepted result is attempt-0169/micro-0020 at 1,566 parameters and 99.02%; the most recent failed result is attempt-0168/micro-0005 (FF-output pair 183/223 discarded at 98.99%). This is a parameterization-preserving compression of the depth-shared feed-forward output map: union flattened coordinates 25 and 128, values 0.1410306841 and 0.1415129155 (difference 4.822e-04), using a weighted mean and integer reconstruction. Hypothesis: residual-stream reconstruction contains near-duplicate scalars distinct from FF-input redundancy, preserving qualification at 1,555 parameters. It is more informative than the next FF-output union (difference 4.827e-04) because it is the minimum-distortion isolated test of the complementary FF map. Official acceptance and rollback are unchanged.	0	0
attempt-0170	ff-output-continuation-after-cap	micro-0012	e1fe882e9d248456f9b9a05876f82814eb057abd	25d46b71b9469c995267517e0771db5a1398c8c8	2026-08-17T11:00:09.566206+00:00	parameter tying	99.060000%	1554	keep	Union closest shared FF-output scalar groups 192 and 96	Family: parameter tying. Current retained frontier is 1,555 parameters at 99.020000%, a +0.020000 percentage-point margin over 99%. There have been 67 prior macro-attempts in this family and 584 prior micro-trials. The most recent accepted result is attempt-0169/micro-0020 at 1,566 parameters and 99.02%; the most recent failed result is attempt-0168/micro-0005 (FF-output pair 183/223 discarded at 98.99%). This is a parameterization-preserving compression of the depth-shared feed-forward output map: union flattened coordinates 192 and 96, values 0.0324879065 and 0.0329705589 (difference 4.827e-04), using a weighted mean and integer reconstruction. Hypothesis: residual-stream reconstruction contains near-duplicate scalars distinct from FF-input redundancy, preserving qualification at 1,554 parameters. It is more informative than the next FF-output union (difference 4.923e-04) because it is the minimum-distortion isolated test of the complementary FF map. Official acceptance and rollback are unchanged.	0	0
