macro_attempt_id	automation_id	micro_attempt_id	commit	parent_commit	timestamp_utc	family	accuracy	parameters	status	description	proposal	train_exit	verify_exit
attempt-0187	qkv-revisit-after-cross-tensor-compression	micro-0010	601c91c3c8bc7ed3b74f3a9dc2a771eea9ed441e	86d19bad576f3837fee5db7340433a9bb057009d	2026-08-17T13:18:10.362143+00:00	parameter tying	99.200000%	1469	keep	Union closest shared-QKV scalar groups 722 and 574	Family: parameter tying. Current retained frontier is 1,470 parameters at 99.240000%, a +0.240000 percentage-point margin over 99%. There have been 84 prior macro-attempts in this family and 683 prior micro-trials. The most recent accepted result is attempt-0185/micro-0002 at 1,479 parameters and 99.20%; the most recent failed result is attempt-0186/micro-0001 (block-0 pre-FF bias pair 8/3 discarded at 98.08%). This is a parameterization-preserving compression of the depth-shared QKV transform: union flattened coordinates 722 and 574, whose learned values are 0.0059133717 and 0.0060920063 (difference 1.786e-04), with a multiplicity-weighted mean and integer reconstruction map. Hypothesis: the much larger attention tensor contains near-duplicate scalars below the token failure scale, so this union preserves qualification and yields 1,469 parameters. It is more informative than the next QKV union (difference 1.796e-04) because it is the minimum-distortion test at this new site. Acceptance and rollback remain solely governed by the official runner.	0	0
attempt-0187	qkv-revisit-after-cross-tensor-compression	micro-0011	f94b60d6c9f345e6b9cd744b8e0fcfce055524b0	601c91c3c8bc7ed3b74f3a9dc2a771eea9ed441e	2026-08-17T13:19:25.387440+00:00	parameter tying	99.200000%	1468	keep	Union closest shared-QKV scalar groups 56 and 480	Family: parameter tying. Current retained frontier is 1,469 parameters at 99.200000%, a +0.200000 percentage-point margin over 99%. There have been 84 prior macro-attempts in this family and 684 prior micro-trials. The most recent accepted result is attempt-0185/micro-0002 at 1,479 parameters and 99.20%; the most recent failed result is attempt-0186/micro-0001 (block-0 pre-FF bias pair 8/3 discarded at 98.08%). This is a parameterization-preserving compression of the depth-shared QKV transform: union flattened coordinates 56 and 480, whose learned values are -0.1743875295 and -0.1742079705 (difference 1.796e-04), with a multiplicity-weighted mean and integer reconstruction map. Hypothesis: the much larger attention tensor contains near-duplicate scalars below the token failure scale, so this union preserves qualification and yields 1,468 parameters. It is more informative than the next QKV union (difference 1.801e-04) because it is the minimum-distortion test at this new site. Acceptance and rollback remain solely governed by the official runner.	0	0
attempt-0187	qkv-revisit-after-cross-tensor-compression	micro-0012	45a92f83105d020033f29fd204b88337b227d116	f94b60d6c9f345e6b9cd744b8e0fcfce055524b0	2026-08-17T13:20:44.740965+00:00	parameter tying	99.200000%	1467	keep	Union closest shared-QKV scalar groups 714 and 216	Family: parameter tying. Current retained frontier is 1,468 parameters at 99.200000%, a +0.200000 percentage-point margin over 99%. There have been 84 prior macro-attempts in this family and 685 prior micro-trials. The most recent accepted result is attempt-0185/micro-0002 at 1,479 parameters and 99.20%; the most recent failed result is attempt-0186/micro-0001 (block-0 pre-FF bias pair 8/3 discarded at 98.08%). This is a parameterization-preserving compression of the depth-shared QKV transform: union flattened coordinates 714 and 216, whose learned values are -0.0457247272 and -0.0455446206 (difference 1.801e-04), with a multiplicity-weighted mean and integer reconstruction map. Hypothesis: the much larger attention tensor contains near-duplicate scalars below the token failure scale, so this union preserves qualification and yields 1,467 parameters. It is more informative than the next QKV union (difference 1.926e-04) because it is the minimum-distortion test at this new site. Acceptance and rollback remain solely governed by the official runner.	0	0
attempt-0187	qkv-revisit-after-cross-tensor-compression	micro-0013	de97cdb7e762dbb5e3d76212c9735ad1b540e6d8	45a92f83105d020033f29fd204b88337b227d116	2026-08-17T13:22:03.699599+00:00	parameter tying	99.200000%	1466	keep	Union closest shared-QKV scalar groups 639 and 687	Family: parameter tying. Current retained frontier is 1,467 parameters at 99.200000%, a +0.200000 percentage-point margin over 99%. There have been 84 prior macro-attempts in this family and 686 prior micro-trials. The most recent accepted result is attempt-0185/micro-0002 at 1,479 parameters and 99.20%; the most recent failed result is attempt-0186/micro-0001 (block-0 pre-FF bias pair 8/3 discarded at 98.08%). This is a parameterization-preserving compression of the depth-shared QKV transform: union flattened coordinates 639 and 687, whose learned values are -0.0998875722 and -0.0996949449 (difference 1.926e-04), with a multiplicity-weighted mean and integer reconstruction map. Hypothesis: the much larger attention tensor contains near-duplicate scalars below the token failure scale, so this union preserves qualification and yields 1,466 parameters. It is more informative than the next QKV union (difference 1.938e-04) because it is the minimum-distortion test at this new site. Acceptance and rollback remain solely governed by the official runner.	0	0
attempt-0187	qkv-revisit-after-cross-tensor-compression	micro-0014	e0b862e9f0c5cf74520d3b6679188e9966c2ea60	de97cdb7e762dbb5e3d76212c9735ad1b540e6d8	2026-08-17T13:23:21.906901+00:00	parameter tying	99.200000%	1465	keep	Union closest shared-QKV scalar groups 708 and 303	Family: parameter tying. Current retained frontier is 1,466 parameters at 99.200000%, a +0.200000 percentage-point margin over 99%. There have been 84 prior macro-attempts in this family and 687 prior micro-trials. The most recent accepted result is attempt-0185/micro-0002 at 1,479 parameters and 99.20%; the most recent failed result is attempt-0186/micro-0001 (block-0 pre-FF bias pair 8/3 discarded at 98.08%). This is a parameterization-preserving compression of the depth-shared QKV transform: union flattened coordinates 708 and 303, whose learned values are -0.0056183636 and -0.0054245354 (difference 1.938e-04), with a multiplicity-weighted mean and integer reconstruction map. Hypothesis: the much larger attention tensor contains near-duplicate scalars below the token failure scale, so this union preserves qualification and yields 1,465 parameters. It is more informative than the next QKV union (difference 1.950e-04) because it is the minimum-distortion test at this new site. Acceptance and rollback remain solely governed by the official runner.	0	0
attempt-0187	qkv-revisit-after-cross-tensor-compression	micro-0015	b644f9b4d3637293c487348a35b4a099a54af829	e0b862e9f0c5cf74520d3b6679188e9966c2ea60	2026-08-17T13:24:39.704972+00:00	parameter tying	99.200000%	1464	keep	Union closest shared-QKV scalar groups 464 and 10	Family: parameter tying. Current retained frontier is 1,465 parameters at 99.200000%, a +0.200000 percentage-point margin over 99%. There have been 84 prior macro-attempts in this family and 688 prior micro-trials. The most recent accepted result is attempt-0185/micro-0002 at 1,479 parameters and 99.20%; the most recent failed result is attempt-0186/micro-0001 (block-0 pre-FF bias pair 8/3 discarded at 98.08%). This is a parameterization-preserving compression of the depth-shared QKV transform: union flattened coordinates 464 and 10, whose learned values are -0.0629736707 and -0.0627787039 (difference 1.950e-04), with a multiplicity-weighted mean and integer reconstruction map. Hypothesis: the much larger attention tensor contains near-duplicate scalars below the token failure scale, so this union preserves qualification and yields 1,464 parameters. It is more informative than the next QKV union (difference 1.953e-04) because it is the minimum-distortion test at this new site. Acceptance and rollback remain solely governed by the official runner.	0	0
attempt-0187	qkv-revisit-after-cross-tensor-compression	micro-0016	f1e9e85092bf92a6f964712b5cf8388f43ec7276	b644f9b4d3637293c487348a35b4a099a54af829	2026-08-17T13:25:57.373247+00:00	parameter tying	99.170000%	1463	keep	Union closest shared-QKV scalar groups 583 and 577	Family: parameter tying. Current retained frontier is 1,464 parameters at 99.200000%, a +0.200000 percentage-point margin over 99%. There have been 84 prior macro-attempts in this family and 689 prior micro-trials. The most recent accepted result is attempt-0185/micro-0002 at 1,479 parameters and 99.20%; the most recent failed result is attempt-0186/micro-0001 (block-0 pre-FF bias pair 8/3 discarded at 98.08%). This is a parameterization-preserving compression of the depth-shared QKV transform: union flattened coordinates 583 and 577, whose learned values are -0.0160971358 and -0.0159018170 (difference 1.953e-04), with a multiplicity-weighted mean and integer reconstruction map. Hypothesis: the much larger attention tensor contains near-duplicate scalars below the token failure scale, so this union preserves qualification and yields 1,463 parameters. It is more informative than the next QKV union (difference 1.954e-04) because it is the minimum-distortion test at this new site. Acceptance and rollback remain solely governed by the official runner.	0	0
attempt-0187	qkv-revisit-after-cross-tensor-compression	micro-0017	92348eb069346dfd481b8a1dff17da62367a6687	f1e9e85092bf92a6f964712b5cf8388f43ec7276	2026-08-17T13:27:23.608505+00:00	parameter tying	99.210000%	1462	keep	Union closest shared-QKV scalar groups 514 and 497	Family: parameter tying. Current retained frontier is 1,463 parameters at 99.170000%, a +0.170000 percentage-point margin over 99%. There have been 84 prior macro-attempts in this family and 690 prior micro-trials. The most recent accepted result is attempt-0185/micro-0002 at 1,479 parameters and 99.20%; the most recent failed result is attempt-0186/micro-0001 (block-0 pre-FF bias pair 8/3 discarded at 98.08%). This is a parameterization-preserving compression of the depth-shared QKV transform: union flattened coordinates 514 and 497, whose learned values are -0.0145190591 and -0.0143236127 (difference 1.954e-04), with a multiplicity-weighted mean and integer reconstruction map. Hypothesis: the much larger attention tensor contains near-duplicate scalars below the token failure scale, so this union preserves qualification and yields 1,462 parameters. It is more informative than the next QKV union (difference 1.959e-04) because it is the minimum-distortion test at this new site. Acceptance and rollback remain solely governed by the official runner.	0	0
attempt-0187	qkv-revisit-after-cross-tensor-compression	micro-0018	658a05ac79442c438dce79b9b7c5cd763751a865	92348eb069346dfd481b8a1dff17da62367a6687	2026-08-17T13:28:51.314745+00:00	parameter tying	99.210000%	1461	keep	Union closest shared-QKV scalar groups 300 and 469	Family: parameter tying. Current retained frontier is 1,462 parameters at 99.210000%, a +0.210000 percentage-point margin over 99%. There have been 84 prior macro-attempts in this family and 691 prior micro-trials. The most recent accepted result is attempt-0185/micro-0002 at 1,479 parameters and 99.20%; the most recent failed result is attempt-0186/micro-0001 (block-0 pre-FF bias pair 8/3 discarded at 98.08%). This is a parameterization-preserving compression of the depth-shared QKV transform: union flattened coordinates 300 and 469, whose learned values are 0.6248732209 and 0.6250690818 (difference 1.959e-04), with a multiplicity-weighted mean and integer reconstruction map. Hypothesis: the much larger attention tensor contains near-duplicate scalars below the token failure scale, so this union preserves qualification and yields 1,461 parameters. It is more informative than the next QKV union (difference 1.966e-04) because it is the minimum-distortion test at this new site. Acceptance and rollback remain solely governed by the official runner.	0	0
attempt-0187	qkv-revisit-after-cross-tensor-compression	micro-0019	b2bf1d92f0a19ca3ac8d1cf5426efed82c86e2dc	658a05ac79442c438dce79b9b7c5cd763751a865	2026-08-17T13:30:02.445285+00:00	parameter tying	99.210000%	1460	keep	Union closest shared-QKV scalar groups 370 and 499	Family: parameter tying. Current retained frontier is 1,461 parameters at 99.210000%, a +0.210000 percentage-point margin over 99%. There have been 84 prior macro-attempts in this family and 692 prior micro-trials. The most recent accepted result is attempt-0185/micro-0002 at 1,479 parameters and 99.20%; the most recent failed result is attempt-0186/micro-0001 (block-0 pre-FF bias pair 8/3 discarded at 98.08%). This is a parameterization-preserving compression of the depth-shared QKV transform: union flattened coordinates 370 and 499, whose learned values are 0.0328701213 and 0.0330667309 (difference 1.966e-04), with a multiplicity-weighted mean and integer reconstruction map. Hypothesis: the much larger attention tensor contains near-duplicate scalars below the token failure scale, so this union preserves qualification and yields 1,460 parameters. It is more informative than the next QKV union (difference 2.001e-04) because it is the minimum-distortion test at this new site. Acceptance and rollback remain solely governed by the official runner.	0	0
attempt-0187	qkv-revisit-after-cross-tensor-compression	micro-0020	a86d68b523740a382c63e2c86f61f40af5539686	b2bf1d92f0a19ca3ac8d1cf5426efed82c86e2dc	2026-08-17T13:31:16.582905+00:00	parameter tying	99.210000%	1459	keep	Union closest shared-QKV scalar groups 110 and 162	Family: parameter tying. Current retained frontier is 1,460 parameters at 99.210000%, a +0.210000 percentage-point margin over 99%. There have been 84 prior macro-attempts in this family and 693 prior micro-trials. The most recent accepted result is attempt-0185/micro-0002 at 1,479 parameters and 99.20%; the most recent failed result is attempt-0186/micro-0001 (block-0 pre-FF bias pair 8/3 discarded at 98.08%). This is a parameterization-preserving compression of the depth-shared QKV transform: union flattened coordinates 110 and 162, whose learned values are 0.5063167810 and 0.5065168738 (difference 2.001e-04), with a multiplicity-weighted mean and integer reconstruction map. Hypothesis: the much larger attention tensor contains near-duplicate scalars below the token failure scale, so this union preserves qualification and yields 1,459 parameters. It is more informative than the next QKV union (difference 2.031e-04) because it is the minimum-distortion test at this new site. Acceptance and rollback remain solely governed by the official runner.	0	0
attempt-0188	qkv-five-trial-continuation	micro-0001	120e65214496d5e61d46ea36b6cbdfa0418358b4	a86d68b523740a382c63e2c86f61f40af5539686	2026-08-17T13:33:20.479829+00:00	parameter tying	99.210000%	1458	keep	Union closest shared-QKV scalar groups 704 and 736	Family: parameter tying. Current retained frontier is 1,459 parameters at 99.210000%, a +0.210000 percentage-point margin over 99%. There have been 85 prior macro-attempts in this family and 694 prior micro-trials. The most recent accepted result is attempt-0185/micro-0002 at 1,479 parameters and 99.20%; the most recent failed result is attempt-0186/micro-0001 (block-0 pre-FF bias pair 8/3 discarded at 98.08%). This is a parameterization-preserving compression of the depth-shared QKV transform: union flattened coordinates 704 and 736, whose learned values are 0.0842205882 and 0.0844237134 (difference 2.031e-04), with a multiplicity-weighted mean and integer reconstruction map. Hypothesis: the much larger attention tensor contains near-duplicate scalars below the token failure scale, so this union preserves qualification and yields 1,458 parameters. It is more informative than the next QKV union (difference 2.039e-04) because it is the minimum-distortion test at this new site. Acceptance and rollback remain solely governed by the official runner.	0	0
attempt-0188	qkv-five-trial-continuation	micro-0002	dc447ee8fd0d081b048f79b302359545fe11ab29	120e65214496d5e61d46ea36b6cbdfa0418358b4	2026-08-17T13:34:36.200156+00:00	parameter tying	99.210000%	1457	keep	Union closest shared-QKV scalar groups 654 and 641	Family: parameter tying. Current retained frontier is 1,458 parameters at 99.210000%, a +0.210000 percentage-point margin over 99%. There have been 85 prior macro-attempts in this family and 695 prior micro-trials. The most recent accepted result is attempt-0185/micro-0002 at 1,479 parameters and 99.20%; the most recent failed result is attempt-0186/micro-0001 (block-0 pre-FF bias pair 8/3 discarded at 98.08%). This is a parameterization-preserving compression of the depth-shared QKV transform: union flattened coordinates 654 and 641, whose learned values are -0.0378057621 and -0.0376018994 (difference 2.039e-04), with a multiplicity-weighted mean and integer reconstruction map. Hypothesis: the much larger attention tensor contains near-duplicate scalars below the token failure scale, so this union preserves qualification and yields 1,457 parameters. It is more informative than the next QKV union (difference 2.067e-04) because it is the minimum-distortion test at this new site. Acceptance and rollback remain solely governed by the official runner.	0	0
attempt-0188	qkv-five-trial-continuation	micro-0003	7b86b6a653c53a8341066299a9b8a80e48f0af44	dc447ee8fd0d081b048f79b302359545fe11ab29	2026-08-17T13:35:53.850198+00:00	parameter tying	99.210000%	1456	keep	Union closest shared-QKV scalar groups 291 and 229	Family: parameter tying. Current retained frontier is 1,457 parameters at 99.210000%, a +0.210000 percentage-point margin over 99%. There have been 85 prior macro-attempts in this family and 696 prior micro-trials. The most recent accepted result is attempt-0185/micro-0002 at 1,479 parameters and 99.20%; the most recent failed result is attempt-0186/micro-0001 (block-0 pre-FF bias pair 8/3 discarded at 98.08%). This is a parameterization-preserving compression of the depth-shared QKV transform: union flattened coordinates 291 and 229, whose learned values are 0.1711508483 and 0.1713575572 (difference 2.067e-04), with a multiplicity-weighted mean and integer reconstruction map. Hypothesis: the much larger attention tensor contains near-duplicate scalars below the token failure scale, so this union preserves qualification and yields 1,456 parameters. It is more informative than the next QKV union (difference 2.121e-04) because it is the minimum-distortion test at this new site. Acceptance and rollback remain solely governed by the official runner.	0	0
attempt-0188	qkv-five-trial-continuation	micro-0004	cc408221f2861757f5ddd6c417dd8ff9a9fce64d	7b86b6a653c53a8341066299a9b8a80e48f0af44	2026-08-17T13:37:08.657163+00:00	parameter tying	99.210000%	1455	keep	Union closest shared-QKV scalar groups 142 and 659	Family: parameter tying. Current retained frontier is 1,456 parameters at 99.210000%, a +0.210000 percentage-point margin over 99%. There have been 85 prior macro-attempts in this family and 697 prior micro-trials. The most recent accepted result is attempt-0185/micro-0002 at 1,479 parameters and 99.20%; the most recent failed result is attempt-0186/micro-0001 (block-0 pre-FF bias pair 8/3 discarded at 98.08%). This is a parameterization-preserving compression of the depth-shared QKV transform: union flattened coordinates 142 and 659, whose learned values are 0.0581499562 and 0.0583620220 (difference 2.121e-04), with a multiplicity-weighted mean and integer reconstruction map. Hypothesis: the much larger attention tensor contains near-duplicate scalars below the token failure scale, so this union preserves qualification and yields 1,455 parameters. It is more informative than the next QKV union (difference 2.135e-04) because it is the minimum-distortion test at this new site. Acceptance and rollback remain solely governed by the official runner.	0	0
attempt-0188	qkv-five-trial-continuation	micro-0005	e3da88bd751cbdc51b33f9fe0c581ac995dc0c90	cc408221f2861757f5ddd6c417dd8ff9a9fce64d	2026-08-17T13:38:22.360240+00:00	parameter tying	99.210000%	1454	keep	Union closest shared-QKV scalar groups 410 and 219	Family: parameter tying. Current retained frontier is 1,455 parameters at 99.210000%, a +0.210000 percentage-point margin over 99%. There have been 85 prior macro-attempts in this family and 698 prior micro-trials. The most recent accepted result is attempt-0185/micro-0002 at 1,479 parameters and 99.20%; the most recent failed result is attempt-0186/micro-0001 (block-0 pre-FF bias pair 8/3 discarded at 98.08%). This is a parameterization-preserving compression of the depth-shared QKV transform: union flattened coordinates 410 and 219, whose learned values are -0.0933326781 and -0.0931191891 (difference 2.135e-04), with a multiplicity-weighted mean and integer reconstruction map. Hypothesis: the much larger attention tensor contains near-duplicate scalars below the token failure scale, so this union preserves qualification and yields 1,454 parameters. It is more informative than the next QKV union (difference 2.135e-04) because it is the minimum-distortion test at this new site. Acceptance and rollback remain solely governed by the official runner.	0	0
