macro_attempt_id	automation_id	micro_attempt_id	commit	parent_commit	timestamp_utc	family	accuracy	parameters	status	description	proposal	train_exit	verify_exit
attempt-0183	final-norm-skip-sensitive-pair	micro-0004	96b23ed4dade41358557d2f1d09a724bf58ea214	8c084e92e0f5d6088fc2adde4b2de54f89c03815	2026-08-17T12:53:43.124356+00:00	parameter tying	99.060000%	1482	keep	Union closest final LayerNorm scale groups 4 and 0	Family: parameter tying. Current retained frontier is 1,483 parameters at 99.000000%, a +0.000000 percentage-point margin over 99%. There have been 80 prior macro-attempts in this family and 667 prior micro-trials. The most recent accepted result is attempt-0183/micro-0003 at 1483 parameters and 99.000000%; the most recent failed result is attempt-0182/micro-0001 (discard, 98.990000%). This is a parameterization-preserving compression of the final normalization scales: union coordinates 4 and 0, values 7.2239298820 and 8.3199396133 (difference 1.096e+00), using a weighted mean and integer reconstruction. Hypothesis: the final affine rescaling contains a near-duplicate coordinate pair independent of matrix and positional boundaries, preserving qualification at 1,482 parameters. It is more informative than the next scale union (difference 1.204e+01) because it is the minimum-distortion test in the complete 16-scale search space. Official acceptance and rollback are unchanged.	0	0
attempt-0183	final-norm-skip-sensitive-pair	micro-0005	b4fadadb0c015d081ae83a98708d3ee4027f54bf	96b23ed4dade41358557d2f1d09a724bf58ea214	2026-08-17T12:54:59.420305+00:00	parameter tying	99.110000%	1481	keep	Union closest final LayerNorm scale groups 11 and 0	Family: parameter tying. Current retained frontier is 1,482 parameters at 99.060000%, a +0.060000 percentage-point margin over 99%. There have been 80 prior macro-attempts in this family and 668 prior micro-trials. The most recent accepted result is attempt-0183/micro-0004 at 1482 parameters and 99.060000%; the most recent failed result is attempt-0182/micro-0001 (discard, 98.990000%). This is a parameterization-preserving compression of the final normalization scales: union coordinates 11 and 0, values -4.8163661957 and 7.8815360069 (difference 1.270e+01), using a weighted mean and integer reconstruction. Hypothesis: the final affine rescaling contains a near-duplicate coordinate pair independent of matrix and positional boundaries, preserving qualification at 1,481 parameters. It is more informative than the next scale union (difference nan) because it is the minimum-distortion test in the complete 16-scale search space. Official acceptance and rollback are unchanged.	0	0
attempt-0184	block0-preff-scale-skip-sensitive-pair	micro-0001	f34f6678fa6a986c5088521cf18acfb41ed4350b	b4fadadb0c015d081ae83a98708d3ee4027f54bf	2026-08-17T12:57:16.289460+00:00	parameter tying	98.040000%	1480	discard	Union closest block-0 pre-FF norm scales 8 and 1	Family: parameter tying. Current retained frontier is 1,481 parameters at 99.110000%, a +0.110000 percentage-point margin over 99%. There have been 81 prior macro-attempts in this family and 669 prior micro-trials. The most recent accepted result is attempt-0183/micro-0005 at 1481 parameters and 99.110000%; the most recent failed result is attempt-0182/micro-0001 (discard, 98.990000%). This is a parameterization-preserving compression of block 0's pre-feed-forward normalization scales: union coordinates 8 and 1, values 0.4341307580 and 0.4471161664 (difference 1.299e-02), using a weighted mean and integer reconstruction. Hypothesis: upstream nonlinear normalization has local scale redundancy distinct from final normalization, preserving qualification at 1,480 parameters. It is more informative than the next scale union (difference 1.343e-02) because it is the minimum-distortion isolated scale test; biases remain independent. Official acceptance and rollback are unchanged.	0	0
attempt-0185	block0-preff-bias-skip-sensitive-pair	micro-0001	84aa2a8d614651983698fe32f6023651a635b25b	b4fadadb0c015d081ae83a98708d3ee4027f54bf	2026-08-17T12:59:38.374877+00:00	parameter tying	99.170000%	1480	keep	Union closest block-0 pre-FF norm biases 6 and 1	Family: parameter tying. Current retained frontier is 1,481 parameters at 99.110000%, a +0.110000 percentage-point margin over 99%. There have been 82 prior macro-attempts in this family and 670 prior micro-trials. The most recent accepted result is attempt-0183/micro-0005 at 1481 parameters and 99.110000%; the most recent failed result is attempt-0184/micro-0001 (discard, 98.040000%). This is a parameterization-preserving compression of block 0's pre-feed-forward normalization biases: union coordinates 6 and 1, values -0.0590417981 and -0.0540862270 (difference 4.956e-03), using a weighted mean and integer reconstruction. Hypothesis: additive centering has local redundancy distinct from the measured scale boundary, preserving qualification at 1,480 parameters. It is more informative than the next bias union (difference 5.813e-03) because it is the minimum-distortion isolated bias test; scales remain fixed. Official acceptance and rollback are unchanged.	0	0
attempt-0185	block0-preff-bias-skip-sensitive-pair	micro-0002	05875f033cfc959c59f855cfc2b634ebb11116fc	84aa2a8d614651983698fe32f6023651a635b25b	2026-08-17T13:00:46.506867+00:00	parameter tying	99.200000%	1479	keep	Union closest block-0 pre-FF norm biases 7 and 11	Family: parameter tying. Current retained frontier is 1,480 parameters at 99.170000%, a +0.170000 percentage-point margin over 99%. There have been 82 prior macro-attempts in this family and 671 prior micro-trials. The most recent accepted result is attempt-0185/micro-0001 at 1480 parameters and 99.170000%; the most recent failed result is attempt-0184/micro-0001 (discard, 98.040000%). This is a parameterization-preserving compression of block 0's pre-feed-forward normalization biases: union coordinates 7 and 11, values -0.0433933064 and -0.0375803076 (difference 5.813e-03), using a weighted mean and integer reconstruction. Hypothesis: additive centering has local redundancy distinct from the measured scale boundary, preserving qualification at 1,479 parameters. It is more informative than the next bias union (difference 1.400e-02) because it is the minimum-distortion isolated bias test; scales remain fixed. Official acceptance and rollback are unchanged.	0	0
attempt-0185	block0-preff-bias-skip-sensitive-pair	micro-0003	461a4004f491976c0effcdaa7848f6bd68298637	05875f033cfc959c59f855cfc2b634ebb11116fc	2026-08-17T13:01:53.535408+00:00	parameter tying	98.750000%	1478	discard	Union closest block-0 pre-FF norm biases 14 and 1	Family: parameter tying. Current retained frontier is 1,479 parameters at 99.200000%, a +0.200000 percentage-point margin over 99%. There have been 82 prior macro-attempts in this family and 672 prior micro-trials. The most recent accepted result is attempt-0185/micro-0002 at 1479 parameters and 99.200000%; the most recent failed result is attempt-0184/micro-0001 (discard, 98.040000%). This is a parameterization-preserving compression of block 0's pre-feed-forward normalization biases: union coordinates 14 and 1, values -0.0736862943 and -0.0573899411 (difference 1.630e-02), using a weighted mean and integer reconstruction. Hypothesis: additive centering has local redundancy distinct from the measured scale boundary, preserving qualification at 1,478 parameters. It is more informative than the next bias union (difference 1.654e-02) because it is the minimum-distortion isolated bias test; scales remain fixed. Official acceptance and rollback are unchanged.	0	0
attempt-0186	block0-preff-bias-skip-two-sensitive-pairs	micro-0001	4feea38358607b35ee8c81ea3d5999c8d130b74f	05875f033cfc959c59f855cfc2b634ebb11116fc	2026-08-17T13:03:42.335769+00:00	parameter tying	98.080000%	1478	discard	Union closest block-0 pre-FF norm biases 8 and 3	Family: parameter tying. Current retained frontier is 1,479 parameters at 99.200000%, a +0.200000 percentage-point margin over 99%. There have been 83 prior macro-attempts in this family and 673 prior micro-trials. The most recent accepted result is attempt-0185/micro-0002 at 1479 parameters and 99.200000%; the most recent failed result is attempt-0185/micro-0003 (discard, 98.750000%). This is a parameterization-preserving compression of block 0's pre-feed-forward normalization biases: union coordinates 8 and 3, values 0.0470397957 and 0.0635843351 (difference 1.654e-02), using a weighted mean and integer reconstruction. Hypothesis: additive centering has local redundancy distinct from the measured scale boundary, preserving qualification at 1,478 parameters. It is more informative than the next bias union (difference 1.690e-02) because it is the minimum-distortion isolated bias test; scales remain fixed. Official acceptance and rollback are unchanged.	0	0
attempt-0187	qkv-revisit-after-cross-tensor-compression	micro-0001	1482ce15263163befaab63627a680560efa371b0	05875f033cfc959c59f855cfc2b634ebb11116fc	2026-08-17T13:05:59.649449+00:00	parameter tying	99.190000%	1478	keep	Union closest shared-QKV scalar groups 34 and 42	Family: parameter tying. Current retained frontier is 1,479 parameters at 99.200000%, a +0.200000 percentage-point margin over 99%. There have been 84 prior macro-attempts in this family and 674 prior micro-trials. The most recent accepted result is attempt-0185/micro-0002 at 1,479 parameters and 99.20%; the most recent failed result is attempt-0186/micro-0001 (block-0 pre-FF bias pair 8/3 discarded at 98.08%). This is a parameterization-preserving compression of the depth-shared QKV transform: union flattened coordinates 34 and 42, whose learned values are -0.1585058868 and -0.1583363116 (difference 1.696e-04), with a multiplicity-weighted mean and integer reconstruction map. Hypothesis: the much larger attention tensor contains near-duplicate scalars below the token failure scale, so this union preserves qualification and yields 1,478 parameters. It is more informative than the next QKV union (difference 1.715e-04) because it is the minimum-distortion test at this new site. Acceptance and rollback remain solely governed by the official runner.	0	0
attempt-0187	qkv-revisit-after-cross-tensor-compression	micro-0002	c769a04a448fb506c66d95a0dd71f51ce50b9228	1482ce15263163befaab63627a680560efa371b0	2026-08-17T13:07:17.446638+00:00	parameter tying	99.190000%	1477	keep	Union closest shared-QKV scalar groups 52 and 283	Family: parameter tying. Current retained frontier is 1,478 parameters at 99.190000%, a +0.190000 percentage-point margin over 99%. There have been 84 prior macro-attempts in this family and 675 prior micro-trials. The most recent accepted result is attempt-0185/micro-0002 at 1,479 parameters and 99.20%; the most recent failed result is attempt-0186/micro-0001 (block-0 pre-FF bias pair 8/3 discarded at 98.08%). This is a parameterization-preserving compression of the depth-shared QKV transform: union flattened coordinates 52 and 283, whose learned values are -0.2213726938 and -0.2212011665 (difference 1.715e-04), with a multiplicity-weighted mean and integer reconstruction map. Hypothesis: the much larger attention tensor contains near-duplicate scalars below the token failure scale, so this union preserves qualification and yields 1,477 parameters. It is more informative than the next QKV union (difference 1.725e-04) because it is the minimum-distortion test at this new site. Acceptance and rollback remain solely governed by the official runner.	0	0
attempt-0187	qkv-revisit-after-cross-tensor-compression	micro-0003	410790f7cc8949a2b65cba40fac3edc469583b77	c769a04a448fb506c66d95a0dd71f51ce50b9228	2026-08-17T13:09:05.344328+00:00	parameter tying	99.190000%	1476	keep	Union closest shared-QKV scalar groups 401 and 54	Family: parameter tying. Current retained frontier is 1,477 parameters at 99.190000%, a +0.190000 percentage-point margin over 99%. There have been 84 prior macro-attempts in this family and 676 prior micro-trials. The most recent accepted result is attempt-0185/micro-0002 at 1,479 parameters and 99.20%; the most recent failed result is attempt-0186/micro-0001 (block-0 pre-FF bias pair 8/3 discarded at 98.08%). This is a parameterization-preserving compression of the depth-shared QKV transform: union flattened coordinates 401 and 54, whose learned values are 0.1618884504 and 0.1620609611 (difference 1.725e-04), with a multiplicity-weighted mean and integer reconstruction map. Hypothesis: the much larger attention tensor contains near-duplicate scalars below the token failure scale, so this union preserves qualification and yields 1,476 parameters. It is more informative than the next QKV union (difference 1.734e-04) because it is the minimum-distortion test at this new site. Acceptance and rollback remain solely governed by the official runner.	0	0
attempt-0187	qkv-revisit-after-cross-tensor-compression	micro-0004	54eeec710c39292e1222a8a6ba67982d69fce79c	410790f7cc8949a2b65cba40fac3edc469583b77	2026-08-17T13:10:21.638752+00:00	parameter tying	99.200000%	1475	keep	Union closest shared-QKV scalar groups 78 and 655	Family: parameter tying. Current retained frontier is 1,476 parameters at 99.190000%, a +0.190000 percentage-point margin over 99%. There have been 84 prior macro-attempts in this family and 677 prior micro-trials. The most recent accepted result is attempt-0185/micro-0002 at 1,479 parameters and 99.20%; the most recent failed result is attempt-0186/micro-0001 (block-0 pre-FF bias pair 8/3 discarded at 98.08%). This is a parameterization-preserving compression of the depth-shared QKV transform: union flattened coordinates 78 and 655, whose learned values are 0.0162400920 and 0.0164135173 (difference 1.734e-04), with a multiplicity-weighted mean and integer reconstruction map. Hypothesis: the much larger attention tensor contains near-duplicate scalars below the token failure scale, so this union preserves qualification and yields 1,475 parameters. It is more informative than the next QKV union (difference 1.736e-04) because it is the minimum-distortion test at this new site. Acceptance and rollback remain solely governed by the official runner.	0	0
attempt-0187	qkv-revisit-after-cross-tensor-compression	micro-0005	f3088fb0a10f92fc61e54739bbdc4ac7fcef45ac	54eeec710c39292e1222a8a6ba67982d69fce79c	2026-08-17T13:11:37.662994+00:00	parameter tying	99.190000%	1474	keep	Union closest shared-QKV scalar groups 529 and 127	Family: parameter tying. Current retained frontier is 1,475 parameters at 99.200000%, a +0.200000 percentage-point margin over 99%. There have been 84 prior macro-attempts in this family and 678 prior micro-trials. The most recent accepted result is attempt-0185/micro-0002 at 1,479 parameters and 99.20%; the most recent failed result is attempt-0186/micro-0001 (block-0 pre-FF bias pair 8/3 discarded at 98.08%). This is a parameterization-preserving compression of the depth-shared QKV transform: union flattened coordinates 529 and 127, whose learned values are 0.0084658004 and 0.0086393934 (difference 1.736e-04), with a multiplicity-weighted mean and integer reconstruction map. Hypothesis: the much larger attention tensor contains near-duplicate scalars below the token failure scale, so this union preserves qualification and yields 1,474 parameters. It is more informative than the next QKV union (difference 1.746e-04) because it is the minimum-distortion test at this new site. Acceptance and rollback remain solely governed by the official runner.	0	0
attempt-0187	qkv-revisit-after-cross-tensor-compression	micro-0006	045f8a71d8e2da67b8582ad23bc83e2dfa823496	f3088fb0a10f92fc61e54739bbdc4ac7fcef45ac	2026-08-17T13:12:55.900572+00:00	parameter tying	99.240000%	1473	keep	Union closest shared-QKV scalar groups 588 and 574	Family: parameter tying. Current retained frontier is 1,474 parameters at 99.190000%, a +0.190000 percentage-point margin over 99%. There have been 84 prior macro-attempts in this family and 679 prior micro-trials. The most recent accepted result is attempt-0185/micro-0002 at 1,479 parameters and 99.20%; the most recent failed result is attempt-0186/micro-0001 (block-0 pre-FF bias pair 8/3 discarded at 98.08%). This is a parameterization-preserving compression of the depth-shared QKV transform: union flattened coordinates 588 and 574, whose learned values are 0.0060047032 and 0.0061793095 (difference 1.746e-04), with a multiplicity-weighted mean and integer reconstruction map. Hypothesis: the much larger attention tensor contains near-duplicate scalars below the token failure scale, so this union preserves qualification and yields 1,473 parameters. It is more informative than the next QKV union (difference 1.760e-04) because it is the minimum-distortion test at this new site. Acceptance and rollback remain solely governed by the official runner.	0	0
attempt-0187	qkv-revisit-after-cross-tensor-compression	micro-0007	e488b1d033ff0288e83f6cffd819e2f9acfb242d	045f8a71d8e2da67b8582ad23bc83e2dfa823496	2026-08-17T13:14:13.224596+00:00	parameter tying	99.240000%	1472	keep	Union closest shared-QKV scalar groups 321 and 751	Family: parameter tying. Current retained frontier is 1,473 parameters at 99.240000%, a +0.240000 percentage-point margin over 99%. There have been 84 prior macro-attempts in this family and 680 prior micro-trials. The most recent accepted result is attempt-0185/micro-0002 at 1,479 parameters and 99.20%; the most recent failed result is attempt-0186/micro-0001 (block-0 pre-FF bias pair 8/3 discarded at 98.08%). This is a parameterization-preserving compression of the depth-shared QKV transform: union flattened coordinates 321 and 751, whose learned values are 0.0607213974 and 0.0608974174 (difference 1.760e-04), with a multiplicity-weighted mean and integer reconstruction map. Hypothesis: the much larger attention tensor contains near-duplicate scalars below the token failure scale, so this union preserves qualification and yields 1,472 parameters. It is more informative than the next QKV union (difference 1.764e-04) because it is the minimum-distortion test at this new site. Acceptance and rollback remain solely governed by the official runner.	0	0
attempt-0187	qkv-revisit-after-cross-tensor-compression	micro-0008	3162bf397b98df39b9ca55c9e15f8a152a23fa81	e488b1d033ff0288e83f6cffd819e2f9acfb242d	2026-08-17T13:15:29.228196+00:00	parameter tying	99.240000%	1471	keep	Union closest shared-QKV scalar groups 674 and 322	Family: parameter tying. Current retained frontier is 1,472 parameters at 99.240000%, a +0.240000 percentage-point margin over 99%. There have been 84 prior macro-attempts in this family and 681 prior micro-trials. The most recent accepted result is attempt-0185/micro-0002 at 1,479 parameters and 99.20%; the most recent failed result is attempt-0186/micro-0001 (block-0 pre-FF bias pair 8/3 discarded at 98.08%). This is a parameterization-preserving compression of the depth-shared QKV transform: union flattened coordinates 674 and 322, whose learned values are 0.0297093373 and 0.0298857801 (difference 1.764e-04), with a multiplicity-weighted mean and integer reconstruction map. Hypothesis: the much larger attention tensor contains near-duplicate scalars below the token failure scale, so this union preserves qualification and yields 1,471 parameters. It is more informative than the next QKV union (difference 1.775e-04) because it is the minimum-distortion test at this new site. Acceptance and rollback remain solely governed by the official runner.	0	0
attempt-0187	qkv-revisit-after-cross-tensor-compression	micro-0009	86d19bad576f3837fee5db7340433a9bb057009d	3162bf397b98df39b9ca55c9e15f8a152a23fa81	2026-08-17T13:16:52.860444+00:00	parameter tying	99.240000%	1470	keep	Union closest shared-QKV scalar groups 308 and 263	Family: parameter tying. Current retained frontier is 1,471 parameters at 99.240000%, a +0.240000 percentage-point margin over 99%. There have been 84 prior macro-attempts in this family and 682 prior micro-trials. The most recent accepted result is attempt-0185/micro-0002 at 1,479 parameters and 99.20%; the most recent failed result is attempt-0186/micro-0001 (block-0 pre-FF bias pair 8/3 discarded at 98.08%). This is a parameterization-preserving compression of the depth-shared QKV transform: union flattened coordinates 308 and 263, whose learned values are 0.1938502491 and 0.1940277368 (difference 1.775e-04), with a multiplicity-weighted mean and integer reconstruction map. Hypothesis: the much larger attention tensor contains near-duplicate scalars below the token failure scale, so this union preserves qualification and yields 1,470 parameters. It is more informative than the next QKV union (difference 1.786e-04) because it is the minimum-distortion test at this new site. Acceptance and rollback remain solely governed by the official runner.	0	0
