macro_attempt_id	automation_id	micro_attempt_id	commit	parent_commit	timestamp_utc	family	accuracy	parameters	status	description	proposal	train_exit	verify_exit
attempt-0169	ff-output-skip-four-sensitive-pairs	micro-0001	fa6c99b80507a7a7be7e0ba08cc2d5cb1d122635	3bd65bc6a0e8f2d103841ceb9048b6ce68906426	2026-08-17T10:20:19.174042+00:00	parameter tying	99.020000%	1585	keep	Union closest shared FF-output scalar groups 118 and 119	Family: parameter tying. Current retained frontier is 1,586 parameters at 99.020000%, a +0.020000 percentage-point margin over 99%. There have been 66 prior macro-attempts in this family and 553 prior micro-trials. The most recent accepted result is attempt-0168/micro-0004 at 1,586 parameters and 99.02%; the most recent failed result is attempt-0168/micro-0005 (FF-output pair 183/223 discarded at 98.99%). This is a parameterization-preserving compression of the depth-shared feed-forward output map: union flattened coordinates 118 and 119, values 0.0333433077 and 0.0335657597 (difference 2.225e-04), using a weighted mean and integer reconstruction. Hypothesis: residual-stream reconstruction contains near-duplicate scalars distinct from FF-input redundancy, preserving qualification at 1,585 parameters. It is more informative than the next FF-output union (difference 2.267e-04) because it is the minimum-distortion isolated test of the complementary FF map. Official acceptance and rollback are unchanged.	0	0
attempt-0169	ff-output-skip-four-sensitive-pairs	micro-0002	c2e7fe33077f2434ec05e8cbf3674f9cf15310f3	fa6c99b80507a7a7be7e0ba08cc2d5cb1d122635	2026-08-17T10:21:45.203169+00:00	parameter tying	99.000000%	1584	keep	Union closest shared FF-output scalar groups 69 and 7	Family: parameter tying. Current retained frontier is 1,585 parameters at 99.020000%, a +0.020000 percentage-point margin over 99%. There have been 66 prior macro-attempts in this family and 554 prior micro-trials. The most recent accepted result is attempt-0168/micro-0004 at 1,586 parameters and 99.02%; the most recent failed result is attempt-0168/micro-0005 (FF-output pair 183/223 discarded at 98.99%). This is a parameterization-preserving compression of the depth-shared feed-forward output map: union flattened coordinates 69 and 7, values -0.0037588507 and -0.0035321494 (difference 2.267e-04), using a weighted mean and integer reconstruction. Hypothesis: residual-stream reconstruction contains near-duplicate scalars distinct from FF-input redundancy, preserving qualification at 1,584 parameters. It is more informative than the next FF-output union (difference 2.297e-04) because it is the minimum-distortion isolated test of the complementary FF map. Official acceptance and rollback are unchanged.	0	0
attempt-0169	ff-output-skip-four-sensitive-pairs	micro-0003	4f30f3e83d6cba533024f9dacce9f538b7f7b1f4	c2e7fe33077f2434ec05e8cbf3674f9cf15310f3	2026-08-17T10:23:10.981147+00:00	parameter tying	99.000000%	1583	keep	Union closest shared FF-output scalar groups 247 and 84	Family: parameter tying. Current retained frontier is 1,584 parameters at 99.000000%, a +0.000000 percentage-point margin over 99%. There have been 66 prior macro-attempts in this family and 555 prior micro-trials. The most recent accepted result is attempt-0168/micro-0004 at 1,586 parameters and 99.02%; the most recent failed result is attempt-0168/micro-0005 (FF-output pair 183/223 discarded at 98.99%). This is a parameterization-preserving compression of the depth-shared feed-forward output map: union flattened coordinates 247 and 84, values 0.0166628882 and 0.0168926101 (difference 2.297e-04), using a weighted mean and integer reconstruction. Hypothesis: residual-stream reconstruction contains near-duplicate scalars distinct from FF-input redundancy, preserving qualification at 1,583 parameters. It is more informative than the next FF-output union (difference 2.600e-04) because it is the minimum-distortion isolated test of the complementary FF map. Official acceptance and rollback are unchanged.	0	0
attempt-0169	ff-output-skip-four-sensitive-pairs	micro-0004	d711e24ba69f3f020dd2590e9d3f059346e002a0	4f30f3e83d6cba533024f9dacce9f538b7f7b1f4	2026-08-17T10:24:20.910029+00:00	parameter tying	99.000000%	1582	keep	Union closest shared FF-output scalar groups 239 and 143	Family: parameter tying. Current retained frontier is 1,583 parameters at 99.000000%, a +0.000000 percentage-point margin over 99%. There have been 66 prior macro-attempts in this family and 556 prior micro-trials. The most recent accepted result is attempt-0168/micro-0004 at 1,586 parameters and 99.02%; the most recent failed result is attempt-0168/micro-0005 (FF-output pair 183/223 discarded at 98.99%). This is a parameterization-preserving compression of the depth-shared feed-forward output map: union flattened coordinates 239 and 143, values -0.0717083886 and -0.0714483783 (difference 2.600e-04), using a weighted mean and integer reconstruction. Hypothesis: residual-stream reconstruction contains near-duplicate scalars distinct from FF-input redundancy, preserving qualification at 1,582 parameters. It is more informative than the next FF-output union (difference 2.674e-04) because it is the minimum-distortion isolated test of the complementary FF map. Official acceptance and rollback are unchanged.	0	0
attempt-0169	ff-output-skip-four-sensitive-pairs	micro-0005	6441523a84c897030f6e95e19bcbeefd64df0e16	d711e24ba69f3f020dd2590e9d3f059346e002a0	2026-08-17T10:25:33.274971+00:00	parameter tying	99.030000%	1581	keep	Union closest shared FF-output scalar groups 58 and 19	Family: parameter tying. Current retained frontier is 1,582 parameters at 99.000000%, a +0.000000 percentage-point margin over 99%. There have been 66 prior macro-attempts in this family and 557 prior micro-trials. The most recent accepted result is attempt-0168/micro-0004 at 1,586 parameters and 99.02%; the most recent failed result is attempt-0168/micro-0005 (FF-output pair 183/223 discarded at 98.99%). This is a parameterization-preserving compression of the depth-shared feed-forward output map: union flattened coordinates 58 and 19, values 0.0001672037 and 0.0004346526 (difference 2.674e-04), using a weighted mean and integer reconstruction. Hypothesis: residual-stream reconstruction contains near-duplicate scalars distinct from FF-input redundancy, preserving qualification at 1,581 parameters. It is more informative than the next FF-output union (difference 2.679e-04) because it is the minimum-distortion isolated test of the complementary FF map. Official acceptance and rollback are unchanged.	0	0
attempt-0169	ff-output-skip-four-sensitive-pairs	micro-0006	20c9de36a65fffef9fea999e0cbd1768d3a6cdf2	6441523a84c897030f6e95e19bcbeefd64df0e16	2026-08-17T10:26:48.340683+00:00	parameter tying	99.020000%	1580	keep	Union closest shared FF-output scalar groups 191 and 79	Family: parameter tying. Current retained frontier is 1,581 parameters at 99.030000%, a +0.030000 percentage-point margin over 99%. There have been 66 prior macro-attempts in this family and 558 prior micro-trials. The most recent accepted result is attempt-0168/micro-0004 at 1,586 parameters and 99.02%; the most recent failed result is attempt-0168/micro-0005 (FF-output pair 183/223 discarded at 98.99%). This is a parameterization-preserving compression of the depth-shared feed-forward output map: union flattened coordinates 191 and 79, values -0.0108519476 and -0.0105840163 (difference 2.679e-04), using a weighted mean and integer reconstruction. Hypothesis: residual-stream reconstruction contains near-duplicate scalars distinct from FF-input redundancy, preserving qualification at 1,580 parameters. It is more informative than the next FF-output union (difference 2.729e-04) because it is the minimum-distortion isolated test of the complementary FF map. Official acceptance and rollback are unchanged.	0	0
attempt-0169	ff-output-skip-four-sensitive-pairs	micro-0007	5e20c3cd6a657be7a82b65d30a505d10655716bc	20c9de36a65fffef9fea999e0cbd1768d3a6cdf2	2026-08-17T10:28:03.770778+00:00	parameter tying	99.050000%	1579	keep	Union closest shared FF-output scalar groups 144 and 107	Family: parameter tying. Current retained frontier is 1,580 parameters at 99.020000%, a +0.020000 percentage-point margin over 99%. There have been 66 prior macro-attempts in this family and 559 prior micro-trials. The most recent accepted result is attempt-0168/micro-0004 at 1,586 parameters and 99.02%; the most recent failed result is attempt-0168/micro-0005 (FF-output pair 183/223 discarded at 98.99%). This is a parameterization-preserving compression of the depth-shared feed-forward output map: union flattened coordinates 144 and 107, values -0.0847604349 and -0.0844875574 (difference 2.729e-04), using a weighted mean and integer reconstruction. Hypothesis: residual-stream reconstruction contains near-duplicate scalars distinct from FF-input redundancy, preserving qualification at 1,579 parameters. It is more informative than the next FF-output union (difference 2.753e-04) because it is the minimum-distortion isolated test of the complementary FF map. Official acceptance and rollback are unchanged.	0	0
attempt-0169	ff-output-skip-four-sensitive-pairs	micro-0008	0b4444e1036d7003f13fb8ff85818730dd176d9a	5e20c3cd6a657be7a82b65d30a505d10655716bc	2026-08-17T10:29:19.083248+00:00	parameter tying	99.040000%	1578	keep	Union closest shared FF-output scalar groups 209 and 168	Family: parameter tying. Current retained frontier is 1,579 parameters at 99.050000%, a +0.050000 percentage-point margin over 99%. There have been 66 prior macro-attempts in this family and 560 prior micro-trials. The most recent accepted result is attempt-0168/micro-0004 at 1,586 parameters and 99.02%; the most recent failed result is attempt-0168/micro-0005 (FF-output pair 183/223 discarded at 98.99%). This is a parameterization-preserving compression of the depth-shared feed-forward output map: union flattened coordinates 209 and 168, values 0.0091690673 and 0.0094443336 (difference 2.753e-04), using a weighted mean and integer reconstruction. Hypothesis: residual-stream reconstruction contains near-duplicate scalars distinct from FF-input redundancy, preserving qualification at 1,578 parameters. It is more informative than the next FF-output union (difference 2.794e-04) because it is the minimum-distortion isolated test of the complementary FF map. Official acceptance and rollback are unchanged.	0	0
attempt-0169	ff-output-skip-four-sensitive-pairs	micro-0009	0be82ecf56035ae724b7ac37f0b56af3a148a32e	0b4444e1036d7003f13fb8ff85818730dd176d9a	2026-08-17T10:30:34.542037+00:00	parameter tying	99.010000%	1577	keep	Union closest shared FF-output scalar groups 71 and 92	Family: parameter tying. Current retained frontier is 1,578 parameters at 99.040000%, a +0.040000 percentage-point margin over 99%. There have been 66 prior macro-attempts in this family and 561 prior micro-trials. The most recent accepted result is attempt-0168/micro-0004 at 1,586 parameters and 99.02%; the most recent failed result is attempt-0168/micro-0005 (FF-output pair 183/223 discarded at 98.99%). This is a parameterization-preserving compression of the depth-shared feed-forward output map: union flattened coordinates 71 and 92, values -0.0016995448 and -0.0014201598 (difference 2.794e-04), using a weighted mean and integer reconstruction. Hypothesis: residual-stream reconstruction contains near-duplicate scalars distinct from FF-input redundancy, preserving qualification at 1,577 parameters. It is more informative than the next FF-output union (difference 2.814e-04) because it is the minimum-distortion isolated test of the complementary FF map. Official acceptance and rollback are unchanged.	0	0
attempt-0169	ff-output-skip-four-sensitive-pairs	micro-0010	32425bbe944eab318e80c751290792189daa9256	0be82ecf56035ae724b7ac37f0b56af3a148a32e	2026-08-17T10:31:51.000280+00:00	parameter tying	99.000000%	1576	keep	Union closest shared FF-output scalar groups 117 and 74	Family: parameter tying. Current retained frontier is 1,577 parameters at 99.010000%, a +0.010000 percentage-point margin over 99%. There have been 66 prior macro-attempts in this family and 562 prior micro-trials. The most recent accepted result is attempt-0168/micro-0004 at 1,586 parameters and 99.02%; the most recent failed result is attempt-0168/micro-0005 (FF-output pair 183/223 discarded at 98.99%). This is a parameterization-preserving compression of the depth-shared feed-forward output map: union flattened coordinates 117 and 74, values -0.0102504361 and -0.0099690780 (difference 2.814e-04), using a weighted mean and integer reconstruction. Hypothesis: residual-stream reconstruction contains near-duplicate scalars distinct from FF-input redundancy, preserving qualification at 1,576 parameters. It is more informative than the next FF-output union (difference 2.884e-04) because it is the minimum-distortion isolated test of the complementary FF map. Official acceptance and rollback are unchanged.	0	0
attempt-0169	ff-output-skip-four-sensitive-pairs	micro-0011	d837f0641fe7d6d03743b3eaef0329850298eb31	32425bbe944eab318e80c751290792189daa9256	2026-08-17T10:33:05.929618+00:00	parameter tying	99.020000%	1575	keep	Union closest shared FF-output scalar groups 182 and 189	Family: parameter tying. Current retained frontier is 1,576 parameters at 99.000000%, a +0.000000 percentage-point margin over 99%. There have been 66 prior macro-attempts in this family and 563 prior micro-trials. The most recent accepted result is attempt-0168/micro-0004 at 1,586 parameters and 99.02%; the most recent failed result is attempt-0168/micro-0005 (FF-output pair 183/223 discarded at 98.99%). This is a parameterization-preserving compression of the depth-shared feed-forward output map: union flattened coordinates 182 and 189, values -0.0117412657 and -0.0114529021 (difference 2.884e-04), using a weighted mean and integer reconstruction. Hypothesis: residual-stream reconstruction contains near-duplicate scalars distinct from FF-input redundancy, preserving qualification at 1,575 parameters. It is more informative than the next FF-output union (difference 2.926e-04) because it is the minimum-distortion isolated test of the complementary FF map. Official acceptance and rollback are unchanged.	0	0
attempt-0169	ff-output-skip-four-sensitive-pairs	micro-0012	ee94561256453e2171b11334cccc17e19e069a50	d837f0641fe7d6d03743b3eaef0329850298eb31	2026-08-17T10:34:28.517846+00:00	parameter tying	99.030000%	1574	keep	Union closest shared FF-output scalar groups 248 and 149	Family: parameter tying. Current retained frontier is 1,575 parameters at 99.020000%, a +0.020000 percentage-point margin over 99%. There have been 66 prior macro-attempts in this family and 564 prior micro-trials. The most recent accepted result is attempt-0168/micro-0004 at 1,586 parameters and 99.02%; the most recent failed result is attempt-0168/micro-0005 (FF-output pair 183/223 discarded at 98.99%). This is a parameterization-preserving compression of the depth-shared feed-forward output map: union flattened coordinates 248 and 149, values 0.0303191338 and 0.0306117032 (difference 2.926e-04), using a weighted mean and integer reconstruction. Hypothesis: residual-stream reconstruction contains near-duplicate scalars distinct from FF-input redundancy, preserving qualification at 1,574 parameters. It is more informative than the next FF-output union (difference 3.061e-04) because it is the minimum-distortion isolated test of the complementary FF map. Official acceptance and rollback are unchanged.	0	0
attempt-0169	ff-output-skip-four-sensitive-pairs	micro-0013	131e2f8d673dc6d2a690917ac16ea4b8e1e8a5f2	ee94561256453e2171b11334cccc17e19e069a50	2026-08-17T10:35:44.363239+00:00	parameter tying	99.040000%	1573	keep	Union closest shared FF-output scalar groups 157 and 101	Family: parameter tying. Current retained frontier is 1,574 parameters at 99.030000%, a +0.030000 percentage-point margin over 99%. There have been 66 prior macro-attempts in this family and 565 prior micro-trials. The most recent accepted result is attempt-0168/micro-0004 at 1,586 parameters and 99.02%; the most recent failed result is attempt-0168/micro-0005 (FF-output pair 183/223 discarded at 98.99%). This is a parameterization-preserving compression of the depth-shared feed-forward output map: union flattened coordinates 157 and 101, values 0.0157417711 and 0.0160478409 (difference 3.061e-04), using a weighted mean and integer reconstruction. Hypothesis: residual-stream reconstruction contains near-duplicate scalars distinct from FF-input redundancy, preserving qualification at 1,573 parameters. It is more informative than the next FF-output union (difference 3.120e-04) because it is the minimum-distortion isolated test of the complementary FF map. Official acceptance and rollback are unchanged.	0	0
attempt-0169	ff-output-skip-four-sensitive-pairs	micro-0014	65447ded15eae4d8fe83ff44f3edf9f937f3cbec	131e2f8d673dc6d2a690917ac16ea4b8e1e8a5f2	2026-08-17T10:36:57.935915+00:00	parameter tying	99.080000%	1572	keep	Union closest shared FF-output scalar groups 215 and 11	Family: parameter tying. Current retained frontier is 1,573 parameters at 99.040000%, a +0.040000 percentage-point margin over 99%. There have been 66 prior macro-attempts in this family and 566 prior micro-trials. The most recent accepted result is attempt-0168/micro-0004 at 1,586 parameters and 99.02%; the most recent failed result is attempt-0168/micro-0005 (FF-output pair 183/223 discarded at 98.99%). This is a parameterization-preserving compression of the depth-shared feed-forward output map: union flattened coordinates 215 and 11, values -0.0596261658 and -0.0593141988 (difference 3.120e-04), using a weighted mean and integer reconstruction. Hypothesis: residual-stream reconstruction contains near-duplicate scalars distinct from FF-input redundancy, preserving qualification at 1,572 parameters. It is more informative than the next FF-output union (difference 3.143e-04) because it is the minimum-distortion isolated test of the complementary FF map. Official acceptance and rollback are unchanged.	0	0
attempt-0169	ff-output-skip-four-sensitive-pairs	micro-0015	45cd935ee9681e4582f99fa418475eec4d5c67ff	65447ded15eae4d8fe83ff44f3edf9f937f3cbec	2026-08-17T10:38:12.445090+00:00	parameter tying	99.070000%	1571	keep	Union closest shared FF-output scalar groups 227 and 78	Family: parameter tying. Current retained frontier is 1,572 parameters at 99.080000%, a +0.080000 percentage-point margin over 99%. There have been 66 prior macro-attempts in this family and 567 prior micro-trials. The most recent accepted result is attempt-0168/micro-0004 at 1,586 parameters and 99.02%; the most recent failed result is attempt-0168/micro-0005 (FF-output pair 183/223 discarded at 98.99%). This is a parameterization-preserving compression of the depth-shared feed-forward output map: union flattened coordinates 227 and 78, values -0.0420486704 and -0.0417343453 (difference 3.143e-04), using a weighted mean and integer reconstruction. Hypothesis: residual-stream reconstruction contains near-duplicate scalars distinct from FF-input redundancy, preserving qualification at 1,571 parameters. It is more informative than the next FF-output union (difference 3.246e-04) because it is the minimum-distortion isolated test of the complementary FF map. Official acceptance and rollback are unchanged.	0	0
attempt-0169	ff-output-skip-four-sensitive-pairs	micro-0016	65e45c1fa4dde0e632f9cae18accab6459267a08	45cd935ee9681e4582f99fa418475eec4d5c67ff	2026-08-17T10:39:28.756561+00:00	parameter tying	99.030000%	1570	keep	Union closest shared FF-output scalar groups 140 and 67	Family: parameter tying. Current retained frontier is 1,571 parameters at 99.070000%, a +0.070000 percentage-point margin over 99%. There have been 66 prior macro-attempts in this family and 568 prior micro-trials. The most recent accepted result is attempt-0168/micro-0004 at 1,586 parameters and 99.02%; the most recent failed result is attempt-0168/micro-0005 (FF-output pair 183/223 discarded at 98.99%). This is a parameterization-preserving compression of the depth-shared feed-forward output map: union flattened coordinates 140 and 67, values 0.0037299010 and 0.0040545203 (difference 3.246e-04), using a weighted mean and integer reconstruction. Hypothesis: residual-stream reconstruction contains near-duplicate scalars distinct from FF-input redundancy, preserving qualification at 1,570 parameters. It is more informative than the next FF-output union (difference 3.312e-04) because it is the minimum-distortion isolated test of the complementary FF map. Official acceptance and rollback are unchanged.	0	0
