macro_attempt_id	automation_id	micro_attempt_id	commit	parent_commit	timestamp_utc	family	accuracy	parameters	status	description	proposal	train_exit	verify_exit
attempt-0159	qkv-skip-seven-sensitive-pairs	micro-0010	297fcf806497165dc123072aaa82ddb4845e11b1	77e3646e2e1dd2a87717bcb21b3d49c2058a4836	2026-08-17T09:13:17.513971+00:00	parameter tying	99.040000%	1623	keep	Union closest shared-QKV scalar groups 385 and 726	Family: parameter tying. Current retained frontier is 1,624 parameters at 99.040000%, a +0.040000 percentage-point margin over 99%. There have been 56 prior macro-attempts in this family and 505 prior micro-trials. The most recent accepted result is attempt-0158/micro-0002 at 1,633 parameters and 99.00%; the most recent failed result is attempt-0158/micro-0003 (QKV pair 722/588 discarded at 98.97%). This is a parameterization-preserving compression of the depth-shared QKV transform: union flattened coordinates 385 and 726, whose learned values are -0.1080522463 and -0.1079512760 (difference 1.010e-04), with a multiplicity-weighted mean and integer reconstruction map. Hypothesis: the much larger attention tensor contains near-duplicate scalars below the token failure scale, so this union preserves qualification and yields 1,623 parameters. It is more informative than the next QKV union (difference 1.013e-04) because it is the minimum-distortion test at this new site. Acceptance and rollback remain solely governed by the official runner.	0	0
attempt-0159	qkv-skip-seven-sensitive-pairs	micro-0011	a62536e167983f0b21dc581d48961f5d4eb4161d	297fcf806497165dc123072aaa82ddb4845e11b1	2026-08-17T09:14:30.552117+00:00	parameter tying	99.040000%	1622	keep	Union closest shared-QKV scalar groups 383 and 454	Family: parameter tying. Current retained frontier is 1,623 parameters at 99.040000%, a +0.040000 percentage-point margin over 99%. There have been 56 prior macro-attempts in this family and 506 prior micro-trials. The most recent accepted result is attempt-0158/micro-0002 at 1,633 parameters and 99.00%; the most recent failed result is attempt-0158/micro-0003 (QKV pair 722/588 discarded at 98.97%). This is a parameterization-preserving compression of the depth-shared QKV transform: union flattened coordinates 383 and 454, whose learned values are -0.0240071081 and -0.0239058137 (difference 1.013e-04), with a multiplicity-weighted mean and integer reconstruction map. Hypothesis: the much larger attention tensor contains near-duplicate scalars below the token failure scale, so this union preserves qualification and yields 1,622 parameters. It is more informative than the next QKV union (difference 1.046e-04) because it is the minimum-distortion test at this new site. Acceptance and rollback remain solely governed by the official runner.	0	0
attempt-0159	qkv-skip-seven-sensitive-pairs	micro-0012	09f18a685299c4dba91d77d63d5e344daf714d22	a62536e167983f0b21dc581d48961f5d4eb4161d	2026-08-17T09:15:44.992765+00:00	parameter tying	99.040000%	1621	keep	Union closest shared-QKV scalar groups 135 and 483	Family: parameter tying. Current retained frontier is 1,622 parameters at 99.040000%, a +0.040000 percentage-point margin over 99%. There have been 56 prior macro-attempts in this family and 507 prior micro-trials. The most recent accepted result is attempt-0158/micro-0002 at 1,633 parameters and 99.00%; the most recent failed result is attempt-0158/micro-0003 (QKV pair 722/588 discarded at 98.97%). This is a parameterization-preserving compression of the depth-shared QKV transform: union flattened coordinates 135 and 483, whose learned values are 0.0169548895 and 0.0170594640 (difference 1.046e-04), with a multiplicity-weighted mean and integer reconstruction map. Hypothesis: the much larger attention tensor contains near-duplicate scalars below the token failure scale, so this union preserves qualification and yields 1,621 parameters. It is more informative than the next QKV union (difference 1.048e-04) because it is the minimum-distortion test at this new site. Acceptance and rollback remain solely governed by the official runner.	0	0
attempt-0159	qkv-skip-seven-sensitive-pairs	micro-0013	aadb01c71c69d8d1cfeb0938fd93342968d7add5	09f18a685299c4dba91d77d63d5e344daf714d22	2026-08-17T09:16:59.903228+00:00	parameter tying	99.040000%	1620	keep	Union closest shared-QKV scalar groups 128 and 56	Family: parameter tying. Current retained frontier is 1,621 parameters at 99.040000%, a +0.040000 percentage-point margin over 99%. There have been 56 prior macro-attempts in this family and 508 prior micro-trials. The most recent accepted result is attempt-0158/micro-0002 at 1,633 parameters and 99.00%; the most recent failed result is attempt-0158/micro-0003 (QKV pair 722/588 discarded at 98.97%). This is a parameterization-preserving compression of the depth-shared QKV transform: union flattened coordinates 128 and 56, whose learned values are -0.1744399518 and -0.1743351072 (difference 1.048e-04), with a multiplicity-weighted mean and integer reconstruction map. Hypothesis: the much larger attention tensor contains near-duplicate scalars below the token failure scale, so this union preserves qualification and yields 1,620 parameters. It is more informative than the next QKV union (difference 1.053e-04) because it is the minimum-distortion test at this new site. Acceptance and rollback remain solely governed by the official runner.	0	0
attempt-0159	qkv-skip-seven-sensitive-pairs	micro-0014	e3182247be19b95c42d84b3aacdcb05ecfe6ebf3	aadb01c71c69d8d1cfeb0938fd93342968d7add5	2026-08-17T09:18:13.607170+00:00	parameter tying	99.020000%	1619	keep	Union closest shared-QKV scalar groups 596 and 677	Family: parameter tying. Current retained frontier is 1,620 parameters at 99.040000%, a +0.040000 percentage-point margin over 99%. There have been 56 prior macro-attempts in this family and 509 prior micro-trials. The most recent accepted result is attempt-0158/micro-0002 at 1,633 parameters and 99.00%; the most recent failed result is attempt-0158/micro-0003 (QKV pair 722/588 discarded at 98.97%). This is a parameterization-preserving compression of the depth-shared QKV transform: union flattened coordinates 596 and 677, whose learned values are 0.0020698574 and 0.0021751176 (difference 1.053e-04), with a multiplicity-weighted mean and integer reconstruction map. Hypothesis: the much larger attention tensor contains near-duplicate scalars below the token failure scale, so this union preserves qualification and yields 1,619 parameters. It is more informative than the next QKV union (difference 1.061e-04) because it is the minimum-distortion test at this new site. Acceptance and rollback remain solely governed by the official runner.	0	0
attempt-0159	qkv-skip-seven-sensitive-pairs	micro-0015	205945117e29b536d4696ae31607289c1e1452e2	e3182247be19b95c42d84b3aacdcb05ecfe6ebf3	2026-08-17T09:19:39.463839+00:00	parameter tying	99.020000%	1618	keep	Union closest shared-QKV scalar groups 449 and 316	Family: parameter tying. Current retained frontier is 1,619 parameters at 99.020000%, a +0.020000 percentage-point margin over 99%. There have been 56 prior macro-attempts in this family and 510 prior micro-trials. The most recent accepted result is attempt-0158/micro-0002 at 1,633 parameters and 99.00%; the most recent failed result is attempt-0158/micro-0003 (QKV pair 722/588 discarded at 98.97%). This is a parameterization-preserving compression of the depth-shared QKV transform: union flattened coordinates 449 and 316, whose learned values are -0.0540766418 and -0.0539705008 (difference 1.061e-04), with a multiplicity-weighted mean and integer reconstruction map. Hypothesis: the much larger attention tensor contains near-duplicate scalars below the token failure scale, so this union preserves qualification and yields 1,618 parameters. It is more informative than the next QKV union (difference 1.068e-04) because it is the minimum-distortion test at this new site. Acceptance and rollback remain solely governed by the official runner.	0	0
attempt-0159	qkv-skip-seven-sensitive-pairs	micro-0016	f31daa12280e567d436cf95821d1f46eebd80dfc	205945117e29b536d4696ae31607289c1e1452e2	2026-08-17T09:20:53.479954+00:00	parameter tying	99.020000%	1617	keep	Union closest shared-QKV scalar groups 592 and 720	Family: parameter tying. Current retained frontier is 1,618 parameters at 99.020000%, a +0.020000 percentage-point margin over 99%. There have been 56 prior macro-attempts in this family and 511 prior micro-trials. The most recent accepted result is attempt-0158/micro-0002 at 1,633 parameters and 99.00%; the most recent failed result is attempt-0158/micro-0003 (QKV pair 722/588 discarded at 98.97%). This is a parameterization-preserving compression of the depth-shared QKV transform: union flattened coordinates 592 and 720, whose learned values are 0.0324161127 and 0.0325229280 (difference 1.068e-04), with a multiplicity-weighted mean and integer reconstruction map. Hypothesis: the much larger attention tensor contains near-duplicate scalars below the token failure scale, so this union preserves qualification and yields 1,617 parameters. It is more informative than the next QKV union (difference 1.077e-04) because it is the minimum-distortion test at this new site. Acceptance and rollback remain solely governed by the official runner.	0	0
attempt-0159	qkv-skip-seven-sensitive-pairs	micro-0017	84f3d593dac02d1217a48bcd1ac53d70e804f269	f31daa12280e567d436cf95821d1f46eebd80dfc	2026-08-17T09:22:04.177941+00:00	parameter tying	98.990000%	1616	discard	Union closest shared-QKV scalar groups 564 and 572	Family: parameter tying. Current retained frontier is 1,617 parameters at 99.020000%, a +0.020000 percentage-point margin over 99%. There have been 56 prior macro-attempts in this family and 512 prior micro-trials. The most recent accepted result is attempt-0158/micro-0002 at 1,633 parameters and 99.00%; the most recent failed result is attempt-0158/micro-0003 (QKV pair 722/588 discarded at 98.97%). This is a parameterization-preserving compression of the depth-shared QKV transform: union flattened coordinates 564 and 572, whose learned values are -0.0023611477 and -0.0022534279 (difference 1.077e-04), with a multiplicity-weighted mean and integer reconstruction map. Hypothesis: the much larger attention tensor contains near-duplicate scalars below the token failure scale, so this union preserves qualification and yields 1,616 parameters. It is more informative than the next QKV union (difference 1.108e-04) because it is the minimum-distortion test at this new site. Acceptance and rollback remain solely governed by the official runner.	0	0
attempt-0160	qkv-skip-eight-sensitive-pairs	micro-0001	d6b0f62cc0f20aca23069f9085fb0af9e516befa	f31daa12280e567d436cf95821d1f46eebd80dfc	2026-08-17T09:23:54.001465+00:00	parameter tying	99.070000%	1616	keep	Union closest shared-QKV scalar groups 644 and 766	Family: parameter tying. Current retained frontier is 1,617 parameters at 99.020000%, a +0.020000 percentage-point margin over 99%. There have been 57 prior macro-attempts in this family and 513 prior micro-trials. The most recent accepted result is attempt-0159/micro-0016 at 1,617 parameters and 99.02%; the most recent failed result is attempt-0159/micro-0017 (QKV pair 564/572 discarded at 98.99%). This is a parameterization-preserving compression of the depth-shared QKV transform: union flattened coordinates 644 and 766, whose learned values are -0.0058080740 and -0.0056972466 (difference 1.108e-04), with a multiplicity-weighted mean and integer reconstruction map. Hypothesis: the much larger attention tensor contains near-duplicate scalars below the token failure scale, so this union preserves qualification and yields 1,616 parameters. It is more informative than the next QKV union (difference 1.118e-04) because it is the minimum-distortion test at this new site. Acceptance and rollback remain solely governed by the official runner.	0	0
attempt-0160	qkv-skip-eight-sensitive-pairs	micro-0002	58207b02c7c2d36934a990a5e744b055a66944a0	d6b0f62cc0f20aca23069f9085fb0af9e516befa	2026-08-17T09:25:04.962868+00:00	parameter tying	99.070000%	1615	keep	Union closest shared-QKV scalar groups 538 and 585	Family: parameter tying. Current retained frontier is 1,616 parameters at 99.070000%, a +0.070000 percentage-point margin over 99%. There have been 57 prior macro-attempts in this family and 514 prior micro-trials. The most recent accepted result is attempt-0159/micro-0016 at 1,617 parameters and 99.02%; the most recent failed result is attempt-0159/micro-0017 (QKV pair 564/572 discarded at 98.99%). This is a parameterization-preserving compression of the depth-shared QKV transform: union flattened coordinates 538 and 585, whose learned values are -0.0061413720 and -0.0060295924 (difference 1.118e-04), with a multiplicity-weighted mean and integer reconstruction map. Hypothesis: the much larger attention tensor contains near-duplicate scalars below the token failure scale, so this union preserves qualification and yields 1,615 parameters. It is more informative than the next QKV union (difference 1.150e-04) because it is the minimum-distortion test at this new site. Acceptance and rollback remain solely governed by the official runner.	0	0
attempt-0160	qkv-skip-eight-sensitive-pairs	micro-0003	62d005bc76b7272ecadef832e0dcb9a33daf5360	58207b02c7c2d36934a990a5e744b055a66944a0	2026-08-17T09:26:17.238979+00:00	parameter tying	99.060000%	1614	keep	Union closest shared-QKV scalar groups 584 and 53	Family: parameter tying. Current retained frontier is 1,615 parameters at 99.070000%, a +0.070000 percentage-point margin over 99%. There have been 57 prior macro-attempts in this family and 515 prior micro-trials. The most recent accepted result is attempt-0159/micro-0016 at 1,617 parameters and 99.02%; the most recent failed result is attempt-0159/micro-0017 (QKV pair 564/572 discarded at 98.99%). This is a parameterization-preserving compression of the depth-shared QKV transform: union flattened coordinates 584 and 53, whose learned values are -0.0348339193 and -0.0347168669 (difference 1.171e-04), with a multiplicity-weighted mean and integer reconstruction map. Hypothesis: the much larger attention tensor contains near-duplicate scalars below the token failure scale, so this union preserves qualification and yields 1,614 parameters. It is more informative than the next QKV union (difference 1.190e-04) because it is the minimum-distortion test at this new site. Acceptance and rollback remain solely governed by the official runner.	0	0
attempt-0160	qkv-skip-eight-sensitive-pairs	micro-0004	d86c146bb0c1b435004037335af05b07e17a397b	62d005bc76b7272ecadef832e0dcb9a33daf5360	2026-08-17T09:27:27.890574+00:00	parameter tying	99.030000%	1613	keep	Union closest shared-QKV scalar groups 680 and 709	Family: parameter tying. Current retained frontier is 1,614 parameters at 99.060000%, a +0.060000 percentage-point margin over 99%. There have been 57 prior macro-attempts in this family and 516 prior micro-trials. The most recent accepted result is attempt-0159/micro-0016 at 1,617 parameters and 99.02%; the most recent failed result is attempt-0159/micro-0017 (QKV pair 564/572 discarded at 98.99%). This is a parameterization-preserving compression of the depth-shared QKV transform: union flattened coordinates 680 and 709, whose learned values are 0.0033234528 and 0.0034424693 (difference 1.190e-04), with a multiplicity-weighted mean and integer reconstruction map. Hypothesis: the much larger attention tensor contains near-duplicate scalars below the token failure scale, so this union preserves qualification and yields 1,613 parameters. It is more informative than the next QKV union (difference 1.219e-04) because it is the minimum-distortion test at this new site. Acceptance and rollback remain solely governed by the official runner.	0	0
attempt-0160	qkv-skip-eight-sensitive-pairs	micro-0005	168332f0b52cc715e35375ec2d61c7f9bc83f045	d86c146bb0c1b435004037335af05b07e17a397b	2026-08-17T09:28:51.375368+00:00	parameter tying	99.020000%	1612	keep	Union closest shared-QKV scalar groups 578 and 434	Family: parameter tying. Current retained frontier is 1,613 parameters at 99.030000%, a +0.030000 percentage-point margin over 99%. There have been 57 prior macro-attempts in this family and 517 prior micro-trials. The most recent accepted result is attempt-0159/micro-0016 at 1,617 parameters and 99.02%; the most recent failed result is attempt-0159/micro-0017 (QKV pair 564/572 discarded at 98.99%). This is a parameterization-preserving compression of the depth-shared QKV transform: union flattened coordinates 578 and 434, whose learned values are -0.0120386416 and -0.0119167548 (difference 1.219e-04), with a multiplicity-weighted mean and integer reconstruction map. Hypothesis: the much larger attention tensor contains near-duplicate scalars below the token failure scale, so this union preserves qualification and yields 1,612 parameters. It is more informative than the next QKV union (difference 1.224e-04) because it is the minimum-distortion test at this new site. Acceptance and rollback remain solely governed by the official runner.	0	0
attempt-0160	qkv-skip-eight-sensitive-pairs	micro-0006	47a767d172d30011af0ac7fb643956fbe78ac0ae	168332f0b52cc715e35375ec2d61c7f9bc83f045	2026-08-17T09:30:06.257514+00:00	parameter tying	99.010000%	1611	keep	Union closest shared-QKV scalar groups 207 and 393	Family: parameter tying. Current retained frontier is 1,612 parameters at 99.020000%, a +0.020000 percentage-point margin over 99%. There have been 57 prior macro-attempts in this family and 518 prior micro-trials. The most recent accepted result is attempt-0159/micro-0016 at 1,617 parameters and 99.02%; the most recent failed result is attempt-0159/micro-0017 (QKV pair 564/572 discarded at 98.99%). This is a parameterization-preserving compression of the depth-shared QKV transform: union flattened coordinates 207 and 393, whose learned values are 0.0125709791 and 0.0126933297 (difference 1.224e-04), with a multiplicity-weighted mean and integer reconstruction map. Hypothesis: the much larger attention tensor contains near-duplicate scalars below the token failure scale, so this union preserves qualification and yields 1,611 parameters. It is more informative than the next QKV union (difference 1.225e-04) because it is the minimum-distortion test at this new site. Acceptance and rollback remain solely governed by the official runner.	0	0
attempt-0160	qkv-skip-eight-sensitive-pairs	micro-0007	5e40bf24142e707217873e9440b5cb7fe7fc7a78	47a767d172d30011af0ac7fb643956fbe78ac0ae	2026-08-17T09:31:21.315030+00:00	parameter tying	99.010000%	1610	keep	Union closest shared-QKV scalar groups 447 and 410	Family: parameter tying. Current retained frontier is 1,611 parameters at 99.010000%, a +0.010000 percentage-point margin over 99%. There have been 57 prior macro-attempts in this family and 519 prior micro-trials. The most recent accepted result is attempt-0159/micro-0016 at 1,617 parameters and 99.02%; the most recent failed result is attempt-0159/micro-0017 (QKV pair 564/572 discarded at 98.99%). This is a parameterization-preserving compression of the depth-shared QKV transform: union flattened coordinates 447 and 410, whose learned values are -0.0933939144 and -0.0932714492 (difference 1.225e-04), with a multiplicity-weighted mean and integer reconstruction map. Hypothesis: the much larger attention tensor contains near-duplicate scalars below the token failure scale, so this union preserves qualification and yields 1,610 parameters. It is more informative than the next QKV union (difference 1.251e-04) because it is the minimum-distortion test at this new site. Acceptance and rollback remain solely governed by the official runner.	0	0
attempt-0160	qkv-skip-eight-sensitive-pairs	micro-0008	7c1af90d1bf22147ff8e50ad67cf286467f6d5e6	5e40bf24142e707217873e9440b5cb7fe7fc7a78	2026-08-17T09:32:37.548963+00:00	parameter tying	99.010000%	1609	keep	Union closest shared-QKV scalar groups 1 and 732	Family: parameter tying. Current retained frontier is 1,610 parameters at 99.010000%, a +0.010000 percentage-point margin over 99%. There have been 57 prior macro-attempts in this family and 520 prior micro-trials. The most recent accepted result is attempt-0159/micro-0016 at 1,617 parameters and 99.02%; the most recent failed result is attempt-0159/micro-0017 (QKV pair 564/572 discarded at 98.99%). This is a parameterization-preserving compression of the depth-shared QKV transform: union flattened coordinates 1 and 732, whose learned values are 0.0187542811 and 0.0188793689 (difference 1.251e-04), with a multiplicity-weighted mean and integer reconstruction map. Hypothesis: the much larger attention tensor contains near-duplicate scalars below the token failure scale, so this union preserves qualification and yields 1,609 parameters. It is more informative than the next QKV union (difference 1.281e-04) because it is the minimum-distortion test at this new site. Acceptance and rollback remain solely governed by the official runner.	0	0
