macro_attempt_id	automation_id	micro_attempt_id	commit	parent_commit	timestamp_utc	family	accuracy	parameters	status	description	proposal	train_exit	verify_exit
attempt-0172	ff-output-skip-six-sensitive-pairs	micro-0001	cf209440fbaa3288122b46bfb532e6bfcfe772d0	2b3ee03870671d541c7c99f7f7ce0851420f6080	2026-08-17T11:22:56.602004+00:00	parameter tying	99.050000%	1539	keep	Union closest shared FF-output scalar groups 188 and 241	Family: parameter tying. Current retained frontier is 1,540 parameters at 99.020000%, a +0.020000 percentage-point margin over 99%. There have been 69 prior macro-attempts in this family and 601 prior micro-trials. The most recent accepted result is attempt-0171/micro-0012 at 1,540 parameters and 99.02%; the most recent failed result is attempt-0171/micro-0013 (FF-output pair 236/180 discarded at 98.98%). This is a parameterization-preserving compression of the depth-shared feed-forward output map: union flattened coordinates 188 and 241, values -0.0193210728 and -0.0187077783 (difference 6.133e-04), using a weighted mean and integer reconstruction. Hypothesis: residual-stream reconstruction contains near-duplicate scalars distinct from FF-input redundancy, preserving qualification at 1,539 parameters. It is more informative than the next FF-output union (difference 6.396e-04) because it is the minimum-distortion isolated test of the complementary FF map. Official acceptance and rollback are unchanged.	0	0
attempt-0172	ff-output-skip-six-sensitive-pairs	micro-0002	ab957405282ccbfc8980ed8534c0fa553cc09119	cf209440fbaa3288122b46bfb532e6bfcfe772d0	2026-08-17T11:24:10.560170+00:00	parameter tying	99.010000%	1538	keep	Union closest shared FF-output scalar groups 103 and 68	Family: parameter tying. Current retained frontier is 1,539 parameters at 99.050000%, a +0.050000 percentage-point margin over 99%. There have been 69 prior macro-attempts in this family and 602 prior micro-trials. The most recent accepted result is attempt-0171/micro-0012 at 1,540 parameters and 99.02%; the most recent failed result is attempt-0171/micro-0013 (FF-output pair 236/180 discarded at 98.98%). This is a parameterization-preserving compression of the depth-shared feed-forward output map: union flattened coordinates 103 and 68, values 0.0409245677 and 0.0415641554 (difference 6.396e-04), using a weighted mean and integer reconstruction. Hypothesis: residual-stream reconstruction contains near-duplicate scalars distinct from FF-input redundancy, preserving qualification at 1,538 parameters. It is more informative than the next FF-output union (difference 6.786e-04) because it is the minimum-distortion isolated test of the complementary FF map. Official acceptance and rollback are unchanged.	0	0
attempt-0172	ff-output-skip-six-sensitive-pairs	micro-0003	374a408b42e65dd183611b1554b1001e826c8fb7	ab957405282ccbfc8980ed8534c0fa553cc09119	2026-08-17T11:25:23.447545+00:00	parameter tying	99.110000%	1537	keep	Union closest shared FF-output scalar groups 79 and 74	Family: parameter tying. Current retained frontier is 1,538 parameters at 99.010000%, a +0.010000 percentage-point margin over 99%. There have been 69 prior macro-attempts in this family and 603 prior micro-trials. The most recent accepted result is attempt-0171/micro-0012 at 1,540 parameters and 99.02%; the most recent failed result is attempt-0171/micro-0013 (FF-output pair 236/180 discarded at 98.98%). This is a parameterization-preserving compression of the depth-shared feed-forward output map: union flattened coordinates 79 and 74, values -0.0107179824 and -0.0100394171 (difference 6.786e-04), using a weighted mean and integer reconstruction. Hypothesis: residual-stream reconstruction contains near-duplicate scalars distinct from FF-input redundancy, preserving qualification at 1,537 parameters. It is more informative than the next FF-output union (difference 6.991e-04) because it is the minimum-distortion isolated test of the complementary FF map. Official acceptance and rollback are unchanged.	0	0
attempt-0172	ff-output-skip-six-sensitive-pairs	micro-0004	ac4fe2c0908be559a95ca907fa306a304dc5d83f	374a408b42e65dd183611b1554b1001e826c8fb7	2026-08-17T11:26:36.273040+00:00	parameter tying	99.150000%	1536	keep	Union closest shared FF-output scalar groups 77 and 56	Family: parameter tying. Current retained frontier is 1,537 parameters at 99.110000%, a +0.110000 percentage-point margin over 99%. There have been 69 prior macro-attempts in this family and 604 prior micro-trials. The most recent accepted result is attempt-0171/micro-0012 at 1,540 parameters and 99.02%; the most recent failed result is attempt-0171/micro-0013 (FF-output pair 236/180 discarded at 98.98%). This is a parameterization-preserving compression of the depth-shared feed-forward output map: union flattened coordinates 77 and 56, values -0.0088734934 and -0.0081743719 (difference 6.991e-04), using a weighted mean and integer reconstruction. Hypothesis: residual-stream reconstruction contains near-duplicate scalars distinct from FF-input redundancy, preserving qualification at 1,536 parameters. It is more informative than the next FF-output union (difference 7.038e-04) because it is the minimum-distortion isolated test of the complementary FF map. Official acceptance and rollback are unchanged.	0	0
attempt-0172	ff-output-skip-six-sensitive-pairs	micro-0005	372fa322ba810f6ad1f2d56d045c9b206650ffe9	ac4fe2c0908be559a95ca907fa306a304dc5d83f	2026-08-17T11:28:00.626680+00:00	parameter tying	99.170000%	1535	keep	Union closest shared FF-output scalar groups 224 and 152	Family: parameter tying. Current retained frontier is 1,536 parameters at 99.150000%, a +0.150000 percentage-point margin over 99%. There have been 69 prior macro-attempts in this family and 605 prior micro-trials. The most recent accepted result is attempt-0171/micro-0012 at 1,540 parameters and 99.02%; the most recent failed result is attempt-0171/micro-0013 (FF-output pair 236/180 discarded at 98.98%). This is a parameterization-preserving compression of the depth-shared feed-forward output map: union flattened coordinates 224 and 152, values 0.0909895152 and 0.0916932821 (difference 7.038e-04), using a weighted mean and integer reconstruction. Hypothesis: residual-stream reconstruction contains near-duplicate scalars distinct from FF-input redundancy, preserving qualification at 1,535 parameters. It is more informative than the next FF-output union (difference 7.163e-04) because it is the minimum-distortion isolated test of the complementary FF map. Official acceptance and rollback are unchanged.	0	0
attempt-0172	ff-output-skip-six-sensitive-pairs	micro-0006	a609561cdc7bcba7c6dc797a4215dd28a2fac078	372fa322ba810f6ad1f2d56d045c9b206650ffe9	2026-08-17T11:29:26.688886+00:00	parameter tying	99.230000%	1534	keep	Union closest shared FF-output scalar groups 75 and 194	Family: parameter tying. Current retained frontier is 1,535 parameters at 99.170000%, a +0.170000 percentage-point margin over 99%. There have been 69 prior macro-attempts in this family and 606 prior micro-trials. The most recent accepted result is attempt-0171/micro-0012 at 1,540 parameters and 99.02%; the most recent failed result is attempt-0171/micro-0013 (FF-output pair 236/180 discarded at 98.98%). This is a parameterization-preserving compression of the depth-shared feed-forward output map: union flattened coordinates 75 and 194, values 0.0512500070 and 0.0519663431 (difference 7.163e-04), using a weighted mean and integer reconstruction. Hypothesis: residual-stream reconstruction contains near-duplicate scalars distinct from FF-input redundancy, preserving qualification at 1,534 parameters. It is more informative than the next FF-output union (difference 7.239e-04) because it is the minimum-distortion isolated test of the complementary FF map. Official acceptance and rollback are unchanged.	0	0
attempt-0172	ff-output-skip-six-sensitive-pairs	micro-0007	7ff4fa6d4d328ba15899e65c9e6995b619881c64	a609561cdc7bcba7c6dc797a4215dd28a2fac078	2026-08-17T11:30:41.919658+00:00	parameter tying	99.280000%	1533	keep	Union closest shared FF-output scalar groups 63 and 244	Family: parameter tying. Current retained frontier is 1,534 parameters at 99.230000%, a +0.230000 percentage-point margin over 99%. There have been 69 prior macro-attempts in this family and 607 prior micro-trials. The most recent accepted result is attempt-0171/micro-0012 at 1,540 parameters and 99.02%; the most recent failed result is attempt-0171/micro-0013 (FF-output pair 236/180 discarded at 98.98%). This is a parameterization-preserving compression of the depth-shared feed-forward output map: union flattened coordinates 63 and 244, values -0.0252842158 and -0.0245602764 (difference 7.239e-04), using a weighted mean and integer reconstruction. Hypothesis: residual-stream reconstruction contains near-duplicate scalars distinct from FF-input redundancy, preserving qualification at 1,533 parameters. It is more informative than the next FF-output union (difference 7.395e-04) because it is the minimum-distortion isolated test of the complementary FF map. Official acceptance and rollback are unchanged.	0	0
attempt-0172	ff-output-skip-six-sensitive-pairs	micro-0008	c55a176f3537bf43c8a912e0aee65d06de32e9b2	7ff4fa6d4d328ba15899e65c9e6995b619881c64	2026-08-17T11:31:49.227232+00:00	parameter tying	99.290000%	1532	keep	Union closest shared FF-output scalar groups 5 and 208	Family: parameter tying. Current retained frontier is 1,533 parameters at 99.280000%, a +0.280000 percentage-point margin over 99%. There have been 69 prior macro-attempts in this family and 608 prior micro-trials. The most recent accepted result is attempt-0171/micro-0012 at 1,540 parameters and 99.02%; the most recent failed result is attempt-0171/micro-0013 (FF-output pair 236/180 discarded at 98.98%). This is a parameterization-preserving compression of the depth-shared feed-forward output map: union flattened coordinates 5 and 208, values -0.0480723679 and -0.0473328978 (difference 7.395e-04), using a weighted mean and integer reconstruction. Hypothesis: residual-stream reconstruction contains near-duplicate scalars distinct from FF-input redundancy, preserving qualification at 1,532 parameters. It is more informative than the next FF-output union (difference 7.481e-04) because it is the minimum-distortion isolated test of the complementary FF map. Official acceptance and rollback are unchanged.	0	0
attempt-0172	ff-output-skip-six-sensitive-pairs	micro-0009	ee33543c838cfb67d35bb2f4e6b558252e980708	c55a176f3537bf43c8a912e0aee65d06de32e9b2	2026-08-17T11:32:59.613324+00:00	parameter tying	99.280000%	1531	keep	Union closest shared FF-output scalar groups 231 and 135	Family: parameter tying. Current retained frontier is 1,532 parameters at 99.290000%, a +0.290000 percentage-point margin over 99%. There have been 69 prior macro-attempts in this family and 609 prior micro-trials. The most recent accepted result is attempt-0171/micro-0012 at 1,540 parameters and 99.02%; the most recent failed result is attempt-0171/micro-0013 (FF-output pair 236/180 discarded at 98.98%). This is a parameterization-preserving compression of the depth-shared feed-forward output map: union flattened coordinates 231 and 135, values -0.0802602321 and -0.0795121267 (difference 7.481e-04), using a weighted mean and integer reconstruction. Hypothesis: residual-stream reconstruction contains near-duplicate scalars distinct from FF-input redundancy, preserving qualification at 1,531 parameters. It is more informative than the next FF-output union (difference 7.659e-04) because it is the minimum-distortion isolated test of the complementary FF map. Official acceptance and rollback are unchanged.	0	0
attempt-0172	ff-output-skip-six-sensitive-pairs	micro-0010	c81e59b250b3e3fd8e7bf227735afeff4ad5dda5	ee33543c838cfb67d35bb2f4e6b558252e980708	2026-08-17T11:34:13.560961+00:00	parameter tying	99.210000%	1530	keep	Union closest shared FF-output scalar groups 137 and 4	Family: parameter tying. Current retained frontier is 1,531 parameters at 99.280000%, a +0.280000 percentage-point margin over 99%. There have been 69 prior macro-attempts in this family and 610 prior micro-trials. The most recent accepted result is attempt-0171/micro-0012 at 1,540 parameters and 99.02%; the most recent failed result is attempt-0171/micro-0013 (FF-output pair 236/180 discarded at 98.98%). This is a parameterization-preserving compression of the depth-shared feed-forward output map: union flattened coordinates 137 and 4, values 0.0653534830 and 0.0661193430 (difference 7.659e-04), using a weighted mean and integer reconstruction. Hypothesis: residual-stream reconstruction contains near-duplicate scalars distinct from FF-input redundancy, preserving qualification at 1,530 parameters. It is more informative than the next FF-output union (difference 7.757e-04) because it is the minimum-distortion isolated test of the complementary FF map. Official acceptance and rollback are unchanged.	0	0
attempt-0172	ff-output-skip-six-sensitive-pairs	micro-0011	97e4192d24e6ec16f7c586b02282553af0821312	c81e59b250b3e3fd8e7bf227735afeff4ad5dda5	2026-08-17T11:35:27.503321+00:00	parameter tying	99.200000%	1529	keep	Union closest shared FF-output scalar groups 121 and 3	Family: parameter tying. Current retained frontier is 1,530 parameters at 99.210000%, a +0.210000 percentage-point margin over 99%. There have been 69 prior macro-attempts in this family and 611 prior micro-trials. The most recent accepted result is attempt-0171/micro-0012 at 1,540 parameters and 99.02%; the most recent failed result is attempt-0171/micro-0013 (FF-output pair 236/180 discarded at 98.98%). This is a parameterization-preserving compression of the depth-shared feed-forward output map: union flattened coordinates 121 and 3, values 0.1164349318 and 0.1172106192 (difference 7.757e-04), using a weighted mean and integer reconstruction. Hypothesis: residual-stream reconstruction contains near-duplicate scalars distinct from FF-input redundancy, preserving qualification at 1,529 parameters. It is more informative than the next FF-output union (difference 8.001e-04) because it is the minimum-distortion isolated test of the complementary FF map. Official acceptance and rollback are unchanged.	0	0
attempt-0172	ff-output-skip-six-sensitive-pairs	micro-0012	c8cfe30ecfb1f99c5ca973091b304822bcae8877	97e4192d24e6ec16f7c586b02282553af0821312	2026-08-17T11:36:42.892460+00:00	parameter tying	99.130000%	1528	keep	Union closest shared FF-output scalar groups 138 and 99	Family: parameter tying. Current retained frontier is 1,529 parameters at 99.200000%, a +0.200000 percentage-point margin over 99%. There have been 69 prior macro-attempts in this family and 612 prior micro-trials. The most recent accepted result is attempt-0171/micro-0012 at 1,540 parameters and 99.02%; the most recent failed result is attempt-0171/micro-0013 (FF-output pair 236/180 discarded at 98.98%). This is a parameterization-preserving compression of the depth-shared feed-forward output map: union flattened coordinates 138 and 99, values -0.1309382766 and -0.1301382184 (difference 8.001e-04), using a weighted mean and integer reconstruction. Hypothesis: residual-stream reconstruction contains near-duplicate scalars distinct from FF-input redundancy, preserving qualification at 1,528 parameters. It is more informative than the next FF-output union (difference 8.186e-04) because it is the minimum-distortion isolated test of the complementary FF map. Official acceptance and rollback are unchanged.	0	0
attempt-0172	ff-output-skip-six-sensitive-pairs	micro-0013	9657151440e17c0925e95aaa655d4ca89b53dd9d	c8cfe30ecfb1f99c5ca973091b304822bcae8877	2026-08-17T11:37:59.194111+00:00	parameter tying	99.100000%	1527	keep	Union closest shared FF-output scalar groups 114 and 236	Family: parameter tying. Current retained frontier is 1,528 parameters at 99.130000%, a +0.130000 percentage-point margin over 99%. There have been 69 prior macro-attempts in this family and 613 prior micro-trials. The most recent accepted result is attempt-0171/micro-0012 at 1,540 parameters and 99.02%; the most recent failed result is attempt-0171/micro-0013 (FF-output pair 236/180 discarded at 98.98%). This is a parameterization-preserving compression of the depth-shared feed-forward output map: union flattened coordinates 114 and 236, values -0.0292829648 and -0.0284643732 (difference 8.186e-04), using a weighted mean and integer reconstruction. Hypothesis: residual-stream reconstruction contains near-duplicate scalars distinct from FF-input redundancy, preserving qualification at 1,527 parameters. It is more informative than the next FF-output union (difference 8.346e-04) because it is the minimum-distortion isolated test of the complementary FF map. Official acceptance and rollback are unchanged.	0	0
attempt-0172	ff-output-skip-six-sensitive-pairs	micro-0014	207c11d5c45f229e16bdae5d540742a9b60a2647	9657151440e17c0925e95aaa655d4ca89b53dd9d	2026-08-17T11:39:13.999246+00:00	parameter tying	99.120000%	1526	keep	Union closest shared FF-output scalar groups 155 and 230	Family: parameter tying. Current retained frontier is 1,527 parameters at 99.100000%, a +0.100000 percentage-point margin over 99%. There have been 69 prior macro-attempts in this family and 614 prior micro-trials. The most recent accepted result is attempt-0171/micro-0012 at 1,540 parameters and 99.02%; the most recent failed result is attempt-0171/micro-0013 (FF-output pair 236/180 discarded at 98.98%). This is a parameterization-preserving compression of the depth-shared feed-forward output map: union flattened coordinates 155 and 230, values 0.1462986618 and 0.1471332610 (difference 8.346e-04), using a weighted mean and integer reconstruction. Hypothesis: residual-stream reconstruction contains near-duplicate scalars distinct from FF-input redundancy, preserving qualification at 1,526 parameters. It is more informative than the next FF-output union (difference 8.393e-04) because it is the minimum-distortion isolated test of the complementary FF map. Official acceptance and rollback are unchanged.	0	0
attempt-0172	ff-output-skip-six-sensitive-pairs	micro-0015	e8cdc138fde22ddb97c65ad429c2765c0a0f8041	207c11d5c45f229e16bdae5d540742a9b60a2647	2026-08-17T11:40:29.190876+00:00	parameter tying	99.110000%	1525	keep	Union closest shared FF-output scalar groups 93 and 182	Family: parameter tying. Current retained frontier is 1,526 parameters at 99.120000%, a +0.120000 percentage-point margin over 99%. There have been 69 prior macro-attempts in this family and 615 prior micro-trials. The most recent accepted result is attempt-0171/micro-0012 at 1,540 parameters and 99.02%; the most recent failed result is attempt-0171/micro-0013 (FF-output pair 236/180 discarded at 98.98%). This is a parameterization-preserving compression of the depth-shared feed-forward output map: union flattened coordinates 93 and 182, values -0.0124363499 and -0.0115970839 (difference 8.393e-04), using a weighted mean and integer reconstruction. Hypothesis: residual-stream reconstruction contains near-duplicate scalars distinct from FF-input redundancy, preserving qualification at 1,525 parameters. It is more informative than the next FF-output union (difference 8.533e-04) because it is the minimum-distortion isolated test of the complementary FF map. Official acceptance and rollback are unchanged.	0	0
attempt-0172	ff-output-skip-six-sensitive-pairs	micro-0016	9652eb32e7a47dfa34e02ae2c27c502f96707d27	e8cdc138fde22ddb97c65ad429c2765c0a0f8041	2026-08-17T11:41:55.163985+00:00	parameter tying	99.080000%	1524	keep	Union closest shared FF-output scalar groups 96 and 118	Family: parameter tying. Current retained frontier is 1,525 parameters at 99.110000%, a +0.110000 percentage-point margin over 99%. There have been 69 prior macro-attempts in this family and 616 prior micro-trials. The most recent accepted result is attempt-0171/micro-0012 at 1,540 parameters and 99.02%; the most recent failed result is attempt-0171/micro-0013 (FF-output pair 236/180 discarded at 98.98%). This is a parameterization-preserving compression of the depth-shared feed-forward output map: union flattened coordinates 96 and 118, values 0.0327292308 and 0.0335825570 (difference 8.533e-04), using a weighted mean and integer reconstruction. Hypothesis: residual-stream reconstruction contains near-duplicate scalars distinct from FF-input redundancy, preserving qualification at 1,524 parameters. It is more informative than the next FF-output union (difference 8.544e-04) because it is the minimum-distortion isolated test of the complementary FF map. Official acceptance and rollback are unchanged.	0	0
