macro_attempt_id	automation_id	micro_attempt_id	commit	parent_commit	timestamp_utc	family	accuracy	parameters	status	description	proposal	train_exit	verify_exit
attempt-0075	nearest-position-unions	micro-0001	a7cbf2060695f27216a7f39826d22a256d77b6ed	346d89912f272074b2f8878b19d2df19def9735e	2026-08-16T08:51:57.566366+00:00	parameter tying			error	Union closest position groups 364 and 501	Family: parameter tying. Current retained frontier is 2,105 parameters at 99.050000%, a +0.050000 percentage-point margin over 99%. There have been 17 prior attempts in this family. The most recent accepted result is attempt-0074 at 2,105 parameters and 99.05%; the most recent failed result is attempt-0034 (shared normalization biases). This is a parameterization-preserving compression: union current position groups represented by coordinates 364 and 501, whose learned values are -0.0023571008 and -0.0023529029 (absolute difference 4.198e-06), using a multiplicity-weighted mean. Hypothesis: this preserves qualification and yields 2,104 parameters. It is more informative than the nearest untested alternative (difference 4.503e-06) because it is the minimum-distortion eligible union; exact pairs already rejected under the unchanged grouping are excluded. Acceptance and rollback remain solely governed by the official runner.	1	
attempt-0076	nearest-position-unions-repair	micro-0001	4b32ee79932cbca1cdd23d4431b0a4b370f31312	346d89912f272074b2f8878b19d2df19def9735e	2026-08-16T08:54:25.954388+00:00	parameter tying	99.050000%	2104	keep	Union closest position groups 364 and 501	Family: parameter tying. Current retained frontier is 2,105 parameters at 99.050000%, a +0.050000 percentage-point margin over 99%. There have been 18 prior attempts in this family. The most recent accepted result is attempt-0074 at 2,105 parameters and 99.05%; the most recent failed result is attempt-0075/micro-0001 (error, no score). This is a parameterization-preserving compression: union current position groups represented by coordinates 364 and 501, whose learned values are -0.0023571008 and -0.0023529029 (absolute difference 4.198e-06), using a multiplicity-weighted mean. Hypothesis: this preserves qualification and yields 2,104 parameters. It is more informative than the nearest untested alternative (difference 4.503e-06) because it is the minimum-distortion eligible union; exact pairs already rejected under the unchanged grouping are excluded. Acceptance and rollback remain solely governed by the official runner.	0	0
attempt-0076	nearest-position-unions-repair	micro-0002	cfdc0b55b0cca3f34d6d40ba7cb640177129d841	4b32ee79932cbca1cdd23d4431b0a4b370f31312	2026-08-16T08:55:27.797797+00:00	parameter tying	99.050000%	2103	keep	Union closest position groups 177 and 462	Family: parameter tying. Current retained frontier is 2,104 parameters at 99.050000%, a +0.050000 percentage-point margin over 99%. There have been 19 prior attempts in this family. The most recent accepted result is attempt-0076/micro-0001 at 2104 parameters and 99.050000%; the most recent failed result is attempt-0075/micro-0001 (error, no score). This is a parameterization-preserving compression: union current position groups represented by coordinates 177 and 462, whose learned values are 0.0004998767 and 0.0005043799 (absolute difference 4.503e-06), using a multiplicity-weighted mean. Hypothesis: this preserves qualification and yields 2,103 parameters. It is more informative than the nearest untested alternative (difference 4.790e-06) because it is the minimum-distortion eligible union; exact pairs already rejected under the unchanged grouping are excluded. Acceptance and rollback remain solely governed by the official runner.	0	0
attempt-0076	nearest-position-unions-repair	micro-0003	da68d84de106da89bed82a4a9eb18ca1b8fcc600	cfdc0b55b0cca3f34d6d40ba7cb640177129d841	2026-08-16T08:56:29.935831+00:00	parameter tying	99.050000%	2102	keep	Union closest position groups 211 and 348	Family: parameter tying. Current retained frontier is 2,103 parameters at 99.050000%, a +0.050000 percentage-point margin over 99%. There have been 20 prior attempts in this family. The most recent accepted result is attempt-0076/micro-0002 at 2103 parameters and 99.050000%; the most recent failed result is attempt-0075/micro-0001 (error, no score). This is a parameterization-preserving compression: union current position groups represented by coordinates 211 and 348, whose learned values are 0.0005243364 and 0.0005300569 (absolute difference 5.721e-06), using a multiplicity-weighted mean. Hypothesis: this preserves qualification and yields 2,102 parameters. It is more informative than the nearest untested alternative (difference 6.702e-06) because it is the minimum-distortion eligible union; exact pairs already rejected under the unchanged grouping are excluded. Acceptance and rollback remain solely governed by the official runner.	0	0
attempt-0076	nearest-position-unions-repair	micro-0004	c13d2fd61f1cd9c44ea36a730e02cb0e91473b2c	da68d84de106da89bed82a4a9eb18ca1b8fcc600	2026-08-16T08:57:31.845350+00:00	parameter tying	99.040000%	2101	keep	Union closest position groups 260 and 244	Family: parameter tying. Current retained frontier is 2,102 parameters at 99.050000%, a +0.050000 percentage-point margin over 99%. There have been 21 prior attempts in this family. The most recent accepted result is attempt-0076/micro-0003 at 2102 parameters and 99.050000%; the most recent failed result is attempt-0075/micro-0001 (error, no score). This is a parameterization-preserving compression: union current position groups represented by coordinates 260 and 244, whose learned values are 0.0018342569 and 0.0018409587 (absolute difference 6.702e-06), using a multiplicity-weighted mean. Hypothesis: this preserves qualification and yields 2,101 parameters. It is more informative than the nearest untested alternative (difference 6.728e-06) because it is the minimum-distortion eligible union; exact pairs already rejected under the unchanged grouping are excluded. Acceptance and rollback remain solely governed by the official runner.	0	0
attempt-0076	nearest-position-unions-repair	micro-0005	ef598b05ef2b846b5b110906d67d932d3c79fe43	c13d2fd61f1cd9c44ea36a730e02cb0e91473b2c	2026-08-16T08:58:34.032346+00:00	parameter tying	99.040000%	2100	keep	Union closest position groups 188 and 21	Family: parameter tying. Current retained frontier is 2,101 parameters at 99.040000%, a +0.040000 percentage-point margin over 99%. There have been 22 prior attempts in this family. The most recent accepted result is attempt-0076/micro-0004 at 2101 parameters and 99.040000%; the most recent failed result is attempt-0075/micro-0001 (error, no score). This is a parameterization-preserving compression: union current position groups represented by coordinates 188 and 21, whose learned values are -0.0111811543 and -0.0111744264 (absolute difference 6.728e-06), using a multiplicity-weighted mean. Hypothesis: this preserves qualification and yields 2,100 parameters. It is more informative than the nearest untested alternative (difference 7.017e-06) because it is the minimum-distortion eligible union; exact pairs already rejected under the unchanged grouping are excluded. Acceptance and rollback remain solely governed by the official runner.	0	0
attempt-0076	nearest-position-unions-repair	micro-0006	4aad56f79ff193978abef5f53526fc5e1e280417	ef598b05ef2b846b5b110906d67d932d3c79fe43	2026-08-16T08:59:34.999168+00:00	parameter tying	99.040000%	2099	keep	Union closest position groups 238 and 274	Family: parameter tying. Current retained frontier is 2,100 parameters at 99.040000%, a +0.040000 percentage-point margin over 99%. There have been 23 prior attempts in this family. The most recent accepted result is attempt-0076/micro-0005 at 2100 parameters and 99.040000%; the most recent failed result is attempt-0075/micro-0001 (error, no score). This is a parameterization-preserving compression: union current position groups represented by coordinates 238 and 274, whose learned values are -0.0127586974 and -0.0127516808 (absolute difference 7.017e-06), using a multiplicity-weighted mean. Hypothesis: this preserves qualification and yields 2,099 parameters. It is more informative than the nearest untested alternative (difference 7.042e-06) because it is the minimum-distortion eligible union; exact pairs already rejected under the unchanged grouping are excluded. Acceptance and rollback remain solely governed by the official runner.	0	0
attempt-0076	nearest-position-unions-repair	micro-0007	dfd05ee5006748cc5e45b51c0469ff5f428e05b0	4aad56f79ff193978abef5f53526fc5e1e280417	2026-08-16T09:00:36.079793+00:00	parameter tying	99.040000%	2098	keep	Union closest position groups 194 and 177	Family: parameter tying. Current retained frontier is 2,099 parameters at 99.040000%, a +0.040000 percentage-point margin over 99%. There have been 24 prior attempts in this family. The most recent accepted result is attempt-0076/micro-0006 at 2099 parameters and 99.040000%; the most recent failed result is attempt-0075/micro-0001 (error, no score). This is a parameterization-preserving compression: union current position groups represented by coordinates 194 and 177, whose learned values are 0.0004950865 and 0.0005021283 (absolute difference 7.042e-06), using a multiplicity-weighted mean. Hypothesis: this preserves qualification and yields 2,098 parameters. It is more informative than the nearest untested alternative (difference 8.389e-06) because it is the minimum-distortion eligible union; exact pairs already rejected under the unchanged grouping are excluded. Acceptance and rollback remain solely governed by the official runner.	0	0
attempt-0076	nearest-position-unions-repair	micro-0008	10ff092714cd04d288695f3ca30c4b49891060fa	dfd05ee5006748cc5e45b51c0469ff5f428e05b0	2026-08-16T09:01:38.002375+00:00	parameter tying	99.040000%	2097	keep	Union closest position groups 334 and 403	Family: parameter tying. Current retained frontier is 2,098 parameters at 99.040000%, a +0.040000 percentage-point margin over 99%. There have been 25 prior attempts in this family. The most recent accepted result is attempt-0076/micro-0007 at 2098 parameters and 99.040000%; the most recent failed result is attempt-0075/micro-0001 (error, no score). This is a parameterization-preserving compression: union current position groups represented by coordinates 334 and 403, whose learned values are 0.0252252594 and 0.0252336487 (absolute difference 8.389e-06), using a multiplicity-weighted mean. Hypothesis: this preserves qualification and yields 2,097 parameters. It is more informative than the nearest untested alternative (difference 8.624e-06) because it is the minimum-distortion eligible union; exact pairs already rejected under the unchanged grouping are excluded. Acceptance and rollback remain solely governed by the official runner.	0	0
attempt-0076	nearest-position-unions-repair	micro-0009	07222a573b8fae35ab2dacb7e55a75d6a159c4d3	10ff092714cd04d288695f3ca30c4b49891060fa	2026-08-16T09:02:39.745489+00:00	parameter tying	99.040000%	2096	keep	Union closest position groups 175 and 208	Family: parameter tying. Current retained frontier is 2,097 parameters at 99.040000%, a +0.040000 percentage-point margin over 99%. There have been 26 prior attempts in this family. The most recent accepted result is attempt-0076/micro-0008 at 2097 parameters and 99.040000%; the most recent failed result is attempt-0075/micro-0001 (error, no score). This is a parameterization-preserving compression: union current position groups represented by coordinates 175 and 208, whose learned values are -0.0037990911 and -0.0037904670 (absolute difference 8.624e-06), using a multiplicity-weighted mean. Hypothesis: this preserves qualification and yields 2,096 parameters. It is more informative than the nearest untested alternative (difference 8.790e-06) because it is the minimum-distortion eligible union; exact pairs already rejected under the unchanged grouping are excluded. Acceptance and rollback remain solely governed by the official runner.	0	0
attempt-0076	nearest-position-unions-repair	micro-0010	32ef4be35e25aa85757ce70f7c07db1c99137c51	07222a573b8fae35ab2dacb7e55a75d6a159c4d3	2026-08-16T09:03:41.913450+00:00	parameter tying	99.040000%	2095	keep	Union closest position groups 442 and 179	Family: parameter tying. Current retained frontier is 2,096 parameters at 99.040000%, a +0.040000 percentage-point margin over 99%. There have been 27 prior attempts in this family. The most recent accepted result is attempt-0076/micro-0009 at 2096 parameters and 99.040000%; the most recent failed result is attempt-0075/micro-0001 (error, no score). This is a parameterization-preserving compression: union current position groups represented by coordinates 442 and 179, whose learned values are -0.0129203992 and -0.0129116094 (absolute difference 8.790e-06), using a multiplicity-weighted mean. Hypothesis: this preserves qualification and yields 2,095 parameters. It is more informative than the nearest untested alternative (difference 9.119e-06) because it is the minimum-distortion eligible union; exact pairs already rejected under the unchanged grouping are excluded. Acceptance and rollback remain solely governed by the official runner.	0	0
attempt-0076	nearest-position-unions-repair	micro-0011	380ab3c26a6ab09e841c58772e587d48219f3be2	32ef4be35e25aa85757ce70f7c07db1c99137c51	2026-08-16T09:04:43.666957+00:00	parameter tying	99.040000%	2094	keep	Union closest position groups 41 and 106	Family: parameter tying. Current retained frontier is 2,095 parameters at 99.040000%, a +0.040000 percentage-point margin over 99%. There have been 28 prior attempts in this family. The most recent accepted result is attempt-0076/micro-0010 at 2095 parameters and 99.040000%; the most recent failed result is attempt-0075/micro-0001 (error, no score). This is a parameterization-preserving compression: union current position groups represented by coordinates 41 and 106, whose learned values are 0.0005422053 and 0.0005513247 (absolute difference 9.119e-06), using a multiplicity-weighted mean. Hypothesis: this preserves qualification and yields 2,094 parameters. It is more informative than the nearest untested alternative (difference 9.392e-06) because it is the minimum-distortion eligible union; exact pairs already rejected under the unchanged grouping are excluded. Acceptance and rollback remain solely governed by the official runner.	0	0
attempt-0076	nearest-position-unions-repair	micro-0012	a12a87f8a63132d2614a37cb4c98d671499a1107	380ab3c26a6ab09e841c58772e587d48219f3be2	2026-08-16T09:05:45.292621+00:00	parameter tying	99.040000%	2093	keep	Union closest position groups 95 and 424	Family: parameter tying. Current retained frontier is 2,094 parameters at 99.040000%, a +0.040000 percentage-point margin over 99%. There have been 29 prior attempts in this family. The most recent accepted result is attempt-0076/micro-0011 at 2094 parameters and 99.040000%; the most recent failed result is attempt-0075/micro-0001 (error, no score). This is a parameterization-preserving compression: union current position groups represented by coordinates 95 and 424, whose learned values are 0.0040847282 and 0.0040941206 (absolute difference 9.392e-06), using a multiplicity-weighted mean. Hypothesis: this preserves qualification and yields 2,093 parameters. It is more informative than the nearest untested alternative (difference 1.004e-05) because it is the minimum-distortion eligible union; exact pairs already rejected under the unchanged grouping are excluded. Acceptance and rollback remain solely governed by the official runner.	0	0
attempt-0076	nearest-position-unions-repair	micro-0013	6a62bc1b8fca089adeb85b851733a02ae6d72128	a12a87f8a63132d2614a37cb4c98d671499a1107	2026-08-16T09:06:46.167818+00:00	parameter tying	99.050000%	2092	keep	Union closest position groups 275 and 10	Family: parameter tying. Current retained frontier is 2,093 parameters at 99.040000%, a +0.040000 percentage-point margin over 99%. There have been 30 prior attempts in this family. The most recent accepted result is attempt-0076/micro-0012 at 2093 parameters and 99.040000%; the most recent failed result is attempt-0075/micro-0001 (error, no score). This is a parameterization-preserving compression: union current position groups represented by coordinates 275 and 10, whose learned values are 0.0054133600 and 0.0054233973 (absolute difference 1.004e-05), using a multiplicity-weighted mean. Hypothesis: this preserves qualification and yields 2,092 parameters. It is more informative than the nearest untested alternative (difference 1.071e-05) because it is the minimum-distortion eligible union; exact pairs already rejected under the unchanged grouping are excluded. Acceptance and rollback remain solely governed by the official runner.	0	0
attempt-0076	nearest-position-unions-repair	micro-0014	3f9dea055611f0a1682cda005b1e20a15b88242a	6a62bc1b8fca089adeb85b851733a02ae6d72128	2026-08-16T09:07:47.222674+00:00	parameter tying	99.050000%	2091	keep	Union closest position groups 471 and 445	Family: parameter tying. Current retained frontier is 2,092 parameters at 99.050000%, a +0.050000 percentage-point margin over 99%. There have been 31 prior attempts in this family. The most recent accepted result is attempt-0076/micro-0013 at 2092 parameters and 99.050000%; the most recent failed result is attempt-0075/micro-0001 (error, no score). This is a parameterization-preserving compression: union current position groups represented by coordinates 471 and 445, whose learned values are 0.0314305238 and 0.0314412378 (absolute difference 1.071e-05), using a multiplicity-weighted mean. Hypothesis: this preserves qualification and yields 2,091 parameters. It is more informative than the nearest untested alternative (difference 1.078e-05) because it is the minimum-distortion eligible union; exact pairs already rejected under the unchanged grouping are excluded. Acceptance and rollback remain solely governed by the official runner.	0	0
attempt-0076	nearest-position-unions-repair	micro-0015	f123660c07b69a63c07a1acff412b0ed9ecf98e0	3f9dea055611f0a1682cda005b1e20a15b88242a	2026-08-16T09:08:48.515954+00:00	parameter tying	99.050000%	2090	keep	Union closest position groups 24 and 113	Family: parameter tying. Current retained frontier is 2,091 parameters at 99.050000%, a +0.050000 percentage-point margin over 99%. There have been 32 prior attempts in this family. The most recent accepted result is attempt-0076/micro-0014 at 2091 parameters and 99.050000%; the most recent failed result is attempt-0075/micro-0001 (error, no score). This is a parameterization-preserving compression: union current position groups represented by coordinates 24 and 113, whose learned values are -0.0248801205 and -0.0248693433 (absolute difference 1.078e-05), using a multiplicity-weighted mean. Hypothesis: this preserves qualification and yields 2,090 parameters. It is more informative than the nearest untested alternative (difference 1.117e-05) because it is the minimum-distortion eligible union; exact pairs already rejected under the unchanged grouping are excluded. Acceptance and rollback remain solely governed by the official runner.	0	0
attempt-0076	nearest-position-unions-repair	micro-0016	7222731de4f5bddeaa5ddc776d85b8da0bc0e92c	f123660c07b69a63c07a1acff412b0ed9ecf98e0	2026-08-16T09:09:49.869312+00:00	parameter tying	99.040000%	2089	keep	Union closest position groups 294 and 314	Family: parameter tying. Current retained frontier is 2,090 parameters at 99.050000%, a +0.050000 percentage-point margin over 99%. There have been 33 prior attempts in this family. The most recent accepted result is attempt-0076/micro-0015 at 2090 parameters and 99.050000%; the most recent failed result is attempt-0075/micro-0001 (error, no score). This is a parameterization-preserving compression: union current position groups represented by coordinates 294 and 314, whose learned values are 0.0053202268 and 0.0053313975 (absolute difference 1.117e-05), using a multiplicity-weighted mean. Hypothesis: this preserves qualification and yields 2,089 parameters. It is more informative than the nearest untested alternative (difference 1.159e-05) because it is the minimum-distortion eligible union; exact pairs already rejected under the unchanged grouping are excluded. Acceptance and rollback remain solely governed by the official runner.	0	0
attempt-0076	nearest-position-unions-repair	micro-0017	8f174b4d6c9e724687573461c30ad77e875301c6	7222731de4f5bddeaa5ddc776d85b8da0bc0e92c	2026-08-16T09:10:51.092175+00:00	parameter tying	99.040000%	2088	keep	Union closest position groups 397 and 506	Family: parameter tying. Current retained frontier is 2,089 parameters at 99.040000%, a +0.040000 percentage-point margin over 99%. There have been 34 prior attempts in this family. The most recent accepted result is attempt-0076/micro-0016 at 2089 parameters and 99.040000%; the most recent failed result is attempt-0075/micro-0001 (error, no score). This is a parameterization-preserving compression: union current position groups represented by coordinates 397 and 506, whose learned values are 0.0130978301 and 0.0131094176 (absolute difference 1.159e-05), using a multiplicity-weighted mean. Hypothesis: this preserves qualification and yields 2,088 parameters. It is more informative than the nearest untested alternative (difference 1.222e-05) because it is the minimum-distortion eligible union; exact pairs already rejected under the unchanged grouping are excluded. Acceptance and rollback remain solely governed by the official runner.	0	0
