macro_attempt_id	automation_id	micro_attempt_id	commit	parent_commit	timestamp_utc	family	accuracy	parameters	status	description	proposal	train_exit	verify_exit
attempt-0176	repair-ff-input-boundary-selector	micro-0009	cf7b36e4145a0160bb0884e4ee53be89f8c4d0d2	c4fb0cfc4bd7d89647151b7139aeb0fd37e7c860	2026-08-17T12:06:20.092860+00:00	parameter tying	99.000000%	1509	keep	Union closest shared FF-input scalar groups 68 and 234	Family: parameter tying. Current retained frontier is 1,510 parameters at 99.000000%, a +0.000000 percentage-point margin over 99%. There have been 73 prior macro-attempts in this family and 634 prior micro-trials. The most recent accepted result is attempt-0176/micro-0008 at 1510 parameters and 99.000000%; the most recent failed result is attempt-0175/micro-0001 (error, no score). This is a parameterization-preserving compression of the depth-shared feed-forward input map: union flattened coordinates 68 and 234, values 0.0544617623 and 0.0547730140 (difference 3.113e-04), using a weighted mean and integer reconstruction. Hypothesis: nonlinear feature construction contains near-duplicate scalars independent of QKV redundancy, preserving qualification at 1,509 parameters. It is more informative than the next FF-input union (difference 3.148e-04) because it is the minimum-distortion isolated test at this new mechanism site. Official acceptance and rollback are unchanged.	0	0
attempt-0176	repair-ff-input-boundary-selector	micro-0010	9c48bbfec150aeac7a31c24b8cf2d84fb53473db	cf7b36e4145a0160bb0884e4ee53be89f8c4d0d2	2026-08-17T12:07:33.193009+00:00	parameter tying	99.000000%	1508	keep	Union closest shared FF-input scalar groups 208 and 240	Family: parameter tying. Current retained frontier is 1,509 parameters at 99.000000%, a +0.000000 percentage-point margin over 99%. There have been 73 prior macro-attempts in this family and 635 prior micro-trials. The most recent accepted result is attempt-0176/micro-0009 at 1509 parameters and 99.000000%; the most recent failed result is attempt-0175/micro-0001 (error, no score). This is a parameterization-preserving compression of the depth-shared feed-forward input map: union flattened coordinates 208 and 240, values -0.0371679552 and -0.0368531384 (difference 3.148e-04), using a weighted mean and integer reconstruction. Hypothesis: nonlinear feature construction contains near-duplicate scalars independent of QKV redundancy, preserving qualification at 1,508 parameters. It is more informative than the next FF-input union (difference 3.325e-04) because it is the minimum-distortion isolated test at this new mechanism site. Official acceptance and rollback are unchanged.	0	0
attempt-0176	repair-ff-input-boundary-selector	micro-0011	a7a341f6d08017c538595756203645ebc5ea4251	9c48bbfec150aeac7a31c24b8cf2d84fb53473db	2026-08-17T12:08:48.108550+00:00	parameter tying	99.000000%	1507	keep	Union closest shared FF-input scalar groups 32 and 229	Family: parameter tying. Current retained frontier is 1,508 parameters at 99.000000%, a +0.000000 percentage-point margin over 99%. There have been 73 prior macro-attempts in this family and 636 prior micro-trials. The most recent accepted result is attempt-0176/micro-0010 at 1508 parameters and 99.000000%; the most recent failed result is attempt-0175/micro-0001 (error, no score). This is a parameterization-preserving compression of the depth-shared feed-forward input map: union flattened coordinates 32 and 229, values -0.3092828393 and -0.3089503348 (difference 3.325e-04), using a weighted mean and integer reconstruction. Hypothesis: nonlinear feature construction contains near-duplicate scalars independent of QKV redundancy, preserving qualification at 1,507 parameters. It is more informative than the next FF-input union (difference 3.461e-04) because it is the minimum-distortion isolated test at this new mechanism site. Official acceptance and rollback are unchanged.	0	0
attempt-0176	repair-ff-input-boundary-selector	micro-0012	45fdfc2738b8365925d0a6dc8863c02d58ec13aa	a7a341f6d08017c538595756203645ebc5ea4251	2026-08-17T12:10:03.093928+00:00	parameter tying	99.000000%	1506	keep	Union closest shared FF-input scalar groups 137 and 228	Family: parameter tying. Current retained frontier is 1,507 parameters at 99.000000%, a +0.000000 percentage-point margin over 99%. There have been 73 prior macro-attempts in this family and 637 prior micro-trials. The most recent accepted result is attempt-0176/micro-0011 at 1507 parameters and 99.000000%; the most recent failed result is attempt-0175/micro-0001 (error, no score). This is a parameterization-preserving compression of the depth-shared feed-forward input map: union flattened coordinates 137 and 228, values -0.0707229748 and -0.0703768432 (difference 3.461e-04), using a weighted mean and integer reconstruction. Hypothesis: nonlinear feature construction contains near-duplicate scalars independent of QKV redundancy, preserving qualification at 1,506 parameters. It is more informative than the next FF-input union (difference 3.605e-04) because it is the minimum-distortion isolated test at this new mechanism site. Official acceptance and rollback are unchanged.	0	0
attempt-0176	repair-ff-input-boundary-selector	micro-0013	69bbcae3bc487b7d53f33c6387032c69e1237d59	45fdfc2738b8365925d0a6dc8863c02d58ec13aa	2026-08-17T12:11:17.301687+00:00	parameter tying	99.000000%	1505	keep	Union closest shared FF-input scalar groups 148 and 169	Family: parameter tying. Current retained frontier is 1,506 parameters at 99.000000%, a +0.000000 percentage-point margin over 99%. There have been 73 prior macro-attempts in this family and 638 prior micro-trials. The most recent accepted result is attempt-0176/micro-0012 at 1506 parameters and 99.000000%; the most recent failed result is attempt-0175/micro-0001 (error, no score). This is a parameterization-preserving compression of the depth-shared feed-forward input map: union flattened coordinates 148 and 169, values 0.0625175908 and 0.0628781170 (difference 3.605e-04), using a weighted mean and integer reconstruction. Hypothesis: nonlinear feature construction contains near-duplicate scalars independent of QKV redundancy, preserving qualification at 1,505 parameters. It is more informative than the next FF-input union (difference 3.644e-04) because it is the minimum-distortion isolated test at this new mechanism site. Official acceptance and rollback are unchanged.	0	0
attempt-0176	repair-ff-input-boundary-selector	micro-0014	bb5a6549cf81529966cd67ac250a7138ded96297	69bbcae3bc487b7d53f33c6387032c69e1237d59	2026-08-17T12:12:27.721872+00:00	parameter tying	99.000000%	1504	keep	Union closest shared FF-input scalar groups 19 and 36	Family: parameter tying. Current retained frontier is 1,505 parameters at 99.000000%, a +0.000000 percentage-point margin over 99%. There have been 73 prior macro-attempts in this family and 639 prior micro-trials. The most recent accepted result is attempt-0176/micro-0013 at 1505 parameters and 99.000000%; the most recent failed result is attempt-0175/micro-0001 (error, no score). This is a parameterization-preserving compression of the depth-shared feed-forward input map: union flattened coordinates 19 and 36, values 0.0430105589 and 0.0433749743 (difference 3.644e-04), using a weighted mean and integer reconstruction. Hypothesis: nonlinear feature construction contains near-duplicate scalars independent of QKV redundancy, preserving qualification at 1,504 parameters. It is more informative than the next FF-input union (difference 3.679e-04) because it is the minimum-distortion isolated test at this new mechanism site. Official acceptance and rollback are unchanged.	0	0
attempt-0176	repair-ff-input-boundary-selector	micro-0015	cf38be8fdf2e542ff2a611310e047d5a0440d198	bb5a6549cf81529966cd67ac250a7138ded96297	2026-08-17T12:13:40.372901+00:00	parameter tying	99.000000%	1503	keep	Union closest shared FF-input scalar groups 87 and 22	Family: parameter tying. Current retained frontier is 1,504 parameters at 99.000000%, a +0.000000 percentage-point margin over 99%. There have been 73 prior macro-attempts in this family and 640 prior micro-trials. The most recent accepted result is attempt-0176/micro-0014 at 1504 parameters and 99.000000%; the most recent failed result is attempt-0175/micro-0001 (error, no score). This is a parameterization-preserving compression of the depth-shared feed-forward input map: union flattened coordinates 87 and 22, values -0.0324013382 and -0.0320334435 (difference 3.679e-04), using a weighted mean and integer reconstruction. Hypothesis: nonlinear feature construction contains near-duplicate scalars independent of QKV redundancy, preserving qualification at 1,503 parameters. It is more informative than the next FF-input union (difference 3.736e-04) because it is the minimum-distortion isolated test at this new mechanism site. Official acceptance and rollback are unchanged.	0	0
attempt-0176	repair-ff-input-boundary-selector	micro-0016	16db63213a0411536899e542bf02ea1880e5e450	cf38be8fdf2e542ff2a611310e047d5a0440d198	2026-08-17T12:14:53.280816+00:00	parameter tying	99.010000%	1502	keep	Union closest shared FF-input scalar groups 98 and 85	Family: parameter tying. Current retained frontier is 1,503 parameters at 99.000000%, a +0.000000 percentage-point margin over 99%. There have been 73 prior macro-attempts in this family and 641 prior micro-trials. The most recent accepted result is attempt-0176/micro-0015 at 1503 parameters and 99.000000%; the most recent failed result is attempt-0175/micro-0001 (error, no score). This is a parameterization-preserving compression of the depth-shared feed-forward input map: union flattened coordinates 98 and 85, values 0.0417230539 and 0.0420966335 (difference 3.736e-04), using a weighted mean and integer reconstruction. Hypothesis: nonlinear feature construction contains near-duplicate scalars independent of QKV redundancy, preserving qualification at 1,502 parameters. It is more informative than the next FF-input union (difference 4.179e-04) because it is the minimum-distortion isolated test at this new mechanism site. Official acceptance and rollback are unchanged.	0	0
attempt-0176	repair-ff-input-boundary-selector	micro-0017	04a9d8f532136f7f9e37eb2a1cb4a116a522e409	16db63213a0411536899e542bf02ea1880e5e450	2026-08-17T12:16:07.450678+00:00	parameter tying	99.010000%	1501	keep	Union closest shared FF-input scalar groups 75 and 224	Family: parameter tying. Current retained frontier is 1,502 parameters at 99.010000%, a +0.010000 percentage-point margin over 99%. There have been 73 prior macro-attempts in this family and 642 prior micro-trials. The most recent accepted result is attempt-0176/micro-0016 at 1502 parameters and 99.010000%; the most recent failed result is attempt-0175/micro-0001 (error, no score). This is a parameterization-preserving compression of the depth-shared feed-forward input map: union flattened coordinates 75 and 224, values 0.2378070652 and 0.2382249981 (difference 4.179e-04), using a weighted mean and integer reconstruction. Hypothesis: nonlinear feature construction contains near-duplicate scalars independent of QKV redundancy, preserving qualification at 1,501 parameters. It is more informative than the next FF-input union (difference 4.194e-04) because it is the minimum-distortion isolated test at this new mechanism site. Official acceptance and rollback are unchanged.	0	0
attempt-0176	repair-ff-input-boundary-selector	micro-0018	0f52d50bb1651d33ba73da1bee4292615d6e3aa1	04a9d8f532136f7f9e37eb2a1cb4a116a522e409	2026-08-17T12:17:34.608760+00:00	parameter tying	99.010000%	1500	keep	Union closest shared FF-input scalar groups 117 and 61	Family: parameter tying. Current retained frontier is 1,501 parameters at 99.010000%, a +0.010000 percentage-point margin over 99%. There have been 73 prior macro-attempts in this family and 643 prior micro-trials. The most recent accepted result is attempt-0176/micro-0017 at 1501 parameters and 99.010000%; the most recent failed result is attempt-0175/micro-0001 (error, no score). This is a parameterization-preserving compression of the depth-shared feed-forward input map: union flattened coordinates 117 and 61, values -0.0196269508 and -0.0192075297 (difference 4.194e-04), using a weighted mean and integer reconstruction. Hypothesis: nonlinear feature construction contains near-duplicate scalars independent of QKV redundancy, preserving qualification at 1,500 parameters. It is more informative than the next FF-input union (difference 4.241e-04) because it is the minimum-distortion isolated test at this new mechanism site. Official acceptance and rollback are unchanged.	0	0
attempt-0176	repair-ff-input-boundary-selector	micro-0019	86dcaf6b33fc96784cf3ab0db3b3a4ba6a6fa1b7	0f52d50bb1651d33ba73da1bee4292615d6e3aa1	2026-08-17T12:18:45.172252+00:00	parameter tying	99.010000%	1499	keep	Union closest shared FF-input scalar groups 50 and 214	Family: parameter tying. Current retained frontier is 1,500 parameters at 99.010000%, a +0.010000 percentage-point margin over 99%. There have been 73 prior macro-attempts in this family and 644 prior micro-trials. The most recent accepted result is attempt-0176/micro-0018 at 1500 parameters and 99.010000%; the most recent failed result is attempt-0175/micro-0001 (error, no score). This is a parameterization-preserving compression of the depth-shared feed-forward input map: union flattened coordinates 50 and 214, values 0.0652321354 and 0.0656561926 (difference 4.241e-04), using a weighted mean and integer reconstruction. Hypothesis: nonlinear feature construction contains near-duplicate scalars independent of QKV redundancy, preserving qualification at 1,499 parameters. It is more informative than the next FF-input union (difference 4.384e-04) because it is the minimum-distortion isolated test at this new mechanism site. Official acceptance and rollback are unchanged.	0	0
attempt-0176	repair-ff-input-boundary-selector	micro-0020	7046765701f2fd2b3d886ae4cb6bf9c886b58d0e	86dcaf6b33fc96784cf3ab0db3b3a4ba6a6fa1b7	2026-08-17T12:19:57.539218+00:00	parameter tying	99.010000%	1498	keep	Union closest shared FF-input scalar groups 248 and 33	Family: parameter tying. Current retained frontier is 1,499 parameters at 99.010000%, a +0.010000 percentage-point margin over 99%. There have been 73 prior macro-attempts in this family and 645 prior micro-trials. The most recent accepted result is attempt-0176/micro-0019 at 1499 parameters and 99.010000%; the most recent failed result is attempt-0175/micro-0001 (error, no score). This is a parameterization-preserving compression of the depth-shared feed-forward input map: union flattened coordinates 248 and 33, values 0.0349651463 and 0.0354035273 (difference 4.384e-04), using a weighted mean and integer reconstruction. Hypothesis: nonlinear feature construction contains near-duplicate scalars independent of QKV redundancy, preserving qualification at 1,498 parameters. It is more informative than the next FF-input union (difference 4.454e-04) because it is the minimum-distortion isolated test at this new mechanism site. Official acceptance and rollback are unchanged.	0	0
attempt-0177	ff-input-continuation-after-cap	micro-0001	f5fbfe4c5bf44d8f04dc99a08c312805e89b29e8	7046765701f2fd2b3d886ae4cb6bf9c886b58d0e	2026-08-17T12:21:47.594401+00:00	parameter tying	99.000000%	1497	keep	Union closest shared FF-input scalar groups 178 and 223	Family: parameter tying. Current retained frontier is 1,498 parameters at 99.010000%, a +0.010000 percentage-point margin over 99%. There have been 74 prior macro-attempts in this family and 646 prior micro-trials. The most recent accepted result is attempt-0176/micro-0020 at 1498 parameters and 99.010000%; the most recent failed result is attempt-0175/micro-0001 (error, no score). This is a parameterization-preserving compression of the depth-shared feed-forward input map: union flattened coordinates 178 and 223, values -0.1369620115 and -0.1365166008 (difference 4.454e-04), using a weighted mean and integer reconstruction. Hypothesis: nonlinear feature construction contains near-duplicate scalars independent of QKV redundancy, preserving qualification at 1,497 parameters. It is more informative than the next FF-input union (difference 4.689e-04) because it is the minimum-distortion isolated test at this new mechanism site. Official acceptance and rollback are unchanged.	0	0
attempt-0177	ff-input-continuation-after-cap	micro-0002	bc2ed9639474e0fc51e4dc56b5a5ee9ca401a56c	f5fbfe4c5bf44d8f04dc99a08c312805e89b29e8	2026-08-17T12:23:00.496375+00:00	parameter tying	98.990000%	1496	discard	Union closest shared FF-input scalar groups 231 and 0	Family: parameter tying. Current retained frontier is 1,497 parameters at 99.000000%, a +0.000000 percentage-point margin over 99%. There have been 74 prior macro-attempts in this family and 647 prior micro-trials. The most recent accepted result is attempt-0177/micro-0001 at 1497 parameters and 99.000000%; the most recent failed result is attempt-0175/micro-0001 (error, no score). This is a parameterization-preserving compression of the depth-shared feed-forward input map: union flattened coordinates 231 and 0, values -0.1618723571 and -0.1614034772 (difference 4.689e-04), using a weighted mean and integer reconstruction. Hypothesis: nonlinear feature construction contains near-duplicate scalars independent of QKV redundancy, preserving qualification at 1,496 parameters. It is more informative than the next FF-input union (difference 4.833e-04) because it is the minimum-distortion isolated test at this new mechanism site. Official acceptance and rollback are unchanged.	0	0
attempt-0178	ff-input-skip-two-sensitive-pairs	micro-0001	693827426022588c59b4db6defe4efb7725c8c57	f5fbfe4c5bf44d8f04dc99a08c312805e89b29e8	2026-08-17T12:24:55.243834+00:00	parameter tying	99.010000%	1496	keep	Union closest shared FF-input scalar groups 93 and 221	Family: parameter tying. Current retained frontier is 1,497 parameters at 99.000000%, a +0.000000 percentage-point margin over 99%. There have been 75 prior macro-attempts in this family and 648 prior micro-trials. The most recent accepted result is attempt-0177/micro-0001 at 1497 parameters and 99.000000%; the most recent failed result is attempt-0177/micro-0002 (discard, 98.990000%). This is a parameterization-preserving compression of the depth-shared feed-forward input map: union flattened coordinates 93 and 221, values -0.1162156090 and -0.1157323122 (difference 4.833e-04), using a weighted mean and integer reconstruction. Hypothesis: nonlinear feature construction contains near-duplicate scalars independent of QKV redundancy, preserving qualification at 1,496 parameters. It is more informative than the next FF-input union (difference 4.939e-04) because it is the minimum-distortion isolated test at this new mechanism site. Official acceptance and rollback are unchanged.	0	0
attempt-0178	ff-input-skip-two-sensitive-pairs	micro-0002	9b15d448cc71dc99c57f491bd7a1f9c5b892fd3e	693827426022588c59b4db6defe4efb7725c8c57	2026-08-17T12:26:17.230860+00:00	parameter tying	98.990000%	1495	discard	Union closest shared FF-input scalar groups 153 and 71	Family: parameter tying. Current retained frontier is 1,496 parameters at 99.010000%, a +0.010000 percentage-point margin over 99%. There have been 75 prior macro-attempts in this family and 649 prior micro-trials. The most recent accepted result is attempt-0178/micro-0001 at 1496 parameters and 99.010000%; the most recent failed result is attempt-0177/micro-0002 (discard, 98.990000%). This is a parameterization-preserving compression of the depth-shared feed-forward input map: union flattened coordinates 153 and 71, values 0.1599667221 and 0.1604606062 (difference 4.939e-04), using a weighted mean and integer reconstruction. Hypothesis: nonlinear feature construction contains near-duplicate scalars independent of QKV redundancy, preserving qualification at 1,495 parameters. It is more informative than the next FF-input union (difference 5.324e-04) because it is the minimum-distortion isolated test at this new mechanism site. Official acceptance and rollback are unchanged.	0	0
attempt-0179	position-skip-two-sensitive-pairs	micro-0001	626638daaf38eed703eea2cb9f4a39b09fbbbdcf	693827426022588c59b4db6defe4efb7725c8c57	2026-08-17T12:28:23.453808+00:00	parameter tying	98.970000%	1495	discard	Union closest position groups 182 and 70	Family: parameter tying. Current retained frontier is 1,496 parameters at 99.010000%, a +0.010000 percentage-point margin over 99%. There have been 76 prior macro-attempts in this family and 650 prior micro-trials. The most recent accepted result is attempt-0178/micro-0001 at 1496 parameters and 99.010000%; the most recent failed result is attempt-0178/micro-0002 (discard, 98.990000%). This is a parameterization-preserving compression: union current position groups represented by coordinates 182 and 70, whose learned values are 0.0127164116 and 0.0131606534 (absolute difference 4.442e-04), using a multiplicity-weighted mean. Hypothesis: this preserves qualification and yields 1,495 parameters. It is more informative than the nearest untested alternative (difference 4.612e-04) because it is the minimum-distortion eligible union; exact pairs already rejected under the unchanged grouping are excluded. Acceptance and rollback remain solely governed by the official runner.	0	0
