macro_attempt_id	automation_id	micro_attempt_id	commit	parent_commit	timestamp_utc	family	accuracy	parameters	status	description	proposal	train_exit	verify_exit
attempt-0078	nearest-position-unions-infra-repair	micro-0253	28ecce2e4a7fc2a15181157e9bc32061a9d6a855	4a2c5fcebc0ca44cab08afebfbc15e1516c06b67	2026-08-17T01:34:07.318544+00:00	parameter tying	99.160000%	1832	keep	Union closest position groups 10 and 102	Family: parameter tying. Current retained frontier is 1,833 parameters at 99.170000%, a +0.170000 percentage-point margin over 99%. There have been 20 prior macro-attempts in this family and 273 prior micro-trials. The most recent accepted result is attempt-0078/micro-0252 at 1833 parameters and 99.170000%; the most recent failed result is attempt-0075/micro-0001 (error, no score). This is a parameterization-preserving compression: union current position groups represented by coordinates 10 and 102, whose learned values are 0.0053448481 and 0.0056214668 (absolute difference 2.766e-04), using a multiplicity-weighted mean. Hypothesis: this preserves qualification and yields 1,832 parameters. It is more informative than the nearest untested alternative (difference 2.784e-04) because it is the minimum-distortion eligible union; exact pairs already rejected under the unchanged grouping are excluded. Acceptance and rollback remain solely governed by the official runner.	0	0
attempt-0078	nearest-position-unions-infra-repair	micro-0254	76053f17a9810c8388ad3a9344d64287fb2e5562	28ecce2e4a7fc2a15181157e9bc32061a9d6a855	2026-08-17T01:35:21.706400+00:00	parameter tying	99.140000%	1831	keep	Union closest position groups 3 and 40	Family: parameter tying. Current retained frontier is 1,832 parameters at 99.160000%, a +0.160000 percentage-point margin over 99%. There have been 20 prior macro-attempts in this family and 274 prior micro-trials. The most recent accepted result is attempt-0078/micro-0253 at 1832 parameters and 99.160000%; the most recent failed result is attempt-0075/micro-0001 (error, no score). This is a parameterization-preserving compression: union current position groups represented by coordinates 3 and 40, whose learned values are -0.0145016257 and -0.0142232580 (absolute difference 2.784e-04), using a multiplicity-weighted mean. Hypothesis: this preserves qualification and yields 1,831 parameters. It is more informative than the nearest untested alternative (difference 2.841e-04) because it is the minimum-distortion eligible union; exact pairs already rejected under the unchanged grouping are excluded. Acceptance and rollback remain solely governed by the official runner.	0	0
attempt-0078	nearest-position-unions-infra-repair	micro-0255	5bdb0d3fbe285e4a1d63c42b6409278f986f3c54	76053f17a9810c8388ad3a9344d64287fb2e5562	2026-08-17T01:36:36.458295+00:00	parameter tying	99.140000%	1830	keep	Union closest position groups 214 and 209	Family: parameter tying. Current retained frontier is 1,831 parameters at 99.140000%, a +0.140000 percentage-point margin over 99%. There have been 20 prior macro-attempts in this family and 275 prior micro-trials. The most recent accepted result is attempt-0078/micro-0254 at 1831 parameters and 99.140000%; the most recent failed result is attempt-0075/micro-0001 (error, no score). This is a parameterization-preserving compression: union current position groups represented by coordinates 214 and 209, whose learned values are 0.0142494151 and 0.0145335505 (absolute difference 2.841e-04), using a multiplicity-weighted mean. Hypothesis: this preserves qualification and yields 1,830 parameters. It is more informative than the nearest untested alternative (difference 2.849e-04) because it is the minimum-distortion eligible union; exact pairs already rejected under the unchanged grouping are excluded. Acceptance and rollback remain solely governed by the official runner.	0	0
attempt-0078	nearest-position-unions-infra-repair	micro-0256	7d4af8830557ed1512c2ff66729b07237f0993da	5bdb0d3fbe285e4a1d63c42b6409278f986f3c54	2026-08-17T01:37:51.084611+00:00	parameter tying	99.130000%	1829	keep	Union closest position groups 17 and 337	Family: parameter tying. Current retained frontier is 1,830 parameters at 99.140000%, a +0.140000 percentage-point margin over 99%. There have been 20 prior macro-attempts in this family and 276 prior micro-trials. The most recent accepted result is attempt-0078/micro-0255 at 1830 parameters and 99.140000%; the most recent failed result is attempt-0075/micro-0001 (error, no score). This is a parameterization-preserving compression: union current position groups represented by coordinates 17 and 337, whose learned values are 0.0333643630 and 0.0336493030 (absolute difference 2.849e-04), using a multiplicity-weighted mean. Hypothesis: this preserves qualification and yields 1,829 parameters. It is more informative than the nearest untested alternative (difference 2.881e-04) because it is the minimum-distortion eligible union; exact pairs already rejected under the unchanged grouping are excluded. Acceptance and rollback remain solely governed by the official runner.	0	0
attempt-0078	nearest-position-unions-infra-repair	micro-0257	37e6dc7d1b463a1be3bfa899c7e6f0231569166b	7d4af8830557ed1512c2ff66729b07237f0993da	2026-08-17T01:39:07.223568+00:00	parameter tying	99.140000%	1828	keep	Union closest position groups 448 and 52	Family: parameter tying. Current retained frontier is 1,829 parameters at 99.130000%, a +0.130000 percentage-point margin over 99%. There have been 20 prior macro-attempts in this family and 277 prior micro-trials. The most recent accepted result is attempt-0078/micro-0256 at 1829 parameters and 99.130000%; the most recent failed result is attempt-0075/micro-0001 (error, no score). This is a parameterization-preserving compression: union current position groups represented by coordinates 448 and 52, whose learned values are -0.0459120721 and -0.0456239879 (absolute difference 2.881e-04), using a multiplicity-weighted mean. Hypothesis: this preserves qualification and yields 1,828 parameters. It is more informative than the nearest untested alternative (difference 2.905e-04) because it is the minimum-distortion eligible union; exact pairs already rejected under the unchanged grouping are excluded. Acceptance and rollback remain solely governed by the official runner.	0	0
attempt-0078	nearest-position-unions-infra-repair	micro-0258	15d7c837a7002e5a79f727218a5894ffacca062c	37e6dc7d1b463a1be3bfa899c7e6f0231569166b	2026-08-17T01:40:20.970447+00:00	parameter tying	99.140000%	1827	keep	Union closest position groups 89 and 8	Family: parameter tying. Current retained frontier is 1,828 parameters at 99.140000%, a +0.140000 percentage-point margin over 99%. There have been 20 prior macro-attempts in this family and 278 prior micro-trials. The most recent accepted result is attempt-0078/micro-0257 at 1828 parameters and 99.140000%; the most recent failed result is attempt-0075/micro-0001 (error, no score). This is a parameterization-preserving compression: union current position groups represented by coordinates 89 and 8, whose learned values are -0.0152156111 and -0.0149251334 (absolute difference 2.905e-04), using a multiplicity-weighted mean. Hypothesis: this preserves qualification and yields 1,827 parameters. It is more informative than the nearest untested alternative (difference 2.932e-04) because it is the minimum-distortion eligible union; exact pairs already rejected under the unchanged grouping are excluded. Acceptance and rollback remain solely governed by the official runner.	0	0
attempt-0078	nearest-position-unions-infra-repair	micro-0259	6a496af4dc57ebb3e4a3f4a2dfa4f2db80c25906	15d7c837a7002e5a79f727218a5894ffacca062c	2026-08-17T01:41:22.969105+00:00	parameter tying	99.140000%	1826	keep	Union closest position groups 472 and 412	Family: parameter tying. Current retained frontier is 1,827 parameters at 99.140000%, a +0.140000 percentage-point margin over 99%. There have been 20 prior macro-attempts in this family and 279 prior micro-trials. The most recent accepted result is attempt-0078/micro-0258 at 1827 parameters and 99.140000%; the most recent failed result is attempt-0075/micro-0001 (error, no score). This is a parameterization-preserving compression: union current position groups represented by coordinates 472 and 412, whose learned values are -0.0322351679 and -0.0319419838 (absolute difference 2.932e-04), using a multiplicity-weighted mean. Hypothesis: this preserves qualification and yields 1,826 parameters. It is more informative than the nearest untested alternative (difference 2.961e-04) because it is the minimum-distortion eligible union; exact pairs already rejected under the unchanged grouping are excluded. Acceptance and rollback remain solely governed by the official runner.	0	0
attempt-0078	nearest-position-unions-infra-repair	micro-0260	84a7eecb9f2ea657969eed7c33ef2d8b242c6309	6a496af4dc57ebb3e4a3f4a2dfa4f2db80c25906	2026-08-17T01:42:26.480617+00:00	parameter tying	99.140000%	1825	keep	Union closest position groups 41 and 77	Family: parameter tying. Current retained frontier is 1,826 parameters at 99.140000%, a +0.140000 percentage-point margin over 99%. There have been 20 prior macro-attempts in this family and 280 prior micro-trials. The most recent accepted result is attempt-0078/micro-0259 at 1826 parameters and 99.140000%; the most recent failed result is attempt-0075/micro-0001 (error, no score). This is a parameterization-preserving compression: union current position groups represented by coordinates 41 and 77, whose learned values are 0.0005117839 and 0.0008078447 (absolute difference 2.961e-04), using a multiplicity-weighted mean. Hypothesis: this preserves qualification and yields 1,825 parameters. It is more informative than the nearest untested alternative (difference 3.018e-04) because it is the minimum-distortion eligible union; exact pairs already rejected under the unchanged grouping are excluded. Acceptance and rollback remain solely governed by the official runner.	0	0
attempt-0078	nearest-position-unions-infra-repair	micro-0261	2ddf12e7b499ac3ae973d5e9a174ec420fa56768	84a7eecb9f2ea657969eed7c33ef2d8b242c6309	2026-08-17T01:43:47.217916+00:00	parameter tying	99.140000%	1824	keep	Union closest position groups 427 and 135	Family: parameter tying. Current retained frontier is 1,825 parameters at 99.140000%, a +0.140000 percentage-point margin over 99%. There have been 20 prior macro-attempts in this family and 281 prior micro-trials. The most recent accepted result is attempt-0078/micro-0260 at 1825 parameters and 99.140000%; the most recent failed result is attempt-0075/micro-0001 (error, no score). This is a parameterization-preserving compression: union current position groups represented by coordinates 427 and 135, whose learned values are -0.0354401916 and -0.0351384021 (absolute difference 3.018e-04), using a multiplicity-weighted mean. Hypothesis: this preserves qualification and yields 1,824 parameters. It is more informative than the nearest untested alternative (difference 3.036e-04) because it is the minimum-distortion eligible union; exact pairs already rejected under the unchanged grouping are excluded. Acceptance and rollback remain solely governed by the official runner.	0	0
attempt-0078	nearest-position-unions-infra-repair	micro-0262	315393308251debb2dbbb2bf6fc592a7b9834f39	2ddf12e7b499ac3ae973d5e9a174ec420fa56768	2026-08-17T01:45:10.152260+00:00	parameter tying	99.150000%	1823	keep	Union closest position groups 225 and 479	Family: parameter tying. Current retained frontier is 1,824 parameters at 99.140000%, a +0.140000 percentage-point margin over 99%. There have been 20 prior macro-attempts in this family and 282 prior micro-trials. The most recent accepted result is attempt-0078/micro-0261 at 1824 parameters and 99.140000%; the most recent failed result is attempt-0075/micro-0001 (error, no score). This is a parameterization-preserving compression: union current position groups represented by coordinates 225 and 479, whose learned values are 0.0191290230 and 0.0194326434 (absolute difference 3.036e-04), using a multiplicity-weighted mean. Hypothesis: this preserves qualification and yields 1,823 parameters. It is more informative than the nearest untested alternative (difference 3.090e-04) because it is the minimum-distortion eligible union; exact pairs already rejected under the unchanged grouping are excluded. Acceptance and rollback remain solely governed by the official runner.	0	0
attempt-0078	nearest-position-unions-infra-repair	micro-0263	f8bd5a86518331a5320e5d83596fd51911ea00e0	315393308251debb2dbbb2bf6fc592a7b9834f39	2026-08-17T01:49:33.420759+00:00	parameter tying	99.160000%	1822	keep	Union closest position groups 170 and 136	Family: parameter tying. Current retained frontier is 1,823 parameters at 99.150000%, a +0.150000 percentage-point margin over 99%. There have been 20 prior macro-attempts in this family and 283 prior micro-trials. The most recent accepted result is attempt-0078/micro-0262 at 1823 parameters and 99.150000%; the most recent failed result is attempt-0075/micro-0001 (error, no score). This is a parameterization-preserving compression: union current position groups represented by coordinates 170 and 136, whose learned values are 0.0089607472 and 0.0092697125 (absolute difference 3.090e-04), using a multiplicity-weighted mean. Hypothesis: this preserves qualification and yields 1,822 parameters. It is more informative than the nearest untested alternative (difference 3.139e-04) because it is the minimum-distortion eligible union; exact pairs already rejected under the unchanged grouping are excluded. Acceptance and rollback remain solely governed by the official runner.	0	0
attempt-0078	nearest-position-unions-infra-repair	micro-0264	9ea7bdefc5a005e88e322e9b17bf272de86cc309	f8bd5a86518331a5320e5d83596fd51911ea00e0	2026-08-17T01:50:41.277210+00:00	parameter tying	99.140000%	1821	keep	Union closest position groups 74 and 90	Family: parameter tying. Current retained frontier is 1,822 parameters at 99.160000%, a +0.160000 percentage-point margin over 99%. There have been 20 prior macro-attempts in this family and 284 prior micro-trials. The most recent accepted result is attempt-0078/micro-0263 at 1822 parameters and 99.160000%; the most recent failed result is attempt-0075/micro-0001 (error, no score). This is a parameterization-preserving compression: union current position groups represented by coordinates 74 and 90, whose learned values are -0.0049095368 and -0.0045956578 (absolute difference 3.139e-04), using a multiplicity-weighted mean. Hypothesis: this preserves qualification and yields 1,821 parameters. It is more informative than the nearest untested alternative (difference 3.145e-04) because it is the minimum-distortion eligible union; exact pairs already rejected under the unchanged grouping are excluded. Acceptance and rollback remain solely governed by the official runner.	0	0
attempt-0078	nearest-position-unions-infra-repair	micro-0265	a222ba4624d67fb3cf75a71afcaded047948f4c3	9ea7bdefc5a005e88e322e9b17bf272de86cc309	2026-08-17T01:51:55.094219+00:00	parameter tying	99.140000%	1820	keep	Union closest position groups 443 and 338	Family: parameter tying. Current retained frontier is 1,821 parameters at 99.140000%, a +0.140000 percentage-point margin over 99%. There have been 20 prior macro-attempts in this family and 285 prior micro-trials. The most recent accepted result is attempt-0078/micro-0264 at 1821 parameters and 99.140000%; the most recent failed result is attempt-0075/micro-0001 (error, no score). This is a parameterization-preserving compression: union current position groups represented by coordinates 443 and 338, whose learned values are -0.0057055685 and -0.0053910939 (absolute difference 3.145e-04), using a multiplicity-weighted mean. Hypothesis: this preserves qualification and yields 1,820 parameters. It is more informative than the nearest untested alternative (difference 3.147e-04) because it is the minimum-distortion eligible union; exact pairs already rejected under the unchanged grouping are excluded. Acceptance and rollback remain solely governed by the official runner.	0	0
attempt-0078	nearest-position-unions-infra-repair	micro-0266	325bd3493862b498037e337286c9817868fff61e	a222ba4624d67fb3cf75a71afcaded047948f4c3	2026-08-17T01:53:13.623974+00:00	parameter tying	99.140000%	1819	keep	Union closest position groups 85 and 101	Family: parameter tying. Current retained frontier is 1,820 parameters at 99.140000%, a +0.140000 percentage-point margin over 99%. There have been 20 prior macro-attempts in this family and 286 prior micro-trials. The most recent accepted result is attempt-0078/micro-0265 at 1820 parameters and 99.140000%; the most recent failed result is attempt-0075/micro-0001 (error, no score). This is a parameterization-preserving compression: union current position groups represented by coordinates 85 and 101, whose learned values are 0.0800988376 and 0.0804135054 (absolute difference 3.147e-04), using a multiplicity-weighted mean. Hypothesis: this preserves qualification and yields 1,819 parameters. It is more informative than the nearest untested alternative (difference 3.162e-04) because it is the minimum-distortion eligible union; exact pairs already rejected under the unchanged grouping are excluded. Acceptance and rollback remain solely governed by the official runner.	0	0
attempt-0078	nearest-position-unions-infra-repair	micro-0267	339fd30c76dec6d7aa00b8f91f7e4846dc754778	325bd3493862b498037e337286c9817868fff61e	2026-08-17T01:54:28.923628+00:00	parameter tying	99.140000%	1818	keep	Union closest position groups 355 and 168	Family: parameter tying. Current retained frontier is 1,819 parameters at 99.140000%, a +0.140000 percentage-point margin over 99%. There have been 20 prior macro-attempts in this family and 287 prior micro-trials. The most recent accepted result is attempt-0078/micro-0266 at 1819 parameters and 99.140000%; the most recent failed result is attempt-0075/micro-0001 (error, no score). This is a parameterization-preserving compression: union current position groups represented by coordinates 355 and 168, whose learned values are 0.0293630566 and 0.0296792388 (absolute difference 3.162e-04), using a multiplicity-weighted mean. Hypothesis: this preserves qualification and yields 1,818 parameters. It is more informative than the nearest untested alternative (difference 3.220e-04) because it is the minimum-distortion eligible union; exact pairs already rejected under the unchanged grouping are excluded. Acceptance and rollback remain solely governed by the official runner.	0	0
attempt-0078	nearest-position-unions-infra-repair	micro-0268	c0e0c10a6408b5452df3288670030a4773aa5418	339fd30c76dec6d7aa00b8f91f7e4846dc754778	2026-08-17T01:55:40.144804+00:00	parameter tying	99.140000%	1817	keep	Union closest position groups 57 and 114	Family: parameter tying. Current retained frontier is 1,818 parameters at 99.140000%, a +0.140000 percentage-point margin over 99%. There have been 20 prior macro-attempts in this family and 288 prior micro-trials. The most recent accepted result is attempt-0078/micro-0267 at 1818 parameters and 99.140000%; the most recent failed result is attempt-0075/micro-0001 (error, no score). This is a parameterization-preserving compression: union current position groups represented by coordinates 57 and 114, whose learned values are -0.0206732228 and -0.0203496125 (absolute difference 3.236e-04), using a multiplicity-weighted mean. Hypothesis: this preserves qualification and yields 1,817 parameters. It is more informative than the nearest untested alternative (difference 3.266e-04) because it is the minimum-distortion eligible union; exact pairs already rejected under the unchanged grouping are excluded. Acceptance and rollback remain solely governed by the official runner.	0	0
attempt-0078	nearest-position-unions-infra-repair	micro-0269	8c82e418621d92f85a6f327211c81cb794bb1320	c0e0c10a6408b5452df3288670030a4773aa5418	2026-08-17T01:56:45.278879+00:00	parameter tying	99.140000%	1816	keep	Union closest position groups 364 and 120	Family: parameter tying. Current retained frontier is 1,817 parameters at 99.140000%, a +0.140000 percentage-point margin over 99%. There have been 20 prior macro-attempts in this family and 289 prior micro-trials. The most recent accepted result is attempt-0078/micro-0268 at 1817 parameters and 99.140000%; the most recent failed result is attempt-0075/micro-0001 (error, no score). This is a parameterization-preserving compression: union current position groups represented by coordinates 364 and 120, whose learned values are -0.0023550019 and -0.0020284054 (absolute difference 3.266e-04), using a multiplicity-weighted mean. Hypothesis: this preserves qualification and yields 1,816 parameters. It is more informative than the nearest untested alternative (difference 3.306e-04) because it is the minimum-distortion eligible union; exact pairs already rejected under the unchanged grouping are excluded. Acceptance and rollback remain solely governed by the official runner.	0	0
