macro_attempt_id	automation_id	micro_attempt_id	commit	parent_commit	timestamp_utc	family	accuracy	parameters	status	description	proposal	train_exit	verify_exit
attempt-0081	nearest-token-matrix-unions-repair	micro-0006	76b797df9fd2d9b42b82d99720958d50ba25fc7e	f5c6b45da5a418250ef22e556de7e37be1e40378	2026-08-17T02:42:44.540820+00:00	parameter tying	99.000000%	1784	keep	Union closest token-matrix scalar groups 163 and 179	Family: parameter tying. Current retained frontier is 1,785 parameters at 99.000000%, a +0.000000 percentage-point margin over 99%. There have been 23 prior macro-attempts in this family and 324 prior micro-trials. The most recent accepted result is attempt-0081/micro-0005 at 1785 parameters and 99.000000%; the most recent failed result is attempt-0080/micro-0002 (error, no score). This is a parameterization-preserving compression of the tied input/output token matrix: union groups represented by flattened coordinates 163 and 179, whose values are -0.0008038765 and -0.0007222201 (difference 8.166e-05), using a multiplicity-weighted mean and one integer reconstruction map. Hypothesis: token scalars have a different sensitivity structure from the positional table and this minimum-distortion union preserves qualification while yielding 1,784 parameters. It is more informative than the next eligible token union (difference 9.112e-05) because it is the least perturbing test at this new tensor site. Acceptance and rollback remain solely governed by the official runner.	0	0
attempt-0081	nearest-token-matrix-unions-repair	micro-0007	68619ec6b450be1f9d555af40d16c8036322c43b	76b797df9fd2d9b42b82d99720958d50ba25fc7e	2026-08-17T02:43:52.850180+00:00	parameter tying	98.970000%	1783	discard	Union closest token-matrix scalar groups 92 and 55	Family: parameter tying. Current retained frontier is 1,784 parameters at 99.000000%, a +0.000000 percentage-point margin over 99%. There have been 23 prior macro-attempts in this family and 325 prior micro-trials. The most recent accepted result is attempt-0081/micro-0006 at 1784 parameters and 99.000000%; the most recent failed result is attempt-0080/micro-0002 (error, no score). This is a parameterization-preserving compression of the tied input/output token matrix: union groups represented by flattened coordinates 92 and 55, whose values are -0.0424984731 and -0.0424073525 (difference 9.112e-05), using a multiplicity-weighted mean and one integer reconstruction map. Hypothesis: token scalars have a different sensitivity structure from the positional table and this minimum-distortion union preserves qualification while yielding 1,783 parameters. It is more informative than the next eligible token union (difference 1.143e-04) because it is the least perturbing test at this new tensor site. Acceptance and rollback remain solely governed by the official runner.	0	0
attempt-0082	nearest-shared-qkv-unions	micro-0001	dbf6149a0d665ce509e94d2b852e09665b759c4f	76b797df9fd2d9b42b82d99720958d50ba25fc7e	2026-08-17T02:47:31.411561+00:00	parameter tying	99.000000%	1783	keep	Union closest shared-QKV scalar groups 649 and 600	Family: parameter tying. Current retained frontier is 1,784 parameters at 99.000000%, a +0.000000 percentage-point margin over 99%. There have been 24 prior macro-attempts in this family and 326 prior micro-trials. The most recent accepted result is attempt-0081/micro-0006 at 1784 parameters and 99.000000%; the most recent failed result is attempt-0081/micro-0007 (discard, 98.970000%). This is a parameterization-preserving compression of the depth-shared QKV transform: union flattened coordinates 649 and 600, whose learned values are 0.0105196452 and 0.0105203865 (difference 7.413e-07), with a multiplicity-weighted mean and integer reconstruction map. Hypothesis: the much larger attention tensor contains near-duplicate scalars below the token failure scale, so this union preserves qualification and yields 1,783 parameters. It is more informative than the next QKV union (difference 1.395e-06) because it is the minimum-distortion test at this new site. Acceptance and rollback remain solely governed by the official runner.	0	0
attempt-0082	nearest-shared-qkv-unions	micro-0002	44700b67a3ecd19242a6c92ff0bb5eb9c87b4702	dbf6149a0d665ce509e94d2b852e09665b759c4f	2026-08-17T02:48:44.881908+00:00	parameter tying	99.000000%	1782	keep	Union closest shared-QKV scalar groups 608 and 693	Family: parameter tying. Current retained frontier is 1,783 parameters at 99.000000%, a +0.000000 percentage-point margin over 99%. There have been 24 prior macro-attempts in this family and 327 prior micro-trials. The most recent accepted result is attempt-0082/micro-0001 at 1783 parameters and 99.000000%; the most recent failed result is attempt-0081/micro-0007 (discard, 98.970000%). This is a parameterization-preserving compression of the depth-shared QKV transform: union flattened coordinates 608 and 693, whose learned values are 0.0139430370 and 0.0139444321 (difference 1.395e-06), with a multiplicity-weighted mean and integer reconstruction map. Hypothesis: the much larger attention tensor contains near-duplicate scalars below the token failure scale, so this union preserves qualification and yields 1,782 parameters. It is more informative than the next QKV union (difference 1.403e-06) because it is the minimum-distortion test at this new site. Acceptance and rollback remain solely governed by the official runner.	0	0
attempt-0082	nearest-shared-qkv-unions	micro-0003	49a8d96cb86bcccea96f75442d1cd969cf55a886	44700b67a3ecd19242a6c92ff0bb5eb9c87b4702	2026-08-17T02:49:54.655611+00:00	parameter tying	99.000000%	1781	keep	Union closest shared-QKV scalar groups 523 and 393	Family: parameter tying. Current retained frontier is 1,782 parameters at 99.000000%, a +0.000000 percentage-point margin over 99%. There have been 24 prior macro-attempts in this family and 328 prior micro-trials. The most recent accepted result is attempt-0082/micro-0002 at 1782 parameters and 99.000000%; the most recent failed result is attempt-0081/micro-0007 (discard, 98.970000%). This is a parameterization-preserving compression of the depth-shared QKV transform: union flattened coordinates 523 and 393, whose learned values are 0.0126734395 and 0.0126748420 (difference 1.403e-06), with a multiplicity-weighted mean and integer reconstruction map. Hypothesis: the much larger attention tensor contains near-duplicate scalars below the token failure scale, so this union preserves qualification and yields 1,781 parameters. It is more informative than the next QKV union (difference 1.488e-06) because it is the minimum-distortion test at this new site. Acceptance and rollback remain solely governed by the official runner.	0	0
attempt-0082	nearest-shared-qkv-unions	micro-0004	3fba36a52202c3976a648159d02e4c08a5abd4f8	49a8d96cb86bcccea96f75442d1cd969cf55a886	2026-08-17T02:51:04.661860+00:00	parameter tying	99.000000%	1780	keep	Union closest shared-QKV scalar groups 587 and 530	Family: parameter tying. Current retained frontier is 1,781 parameters at 99.000000%, a +0.000000 percentage-point margin over 99%. There have been 24 prior macro-attempts in this family and 329 prior micro-trials. The most recent accepted result is attempt-0082/micro-0003 at 1781 parameters and 99.000000%; the most recent failed result is attempt-0081/micro-0007 (discard, 98.970000%). This is a parameterization-preserving compression of the depth-shared QKV transform: union flattened coordinates 587 and 530, whose learned values are 0.0181534551 and 0.0181549434 (difference 1.488e-06), with a multiplicity-weighted mean and integer reconstruction map. Hypothesis: the much larger attention tensor contains near-duplicate scalars below the token failure scale, so this union preserves qualification and yields 1,780 parameters. It is more informative than the next QKV union (difference 1.755e-06) because it is the minimum-distortion test at this new site. Acceptance and rollback remain solely governed by the official runner.	0	0
attempt-0082	nearest-shared-qkv-unions	micro-0005	d0a43230d4b40c6f1612220903a4ca8fa08e98ac	3fba36a52202c3976a648159d02e4c08a5abd4f8	2026-08-17T02:52:13.727669+00:00	parameter tying	99.000000%	1779	keep	Union closest shared-QKV scalar groups 273 and 258	Family: parameter tying. Current retained frontier is 1,780 parameters at 99.000000%, a +0.000000 percentage-point margin over 99%. There have been 24 prior macro-attempts in this family and 330 prior micro-trials. The most recent accepted result is attempt-0082/micro-0004 at 1780 parameters and 99.000000%; the most recent failed result is attempt-0081/micro-0007 (discard, 98.970000%). This is a parameterization-preserving compression of the depth-shared QKV transform: union flattened coordinates 273 and 258, whose learned values are 0.0319541283 and 0.0319558829 (difference 1.755e-06), with a multiplicity-weighted mean and integer reconstruction map. Hypothesis: the much larger attention tensor contains near-duplicate scalars below the token failure scale, so this union preserves qualification and yields 1,779 parameters. It is more informative than the next QKV union (difference 2.393e-06) because it is the minimum-distortion test at this new site. Acceptance and rollback remain solely governed by the official runner.	0	0
attempt-0082	nearest-shared-qkv-unions	micro-0006	d793ce5ae24ee9f901f13af1cea9840ed6ecd450	d0a43230d4b40c6f1612220903a4ca8fa08e98ac	2026-08-17T02:53:23.493106+00:00	parameter tying	99.000000%	1778	keep	Union closest shared-QKV scalar groups 608 and 690	Family: parameter tying. Current retained frontier is 1,779 parameters at 99.000000%, a +0.000000 percentage-point margin over 99%. There have been 24 prior macro-attempts in this family and 331 prior micro-trials. The most recent accepted result is attempt-0082/micro-0005 at 1779 parameters and 99.000000%; the most recent failed result is attempt-0081/micro-0007 (discard, 98.970000%). This is a parameterization-preserving compression of the depth-shared QKV transform: union flattened coordinates 608 and 690, whose learned values are 0.0139437346 and 0.0139461271 (difference 2.393e-06), with a multiplicity-weighted mean and integer reconstruction map. Hypothesis: the much larger attention tensor contains near-duplicate scalars below the token failure scale, so this union preserves qualification and yields 1,778 parameters. It is more informative than the next QKV union (difference 2.403e-06) because it is the minimum-distortion test at this new site. Acceptance and rollback remain solely governed by the official runner.	0	0
attempt-0082	nearest-shared-qkv-unions	micro-0007	072dbfdc20623eddf82c0247e48f6fb6c26c411f	d793ce5ae24ee9f901f13af1cea9840ed6ecd450	2026-08-17T02:54:33.577697+00:00	parameter tying	99.000000%	1777	keep	Union closest shared-QKV scalar groups 381 and 105	Family: parameter tying. Current retained frontier is 1,778 parameters at 99.000000%, a +0.000000 percentage-point margin over 99%. There have been 24 prior macro-attempts in this family and 332 prior micro-trials. The most recent accepted result is attempt-0082/micro-0006 at 1778 parameters and 99.000000%; the most recent failed result is attempt-0081/micro-0007 (discard, 98.970000%). This is a parameterization-preserving compression of the depth-shared QKV transform: union flattened coordinates 381 and 105, whose learned values are -0.0079082046 and -0.0079058018 (difference 2.403e-06), with a multiplicity-weighted mean and integer reconstruction map. Hypothesis: the much larger attention tensor contains near-duplicate scalars below the token failure scale, so this union preserves qualification and yields 1,777 parameters. It is more informative than the next QKV union (difference 3.007e-06) because it is the minimum-distortion test at this new site. Acceptance and rollback remain solely governed by the official runner.	0	0
attempt-0082	nearest-shared-qkv-unions	micro-0008	1ef8e98a86f4ced1820ca32e7c10037a08b72a9f	072dbfdc20623eddf82c0247e48f6fb6c26c411f	2026-08-17T02:55:46.010024+00:00	parameter tying	99.000000%	1776	keep	Union closest shared-QKV scalar groups 594 and 601	Family: parameter tying. Current retained frontier is 1,777 parameters at 99.000000%, a +0.000000 percentage-point margin over 99%. There have been 24 prior macro-attempts in this family and 333 prior micro-trials. The most recent accepted result is attempt-0082/micro-0007 at 1777 parameters and 99.000000%; the most recent failed result is attempt-0081/micro-0007 (discard, 98.970000%). This is a parameterization-preserving compression of the depth-shared QKV transform: union flattened coordinates 594 and 601, whose learned values are -0.0068016830 and -0.0067986762 (difference 3.007e-06), with a multiplicity-weighted mean and integer reconstruction map. Hypothesis: the much larger attention tensor contains near-duplicate scalars below the token failure scale, so this union preserves qualification and yields 1,776 parameters. It is more informative than the next QKV union (difference 4.909e-06) because it is the minimum-distortion test at this new site. Acceptance and rollback remain solely governed by the official runner.	0	0
attempt-0082	nearest-shared-qkv-unions	micro-0009	c3d4b59d9768865abd220d74a264bdf843950737	1ef8e98a86f4ced1820ca32e7c10037a08b72a9f	2026-08-17T02:57:04.539756+00:00	parameter tying	99.000000%	1775	keep	Union closest shared-QKV scalar groups 644 and 749	Family: parameter tying. Current retained frontier is 1,776 parameters at 99.000000%, a +0.000000 percentage-point margin over 99%. There have been 24 prior macro-attempts in this family and 334 prior micro-trials. The most recent accepted result is attempt-0082/micro-0008 at 1776 parameters and 99.000000%; the most recent failed result is attempt-0081/micro-0007 (discard, 98.970000%). This is a parameterization-preserving compression of the depth-shared QKV transform: union flattened coordinates 644 and 749, whose learned values are -0.0058162315 and -0.0058113225 (difference 4.909e-06), with a multiplicity-weighted mean and integer reconstruction map. Hypothesis: the much larger attention tensor contains near-duplicate scalars below the token failure scale, so this union preserves qualification and yields 1,775 parameters. It is more informative than the next QKV union (difference 5.178e-06) because it is the minimum-distortion test at this new site. Acceptance and rollback remain solely governed by the official runner.	0	0
attempt-0082	nearest-shared-qkv-unions	micro-0010	78dfb669e072376274ef05d5201c47e4fc0aa2b5	c3d4b59d9768865abd220d74a264bdf843950737	2026-08-17T02:58:36.474968+00:00	parameter tying	99.000000%	1774	keep	Union closest shared-QKV scalar groups 345 and 335	Family: parameter tying. Current retained frontier is 1,775 parameters at 99.000000%, a +0.000000 percentage-point margin over 99%. There have been 24 prior macro-attempts in this family and 335 prior micro-trials. The most recent accepted result is attempt-0082/micro-0009 at 1775 parameters and 99.000000%; the most recent failed result is attempt-0081/micro-0007 (discard, 98.970000%). This is a parameterization-preserving compression of the depth-shared QKV transform: union flattened coordinates 345 and 335, whose learned values are 0.0423460305 and 0.0423512086 (difference 5.178e-06), with a multiplicity-weighted mean and integer reconstruction map. Hypothesis: the much larger attention tensor contains near-duplicate scalars below the token failure scale, so this union preserves qualification and yields 1,774 parameters. It is more informative than the next QKV union (difference 7.628e-06) because it is the minimum-distortion test at this new site. Acceptance and rollback remain solely governed by the official runner.	0	0
attempt-0082	nearest-shared-qkv-unions	micro-0011	12f16e7dceb4bf48fe0134403b164d4518a23277	78dfb669e072376274ef05d5201c47e4fc0aa2b5	2026-08-17T02:59:41.862819+00:00	parameter tying	99.000000%	1773	keep	Union closest shared-QKV scalar groups 767 and 287	Family: parameter tying. Current retained frontier is 1,774 parameters at 99.000000%, a +0.000000 percentage-point margin over 99%. There have been 24 prior macro-attempts in this family and 336 prior micro-trials. The most recent accepted result is attempt-0082/micro-0010 at 1774 parameters and 99.000000%; the most recent failed result is attempt-0081/micro-0007 (discard, 98.970000%). This is a parameterization-preserving compression of the depth-shared QKV transform: union flattened coordinates 767 and 287, whose learned values are -0.0304883663 and -0.0304807387 (difference 7.628e-06), with a multiplicity-weighted mean and integer reconstruction map. Hypothesis: the much larger attention tensor contains near-duplicate scalars below the token failure scale, so this union preserves qualification and yields 1,773 parameters. It is more informative than the next QKV union (difference 9.611e-06) because it is the minimum-distortion test at this new site. Acceptance and rollback remain solely governed by the official runner.	0	0
attempt-0082	nearest-shared-qkv-unions	micro-0012	c0314c1fe9c9bb4d418f989eb0c418dff7bfea2e	12f16e7dceb4bf48fe0134403b164d4518a23277	2026-08-17T03:00:51.488759+00:00	parameter tying	99.000000%	1772	keep	Union closest shared-QKV scalar groups 695 and 606	Family: parameter tying. Current retained frontier is 1,773 parameters at 99.000000%, a +0.000000 percentage-point margin over 99%. There have been 24 prior macro-attempts in this family and 337 prior micro-trials. The most recent accepted result is attempt-0082/micro-0011 at 1773 parameters and 99.000000%; the most recent failed result is attempt-0081/micro-0007 (discard, 98.970000%). This is a parameterization-preserving compression of the depth-shared QKV transform: union flattened coordinates 695 and 606, whose learned values are -0.0359113328 and -0.0359017216 (difference 9.611e-06), with a multiplicity-weighted mean and integer reconstruction map. Hypothesis: the much larger attention tensor contains near-duplicate scalars below the token failure scale, so this union preserves qualification and yields 1,772 parameters. It is more informative than the next QKV union (difference 1.041e-05) because it is the minimum-distortion test at this new site. Acceptance and rollback remain solely governed by the official runner.	0	0
attempt-0082	nearest-shared-qkv-unions	micro-0013	91ce2d240847099d9182707f7063ead7587f917d	c0314c1fe9c9bb4d418f989eb0c418dff7bfea2e	2026-08-17T03:02:01.335723+00:00	parameter tying	99.000000%	1771	keep	Union closest shared-QKV scalar groups 394 and 78	Family: parameter tying. Current retained frontier is 1,772 parameters at 99.000000%, a +0.000000 percentage-point margin over 99%. There have been 24 prior macro-attempts in this family and 338 prior micro-trials. The most recent accepted result is attempt-0082/micro-0012 at 1772 parameters and 99.000000%; the most recent failed result is attempt-0081/micro-0007 (discard, 98.970000%). This is a parameterization-preserving compression of the depth-shared QKV transform: union flattened coordinates 394 and 78, whose learned values are 0.0162054524 and 0.0162158627 (difference 1.041e-05), with a multiplicity-weighted mean and integer reconstruction map. Hypothesis: the much larger attention tensor contains near-duplicate scalars below the token failure scale, so this union preserves qualification and yields 1,771 parameters. It is more informative than the next QKV union (difference 1.140e-05) because it is the minimum-distortion test at this new site. Acceptance and rollback remain solely governed by the official runner.	0	0
attempt-0082	nearest-shared-qkv-unions	micro-0014	187bcbc20ee1207f10976a452fbdabe2cc1aa423	91ce2d240847099d9182707f7063ead7587f917d	2026-08-17T03:03:11.174343+00:00	parameter tying	99.010000%	1770	keep	Union closest shared-QKV scalar groups 593 and 105	Family: parameter tying. Current retained frontier is 1,771 parameters at 99.000000%, a +0.000000 percentage-point margin over 99%. There have been 24 prior macro-attempts in this family and 339 prior micro-trials. The most recent accepted result is attempt-0082/micro-0013 at 1771 parameters and 99.000000%; the most recent failed result is attempt-0081/micro-0007 (discard, 98.970000%). This is a parameterization-preserving compression of the depth-shared QKV transform: union flattened coordinates 593 and 105, whose learned values are -0.0079184044 and -0.0079070032 (difference 1.140e-05), with a multiplicity-weighted mean and integer reconstruction map. Hypothesis: the much larger attention tensor contains near-duplicate scalars below the token failure scale, so this union preserves qualification and yields 1,770 parameters. It is more informative than the next QKV union (difference 1.275e-05) because it is the minimum-distortion test at this new site. Acceptance and rollback remain solely governed by the official runner.	0	0
