macro_attempt_id	automation_id	micro_attempt_id	commit	parent_commit	timestamp_utc	family	accuracy	parameters	status	description	proposal	train_exit	verify_exit
attempt-0164	qkv-skip-twelve-sensitive-pairs	micro-0001	b5e1840a6b69228d4fa25a3a10e599cdc670c0ff	b807f6751d082ea554b2ca8915aa2b99df9e0299	2026-08-17T09:56:49.210853+00:00	parameter tying	98.990000%	1596	discard	Union closest shared-QKV scalar groups 661 and 747	Family: parameter tying. Current retained frontier is 1,597 parameters at 99.000000%, a +0.000000 percentage-point margin over 99%. There have been 61 prior macro-attempts in this family and 537 prior micro-trials. The most recent accepted result is attempt-0163/micro-0002 at 1,597 parameters and 99.00%; the most recent failed result is attempt-0163/micro-0003 (QKV pair 651/596 discarded at 98.95%). This is a parameterization-preserving compression of the depth-shared QKV transform: union flattened coordinates 661 and 747, whose learned values are 0.0028145285 and 0.0029796674 (difference 1.651e-04), with a multiplicity-weighted mean and integer reconstruction map. Hypothesis: the much larger attention tensor contains near-duplicate scalars below the token failure scale, so this union preserves qualification and yields 1,596 parameters. It is more informative than the next QKV union (difference 1.654e-04) because it is the minimum-distortion test at this new site. Acceptance and rollback remain solely governed by the official runner.	0	0
attempt-0165	qkv-final-two-failure-plateau-check	micro-0001	0748239d07dcc503cb5d2ba9c8e254545ad32520	b807f6751d082ea554b2ca8915aa2b99df9e0299	2026-08-17T09:58:46.099914+00:00	parameter tying	99.000000%	1596	keep	Union closest shared-QKV scalar groups 385 and 662	Family: parameter tying. Current retained frontier is 1,597 parameters at 99.000000%, a +0.000000 percentage-point margin over 99%. There have been 62 prior macro-attempts in this family and 538 prior micro-trials. The most recent accepted result is attempt-0163/micro-0002 at 1,597 parameters and 99.00%; the most recent failed result is attempt-0164/micro-0001 (QKV pair 661/747 discarded at 98.99%). This is a parameterization-preserving compression of the depth-shared QKV transform: union flattened coordinates 385 and 662, whose learned values are -0.1080017611 and -0.1078363732 (difference 1.654e-04), with a multiplicity-weighted mean and integer reconstruction map. Hypothesis: the much larger attention tensor contains near-duplicate scalars below the token failure scale, so this union preserves qualification and yields 1,596 parameters. It is more informative than the next QKV union (difference 1.657e-04) because it is the minimum-distortion test at this new site. Acceptance and rollback remain solely governed by the official runner.	0	0
attempt-0165	qkv-final-two-failure-plateau-check	micro-0002	87ff47c67e3d3d025f4bb2ce6f5dd57d95495100	0748239d07dcc503cb5d2ba9c8e254545ad32520	2026-08-17T09:59:59.852939+00:00	parameter tying	98.990000%	1595	discard	Union closest shared-QKV scalar groups 571 and 651	Family: parameter tying. Current retained frontier is 1,596 parameters at 99.000000%, a +0.000000 percentage-point margin over 99%. There have been 62 prior macro-attempts in this family and 539 prior micro-trials. The most recent accepted result is attempt-0163/micro-0002 at 1,597 parameters and 99.00%; the most recent failed result is attempt-0164/micro-0001 (QKV pair 661/747 discarded at 98.99%). This is a parameterization-preserving compression of the depth-shared QKV transform: union flattened coordinates 571 and 651, whose learned values are 0.0017924109 and 0.0019581029 (difference 1.657e-04), with a multiplicity-weighted mean and integer reconstruction map. Hypothesis: the much larger attention tensor contains near-duplicate scalars below the token failure scale, so this union preserves qualification and yields 1,595 parameters. It is more informative than the next QKV union (difference 1.696e-04) because it is the minimum-distortion test at this new site. Acceptance and rollback remain solely governed by the official runner.	0	0
attempt-0166	ff-output-skip-sensitive-pair	micro-0001	61b1bbe9d0af881a26e7ca81b23d1a26f7b966b7	0748239d07dcc503cb5d2ba9c8e254545ad32520	2026-08-17T10:02:11.330917+00:00	parameter tying	99.010000%	1595	keep	Union closest shared FF-output scalar groups 214 and 9	Family: parameter tying. Current retained frontier is 1,596 parameters at 99.000000%, a +0.000000 percentage-point margin over 99%. There have been 63 prior macro-attempts in this family and 540 prior micro-trials. The most recent accepted result is attempt-0165/micro-0001 at 1,596 parameters and 99.00%; the most recent failed result is attempt-0165/micro-0002 (QKV pair 571/651 discarded at 98.99%). This is a parameterization-preserving compression of the depth-shared feed-forward output map: union flattened coordinates 214 and 9, values 0.0147994803 and 0.0149607537 (difference 1.613e-04), using a weighted mean and integer reconstruction. Hypothesis: residual-stream reconstruction contains near-duplicate scalars distinct from FF-input redundancy, preserving qualification at 1,595 parameters. It is more informative than the next FF-output union (difference 1.625e-04) because it is the minimum-distortion isolated test of the complementary FF map. Official acceptance and rollback are unchanged.	0	0
attempt-0166	ff-output-skip-sensitive-pair	micro-0002	d0b95f88938491e0465adfcf04f5681b406f5006	61b1bbe9d0af881a26e7ca81b23d1a26f7b966b7	2026-08-17T10:03:24.340372+00:00	parameter tying	99.040000%	1594	keep	Union closest shared FF-output scalar groups 63 and 83	Family: parameter tying. Current retained frontier is 1,595 parameters at 99.010000%, a +0.010000 percentage-point margin over 99%. There have been 63 prior macro-attempts in this family and 541 prior micro-trials. The most recent accepted result is attempt-0165/micro-0001 at 1,596 parameters and 99.00%; the most recent failed result is attempt-0165/micro-0002 (QKV pair 571/651 discarded at 98.99%). This is a parameterization-preserving compression of the depth-shared feed-forward output map: union flattened coordinates 63 and 83, values -0.0253817327 and -0.0252192076 (difference 1.625e-04), using a weighted mean and integer reconstruction. Hypothesis: residual-stream reconstruction contains near-duplicate scalars distinct from FF-input redundancy, preserving qualification at 1,594 parameters. It is more informative than the next FF-output union (difference 1.635e-04) because it is the minimum-distortion isolated test of the complementary FF map. Official acceptance and rollback are unchanged.	0	0
attempt-0166	ff-output-skip-sensitive-pair	micro-0003	77a94862731ad45691397fdc8ddfe82ae003ec89	d0b95f88938491e0465adfcf04f5681b406f5006	2026-08-17T10:04:39.171268+00:00	parameter tying	99.040000%	1593	keep	Union closest shared FF-output scalar groups 77 and 200	Family: parameter tying. Current retained frontier is 1,594 parameters at 99.040000%, a +0.040000 percentage-point margin over 99%. There have been 63 prior macro-attempts in this family and 542 prior micro-trials. The most recent accepted result is attempt-0165/micro-0001 at 1,596 parameters and 99.00%; the most recent failed result is attempt-0165/micro-0002 (QKV pair 571/651 discarded at 98.99%). This is a parameterization-preserving compression of the depth-shared feed-forward output map: union flattened coordinates 77 and 200, values -0.0088192206 and -0.0086557502 (difference 1.635e-04), using a weighted mean and integer reconstruction. Hypothesis: residual-stream reconstruction contains near-duplicate scalars distinct from FF-input redundancy, preserving qualification at 1,593 parameters. It is more informative than the next FF-output union (difference 1.792e-04) because it is the minimum-distortion isolated test of the complementary FF map. Official acceptance and rollback are unchanged.	0	0
attempt-0166	ff-output-skip-sensitive-pair	micro-0004	567eeb9162f5a2da2146f37f96658cef89f9551b	77a94862731ad45691397fdc8ddfe82ae003ec89	2026-08-17T10:05:51.672975+00:00	parameter tying	99.020000%	1592	keep	Union closest shared FF-output scalar groups 10 and 197	Family: parameter tying. Current retained frontier is 1,593 parameters at 99.040000%, a +0.040000 percentage-point margin over 99%. There have been 63 prior macro-attempts in this family and 543 prior micro-trials. The most recent accepted result is attempt-0165/micro-0001 at 1,596 parameters and 99.00%; the most recent failed result is attempt-0165/micro-0002 (QKV pair 571/651 discarded at 98.99%). This is a parameterization-preserving compression of the depth-shared feed-forward output map: union flattened coordinates 10 and 197, values 0.0250107273 and 0.0251899511 (difference 1.792e-04), using a weighted mean and integer reconstruction. Hypothesis: residual-stream reconstruction contains near-duplicate scalars distinct from FF-input redundancy, preserving qualification at 1,592 parameters. It is more informative than the next FF-output union (difference 1.858e-04) because it is the minimum-distortion isolated test of the complementary FF map. Official acceptance and rollback are unchanged.	0	0
attempt-0166	ff-output-skip-sensitive-pair	micro-0005	671e592bdde2f864e102d95cda642d38e3712690	567eeb9162f5a2da2146f37f96658cef89f9551b	2026-08-17T10:07:04.800077+00:00	parameter tying	99.040000%	1591	keep	Union closest shared FF-output scalar groups 99 and 169	Family: parameter tying. Current retained frontier is 1,592 parameters at 99.020000%, a +0.020000 percentage-point margin over 99%. There have been 63 prior macro-attempts in this family and 544 prior micro-trials. The most recent accepted result is attempt-0165/micro-0001 at 1,596 parameters and 99.00%; the most recent failed result is attempt-0165/micro-0002 (QKV pair 571/651 discarded at 98.99%). This is a parameterization-preserving compression of the depth-shared feed-forward output map: union flattened coordinates 99 and 169, values -0.1302311122 and -0.1300453097 (difference 1.858e-04), using a weighted mean and integer reconstruction. Hypothesis: residual-stream reconstruction contains near-duplicate scalars distinct from FF-input redundancy, preserving qualification at 1,591 parameters. It is more informative than the next FF-output union (difference 1.867e-04) because it is the minimum-distortion isolated test of the complementary FF map. Official acceptance and rollback are unchanged.	0	0
attempt-0166	ff-output-skip-sensitive-pair	micro-0006	a7cc9394a6258e9e469ff4e65bb344b32b3eb7ec	671e592bdde2f864e102d95cda642d38e3712690	2026-08-17T10:08:16.014136+00:00	parameter tying	99.020000%	1590	keep	Union closest shared FF-output scalar groups 16 and 17	Family: parameter tying. Current retained frontier is 1,591 parameters at 99.040000%, a +0.040000 percentage-point margin over 99%. There have been 63 prior macro-attempts in this family and 545 prior micro-trials. The most recent accepted result is attempt-0165/micro-0001 at 1,596 parameters and 99.00%; the most recent failed result is attempt-0165/micro-0002 (QKV pair 571/651 discarded at 98.99%). This is a parameterization-preserving compression of the depth-shared feed-forward output map: union flattened coordinates 16 and 17, values 0.0383275412 and 0.0385142118 (difference 1.867e-04), using a weighted mean and integer reconstruction. Hypothesis: residual-stream reconstruction contains near-duplicate scalars distinct from FF-input redundancy, preserving qualification at 1,590 parameters. It is more informative than the next FF-output union (difference 2.014e-04) because it is the minimum-distortion isolated test of the complementary FF map. Official acceptance and rollback are unchanged.	0	0
attempt-0166	ff-output-skip-sensitive-pair	micro-0007	d16e2027fedc068ebe7dc1f082b58576d9cd28f3	a7cc9394a6258e9e469ff4e65bb344b32b3eb7ec	2026-08-17T10:09:28.592055+00:00	parameter tying	98.980000%	1589	discard	Union closest shared FF-output scalar groups 13 and 188	Family: parameter tying. Current retained frontier is 1,590 parameters at 99.020000%, a +0.020000 percentage-point margin over 99%. There have been 63 prior macro-attempts in this family and 546 prior micro-trials. The most recent accepted result is attempt-0165/micro-0001 at 1,596 parameters and 99.00%; the most recent failed result is attempt-0165/micro-0002 (QKV pair 571/651 discarded at 98.99%). This is a parameterization-preserving compression of the depth-shared feed-forward output map: union flattened coordinates 13 and 188, values -0.0195224322 and -0.0193210728 (difference 2.014e-04), using a weighted mean and integer reconstruction. Hypothesis: residual-stream reconstruction contains near-duplicate scalars distinct from FF-input redundancy, preserving qualification at 1,589 parameters. It is more informative than the next FF-output union (difference 2.032e-04) because it is the minimum-distortion isolated test of the complementary FF map. Official acceptance and rollback are unchanged.	0	0
attempt-0167	ff-output-skip-two-sensitive-pairs	micro-0001	026283e3d76585ba5a7fc340f25ad102e7745a59	a7cc9394a6258e9e469ff4e65bb344b32b3eb7ec	2026-08-17T10:11:19.697555+00:00	parameter tying	98.960000%	1589	discard	Union closest shared FF-output scalar groups 180 and 59	Family: parameter tying. Current retained frontier is 1,590 parameters at 99.020000%, a +0.020000 percentage-point margin over 99%. There have been 64 prior macro-attempts in this family and 547 prior micro-trials. The most recent accepted result is attempt-0166/micro-0006 at 1,590 parameters and 99.02%; the most recent failed result is attempt-0166/micro-0007 (FF-output pair 13/188 discarded at 98.98%). This is a parameterization-preserving compression of the depth-shared feed-forward output map: union flattened coordinates 180 and 59, values -0.0278803911 and -0.0276771858 (difference 2.032e-04), using a weighted mean and integer reconstruction. Hypothesis: residual-stream reconstruction contains near-duplicate scalars distinct from FF-input redundancy, preserving qualification at 1,589 parameters. It is more informative than the next FF-output union (difference 2.078e-04) because it is the minimum-distortion isolated test of the complementary FF map. Official acceptance and rollback are unchanged.	0	0
attempt-0168	ff-output-final-plateau-check	micro-0001	2eeaf3d7f2d70a83f86eef65a3fe7cab16ce9869	a7cc9394a6258e9e469ff4e65bb344b32b3eb7ec	2026-08-17T10:13:36.600743+00:00	parameter tying	99.000000%	1589	keep	Union closest shared FF-output scalar groups 208 and 218	Family: parameter tying. Current retained frontier is 1,590 parameters at 99.020000%, a +0.020000 percentage-point margin over 99%. There have been 65 prior macro-attempts in this family and 548 prior micro-trials. The most recent accepted result is attempt-0166/micro-0006 at 1,590 parameters and 99.02%; the most recent failed result is attempt-0167/micro-0001 (FF-output pair 180/59 discarded at 98.96%). This is a parameterization-preserving compression of the depth-shared feed-forward output map: union flattened coordinates 208 and 218, values -0.0474367738 and -0.0472290181 (difference 2.078e-04), using a weighted mean and integer reconstruction. Hypothesis: residual-stream reconstruction contains near-duplicate scalars distinct from FF-input redundancy, preserving qualification at 1,589 parameters. It is more informative than the next FF-output union (difference 2.129e-04) because it is the minimum-distortion isolated test of the complementary FF map. Official acceptance and rollback are unchanged.	0	0
attempt-0168	ff-output-final-plateau-check	micro-0002	b2c7a59ba8442fdba8008c72bac01ff64c6f8f8a	2eeaf3d7f2d70a83f86eef65a3fe7cab16ce9869	2026-08-17T10:14:49.996576+00:00	parameter tying	99.010000%	1588	keep	Union closest shared FF-output scalar groups 199 and 13	Family: parameter tying. Current retained frontier is 1,589 parameters at 99.000000%, a +0.000000 percentage-point margin over 99%. There have been 65 prior macro-attempts in this family and 549 prior micro-trials. The most recent accepted result is attempt-0166/micro-0006 at 1,590 parameters and 99.02%; the most recent failed result is attempt-0167/micro-0001 (FF-output pair 180/59 discarded at 98.96%). This is a parameterization-preserving compression of the depth-shared feed-forward output map: union flattened coordinates 199 and 13, values -0.0197353363 and -0.0195224322 (difference 2.129e-04), using a weighted mean and integer reconstruction. Hypothesis: residual-stream reconstruction contains near-duplicate scalars distinct from FF-input redundancy, preserving qualification at 1,588 parameters. It is more informative than the next FF-output union (difference 2.134e-04) because it is the minimum-distortion isolated test of the complementary FF map. Official acceptance and rollback are unchanged.	0	0
attempt-0168	ff-output-final-plateau-check	micro-0003	59f99ad01b4e33546029db3b0411cca7f2543691	b2c7a59ba8442fdba8008c72bac01ff64c6f8f8a	2026-08-17T10:16:03.268750+00:00	parameter tying	99.010000%	1587	keep	Union closest shared FF-output scalar groups 67 and 97	Family: parameter tying. Current retained frontier is 1,588 parameters at 99.010000%, a +0.010000 percentage-point margin over 99%. There have been 65 prior macro-attempts in this family and 550 prior micro-trials. The most recent accepted result is attempt-0166/micro-0006 at 1,590 parameters and 99.02%; the most recent failed result is attempt-0167/micro-0001 (FF-output pair 180/59 discarded at 98.96%). This is a parameterization-preserving compression of the depth-shared feed-forward output map: union flattened coordinates 67 and 97, values 0.0039833756 and 0.0041968096 (difference 2.134e-04), using a weighted mean and integer reconstruction. Hypothesis: residual-stream reconstruction contains near-duplicate scalars distinct from FF-input redundancy, preserving qualification at 1,587 parameters. It is more informative than the next FF-output union (difference 2.139e-04) because it is the minimum-distortion isolated test of the complementary FF map. Official acceptance and rollback are unchanged.	0	0
attempt-0168	ff-output-final-plateau-check	micro-0004	3bd65bc6a0e8f2d103841ceb9048b6ce68906426	59f99ad01b4e33546029db3b0411cca7f2543691	2026-08-17T10:17:17.649066+00:00	parameter tying	99.020000%	1586	keep	Union closest shared FF-output scalar groups 56 and 64	Family: parameter tying. Current retained frontier is 1,587 parameters at 99.010000%, a +0.010000 percentage-point margin over 99%. There have been 65 prior macro-attempts in this family and 551 prior micro-trials. The most recent accepted result is attempt-0166/micro-0006 at 1,590 parameters and 99.02%; the most recent failed result is attempt-0167/micro-0001 (FF-output pair 180/59 discarded at 98.96%). This is a parameterization-preserving compression of the depth-shared feed-forward output map: union flattened coordinates 56 and 64, values -0.0082456674 and -0.0080317799 (difference 2.139e-04), using a weighted mean and integer reconstruction. Hypothesis: residual-stream reconstruction contains near-duplicate scalars distinct from FF-input redundancy, preserving qualification at 1,586 parameters. It is more informative than the next FF-output union (difference 2.184e-04) because it is the minimum-distortion isolated test of the complementary FF map. Official acceptance and rollback are unchanged.	0	0
attempt-0168	ff-output-final-plateau-check	micro-0005	4cabe4d1fe958ef585726ce2d4c6d9d0a37a9bda	3bd65bc6a0e8f2d103841ceb9048b6ce68906426	2026-08-17T10:18:31.884352+00:00	parameter tying	98.990000%	1585	discard	Union closest shared FF-output scalar groups 183 and 223	Family: parameter tying. Current retained frontier is 1,586 parameters at 99.020000%, a +0.020000 percentage-point margin over 99%. There have been 65 prior macro-attempts in this family and 552 prior micro-trials. The most recent accepted result is attempt-0166/micro-0006 at 1,590 parameters and 99.02%; the most recent failed result is attempt-0167/micro-0001 (FF-output pair 180/59 discarded at 98.96%). This is a parameterization-preserving compression of the depth-shared feed-forward output map: union flattened coordinates 183 and 223, values 0.0255113114 and 0.0257297587 (difference 2.184e-04), using a weighted mean and integer reconstruction. Hypothesis: residual-stream reconstruction contains near-duplicate scalars distinct from FF-input redundancy, preserving qualification at 1,585 parameters. It is more informative than the next FF-output union (difference 2.225e-04) because it is the minimum-distortion isolated test of the complementary FF map. Official acceptance and rollback are unchanged.	0	0
