macro_attempt_id	automation_id	micro_attempt_id	commit	parent_commit	timestamp_utc	family	accuracy	parameters	status	description	proposal	train_exit	verify_exit
attempt-0157	qkv-skip-five-sensitive-pairs	micro-0002	b6af1c02b3352ab55f492fa443b81e70ad08400f	98f23e74adad05b5f8dc39b2cf674e4f08039fb6	2026-08-17T08:52:06.756238+00:00	parameter tying	99.000000%	1637	keep	Union closest shared-QKV scalar groups 171 and 12	Family: parameter tying. Current retained frontier is 1,638 parameters at 99.000000%, a +0.000000 percentage-point margin over 99%. There have been 54 prior macro-attempts in this family and 489 prior micro-trials. The most recent accepted result is attempt-0155/micro-0001 at 1,639 parameters and 99.00%; the most recent failed result is attempt-0156/micro-0001 (QKV pair 672/271 discarded at 98.99%). This is a parameterization-preserving compression of the depth-shared QKV transform: union flattened coordinates 171 and 12, whose learned values are -0.5432264209 and -0.5431438684 (difference 8.255e-05), with a multiplicity-weighted mean and integer reconstruction map. Hypothesis: the much larger attention tensor contains near-duplicate scalars below the token failure scale, so this union preserves qualification and yields 1,637 parameters. It is more informative than the next QKV union (difference 8.278e-05) because it is the minimum-distortion test at this new site. Acceptance and rollback remain solely governed by the official runner.	0	0
attempt-0157	qkv-skip-five-sensitive-pairs	micro-0003	ea0de2454aae5627a7cca75e7e3d406a3cee07db	b6af1c02b3352ab55f492fa443b81e70ad08400f	2026-08-17T08:53:21.386255+00:00	parameter tying	99.000000%	1636	keep	Union closest shared-QKV scalar groups 573 and 665	Family: parameter tying. Current retained frontier is 1,637 parameters at 99.000000%, a +0.000000 percentage-point margin over 99%. There have been 54 prior macro-attempts in this family and 490 prior micro-trials. The most recent accepted result is attempt-0155/micro-0001 at 1,639 parameters and 99.00%; the most recent failed result is attempt-0156/micro-0001 (QKV pair 672/271 discarded at 98.99%). This is a parameterization-preserving compression of the depth-shared QKV transform: union flattened coordinates 573 and 665, whose learned values are -0.1043574437 and -0.1042746678 (difference 8.278e-05), with a multiplicity-weighted mean and integer reconstruction map. Hypothesis: the much larger attention tensor contains near-duplicate scalars below the token failure scale, so this union preserves qualification and yields 1,636 parameters. It is more informative than the next QKV union (difference 8.509e-05) because it is the minimum-distortion test at this new site. Acceptance and rollback remain solely governed by the official runner.	0	0
attempt-0157	qkv-skip-five-sensitive-pairs	micro-0004	0f9beef324b4e76535fbcb6cae8ee334f4231d64	ea0de2454aae5627a7cca75e7e3d406a3cee07db	2026-08-17T08:54:34.056762+00:00	parameter tying	99.000000%	1635	keep	Union closest shared-QKV scalar groups 127 and 616	Family: parameter tying. Current retained frontier is 1,636 parameters at 99.000000%, a +0.000000 percentage-point margin over 99%. There have been 54 prior macro-attempts in this family and 491 prior micro-trials. The most recent accepted result is attempt-0155/micro-0001 at 1,639 parameters and 99.00%; the most recent failed result is attempt-0156/micro-0001 (QKV pair 672/271 discarded at 98.99%). This is a parameterization-preserving compression of the depth-shared QKV transform: union flattened coordinates 127 and 616, whose learned values are 0.0085968459 and 0.0086819399 (difference 8.509e-05), with a multiplicity-weighted mean and integer reconstruction map. Hypothesis: the much larger attention tensor contains near-duplicate scalars below the token failure scale, so this union preserves qualification and yields 1,635 parameters. It is more informative than the next QKV union (difference 8.520e-05) because it is the minimum-distortion test at this new site. Acceptance and rollback remain solely governed by the official runner.	0	0
attempt-0157	qkv-skip-five-sensitive-pairs	micro-0005	40d15d057c31b39ff9c518826da72a50e99994f0	0f9beef324b4e76535fbcb6cae8ee334f4231d64	2026-08-17T08:55:49.101190+00:00	parameter tying	98.970000%	1634	discard	Union closest shared-QKV scalar groups 422 and 723	Family: parameter tying. Current retained frontier is 1,635 parameters at 99.000000%, a +0.000000 percentage-point margin over 99%. There have been 54 prior macro-attempts in this family and 492 prior micro-trials. The most recent accepted result is attempt-0155/micro-0001 at 1,639 parameters and 99.00%; the most recent failed result is attempt-0156/micro-0001 (QKV pair 672/271 discarded at 98.99%). This is a parameterization-preserving compression of the depth-shared QKV transform: union flattened coordinates 422 and 723, whose learned values are 0.0216916297 and 0.0217768345 (difference 8.520e-05), with a multiplicity-weighted mean and integer reconstruction map. Hypothesis: the much larger attention tensor contains near-duplicate scalars below the token failure scale, so this union preserves qualification and yields 1,634 parameters. It is more informative than the next QKV union (difference 8.620e-05) because it is the minimum-distortion test at this new site. Acceptance and rollback remain solely governed by the official runner.	0	0
attempt-0158	qkv-skip-six-sensitive-pairs	micro-0001	03dfd19665c0587ae3f7be11c6c6712edd6bdf69	0f9beef324b4e76535fbcb6cae8ee334f4231d64	2026-08-17T08:57:42.346123+00:00	parameter tying	99.000000%	1634	keep	Union closest shared-QKV scalar groups 294 and 730	Family: parameter tying. Current retained frontier is 1,635 parameters at 99.000000%, a +0.000000 percentage-point margin over 99%. There have been 55 prior macro-attempts in this family and 493 prior micro-trials. The most recent accepted result is attempt-0157/micro-0004 at 1,635 parameters and 99.00%; the most recent failed result is attempt-0157/micro-0005 (QKV pair 422/723 discarded at 98.97%). This is a parameterization-preserving compression of the depth-shared QKV transform: union flattened coordinates 294 and 730, whose learned values are -0.0204411969 and -0.0203549992 (difference 8.620e-05), with a multiplicity-weighted mean and integer reconstruction map. Hypothesis: the much larger attention tensor contains near-duplicate scalars below the token failure scale, so this union preserves qualification and yields 1,634 parameters. It is more informative than the next QKV union (difference 8.831e-05) because it is the minimum-distortion test at this new site. Acceptance and rollback remain solely governed by the official runner.	0	0
attempt-0158	qkv-skip-six-sensitive-pairs	micro-0002	4d43f93bc2f7b5700cd11d798359bbce90568b25	03dfd19665c0587ae3f7be11c6c6712edd6bdf69	2026-08-17T08:59:01.443687+00:00	parameter tying	99.000000%	1633	keep	Union closest shared-QKV scalar groups 78 and 537	Family: parameter tying. Current retained frontier is 1,634 parameters at 99.000000%, a +0.000000 percentage-point margin over 99%. There have been 55 prior macro-attempts in this family and 494 prior micro-trials. The most recent accepted result is attempt-0157/micro-0004 at 1,635 parameters and 99.00%; the most recent failed result is attempt-0157/micro-0005 (QKV pair 422/723 discarded at 98.97%). This is a parameterization-preserving compression of the depth-shared QKV transform: union flattened coordinates 78 and 537, whose learned values are 0.0162106566 and 0.0162989646 (difference 8.831e-05), with a multiplicity-weighted mean and integer reconstruction map. Hypothesis: the much larger attention tensor contains near-duplicate scalars below the token failure scale, so this union preserves qualification and yields 1,633 parameters. It is more informative than the next QKV union (difference 9.133e-05) because it is the minimum-distortion test at this new site. Acceptance and rollback remain solely governed by the official runner.	0	0
attempt-0158	qkv-skip-six-sensitive-pairs	micro-0003	7b676496ac36a0560b693af34bb0a5a402b7faee	4d43f93bc2f7b5700cd11d798359bbce90568b25	2026-08-17T09:00:14.064213+00:00	parameter tying	98.970000%	1632	discard	Union closest shared-QKV scalar groups 722 and 588	Family: parameter tying. Current retained frontier is 1,633 parameters at 99.000000%, a +0.000000 percentage-point margin over 99%. There have been 55 prior macro-attempts in this family and 495 prior micro-trials. The most recent accepted result is attempt-0157/micro-0004 at 1,635 parameters and 99.00%; the most recent failed result is attempt-0157/micro-0005 (QKV pair 422/723 discarded at 98.97%). This is a parameterization-preserving compression of the depth-shared QKV transform: union flattened coordinates 722 and 588, whose learned values are 0.0059133717 and 0.0060047032 (difference 9.133e-05), with a multiplicity-weighted mean and integer reconstruction map. Hypothesis: the much larger attention tensor contains near-duplicate scalars below the token failure scale, so this union preserves qualification and yields 1,632 parameters. It is more informative than the next QKV union (difference 9.304e-05) because it is the minimum-distortion test at this new site. Acceptance and rollback remain solely governed by the official runner.	0	0
attempt-0159	qkv-skip-seven-sensitive-pairs	micro-0001	817fa9e787aa2c5b0c85a9b82539d990d53fd1a7	4d43f93bc2f7b5700cd11d798359bbce90568b25	2026-08-17T09:02:02.355628+00:00	parameter tying	99.000000%	1632	keep	Union closest shared-QKV scalar groups 436 and 456	Family: parameter tying. Current retained frontier is 1,633 parameters at 99.000000%, a +0.000000 percentage-point margin over 99%. There have been 56 prior macro-attempts in this family and 496 prior micro-trials. The most recent accepted result is attempt-0158/micro-0002 at 1,633 parameters and 99.00%; the most recent failed result is attempt-0158/micro-0003 (QKV pair 722/588 discarded at 98.97%). This is a parameterization-preserving compression of the depth-shared QKV transform: union flattened coordinates 436 and 456, whose learned values are 0.5705673099 and 0.5706603527 (difference 9.304e-05), with a multiplicity-weighted mean and integer reconstruction map. Hypothesis: the much larger attention tensor contains near-duplicate scalars below the token failure scale, so this union preserves qualification and yields 1,632 parameters. It is more informative than the next QKV union (difference 9.325e-05) because it is the minimum-distortion test at this new site. Acceptance and rollback remain solely governed by the official runner.	0	0
attempt-0159	qkv-skip-seven-sensitive-pairs	micro-0002	09413200db8034d3cfd3d872d772258e59834805	817fa9e787aa2c5b0c85a9b82539d990d53fd1a7	2026-08-17T09:03:15.502698+00:00	parameter tying	99.020000%	1631	keep	Union closest shared-QKV scalar groups 743 and 565	Family: parameter tying. Current retained frontier is 1,632 parameters at 99.000000%, a +0.000000 percentage-point margin over 99%. There have been 56 prior macro-attempts in this family and 497 prior micro-trials. The most recent accepted result is attempt-0158/micro-0002 at 1,633 parameters and 99.00%; the most recent failed result is attempt-0158/micro-0003 (QKV pair 722/588 discarded at 98.97%). This is a parameterization-preserving compression of the depth-shared QKV transform: union flattened coordinates 743 and 565, whose learned values are 0.0006605315 and 0.0007537865 (difference 9.325e-05), with a multiplicity-weighted mean and integer reconstruction map. Hypothesis: the much larger attention tensor contains near-duplicate scalars below the token failure scale, so this union preserves qualification and yields 1,631 parameters. It is more informative than the next QKV union (difference 9.608e-05) because it is the minimum-distortion test at this new site. Acceptance and rollback remain solely governed by the official runner.	0	0
attempt-0159	qkv-skip-seven-sensitive-pairs	micro-0003	2726a4cf9f9c13e1c36ccb55f7b87aa8e1b3c06c	09413200db8034d3cfd3d872d772258e59834805	2026-08-17T09:04:27.949047+00:00	parameter tying	99.020000%	1630	keep	Union closest shared-QKV scalar groups 675 and 575	Family: parameter tying. Current retained frontier is 1,631 parameters at 99.020000%, a +0.020000 percentage-point margin over 99%. There have been 56 prior macro-attempts in this family and 498 prior micro-trials. The most recent accepted result is attempt-0158/micro-0002 at 1,633 parameters and 99.00%; the most recent failed result is attempt-0158/micro-0003 (QKV pair 722/588 discarded at 98.97%). This is a parameterization-preserving compression of the depth-shared QKV transform: union flattened coordinates 675 and 575, whose learned values are 0.0712819695 and 0.0713780522 (difference 9.608e-05), with a multiplicity-weighted mean and integer reconstruction map. Hypothesis: the much larger attention tensor contains near-duplicate scalars below the token failure scale, so this union preserves qualification and yields 1,630 parameters. It is more informative than the next QKV union (difference 9.647e-05) because it is the minimum-distortion test at this new site. Acceptance and rollback remain solely governed by the official runner.	0	0
attempt-0159	qkv-skip-seven-sensitive-pairs	micro-0004	d263af77792b17a4fb8ccfe5ac0acb42cb36b6e1	2726a4cf9f9c13e1c36ccb55f7b87aa8e1b3c06c	2026-08-17T09:05:40.780047+00:00	parameter tying	99.040000%	1629	keep	Union closest shared-QKV scalar groups 481 and 580	Family: parameter tying. Current retained frontier is 1,630 parameters at 99.020000%, a +0.020000 percentage-point margin over 99%. There have been 56 prior macro-attempts in this family and 499 prior micro-trials. The most recent accepted result is attempt-0158/micro-0002 at 1,633 parameters and 99.00%; the most recent failed result is attempt-0158/micro-0003 (QKV pair 722/588 discarded at 98.97%). This is a parameterization-preserving compression of the depth-shared QKV transform: union flattened coordinates 481 and 580, whose learned values are 0.0056560640 and 0.0057525379 (difference 9.647e-05), with a multiplicity-weighted mean and integer reconstruction map. Hypothesis: the much larger attention tensor contains near-duplicate scalars below the token failure scale, so this union preserves qualification and yields 1,629 parameters. It is more informative than the next QKV union (difference 9.730e-05) because it is the minimum-distortion test at this new site. Acceptance and rollback remain solely governed by the official runner.	0	0
attempt-0159	qkv-skip-seven-sensitive-pairs	micro-0005	32d1d9bb4503c24013277b3a0d09819429d4f380	d263af77792b17a4fb8ccfe5ac0acb42cb36b6e1	2026-08-17T09:06:54.853945+00:00	parameter tying	99.030000%	1628	keep	Union closest shared-QKV scalar groups 660 and 103	Family: parameter tying. Current retained frontier is 1,629 parameters at 99.040000%, a +0.040000 percentage-point margin over 99%. There have been 56 prior macro-attempts in this family and 500 prior micro-trials. The most recent accepted result is attempt-0158/micro-0002 at 1,633 parameters and 99.00%; the most recent failed result is attempt-0158/micro-0003 (QKV pair 722/588 discarded at 98.97%). This is a parameterization-preserving compression of the depth-shared QKV transform: union flattened coordinates 660 and 103, whose learned values are -0.0027828654 and -0.0026855627 (difference 9.730e-05), with a multiplicity-weighted mean and integer reconstruction map. Hypothesis: the much larger attention tensor contains near-duplicate scalars below the token failure scale, so this union preserves qualification and yields 1,628 parameters. It is more informative than the next QKV union (difference 9.835e-05) because it is the minimum-distortion test at this new site. Acceptance and rollback remain solely governed by the official runner.	0	0
attempt-0159	qkv-skip-seven-sensitive-pairs	micro-0006	1bf8439ba88618cc8eb01eb4465a8033a6562ad1	32d1d9bb4503c24013277b3a0d09819429d4f380	2026-08-17T09:08:09.700744+00:00	parameter tying	99.060000%	1627	keep	Union closest shared-QKV scalar groups 571 and 602	Family: parameter tying. Current retained frontier is 1,628 parameters at 99.030000%, a +0.030000 percentage-point margin over 99%. There have been 56 prior macro-attempts in this family and 501 prior micro-trials. The most recent accepted result is attempt-0158/micro-0002 at 1,633 parameters and 99.00%; the most recent failed result is attempt-0158/micro-0003 (QKV pair 722/588 discarded at 98.97%). This is a parameterization-preserving compression of the depth-shared QKV transform: union flattened coordinates 571 and 602, whose learned values are 0.0017432360 and 0.0018415859 (difference 9.835e-05), with a multiplicity-weighted mean and integer reconstruction map. Hypothesis: the much larger attention tensor contains near-duplicate scalars below the token failure scale, so this union preserves qualification and yields 1,627 parameters. It is more informative than the next QKV union (difference 9.845e-05) because it is the minimum-distortion test at this new site. Acceptance and rollback remain solely governed by the official runner.	0	0
attempt-0159	qkv-skip-seven-sensitive-pairs	micro-0007	ffccaaad4133e3282f5c7ce82eb138b97d5bd4d9	1bf8439ba88618cc8eb01eb4465a8033a6562ad1	2026-08-17T09:09:36.701076+00:00	parameter tying	99.050000%	1626	keep	Union closest shared-QKV scalar groups 609 and 303	Family: parameter tying. Current retained frontier is 1,627 parameters at 99.060000%, a +0.060000 percentage-point margin over 99%. There have been 56 prior macro-attempts in this family and 502 prior micro-trials. The most recent accepted result is attempt-0158/micro-0002 at 1,633 parameters and 99.00%; the most recent failed result is attempt-0158/micro-0003 (QKV pair 722/588 discarded at 98.97%). This is a parameterization-preserving compression of the depth-shared QKV transform: union flattened coordinates 609 and 303, whose learned values are -0.0054737623 and -0.0053753085 (difference 9.845e-05), with a multiplicity-weighted mean and integer reconstruction map. Hypothesis: the much larger attention tensor contains near-duplicate scalars below the token failure scale, so this union preserves qualification and yields 1,626 parameters. It is more informative than the next QKV union (difference 9.855e-05) because it is the minimum-distortion test at this new site. Acceptance and rollback remain solely governed by the official runner.	0	0
attempt-0159	qkv-skip-seven-sensitive-pairs	micro-0008	4c467fc8b3fbd73519fb18bdf1e4c5e13b28bf0a	ffccaaad4133e3282f5c7ce82eb138b97d5bd4d9	2026-08-17T09:10:53.465930+00:00	parameter tying	99.040000%	1625	keep	Union closest shared-QKV scalar groups 532 and 517	Family: parameter tying. Current retained frontier is 1,626 parameters at 99.050000%, a +0.050000 percentage-point margin over 99%. There have been 56 prior macro-attempts in this family and 503 prior micro-trials. The most recent accepted result is attempt-0158/micro-0002 at 1,633 parameters and 99.00%; the most recent failed result is attempt-0158/micro-0003 (QKV pair 722/588 discarded at 98.97%). This is a parameterization-preserving compression of the depth-shared QKV transform: union flattened coordinates 532 and 517, whose learned values are 0.0066435207 and 0.0067420714 (difference 9.855e-05), with a multiplicity-weighted mean and integer reconstruction map. Hypothesis: the much larger attention tensor contains near-duplicate scalars below the token failure scale, so this union preserves qualification and yields 1,625 parameters. It is more informative than the next QKV union (difference 9.975e-05) because it is the minimum-distortion test at this new site. Acceptance and rollback remain solely governed by the official runner.	0	0
attempt-0159	qkv-skip-seven-sensitive-pairs	micro-0009	77e3646e2e1dd2a87717bcb21b3d49c2058a4836	4c467fc8b3fbd73519fb18bdf1e4c5e13b28bf0a	2026-08-17T09:12:06.231358+00:00	parameter tying	99.040000%	1624	keep	Union closest shared-QKV scalar groups 466 and 274	Family: parameter tying. Current retained frontier is 1,625 parameters at 99.040000%, a +0.040000 percentage-point margin over 99%. There have been 56 prior macro-attempts in this family and 504 prior micro-trials. The most recent accepted result is attempt-0158/micro-0002 at 1,633 parameters and 99.00%; the most recent failed result is attempt-0158/micro-0003 (QKV pair 722/588 discarded at 98.97%). This is a parameterization-preserving compression of the depth-shared QKV transform: union flattened coordinates 466 and 274, whose learned values are -0.0593107939 and -0.0592110418 (difference 9.975e-05), with a multiplicity-weighted mean and integer reconstruction map. Hypothesis: the much larger attention tensor contains near-duplicate scalars below the token failure scale, so this union preserves qualification and yields 1,624 parameters. It is more informative than the next QKV union (difference 1.010e-04) because it is the minimum-distortion test at this new site. Acceptance and rollback remain solely governed by the official runner.	0	0
