macro_attempt_id	automation_id	micro_attempt_id	commit	parent_commit	timestamp_utc	family	accuracy	parameters	status	description	proposal	train_exit	verify_exit
attempt-0076	nearest-position-unions-repair	micro-0018	44ceb75f5660fe8d4d526750eaf8969ad020b1f5	8f174b4d6c9e724687573461c30ad77e875301c6	2026-08-16T09:11:52.206957+00:00	parameter tying	99.040000%	2087	keep	Union closest position groups 176 and 134	Family: parameter tying. Current retained frontier is 2,088 parameters at 99.040000%, a +0.040000 percentage-point margin over 99%. There have been 35 prior attempts in this family. The most recent accepted result is attempt-0076/micro-0017 at 2088 parameters and 99.040000%; the most recent failed result is attempt-0075/micro-0001 (error, no score). This is a parameterization-preserving compression: union current position groups represented by coordinates 176 and 134, whose learned values are -0.0016184105 and -0.0016061913 (absolute difference 1.222e-05), using a multiplicity-weighted mean. Hypothesis: this preserves qualification and yields 2,087 parameters. It is more informative than the nearest untested alternative (difference 1.270e-05) because it is the minimum-distortion eligible union; exact pairs already rejected under the unchanged grouping are excluded. Acceptance and rollback remain solely governed by the official runner.	0	0
attempt-0076	nearest-position-unions-repair	micro-0019	2687f36f6b1adad6a783a589dad193a83a020ee5	44ceb75f5660fe8d4d526750eaf8969ad020b1f5	2026-08-16T09:12:54.342300+00:00	parameter tying	99.040000%	2086	keep	Union closest position groups 379 and 223	Family: parameter tying. Current retained frontier is 2,087 parameters at 99.040000%, a +0.040000 percentage-point margin over 99%. There have been 36 prior attempts in this family. The most recent accepted result is attempt-0076/micro-0018 at 2087 parameters and 99.040000%; the most recent failed result is attempt-0075/micro-0001 (error, no score). This is a parameterization-preserving compression: union current position groups represented by coordinates 379 and 223, whose learned values are -0.0048395605 and -0.0048268624 (absolute difference 1.270e-05), using a multiplicity-weighted mean. Hypothesis: this preserves qualification and yields 2,086 parameters. It is more informative than the nearest untested alternative (difference 1.285e-05) because it is the minimum-distortion eligible union; exact pairs already rejected under the unchanged grouping are excluded. Acceptance and rollback remain solely governed by the official runner.	0	0
attempt-0076	nearest-position-unions-repair	micro-0020	91c23347ef536d769ead1c1934017082ebad35e0	2687f36f6b1adad6a783a589dad193a83a020ee5	2026-08-16T09:13:55.840001+00:00	parameter tying	99.040000%	2085	keep	Union closest position groups 7 and 465	Family: parameter tying. Current retained frontier is 2,086 parameters at 99.040000%, a +0.040000 percentage-point margin over 99%. There have been 37 prior attempts in this family. The most recent accepted result is attempt-0076/micro-0019 at 2086 parameters and 99.040000%; the most recent failed result is attempt-0075/micro-0001 (error, no score). This is a parameterization-preserving compression: union current position groups represented by coordinates 7 and 465, whose learned values are 0.0035159513 and 0.0035288008 (absolute difference 1.285e-05), using a multiplicity-weighted mean. Hypothesis: this preserves qualification and yields 2,085 parameters. It is more informative than the nearest untested alternative (difference 1.346e-05) because it is the minimum-distortion eligible union; exact pairs already rejected under the unchanged grouping are excluded. Acceptance and rollback remain solely governed by the official runner.	0	0
attempt-0078	nearest-position-unions-infra-repair	micro-0001	d631ff213771b4f93fea0a32973f85712d30e11f	6edffd5ebc428d9bff44da2632a74481fa540447	2026-08-16T20:57:04.276915+00:00	parameter tying	99.040000%	2084	keep	Union closest position groups 66 and 312	Family: parameter tying. Current retained frontier is 2,085 parameters at 99.050000%, a +0.050000 percentage-point margin over 99%. There have been 20 prior macro-attempts in this family and 21 prior micro-trials. The most recent accepted result is attempt-0076/micro-0020 at 2085 parameters and 99.040000%; the most recent failed result is attempt-0075/micro-0001 (error, no score). This is a parameterization-preserving compression: union current position groups represented by coordinates 66 and 312, whose learned values are -0.0118125025 and -0.0117990421 (absolute difference 1.346e-05), using a multiplicity-weighted mean. Hypothesis: this preserves qualification and yields 2,084 parameters. It is more informative than the nearest untested alternative (difference 1.516e-05) because it is the minimum-distortion eligible union; exact pairs already rejected under the unchanged grouping are excluded. Acceptance and rollback remain solely governed by the official runner.	0	0
attempt-0078	nearest-position-unions-infra-repair	micro-0002	df1c80d0efe6c30178710008d092c746e6d849ad	d631ff213771b4f93fea0a32973f85712d30e11f	2026-08-16T20:58:06.902194+00:00	parameter tying	99.040000%	2083	keep	Union closest position groups 64 and 330	Family: parameter tying. Current retained frontier is 2,084 parameters at 99.040000%, a +0.040000 percentage-point margin over 99%. There have been 20 prior macro-attempts in this family and 22 prior micro-trials. The most recent accepted result is attempt-0078/micro-0001 at 2084 parameters and 99.040000%; the most recent failed result is attempt-0075/micro-0001 (error, no score). This is a parameterization-preserving compression: union current position groups represented by coordinates 64 and 330, whose learned values are 0.0042936467 and 0.0043088091 (absolute difference 1.516e-05), using a multiplicity-weighted mean. Hypothesis: this preserves qualification and yields 2,083 parameters. It is more informative than the nearest untested alternative (difference 1.530e-05) because it is the minimum-distortion eligible union; exact pairs already rejected under the unchanged grouping are excluded. Acceptance and rollback remain solely governed by the official runner.	0	0
attempt-0078	nearest-position-unions-infra-repair	micro-0003	307536b344e3fc09e2a59c3ba0d0ed498df10a62	df1c80d0efe6c30178710008d092c746e6d849ad	2026-08-16T20:59:09.427799+00:00	parameter tying	99.040000%	2082	keep	Union closest position groups 233 and 306	Family: parameter tying. Current retained frontier is 2,083 parameters at 99.040000%, a +0.040000 percentage-point margin over 99%. There have been 20 prior macro-attempts in this family and 23 prior micro-trials. The most recent accepted result is attempt-0078/micro-0002 at 2083 parameters and 99.040000%; the most recent failed result is attempt-0075/micro-0001 (error, no score). This is a parameterization-preserving compression: union current position groups represented by coordinates 233 and 306, whose learned values are 0.0013918133 and 0.0014071175 (absolute difference 1.530e-05), using a multiplicity-weighted mean. Hypothesis: this preserves qualification and yields 2,082 parameters. It is more informative than the nearest untested alternative (difference 1.647e-05) because it is the minimum-distortion eligible union; exact pairs already rejected under the unchanged grouping are excluded. Acceptance and rollback remain solely governed by the official runner.	0	0
attempt-0078	nearest-position-unions-infra-repair	micro-0004	186c61d46ddc64461a641ba3827e034478b00f17	307536b344e3fc09e2a59c3ba0d0ed498df10a62	2026-08-16T21:00:12.182991+00:00	parameter tying	99.040000%	2081	keep	Union closest position groups 361 and 469	Family: parameter tying. Current retained frontier is 2,082 parameters at 99.040000%, a +0.040000 percentage-point margin over 99%. There have been 20 prior macro-attempts in this family and 24 prior micro-trials. The most recent accepted result is attempt-0078/micro-0003 at 2082 parameters and 99.040000%; the most recent failed result is attempt-0075/micro-0001 (error, no score). This is a parameterization-preserving compression: union current position groups represented by coordinates 361 and 469, whose learned values are -0.0130450493 and -0.0130285807 (absolute difference 1.647e-05), using a multiplicity-weighted mean. Hypothesis: this preserves qualification and yields 2,081 parameters. It is more informative than the nearest untested alternative (difference 1.661e-05) because it is the minimum-distortion eligible union; exact pairs already rejected under the unchanged grouping are excluded. Acceptance and rollback remain solely governed by the official runner.	0	0
attempt-0078	nearest-position-unions-infra-repair	micro-0005	ad750f90a86377810540656a625930a8f406d063	186c61d46ddc64461a641ba3827e034478b00f17	2026-08-16T21:01:15.373723+00:00	parameter tying	99.040000%	2080	keep	Union closest position groups 473 and 99	Family: parameter tying. Current retained frontier is 2,081 parameters at 99.040000%, a +0.040000 percentage-point margin over 99%. There have been 20 prior macro-attempts in this family and 25 prior micro-trials. The most recent accepted result is attempt-0078/micro-0004 at 2081 parameters and 99.040000%; the most recent failed result is attempt-0075/micro-0001 (error, no score). This is a parameterization-preserving compression: union current position groups represented by coordinates 473 and 99, whose learned values are -0.0121204974 and -0.0121038873 (absolute difference 1.661e-05), using a multiplicity-weighted mean. Hypothesis: this preserves qualification and yields 2,080 parameters. It is more informative than the nearest untested alternative (difference 1.664e-05) because it is the minimum-distortion eligible union; exact pairs already rejected under the unchanged grouping are excluded. Acceptance and rollback remain solely governed by the official runner.	0	0
attempt-0078	nearest-position-unions-infra-repair	micro-0006	db1a06546e6504104aaf19fd6e43b7b29e96475b	ad750f90a86377810540656a625930a8f406d063	2026-08-16T21:02:18.223298+00:00	parameter tying	99.040000%	2079	keep	Union closest position groups 25 and 454	Family: parameter tying. Current retained frontier is 2,080 parameters at 99.040000%, a +0.040000 percentage-point margin over 99%. There have been 20 prior macro-attempts in this family and 26 prior micro-trials. The most recent accepted result is attempt-0078/micro-0005 at 2080 parameters and 99.040000%; the most recent failed result is attempt-0075/micro-0001 (error, no score). This is a parameterization-preserving compression: union current position groups represented by coordinates 25 and 454, whose learned values are -0.0134330411 and -0.0134163965 (absolute difference 1.664e-05), using a multiplicity-weighted mean. Hypothesis: this preserves qualification and yields 2,079 parameters. It is more informative than the nearest untested alternative (difference 1.675e-05) because it is the minimum-distortion eligible union; exact pairs already rejected under the unchanged grouping are excluded. Acceptance and rollback remain solely governed by the official runner.	0	0
attempt-0078	nearest-position-unions-infra-repair	micro-0007	7e573117b058b2ba03296707397681dc91c66597	db1a06546e6504104aaf19fd6e43b7b29e96475b	2026-08-16T21:03:20.243244+00:00	parameter tying	99.040000%	2078	keep	Union closest position groups 142 and 169	Family: parameter tying. Current retained frontier is 2,079 parameters at 99.040000%, a +0.040000 percentage-point margin over 99%. There have been 20 prior macro-attempts in this family and 27 prior micro-trials. The most recent accepted result is attempt-0078/micro-0006 at 2079 parameters and 99.040000%; the most recent failed result is attempt-0075/micro-0001 (error, no score). This is a parameterization-preserving compression: union current position groups represented by coordinates 142 and 169, whose learned values are -0.0174008161 and -0.0173840653 (absolute difference 1.675e-05), using a multiplicity-weighted mean. Hypothesis: this preserves qualification and yields 2,078 parameters. It is more informative than the nearest untested alternative (difference 1.685e-05) because it is the minimum-distortion eligible union; exact pairs already rejected under the unchanged grouping are excluded. Acceptance and rollback remain solely governed by the official runner.	0	0
attempt-0078	nearest-position-unions-infra-repair	micro-0008	641f20858d2d23e62dec5eb3ec9704a7197b54a8	7e573117b058b2ba03296707397681dc91c66597	2026-08-16T21:04:22.855617+00:00	parameter tying	99.040000%	2077	keep	Union closest position groups 441 and 173	Family: parameter tying. Current retained frontier is 2,078 parameters at 99.040000%, a +0.040000 percentage-point margin over 99%. There have been 20 prior macro-attempts in this family and 28 prior micro-trials. The most recent accepted result is attempt-0078/micro-0007 at 2078 parameters and 99.040000%; the most recent failed result is attempt-0075/micro-0001 (error, no score). This is a parameterization-preserving compression: union current position groups represented by coordinates 441 and 173, whose learned values are -0.0081322808 and -0.0081154266 (absolute difference 1.685e-05), using a multiplicity-weighted mean. Hypothesis: this preserves qualification and yields 2,077 parameters. It is more informative than the nearest untested alternative (difference 1.690e-05) because it is the minimum-distortion eligible union; exact pairs already rejected under the unchanged grouping are excluded. Acceptance and rollback remain solely governed by the official runner.	0	0
attempt-0078	nearest-position-unions-infra-repair	micro-0009	a3d4f754f80b7afabf6f21295dc073ba982db7c4	641f20858d2d23e62dec5eb3ec9704a7197b54a8	2026-08-16T21:05:25.399767+00:00	parameter tying	99.040000%	2076	keep	Union closest position groups 139 and 279	Family: parameter tying. Current retained frontier is 2,077 parameters at 99.040000%, a +0.040000 percentage-point margin over 99%. There have been 20 prior macro-attempts in this family and 29 prior micro-trials. The most recent accepted result is attempt-0078/micro-0008 at 2077 parameters and 99.040000%; the most recent failed result is attempt-0075/micro-0001 (error, no score). This is a parameterization-preserving compression: union current position groups represented by coordinates 139 and 279, whose learned values are 0.0168967135 and 0.0169136096 (absolute difference 1.690e-05), using a multiplicity-weighted mean. Hypothesis: this preserves qualification and yields 2,076 parameters. It is more informative than the nearest untested alternative (difference 1.704e-05) because it is the minimum-distortion eligible union; exact pairs already rejected under the unchanged grouping are excluded. Acceptance and rollback remain solely governed by the official runner.	0	0
attempt-0078	nearest-position-unions-infra-repair	micro-0010	1977df45decfe25ed23454fb8c05e66ab05681af	a3d4f754f80b7afabf6f21295dc073ba982db7c4	2026-08-16T21:06:27.104973+00:00	parameter tying	99.040000%	2075	keep	Union closest position groups 391 and 353	Family: parameter tying. Current retained frontier is 2,076 parameters at 99.040000%, a +0.040000 percentage-point margin over 99%. There have been 20 prior macro-attempts in this family and 30 prior micro-trials. The most recent accepted result is attempt-0078/micro-0009 at 2076 parameters and 99.040000%; the most recent failed result is attempt-0075/micro-0001 (error, no score). This is a parameterization-preserving compression: union current position groups represented by coordinates 391 and 353, whose learned values are 0.0065754987 and 0.0065925373 (absolute difference 1.704e-05), using a multiplicity-weighted mean. Hypothesis: this preserves qualification and yields 2,075 parameters. It is more informative than the nearest untested alternative (difference 1.705e-05) because it is the minimum-distortion eligible union; exact pairs already rejected under the unchanged grouping are excluded. Acceptance and rollback remain solely governed by the official runner.	0	0
attempt-0078	nearest-position-unions-infra-repair	micro-0011	42a24e2da63dccb47c2ddcce454f6dd45a23bab0	1977df45decfe25ed23454fb8c05e66ab05681af	2026-08-16T21:07:37.351103+00:00	parameter tying	99.040000%	2074	keep	Union closest position groups 452 and 447	Family: parameter tying. Current retained frontier is 2,075 parameters at 99.040000%, a +0.040000 percentage-point margin over 99%. There have been 20 prior macro-attempts in this family and 31 prior micro-trials. The most recent accepted result is attempt-0078/micro-0010 at 2075 parameters and 99.040000%; the most recent failed result is attempt-0075/micro-0001 (error, no score). This is a parameterization-preserving compression: union current position groups represented by coordinates 452 and 447, whose learned values are -0.0080402214 and -0.0080231763 (absolute difference 1.705e-05), using a multiplicity-weighted mean. Hypothesis: this preserves qualification and yields 2,074 parameters. It is more informative than the nearest untested alternative (difference 1.728e-05) because it is the minimum-distortion eligible union; exact pairs already rejected under the unchanged grouping are excluded. Acceptance and rollback remain solely governed by the official runner.	0	0
attempt-0078	nearest-position-unions-infra-repair	micro-0012	19730d64b203ec12bdc87ce14413e656323f2869	42a24e2da63dccb47c2ddcce454f6dd45a23bab0	2026-08-16T21:08:45.059569+00:00	parameter tying	99.040000%	2073	keep	Union closest position groups 217 and 482	Family: parameter tying. Current retained frontier is 2,074 parameters at 99.040000%, a +0.040000 percentage-point margin over 99%. There have been 20 prior macro-attempts in this family and 32 prior micro-trials. The most recent accepted result is attempt-0078/micro-0011 at 2074 parameters and 99.040000%; the most recent failed result is attempt-0075/micro-0001 (error, no score). This is a parameterization-preserving compression: union current position groups represented by coordinates 217 and 482, whose learned values are 0.0024018355 and 0.0024191204 (absolute difference 1.728e-05), using a multiplicity-weighted mean. Hypothesis: this preserves qualification and yields 2,073 parameters. It is more informative than the nearest untested alternative (difference 1.741e-05) because it is the minimum-distortion eligible union; exact pairs already rejected under the unchanged grouping are excluded. Acceptance and rollback remain solely governed by the official runner.	0	0
attempt-0078	nearest-position-unions-infra-repair	micro-0013	3247a0abdd2def7858e710b7332931145b81af86	19730d64b203ec12bdc87ce14413e656323f2869	2026-08-16T21:09:50.394308+00:00	parameter tying	99.040000%	2072	keep	Union closest position groups 386 and 83	Family: parameter tying. Current retained frontier is 2,073 parameters at 99.040000%, a +0.040000 percentage-point margin over 99%. There have been 20 prior macro-attempts in this family and 33 prior micro-trials. The most recent accepted result is attempt-0078/micro-0012 at 2073 parameters and 99.040000%; the most recent failed result is attempt-0075/micro-0001 (error, no score). This is a parameterization-preserving compression: union current position groups represented by coordinates 386 and 83, whose learned values are -0.0120240804 and -0.0120066665 (absolute difference 1.741e-05), using a multiplicity-weighted mean. Hypothesis: this preserves qualification and yields 2,072 parameters. It is more informative than the nearest untested alternative (difference 1.761e-05) because it is the minimum-distortion eligible union; exact pairs already rejected under the unchanged grouping are excluded. Acceptance and rollback remain solely governed by the official runner.	0	0
attempt-0078	nearest-position-unions-infra-repair	micro-0014	afee5e84f9e756a240e0f64c89ee116408513466	3247a0abdd2def7858e710b7332931145b81af86	2026-08-16T21:10:56.097751+00:00	parameter tying	99.040000%	2071	keep	Union closest position groups 33 and 429	Family: parameter tying. Current retained frontier is 2,072 parameters at 99.040000%, a +0.040000 percentage-point margin over 99%. There have been 20 prior macro-attempts in this family and 34 prior micro-trials. The most recent accepted result is attempt-0078/micro-0013 at 2072 parameters and 99.040000%; the most recent failed result is attempt-0075/micro-0001 (error, no score). This is a parameterization-preserving compression: union current position groups represented by coordinates 33 and 429, whose learned values are 0.0309574809 and 0.0309750866 (absolute difference 1.761e-05), using a multiplicity-weighted mean. Hypothesis: this preserves qualification and yields 2,071 parameters. It is more informative than the nearest untested alternative (difference 1.765e-05) because it is the minimum-distortion eligible union; exact pairs already rejected under the unchanged grouping are excluded. Acceptance and rollback remain solely governed by the official runner.	0	0
