macro_attempt_id	automation_id	micro_attempt_id	commit	parent_commit	timestamp_utc	family	accuracy	parameters	status	description	proposal	train_exit	verify_exit
attempt-0078	nearest-position-unions-infra-repair	micro-0015	ce783dcee2516fb938810ff5cb5431aa49af2366	afee5e84f9e756a240e0f64c89ee116408513466	2026-08-16T21:12:00.624783+00:00	parameter tying	99.040000%	2070	keep	Union closest position groups 105 and 290	Family: parameter tying. Current retained frontier is 2,071 parameters at 99.040000%, a +0.040000 percentage-point margin over 99%. There have been 20 prior macro-attempts in this family and 35 prior micro-trials. The most recent accepted result is attempt-0078/micro-0014 at 2071 parameters and 99.040000%; the most recent failed result is attempt-0075/micro-0001 (error, no score). This is a parameterization-preserving compression: union current position groups represented by coordinates 105 and 290, whose learned values are -0.0133752627 and -0.0133576095 (absolute difference 1.765e-05), using a multiplicity-weighted mean. Hypothesis: this preserves qualification and yields 2,070 parameters. It is more informative than the nearest untested alternative (difference 1.836e-05) because it is the minimum-distortion eligible union; exact pairs already rejected under the unchanged grouping are excluded. Acceptance and rollback remain solely governed by the official runner.	0	0
attempt-0078	nearest-position-unions-infra-repair	micro-0016	22a7d5e3e306159ab3954bb47dc51e8e27d27c0c	ce783dcee2516fb938810ff5cb5431aa49af2366	2026-08-16T21:13:06.725969+00:00	parameter tying	99.040000%	2069	keep	Union closest position groups 50 and 161	Family: parameter tying. Current retained frontier is 2,070 parameters at 99.040000%, a +0.040000 percentage-point margin over 99%. There have been 20 prior macro-attempts in this family and 36 prior micro-trials. The most recent accepted result is attempt-0078/micro-0015 at 2070 parameters and 99.040000%; the most recent failed result is attempt-0075/micro-0001 (error, no score). This is a parameterization-preserving compression: union current position groups represented by coordinates 50 and 161, whose learned values are -0.0137402015 and -0.0137218442 (absolute difference 1.836e-05), using a multiplicity-weighted mean. Hypothesis: this preserves qualification and yields 2,069 parameters. It is more informative than the nearest untested alternative (difference 1.861e-05) because it is the minimum-distortion eligible union; exact pairs already rejected under the unchanged grouping are excluded. Acceptance and rollback remain solely governed by the official runner.	0	0
attempt-0078	nearest-position-unions-infra-repair	micro-0017	9d618155facc10f48ac9cb1cbf89a14da26c9399	22a7d5e3e306159ab3954bb47dc51e8e27d27c0c	2026-08-16T21:14:13.235092+00:00	parameter tying	99.040000%	2068	keep	Union closest position groups 509 and 84	Family: parameter tying. Current retained frontier is 2,069 parameters at 99.040000%, a +0.040000 percentage-point margin over 99%. There have been 20 prior macro-attempts in this family and 37 prior micro-trials. The most recent accepted result is attempt-0078/micro-0016 at 2069 parameters and 99.040000%; the most recent failed result is attempt-0075/micro-0001 (error, no score). This is a parameterization-preserving compression: union current position groups represented by coordinates 509 and 84, whose learned values are -0.0472288392 and -0.0472102277 (absolute difference 1.861e-05), using a multiplicity-weighted mean. Hypothesis: this preserves qualification and yields 2,068 parameters. It is more informative than the nearest untested alternative (difference 1.957e-05) because it is the minimum-distortion eligible union; exact pairs already rejected under the unchanged grouping are excluded. Acceptance and rollback remain solely governed by the official runner.	0	0
attempt-0078	nearest-position-unions-infra-repair	micro-0018	994d80a10f097370e16e7e35dd4bfc8445d61a7f	9d618155facc10f48ac9cb1cbf89a14da26c9399	2026-08-16T21:15:20.301722+00:00	parameter tying	99.040000%	2067	keep	Union closest position groups 211 and 41	Family: parameter tying. Current retained frontier is 2,068 parameters at 99.040000%, a +0.040000 percentage-point margin over 99%. There have been 20 prior macro-attempts in this family and 38 prior micro-trials. The most recent accepted result is attempt-0078/micro-0017 at 2068 parameters and 99.040000%; the most recent failed result is attempt-0075/micro-0001 (error, no score). This is a parameterization-preserving compression: union current position groups represented by coordinates 211 and 41, whose learned values are 0.0005271967 and 0.0005467650 (absolute difference 1.957e-05), using a multiplicity-weighted mean. Hypothesis: this preserves qualification and yields 2,067 parameters. It is more informative than the nearest untested alternative (difference 1.958e-05) because it is the minimum-distortion eligible union; exact pairs already rejected under the unchanged grouping are excluded. Acceptance and rollback remain solely governed by the official runner.	0	0
attempt-0078	nearest-position-unions-infra-repair	micro-0019	f17df175740b4f9242d27bc2fbf0e217b4a71172	994d80a10f097370e16e7e35dd4bfc8445d61a7f	2026-08-16T21:16:24.823911+00:00	parameter tying	99.040000%	2066	keep	Union closest position groups 271 and 254	Family: parameter tying. Current retained frontier is 2,067 parameters at 99.040000%, a +0.040000 percentage-point margin over 99%. There have been 20 prior macro-attempts in this family and 39 prior micro-trials. The most recent accepted result is attempt-0078/micro-0018 at 2067 parameters and 99.040000%; the most recent failed result is attempt-0075/micro-0001 (error, no score). This is a parameterization-preserving compression: union current position groups represented by coordinates 271 and 254, whose learned values are 0.0000570905 and 0.0000766712 (absolute difference 1.958e-05), using a multiplicity-weighted mean. Hypothesis: this preserves qualification and yields 2,066 parameters. It is more informative than the nearest untested alternative (difference 2.175e-05) because it is the minimum-distortion eligible union; exact pairs already rejected under the unchanged grouping are excluded. Acceptance and rollback remain solely governed by the official runner.	0	0
attempt-0078	nearest-position-unions-infra-repair	micro-0020	c37a3832f27f046f1762fcb9607fc29f3fdc9401	f17df175740b4f9242d27bc2fbf0e217b4a71172	2026-08-16T21:17:29.749722+00:00	parameter tying	99.040000%	2065	keep	Union closest position groups 418 and 57	Family: parameter tying. Current retained frontier is 2,066 parameters at 99.040000%, a +0.040000 percentage-point margin over 99%. There have been 20 prior macro-attempts in this family and 40 prior micro-trials. The most recent accepted result is attempt-0078/micro-0019 at 2066 parameters and 99.040000%; the most recent failed result is attempt-0075/micro-0001 (error, no score). This is a parameterization-preserving compression: union current position groups represented by coordinates 418 and 57, whose learned values are -0.0206587948 and -0.0206370465 (absolute difference 2.175e-05), using a multiplicity-weighted mean. Hypothesis: this preserves qualification and yields 2,065 parameters. It is more informative than the nearest untested alternative (difference 2.175e-05) because it is the minimum-distortion eligible union; exact pairs already rejected under the unchanged grouping are excluded. Acceptance and rollback remain solely governed by the official runner.	0	0
attempt-0078	nearest-position-unions-infra-repair	micro-0021	a65f92e12479f7c4183b7c1a0fe63c33f329f806	c37a3832f27f046f1762fcb9607fc29f3fdc9401	2026-08-16T21:18:34.326111+00:00	parameter tying	99.040000%	2064	keep	Union closest position groups 131 and 119	Family: parameter tying. Current retained frontier is 2,065 parameters at 99.040000%, a +0.040000 percentage-point margin over 99%. There have been 20 prior macro-attempts in this family and 41 prior micro-trials. The most recent accepted result is attempt-0078/micro-0020 at 2065 parameters and 99.040000%; the most recent failed result is attempt-0075/micro-0001 (error, no score). This is a parameterization-preserving compression: union current position groups represented by coordinates 131 and 119, whose learned values are -0.0271725915 and -0.0271508396 (absolute difference 2.175e-05), using a multiplicity-weighted mean. Hypothesis: this preserves qualification and yields 2,064 parameters. It is more informative than the nearest untested alternative (difference 2.204e-05) because it is the minimum-distortion eligible union; exact pairs already rejected under the unchanged grouping are excluded. Acceptance and rollback remain solely governed by the official runner.	0	0
attempt-0078	nearest-position-unions-infra-repair	micro-0022	13f14534418eac4cc64370a782c7face7af2bccb	a65f92e12479f7c4183b7c1a0fe63c33f329f806	2026-08-16T21:19:42.003184+00:00	parameter tying	99.040000%	2063	keep	Union closest position groups 110 and 150	Family: parameter tying. Current retained frontier is 2,064 parameters at 99.040000%, a +0.040000 percentage-point margin over 99%. There have been 20 prior macro-attempts in this family and 42 prior micro-trials. The most recent accepted result is attempt-0078/micro-0021 at 2064 parameters and 99.040000%; the most recent failed result is attempt-0075/micro-0001 (error, no score). This is a parameterization-preserving compression: union current position groups represented by coordinates 110 and 150, whose learned values are 0.0058638183 and 0.0058858567 (absolute difference 2.204e-05), using a multiplicity-weighted mean. Hypothesis: this preserves qualification and yields 2,063 parameters. It is more informative than the nearest untested alternative (difference 2.272e-05) because it is the minimum-distortion eligible union; exact pairs already rejected under the unchanged grouping are excluded. Acceptance and rollback remain solely governed by the official runner.	0	0
attempt-0078	nearest-position-unions-infra-repair	micro-0023	18601c8048643977b657c11d86918545bd09d823	13f14534418eac4cc64370a782c7face7af2bccb	2026-08-16T21:20:46.168676+00:00	parameter tying	99.040000%	2062	keep	Union closest position groups 406 and 94	Family: parameter tying. Current retained frontier is 2,063 parameters at 99.040000%, a +0.040000 percentage-point margin over 99%. There have been 20 prior macro-attempts in this family and 43 prior micro-trials. The most recent accepted result is attempt-0078/micro-0022 at 2063 parameters and 99.040000%; the most recent failed result is attempt-0075/micro-0001 (error, no score). This is a parameterization-preserving compression: union current position groups represented by coordinates 406 and 94, whose learned values are 0.0043964013 and 0.0044191196 (absolute difference 2.272e-05), using a multiplicity-weighted mean. Hypothesis: this preserves qualification and yields 2,062 parameters. It is more informative than the nearest untested alternative (difference 2.276e-05) because it is the minimum-distortion eligible union; exact pairs already rejected under the unchanged grouping are excluded. Acceptance and rollback remain solely governed by the official runner.	0	0
attempt-0078	nearest-position-unions-infra-repair	micro-0024	b5500c18a53fbf26c6c94790ae4ee1ba098574cf	18601c8048643977b657c11d86918545bd09d823	2026-08-16T21:21:49.504378+00:00	parameter tying	99.040000%	2061	keep	Union closest position groups 253 and 151	Family: parameter tying. Current retained frontier is 2,062 parameters at 99.040000%, a +0.040000 percentage-point margin over 99%. There have been 20 prior macro-attempts in this family and 44 prior micro-trials. The most recent accepted result is attempt-0078/micro-0023 at 2062 parameters and 99.040000%; the most recent failed result is attempt-0075/micro-0001 (error, no score). This is a parameterization-preserving compression: union current position groups represented by coordinates 253 and 151, whose learned values are -0.0078767557 and -0.0078539960 (absolute difference 2.276e-05), using a multiplicity-weighted mean. Hypothesis: this preserves qualification and yields 2,061 parameters. It is more informative than the nearest untested alternative (difference 2.279e-05) because it is the minimum-distortion eligible union; exact pairs already rejected under the unchanged grouping are excluded. Acceptance and rollback remain solely governed by the official runner.	0	0
attempt-0078	nearest-position-unions-infra-repair	micro-0025	74073a9e9383bd7e12e237f7eca36807dec5f34d	b5500c18a53fbf26c6c94790ae4ee1ba098574cf	2026-08-16T21:22:52.758873+00:00	parameter tying	99.040000%	2060	keep	Union closest position groups 286 and 159	Family: parameter tying. Current retained frontier is 2,061 parameters at 99.040000%, a +0.040000 percentage-point margin over 99%. There have been 20 prior macro-attempts in this family and 45 prior micro-trials. The most recent accepted result is attempt-0078/micro-0024 at 2061 parameters and 99.040000%; the most recent failed result is attempt-0075/micro-0001 (error, no score). This is a parameterization-preserving compression: union current position groups represented by coordinates 286 and 159, whose learned values are -0.0041147554 and -0.0040919622 (absolute difference 2.279e-05), using a multiplicity-weighted mean. Hypothesis: this preserves qualification and yields 2,060 parameters. It is more informative than the nearest untested alternative (difference 2.316e-05) because it is the minimum-distortion eligible union; exact pairs already rejected under the unchanged grouping are excluded. Acceptance and rollback remain solely governed by the official runner.	0	0
attempt-0078	nearest-position-unions-infra-repair	micro-0026	49846637fda03b777a8598bf7a05e5f19c7f6020	74073a9e9383bd7e12e237f7eca36807dec5f34d	2026-08-16T21:23:58.920099+00:00	parameter tying	99.040000%	2059	keep	Union closest position groups 190 and 115	Family: parameter tying. Current retained frontier is 2,060 parameters at 99.040000%, a +0.040000 percentage-point margin over 99%. There have been 20 prior macro-attempts in this family and 46 prior micro-trials. The most recent accepted result is attempt-0078/micro-0025 at 2060 parameters and 99.040000%; the most recent failed result is attempt-0075/micro-0001 (error, no score). This is a parameterization-preserving compression: union current position groups represented by coordinates 190 and 115, whose learned values are -0.0278409049 and -0.0278177448 (absolute difference 2.316e-05), using a multiplicity-weighted mean. Hypothesis: this preserves qualification and yields 2,059 parameters. It is more informative than the nearest untested alternative (difference 2.407e-05) because it is the minimum-distortion eligible union; exact pairs already rejected under the unchanged grouping are excluded. Acceptance and rollback remain solely governed by the official runner.	0	0
attempt-0078	nearest-position-unions-infra-repair	micro-0027	8e7c068ecc10b9c5f16137ba2a58d1eccc0ab7ac	49846637fda03b777a8598bf7a05e5f19c7f6020	2026-08-16T21:25:02.015115+00:00	parameter tying	99.040000%	2058	keep	Union closest position groups 64 and 378	Family: parameter tying. Current retained frontier is 2,059 parameters at 99.040000%, a +0.040000 percentage-point margin over 99%. There have been 20 prior macro-attempts in this family and 47 prior micro-trials. The most recent accepted result is attempt-0078/micro-0026 at 2059 parameters and 99.040000%; the most recent failed result is attempt-0075/micro-0001 (error, no score). This is a parameterization-preserving compression: union current position groups represented by coordinates 64 and 378, whose learned values are 0.0043012276 and 0.0043252981 (absolute difference 2.407e-05), using a multiplicity-weighted mean. Hypothesis: this preserves qualification and yields 2,058 parameters. It is more informative than the nearest untested alternative (difference 2.448e-05) because it is the minimum-distortion eligible union; exact pairs already rejected under the unchanged grouping are excluded. Acceptance and rollback remain solely governed by the official runner.	0	0
attempt-0078	nearest-position-unions-infra-repair	micro-0028	518d58ab1c788225936b84a34e6c361af55d273d	8e7c068ecc10b9c5f16137ba2a58d1eccc0ab7ac	2026-08-16T21:26:06.378110+00:00	parameter tying	99.040000%	2057	keep	Union closest position groups 417 and 13	Family: parameter tying. Current retained frontier is 2,058 parameters at 99.040000%, a +0.040000 percentage-point margin over 99%. There have been 20 prior macro-attempts in this family and 48 prior micro-trials. The most recent accepted result is attempt-0078/micro-0027 at 2058 parameters and 99.040000%; the most recent failed result is attempt-0075/micro-0001 (error, no score). This is a parameterization-preserving compression: union current position groups represented by coordinates 417 and 13, whose learned values are 0.0175062064 and 0.0175306890 (absolute difference 2.448e-05), using a multiplicity-weighted mean. Hypothesis: this preserves qualification and yields 2,057 parameters. It is more informative than the nearest untested alternative (difference 2.487e-05) because it is the minimum-distortion eligible union; exact pairs already rejected under the unchanged grouping are excluded. Acceptance and rollback remain solely governed by the official runner.	0	0
attempt-0078	nearest-position-unions-infra-repair	micro-0029	9f3503c3db1c59141aa280efc86d727f9e3c7960	518d58ab1c788225936b84a34e6c361af55d273d	2026-08-16T21:27:08.821026+00:00	parameter tying	99.030000%	2056	keep	Union closest position groups 304 and 439	Family: parameter tying. Current retained frontier is 2,057 parameters at 99.040000%, a +0.040000 percentage-point margin over 99%. There have been 20 prior macro-attempts in this family and 49 prior micro-trials. The most recent accepted result is attempt-0078/micro-0028 at 2057 parameters and 99.040000%; the most recent failed result is attempt-0075/micro-0001 (error, no score). This is a parameterization-preserving compression: union current position groups represented by coordinates 304 and 439, whose learned values are 0.0218563583 and 0.0218812283 (absolute difference 2.487e-05), using a multiplicity-weighted mean. Hypothesis: this preserves qualification and yields 2,056 parameters. It is more informative than the nearest untested alternative (difference 2.531e-05) because it is the minimum-distortion eligible union; exact pairs already rejected under the unchanged grouping are excluded. Acceptance and rollback remain solely governed by the official runner.	0	0
attempt-0078	nearest-position-unions-infra-repair	micro-0030	5834d2dcd7f31e9e4389d4acd5a43ce06b5b3bf4	9f3503c3db1c59141aa280efc86d727f9e3c7960	2026-08-16T21:28:11.053422+00:00	parameter tying	99.040000%	2055	keep	Union closest position groups 66 and 504	Family: parameter tying. Current retained frontier is 2,056 parameters at 99.030000%, a +0.030000 percentage-point margin over 99%. There have been 20 prior macro-attempts in this family and 50 prior micro-trials. The most recent accepted result is attempt-0078/micro-0029 at 2056 parameters and 99.030000%; the most recent failed result is attempt-0075/micro-0001 (error, no score). This is a parameterization-preserving compression: union current position groups represented by coordinates 66 and 504, whose learned values are -0.0118057728 and -0.0117804604 (absolute difference 2.531e-05), using a multiplicity-weighted mean. Hypothesis: this preserves qualification and yields 2,055 parameters. It is more informative than the nearest untested alternative (difference 2.595e-05) because it is the minimum-distortion eligible union; exact pairs already rejected under the unchanged grouping are excluded. Acceptance and rollback remain solely governed by the official runner.	0	0
attempt-0078	nearest-position-unions-infra-repair	micro-0031	062e715f4d4c8a29612b2e6d10449c001e7af16d	5834d2dcd7f31e9e4389d4acd5a43ce06b5b3bf4	2026-08-16T21:29:14.193310+00:00	parameter tying	99.030000%	2054	keep	Union closest position groups 301 and 7	Family: parameter tying. Current retained frontier is 2,055 parameters at 99.040000%, a +0.040000 percentage-point margin over 99%. There have been 20 prior macro-attempts in this family and 51 prior micro-trials. The most recent accepted result is attempt-0078/micro-0030 at 2055 parameters and 99.040000%; the most recent failed result is attempt-0075/micro-0001 (error, no score). This is a parameterization-preserving compression: union current position groups represented by coordinates 301 and 7, whose learned values are 0.0034964248 and 0.0035223761 (absolute difference 2.595e-05), using a multiplicity-weighted mean. Hypothesis: this preserves qualification and yields 2,054 parameters. It is more informative than the nearest untested alternative (difference 2.610e-05) because it is the minimum-distortion eligible union; exact pairs already rejected under the unchanged grouping are excluded. Acceptance and rollback remain solely governed by the official runner.	0	0
