macro_attempt_id	automation_id	micro_attempt_id	commit	parent_commit	timestamp_utc	family	accuracy	parameters	status	description	proposal	train_exit	verify_exit
attempt-0078	nearest-position-unions-infra-repair	micro-0168	b45e2ea42cd5dde4d4c7b9054fcfa4634bded785	52945f80364c1c56f42e6a80a2e8bad7318e77f1	2026-08-17T00:03:43.027823+00:00	parameter tying	99.070000%	1917	keep	Union closest position groups 146 and 122	Family: parameter tying. Current retained frontier is 1,918 parameters at 99.070000%, a +0.070000 percentage-point margin over 99%. There have been 20 prior macro-attempts in this family and 188 prior micro-trials. The most recent accepted result is attempt-0078/micro-0167 at 1918 parameters and 99.070000%; the most recent failed result is attempt-0075/micro-0001 (error, no score). This is a parameterization-preserving compression: union current position groups represented by coordinates 146 and 122, whose learned values are -0.0088707572 and -0.0087474920 (absolute difference 1.233e-04), using a multiplicity-weighted mean. Hypothesis: this preserves qualification and yields 1,917 parameters. It is more informative than the nearest untested alternative (difference 1.245e-04) because it is the minimum-distortion eligible union; exact pairs already rejected under the unchanged grouping are excluded. Acceptance and rollback remain solely governed by the official runner.	0	0
attempt-0078	nearest-position-unions-infra-repair	micro-0169	bff17c16f604450a1e4c984b62ff8e115f783bbf	b45e2ea42cd5dde4d4c7b9054fcfa4634bded785	2026-08-17T00:04:45.265924+00:00	parameter tying	99.070000%	1916	keep	Union closest position groups 90 and 191	Family: parameter tying. Current retained frontier is 1,917 parameters at 99.070000%, a +0.070000 percentage-point margin over 99%. There have been 20 prior macro-attempts in this family and 189 prior micro-trials. The most recent accepted result is attempt-0078/micro-0168 at 1917 parameters and 99.070000%; the most recent failed result is attempt-0075/micro-0001 (error, no score). This is a parameterization-preserving compression: union current position groups represented by coordinates 90 and 191, whose learned values are -0.0046267784 and -0.0045022960 (absolute difference 1.245e-04), using a multiplicity-weighted mean. Hypothesis: this preserves qualification and yields 1,916 parameters. It is more informative than the nearest untested alternative (difference 1.263e-04) because it is the minimum-distortion eligible union; exact pairs already rejected under the unchanged grouping are excluded. Acceptance and rollback remain solely governed by the official runner.	0	0
attempt-0078	nearest-position-unions-infra-repair	micro-0170	02d6849a8841ea9053c5db47ee9af19b4682deb9	bff17c16f604450a1e4c984b62ff8e115f783bbf	2026-08-17T00:05:47.777462+00:00	parameter tying	99.070000%	1915	keep	Union closest position groups 152 and 365	Family: parameter tying. Current retained frontier is 1,916 parameters at 99.070000%, a +0.070000 percentage-point margin over 99%. There have been 20 prior macro-attempts in this family and 190 prior micro-trials. The most recent accepted result is attempt-0078/micro-0169 at 1916 parameters and 99.070000%; the most recent failed result is attempt-0075/micro-0001 (error, no score). This is a parameterization-preserving compression: union current position groups represented by coordinates 152 and 365, whose learned values are 0.0197345428 and 0.0198608190 (absolute difference 1.263e-04), using a multiplicity-weighted mean. Hypothesis: this preserves qualification and yields 1,915 parameters. It is more informative than the nearest untested alternative (difference 1.301e-04) because it is the minimum-distortion eligible union; exact pairs already rejected under the unchanged grouping are excluded. Acceptance and rollback remain solely governed by the official runner.	0	0
attempt-0078	nearest-position-unions-infra-repair	micro-0171	07cd9ea43952b462806fa8196e88f223fed18bfb	02d6849a8841ea9053c5db47ee9af19b4682deb9	2026-08-17T00:06:50.351638+00:00	parameter tying	99.070000%	1914	keep	Union closest position groups 349 and 114	Family: parameter tying. Current retained frontier is 1,915 parameters at 99.070000%, a +0.070000 percentage-point margin over 99%. There have been 20 prior macro-attempts in this family and 191 prior micro-trials. The most recent accepted result is attempt-0078/micro-0170 at 1915 parameters and 99.070000%; the most recent failed result is attempt-0075/micro-0001 (error, no score). This is a parameterization-preserving compression: union current position groups represented by coordinates 349 and 114, whose learned values are -0.0204363763 and -0.0203062315 (absolute difference 1.301e-04), using a multiplicity-weighted mean. Hypothesis: this preserves qualification and yields 1,914 parameters. It is more informative than the nearest untested alternative (difference 1.311e-04) because it is the minimum-distortion eligible union; exact pairs already rejected under the unchanged grouping are excluded. Acceptance and rollback remain solely governed by the official runner.	0	0
attempt-0078	nearest-position-unions-infra-repair	micro-0172	df308ea29b04579b357192ba15bd8fa8de6ba233	07cd9ea43952b462806fa8196e88f223fed18bfb	2026-08-17T00:07:52.769772+00:00	parameter tying	99.070000%	1913	keep	Union closest position groups 419 and 116	Family: parameter tying. Current retained frontier is 1,914 parameters at 99.070000%, a +0.070000 percentage-point margin over 99%. There have been 20 prior macro-attempts in this family and 192 prior micro-trials. The most recent accepted result is attempt-0078/micro-0171 at 1914 parameters and 99.070000%; the most recent failed result is attempt-0075/micro-0001 (error, no score). This is a parameterization-preserving compression: union current position groups represented by coordinates 419 and 116, whose learned values are 0.0164517015 and 0.0165827703 (absolute difference 1.311e-04), using a multiplicity-weighted mean. Hypothesis: this preserves qualification and yields 1,913 parameters. It is more informative than the nearest untested alternative (difference 1.320e-04) because it is the minimum-distortion eligible union; exact pairs already rejected under the unchanged grouping are excluded. Acceptance and rollback remain solely governed by the official runner.	0	0
attempt-0078	nearest-position-unions-infra-repair	micro-0173	73e0e52d72631abf1968d344324b11b12dd427d5	df308ea29b04579b357192ba15bd8fa8de6ba233	2026-08-17T00:08:54.869186+00:00	parameter tying	99.070000%	1912	keep	Union closest position groups 51 and 81	Family: parameter tying. Current retained frontier is 1,913 parameters at 99.070000%, a +0.070000 percentage-point margin over 99%. There have been 20 prior macro-attempts in this family and 193 prior micro-trials. The most recent accepted result is attempt-0078/micro-0172 at 1913 parameters and 99.070000%; the most recent failed result is attempt-0075/micro-0001 (error, no score). This is a parameterization-preserving compression: union current position groups represented by coordinates 51 and 81, whose learned values are -0.0115277953 and -0.0113957711 (absolute difference 1.320e-04), using a multiplicity-weighted mean. Hypothesis: this preserves qualification and yields 1,912 parameters. It is more informative than the nearest untested alternative (difference 1.363e-04) because it is the minimum-distortion eligible union; exact pairs already rejected under the unchanged grouping are excluded. Acceptance and rollback remain solely governed by the official runner.	0	0
attempt-0078	nearest-position-unions-infra-repair	micro-0174	7f7148797b516480cb6aaff6ecb1941b83ab832a	73e0e52d72631abf1968d344324b11b12dd427d5	2026-08-17T00:09:56.986767+00:00	parameter tying	99.070000%	1911	keep	Union closest position groups 218 and 321	Family: parameter tying. Current retained frontier is 1,912 parameters at 99.070000%, a +0.070000 percentage-point margin over 99%. There have been 20 prior macro-attempts in this family and 194 prior micro-trials. The most recent accepted result is attempt-0078/micro-0173 at 1912 parameters and 99.070000%; the most recent failed result is attempt-0075/micro-0001 (error, no score). This is a parameterization-preserving compression: union current position groups represented by coordinates 218 and 321, whose learned values are 0.0214539114 and 0.0215902179 (absolute difference 1.363e-04), using a multiplicity-weighted mean. Hypothesis: this preserves qualification and yields 1,911 parameters. It is more informative than the nearest untested alternative (difference 1.370e-04) because it is the minimum-distortion eligible union; exact pairs already rejected under the unchanged grouping are excluded. Acceptance and rollback remain solely governed by the official runner.	0	0
attempt-0078	nearest-position-unions-infra-repair	micro-0175	4ae5d0517dc5f16a985e9f82429bc96988c9cb33	7f7148797b516480cb6aaff6ecb1941b83ab832a	2026-08-17T00:10:59.747660+00:00	parameter tying	99.070000%	1910	keep	Union closest position groups 86 and 199	Family: parameter tying. Current retained frontier is 1,911 parameters at 99.070000%, a +0.070000 percentage-point margin over 99%. There have been 20 prior macro-attempts in this family and 195 prior micro-trials. The most recent accepted result is attempt-0078/micro-0174 at 1911 parameters and 99.070000%; the most recent failed result is attempt-0075/micro-0001 (error, no score). This is a parameterization-preserving compression: union current position groups represented by coordinates 86 and 199, whose learned values are 0.0072413594 and 0.0073783263 (absolute difference 1.370e-04), using a multiplicity-weighted mean. Hypothesis: this preserves qualification and yields 1,910 parameters. It is more informative than the nearest untested alternative (difference 1.379e-04) because it is the minimum-distortion eligible union; exact pairs already rejected under the unchanged grouping are excluded. Acceptance and rollback remain solely governed by the official runner.	0	0
attempt-0078	nearest-position-unions-infra-repair	micro-0176	391bbe7a58dd4e1a6a910414b426f826727761a5	4ae5d0517dc5f16a985e9f82429bc96988c9cb33	2026-08-17T00:12:02.155392+00:00	parameter tying	99.070000%	1909	keep	Union closest position groups 408 and 315	Family: parameter tying. Current retained frontier is 1,910 parameters at 99.070000%, a +0.070000 percentage-point margin over 99%. There have been 20 prior macro-attempts in this family and 196 prior micro-trials. The most recent accepted result is attempt-0078/micro-0175 at 1910 parameters and 99.070000%; the most recent failed result is attempt-0075/micro-0001 (error, no score). This is a parameterization-preserving compression: union current position groups represented by coordinates 408 and 315, whose learned values are 0.0120903496 and 0.0122282673 (absolute difference 1.379e-04), using a multiplicity-weighted mean. Hypothesis: this preserves qualification and yields 1,909 parameters. It is more informative than the nearest untested alternative (difference 1.398e-04) because it is the minimum-distortion eligible union; exact pairs already rejected under the unchanged grouping are excluded. Acceptance and rollback remain solely governed by the official runner.	0	0
attempt-0078	nearest-position-unions-infra-repair	micro-0177	70128785a633e9cade3e3a1ac885fa48ecdb9d7e	391bbe7a58dd4e1a6a910414b426f826727761a5	2026-08-17T00:13:04.532165+00:00	parameter tying	99.070000%	1908	keep	Union closest position groups 227 and 210	Family: parameter tying. Current retained frontier is 1,909 parameters at 99.070000%, a +0.070000 percentage-point margin over 99%. There have been 20 prior macro-attempts in this family and 197 prior micro-trials. The most recent accepted result is attempt-0078/micro-0176 at 1909 parameters and 99.070000%; the most recent failed result is attempt-0075/micro-0001 (error, no score). This is a parameterization-preserving compression: union current position groups represented by coordinates 227 and 210, whose learned values are -0.0014380493 and -0.0012982020 (absolute difference 1.398e-04), using a multiplicity-weighted mean. Hypothesis: this preserves qualification and yields 1,908 parameters. It is more informative than the nearest untested alternative (difference 1.401e-04) because it is the minimum-distortion eligible union; exact pairs already rejected under the unchanged grouping are excluded. Acceptance and rollback remain solely governed by the official runner.	0	0
attempt-0078	nearest-position-unions-infra-repair	micro-0178	70d13c5dc6bcd7ff4f52db246748173732494984	70128785a633e9cade3e3a1ac885fa48ecdb9d7e	2026-08-17T00:14:07.510720+00:00	parameter tying	99.070000%	1907	keep	Union closest position groups 100 and 52	Family: parameter tying. Current retained frontier is 1,908 parameters at 99.070000%, a +0.070000 percentage-point margin over 99%. There have been 20 prior macro-attempts in this family and 198 prior micro-trials. The most recent accepted result is attempt-0078/micro-0177 at 1908 parameters and 99.070000%; the most recent failed result is attempt-0075/micro-0001 (error, no score). This is a parameterization-preserving compression: union current position groups represented by coordinates 100 and 52, whose learned values are -0.0456940569 and -0.0455539227 (absolute difference 1.401e-04), using a multiplicity-weighted mean. Hypothesis: this preserves qualification and yields 1,907 parameters. It is more informative than the nearest untested alternative (difference 1.403e-04) because it is the minimum-distortion eligible union; exact pairs already rejected under the unchanged grouping are excluded. Acceptance and rollback remain solely governed by the official runner.	0	0
attempt-0078	nearest-position-unions-infra-repair	micro-0179	8eb4a0182e4ffbb38fc8621d2b548434d210edd6	70d13c5dc6bcd7ff4f52db246748173732494984	2026-08-17T00:15:09.441554+00:00	parameter tying	99.060000%	1906	keep	Union closest position groups 481 and 18	Family: parameter tying. Current retained frontier is 1,907 parameters at 99.070000%, a +0.070000 percentage-point margin over 99%. There have been 20 prior macro-attempts in this family and 199 prior micro-trials. The most recent accepted result is attempt-0078/micro-0178 at 1907 parameters and 99.070000%; the most recent failed result is attempt-0075/micro-0001 (error, no score). This is a parameterization-preserving compression: union current position groups represented by coordinates 481 and 18, whose learned values are 0.0184771512 and 0.0186174400 (absolute difference 1.403e-04), using a multiplicity-weighted mean. Hypothesis: this preserves qualification and yields 1,906 parameters. It is more informative than the nearest untested alternative (difference 1.404e-04) because it is the minimum-distortion eligible union; exact pairs already rejected under the unchanged grouping are excluded. Acceptance and rollback remain solely governed by the official runner.	0	0
attempt-0078	nearest-position-unions-infra-repair	micro-0180	0ea54e3475f0c15424e08920828511054ef992b5	8eb4a0182e4ffbb38fc8621d2b548434d210edd6	2026-08-17T00:16:11.135671+00:00	parameter tying	99.070000%	1905	keep	Union closest position groups 49 and 254	Family: parameter tying. Current retained frontier is 1,906 parameters at 99.060000%, a +0.060000 percentage-point margin over 99%. There have been 20 prior macro-attempts in this family and 200 prior micro-trials. The most recent accepted result is attempt-0078/micro-0179 at 1906 parameters and 99.060000%; the most recent failed result is attempt-0075/micro-0001 (error, no score). This is a parameterization-preserving compression: union current position groups represented by coordinates 49 and 254, whose learned values are -0.0000937832 and 0.0000466399 (absolute difference 1.404e-04), using a multiplicity-weighted mean. Hypothesis: this preserves qualification and yields 1,905 parameters. It is more informative than the nearest untested alternative (difference 1.412e-04) because it is the minimum-distortion eligible union; exact pairs already rejected under the unchanged grouping are excluded. Acceptance and rollback remain solely governed by the official runner.	0	0
attempt-0078	nearest-position-unions-infra-repair	micro-0181	58c2d719a1dcff1cbd0c36b8350d1c15a34cdeba	0ea54e3475f0c15424e08920828511054ef992b5	2026-08-17T00:17:13.136583+00:00	parameter tying	99.070000%	1904	keep	Union closest position groups 490 and 182	Family: parameter tying. Current retained frontier is 1,905 parameters at 99.070000%, a +0.070000 percentage-point margin over 99%. There have been 20 prior macro-attempts in this family and 201 prior micro-trials. The most recent accepted result is attempt-0078/micro-0180 at 1905 parameters and 99.070000%; the most recent failed result is attempt-0075/micro-0001 (error, no score). This is a parameterization-preserving compression: union current position groups represented by coordinates 490 and 182, whose learned values are 0.0126222679 and 0.0127634834 (absolute difference 1.412e-04), using a multiplicity-weighted mean. Hypothesis: this preserves qualification and yields 1,904 parameters. It is more informative than the nearest untested alternative (difference 1.421e-04) because it is the minimum-distortion eligible union; exact pairs already rejected under the unchanged grouping are excluded. Acceptance and rollback remain solely governed by the official runner.	0	0
attempt-0078	nearest-position-unions-infra-repair	micro-0182	7e3567e34809b3f032a4e4fb8fd57518c6c33af4	58c2d719a1dcff1cbd0c36b8350d1c15a34cdeba	2026-08-17T00:18:15.445071+00:00	parameter tying	99.070000%	1903	keep	Union closest position groups 193 and 102	Family: parameter tying. Current retained frontier is 1,904 parameters at 99.070000%, a +0.070000 percentage-point margin over 99%. There have been 20 prior macro-attempts in this family and 202 prior micro-trials. The most recent accepted result is attempt-0078/micro-0181 at 1904 parameters and 99.070000%; the most recent failed result is attempt-0075/micro-0001 (error, no score). This is a parameterization-preserving compression: union current position groups represented by coordinates 193 and 102, whose learned values are 0.0055504339 and 0.0056925002 (absolute difference 1.421e-04), using a multiplicity-weighted mean. Hypothesis: this preserves qualification and yields 1,903 parameters. It is more informative than the nearest untested alternative (difference 1.424e-04) because it is the minimum-distortion eligible union; exact pairs already rejected under the unchanged grouping are excluded. Acceptance and rollback remain solely governed by the official runner.	0	0
attempt-0078	nearest-position-unions-infra-repair	micro-0183	e86f11826f5dad81de5d52bf05c7fe9bd6bdd008	7e3567e34809b3f032a4e4fb8fd57518c6c33af4	2026-08-17T00:19:17.865571+00:00	parameter tying	99.070000%	1902	keep	Union closest position groups 216 and 459	Family: parameter tying. Current retained frontier is 1,903 parameters at 99.070000%, a +0.070000 percentage-point margin over 99%. There have been 20 prior macro-attempts in this family and 203 prior micro-trials. The most recent accepted result is attempt-0078/micro-0182 at 1903 parameters and 99.070000%; the most recent failed result is attempt-0075/micro-0001 (error, no score). This is a parameterization-preserving compression: union current position groups represented by coordinates 216 and 459, whose learned values are 0.0180739686 and 0.0182163268 (absolute difference 1.424e-04), using a multiplicity-weighted mean. Hypothesis: this preserves qualification and yields 1,902 parameters. It is more informative than the nearest untested alternative (difference 1.456e-04) because it is the minimum-distortion eligible union; exact pairs already rejected under the unchanged grouping are excluded. Acceptance and rollback remain solely governed by the official runner.	0	0
attempt-0078	nearest-position-unions-infra-repair	micro-0184	d75865e13caa94ad24791642895806c61d8ca876	e86f11826f5dad81de5d52bf05c7fe9bd6bdd008	2026-08-17T00:20:20.008388+00:00	parameter tying	99.070000%	1901	keep	Union closest position groups 43 and 69	Family: parameter tying. Current retained frontier is 1,902 parameters at 99.070000%, a +0.070000 percentage-point margin over 99%. There have been 20 prior macro-attempts in this family and 204 prior micro-trials. The most recent accepted result is attempt-0078/micro-0183 at 1902 parameters and 99.070000%; the most recent failed result is attempt-0075/micro-0001 (error, no score). This is a parameterization-preserving compression: union current position groups represented by coordinates 43 and 69, whose learned values are -0.0619976893 and -0.0618521385 (absolute difference 1.456e-04), using a multiplicity-weighted mean. Hypothesis: this preserves qualification and yields 1,901 parameters. It is more informative than the nearest untested alternative (difference 1.476e-04) because it is the minimum-distortion eligible union; exact pairs already rejected under the unchanged grouping are excluded. Acceptance and rollback remain solely governed by the official runner.	0	0
