macro_attempt_id	automation_id	micro_attempt_id	commit	parent_commit	timestamp_utc	family	accuracy	parameters	status	description	proposal	train_exit	verify_exit
attempt-0078	nearest-position-unions-infra-repair	micro-0100	e6958a784fb6e03e2be9b6f13c2f1a3b80c61cb6	219da7f67289954a6ccb36c28e6367cba9781a64	2026-08-16T22:52:53.715149+00:00	parameter tying	99.080000%	1985	keep	Union closest position groups 40 and 485	Family: parameter tying. Current retained frontier is 1,986 parameters at 99.080000%, a +0.080000 percentage-point margin over 99%. There have been 20 prior macro-attempts in this family and 120 prior micro-trials. The most recent accepted result is attempt-0078/micro-0099 at 1986 parameters and 99.080000%; the most recent failed result is attempt-0075/micro-0001 (error, no score). This is a parameterization-preserving compression: union current position groups represented by coordinates 40 and 485, whose learned values are -0.0142924758 and -0.0142285088 (absolute difference 6.397e-05), using a multiplicity-weighted mean. Hypothesis: this preserves qualification and yields 1,985 parameters. It is more informative than the nearest untested alternative (difference 6.556e-05) because it is the minimum-distortion eligible union; exact pairs already rejected under the unchanged grouping are excluded. Acceptance and rollback remain solely governed by the official runner.	0	0
attempt-0078	nearest-position-unions-infra-repair	micro-0101	0ea0da8cef5118861ab031c34499b2e319def6f8	e6958a784fb6e03e2be9b6f13c2f1a3b80c61cb6	2026-08-16T22:53:55.658478+00:00	parameter tying	99.080000%	1984	keep	Union closest position groups 154 and 61	Family: parameter tying. Current retained frontier is 1,985 parameters at 99.080000%, a +0.080000 percentage-point margin over 99%. There have been 20 prior macro-attempts in this family and 121 prior micro-trials. The most recent accepted result is attempt-0078/micro-0100 at 1985 parameters and 99.080000%; the most recent failed result is attempt-0075/micro-0001 (error, no score). This is a parameterization-preserving compression: union current position groups represented by coordinates 154 and 61, whose learned values are 0.0038560850 and 0.0039216476 (absolute difference 6.556e-05), using a multiplicity-weighted mean. Hypothesis: this preserves qualification and yields 1,984 parameters. It is more informative than the nearest untested alternative (difference 6.673e-05) because it is the minimum-distortion eligible union; exact pairs already rejected under the unchanged grouping are excluded. Acceptance and rollback remain solely governed by the official runner.	0	0
attempt-0078	nearest-position-unions-infra-repair	micro-0102	3ba6cd5ad2ece04a4c4367f92cdc529867879730	0ea0da8cef5118861ab031c34499b2e319def6f8	2026-08-16T22:54:57.769519+00:00	parameter tying	99.080000%	1983	keep	Union closest position groups 83 and 67	Family: parameter tying. Current retained frontier is 1,984 parameters at 99.080000%, a +0.080000 percentage-point margin over 99%. There have been 20 prior macro-attempts in this family and 122 prior micro-trials. The most recent accepted result is attempt-0078/micro-0101 at 1984 parameters and 99.080000%; the most recent failed result is attempt-0075/micro-0001 (error, no score). This is a parameterization-preserving compression: union current position groups represented by coordinates 83 and 67, whose learned values are -0.0120153734 and -0.0119486405 (absolute difference 6.673e-05), using a multiplicity-weighted mean. Hypothesis: this preserves qualification and yields 1,983 parameters. It is more informative than the nearest untested alternative (difference 6.754e-05) because it is the minimum-distortion eligible union; exact pairs already rejected under the unchanged grouping are excluded. Acceptance and rollback remain solely governed by the official runner.	0	0
attempt-0078	nearest-position-unions-infra-repair	micro-0103	b322904fdce9041e84cf4811c6122b1d368bcfe8	3ba6cd5ad2ece04a4c4367f92cdc529867879730	2026-08-16T22:56:00.498188+00:00	parameter tying	99.080000%	1982	keep	Union closest position groups 57 and 456	Family: parameter tying. Current retained frontier is 1,983 parameters at 99.080000%, a +0.080000 percentage-point margin over 99%. There have been 20 prior macro-attempts in this family and 123 prior micro-trials. The most recent accepted result is attempt-0078/micro-0102 at 1983 parameters and 99.080000%; the most recent failed result is attempt-0075/micro-0001 (error, no score). This is a parameterization-preserving compression: union current position groups represented by coordinates 57 and 456, whose learned values are -0.0206515454 and -0.0205840040 (absolute difference 6.754e-05), using a multiplicity-weighted mean. Hypothesis: this preserves qualification and yields 1,982 parameters. It is more informative than the nearest untested alternative (difference 6.838e-05) because it is the minimum-distortion eligible union; exact pairs already rejected under the unchanged grouping are excluded. Acceptance and rollback remain solely governed by the official runner.	0	0
attempt-0078	nearest-position-unions-infra-repair	micro-0104	743ac291637cd9e0195ecab65103ad86ace702b4	b322904fdce9041e84cf4811c6122b1d368bcfe8	2026-08-16T22:57:02.813830+00:00	parameter tying	99.080000%	1981	keep	Union closest position groups 120 and 157	Family: parameter tying. Current retained frontier is 1,982 parameters at 99.080000%, a +0.080000 percentage-point margin over 99%. There have been 20 prior macro-attempts in this family and 124 prior micro-trials. The most recent accepted result is attempt-0078/micro-0103 at 1982 parameters and 99.080000%; the most recent failed result is attempt-0075/micro-0001 (error, no score). This is a parameterization-preserving compression: union current position groups represented by coordinates 120 and 157, whose learned values are -0.0020501311 and -0.0019817520 (absolute difference 6.838e-05), using a multiplicity-weighted mean. Hypothesis: this preserves qualification and yields 1,981 parameters. It is more informative than the nearest untested alternative (difference 6.874e-05) because it is the minimum-distortion eligible union; exact pairs already rejected under the unchanged grouping are excluded. Acceptance and rollback remain solely governed by the official runner.	0	0
attempt-0078	nearest-position-unions-infra-repair	micro-0105	b85ab0f676431f5d1a57fde1c8a220e650ad47fd	743ac291637cd9e0195ecab65103ad86ace702b4	2026-08-16T22:58:05.572616+00:00	parameter tying	99.080000%	1980	keep	Union closest position groups 215 and 202	Family: parameter tying. Current retained frontier is 1,981 parameters at 99.080000%, a +0.080000 percentage-point margin over 99%. There have been 20 prior macro-attempts in this family and 125 prior micro-trials. The most recent accepted result is attempt-0078/micro-0104 at 1981 parameters and 99.080000%; the most recent failed result is attempt-0075/micro-0001 (error, no score). This is a parameterization-preserving compression: union current position groups represented by coordinates 215 and 202, whose learned values are 0.0224345662 and 0.0225033090 (absolute difference 6.874e-05), using a multiplicity-weighted mean. Hypothesis: this preserves qualification and yields 1,980 parameters. It is more informative than the nearest untested alternative (difference 6.962e-05) because it is the minimum-distortion eligible union; exact pairs already rejected under the unchanged grouping are excluded. Acceptance and rollback remain solely governed by the official runner.	0	0
attempt-0078	nearest-position-unions-infra-repair	micro-0106	fe8770a8251ef5180c4fc4fcba0f9e326242d913	b85ab0f676431f5d1a57fde1c8a220e650ad47fd	2026-08-16T22:59:07.719040+00:00	parameter tying	99.080000%	1979	keep	Union closest position groups 440 and 328	Family: parameter tying. Current retained frontier is 1,980 parameters at 99.080000%, a +0.080000 percentage-point margin over 99%. There have been 20 prior macro-attempts in this family and 126 prior micro-trials. The most recent accepted result is attempt-0078/micro-0105 at 1980 parameters and 99.080000%; the most recent failed result is attempt-0075/micro-0001 (error, no score). This is a parameterization-preserving compression: union current position groups represented by coordinates 440 and 328, whose learned values are -0.0100251315 and -0.0099555161 (absolute difference 6.962e-05), using a multiplicity-weighted mean. Hypothesis: this preserves qualification and yields 1,979 parameters. It is more informative than the nearest untested alternative (difference 7.088e-05) because it is the minimum-distortion eligible union; exact pairs already rejected under the unchanged grouping are excluded. Acceptance and rollback remain solely governed by the official runner.	0	0
attempt-0078	nearest-position-unions-infra-repair	micro-0107	a9aa2e5d9352c5daf97cbec4b9adfc895ab05ad6	fe8770a8251ef5180c4fc4fcba0f9e326242d913	2026-08-16T23:00:09.784170+00:00	parameter tying	99.070000%	1978	keep	Union closest position groups 16 and 491	Family: parameter tying. Current retained frontier is 1,979 parameters at 99.080000%, a +0.080000 percentage-point margin over 99%. There have been 20 prior macro-attempts in this family and 127 prior micro-trials. The most recent accepted result is attempt-0078/micro-0106 at 1979 parameters and 99.080000%; the most recent failed result is attempt-0075/micro-0001 (error, no score). This is a parameterization-preserving compression: union current position groups represented by coordinates 16 and 491, whose learned values are 0.0330912992 and 0.0331621766 (absolute difference 7.088e-05), using a multiplicity-weighted mean. Hypothesis: this preserves qualification and yields 1,978 parameters. It is more informative than the nearest untested alternative (difference 7.179e-05) because it is the minimum-distortion eligible union; exact pairs already rejected under the unchanged grouping are excluded. Acceptance and rollback remain solely governed by the official runner.	0	0
attempt-0078	nearest-position-unions-infra-repair	micro-0108	6bc0992d08551812d8792f944d3a0d96192c6d5a	a9aa2e5d9352c5daf97cbec4b9adfc895ab05ad6	2026-08-16T23:01:12.810047+00:00	parameter tying	99.070000%	1977	keep	Union closest position groups 25 and 105	Family: parameter tying. Current retained frontier is 1,978 parameters at 99.070000%, a +0.070000 percentage-point margin over 99%. There have been 20 prior macro-attempts in this family and 128 prior micro-trials. The most recent accepted result is attempt-0078/micro-0107 at 1978 parameters and 99.070000%; the most recent failed result is attempt-0075/micro-0001 (error, no score). This is a parameterization-preserving compression: union current position groups represented by coordinates 25 and 105, whose learned values are -0.0134382220 and -0.0133664366 (absolute difference 7.179e-05), using a multiplicity-weighted mean. Hypothesis: this preserves qualification and yields 1,977 parameters. It is more informative than the nearest untested alternative (difference 7.403e-05) because it is the minimum-distortion eligible union; exact pairs already rejected under the unchanged grouping are excluded. Acceptance and rollback remain solely governed by the official runner.	0	0
attempt-0078	nearest-position-unions-infra-repair	micro-0109	23de3483d0ecb3428a78f7a4e561547234a0821e	6bc0992d08551812d8792f944d3a0d96192c6d5a	2026-08-16T23:02:14.792887+00:00	parameter tying	99.070000%	1976	keep	Union closest position groups 394 and 41	Family: parameter tying. Current retained frontier is 1,977 parameters at 99.070000%, a +0.070000 percentage-point margin over 99%. There have been 20 prior macro-attempts in this family and 129 prior micro-trials. The most recent accepted result is attempt-0078/micro-0108 at 1977 parameters and 99.070000%; the most recent failed result is attempt-0075/micro-0001 (error, no score). This is a parameterization-preserving compression: union current position groups represented by coordinates 394 and 41, whose learned values are 0.0004470043 and 0.0005210381 (absolute difference 7.403e-05), using a multiplicity-weighted mean. Hypothesis: this preserves qualification and yields 1,976 parameters. It is more informative than the nearest untested alternative (difference 7.534e-05) because it is the minimum-distortion eligible union; exact pairs already rejected under the unchanged grouping are excluded. Acceptance and rollback remain solely governed by the official runner.	0	0
attempt-0078	nearest-position-unions-infra-repair	micro-0110	be41b4ddeac22c237751c671f210bd22ee437e6e	23de3483d0ecb3428a78f7a4e561547234a0821e	2026-08-16T23:03:16.900198+00:00	parameter tying	99.060000%	1975	keep	Union closest position groups 377 and 66	Family: parameter tying. Current retained frontier is 1,976 parameters at 99.070000%, a +0.070000 percentage-point margin over 99%. There have been 20 prior macro-attempts in this family and 130 prior micro-trials. The most recent accepted result is attempt-0078/micro-0109 at 1976 parameters and 99.070000%; the most recent failed result is attempt-0075/micro-0001 (error, no score). This is a parameterization-preserving compression: union current position groups represented by coordinates 377 and 66, whose learned values are -0.0118612573 and -0.0117859123 (absolute difference 7.534e-05), using a multiplicity-weighted mean. Hypothesis: this preserves qualification and yields 1,975 parameters. It is more informative than the nearest untested alternative (difference 7.754e-05) because it is the minimum-distortion eligible union; exact pairs already rejected under the unchanged grouping are excluded. Acceptance and rollback remain solely governed by the official runner.	0	0
attempt-0078	nearest-position-unions-infra-repair	micro-0111	03bda2df5a4dd3920d4d09f5167da520af2f56f2	be41b4ddeac22c237751c671f210bd22ee437e6e	2026-08-16T23:04:19.556280+00:00	parameter tying	99.070000%	1974	keep	Union closest position groups 60 and 6	Family: parameter tying. Current retained frontier is 1,975 parameters at 99.060000%, a +0.060000 percentage-point margin over 99%. There have been 20 prior macro-attempts in this family and 131 prior micro-trials. The most recent accepted result is attempt-0078/micro-0110 at 1975 parameters and 99.060000%; the most recent failed result is attempt-0075/micro-0001 (error, no score). This is a parameterization-preserving compression: union current position groups represented by coordinates 60 and 6, whose learned values are 0.0080489628 and 0.0081265001 (absolute difference 7.754e-05), using a multiplicity-weighted mean. Hypothesis: this preserves qualification and yields 1,974 parameters. It is more informative than the nearest untested alternative (difference 7.780e-05) because it is the minimum-distortion eligible union; exact pairs already rejected under the unchanged grouping are excluded. Acceptance and rollback remain solely governed by the official runner.	0	0
attempt-0078	nearest-position-unions-infra-repair	micro-0112	5d2dd8acd5a4e1fb9919129136a987fcd4606104	03bda2df5a4dd3920d4d09f5167da520af2f56f2	2026-08-16T23:05:22.536701+00:00	parameter tying	99.070000%	1973	keep	Union closest position groups 170 and 392	Family: parameter tying. Current retained frontier is 1,974 parameters at 99.070000%, a +0.070000 percentage-point margin over 99%. There have been 20 prior macro-attempts in this family and 132 prior micro-trials. The most recent accepted result is attempt-0078/micro-0111 at 1974 parameters and 99.070000%; the most recent failed result is attempt-0075/micro-0001 (error, no score). This is a parameterization-preserving compression: union current position groups represented by coordinates 170 and 392, whose learned values are 0.0089218495 and 0.0089996448 (absolute difference 7.780e-05), using a multiplicity-weighted mean. Hypothesis: this preserves qualification and yields 1,973 parameters. It is more informative than the nearest untested alternative (difference 7.853e-05) because it is the minimum-distortion eligible union; exact pairs already rejected under the unchanged grouping are excluded. Acceptance and rollback remain solely governed by the official runner.	0	0
attempt-0078	nearest-position-unions-infra-repair	micro-0113	e23dcc8aa75141fac025d60e47aef6617ed1b2db	5d2dd8acd5a4e1fb9919129136a987fcd4606104	2026-08-16T23:06:24.572286+00:00	parameter tying	99.050000%	1972	keep	Union closest position groups 344 and 136	Family: parameter tying. Current retained frontier is 1,973 parameters at 99.070000%, a +0.070000 percentage-point margin over 99%. There have been 20 prior macro-attempts in this family and 133 prior micro-trials. The most recent accepted result is attempt-0078/micro-0112 at 1973 parameters and 99.070000%; the most recent failed result is attempt-0075/micro-0001 (error, no score). This is a parameterization-preserving compression: union current position groups represented by coordinates 344 and 136, whose learned values are 0.0092173573 and 0.0092958901 (absolute difference 7.853e-05), using a multiplicity-weighted mean. Hypothesis: this preserves qualification and yields 1,972 parameters. It is more informative than the nearest untested alternative (difference 7.878e-05) because it is the minimum-distortion eligible union; exact pairs already rejected under the unchanged grouping are excluded. Acceptance and rollback remain solely governed by the official runner.	0	0
attempt-0078	nearest-position-unions-infra-repair	micro-0114	f01e0f509198e07e094dbf8cab370365160a364d	e23dcc8aa75141fac025d60e47aef6617ed1b2db	2026-08-16T23:07:26.671840+00:00	parameter tying	99.060000%	1971	keep	Union closest position groups 445 and 455	Family: parameter tying. Current retained frontier is 1,972 parameters at 99.050000%, a +0.050000 percentage-point margin over 99%. There have been 20 prior macro-attempts in this family and 134 prior micro-trials. The most recent accepted result is attempt-0078/micro-0113 at 1972 parameters and 99.050000%; the most recent failed result is attempt-0075/micro-0001 (error, no score). This is a parameterization-preserving compression: union current position groups represented by coordinates 445 and 455, whose learned values are 0.0314358808 and 0.0315146595 (absolute difference 7.878e-05), using a multiplicity-weighted mean. Hypothesis: this preserves qualification and yields 1,971 parameters. It is more informative than the nearest untested alternative (difference 8.052e-05) because it is the minimum-distortion eligible union; exact pairs already rejected under the unchanged grouping are excluded. Acceptance and rollback remain solely governed by the official runner.	0	0
attempt-0078	nearest-position-unions-infra-repair	micro-0115	2317128d9f1f7beaad56f95bd4abb2729bbda5f8	f01e0f509198e07e094dbf8cab370365160a364d	2026-08-16T23:08:29.953916+00:00	parameter tying	99.060000%	1970	keep	Union closest position groups 77 and 362	Family: parameter tying. Current retained frontier is 1,971 parameters at 99.060000%, a +0.060000 percentage-point margin over 99%. There have been 20 prior macro-attempts in this family and 135 prior micro-trials. The most recent accepted result is attempt-0078/micro-0114 at 1971 parameters and 99.060000%; the most recent failed result is attempt-0075/micro-0001 (error, no score). This is a parameterization-preserving compression: union current position groups represented by coordinates 77 and 362, whose learned values are 0.0007877152 and 0.0008682332 (absolute difference 8.052e-05), using a multiplicity-weighted mean. Hypothesis: this preserves qualification and yields 1,970 parameters. It is more informative than the nearest untested alternative (difference 8.069e-05) because it is the minimum-distortion eligible union; exact pairs already rejected under the unchanged grouping are excluded. Acceptance and rollback remain solely governed by the official runner.	0	0
attempt-0078	nearest-position-unions-infra-repair	micro-0116	a94a2d02ac475765985108f175efca5a4c2f9bbb	2317128d9f1f7beaad56f95bd4abb2729bbda5f8	2026-08-16T23:09:31.772260+00:00	parameter tying	99.060000%	1969	keep	Union closest position groups 156 and 343	Family: parameter tying. Current retained frontier is 1,970 parameters at 99.060000%, a +0.060000 percentage-point margin over 99%. There have been 20 prior macro-attempts in this family and 136 prior micro-trials. The most recent accepted result is attempt-0078/micro-0115 at 1970 parameters and 99.060000%; the most recent failed result is attempt-0075/micro-0001 (error, no score). This is a parameterization-preserving compression: union current position groups represented by coordinates 156 and 343, whose learned values are -0.0508982651 and -0.0508175753 (absolute difference 8.069e-05), using a multiplicity-weighted mean. Hypothesis: this preserves qualification and yields 1,969 parameters. It is more informative than the nearest untested alternative (difference 8.201e-05) because it is the minimum-distortion eligible union; exact pairs already rejected under the unchanged grouping are excluded. Acceptance and rollback remain solely governed by the official runner.	0	0
