macro_attempt_id	automation_id	micro_attempt_id	commit	parent_commit	timestamp_utc	family	accuracy	parameters	status	description	proposal	train_exit	verify_exit
attempt-0170	ff-output-continuation-after-cap	micro-0013	a246f308a837beab3a3a46fe9f2c76e081d8d8c8	e1fe882e9d248456f9b9a05876f82814eb057abd	2026-08-17T11:01:22.128888+00:00	parameter tying	99.030000%	1553	keep	Union closest shared FF-output scalar groups 162 and 12	Family: parameter tying. Current retained frontier is 1,554 parameters at 99.060000%, a +0.060000 percentage-point margin over 99%. There have been 67 prior macro-attempts in this family and 585 prior micro-trials. The most recent accepted result is attempt-0169/micro-0020 at 1,566 parameters and 99.02%; the most recent failed result is attempt-0168/micro-0005 (FF-output pair 183/223 discarded at 98.99%). This is a parameterization-preserving compression of the depth-shared feed-forward output map: union flattened coordinates 162 and 12, values 0.0793660805 and 0.0798583329 (difference 4.923e-04), using a weighted mean and integer reconstruction. Hypothesis: residual-stream reconstruction contains near-duplicate scalars distinct from FF-input redundancy, preserving qualification at 1,553 parameters. It is more informative than the next FF-output union (difference 4.960e-04) because it is the minimum-distortion isolated test of the complementary FF map. Official acceptance and rollback are unchanged.	0	0
attempt-0170	ff-output-continuation-after-cap	micro-0014	ae5fb49ae4d2ed0cd73cfd14d49c3f14c583446d	a246f308a837beab3a3a46fe9f2c76e081d8d8c8	2026-08-17T11:02:32.951790+00:00	parameter tying	99.010000%	1552	keep	Union closest shared FF-output scalar groups 16 and 20	Family: parameter tying. Current retained frontier is 1,553 parameters at 99.030000%, a +0.030000 percentage-point margin over 99%. There have been 67 prior macro-attempts in this family and 586 prior micro-trials. The most recent accepted result is attempt-0169/micro-0020 at 1,566 parameters and 99.02%; the most recent failed result is attempt-0168/micro-0005 (FF-output pair 183/223 discarded at 98.99%). This is a parameterization-preserving compression of the depth-shared feed-forward output map: union flattened coordinates 16 and 20, values 0.0383602604 and 0.0388562679 (difference 4.960e-04), using a weighted mean and integer reconstruction. Hypothesis: residual-stream reconstruction contains near-duplicate scalars distinct from FF-input redundancy, preserving qualification at 1,552 parameters. It is more informative than the next FF-output union (difference 5.043e-04) because it is the minimum-distortion isolated test of the complementary FF map. Official acceptance and rollback are unchanged.	0	0
attempt-0170	ff-output-continuation-after-cap	micro-0015	c9bc8f63257e6543c2d883bea64058d933e64eca	ae5fb49ae4d2ed0cd73cfd14d49c3f14c583446d	2026-08-17T11:03:45.503703+00:00	parameter tying	98.950000%	1551	discard	Union closest shared FF-output scalar groups 10 and 223	Family: parameter tying. Current retained frontier is 1,552 parameters at 99.010000%, a +0.010000 percentage-point margin over 99%. There have been 67 prior macro-attempts in this family and 587 prior micro-trials. The most recent accepted result is attempt-0169/micro-0020 at 1,566 parameters and 99.02%; the most recent failed result is attempt-0168/micro-0005 (FF-output pair 183/223 discarded at 98.99%). This is a parameterization-preserving compression of the depth-shared feed-forward output map: union flattened coordinates 10 and 223, values 0.0252254847 and 0.0257297587 (difference 5.043e-04), using a weighted mean and integer reconstruction. Hypothesis: residual-stream reconstruction contains near-duplicate scalars distinct from FF-input redundancy, preserving qualification at 1,551 parameters. It is more informative than the next FF-output union (difference 5.083e-04) because it is the minimum-distortion isolated test of the complementary FF map. Official acceptance and rollback are unchanged.	0	0
attempt-0171	ff-output-skip-five-sensitive-pairs	micro-0001	7455d6b4badd186be56300e45c74d7201afdc919	ae5fb49ae4d2ed0cd73cfd14d49c3f14c583446d	2026-08-17T11:05:47.564110+00:00	parameter tying	99.020000%	1551	keep	Union closest shared FF-output scalar groups 6 and 151	Family: parameter tying. Current retained frontier is 1,552 parameters at 99.010000%, a +0.010000 percentage-point margin over 99%. There have been 68 prior macro-attempts in this family and 588 prior micro-trials. The most recent accepted result is attempt-0170/micro-0014 at 1,552 parameters and 99.01%; the most recent failed result is attempt-0170/micro-0015 (FF-output pair 10/223 discarded at 98.95%). This is a parameterization-preserving compression of the depth-shared feed-forward output map: union flattened coordinates 6 and 151, values 0.0022512816 and 0.0027595749 (difference 5.083e-04), using a weighted mean and integer reconstruction. Hypothesis: residual-stream reconstruction contains near-duplicate scalars distinct from FF-input redundancy, preserving qualification at 1,551 parameters. It is more informative than the next FF-output union (difference 5.208e-04) because it is the minimum-distortion isolated test of the complementary FF map. Official acceptance and rollback are unchanged.	0	0
attempt-0171	ff-output-skip-five-sensitive-pairs	micro-0002	c6faf008fa76f4a82b436b4666864f49973a9913	7455d6b4badd186be56300e45c74d7201afdc919	2026-08-17T11:07:10.130702+00:00	parameter tying	99.050000%	1550	keep	Union closest shared FF-output scalar groups 89 and 127	Family: parameter tying. Current retained frontier is 1,551 parameters at 99.020000%, a +0.020000 percentage-point margin over 99%. There have been 68 prior macro-attempts in this family and 589 prior micro-trials. The most recent accepted result is attempt-0170/micro-0014 at 1,552 parameters and 99.01%; the most recent failed result is attempt-0170/micro-0015 (FF-output pair 10/223 discarded at 98.95%). This is a parameterization-preserving compression of the depth-shared feed-forward output map: union flattened coordinates 89 and 127, values 0.0070689167 and 0.0075896727 (difference 5.208e-04), using a weighted mean and integer reconstruction. Hypothesis: residual-stream reconstruction contains near-duplicate scalars distinct from FF-input redundancy, preserving qualification at 1,550 parameters. It is more informative than the next FF-output union (difference 5.252e-04) because it is the minimum-distortion isolated test of the complementary FF map. Official acceptance and rollback are unchanged.	0	0
attempt-0171	ff-output-skip-five-sensitive-pairs	micro-0003	0a77d84e80091f9c6876061d2303d190e65183ba	c6faf008fa76f4a82b436b4666864f49973a9913	2026-08-17T11:08:22.236482+00:00	parameter tying	99.060000%	1549	keep	Union closest shared FF-output scalar groups 132 and 46	Family: parameter tying. Current retained frontier is 1,550 parameters at 99.050000%, a +0.050000 percentage-point margin over 99%. There have been 68 prior macro-attempts in this family and 590 prior micro-trials. The most recent accepted result is attempt-0170/micro-0014 at 1,552 parameters and 99.01%; the most recent failed result is attempt-0170/micro-0015 (FF-output pair 10/223 discarded at 98.95%). This is a parameterization-preserving compression of the depth-shared feed-forward output map: union flattened coordinates 132 and 46, values 0.0701191798 and 0.0706444234 (difference 5.252e-04), using a weighted mean and integer reconstruction. Hypothesis: residual-stream reconstruction contains near-duplicate scalars distinct from FF-input redundancy, preserving qualification at 1,549 parameters. It is more informative than the next FF-output union (difference 5.266e-04) because it is the minimum-distortion isolated test of the complementary FF map. Official acceptance and rollback are unchanged.	0	0
attempt-0171	ff-output-skip-five-sensitive-pairs	micro-0004	d4d8c846d39b07a6823d812aac24550003c2ed8e	0a77d84e80091f9c6876061d2303d190e65183ba	2026-08-17T11:09:38.355356+00:00	parameter tying	99.100000%	1548	keep	Union closest shared FF-output scalar groups 245 and 5	Family: parameter tying. Current retained frontier is 1,549 parameters at 99.060000%, a +0.060000 percentage-point margin over 99%. There have been 68 prior macro-attempts in this family and 591 prior micro-trials. The most recent accepted result is attempt-0170/micro-0014 at 1,552 parameters and 99.01%; the most recent failed result is attempt-0170/micro-0015 (FF-output pair 10/223 discarded at 98.95%). This is a parameterization-preserving compression of the depth-shared feed-forward output map: union flattened coordinates 245 and 5, values -0.0484234169 and -0.0478968397 (difference 5.266e-04), using a weighted mean and integer reconstruction. Hypothesis: residual-stream reconstruction contains near-duplicate scalars distinct from FF-input redundancy, preserving qualification at 1,548 parameters. It is more informative than the next FF-output union (difference 5.272e-04) because it is the minimum-distortion isolated test of the complementary FF map. Official acceptance and rollback are unchanged.	0	0
attempt-0171	ff-output-skip-five-sensitive-pairs	micro-0005	dbc851b57858a2a595a3d8443dfef1a4d2dfc97c	d4d8c846d39b07a6823d812aac24550003c2ed8e	2026-08-17T11:10:54.234479+00:00	parameter tying	99.100000%	1547	keep	Union closest shared FF-output scalar groups 15 and 226	Family: parameter tying. Current retained frontier is 1,548 parameters at 99.100000%, a +0.100000 percentage-point margin over 99%. There have been 68 prior macro-attempts in this family and 592 prior micro-trials. The most recent accepted result is attempt-0170/micro-0014 at 1,552 parameters and 99.01%; the most recent failed result is attempt-0170/micro-0015 (FF-output pair 10/223 discarded at 98.95%). This is a parameterization-preserving compression of the depth-shared feed-forward output map: union flattened coordinates 15 and 226, values -0.0231623966 and -0.0226352066 (difference 5.272e-04), using a weighted mean and integer reconstruction. Hypothesis: residual-stream reconstruction contains near-duplicate scalars distinct from FF-input redundancy, preserving qualification at 1,547 parameters. It is more informative than the next FF-output union (difference 5.359e-04) because it is the minimum-distortion isolated test of the complementary FF map. Official acceptance and rollback are unchanged.	0	0
attempt-0171	ff-output-skip-five-sensitive-pairs	micro-0006	01debe3b54b1f4cf1c133a5ffd26ef27dd2613fe	dbc851b57858a2a595a3d8443dfef1a4d2dfc97c	2026-08-17T11:12:08.278612+00:00	parameter tying	99.100000%	1546	keep	Union closest shared FF-output scalar groups 86 and 254	Family: parameter tying. Current retained frontier is 1,547 parameters at 99.100000%, a +0.100000 percentage-point margin over 99%. There have been 68 prior macro-attempts in this family and 593 prior micro-trials. The most recent accepted result is attempt-0170/micro-0014 at 1,552 parameters and 99.01%; the most recent failed result is attempt-0170/micro-0015 (FF-output pair 10/223 discarded at 98.95%). This is a parameterization-preserving compression of the depth-shared feed-forward output map: union flattened coordinates 86 and 254, values -0.0456015058 and -0.0450655892 (difference 5.359e-04), using a weighted mean and integer reconstruction. Hypothesis: residual-stream reconstruction contains near-duplicate scalars distinct from FF-input redundancy, preserving qualification at 1,546 parameters. It is more informative than the next FF-output union (difference 5.402e-04) because it is the minimum-distortion isolated test of the complementary FF map. Official acceptance and rollback are unchanged.	0	0
attempt-0171	ff-output-skip-five-sensitive-pairs	micro-0007	786c7f97da68d3c95992e26aba73bda71e989c71	01debe3b54b1f4cf1c133a5ffd26ef27dd2613fe	2026-08-17T11:13:22.493580+00:00	parameter tying	99.090000%	1545	keep	Union closest shared FF-output scalar groups 18 and 44	Family: parameter tying. Current retained frontier is 1,546 parameters at 99.100000%, a +0.100000 percentage-point margin over 99%. There have been 68 prior macro-attempts in this family and 594 prior micro-trials. The most recent accepted result is attempt-0170/micro-0014 at 1,552 parameters and 99.01%; the most recent failed result is attempt-0170/micro-0015 (FF-output pair 10/223 discarded at 98.95%). This is a parameterization-preserving compression of the depth-shared feed-forward output map: union flattened coordinates 18 and 44, values 0.0200012829 and 0.0205414537 (difference 5.402e-04), using a weighted mean and integer reconstruction. Hypothesis: residual-stream reconstruction contains near-duplicate scalars distinct from FF-input redundancy, preserving qualification at 1,545 parameters. It is more informative than the next FF-output union (difference 5.502e-04) because it is the minimum-distortion isolated test of the complementary FF map. Official acceptance and rollback are unchanged.	0	0
attempt-0171	ff-output-skip-five-sensitive-pairs	micro-0008	ba00a57b259bec08c9d498707f08298f514535d7	786c7f97da68d3c95992e26aba73bda71e989c71	2026-08-17T11:14:36.439681+00:00	parameter tying	99.050000%	1544	keep	Union closest shared FF-output scalar groups 94 and 161	Family: parameter tying. Current retained frontier is 1,545 parameters at 99.090000%, a +0.090000 percentage-point margin over 99%. There have been 68 prior macro-attempts in this family and 595 prior micro-trials. The most recent accepted result is attempt-0170/micro-0014 at 1,552 parameters and 99.01%; the most recent failed result is attempt-0170/micro-0015 (FF-output pair 10/223 discarded at 98.95%). This is a parameterization-preserving compression of the depth-shared feed-forward output map: union flattened coordinates 94 and 161, values 0.0466198213 and 0.0471700504 (difference 5.502e-04), using a weighted mean and integer reconstruction. Hypothesis: residual-stream reconstruction contains near-duplicate scalars distinct from FF-input redundancy, preserving qualification at 1,544 parameters. It is more informative than the next FF-output union (difference 5.554e-04) because it is the minimum-distortion isolated test of the complementary FF map. Official acceptance and rollback are unchanged.	0	0
attempt-0171	ff-output-skip-five-sensitive-pairs	micro-0009	00c221e8571c06df4d3a5676c46b88a6fef9afdf	ba00a57b259bec08c9d498707f08298f514535d7	2026-08-17T11:15:56.245228+00:00	parameter tying	99.070000%	1543	keep	Union closest shared FF-output scalar groups 243 and 196	Family: parameter tying. Current retained frontier is 1,544 parameters at 99.050000%, a +0.050000 percentage-point margin over 99%. There have been 68 prior macro-attempts in this family and 596 prior micro-trials. The most recent accepted result is attempt-0170/micro-0014 at 1,552 parameters and 99.01%; the most recent failed result is attempt-0170/micro-0015 (FF-output pair 10/223 discarded at 98.95%). This is a parameterization-preserving compression of the depth-shared feed-forward output map: union flattened coordinates 243 and 196, values -0.0009831287 and -0.0004276995 (difference 5.554e-04), using a weighted mean and integer reconstruction. Hypothesis: residual-stream reconstruction contains near-duplicate scalars distinct from FF-input redundancy, preserving qualification at 1,543 parameters. It is more informative than the next FF-output union (difference 5.566e-04) because it is the minimum-distortion isolated test of the complementary FF map. Official acceptance and rollback are unchanged.	0	0
attempt-0171	ff-output-skip-five-sensitive-pairs	micro-0010	e3a5214729089dd62806d64208bcb1f720e41079	00c221e8571c06df4d3a5676c46b88a6fef9afdf	2026-08-17T11:17:25.684475+00:00	parameter tying	99.110000%	1542	keep	Union closest shared FF-output scalar groups 55 and 242	Family: parameter tying. Current retained frontier is 1,543 parameters at 99.070000%, a +0.070000 percentage-point margin over 99%. There have been 68 prior macro-attempts in this family and 597 prior micro-trials. The most recent accepted result is attempt-0170/micro-0014 at 1,552 parameters and 99.01%; the most recent failed result is attempt-0170/micro-0015 (FF-output pair 10/223 discarded at 98.95%). This is a parameterization-preserving compression of the depth-shared feed-forward output map: union flattened coordinates 55 and 242, values 0.0049494812 and 0.0055060694 (difference 5.566e-04), using a weighted mean and integer reconstruction. Hypothesis: residual-stream reconstruction contains near-duplicate scalars distinct from FF-input redundancy, preserving qualification at 1,542 parameters. It is more informative than the next FF-output union (difference 5.612e-04) because it is the minimum-distortion isolated test of the complementary FF map. Official acceptance and rollback are unchanged.	0	0
attempt-0171	ff-output-skip-five-sensitive-pairs	micro-0011	0a00e93c3b380ac8d38b1770a4c393e6c7d3f093	e3a5214729089dd62806d64208bcb1f720e41079	2026-08-17T11:18:38.832239+00:00	parameter tying	99.030000%	1541	keep	Union closest shared FF-output scalar groups 252 and 65	Family: parameter tying. Current retained frontier is 1,542 parameters at 99.110000%, a +0.110000 percentage-point margin over 99%. There have been 68 prior macro-attempts in this family and 598 prior micro-trials. The most recent accepted result is attempt-0170/micro-0014 at 1,552 parameters and 99.01%; the most recent failed result is attempt-0170/micro-0015 (FF-output pair 10/223 discarded at 98.95%). This is a parameterization-preserving compression of the depth-shared feed-forward output map: union flattened coordinates 252 and 65, values 0.0119936159 and 0.0125547815 (difference 5.612e-04), using a weighted mean and integer reconstruction. Hypothesis: residual-stream reconstruction contains near-duplicate scalars distinct from FF-input redundancy, preserving qualification at 1,541 parameters. It is more informative than the next FF-output union (difference 5.823e-04) because it is the minimum-distortion isolated test of the complementary FF map. Official acceptance and rollback are unchanged.	0	0
attempt-0171	ff-output-skip-five-sensitive-pairs	micro-0012	2b3ee03870671d541c7c99f7f7ce0851420f6080	0a00e93c3b380ac8d38b1770a4c393e6c7d3f093	2026-08-17T11:19:51.171624+00:00	parameter tying	99.020000%	1540	keep	Union closest shared FF-output scalar groups 198 and 184	Family: parameter tying. Current retained frontier is 1,541 parameters at 99.030000%, a +0.030000 percentage-point margin over 99%. There have been 68 prior macro-attempts in this family and 599 prior micro-trials. The most recent accepted result is attempt-0170/micro-0014 at 1,552 parameters and 99.01%; the most recent failed result is attempt-0170/micro-0015 (FF-output pair 10/223 discarded at 98.95%). This is a parameterization-preserving compression of the depth-shared feed-forward output map: union flattened coordinates 198 and 184, values -0.0313365795 and -0.0307543278 (difference 5.823e-04), using a weighted mean and integer reconstruction. Hypothesis: residual-stream reconstruction contains near-duplicate scalars distinct from FF-input redundancy, preserving qualification at 1,540 parameters. It is more informative than the next FF-output union (difference 5.840e-04) because it is the minimum-distortion isolated test of the complementary FF map. Official acceptance and rollback are unchanged.	0	0
attempt-0171	ff-output-skip-five-sensitive-pairs	micro-0013	9e34e61a4cf0e5dcc8070141848499d4d08e2a20	2b3ee03870671d541c7c99f7f7ce0851420f6080	2026-08-17T11:21:04.903781+00:00	parameter tying	98.980000%	1539	discard	Union closest shared FF-output scalar groups 236 and 180	Family: parameter tying. Current retained frontier is 1,540 parameters at 99.020000%, a +0.020000 percentage-point margin over 99%. There have been 68 prior macro-attempts in this family and 600 prior micro-trials. The most recent accepted result is attempt-0170/micro-0014 at 1,552 parameters and 99.01%; the most recent failed result is attempt-0170/micro-0015 (FF-output pair 10/223 discarded at 98.95%). This is a parameterization-preserving compression of the depth-shared feed-forward output map: union flattened coordinates 236 and 180, values -0.0284643732 and -0.0278803911 (difference 5.840e-04), using a weighted mean and integer reconstruction. Hypothesis: residual-stream reconstruction contains near-duplicate scalars distinct from FF-input redundancy, preserving qualification at 1,539 parameters. It is more informative than the next FF-output union (difference 6.133e-04) because it is the minimum-distortion isolated test of the complementary FF map. Official acceptance and rollback are unchanged.	0	0
