macro_attempt_id	automation_id	micro_attempt_id	commit	parent_commit	timestamp_utc	family	accuracy	parameters	status	description	proposal	train_exit	verify_exit
attempt-0085	nearest-shared-ff-output-unions	micro-0005	c4f20b83968a43fbe7473aed169cd6fc0405c303	7b821e2f6b51456d08261a0a0ece50bff7c53d10	2026-08-17T04:09:40.540816+00:00	parameter tying	99.010000%	1719	keep	Union closest shared FF-output scalar groups 95 and 186	Family: parameter tying. Current retained frontier is 1,720 parameters at 99.010000%, a +0.010000 percentage-point margin over 99%. There have been 27 prior macro-attempts in this family and 390 prior micro-trials. The most recent accepted result is attempt-0085/micro-0004 at 1720 parameters and 99.010000%; the most recent failed result is attempt-0081/micro-0007 (discard, 98.970000%). This is a parameterization-preserving compression of the depth-shared feed-forward output map: union flattened coordinates 95 and 186, values -0.0073430655 and -0.0073348526 (difference 8.213e-06), using a weighted mean and integer reconstruction. Hypothesis: residual-stream reconstruction contains near-duplicate scalars distinct from FF-input redundancy, preserving qualification at 1,719 parameters. It is more informative than the next FF-output union (difference 1.008e-05) because it is the minimum-distortion isolated test of the complementary FF map. Official acceptance and rollback are unchanged.	0	0
attempt-0085	nearest-shared-ff-output-unions	micro-0006	e3473bdfd4d92068cbd1a116155030a0e2d01b54	c4f20b83968a43fbe7473aed169cd6fc0405c303	2026-08-17T04:11:00.631150+00:00	parameter tying	99.010000%	1718	keep	Union closest shared FF-output scalar groups 173 and 74	Family: parameter tying. Current retained frontier is 1,719 parameters at 99.010000%, a +0.010000 percentage-point margin over 99%. There have been 27 prior macro-attempts in this family and 391 prior micro-trials. The most recent accepted result is attempt-0085/micro-0005 at 1719 parameters and 99.010000%; the most recent failed result is attempt-0081/micro-0007 (discard, 98.970000%). This is a parameterization-preserving compression of the depth-shared feed-forward output map: union flattened coordinates 173 and 74, values -0.0099952463 and -0.0099851647 (difference 1.008e-05), using a weighted mean and integer reconstruction. Hypothesis: residual-stream reconstruction contains near-duplicate scalars distinct from FF-input redundancy, preserving qualification at 1,718 parameters. It is more informative than the next FF-output union (difference 1.588e-05) because it is the minimum-distortion isolated test of the complementary FF map. Official acceptance and rollback are unchanged.	0	0
attempt-0085	nearest-shared-ff-output-unions	micro-0007	80a4b5c100bce06596a0d58d231e700cc61cd63c	e3473bdfd4d92068cbd1a116155030a0e2d01b54	2026-08-17T04:12:19.365581+00:00	parameter tying	99.010000%	1717	keep	Union closest shared FF-output scalar groups 31 and 15	Family: parameter tying. Current retained frontier is 1,718 parameters at 99.010000%, a +0.010000 percentage-point margin over 99%. There have been 27 prior macro-attempts in this family and 392 prior micro-trials. The most recent accepted result is attempt-0085/micro-0006 at 1718 parameters and 99.010000%; the most recent failed result is attempt-0081/micro-0007 (discard, 98.970000%). This is a parameterization-preserving compression of the depth-shared feed-forward output map: union flattened coordinates 31 and 15, values -0.0231396053 and -0.0231237300 (difference 1.588e-05), using a weighted mean and integer reconstruction. Hypothesis: residual-stream reconstruction contains near-duplicate scalars distinct from FF-input redundancy, preserving qualification at 1,717 parameters. It is more informative than the next FF-output union (difference 1.649e-05) because it is the minimum-distortion isolated test of the complementary FF map. Official acceptance and rollback are unchanged.	0	0
attempt-0085	nearest-shared-ff-output-unions	micro-0008	bc72ac30a154e6b3e88f6f80386b1b3ace9a9858	80a4b5c100bce06596a0d58d231e700cc61cd63c	2026-08-17T04:13:35.237278+00:00	parameter tying	99.010000%	1716	keep	Union closest shared FF-output scalar groups 193 and 56	Family: parameter tying. Current retained frontier is 1,717 parameters at 99.010000%, a +0.010000 percentage-point margin over 99%. There have been 27 prior macro-attempts in this family and 393 prior micro-trials. The most recent accepted result is attempt-0085/micro-0007 at 1717 parameters and 99.010000%; the most recent failed result is attempt-0081/micro-0007 (discard, 98.970000%). This is a parameterization-preserving compression of the depth-shared feed-forward output map: union flattened coordinates 193 and 56, values -0.0082539106 and -0.0082374234 (difference 1.649e-05), using a weighted mean and integer reconstruction. Hypothesis: residual-stream reconstruction contains near-duplicate scalars distinct from FF-input redundancy, preserving qualification at 1,716 parameters. It is more informative than the next FF-output union (difference 2.470e-05) because it is the minimum-distortion isolated test of the complementary FF map. Official acceptance and rollback are unchanged.	0	0
attempt-0085	nearest-shared-ff-output-unions	micro-0009	3f00aa697c5d48617c019077c388daa68f927438	bc72ac30a154e6b3e88f6f80386b1b3ace9a9858	2026-08-17T04:14:44.121935+00:00	parameter tying	99.010000%	1715	keep	Union closest shared FF-output scalar groups 66 and 72	Family: parameter tying. Current retained frontier is 1,716 parameters at 99.010000%, a +0.010000 percentage-point margin over 99%. There have been 27 prior macro-attempts in this family and 394 prior micro-trials. The most recent accepted result is attempt-0085/micro-0008 at 1716 parameters and 99.010000%; the most recent failed result is attempt-0081/micro-0007 (discard, 98.970000%). This is a parameterization-preserving compression of the depth-shared feed-forward output map: union flattened coordinates 66 and 72, values -0.0175382923 and -0.0175135955 (difference 2.470e-05), using a weighted mean and integer reconstruction. Hypothesis: residual-stream reconstruction contains near-duplicate scalars distinct from FF-input redundancy, preserving qualification at 1,715 parameters. It is more informative than the next FF-output union (difference 2.620e-05) because it is the minimum-distortion isolated test of the complementary FF map. Official acceptance and rollback are unchanged.	0	0
attempt-0085	nearest-shared-ff-output-unions	micro-0010	aca5b7e7293d2da74f89addd26d54717b0357f31	3f00aa697c5d48617c019077c388daa68f927438	2026-08-17T04:15:54.571697+00:00	parameter tying	99.020000%	1714	keep	Union closest shared FF-output scalar groups 13 and 81	Family: parameter tying. Current retained frontier is 1,715 parameters at 99.010000%, a +0.010000 percentage-point margin over 99%. There have been 27 prior macro-attempts in this family and 395 prior micro-trials. The most recent accepted result is attempt-0085/micro-0009 at 1715 parameters and 99.010000%; the most recent failed result is attempt-0081/micro-0007 (discard, 98.970000%). This is a parameterization-preserving compression of the depth-shared feed-forward output map: union flattened coordinates 13 and 81, values -0.0195355304 and -0.0195093341 (difference 2.620e-05), using a weighted mean and integer reconstruction. Hypothesis: residual-stream reconstruction contains near-duplicate scalars distinct from FF-input redundancy, preserving qualification at 1,714 parameters. It is more informative than the next FF-output union (difference 2.776e-05) because it is the minimum-distortion isolated test of the complementary FF map. Official acceptance and rollback are unchanged.	0	0
attempt-0085	nearest-shared-ff-output-unions	micro-0011	04642bc33a43291315044a7f9c4a7043dc17620a	aca5b7e7293d2da74f89addd26d54717b0357f31	2026-08-17T04:17:09.018678+00:00	parameter tying	99.020000%	1713	keep	Union closest shared FF-output scalar groups 111 and 229	Family: parameter tying. Current retained frontier is 1,714 parameters at 99.020000%, a +0.020000 percentage-point margin over 99%. There have been 27 prior macro-attempts in this family and 396 prior micro-trials. The most recent accepted result is attempt-0085/micro-0010 at 1714 parameters and 99.020000%; the most recent failed result is attempt-0081/micro-0007 (discard, 98.970000%). This is a parameterization-preserving compression of the depth-shared feed-forward output map: union flattened coordinates 111 and 229, values -0.0503592528 and -0.0503314957 (difference 2.776e-05), using a weighted mean and integer reconstruction. Hypothesis: residual-stream reconstruction contains near-duplicate scalars distinct from FF-input redundancy, preserving qualification at 1,713 parameters. It is more informative than the next FF-output union (difference 3.893e-05) because it is the minimum-distortion isolated test of the complementary FF map. Official acceptance and rollback are unchanged.	0	0
attempt-0085	nearest-shared-ff-output-unions	micro-0012	4adf7ab6dc39eba4b0df5efd3c1e9f0e99c9b629	04642bc33a43291315044a7f9c4a7043dc17620a	2026-08-17T04:18:45.179460+00:00	parameter tying	99.020000%	1712	keep	Union closest shared FF-output scalar groups 207 and 184	Family: parameter tying. Current retained frontier is 1,713 parameters at 99.020000%, a +0.020000 percentage-point margin over 99%. There have been 27 prior macro-attempts in this family and 397 prior micro-trials. The most recent accepted result is attempt-0085/micro-0011 at 1713 parameters and 99.020000%; the most recent failed result is attempt-0081/micro-0007 (discard, 98.970000%). This is a parameterization-preserving compression of the depth-shared feed-forward output map: union flattened coordinates 207 and 184, values -0.0307737924 and -0.0307348650 (difference 3.893e-05), using a weighted mean and integer reconstruction. Hypothesis: residual-stream reconstruction contains near-duplicate scalars distinct from FF-input redundancy, preserving qualification at 1,712 parameters. It is more informative than the next FF-output union (difference 4.079e-05) because it is the minimum-distortion isolated test of the complementary FF map. Official acceptance and rollback are unchanged.	0	0
attempt-0085	nearest-shared-ff-output-unions	micro-0013	d3681c99f5cf420c6206a8b740360d79186277b0	4adf7ab6dc39eba4b0df5efd3c1e9f0e99c9b629	2026-08-17T04:19:52.562623+00:00	parameter tying	99.030000%	1711	keep	Union closest shared FF-output scalar groups 210 and 204	Family: parameter tying. Current retained frontier is 1,712 parameters at 99.020000%, a +0.020000 percentage-point margin over 99%. There have been 27 prior macro-attempts in this family and 398 prior micro-trials. The most recent accepted result is attempt-0085/micro-0012 at 1712 parameters and 99.020000%; the most recent failed result is attempt-0081/micro-0007 (discard, 98.970000%). This is a parameterization-preserving compression of the depth-shared feed-forward output map: union flattened coordinates 210 and 204, values 0.0001060503 and 0.0001468362 (difference 4.079e-05), using a weighted mean and integer reconstruction. Hypothesis: residual-stream reconstruction contains near-duplicate scalars distinct from FF-input redundancy, preserving qualification at 1,711 parameters. It is more informative than the next FF-output union (difference 4.682e-05) because it is the minimum-distortion isolated test of the complementary FF map. Official acceptance and rollback are unchanged.	0	0
attempt-0085	nearest-shared-ff-output-unions	micro-0014	1f4cdfbd5c63a96056ffc871a99393ac0e055632	d3681c99f5cf420c6206a8b740360d79186277b0	2026-08-17T04:21:04.607202+00:00	parameter tying	99.030000%	1710	keep	Union closest shared FF-output scalar groups 145 and 83	Family: parameter tying. Current retained frontier is 1,711 parameters at 99.030000%, a +0.030000 percentage-point margin over 99%. There have been 27 prior macro-attempts in this family and 399 prior micro-trials. The most recent accepted result is attempt-0085/micro-0013 at 1711 parameters and 99.030000%; the most recent failed result is attempt-0081/micro-0007 (discard, 98.970000%). This is a parameterization-preserving compression of the depth-shared feed-forward output map: union flattened coordinates 145 and 83, values -0.0252504200 and -0.0252036005 (difference 4.682e-05), using a weighted mean and integer reconstruction. Hypothesis: residual-stream reconstruction contains near-duplicate scalars distinct from FF-input redundancy, preserving qualification at 1,710 parameters. It is more informative than the next FF-output union (difference 4.716e-05) because it is the minimum-distortion isolated test of the complementary FF map. Official acceptance and rollback are unchanged.	0	0
attempt-0085	nearest-shared-ff-output-unions	micro-0015	ed7d2b8ad2ea3cc69b3777ccfc34f79d95100ffd	1f4cdfbd5c63a96056ffc871a99393ac0e055632	2026-08-17T04:22:22.987978+00:00	parameter tying	99.020000%	1709	keep	Union closest shared FF-output scalar groups 63 and 181	Family: parameter tying. Current retained frontier is 1,710 parameters at 99.030000%, a +0.030000 percentage-point margin over 99%. There have been 27 prior macro-attempts in this family and 400 prior micro-trials. The most recent accepted result is attempt-0085/micro-0014 at 1710 parameters and 99.030000%; the most recent failed result is attempt-0081/micro-0007 (discard, 98.970000%). This is a parameterization-preserving compression of the depth-shared feed-forward output map: union flattened coordinates 63 and 181, values -0.0254053138 and -0.0253581516 (difference 4.716e-05), using a weighted mean and integer reconstruction. Hypothesis: residual-stream reconstruction contains near-duplicate scalars distinct from FF-input redundancy, preserving qualification at 1,709 parameters. It is more informative than the next FF-output union (difference 5.810e-05) because it is the minimum-distortion isolated test of the complementary FF map. Official acceptance and rollback are unchanged.	0	0
attempt-0085	nearest-shared-ff-output-unions	micro-0016	b976e03e28ef83f82d67e3768682557613fd072f	ed7d2b8ad2ea3cc69b3777ccfc34f79d95100ffd	2026-08-17T04:23:40.926323+00:00	parameter tying	99.020000%	1708	keep	Union closest shared FF-output scalar groups 55 and 61	Family: parameter tying. Current retained frontier is 1,709 parameters at 99.020000%, a +0.020000 percentage-point margin over 99%. There have been 27 prior macro-attempts in this family and 401 prior micro-trials. The most recent accepted result is attempt-0085/micro-0015 at 1709 parameters and 99.020000%; the most recent failed result is attempt-0081/micro-0007 (discard, 98.970000%). This is a parameterization-preserving compression of the depth-shared feed-forward output map: union flattened coordinates 55 and 61, values 0.0049204291 and 0.0049785334 (difference 5.810e-05), using a weighted mean and integer reconstruction. Hypothesis: residual-stream reconstruction contains near-duplicate scalars distinct from FF-input redundancy, preserving qualification at 1,708 parameters. It is more informative than the next FF-output union (difference 6.338e-05) because it is the minimum-distortion isolated test of the complementary FF map. Official acceptance and rollback are unchanged.	0	0
attempt-0085	nearest-shared-ff-output-unions	micro-0017	64aa2d669588e5217500411b4aa820920c661f36	b976e03e28ef83f82d67e3768682557613fd072f	2026-08-17T04:24:56.548765+00:00	parameter tying	99.030000%	1707	keep	Union closest shared FF-output scalar groups 74 and 112	Family: parameter tying. Current retained frontier is 1,708 parameters at 99.020000%, a +0.020000 percentage-point margin over 99%. There have been 27 prior macro-attempts in this family and 402 prior micro-trials. The most recent accepted result is attempt-0085/micro-0016 at 1708 parameters and 99.020000%; the most recent failed result is attempt-0081/micro-0007 (discard, 98.970000%). This is a parameterization-preserving compression of the depth-shared feed-forward output map: union flattened coordinates 74 and 112, values -0.0099902060 and -0.0099268220 (difference 6.338e-05), using a weighted mean and integer reconstruction. Hypothesis: residual-stream reconstruction contains near-duplicate scalars distinct from FF-input redundancy, preserving qualification at 1,707 parameters. It is more informative than the next FF-output union (difference 7.509e-05) because it is the minimum-distortion isolated test of the complementary FF map. Official acceptance and rollback are unchanged.	0	0
attempt-0085	nearest-shared-ff-output-unions	micro-0018	9bcc4bc2b10505d4e16e0a822684ddcc29efe1b3	64aa2d669588e5217500411b4aa820920c661f36	2026-08-17T04:26:11.255067+00:00	parameter tying	99.030000%	1706	keep	Union closest shared FF-output scalar groups 211 and 197	Family: parameter tying. Current retained frontier is 1,707 parameters at 99.030000%, a +0.030000 percentage-point margin over 99%. There have been 27 prior macro-attempts in this family and 403 prior micro-trials. The most recent accepted result is attempt-0085/micro-0017 at 1707 parameters and 99.030000%; the most recent failed result is attempt-0081/micro-0007 (discard, 98.970000%). This is a parameterization-preserving compression of the depth-shared feed-forward output map: union flattened coordinates 211 and 197, values 0.0251524076 and 0.0252274945 (difference 7.509e-05), using a weighted mean and integer reconstruction. Hypothesis: residual-stream reconstruction contains near-duplicate scalars distinct from FF-input redundancy, preserving qualification at 1,706 parameters. It is more informative than the next FF-output union (difference 9.218e-05) because it is the minimum-distortion isolated test of the complementary FF map. Official acceptance and rollback are unchanged.	0	0
attempt-0085	nearest-shared-ff-output-unions	micro-0019	947fbcb92f9e80aac713060b8bfb18c34e216b4e	9bcc4bc2b10505d4e16e0a822684ddcc29efe1b3	2026-08-17T04:27:28.291534+00:00	parameter tying	99.030000%	1705	keep	Union closest shared FF-output scalar groups 246 and 15	Family: parameter tying. Current retained frontier is 1,706 parameters at 99.030000%, a +0.030000 percentage-point margin over 99%. There have been 27 prior macro-attempts in this family and 404 prior micro-trials. The most recent accepted result is attempt-0085/micro-0018 at 1706 parameters and 99.030000%; the most recent failed result is attempt-0081/micro-0007 (discard, 98.970000%). This is a parameterization-preserving compression of the depth-shared feed-forward output map: union flattened coordinates 246 and 15, values -0.0232238527 and -0.0231316686 (difference 9.218e-05), using a weighted mean and integer reconstruction. Hypothesis: residual-stream reconstruction contains near-duplicate scalars distinct from FF-input redundancy, preserving qualification at 1,705 parameters. It is more informative than the next FF-output union (difference 1.006e-04) because it is the minimum-distortion isolated test of the complementary FF map. Official acceptance and rollback are unchanged.	0	0
attempt-0085	nearest-shared-ff-output-unions	micro-0020	2753ce4cf4b2ae0a180c09885939688102954562	947fbcb92f9e80aac713060b8bfb18c34e216b4e	2026-08-17T04:28:45.518176+00:00	parameter tying	99.010000%	1704	keep	Union closest shared FF-output scalar groups 185 and 93	Family: parameter tying. Current retained frontier is 1,705 parameters at 99.030000%, a +0.030000 percentage-point margin over 99%. There have been 27 prior macro-attempts in this family and 405 prior micro-trials. The most recent accepted result is attempt-0085/micro-0019 at 1705 parameters and 99.030000%; the most recent failed result is attempt-0081/micro-0007 (discard, 98.970000%). This is a parameterization-preserving compression of the depth-shared feed-forward output map: union flattened coordinates 185 and 93, values -0.0124866515 and -0.0123860482 (difference 1.006e-04), using a weighted mean and integer reconstruction. Hypothesis: residual-stream reconstruction contains near-duplicate scalars distinct from FF-input redundancy, preserving qualification at 1,704 parameters. It is more informative than the next FF-output union (difference 1.015e-04) because it is the minimum-distortion isolated test of the complementary FF map. Official acceptance and rollback are unchanged.	0	0
attempt-0086	next-shared-ff-input-union-band	micro-0001	6000f4d1dce863b699388bb933d3c146e8becfef	2753ce4cf4b2ae0a180c09885939688102954562	2026-08-17T04:30:54.973342+00:00	parameter tying	3.820000%	1703	discard	Union closest shared FF-input scalar groups 233 and 91	Family: parameter tying. Current retained frontier is 1,704 parameters at 99.010000%, a +0.010000 percentage-point margin over 99%. There have been 28 prior macro-attempts in this family and 406 prior micro-trials. The most recent accepted result is attempt-0085/micro-0020 at 1704 parameters and 99.010000%; the most recent failed result is attempt-0081/micro-0007 (discard, 98.970000%). This is a parameterization-preserving compression of the depth-shared feed-forward input map: union flattened coordinates 233 and 91, values 0.0280277841 and 0.0282175746 (difference 1.898e-04), using a weighted mean and integer reconstruction. Hypothesis: nonlinear feature construction contains near-duplicate scalars independent of QKV redundancy, preserving qualification at 1,703 parameters. It is more informative than the next FF-input union (difference 1.986e-04) because it is the minimum-distortion isolated test at this new mechanism site. Official acceptance and rollback are unchanged.	0	0
