macro_attempt_id	automation_id	micro_attempt_id	commit	parent_commit	timestamp_utc	family	accuracy	parameters	status	description	proposal	train_exit	verify_exit
attempt-0180	token-skip-two-sensitive-pairs	micro-0001	273b50bec1201aab69a08f293178d0406fff1454	693827426022588c59b4db6defe4efb7725c8c57	2026-08-17T12:30:26.326150+00:00	parameter tying	99.000000%	1495	keep	Union closest token-matrix scalar groups 133 and 11	Family: parameter tying. Current retained frontier is 1,496 parameters at 99.010000%, a +0.010000 percentage-point margin over 99%. There have been 77 prior macro-attempts in this family and 651 prior micro-trials. The most recent accepted result is attempt-0178/micro-0001 at 1496 parameters and 99.010000%; the most recent failed result is attempt-0179/micro-0001 (discard, 98.970000%). This is a parameterization-preserving compression of the tied input/output token matrix: union groups represented by flattened coordinates 133 and 11, whose values are 0.0195684023 and 0.0196842924 (difference 1.159e-04), using a multiplicity-weighted mean and one integer reconstruction map. Hypothesis: token scalars have a different sensitivity structure from the positional table and this minimum-distortion union preserves qualification while yielding 1,495 parameters. It is more informative than the next eligible token union (difference 1.302e-04) because it is the least perturbing test at this new tensor site. Acceptance and rollback remain solely governed by the official runner.	0	0
attempt-0180	token-skip-two-sensitive-pairs	micro-0002	547326993bc8ec06f45886d5ec48658fe0b28524	273b50bec1201aab69a08f293178d0406fff1454	2026-08-17T12:31:39.953934+00:00	parameter tying	99.000000%	1494	keep	Union closest token-matrix scalar groups 148 and 52	Family: parameter tying. Current retained frontier is 1,495 parameters at 99.000000%, a +0.000000 percentage-point margin over 99%. There have been 77 prior macro-attempts in this family and 652 prior micro-trials. The most recent accepted result is attempt-0180/micro-0001 at 1495 parameters and 99.000000%; the most recent failed result is attempt-0179/micro-0001 (discard, 98.970000%). This is a parameterization-preserving compression of the tied input/output token matrix: union groups represented by flattened coordinates 148 and 52, whose values are 0.0027704604 and 0.0029006137 (difference 1.302e-04), using a multiplicity-weighted mean and one integer reconstruction map. Hypothesis: token scalars have a different sensitivity structure from the positional table and this minimum-distortion union preserves qualification while yielding 1,494 parameters. It is more informative than the next eligible token union (difference 1.352e-04) because it is the least perturbing test at this new tensor site. Acceptance and rollback remain solely governed by the official runner.	0	0
attempt-0180	token-skip-two-sensitive-pairs	micro-0003	172c5458ef1d99a88ffaae67493414dfe02f4c8c	547326993bc8ec06f45886d5ec48658fe0b28524	2026-08-17T12:33:02.439751+00:00	parameter tying	99.000000%	1493	keep	Union closest token-matrix scalar groups 48 and 35	Family: parameter tying. Current retained frontier is 1,494 parameters at 99.000000%, a +0.000000 percentage-point margin over 99%. There have been 77 prior macro-attempts in this family and 653 prior micro-trials. The most recent accepted result is attempt-0180/micro-0002 at 1494 parameters and 99.000000%; the most recent failed result is attempt-0179/micro-0001 (discard, 98.970000%). This is a parameterization-preserving compression of the tied input/output token matrix: union groups represented by flattened coordinates 48 and 35, whose values are -0.1330326349 and -0.1328974813 (difference 1.352e-04), using a multiplicity-weighted mean and one integer reconstruction map. Hypothesis: token scalars have a different sensitivity structure from the positional table and this minimum-distortion union preserves qualification while yielding 1,493 parameters. It is more informative than the next eligible token union (difference 1.400e-04) because it is the least perturbing test at this new tensor site. Acceptance and rollback remain solely governed by the official runner.	0	0
attempt-0180	token-skip-two-sensitive-pairs	micro-0004	e722928891750bf9d4919708e3b08852d99a3b79	172c5458ef1d99a88ffaae67493414dfe02f4c8c	2026-08-17T12:34:21.670510+00:00	parameter tying	99.000000%	1492	keep	Union closest token-matrix scalar groups 82 and 25	Family: parameter tying. Current retained frontier is 1,493 parameters at 99.000000%, a +0.000000 percentage-point margin over 99%. There have been 77 prior macro-attempts in this family and 654 prior micro-trials. The most recent accepted result is attempt-0180/micro-0003 at 1493 parameters and 99.000000%; the most recent failed result is attempt-0179/micro-0001 (discard, 98.970000%). This is a parameterization-preserving compression of the tied input/output token matrix: union groups represented by flattened coordinates 82 and 25, whose values are 0.4193831682 and 0.4195232093 (difference 1.400e-04), using a multiplicity-weighted mean and one integer reconstruction map. Hypothesis: token scalars have a different sensitivity structure from the positional table and this minimum-distortion union preserves qualification while yielding 1,492 parameters. It is more informative than the next eligible token union (difference 1.670e-04) because it is the least perturbing test at this new tensor site. Acceptance and rollback remain solely governed by the official runner.	0	0
attempt-0180	token-skip-two-sensitive-pairs	micro-0005	05fd96e4f7c747f9321c50c696576310aca3c19a	e722928891750bf9d4919708e3b08852d99a3b79	2026-08-17T12:35:38.060053+00:00	parameter tying	98.990000%	1491	discard	Union closest token-matrix scalar groups 142 and 164	Family: parameter tying. Current retained frontier is 1,492 parameters at 99.000000%, a +0.000000 percentage-point margin over 99%. There have been 77 prior macro-attempts in this family and 655 prior micro-trials. The most recent accepted result is attempt-0180/micro-0004 at 1492 parameters and 99.000000%; the most recent failed result is attempt-0179/micro-0001 (discard, 98.970000%). This is a parameterization-preserving compression of the tied input/output token matrix: union groups represented by flattened coordinates 142 and 164, whose values are 0.0023909302 and 0.0025579038 (difference 1.670e-04), using a multiplicity-weighted mean and one integer reconstruction map. Hypothesis: token scalars have a different sensitivity structure from the positional table and this minimum-distortion union preserves qualification while yielding 1,491 parameters. It is more informative than the next eligible token union (difference 2.034e-04) because it is the least perturbing test at this new tensor site. Acceptance and rollback remain solely governed by the official runner.	0	0
attempt-0181	token-skip-three-sensitive-pairs	micro-0001	addbf9413b7b2a779b368190c04b3511547d5f04	e722928891750bf9d4919708e3b08852d99a3b79	2026-08-17T12:37:36.268200+00:00	parameter tying	99.000000%	1491	keep	Union closest token-matrix scalar groups 127 and 53	Family: parameter tying. Current retained frontier is 1,492 parameters at 99.000000%, a +0.000000 percentage-point margin over 99%. There have been 78 prior macro-attempts in this family and 656 prior micro-trials. The most recent accepted result is attempt-0180/micro-0004 at 1492 parameters and 99.000000%; the most recent failed result is attempt-0180/micro-0005 (discard, 98.990000%). This is a parameterization-preserving compression of the tied input/output token matrix: union groups represented by flattened coordinates 127 and 53, whose values are 0.0231449753 and 0.0233483631 (difference 2.034e-04), using a multiplicity-weighted mean and one integer reconstruction map. Hypothesis: token scalars have a different sensitivity structure from the positional table and this minimum-distortion union preserves qualification while yielding 1,491 parameters. It is more informative than the next eligible token union (difference 2.129e-04) because it is the least perturbing test at this new tensor site. Acceptance and rollback remain solely governed by the official runner.	0	0
attempt-0181	token-skip-three-sensitive-pairs	micro-0002	9a2ecf68f3d2ebc5dc4f989edd0cc6fa2e7fd2ec	addbf9413b7b2a779b368190c04b3511547d5f04	2026-08-17T12:38:51.840414+00:00	parameter tying	99.000000%	1490	keep	Union closest token-matrix scalar groups 37 and 77	Family: parameter tying. Current retained frontier is 1,491 parameters at 99.000000%, a +0.000000 percentage-point margin over 99%. There have been 78 prior macro-attempts in this family and 657 prior micro-trials. The most recent accepted result is attempt-0181/micro-0001 at 1491 parameters and 99.000000%; the most recent failed result is attempt-0180/micro-0005 (discard, 98.990000%). This is a parameterization-preserving compression of the tied input/output token matrix: union groups represented by flattened coordinates 37 and 77, whose values are 0.0177600142 and 0.0179729313 (difference 2.129e-04), using a multiplicity-weighted mean and one integer reconstruction map. Hypothesis: token scalars have a different sensitivity structure from the positional table and this minimum-distortion union preserves qualification while yielding 1,490 parameters. It is more informative than the next eligible token union (difference 2.174e-04) because it is the least perturbing test at this new tensor site. Acceptance and rollback remain solely governed by the official runner.	0	0
attempt-0181	token-skip-three-sensitive-pairs	micro-0003	d3aedcbb5459bfc0a9a6e3427ff2d4901bded042	9a2ecf68f3d2ebc5dc4f989edd0cc6fa2e7fd2ec	2026-08-17T12:40:09.470890+00:00	parameter tying	99.010000%	1489	keep	Union closest token-matrix scalar groups 69 and 111	Family: parameter tying. Current retained frontier is 1,490 parameters at 99.000000%, a +0.000000 percentage-point margin over 99%. There have been 78 prior macro-attempts in this family and 658 prior micro-trials. The most recent accepted result is attempt-0181/micro-0002 at 1490 parameters and 99.000000%; the most recent failed result is attempt-0180/micro-0005 (discard, 98.990000%). This is a parameterization-preserving compression of the tied input/output token matrix: union groups represented by flattened coordinates 69 and 111, whose values are 0.0271546990 and 0.0273736026 (difference 2.189e-04), using a multiplicity-weighted mean and one integer reconstruction map. Hypothesis: token scalars have a different sensitivity structure from the positional table and this minimum-distortion union preserves qualification while yielding 1,489 parameters. It is more informative than the next eligible token union (difference 2.204e-04) because it is the least perturbing test at this new tensor site. Acceptance and rollback remain solely governed by the official runner.	0	0
attempt-0181	token-skip-three-sensitive-pairs	micro-0004	b762f40b3d7e38c96936307658d11dcb34f3a458	d3aedcbb5459bfc0a9a6e3427ff2d4901bded042	2026-08-17T12:41:30.794615+00:00	parameter tying	99.010000%	1488	keep	Union closest token-matrix scalar groups 149 and 156	Family: parameter tying. Current retained frontier is 1,489 parameters at 99.010000%, a +0.010000 percentage-point margin over 99%. There have been 78 prior macro-attempts in this family and 659 prior micro-trials. The most recent accepted result is attempt-0181/micro-0003 at 1489 parameters and 99.010000%; the most recent failed result is attempt-0180/micro-0005 (discard, 98.990000%). This is a parameterization-preserving compression of the tied input/output token matrix: union groups represented by flattened coordinates 149 and 156, whose values are 0.0148353959 and 0.0150558027 (difference 2.204e-04), using a multiplicity-weighted mean and one integer reconstruction map. Hypothesis: token scalars have a different sensitivity structure from the positional table and this minimum-distortion union preserves qualification while yielding 1,488 parameters. It is more informative than the next eligible token union (difference 2.297e-04) because it is the least perturbing test at this new tensor site. Acceptance and rollback remain solely governed by the official runner.	0	0
attempt-0181	token-skip-three-sensitive-pairs	micro-0005	68860c59c5db39f40a4a6dc3b9ca6f7df565245a	b762f40b3d7e38c96936307658d11dcb34f3a458	2026-08-17T12:42:42.505864+00:00	parameter tying	99.000000%	1487	keep	Union closest token-matrix scalar groups 65 and 151	Family: parameter tying. Current retained frontier is 1,488 parameters at 99.010000%, a +0.010000 percentage-point margin over 99%. There have been 78 prior macro-attempts in this family and 660 prior micro-trials. The most recent accepted result is attempt-0181/micro-0004 at 1488 parameters and 99.010000%; the most recent failed result is attempt-0180/micro-0005 (discard, 98.990000%). This is a parameterization-preserving compression of the tied input/output token matrix: union groups represented by flattened coordinates 65 and 151, whose values are -0.0516330004 and -0.0514032617 (difference 2.297e-04), using a multiplicity-weighted mean and one integer reconstruction map. Hypothesis: token scalars have a different sensitivity structure from the positional table and this minimum-distortion union preserves qualification while yielding 1,487 parameters. It is more informative than the next eligible token union (difference 2.559e-04) because it is the least perturbing test at this new tensor site. Acceptance and rollback remain solely governed by the official runner.	0	0
attempt-0181	token-skip-three-sensitive-pairs	micro-0006	42fddbcd6337a8107d10fb87d967c054ecc5afcc	68860c59c5db39f40a4a6dc3b9ca6f7df565245a	2026-08-17T12:44:01.961874+00:00	parameter tying	99.010000%	1486	keep	Union closest token-matrix scalar groups 164 and 52	Family: parameter tying. Current retained frontier is 1,487 parameters at 99.000000%, a +0.000000 percentage-point margin over 99%. There have been 78 prior macro-attempts in this family and 661 prior micro-trials. The most recent accepted result is attempt-0181/micro-0005 at 1487 parameters and 99.000000%; the most recent failed result is attempt-0180/micro-0005 (discard, 98.990000%). This is a parameterization-preserving compression of the tied input/output token matrix: union groups represented by flattened coordinates 164 and 52, whose values are 0.0025579038 and 0.0028138449 (difference 2.559e-04), using a multiplicity-weighted mean and one integer reconstruction map. Hypothesis: token scalars have a different sensitivity structure from the positional table and this minimum-distortion union preserves qualification while yielding 1,486 parameters. It is more informative than the next eligible token union (difference 2.710e-04) because it is the least perturbing test at this new tensor site. Acceptance and rollback remain solely governed by the official runner.	0	0
attempt-0181	token-skip-three-sensitive-pairs	micro-0007	911a54118af3a48bded66b3024bb75def5888801	42fddbcd6337a8107d10fb87d967c054ecc5afcc	2026-08-17T12:45:25.071120+00:00	parameter tying	98.980000%	1485	discard	Union closest token-matrix scalar groups 21 and 44	Family: parameter tying. Current retained frontier is 1,486 parameters at 99.010000%, a +0.010000 percentage-point margin over 99%. There have been 78 prior macro-attempts in this family and 662 prior micro-trials. The most recent accepted result is attempt-0181/micro-0006 at 1486 parameters and 99.010000%; the most recent failed result is attempt-0180/micro-0005 (discard, 98.990000%). This is a parameterization-preserving compression of the tied input/output token matrix: union groups represented by flattened coordinates 21 and 44, whose values are -0.0096072564 and -0.0093362071 (difference 2.710e-04), using a multiplicity-weighted mean and one integer reconstruction map. Hypothesis: token scalars have a different sensitivity structure from the positional table and this minimum-distortion union preserves qualification while yielding 1,485 parameters. It is more informative than the next eligible token union (difference 2.820e-04) because it is the least perturbing test at this new tensor site. Acceptance and rollback remain solely governed by the official runner.	0	0
attempt-0182	token-skip-four-sensitive-pairs	micro-0001	9abc860fbdce3dd9cab7b940917002a2fb9fc6b8	42fddbcd6337a8107d10fb87d967c054ecc5afcc	2026-08-17T12:47:30.424172+00:00	parameter tying	98.990000%	1485	discard	Union closest token-matrix scalar groups 16 and 18	Family: parameter tying. Current retained frontier is 1,486 parameters at 99.010000%, a +0.010000 percentage-point margin over 99%. There have been 79 prior macro-attempts in this family and 663 prior micro-trials. The most recent accepted result is attempt-0181/micro-0006 at 1486 parameters and 99.010000%; the most recent failed result is attempt-0181/micro-0007 (discard, 98.980000%). This is a parameterization-preserving compression of the tied input/output token matrix: union groups represented by flattened coordinates 16 and 18, whose values are 0.0941890925 and 0.0944710970 (difference 2.820e-04), using a multiplicity-weighted mean and one integer reconstruction map. Hypothesis: token scalars have a different sensitivity structure from the positional table and this minimum-distortion union preserves qualification while yielding 1,485 parameters. It is more informative than the next eligible token union (difference 2.874e-04) because it is the least perturbing test at this new tensor site. Acceptance and rollback remain solely governed by the official runner.	0	0
attempt-0183	final-norm-skip-sensitive-pair	micro-0001	a504808740203c4cc1d14bcfe8d4129d51e2b5ce	42fddbcd6337a8107d10fb87d967c054ecc5afcc	2026-08-17T12:49:41.492727+00:00	parameter tying	99.010000%	1485	keep	Union closest final LayerNorm scale groups 13 and 0	Family: parameter tying. Current retained frontier is 1,486 parameters at 99.010000%, a +0.010000 percentage-point margin over 99%. There have been 80 prior macro-attempts in this family and 664 prior micro-trials. The most recent accepted result is attempt-0181/micro-0006 at 1486 parameters and 99.010000%; the most recent failed result is attempt-0182/micro-0001 (discard, 98.990000%). This is a parameterization-preserving compression of the final normalization scales: union coordinates 13 and 0, values 8.1406946182 and 8.3557891846 (difference 2.151e-01), using a weighted mean and integer reconstruction. Hypothesis: the final affine rescaling contains a near-duplicate coordinate pair independent of matrix and positional boundaries, preserving qualification at 1,485 parameters. It is more informative than the next scale union (difference 4.079e-01) because it is the minimum-distortion test in the complete 16-scale search space. Official acceptance and rollback are unchanged.	0	0
attempt-0183	final-norm-skip-sensitive-pair	micro-0002	0fe39c52e149e77a84930ff6b41882306de43456	a504808740203c4cc1d14bcfe8d4129d51e2b5ce	2026-08-17T12:51:00.232436+00:00	parameter tying	99.010000%	1484	keep	Union closest final LayerNorm scale groups 5 and 4	Family: parameter tying. Current retained frontier is 1,485 parameters at 99.010000%, a +0.010000 percentage-point margin over 99%. There have been 80 prior macro-attempts in this family and 665 prior micro-trials. The most recent accepted result is attempt-0183/micro-0001 at 1485 parameters and 99.010000%; the most recent failed result is attempt-0182/micro-0001 (discard, 98.990000%). This is a parameterization-preserving compression of the final normalization scales: union coordinates 5 and 4, values 7.2437715530 and 7.7328329086 (difference 4.891e-01), using a weighted mean and integer reconstruction. Hypothesis: the final affine rescaling contains a near-duplicate coordinate pair independent of matrix and positional boundaries, preserving qualification at 1,484 parameters. It is more informative than the next scale union (difference 5.684e-01) because it is the minimum-distortion test in the complete 16-scale search space. Official acceptance and rollback are unchanged.	0	0
attempt-0183	final-norm-skip-sensitive-pair	micro-0003	8c084e92e0f5d6088fc2adde4b2de54f89c03815	0fe39c52e149e77a84930ff6b41882306de43456	2026-08-17T12:52:19.277109+00:00	parameter tying	99.000000%	1483	keep	Union closest final LayerNorm scale groups 15 and 4	Family: parameter tying. Current retained frontier is 1,484 parameters at 99.010000%, a +0.010000 percentage-point margin over 99%. There have been 80 prior macro-attempts in this family and 666 prior micro-trials. The most recent accepted result is attempt-0183/micro-0002 at 1484 parameters and 99.010000%; the most recent failed result is attempt-0182/micro-0001 (discard, 98.990000%). This is a parameterization-preserving compression of the final normalization scales: union coordinates 15 and 4, values 6.6753439903 and 7.4067916870 (difference 7.314e-01), using a weighted mean and integer reconstruction. Hypothesis: the final affine rescaling contains a near-duplicate coordinate pair independent of matrix and positional boundaries, preserving qualification at 1,483 parameters. It is more informative than the next scale union (difference 9.131e-01) because it is the minimum-distortion test in the complete 16-scale search space. Official acceptance and rollback are unchanged.	0	0
