macro_attempt_id	automation_id	micro_attempt_id	commit	parent_commit	timestamp_utc	family	accuracy	parameters	status	description	proposal	train_exit	verify_exit
attempt-0089	third-shared-qkv-union-band-repair	micro-0007	02a12ccbfcb4ace4d2509fb32cd72f3168043063	dafb784c744b174eedf18e810ab43ab3c0ec1d29	2026-08-17T04:53:39.412345+00:00	parameter tying	99.010000%	1688	keep	Union closest shared-QKV scalar groups 653 and 561	Family: parameter tying. Current retained frontier is 1,689 parameters at 99.010000%, a +0.010000 percentage-point margin over 99%. There have been 31 prior macro-attempts in this family and 424 prior micro-trials. The most recent accepted result is attempt-0089/micro-0006 at 1689 parameters and 99.010000%; the most recent failed result is attempt-0088/micro-0001 (error, no score). This is a parameterization-preserving compression of the depth-shared QKV transform: union flattened coordinates 653 and 561, whose learned values are -0.0340255238 and -0.0339768641 (difference 4.866e-05), with a multiplicity-weighted mean and integer reconstruction map. Hypothesis: the much larger attention tensor contains near-duplicate scalars below the token failure scale, so this union preserves qualification and yields 1,688 parameters. It is more informative than the next QKV union (difference 4.879e-05) because it is the minimum-distortion test at this new site. Acceptance and rollback remain solely governed by the official runner.	0	0
attempt-0089	third-shared-qkv-union-band-repair	micro-0008	971e8c08a289d9676a74c0fa343658ad82b76e2b	02a12ccbfcb4ace4d2509fb32cd72f3168043063	2026-08-17T04:54:49.093187+00:00	parameter tying	99.010000%	1687	keep	Union closest shared-QKV scalar groups 131 and 121	Family: parameter tying. Current retained frontier is 1,688 parameters at 99.010000%, a +0.010000 percentage-point margin over 99%. There have been 31 prior macro-attempts in this family and 425 prior micro-trials. The most recent accepted result is attempt-0089/micro-0007 at 1688 parameters and 99.010000%; the most recent failed result is attempt-0088/micro-0001 (error, no score). This is a parameterization-preserving compression of the depth-shared QKV transform: union flattened coordinates 131 and 121, whose learned values are 0.2176036537 and 0.2176524401 (difference 4.879e-05), with a multiplicity-weighted mean and integer reconstruction map. Hypothesis: the much larger attention tensor contains near-duplicate scalars below the token failure scale, so this union preserves qualification and yields 1,687 parameters. It is more informative than the next QKV union (difference 4.929e-05) because it is the minimum-distortion test at this new site. Acceptance and rollback remain solely governed by the official runner.	0	0
attempt-0089	third-shared-qkv-union-band-repair	micro-0009	00d5652e5f4be6e17247f9849b32f44d957e8ecb	971e8c08a289d9676a74c0fa343658ad82b76e2b	2026-08-17T04:55:58.878285+00:00	parameter tying	98.990000%	1686	discard	Union closest shared-QKV scalar groups 516 and 694	Family: parameter tying. Current retained frontier is 1,687 parameters at 99.010000%, a +0.010000 percentage-point margin over 99%. There have been 31 prior macro-attempts in this family and 426 prior micro-trials. The most recent accepted result is attempt-0089/micro-0008 at 1687 parameters and 99.010000%; the most recent failed result is attempt-0088/micro-0001 (error, no score). This is a parameterization-preserving compression of the depth-shared QKV transform: union flattened coordinates 516 and 694, whose learned values are 0.0270248726 and 0.0270741675 (difference 4.929e-05), with a multiplicity-weighted mean and integer reconstruction map. Hypothesis: the much larger attention tensor contains near-duplicate scalars below the token failure scale, so this union preserves qualification and yields 1,686 parameters. It is more informative than the next QKV union (difference 4.983e-05) because it is the minimum-distortion test at this new site. Acceptance and rollback remain solely governed by the official runner.	0	0
attempt-0090	token-unions-after-sensitive-pair	micro-0001	df03f90b91ddab7b0be15ff4e08154de6b06c4bb	971e8c08a289d9676a74c0fa343658ad82b76e2b	2026-08-17T04:58:04.227775+00:00	parameter tying	0.770000%	1686	discard	Union closest token-matrix scalar groups 93 and 160	Family: parameter tying. Current retained frontier is 1,687 parameters at 99.010000%, a +0.010000 percentage-point margin over 99%. There have been 32 prior macro-attempts in this family and 427 prior micro-trials. The most recent accepted result is attempt-0089/micro-0008 at 1687 parameters and 99.010000%; the most recent failed result is attempt-0089/micro-0009 (discard, 98.990000%). This is a parameterization-preserving compression of the tied input/output token matrix: union groups represented by flattened coordinates 93 and 160, whose values are -0.0609154664 and -0.0608011931 (difference 1.143e-04), using a multiplicity-weighted mean and one integer reconstruction map. Hypothesis: token scalars have a different sensitivity structure from the positional table and this minimum-distortion union preserves qualification while yielding 1,686 parameters. It is more informative than the next eligible token union (difference 1.159e-04) because it is the least perturbing test at this new tensor site. Acceptance and rollback remain solely governed by the official runner.	0	0
attempt-0091	qkv-unions-after-sensitive-pair	micro-0001	dcb982756648394fef98bdcf433181b4e7385b32	971e8c08a289d9676a74c0fa343658ad82b76e2b	2026-08-17T05:00:00.721306+00:00	parameter tying	99.000000%	1686	keep	Union closest shared-QKV scalar groups 714 and 716	Family: parameter tying. Current retained frontier is 1,687 parameters at 99.010000%, a +0.010000 percentage-point margin over 99%. There have been 33 prior macro-attempts in this family and 428 prior micro-trials. The most recent accepted result is attempt-0089/micro-0008 at 1687 parameters and 99.010000%; the most recent failed result is attempt-0090/micro-0001 (discard, 0.770000%). This is a parameterization-preserving compression of the depth-shared QKV transform: union flattened coordinates 714 and 716, whose learned values are -0.0457496382 and -0.0456998125 (difference 4.983e-05), with a multiplicity-weighted mean and integer reconstruction map. Hypothesis: the much larger attention tensor contains near-duplicate scalars below the token failure scale, so this union preserves qualification and yields 1,686 parameters. It is more informative than the next QKV union (difference 5.049e-05) because it is the minimum-distortion test at this new site. Acceptance and rollback remain solely governed by the official runner.	0	0
attempt-0091	qkv-unions-after-sensitive-pair	micro-0002	de8fe5861b6d0ffff9fc1045a01986f5479bf8b8	dcb982756648394fef98bdcf433181b4e7385b32	2026-08-17T05:01:08.508081+00:00	parameter tying	98.990000%	1685	discard	Union closest shared-QKV scalar groups 555 and 517	Family: parameter tying. Current retained frontier is 1,686 parameters at 99.000000%, a +0.000000 percentage-point margin over 99%. There have been 33 prior macro-attempts in this family and 429 prior micro-trials. The most recent accepted result is attempt-0091/micro-0001 at 1686 parameters and 99.000000%; the most recent failed result is attempt-0090/micro-0001 (discard, 0.770000%). This is a parameterization-preserving compression of the depth-shared QKV transform: union flattened coordinates 555 and 517, whose learned values are 0.0067168260 and 0.0067673163 (difference 5.049e-05), with a multiplicity-weighted mean and integer reconstruction map. Hypothesis: the much larger attention tensor contains near-duplicate scalars below the token failure scale, so this union preserves qualification and yields 1,685 parameters. It is more informative than the next QKV union (difference 5.227e-05) because it is the minimum-distortion test at this new site. Acceptance and rollback remain solely governed by the official runner.	0	0
attempt-0092	position-unions-after-two-sensitive-pairs	micro-0001	cc9e664cff1e52ff153ba662741341d04f37e38b	dcb982756648394fef98bdcf433181b4e7385b32	2026-08-17T05:03:14.641841+00:00	parameter tying	99.000000%	1685	keep	Union closest position groups 453 and 26	Family: parameter tying. Current retained frontier is 1,686 parameters at 99.050000%, a +0.050000 percentage-point margin over 99%. There have been 34 prior macro-attempts in this family and 430 prior micro-trials. The most recent accepted result is attempt-0091/micro-0001 at 1686 parameters and 99.000000%; the most recent failed result is attempt-0091/micro-0002 (discard, 98.990000%). This is a parameterization-preserving compression: union current position groups represented by coordinates 453 and 26, whose learned values are -0.0477325320 and -0.0473018885 (absolute difference 4.306e-04), using a multiplicity-weighted mean. Hypothesis: this preserves qualification and yields 1,685 parameters. It is more informative than the nearest untested alternative (difference 4.418e-04) because it is the minimum-distortion eligible union; exact pairs already rejected under the unchanged grouping are excluded. Acceptance and rollback remain solely governed by the official runner.	0	0
attempt-0092	position-unions-after-two-sensitive-pairs	micro-0002	1518062d0831ea28a288a4258fc061b0da4813cb	cc9e664cff1e52ff153ba662741341d04f37e38b	2026-08-17T05:04:26.416931+00:00	parameter tying	99.010000%	1684	keep	Union closest position groups 22 and 34	Family: parameter tying. Current retained frontier is 1,685 parameters at 99.000000%, a +0.000000 percentage-point margin over 99%. There have been 34 prior macro-attempts in this family and 431 prior micro-trials. The most recent accepted result is attempt-0092/micro-0001 at 1685 parameters and 99.000000%; the most recent failed result is attempt-0091/micro-0002 (discard, 98.990000%). This is a parameterization-preserving compression: union current position groups represented by coordinates 22 and 34, whose learned values are 0.0214128494 and 0.0218546167 (absolute difference 4.418e-04), using a multiplicity-weighted mean. Hypothesis: this preserves qualification and yields 1,684 parameters. It is more informative than the nearest untested alternative (difference 4.418e-04) because it is the minimum-distortion eligible union; exact pairs already rejected under the unchanged grouping are excluded. Acceptance and rollback remain solely governed by the official runner.	0	0
attempt-0092	position-unions-after-two-sensitive-pairs	micro-0003	e554eb1a7df61aea77cf31474dc370b1dfd7652c	1518062d0831ea28a288a4258fc061b0da4813cb	2026-08-17T05:05:37.979653+00:00	parameter tying	99.000000%	1683	keep	Union closest position groups 116 and 11	Family: parameter tying. Current retained frontier is 1,684 parameters at 99.010000%, a +0.010000 percentage-point margin over 99%. There have been 34 prior macro-attempts in this family and 432 prior micro-trials. The most recent accepted result is attempt-0092/micro-0002 at 1684 parameters and 99.010000%; the most recent failed result is attempt-0091/micro-0002 (discard, 98.990000%). This is a parameterization-preserving compression: union current position groups represented by coordinates 116 and 11, whose learned values are 0.0165172368 and 0.0169590767 (absolute difference 4.418e-04), using a multiplicity-weighted mean. Hypothesis: this preserves qualification and yields 1,683 parameters. It is more informative than the nearest untested alternative (difference 4.442e-04) because it is the minimum-distortion eligible union; exact pairs already rejected under the unchanged grouping are excluded. Acceptance and rollback remain solely governed by the official runner.	0	0
attempt-0092	position-unions-after-two-sensitive-pairs	micro-0004	bc195fd7ecd65eff4eea3cbdcee3841827e11a54	e554eb1a7df61aea77cf31474dc370b1dfd7652c	2026-08-17T05:06:50.128617+00:00	parameter tying	98.980000%	1682	discard	Union closest position groups 182 and 70	Family: parameter tying. Current retained frontier is 1,683 parameters at 99.000000%, a +0.000000 percentage-point margin over 99%. There have been 34 prior macro-attempts in this family and 433 prior micro-trials. The most recent accepted result is attempt-0092/micro-0003 at 1683 parameters and 99.000000%; the most recent failed result is attempt-0091/micro-0002 (discard, 98.990000%). This is a parameterization-preserving compression: union current position groups represented by coordinates 182 and 70, whose learned values are 0.0127164116 and 0.0131606534 (absolute difference 4.442e-04), using a multiplicity-weighted mean. Hypothesis: this preserves qualification and yields 1,682 parameters. It is more informative than the nearest untested alternative (difference 4.612e-04) because it is the minimum-distortion eligible union; exact pairs already rejected under the unchanged grouping are excluded. Acceptance and rollback remain solely governed by the official runner.	0	0
attempt-0093	nearest-final-norm-scale-unions	micro-0001	cc12938e27be31bd9bf4f505672061b51397db7a	e554eb1a7df61aea77cf31474dc370b1dfd7652c	2026-08-17T05:09:52.138700+00:00	parameter tying	99.000000%	1682	keep	Union closest final LayerNorm scale groups 3 and 10	Family: parameter tying. Current retained frontier is 1,683 parameters at 99.000000%, a +0.000000 percentage-point margin over 99%. There have been 35 prior macro-attempts in this family and 434 prior micro-trials. The most recent accepted result is attempt-0092/micro-0003 at 1683 parameters and 99.000000%; the most recent failed result is attempt-0092/micro-0004 (discard, 98.980000%). This is a parameterization-preserving compression of the final normalization scales: union coordinates 3 and 10, values 8.5296850204 and 8.5336341858 (difference 3.949e-03), using a weighted mean and integer reconstruction. Hypothesis: the final affine rescaling contains a near-duplicate coordinate pair independent of matrix and positional boundaries, preserving qualification at 1,682 parameters. It is more informative than the next scale union (difference 7.017e-03) because it is the minimum-distortion test in the complete 16-scale search space. Official acceptance and rollback are unchanged.	0	0
attempt-0093	nearest-final-norm-scale-unions	micro-0002	ff44923d2707dfbc991df4b33ffd9d647388e155	cc12938e27be31bd9bf4f505672061b51397db7a	2026-08-17T05:11:07.318880+00:00	parameter tying	99.000000%	1681	keep	Union closest final LayerNorm scale groups 6 and 9	Family: parameter tying. Current retained frontier is 1,682 parameters at 99.000000%, a +0.000000 percentage-point margin over 99%. There have been 35 prior macro-attempts in this family and 435 prior micro-trials. The most recent accepted result is attempt-0093/micro-0001 at 1682 parameters and 99.000000%; the most recent failed result is attempt-0092/micro-0004 (discard, 98.980000%). This is a parameterization-preserving compression of the final normalization scales: union coordinates 6 and 9, values 8.5532531738 and 8.5602703094 (difference 7.017e-03), using a weighted mean and integer reconstruction. Hypothesis: the final affine rescaling contains a near-duplicate coordinate pair independent of matrix and positional boundaries, preserving qualification at 1,681 parameters. It is more informative than the next scale union (difference 1.307e-02) because it is the minimum-distortion test in the complete 16-scale search space. Official acceptance and rollback are unchanged.	0	0
attempt-0093	nearest-final-norm-scale-unions	micro-0003	7cd6c208ff45b109e4297104af5be6f0c3386a3d	ff44923d2707dfbc991df4b33ffd9d647388e155	2026-08-17T05:12:29.740874+00:00	parameter tying	99.000000%	1680	keep	Union closest final LayerNorm scale groups 0 and 14	Family: parameter tying. Current retained frontier is 1,681 parameters at 99.000000%, a +0.000000 percentage-point margin over 99%. There have been 35 prior macro-attempts in this family and 436 prior micro-trials. The most recent accepted result is attempt-0093/micro-0002 at 1681 parameters and 99.000000%; the most recent failed result is attempt-0092/micro-0004 (discard, 98.980000%). This is a parameterization-preserving compression of the final normalization scales: union coordinates 0 and 14, values 8.2977304459 and 8.3108015060 (difference 1.307e-02), using a weighted mean and integer reconstruction. Hypothesis: the final affine rescaling contains a near-duplicate coordinate pair independent of matrix and positional boundaries, preserving qualification at 1,680 parameters. It is more informative than the next scale union (difference 1.407e-02) because it is the minimum-distortion test in the complete 16-scale search space. Official acceptance and rollback are unchanged.	0	0
attempt-0093	nearest-final-norm-scale-unions	micro-0004	4449f92178a497fe0617e575f89fa6558fdd2b96	7cd6c208ff45b109e4297104af5be6f0c3386a3d	2026-08-17T05:13:38.355076+00:00	parameter tying	99.000000%	1679	keep	Union closest final LayerNorm scale groups 7 and 1	Family: parameter tying. Current retained frontier is 1,680 parameters at 99.000000%, a +0.000000 percentage-point margin over 99%. There have been 35 prior macro-attempts in this family and 437 prior micro-trials. The most recent accepted result is attempt-0093/micro-0003 at 1680 parameters and 99.000000%; the most recent failed result is attempt-0092/micro-0004 (discard, 98.980000%). This is a parameterization-preserving compression of the final normalization scales: union coordinates 7 and 1, values 8.3590192795 and 8.3730907440 (difference 1.407e-02), using a weighted mean and integer reconstruction. Hypothesis: the final affine rescaling contains a near-duplicate coordinate pair independent of matrix and positional boundaries, preserving qualification at 1,679 parameters. It is more informative than the next scale union (difference 2.510e-02) because it is the minimum-distortion test in the complete 16-scale search space. Official acceptance and rollback are unchanged.	0	0
attempt-0093	nearest-final-norm-scale-unions	micro-0005	5448660a0280e640fcb34ada92f9627d16a80504	4449f92178a497fe0617e575f89fa6558fdd2b96	2026-08-17T05:14:47.902889+00:00	parameter tying	99.010000%	1678	keep	Union closest final LayerNorm scale groups 3 and 6	Family: parameter tying. Current retained frontier is 1,679 parameters at 99.000000%, a +0.000000 percentage-point margin over 99%. There have been 35 prior macro-attempts in this family and 438 prior micro-trials. The most recent accepted result is attempt-0093/micro-0004 at 1679 parameters and 99.000000%; the most recent failed result is attempt-0092/micro-0004 (discard, 98.980000%). This is a parameterization-preserving compression of the final normalization scales: union coordinates 3 and 6, values 8.5316600800 and 8.5567617416 (difference 2.510e-02), using a weighted mean and integer reconstruction. Hypothesis: the final affine rescaling contains a near-duplicate coordinate pair independent of matrix and positional boundaries, preserving qualification at 1,678 parameters. It is more informative than the next scale union (difference 5.033e-02) because it is the minimum-distortion test in the complete 16-scale search space. Official acceptance and rollback are unchanged.	0	0
attempt-0093	nearest-final-norm-scale-unions	micro-0006	e7646520b4ae1d9b8b7cba567b21e1d471814e28	5448660a0280e640fcb34ada92f9627d16a80504	2026-08-17T05:15:57.617389+00:00	parameter tying	99.000000%	1677	keep	Union closest final LayerNorm scale groups 0 and 1	Family: parameter tying. Current retained frontier is 1,678 parameters at 99.010000%, a +0.010000 percentage-point margin over 99%. There have been 35 prior macro-attempts in this family and 439 prior micro-trials. The most recent accepted result is attempt-0093/micro-0005 at 1678 parameters and 99.010000%; the most recent failed result is attempt-0092/micro-0004 (discard, 98.980000%). This is a parameterization-preserving compression of the final normalization scales: union coordinates 0 and 1, values 8.3042659760 and 8.3660545349 (difference 6.179e-02), using a weighted mean and integer reconstruction. Hypothesis: the final affine rescaling contains a near-duplicate coordinate pair independent of matrix and positional boundaries, preserving qualification at 1,677 parameters. It is more informative than the next scale union (difference 6.289e-02) because it is the minimum-distortion test in the complete 16-scale search space. Official acceptance and rollback are unchanged.	0	0
attempt-0093	nearest-final-norm-scale-unions	micro-0007	919b51ccfb0214053066fe4527493a66477877e3	e7646520b4ae1d9b8b7cba567b21e1d471814e28	2026-08-17T05:17:08.202689+00:00	parameter tying	99.010000%	1676	keep	Union closest final LayerNorm scale groups 3 and 2	Family: parameter tying. Current retained frontier is 1,677 parameters at 99.000000%, a +0.000000 percentage-point margin over 99%. There have been 35 prior macro-attempts in this family and 440 prior micro-trials. The most recent accepted result is attempt-0093/micro-0006 at 1677 parameters and 99.000000%; the most recent failed result is attempt-0092/micro-0004 (discard, 98.980000%). This is a parameterization-preserving compression of the final normalization scales: union coordinates 3 and 2, values 8.5442104340 and 8.6070966721 (difference 6.289e-02), using a weighted mean and integer reconstruction. Hypothesis: the final affine rescaling contains a near-duplicate coordinate pair independent of matrix and positional boundaries, preserving qualification at 1,676 parameters. It is more informative than the next scale union (difference 1.031e-01) because it is the minimum-distortion test in the complete 16-scale search space. Official acceptance and rollback are unchanged.	0	0
