macro_attempt_id	automation_id	micro_attempt_id	commit	parent_commit	timestamp_utc	family	accuracy	parameters	status	description	proposal	train_exit	verify_exit
attempt-0078	nearest-position-unions-infra-repair	micro-0185	09141de6efd356914d290fb91083ad1a5b3a53af	d75865e13caa94ad24791642895806c61d8ca876	2026-08-17T00:21:22.364737+00:00	parameter tying	99.080000%	1900	keep	Union closest position groups 181 and 239	Family: parameter tying. Current retained frontier is 1,901 parameters at 99.070000%, a +0.070000 percentage-point margin over 99%. There have been 20 prior macro-attempts in this family and 205 prior micro-trials. The most recent accepted result is attempt-0078/micro-0184 at 1901 parameters and 99.070000%; the most recent failed result is attempt-0075/micro-0001 (error, no score). This is a parameterization-preserving compression: union current position groups represented by coordinates 181 and 239, whose learned values are -0.0032146368 and -0.0030670203 (absolute difference 1.476e-04), using a multiplicity-weighted mean. Hypothesis: this preserves qualification and yields 1,900 parameters. It is more informative than the nearest untested alternative (difference 1.514e-04) because it is the minimum-distortion eligible union; exact pairs already rejected under the unchanged grouping are excluded. Acceptance and rollback remain solely governed by the official runner.	0	0
attempt-0078	nearest-position-unions-infra-repair	micro-0186	b8e3a6e90a521361e8e522e4c1d8f96c0dbf0262	09141de6efd356914d290fb91083ad1a5b3a53af	2026-08-17T00:22:24.671604+00:00	parameter tying	99.070000%	1899	keep	Union closest position groups 168 and 284	Family: parameter tying. Current retained frontier is 1,900 parameters at 99.080000%, a +0.080000 percentage-point margin over 99%. There have been 20 prior macro-attempts in this family and 206 prior micro-trials. The most recent accepted result is attempt-0078/micro-0185 at 1900 parameters and 99.080000%; the most recent failed result is attempt-0075/micro-0001 (error, no score). This is a parameterization-preserving compression: union current position groups represented by coordinates 168 and 284, whose learned values are 0.0296287797 and 0.0297801625 (absolute difference 1.514e-04), using a multiplicity-weighted mean. Hypothesis: this preserves qualification and yields 1,899 parameters. It is more informative than the nearest untested alternative (difference 1.516e-04) because it is the minimum-distortion eligible union; exact pairs already rejected under the unchanged grouping are excluded. Acceptance and rollback remain solely governed by the official runner.	0	0
attempt-0078	nearest-position-unions-infra-repair	micro-0187	51fa18c3e7b5febe51ab7e55c052a00384e2199b	b8e3a6e90a521361e8e522e4c1d8f96c0dbf0262	2026-08-17T00:23:27.523754+00:00	parameter tying	99.080000%	1898	keep	Union closest position groups 80 and 278	Family: parameter tying. Current retained frontier is 1,899 parameters at 99.070000%, a +0.070000 percentage-point margin over 99%. There have been 20 prior macro-attempts in this family and 207 prior micro-trials. The most recent accepted result is attempt-0078/micro-0186 at 1899 parameters and 99.070000%; the most recent failed result is attempt-0075/micro-0001 (error, no score). This is a parameterization-preserving compression: union current position groups represented by coordinates 80 and 278, whose learned values are 0.0095302295 and 0.0096818684 (absolute difference 1.516e-04), using a multiplicity-weighted mean. Hypothesis: this preserves qualification and yields 1,898 parameters. It is more informative than the nearest untested alternative (difference 1.529e-04) because it is the minimum-distortion eligible union; exact pairs already rejected under the unchanged grouping are excluded. Acceptance and rollback remain solely governed by the official runner.	0	0
attempt-0078	nearest-position-unions-infra-repair	micro-0188	6c621cf25535beb33cd69a1aea73529e56e5fd2f	51fa18c3e7b5febe51ab7e55c052a00384e2199b	2026-08-17T00:24:29.394939+00:00	parameter tying	99.080000%	1897	keep	Union closest position groups 184 and 475	Family: parameter tying. Current retained frontier is 1,898 parameters at 99.080000%, a +0.080000 percentage-point margin over 99%. There have been 20 prior macro-attempts in this family and 208 prior micro-trials. The most recent accepted result is attempt-0078/micro-0187 at 1898 parameters and 99.080000%; the most recent failed result is attempt-0075/micro-0001 (error, no score). This is a parameterization-preserving compression: union current position groups represented by coordinates 184 and 475, whose learned values are 0.0275601260 and 0.0277129952 (absolute difference 1.529e-04), using a multiplicity-weighted mean. Hypothesis: this preserves qualification and yields 1,897 parameters. It is more informative than the nearest untested alternative (difference 1.535e-04) because it is the minimum-distortion eligible union; exact pairs already rejected under the unchanged grouping are excluded. Acceptance and rollback remain solely governed by the official runner.	0	0
attempt-0078	nearest-position-unions-infra-repair	micro-0189	e9a2ed5e191e563e0b8a3b019441dffbfa8b485b	6c621cf25535beb33cd69a1aea73529e56e5fd2f	2026-08-17T00:25:31.636629+00:00	parameter tying	99.080000%	1896	keep	Union closest position groups 178 and 118	Family: parameter tying. Current retained frontier is 1,897 parameters at 99.080000%, a +0.080000 percentage-point margin over 99%. There have been 20 prior macro-attempts in this family and 209 prior micro-trials. The most recent accepted result is attempt-0078/micro-0188 at 1897 parameters and 99.080000%; the most recent failed result is attempt-0075/micro-0001 (error, no score). This is a parameterization-preserving compression: union current position groups represented by coordinates 178 and 118, whose learned values are -0.0005943253 and -0.0004408389 (absolute difference 1.535e-04), using a multiplicity-weighted mean. Hypothesis: this preserves qualification and yields 1,896 parameters. It is more informative than the nearest untested alternative (difference 1.544e-04) because it is the minimum-distortion eligible union; exact pairs already rejected under the unchanged grouping are excluded. Acceptance and rollback remain solely governed by the official runner.	0	0
attempt-0078	nearest-position-unions-infra-repair	micro-0190	0ab2a0bbc0df7e097092976a016f7694c773d0a7	e9a2ed5e191e563e0b8a3b019441dffbfa8b485b	2026-08-17T00:26:34.350101+00:00	parameter tying	99.080000%	1895	keep	Union closest position groups 240 and 120	Family: parameter tying. Current retained frontier is 1,896 parameters at 99.080000%, a +0.080000 percentage-point margin over 99%. There have been 20 prior macro-attempts in this family and 210 prior micro-trials. The most recent accepted result is attempt-0078/micro-0189 at 1896 parameters and 99.080000%; the most recent failed result is attempt-0075/micro-0001 (error, no score). This is a parameterization-preserving compression: union current position groups represented by coordinates 240 and 120, whose learned values are -0.0021519570 and -0.0019975177 (absolute difference 1.544e-04), using a multiplicity-weighted mean. Hypothesis: this preserves qualification and yields 1,895 parameters. It is more informative than the nearest untested alternative (difference 1.555e-04) because it is the minimum-distortion eligible union; exact pairs already rejected under the unchanged grouping are excluded. Acceptance and rollback remain solely governed by the official runner.	0	0
attempt-0078	nearest-position-unions-infra-repair	micro-0191	7524804469746b2431302a492545ac2c016c6293	0ab2a0bbc0df7e097092976a016f7694c773d0a7	2026-08-17T00:27:36.516066+00:00	parameter tying	99.070000%	1894	keep	Union closest position groups 351 and 236	Family: parameter tying. Current retained frontier is 1,895 parameters at 99.080000%, a +0.080000 percentage-point margin over 99%. There have been 20 prior macro-attempts in this family and 211 prior micro-trials. The most recent accepted result is attempt-0078/micro-0190 at 1895 parameters and 99.080000%; the most recent failed result is attempt-0075/micro-0001 (error, no score). This is a parameterization-preserving compression: union current position groups represented by coordinates 351 and 236, whose learned values are 0.0319148600 and 0.0320703350 (absolute difference 1.555e-04), using a multiplicity-weighted mean. Hypothesis: this preserves qualification and yields 1,894 parameters. It is more informative than the nearest untested alternative (difference 1.557e-04) because it is the minimum-distortion eligible union; exact pairs already rejected under the unchanged grouping are excluded. Acceptance and rollback remain solely governed by the official runner.	0	0
attempt-0078	nearest-position-unions-infra-repair	micro-0192	7af42d909ad2ca6eebf90e3d5648fa0b39619469	7524804469746b2431302a492545ac2c016c6293	2026-08-17T00:28:37.775977+00:00	parameter tying	99.080000%	1893	keep	Union closest position groups 263 and 298	Family: parameter tying. Current retained frontier is 1,894 parameters at 99.070000%, a +0.070000 percentage-point margin over 99%. There have been 20 prior macro-attempts in this family and 212 prior micro-trials. The most recent accepted result is attempt-0078/micro-0191 at 1894 parameters and 99.070000%; the most recent failed result is attempt-0075/micro-0001 (error, no score). This is a parameterization-preserving compression: union current position groups represented by coordinates 263 and 298, whose learned values are 0.0116412975 and 0.0117970435 (absolute difference 1.557e-04), using a multiplicity-weighted mean. Hypothesis: this preserves qualification and yields 1,893 parameters. It is more informative than the nearest untested alternative (difference 1.562e-04) because it is the minimum-distortion eligible union; exact pairs already rejected under the unchanged grouping are excluded. Acceptance and rollback remain solely governed by the official runner.	0	0
attempt-0078	nearest-position-unions-infra-repair	micro-0193	72c9e54836ced121cefe148bd40bb1a4604465a9	7af42d909ad2ca6eebf90e3d5648fa0b39619469	2026-08-17T00:29:44.601568+00:00	parameter tying	99.060000%	1892	keep	Union closest position groups 47 and 507	Family: parameter tying. Current retained frontier is 1,893 parameters at 99.080000%, a +0.080000 percentage-point margin over 99%. There have been 20 prior macro-attempts in this family and 213 prior micro-trials. The most recent accepted result is attempt-0078/micro-0192 at 1893 parameters and 99.080000%; the most recent failed result is attempt-0075/micro-0001 (error, no score). This is a parameterization-preserving compression: union current position groups represented by coordinates 47 and 507, whose learned values are -0.0243488010 and -0.0241926331 (absolute difference 1.562e-04), using a multiplicity-weighted mean. Hypothesis: this preserves qualification and yields 1,892 parameters. It is more informative than the nearest untested alternative (difference 1.577e-04) because it is the minimum-distortion eligible union; exact pairs already rejected under the unchanged grouping are excluded. Acceptance and rollback remain solely governed by the official runner.	0	0
attempt-0078	nearest-position-unions-infra-repair	micro-0194	672ee429b84f26233f00645921d6f943cb5cbb5e	72c9e54836ced121cefe148bd40bb1a4604465a9	2026-08-17T00:30:45.868575+00:00	parameter tying	99.060000%	1891	keep	Union closest position groups 238 and 457	Family: parameter tying. Current retained frontier is 1,892 parameters at 99.060000%, a +0.060000 percentage-point margin over 99%. There have been 20 prior macro-attempts in this family and 214 prior micro-trials. The most recent accepted result is attempt-0078/micro-0193 at 1892 parameters and 99.060000%; the most recent failed result is attempt-0075/micro-0001 (error, no score). This is a parameterization-preserving compression: union current position groups represented by coordinates 238 and 457, whose learned values are -0.0127551891 and -0.0125974715 (absolute difference 1.577e-04), using a multiplicity-weighted mean. Hypothesis: this preserves qualification and yields 1,891 parameters. It is more informative than the nearest untested alternative (difference 1.588e-04) because it is the minimum-distortion eligible union; exact pairs already rejected under the unchanged grouping are excluded. Acceptance and rollback remain solely governed by the official runner.	0	0
attempt-0078	nearest-position-unions-infra-repair	micro-0195	0e889f9b209ec5aef3f58fb30543516edd05b698	672ee429b84f26233f00645921d6f943cb5cbb5e	2026-08-17T00:31:47.700705+00:00	parameter tying	99.050000%	1890	keep	Union closest position groups 13 and 307	Family: parameter tying. Current retained frontier is 1,891 parameters at 99.060000%, a +0.060000 percentage-point margin over 99%. There have been 20 prior macro-attempts in this family and 215 prior micro-trials. The most recent accepted result is attempt-0078/micro-0194 at 1891 parameters and 99.060000%; the most recent failed result is attempt-0075/micro-0001 (error, no score). This is a parameterization-preserving compression: union current position groups represented by coordinates 13 and 307, whose learned values are 0.0174975600 and 0.0176563114 (absolute difference 1.588e-04), using a multiplicity-weighted mean. Hypothesis: this preserves qualification and yields 1,890 parameters. It is more informative than the nearest untested alternative (difference 1.590e-04) because it is the minimum-distortion eligible union; exact pairs already rejected under the unchanged grouping are excluded. Acceptance and rollback remain solely governed by the official runner.	0	0
attempt-0078	nearest-position-unions-infra-repair	micro-0196	e18828e4ffb24adfc8cb1be4dc5c41d23e5aafe2	0e889f9b209ec5aef3f58fb30543516edd05b698	2026-08-17T00:33:49.012628+00:00	parameter tying	99.050000%	1889	keep	Union closest position groups 425 and 104	Family: parameter tying. Current retained frontier is 1,890 parameters at 99.050000%, a +0.050000 percentage-point margin over 99%. There have been 20 prior macro-attempts in this family and 216 prior micro-trials. The most recent accepted result is attempt-0078/micro-0195 at 1890 parameters and 99.050000%; the most recent failed result is attempt-0075/micro-0001 (error, no score). This is a parameterization-preserving compression: union current position groups represented by coordinates 425 and 104, whose learned values are -0.0039302101 and -0.0037712075 (absolute difference 1.590e-04), using a multiplicity-weighted mean. Hypothesis: this preserves qualification and yields 1,889 parameters. It is more informative than the nearest untested alternative (difference 1.617e-04) because it is the minimum-distortion eligible union; exact pairs already rejected under the unchanged grouping are excluded. Acceptance and rollback remain solely governed by the official runner.	0	0
attempt-0078	nearest-position-unions-infra-repair	micro-0197	2ed7bafacef244877c6ded3235ef08f9663d898c	e18828e4ffb24adfc8cb1be4dc5c41d23e5aafe2	2026-08-17T00:34:51.126751+00:00	parameter tying	99.060000%	1888	keep	Union closest position groups 139 and 11	Family: parameter tying. Current retained frontier is 1,889 parameters at 99.050000%, a +0.050000 percentage-point margin over 99%. There have been 20 prior macro-attempts in this family and 217 prior micro-trials. The most recent accepted result is attempt-0078/micro-0196 at 1889 parameters and 99.050000%; the most recent failed result is attempt-0075/micro-0001 (error, no score). This is a parameterization-preserving compression: union current position groups represented by coordinates 139 and 11, whose learned values are 0.0169051625 and 0.0170669034 (absolute difference 1.617e-04), using a multiplicity-weighted mean. Hypothesis: this preserves qualification and yields 1,888 parameters. It is more informative than the nearest untested alternative (difference 1.625e-04) because it is the minimum-distortion eligible union; exact pairs already rejected under the unchanged grouping are excluded. Acceptance and rollback remain solely governed by the official runner.	0	0
attempt-0078	nearest-position-unions-infra-repair	micro-0198	0a559f47e872917399aa469ab59f5f05c702fccd	2ed7bafacef244877c6ded3235ef08f9663d898c	2026-08-17T00:35:53.288082+00:00	parameter tying	99.050000%	1887	keep	Union closest position groups 201 and 431	Family: parameter tying. Current retained frontier is 1,888 parameters at 99.060000%, a +0.060000 percentage-point margin over 99%. There have been 20 prior macro-attempts in this family and 218 prior micro-trials. The most recent accepted result is attempt-0078/micro-0197 at 1888 parameters and 99.060000%; the most recent failed result is attempt-0075/micro-0001 (error, no score). This is a parameterization-preserving compression: union current position groups represented by coordinates 201 and 431, whose learned values are -0.0074716248 and -0.0073090820 (absolute difference 1.625e-04), using a multiplicity-weighted mean. Hypothesis: this preserves qualification and yields 1,887 parameters. It is more informative than the nearest untested alternative (difference 1.629e-04) because it is the minimum-distortion eligible union; exact pairs already rejected under the unchanged grouping are excluded. Acceptance and rollback remain solely governed by the official runner.	0	0
attempt-0078	nearest-position-unions-infra-repair	micro-0199	ac4a6f5555c910ba61ac9c7ef63c9447b62615ae	0a559f47e872917399aa469ab59f5f05c702fccd	2026-08-17T00:36:55.759766+00:00	parameter tying	99.050000%	1886	keep	Union closest position groups 295 and 262	Family: parameter tying. Current retained frontier is 1,887 parameters at 99.050000%, a +0.050000 percentage-point margin over 99%. There have been 20 prior macro-attempts in this family and 219 prior micro-trials. The most recent accepted result is attempt-0078/micro-0198 at 1887 parameters and 99.050000%; the most recent failed result is attempt-0075/micro-0001 (error, no score). This is a parameterization-preserving compression: union current position groups represented by coordinates 295 and 262, whose learned values are 0.0098800901 and 0.0100430045 (absolute difference 1.629e-04), using a multiplicity-weighted mean. Hypothesis: this preserves qualification and yields 1,886 parameters. It is more informative than the nearest untested alternative (difference 1.631e-04) because it is the minimum-distortion eligible union; exact pairs already rejected under the unchanged grouping are excluded. Acceptance and rollback remain solely governed by the official runner.	0	0
attempt-0078	nearest-position-unions-infra-repair	micro-0200	1d5e8c3ef2fcb81dbd60e291b88bf4b7a89eab34	ac4a6f5555c910ba61ac9c7ef63c9447b62615ae	2026-08-17T00:37:56.992559+00:00	parameter tying	99.050000%	1885	keep	Union closest position groups 189 and 258	Family: parameter tying. Current retained frontier is 1,886 parameters at 99.050000%, a +0.050000 percentage-point margin over 99%. There have been 20 prior macro-attempts in this family and 220 prior micro-trials. The most recent accepted result is attempt-0078/micro-0199 at 1886 parameters and 99.050000%; the most recent failed result is attempt-0075/micro-0001 (error, no score). This is a parameterization-preserving compression: union current position groups represented by coordinates 189 and 258, whose learned values are -0.0063263378 and -0.0061632120 (absolute difference 1.631e-04), using a multiplicity-weighted mean. Hypothesis: this preserves qualification and yields 1,885 parameters. It is more informative than the nearest untested alternative (difference 1.654e-04) because it is the minimum-distortion eligible union; exact pairs already rejected under the unchanged grouping are excluded. Acceptance and rollback remain solely governed by the official runner.	0	0
attempt-0078	nearest-position-unions-infra-repair	micro-0201	650cd61a6b558b41de67d0f0a95503350f1853f5	1d5e8c3ef2fcb81dbd60e291b88bf4b7a89eab34	2026-08-17T00:39:00.621935+00:00	parameter tying	99.050000%	1884	keep	Union closest position groups 470 and 486	Family: parameter tying. Current retained frontier is 1,885 parameters at 99.050000%, a +0.050000 percentage-point margin over 99%. There have been 20 prior macro-attempts in this family and 221 prior micro-trials. The most recent accepted result is attempt-0078/micro-0200 at 1885 parameters and 99.050000%; the most recent failed result is attempt-0075/micro-0001 (error, no score). This is a parameterization-preserving compression: union current position groups represented by coordinates 470 and 486, whose learned values are -0.0194189195 and -0.0192535166 (absolute difference 1.654e-04), using a multiplicity-weighted mean. Hypothesis: this preserves qualification and yields 1,884 parameters. It is more informative than the nearest untested alternative (difference 1.685e-04) because it is the minimum-distortion eligible union; exact pairs already rejected under the unchanged grouping are excluded. Acceptance and rollback remain solely governed by the official runner.	0	0
