macro_attempt_id	automation_id	micro_attempt_id	commit	parent_commit	timestamp_utc	family	accuracy	parameters	status	description	proposal	train_exit	verify_exit
attempt-0193	qkv-final-band-one	micro-0002	647417b4648be65736b23e24b99345a7f873cb43	2ac0955cda9f5d077abad70c8ba70478688b9d08	2026-08-17T14:07:53.763949+00:00	parameter tying	99.130000%	1437	keep	Union closest shared-QKV scalar groups 758 and 550	Family: parameter tying. Current retained frontier is 1,438 parameters at 99.120000%, a +0.120000 percentage-point margin over 99%. There have been 90 prior macro-attempts in this family and 716 prior micro-trials. The most recent accepted result is attempt-0185/micro-0002 at 1,479 parameters and 99.20%; the most recent failed result is attempt-0186/micro-0001 (block-0 pre-FF bias pair 8/3 discarded at 98.08%). This is a parameterization-preserving compression of the depth-shared QKV transform: union flattened coordinates 758 and 550, whose learned values are 0.0380637683 and 0.0382790230 (difference 2.153e-04), with a multiplicity-weighted mean and integer reconstruction map. Hypothesis: the much larger attention tensor contains near-duplicate scalars below the token failure scale, so this union preserves qualification and yields 1,437 parameters. It is more informative than the next QKV union (difference 2.160e-04) because it is the minimum-distortion test at this new site. Acceptance and rollback remain solely governed by the official runner.	0	0
attempt-0193	qkv-final-band-one	micro-0003	4741929407b3884858779a29fc2c44f701564092	647417b4648be65736b23e24b99345a7f873cb43	2026-08-17T14:09:19.158537+00:00	parameter tying	99.130000%	1436	keep	Union closest shared-QKV scalar groups 17 and 486	Family: parameter tying. Current retained frontier is 1,437 parameters at 99.130000%, a +0.130000 percentage-point margin over 99%. There have been 90 prior macro-attempts in this family and 717 prior micro-trials. The most recent accepted result is attempt-0185/micro-0002 at 1,479 parameters and 99.20%; the most recent failed result is attempt-0186/micro-0001 (block-0 pre-FF bias pair 8/3 discarded at 98.08%). This is a parameterization-preserving compression of the depth-shared QKV transform: union flattened coordinates 17 and 486, whose learned values are 0.1215052977 and 0.1217212602 (difference 2.160e-04), with a multiplicity-weighted mean and integer reconstruction map. Hypothesis: the much larger attention tensor contains near-duplicate scalars below the token failure scale, so this union preserves qualification and yields 1,436 parameters. It is more informative than the next QKV union (difference 2.189e-04) because it is the minimum-distortion test at this new site. Acceptance and rollback remain solely governed by the official runner.	0	0
attempt-0194	ffout-final-band-one	micro-0001	52b4742d0d8905544e124e414cde7543004cb092	4741929407b3884858779a29fc2c44f701564092	2026-08-17T14:12:13.389428+00:00	parameter tying	99.090000%	1435	keep	Union closest shared FF-output scalar groups 76 and 6	Family: parameter tying. Current retained frontier is 1,436 parameters at 99.130000%, a +0.130000 percentage-point margin over 99%. There have been 91 prior macro-attempts in this family and 718 prior micro-trials. The most recent accepted result is attempt-0193/micro-0003 at 1,436 parameters and 99.13%; the most recent failed result is attempt-0189/micro-0005 (FF-output pair 57/0 discarded at 98.96%). This is a parameterization-preserving compression of the depth-shared feed-forward output map: union flattened coordinates 76 and 6, values 0.0015740934 and 0.0025901438 (difference 1.016e-03), using a weighted mean and integer reconstruction. Hypothesis: residual-stream reconstruction contains near-duplicate scalars distinct from FF-input redundancy, preserving qualification at 1,435 parameters. It is more informative than the next FF-output union (difference 1.059e-03) because it is the minimum-distortion isolated test of the complementary FF map. Official acceptance and rollback are unchanged.	0	0
attempt-0194	ffout-final-band-one	micro-0002	b11b704da94fbbf8092cc8c716d90ba196d27ce9	52b4742d0d8905544e124e414cde7543004cb092	2026-08-17T14:13:47.379323+00:00	parameter tying	98.910000%	1434	discard	Union closest shared FF-output scalar groups 106 and 12	Family: parameter tying. Current retained frontier is 1,435 parameters at 99.090000%, a +0.090000 percentage-point margin over 99%. There have been 91 prior macro-attempts in this family and 719 prior micro-trials. The most recent accepted result is attempt-0193/micro-0003 at 1,436 parameters and 99.13%; the most recent failed result is attempt-0189/micro-0005 (FF-output pair 57/0 discarded at 98.96%). This is a parameterization-preserving compression of the depth-shared feed-forward output map: union flattened coordinates 106 and 12, values 0.0785530284 and 0.0796122104 (difference 1.059e-03), using a weighted mean and integer reconstruction. Hypothesis: residual-stream reconstruction contains near-duplicate scalars distinct from FF-input redundancy, preserving qualification at 1,434 parameters. It is more informative than the next FF-output union (difference 1.078e-03) because it is the minimum-distortion isolated test of the complementary FF map. Official acceptance and rollback are unchanged.	0	0
attempt-0195	ffin-final-band-one	micro-0001	5ee3fe2975f696ebc3bc04d0db40fd34e255695a	52b4742d0d8905544e124e414cde7543004cb092	2026-08-17T14:16:17.770608+00:00	parameter tying	99.090000%	1434	keep	Union closest shared FF-input scalar groups 191 and 206	Family: parameter tying. Current retained frontier is 1,435 parameters at 99.090000%, a +0.090000 percentage-point margin over 99%. There have been 92 prior macro-attempts in this family and 720 prior micro-trials. The most recent accepted result is attempt-0194/micro-0001 at 1435 parameters and 99.090000%; the most recent failed result is attempt-0194/micro-0002 (discard, 98.910000%). This is a parameterization-preserving compression of the depth-shared feed-forward input map: union flattened coordinates 191 and 206, values 0.3336564004 and 0.3342294693 (difference 5.731e-04), using a weighted mean and integer reconstruction. Hypothesis: nonlinear feature construction contains near-duplicate scalars independent of QKV redundancy, preserving qualification at 1,434 parameters. It is more informative than the next FF-input union (difference 5.772e-04) because it is the minimum-distortion isolated test at this new mechanism site. Official acceptance and rollback are unchanged.	0	0
attempt-0195	ffin-final-band-one	micro-0002	d26e6f1bc8465b8b570a1c9a8cdc511e4791c977	5ee3fe2975f696ebc3bc04d0db40fd34e255695a	2026-08-17T14:17:52.515260+00:00	parameter tying	99.100000%	1433	keep	Union closest shared FF-input scalar groups 29 and 131	Family: parameter tying. Current retained frontier is 1,434 parameters at 99.090000%, a +0.090000 percentage-point margin over 99%. There have been 92 prior macro-attempts in this family and 721 prior micro-trials. The most recent accepted result is attempt-0195/micro-0001 at 1434 parameters and 99.090000%; the most recent failed result is attempt-0194/micro-0002 (discard, 98.910000%). This is a parameterization-preserving compression of the depth-shared feed-forward input map: union flattened coordinates 29 and 131, values -0.0309215058 and -0.0303442813 (difference 5.772e-04), using a weighted mean and integer reconstruction. Hypothesis: nonlinear feature construction contains near-duplicate scalars independent of QKV redundancy, preserving qualification at 1,433 parameters. It is more informative than the next FF-input union (difference 6.225e-04) because it is the minimum-distortion isolated test at this new mechanism site. Official acceptance and rollback are unchanged.	0	0
attempt-0195	ffin-final-band-one	micro-0003	1e7f82f56cad50c70442178db8ace6201121936d	d26e6f1bc8465b8b570a1c9a8cdc511e4791c977	2026-08-17T14:19:28.159130+00:00	parameter tying	99.060000%	1432	keep	Union closest shared FF-input scalar groups 190 and 85	Family: parameter tying. Current retained frontier is 1,433 parameters at 99.100000%, a +0.100000 percentage-point margin over 99%. There have been 92 prior macro-attempts in this family and 722 prior micro-trials. The most recent accepted result is attempt-0195/micro-0002 at 1433 parameters and 99.100000%; the most recent failed result is attempt-0194/micro-0002 (discard, 98.910000%). This is a parameterization-preserving compression of the depth-shared feed-forward input map: union flattened coordinates 190 and 85, values 0.0412872955 and 0.0419098437 (difference 6.225e-04), using a weighted mean and integer reconstruction. Hypothesis: nonlinear feature construction contains near-duplicate scalars independent of QKV redundancy, preserving qualification at 1,432 parameters. It is more informative than the next FF-input union (difference 6.274e-04) because it is the minimum-distortion isolated test at this new mechanism site. Official acceptance and rollback are unchanged.	0	0
attempt-0196	token-final-band-one	micro-0001	497e4ddf11f0c873ae162c98b87c6fa8b13553b7	1e7f82f56cad50c70442178db8ace6201121936d	2026-08-17T14:21:58.964260+00:00	parameter tying	99.070000%	1431	keep	Union closest token-matrix scalar groups 96 and 1	Family: parameter tying. Current retained frontier is 1,432 parameters at 99.060000%, a +0.060000 percentage-point margin over 99%. There have been 93 prior macro-attempts in this family and 723 prior micro-trials. The most recent accepted result is attempt-0195/micro-0003 at 1432 parameters and 99.060000%; the most recent failed result is attempt-0194/micro-0002 (discard, 98.910000%). This is a parameterization-preserving compression of the tied input/output token matrix: union groups represented by flattened coordinates 96 and 1, whose values are -0.2205629200 and -0.2202083170 (difference 3.546e-04), using a multiplicity-weighted mean and one integer reconstruction map. Hypothesis: token scalars have a different sensitivity structure from the positional table and this minimum-distortion union preserves qualification while yielding 1,431 parameters. It is more informative than the next eligible token union (difference 3.589e-04) because it is the least perturbing test at this new tensor site. Acceptance and rollback remain solely governed by the official runner.	0	0
attempt-0196	token-final-band-one	micro-0002	64d21e1e51731bb3cd16524004d70a6dd7ed1984	497e4ddf11f0c873ae162c98b87c6fa8b13553b7	2026-08-17T14:23:22.285104+00:00	parameter tying	99.040000%	1430	keep	Union closest token-matrix scalar groups 142 and 52	Family: parameter tying. Current retained frontier is 1,431 parameters at 99.070000%, a +0.070000 percentage-point margin over 99%. There have been 93 prior macro-attempts in this family and 724 prior micro-trials. The most recent accepted result is attempt-0196/micro-0001 at 1431 parameters and 99.070000%; the most recent failed result is attempt-0194/micro-0002 (discard, 98.910000%). This is a parameterization-preserving compression of the tied input/output token matrix: union groups represented by flattened coordinates 142 and 52, whose values are 0.0023909302 and 0.0027498596 (difference 3.589e-04), using a multiplicity-weighted mean and one integer reconstruction map. Hypothesis: token scalars have a different sensitivity structure from the positional table and this minimum-distortion union preserves qualification while yielding 1,430 parameters. It is more informative than the next eligible token union (difference 3.680e-04) because it is the least perturbing test at this new tensor site. Acceptance and rollback remain solely governed by the official runner.	0	0
attempt-0196	token-final-band-one	micro-0003	57876961063cdf322f8b6f115306c220088b0df0	64d21e1e51731bb3cd16524004d70a6dd7ed1984	2026-08-17T14:24:46.609206+00:00	parameter tying	99.080000%	1429	keep	Union closest token-matrix scalar groups 95 and 159	Family: parameter tying. Current retained frontier is 1,430 parameters at 99.040000%, a +0.040000 percentage-point margin over 99%. There have been 93 prior macro-attempts in this family and 725 prior micro-trials. The most recent accepted result is attempt-0196/micro-0002 at 1430 parameters and 99.040000%; the most recent failed result is attempt-0194/micro-0002 (discard, 98.910000%). This is a parameterization-preserving compression of the tied input/output token matrix: union groups represented by flattened coordinates 95 and 159, whose values are 0.0460733622 and 0.0464413203 (difference 3.680e-04), using a multiplicity-weighted mean and one integer reconstruction map. Hypothesis: token scalars have a different sensitivity structure from the positional table and this minimum-distortion union preserves qualification while yielding 1,429 parameters. It is more informative than the next eligible token union (difference 3.730e-04) because it is the least perturbing test at this new tensor site. Acceptance and rollback remain solely governed by the official runner.	0	0
attempt-0197	position-final-band-two	micro-0001	89c5d38648ad224b853380d4a7fc46edc362c0ca	57876961063cdf322f8b6f115306c220088b0df0	2026-08-17T14:27:12.953481+00:00	parameter tying	99.070000%	1428	keep	Union closest position groups 318 and 232	Family: parameter tying. Current retained frontier is 1,429 parameters at 99.080000%, a +0.080000 percentage-point margin over 99%. There have been 94 prior macro-attempts in this family and 726 prior micro-trials. The most recent accepted result is attempt-0196/micro-0003 at 1429 parameters and 99.080000%; the most recent failed result is attempt-0194/micro-0002 (discard, 98.910000%). This is a parameterization-preserving compression: union current position groups represented by coordinates 318 and 232, whose learned values are 0.0253077652 and 0.0257830992 (absolute difference 4.753e-04), using a multiplicity-weighted mean. Hypothesis: this preserves qualification and yields 1,428 parameters. It is more informative than the nearest untested alternative (difference 4.760e-04) because it is the minimum-distortion eligible union; exact pairs already rejected under the unchanged grouping are excluded. Acceptance and rollback remain solely governed by the official runner.	0	0
attempt-0197	position-final-band-two	micro-0002	6fe4609f27e0abaaab08f934b0d1e5b632afd03c	89c5d38648ad224b853380d4a7fc46edc362c0ca	2026-08-17T14:28:59.224661+00:00	parameter tying	99.070000%	1427	keep	Union closest position groups 5 and 395	Family: parameter tying. Current retained frontier is 1,428 parameters at 99.070000%, a +0.070000 percentage-point margin over 99%. There have been 94 prior macro-attempts in this family and 727 prior micro-trials. The most recent accepted result is attempt-0197/micro-0001 at 1428 parameters and 99.070000%; the most recent failed result is attempt-0194/micro-0002 (discard, 98.910000%). This is a parameterization-preserving compression: union current position groups represented by coordinates 5 and 395, whose learned values are -0.0337204635 and -0.0332444310 (absolute difference 4.760e-04), using a multiplicity-weighted mean. Hypothesis: this preserves qualification and yields 1,427 parameters. It is more informative than the nearest untested alternative (difference 4.764e-04) because it is the minimum-distortion eligible union; exact pairs already rejected under the unchanged grouping are excluded. Acceptance and rollback remain solely governed by the official runner.	0	0
attempt-0197	position-final-band-two	micro-0003	34420fca22080a8b9a0270fe9d1b03dd30ab5081	6fe4609f27e0abaaab08f934b0d1e5b632afd03c	2026-08-17T14:30:45.387751+00:00	parameter tying	99.100000%	1426	keep	Union closest position groups 47 and 71	Family: parameter tying. Current retained frontier is 1,427 parameters at 99.070000%, a +0.070000 percentage-point margin over 99%. There have been 94 prior macro-attempts in this family and 728 prior micro-trials. The most recent accepted result is attempt-0197/micro-0002 at 1427 parameters and 99.070000%; the most recent failed result is attempt-0194/micro-0002 (discard, 98.910000%). This is a parameterization-preserving compression: union current position groups represented by coordinates 47 and 71, whose learned values are -0.0242707171 and -0.0237943586 (absolute difference 4.764e-04), using a multiplicity-weighted mean. Hypothesis: this preserves qualification and yields 1,426 parameters. It is more informative than the nearest untested alternative (difference 4.792e-04) because it is the minimum-distortion eligible union; exact pairs already rejected under the unchanged grouping are excluded. Acceptance and rollback remain solely governed by the official runner.	0	0
attempt-0198	qkv-final-band-two	micro-0001	a2d88dea96a62043b73ce4668fead6bc6ba7ae45	34420fca22080a8b9a0270fe9d1b03dd30ab5081	2026-08-17T14:33:04.753884+00:00	parameter tying	99.100000%	1425	keep	Union closest shared-QKV scalar groups 563 and 519	Family: parameter tying. Current retained frontier is 1,426 parameters at 99.100000%, a +0.100000 percentage-point margin over 99%. There have been 95 prior macro-attempts in this family and 729 prior micro-trials. The most recent accepted result is attempt-0197/micro-0003 at 1426 parameters and 99.100000%; the most recent failed result is attempt-0194/micro-0002 (discard, 98.910000%). This is a parameterization-preserving compression of the depth-shared QKV transform: union flattened coordinates 563 and 519, whose learned values are -0.0327741317 and -0.0325552002 (difference 2.189e-04), with a multiplicity-weighted mean and integer reconstruction map. Hypothesis: the much larger attention tensor contains near-duplicate scalars below the token failure scale, so this union preserves qualification and yields 1,425 parameters. It is more informative than the next QKV union (difference 2.287e-04) because it is the minimum-distortion test at this new site. Acceptance and rollback remain solely governed by the official runner.	0	0
attempt-0198	qkv-final-band-two	micro-0002	6c9f5ca770c0e017a6b1cb6a7104b4b6dd0573fa	a2d88dea96a62043b73ce4668fead6bc6ba7ae45	2026-08-17T14:34:26.117162+00:00	parameter tying	99.100000%	1424	keep	Union closest shared-QKV scalar groups 4 and 461	Family: parameter tying. Current retained frontier is 1,425 parameters at 99.100000%, a +0.100000 percentage-point margin over 99%. There have been 95 prior macro-attempts in this family and 730 prior micro-trials. The most recent accepted result is attempt-0198/micro-0001 at 1425 parameters and 99.100000%; the most recent failed result is attempt-0194/micro-0002 (discard, 98.910000%). This is a parameterization-preserving compression of the depth-shared QKV transform: union flattened coordinates 4 and 461, whose learned values are -0.2411482483 and -0.2409195602 (difference 2.287e-04), with a multiplicity-weighted mean and integer reconstruction map. Hypothesis: the much larger attention tensor contains near-duplicate scalars below the token failure scale, so this union preserves qualification and yields 1,424 parameters. It is more informative than the next QKV union (difference 2.299e-04) because it is the minimum-distortion test at this new site. Acceptance and rollback remain solely governed by the official runner.	0	0
attempt-0198	qkv-final-band-two	micro-0003	70c2609476d6ccaa4c1c3308ba011571d88a7f23	6c9f5ca770c0e017a6b1cb6a7104b4b6dd0573fa	2026-08-17T14:35:45.305524+00:00	parameter tying	99.080000%	1423	keep	Union closest shared-QKV scalar groups 753 and 554	Family: parameter tying. Current retained frontier is 1,424 parameters at 99.100000%, a +0.100000 percentage-point margin over 99%. There have been 95 prior macro-attempts in this family and 731 prior micro-trials. The most recent accepted result is attempt-0198/micro-0002 at 1424 parameters and 99.100000%; the most recent failed result is attempt-0194/micro-0002 (discard, 98.910000%). This is a parameterization-preserving compression of the depth-shared QKV transform: union flattened coordinates 753 and 554, whose learned values are -0.0371283107 and -0.0368984453 (difference 2.299e-04), with a multiplicity-weighted mean and integer reconstruction map. Hypothesis: the much larger attention tensor contains near-duplicate scalars below the token failure scale, so this union preserves qualification and yields 1,423 parameters. It is more informative than the next QKV union (difference 2.356e-04) because it is the minimum-distortion test at this new site. Acceptance and rollback remain solely governed by the official runner.	0	0
attempt-0199	ffout-final-band-two	micro-0001	e72f7611b7db0e58592041a10827518a1b2b3f0c	70c2609476d6ccaa4c1c3308ba011571d88a7f23	2026-08-17T14:37:54.788136+00:00	parameter tying	99.150000%	1422	keep	Union closest shared FF-output scalar groups 55 and 87	Family: parameter tying. Current retained frontier is 1,423 parameters at 99.080000%, a +0.080000 percentage-point margin over 99%. There have been 96 prior macro-attempts in this family and 732 prior micro-trials. The most recent accepted result is attempt-0198/micro-0003 at 1423 parameters and 99.080000%; the most recent failed result is attempt-0194/micro-0002 (discard, 98.910000%). This is a parameterization-preserving compression of the depth-shared feed-forward output map: union flattened coordinates 55 and 87, values 0.0051350105 and 0.0062126732 (difference 1.078e-03), using a weighted mean and integer reconstruction. Hypothesis: residual-stream reconstruction contains near-duplicate scalars distinct from FF-input redundancy, preserving qualification at 1,422 parameters. It is more informative than the next FF-output union (difference 1.099e-03) because it is the minimum-distortion isolated test of the complementary FF map. Official acceptance and rollback are unchanged.	0	0
