macro_attempt_id	automation_id	micro_attempt_id	commit	parent_commit	timestamp_utc	family	accuracy	parameters	status	description	proposal	train_exit	verify_exit
attempt-0078	nearest-position-unions-infra-repair	micro-0066	b9c201a28d2d9519c701e01b74dab90e0197f930	98c39113619b4123ee67ed7b8ccfef1d9358f480	2026-08-16T22:06:10.496065+00:00	parameter tying	99.040000%	2019	keep	Union closest position groups 401 and 263	Family: parameter tying. Current retained frontier is 2,020 parameters at 99.040000%, a +0.040000 percentage-point margin over 99%. There have been 20 prior macro-attempts in this family and 86 prior micro-trials. The most recent accepted result is attempt-0078/micro-0065 at 2020 parameters and 99.040000%; the most recent failed result is attempt-0075/micro-0001 (error, no score). This is a parameterization-preserving compression: union current position groups represented by coordinates 401 and 263, whose learned values are 0.0116190100 and 0.0116635850 (absolute difference 4.457e-05), using a multiplicity-weighted mean. Hypothesis: this preserves qualification and yields 2,019 parameters. It is more informative than the nearest untested alternative (difference 4.529e-05) because it is the minimum-distortion eligible union; exact pairs already rejected under the unchanged grouping are excluded. Acceptance and rollback remain solely governed by the official runner.	0	0
attempt-0078	nearest-position-unions-infra-repair	micro-0067	059f4da3192dfc71f0ce15b5b990a7be160b8548	b9c201a28d2d9519c701e01b74dab90e0197f930	2026-08-16T22:07:13.096824+00:00	parameter tying	99.050000%	2018	keep	Union closest position groups 367 and 435	Family: parameter tying. Current retained frontier is 2,019 parameters at 99.040000%, a +0.040000 percentage-point margin over 99%. There have been 20 prior macro-attempts in this family and 87 prior micro-trials. The most recent accepted result is attempt-0078/micro-0066 at 2019 parameters and 99.040000%; the most recent failed result is attempt-0075/micro-0001 (error, no score). This is a parameterization-preserving compression: union current position groups represented by coordinates 367 and 435, whose learned values are 0.0118183270 and 0.0118636144 (absolute difference 4.529e-05), using a multiplicity-weighted mean. Hypothesis: this preserves qualification and yields 2,018 parameters. It is more informative than the nearest untested alternative (difference 4.559e-05) because it is the minimum-distortion eligible union; exact pairs already rejected under the unchanged grouping are excluded. Acceptance and rollback remain solely governed by the official runner.	0	0
attempt-0078	nearest-position-unions-infra-repair	micro-0068	95b141893cf7a963773b5f80518ee32f1a62d257	059f4da3192dfc71f0ce15b5b990a7be160b8548	2026-08-16T22:08:15.470252+00:00	parameter tying	99.060000%	2017	keep	Union closest position groups 198 and 273	Family: parameter tying. Current retained frontier is 2,018 parameters at 99.050000%, a +0.050000 percentage-point margin over 99%. There have been 20 prior macro-attempts in this family and 88 prior micro-trials. The most recent accepted result is attempt-0078/micro-0067 at 2018 parameters and 99.050000%; the most recent failed result is attempt-0075/micro-0001 (error, no score). This is a parameterization-preserving compression: union current position groups represented by coordinates 198 and 273, whose learned values are 0.0105306180 and 0.0105762091 (absolute difference 4.559e-05), using a multiplicity-weighted mean. Hypothesis: this preserves qualification and yields 2,017 parameters. It is more informative than the nearest untested alternative (difference 4.569e-05) because it is the minimum-distortion eligible union; exact pairs already rejected under the unchanged grouping are excluded. Acceptance and rollback remain solely governed by the official runner.	0	0
attempt-0078	nearest-position-unions-infra-repair	micro-0069	762f22b05e35db2cec45fe24f596c4de108ba93b	95b141893cf7a963773b5f80518ee32f1a62d257	2026-08-16T22:09:20.469070+00:00	parameter tying	99.060000%	2016	keep	Union closest position groups 66 and 269	Family: parameter tying. Current retained frontier is 2,017 parameters at 99.060000%, a +0.060000 percentage-point margin over 99%. There have been 20 prior macro-attempts in this family and 89 prior micro-trials. The most recent accepted result is attempt-0078/micro-0068 at 2017 parameters and 99.060000%; the most recent failed result is attempt-0075/micro-0001 (error, no score). This is a parameterization-preserving compression: union current position groups represented by coordinates 66 and 269, whose learned values are -0.0117973350 and -0.0117516462 (absolute difference 4.569e-05), using a multiplicity-weighted mean. Hypothesis: this preserves qualification and yields 2,016 parameters. It is more informative than the nearest untested alternative (difference 4.870e-05) because it is the minimum-distortion eligible union; exact pairs already rejected under the unchanged grouping are excluded. Acceptance and rollback remain solely governed by the official runner.	0	0
attempt-0078	nearest-position-unions-infra-repair	micro-0070	86df9fa799cec8d3b6dfa9a2b2d6e0682308fa00	762f22b05e35db2cec45fe24f596c4de108ba93b	2026-08-16T22:10:23.298853+00:00	parameter tying	99.060000%	2015	keep	Union closest position groups 382 and 182	Family: parameter tying. Current retained frontier is 2,016 parameters at 99.060000%, a +0.060000 percentage-point margin over 99%. There have been 20 prior macro-attempts in this family and 90 prior micro-trials. The most recent accepted result is attempt-0078/micro-0069 at 2016 parameters and 99.060000%; the most recent failed result is attempt-0075/micro-0001 (error, no score). This is a parameterization-preserving compression: union current position groups represented by coordinates 382 and 182, whose learned values are 0.0127391340 and 0.0127878338 (absolute difference 4.870e-05), using a multiplicity-weighted mean. Hypothesis: this preserves qualification and yields 2,015 parameters. It is more informative than the nearest untested alternative (difference 4.944e-05) because it is the minimum-distortion eligible union; exact pairs already rejected under the unchanged grouping are excluded. Acceptance and rollback remain solely governed by the official runner.	0	0
attempt-0078	nearest-position-unions-infra-repair	micro-0071	9774af79f3c2336d29a2939455c770df6525ff16	86df9fa799cec8d3b6dfa9a2b2d6e0682308fa00	2026-08-16T22:11:25.342367+00:00	parameter tying	99.060000%	2014	keep	Union closest position groups 0 and 421	Family: parameter tying. Current retained frontier is 2,015 parameters at 99.060000%, a +0.060000 percentage-point margin over 99%. There have been 20 prior macro-attempts in this family and 91 prior micro-trials. The most recent accepted result is attempt-0078/micro-0070 at 2015 parameters and 99.060000%; the most recent failed result is attempt-0075/micro-0001 (error, no score). This is a parameterization-preserving compression: union current position groups represented by coordinates 0 and 421, whose learned values are -0.0223338176 and -0.0222843736 (absolute difference 4.944e-05), using a multiplicity-weighted mean. Hypothesis: this preserves qualification and yields 2,014 parameters. It is more informative than the nearest untested alternative (difference 5.073e-05) because it is the minimum-distortion eligible union; exact pairs already rejected under the unchanged grouping are excluded. Acceptance and rollback remain solely governed by the official runner.	0	0
attempt-0078	nearest-position-unions-infra-repair	micro-0072	abebaf4a7ab27ccdef32caad52a9ba38aec4e2bf	9774af79f3c2336d29a2939455c770df6525ff16	2026-08-16T22:12:35.126083+00:00	parameter tying	99.070000%	2013	keep	Union closest position groups 136 and 285	Family: parameter tying. Current retained frontier is 2,014 parameters at 99.060000%, a +0.060000 percentage-point margin over 99%. There have been 20 prior macro-attempts in this family and 92 prior micro-trials. The most recent accepted result is attempt-0078/micro-0071 at 2014 parameters and 99.060000%; the most recent failed result is attempt-0075/micro-0001 (error, no score). This is a parameterization-preserving compression: union current position groups represented by coordinates 136 and 285, whose learned values are 0.0092705246 and 0.0093212547 (absolute difference 5.073e-05), using a multiplicity-weighted mean. Hypothesis: this preserves qualification and yields 2,013 parameters. It is more informative than the nearest untested alternative (difference 5.174e-05) because it is the minimum-distortion eligible union; exact pairs already rejected under the unchanged grouping are excluded. Acceptance and rollback remain solely governed by the official runner.	0	0
attempt-0078	nearest-position-unions-infra-repair	micro-0073	0780e56f07c99bb47b347a6064d83a24c6545810	abebaf4a7ab27ccdef32caad52a9ba38aec4e2bf	2026-08-16T22:13:43.104909+00:00	parameter tying	99.070000%	2012	keep	Union closest position groups 210 and 256	Family: parameter tying. Current retained frontier is 2,013 parameters at 99.070000%, a +0.070000 percentage-point margin over 99%. There have been 20 prior macro-attempts in this family and 93 prior micro-trials. The most recent accepted result is attempt-0078/micro-0072 at 2013 parameters and 99.070000%; the most recent failed result is attempt-0075/micro-0001 (error, no score). This is a parameterization-preserving compression: union current position groups represented by coordinates 210 and 256, whose learned values are -0.0013240703 and -0.0012723338 (absolute difference 5.174e-05), using a multiplicity-weighted mean. Hypothesis: this preserves qualification and yields 2,012 parameters. It is more informative than the nearest untested alternative (difference 5.179e-05) because it is the minimum-distortion eligible union; exact pairs already rejected under the unchanged grouping are excluded. Acceptance and rollback remain solely governed by the official runner.	0	0
attempt-0078	nearest-position-unions-infra-repair	micro-0074	e91897f30b8946b9bd8f4381a34a34dee9242a53	0780e56f07c99bb47b347a6064d83a24c6545810	2026-08-16T22:20:26.991479+00:00	parameter tying	99.070000%	2011	keep	Union closest position groups 295 and 422	Family: parameter tying. Current retained frontier is 2,012 parameters at 99.070000%, a +0.070000 percentage-point margin over 99%. There have been 20 prior macro-attempts in this family and 94 prior micro-trials. The most recent accepted result is attempt-0078/micro-0073 at 2012 parameters and 99.070000%; the most recent failed result is attempt-0075/micro-0001 (error, no score). This is a parameterization-preserving compression: union current position groups represented by coordinates 295 and 422, whose learned values are 0.0098234033 and 0.0098751895 (absolute difference 5.179e-05), using a multiplicity-weighted mean. Hypothesis: this preserves qualification and yields 2,011 parameters. It is more informative than the nearest untested alternative (difference 5.235e-05) because it is the minimum-distortion eligible union; exact pairs already rejected under the unchanged grouping are excluded. Acceptance and rollback remain solely governed by the official runner.	0	0
attempt-0078	nearest-position-unions-infra-repair	micro-0075	61aa0a07a16f6efe0138e37cd37a60fa3a7ecf94	e91897f30b8946b9bd8f4381a34a34dee9242a53	2026-08-16T22:21:30.007767+00:00	parameter tying	99.070000%	2010	keep	Union closest position groups 58 and 97	Family: parameter tying. Current retained frontier is 2,011 parameters at 99.070000%, a +0.070000 percentage-point margin over 99%. There have been 20 prior macro-attempts in this family and 95 prior micro-trials. The most recent accepted result is attempt-0078/micro-0074 at 2011 parameters and 99.070000%; the most recent failed result is attempt-0075/micro-0001 (error, no score). This is a parameterization-preserving compression: union current position groups represented by coordinates 58 and 97, whose learned values are -0.0096865334 and -0.0096341819 (absolute difference 5.235e-05), using a multiplicity-weighted mean. Hypothesis: this preserves qualification and yields 2,010 parameters. It is more informative than the nearest untested alternative (difference 5.288e-05) because it is the minimum-distortion eligible union; exact pairs already rejected under the unchanged grouping are excluded. Acceptance and rollback remain solely governed by the official runner.	0	0
attempt-0078	nearest-position-unions-infra-repair	micro-0076	14264e9826b74e544a6e720ca970373e945f42fc	61aa0a07a16f6efe0138e37cd37a60fa3a7ecf94	2026-08-16T22:22:31.956912+00:00	parameter tying	99.070000%	2009	keep	Union closest position groups 262 and 289	Family: parameter tying. Current retained frontier is 2,010 parameters at 99.070000%, a +0.070000 percentage-point margin over 99%. There have been 20 prior macro-attempts in this family and 96 prior micro-trials. The most recent accepted result is attempt-0078/micro-0075 at 2010 parameters and 99.070000%; the most recent failed result is attempt-0075/micro-0001 (error, no score). This is a parameterization-preserving compression: union current position groups represented by coordinates 262 and 289, whose learned values are 0.0100165671 and 0.0100694429 (absolute difference 5.288e-05), using a multiplicity-weighted mean. Hypothesis: this preserves qualification and yields 2,009 parameters. It is more informative than the nearest untested alternative (difference 5.315e-05) because it is the minimum-distortion eligible union; exact pairs already rejected under the unchanged grouping are excluded. Acceptance and rollback remain solely governed by the official runner.	0	0
attempt-0078	nearest-position-unions-infra-repair	micro-0077	e95334ddc0e1d54def85b143db9d8b9b2e332f44	14264e9826b74e544a6e720ca970373e945f42fc	2026-08-16T22:23:34.545288+00:00	parameter tying	99.070000%	2008	keep	Union closest position groups 144 and 79	Family: parameter tying. Current retained frontier is 2,009 parameters at 99.070000%, a +0.070000 percentage-point margin over 99%. There have been 20 prior macro-attempts in this family and 97 prior micro-trials. The most recent accepted result is attempt-0078/micro-0076 at 2009 parameters and 99.070000%; the most recent failed result is attempt-0075/micro-0001 (error, no score). This is a parameterization-preserving compression: union current position groups represented by coordinates 144 and 79, whose learned values are 0.0020982460 and 0.0021513964 (absolute difference 5.315e-05), using a multiplicity-weighted mean. Hypothesis: this preserves qualification and yields 2,008 parameters. It is more informative than the nearest untested alternative (difference 5.347e-05) because it is the minimum-distortion eligible union; exact pairs already rejected under the unchanged grouping are excluded. Acceptance and rollback remain solely governed by the official runner.	0	0
attempt-0078	nearest-position-unions-infra-repair	micro-0078	2194e6c43c74306e165564aa687cf323aa4bcc45	e95334ddc0e1d54def85b143db9d8b9b2e332f44	2026-08-16T22:24:36.706968+00:00	parameter tying	99.070000%	2007	keep	Union closest position groups 393 and 122	Family: parameter tying. Current retained frontier is 2,008 parameters at 99.070000%, a +0.070000 percentage-point margin over 99%. There have been 20 prior macro-attempts in this family and 98 prior micro-trials. The most recent accepted result is attempt-0078/micro-0077 at 2008 parameters and 99.070000%; the most recent failed result is attempt-0075/micro-0001 (error, no score). This is a parameterization-preserving compression: union current position groups represented by coordinates 393 and 122, whose learned values are -0.0087742284 and -0.0087207556 (absolute difference 5.347e-05), using a multiplicity-weighted mean. Hypothesis: this preserves qualification and yields 2,007 parameters. It is more informative than the nearest untested alternative (difference 5.358e-05) because it is the minimum-distortion eligible union; exact pairs already rejected under the unchanged grouping are excluded. Acceptance and rollback remain solely governed by the official runner.	0	0
attempt-0078	nearest-position-unions-infra-repair	micro-0079	cbbe34f64303cf324ee257de0de382fe69810bca	2194e6c43c74306e165564aa687cf323aa4bcc45	2026-08-16T22:25:38.616869+00:00	parameter tying	99.080000%	2006	keep	Union closest position groups 319 and 7	Family: parameter tying. Current retained frontier is 2,007 parameters at 99.070000%, a +0.070000 percentage-point margin over 99%. There have been 20 prior macro-attempts in this family and 99 prior micro-trials. The most recent accepted result is attempt-0078/micro-0078 at 2007 parameters and 99.070000%; the most recent failed result is attempt-0075/micro-0001 (error, no score). This is a parameterization-preserving compression: union current position groups represented by coordinates 319 and 7, whose learned values are 0.0034688686 and 0.0035224482 (absolute difference 5.358e-05), using a multiplicity-weighted mean. Hypothesis: this preserves qualification and yields 2,006 parameters. It is more informative than the nearest untested alternative (difference 5.434e-05) because it is the minimum-distortion eligible union; exact pairs already rejected under the unchanged grouping are excluded. Acceptance and rollback remain solely governed by the official runner.	0	0
attempt-0078	nearest-position-unions-infra-repair	micro-0080	07ea17b670a27ad493f7f62733ca78b2493208db	cbbe34f64303cf324ee257de0de382fe69810bca	2026-08-16T22:28:21.511419+00:00	parameter tying	99.080000%	2005	keep	Union closest position groups 145 and 142	Family: parameter tying. Current retained frontier is 2,006 parameters at 99.080000%, a +0.080000 percentage-point margin over 99%. There have been 20 prior macro-attempts in this family and 100 prior micro-trials. The most recent accepted result is attempt-0078/micro-0079 at 2006 parameters and 99.080000%; the most recent failed result is attempt-0075/micro-0001 (error, no score). This is a parameterization-preserving compression: union current position groups represented by coordinates 145 and 142, whose learned values are -0.0174467843 and -0.0173924416 (absolute difference 5.434e-05), using a multiplicity-weighted mean. Hypothesis: this preserves qualification and yields 2,005 parameters. It is more informative than the nearest untested alternative (difference 5.448e-05) because it is the minimum-distortion eligible union; exact pairs already rejected under the unchanged grouping are excluded. Acceptance and rollback remain solely governed by the official runner.	0	0
attempt-0078	nearest-position-unions-infra-repair	micro-0081	0deb9c289e9d47097782768afd2bfd1bd67458fd	07ea17b670a27ad493f7f62733ca78b2493208db	2026-08-16T22:31:20.779726+00:00	parameter tying	99.080000%	2004	keep	Union closest position groups 407 and 109	Family: parameter tying. Current retained frontier is 2,005 parameters at 99.080000%, a +0.080000 percentage-point margin over 99%. There have been 20 prior macro-attempts in this family and 101 prior micro-trials. The most recent accepted result is attempt-0078/micro-0080 at 2005 parameters and 99.080000%; the most recent failed result is attempt-0075/micro-0001 (error, no score). This is a parameterization-preserving compression: union current position groups represented by coordinates 407 and 109, whose learned values are 0.0032949767 and 0.0033494518 (absolute difference 5.448e-05), using a multiplicity-weighted mean. Hypothesis: this preserves qualification and yields 2,004 parameters. It is more informative than the nearest untested alternative (difference 5.480e-05) because it is the minimum-distortion eligible union; exact pairs already rejected under the unchanged grouping are excluded. Acceptance and rollback remain solely governed by the official runner.	0	0
attempt-0078	nearest-position-unions-infra-repair	micro-0082	bc1c608040fb4ce2c1d739a67e34ffa0d3bbe272	0deb9c289e9d47097782768afd2bfd1bd67458fd	2026-08-16T22:33:58.635827+00:00	parameter tying	99.080000%	2003	keep	Union closest position groups 110 and 112	Family: parameter tying. Current retained frontier is 2,004 parameters at 99.080000%, a +0.080000 percentage-point margin over 99%. There have been 20 prior macro-attempts in this family and 102 prior micro-trials. The most recent accepted result is attempt-0078/micro-0081 at 2004 parameters and 99.080000%; the most recent failed result is attempt-0075/micro-0001 (error, no score). This is a parameterization-preserving compression: union current position groups represented by coordinates 110 and 112, whose learned values are 0.0058748377 and 0.0059296377 (absolute difference 5.480e-05), using a multiplicity-weighted mean. Hypothesis: this preserves qualification and yields 2,003 parameters. It is more informative than the nearest untested alternative (difference 5.505e-05) because it is the minimum-distortion eligible union; exact pairs already rejected under the unchanged grouping are excluded. Acceptance and rollback remain solely governed by the official runner.	0	0
