macro_attempt_id	automation_id	micro_attempt_id	commit	parent_commit	timestamp_utc	family	accuracy	parameters	status	description	proposal	train_exit	verify_exit
attempt-0078	nearest-position-unions-infra-repair	micro-0202	14217f13644caa5260e4fe1942fb72474e1e2968	650cd61a6b558b41de67d0f0a95503350f1853f5	2026-08-17T00:40:03.456569+00:00	parameter tying	99.050000%	1883	keep	Union closest position groups 489 and 158	Family: parameter tying. Current retained frontier is 1,884 parameters at 99.050000%, a +0.050000 percentage-point margin over 99%. There have been 20 prior macro-attempts in this family and 222 prior micro-trials. The most recent accepted result is attempt-0078/micro-0201 at 1884 parameters and 99.050000%; the most recent failed result is attempt-0075/micro-0001 (error, no score). This is a parameterization-preserving compression: union current position groups represented by coordinates 489 and 158, whose learned values are -0.0328453444 and -0.0326768272 (absolute difference 1.685e-04), using a multiplicity-weighted mean. Hypothesis: this preserves qualification and yields 1,883 parameters. It is more informative than the nearest untested alternative (difference 1.696e-04) because it is the minimum-distortion eligible union; exact pairs already rejected under the unchanged grouping are excluded. Acceptance and rollback remain solely governed by the official runner.	0	0
attempt-0078	nearest-position-unions-infra-repair	micro-0203	a0c0a2592c8fa2a9968b9cc505b60c71232e3fe4	14217f13644caa5260e4fe1942fb72474e1e2968	2026-08-17T00:41:03.798777+00:00	parameter tying	99.050000%	1882	keep	Union closest position groups 225 and 241	Family: parameter tying. Current retained frontier is 1,883 parameters at 99.050000%, a +0.050000 percentage-point margin over 99%. There have been 20 prior macro-attempts in this family and 223 prior micro-trials. The most recent accepted result is attempt-0078/micro-0202 at 1883 parameters and 99.050000%; the most recent failed result is attempt-0075/micro-0001 (error, no score). This is a parameterization-preserving compression: union current position groups represented by coordinates 225 and 241, whose learned values are 0.0190442391 and 0.0192138087 (absolute difference 1.696e-04), using a multiplicity-weighted mean. Hypothesis: this preserves qualification and yields 1,882 parameters. It is more informative than the nearest untested alternative (difference 1.768e-04) because it is the minimum-distortion eligible union; exact pairs already rejected under the unchanged grouping are excluded. Acceptance and rollback remain solely governed by the official runner.	0	0
attempt-0078	nearest-position-unions-infra-repair	micro-0204	306daf1ced28b3db82b37af1ba8e3617967e1b22	a0c0a2592c8fa2a9968b9cc505b60c71232e3fe4	2026-08-17T00:42:05.748891+00:00	parameter tying	99.040000%	1881	keep	Union closest position groups 160 and 233	Family: parameter tying. Current retained frontier is 1,882 parameters at 99.050000%, a +0.050000 percentage-point margin over 99%. There have been 20 prior macro-attempts in this family and 224 prior micro-trials. The most recent accepted result is attempt-0078/micro-0203 at 1882 parameters and 99.050000%; the most recent failed result is attempt-0075/micro-0001 (error, no score). This is a parameterization-preserving compression: union current position groups represented by coordinates 160 and 233, whose learned values are 0.0012618811 and 0.0014387117 (absolute difference 1.768e-04), using a multiplicity-weighted mean. Hypothesis: this preserves qualification and yields 1,881 parameters. It is more informative than the nearest untested alternative (difference 1.787e-04) because it is the minimum-distortion eligible union; exact pairs already rejected under the unchanged grouping are excluded. Acceptance and rollback remain solely governed by the official runner.	0	0
attempt-0078	nearest-position-unions-infra-repair	micro-0205	feb1eb53c42e338dd6350a8f5c18b2a88f0e05c4	306daf1ced28b3db82b37af1ba8e3617967e1b22	2026-08-17T00:43:07.426445+00:00	parameter tying	99.040000%	1880	keep	Union closest position groups 445 and 387	Family: parameter tying. Current retained frontier is 1,881 parameters at 99.040000%, a +0.040000 percentage-point margin over 99%. There have been 20 prior macro-attempts in this family and 225 prior micro-trials. The most recent accepted result is attempt-0078/micro-0204 at 1881 parameters and 99.040000%; the most recent failed result is attempt-0075/micro-0001 (error, no score). This is a parameterization-preserving compression: union current position groups represented by coordinates 445 and 387, whose learned values are 0.0314621367 and 0.0316408128 (absolute difference 1.787e-04), using a multiplicity-weighted mean. Hypothesis: this preserves qualification and yields 1,880 parameters. It is more informative than the nearest untested alternative (difference 1.787e-04) because it is the minimum-distortion eligible union; exact pairs already rejected under the unchanged grouping are excluded. Acceptance and rollback remain solely governed by the official runner.	0	0
attempt-0078	nearest-position-unions-infra-repair	micro-0206	61a129b237ab80b9d2ae731eb53a830dc2f20451	feb1eb53c42e338dd6350a8f5c18b2a88f0e05c4	2026-08-17T00:44:09.196654+00:00	parameter tying	99.050000%	1879	keep	Union closest position groups 7 and 492	Family: parameter tying. Current retained frontier is 1,880 parameters at 99.040000%, a +0.040000 percentage-point margin over 99%. There have been 20 prior macro-attempts in this family and 226 prior micro-trials. The most recent accepted result is attempt-0078/micro-0205 at 1880 parameters and 99.040000%; the most recent failed result is attempt-0075/micro-0001 (error, no score). This is a parameterization-preserving compression: union current position groups represented by coordinates 7 and 492, whose learned values are 0.0035117320 and 0.0036904621 (absolute difference 1.787e-04), using a multiplicity-weighted mean. Hypothesis: this preserves qualification and yields 1,879 parameters. It is more informative than the nearest untested alternative (difference 1.790e-04) because it is the minimum-distortion eligible union; exact pairs already rejected under the unchanged grouping are excluded. Acceptance and rollback remain solely governed by the official runner.	0	0
attempt-0078	nearest-position-unions-infra-repair	micro-0207	a0fd34128a58d3ea5773e966518b33ea7b4dcb66	61a129b237ab80b9d2ae731eb53a830dc2f20451	2026-08-17T00:45:10.635821+00:00	parameter tying	99.050000%	1878	keep	Union closest position groups 54 and 78	Family: parameter tying. Current retained frontier is 1,879 parameters at 99.050000%, a +0.050000 percentage-point margin over 99%. There have been 20 prior macro-attempts in this family and 227 prior micro-trials. The most recent accepted result is attempt-0078/micro-0206 at 1879 parameters and 99.050000%; the most recent failed result is attempt-0075/micro-0001 (error, no score). This is a parameterization-preserving compression: union current position groups represented by coordinates 54 and 78, whose learned values are 0.0159998909 and 0.0161789376 (absolute difference 1.790e-04), using a multiplicity-weighted mean. Hypothesis: this preserves qualification and yields 1,878 parameters. It is more informative than the nearest untested alternative (difference 1.837e-04) because it is the minimum-distortion eligible union; exact pairs already rejected under the unchanged grouping are excluded. Acceptance and rollback remain solely governed by the official runner.	0	0
attempt-0078	nearest-position-unions-infra-repair	micro-0208	65ea2b216d08656a21b040b21d16627876f9ed09	a0fd34128a58d3ea5773e966518b33ea7b4dcb66	2026-08-17T00:46:11.315545+00:00	parameter tying	99.050000%	1877	keep	Union closest position groups 87 and 71	Family: parameter tying. Current retained frontier is 1,878 parameters at 99.050000%, a +0.050000 percentage-point margin over 99%. There have been 20 prior macro-attempts in this family and 228 prior micro-trials. The most recent accepted result is attempt-0078/micro-0207 at 1878 parameters and 99.050000%; the most recent failed result is attempt-0075/micro-0001 (error, no score). This is a parameterization-preserving compression: union current position groups represented by coordinates 87 and 71, whose learned values are -0.0239964202 and -0.0238127038 (absolute difference 1.837e-04), using a multiplicity-weighted mean. Hypothesis: this preserves qualification and yields 1,877 parameters. It is more informative than the nearest untested alternative (difference 1.839e-04) because it is the minimum-distortion eligible union; exact pairs already rejected under the unchanged grouping are excluded. Acceptance and rollback remain solely governed by the official runner.	0	0
attempt-0078	nearest-position-unions-infra-repair	micro-0209	b844d6e92767c52dce8b200ef9f41091bbda8b2c	65ea2b216d08656a21b040b21d16627876f9ed09	2026-08-17T00:47:12.336855+00:00	parameter tying	99.050000%	1876	keep	Union closest position groups 74 and 223	Family: parameter tying. Current retained frontier is 1,877 parameters at 99.050000%, a +0.050000 percentage-point margin over 99%. There have been 20 prior macro-attempts in this family and 229 prior micro-trials. The most recent accepted result is attempt-0078/micro-0208 at 1877 parameters and 99.050000%; the most recent failed result is attempt-0075/micro-0001 (error, no score). This is a parameterization-preserving compression: union current position groups represented by coordinates 74 and 223, whose learned values are -0.0050474554 and -0.0048635639 (absolute difference 1.839e-04), using a multiplicity-weighted mean. Hypothesis: this preserves qualification and yields 1,876 parameters. It is more informative than the nearest untested alternative (difference 1.841e-04) because it is the minimum-distortion eligible union; exact pairs already rejected under the unchanged grouping are excluded. Acceptance and rollback remain solely governed by the official runner.	0	0
attempt-0078	nearest-position-unions-infra-repair	micro-0210	d7983ce14a6987e6a5983d9d23d55e137383a416	b844d6e92767c52dce8b200ef9f41091bbda8b2c	2026-08-17T00:48:12.962967+00:00	parameter tying	99.030000%	1875	keep	Union closest position groups 61 and 9	Family: parameter tying. Current retained frontier is 1,876 parameters at 99.050000%, a +0.050000 percentage-point margin over 99%. There have been 20 prior macro-attempts in this family and 230 prior micro-trials. The most recent accepted result is attempt-0078/micro-0209 at 1876 parameters and 99.050000%; the most recent failed result is attempt-0075/micro-0001 (error, no score). This is a parameterization-preserving compression: union current position groups represented by coordinates 61 and 9, whose learned values are 0.0038779394 and 0.0040620421 (absolute difference 1.841e-04), using a multiplicity-weighted mean. Hypothesis: this preserves qualification and yields 1,875 parameters. It is more informative than the nearest untested alternative (difference 1.865e-04) because it is the minimum-distortion eligible union; exact pairs already rejected under the unchanged grouping are excluded. Acceptance and rollback remain solely governed by the official runner.	0	0
attempt-0078	nearest-position-unions-infra-repair	micro-0211	d9d2450ee457800aa22d3c7327b3e2332a2227fc	d7983ce14a6987e6a5983d9d23d55e137383a416	2026-08-17T00:49:13.708049+00:00	parameter tying	99.030000%	1874	keep	Union closest position groups 446 and 8	Family: parameter tying. Current retained frontier is 1,875 parameters at 99.030000%, a +0.030000 percentage-point margin over 99%. There have been 20 prior macro-attempts in this family and 231 prior micro-trials. The most recent accepted result is attempt-0078/micro-0210 at 1875 parameters and 99.030000%; the most recent failed result is attempt-0075/micro-0001 (error, no score). This is a parameterization-preserving compression: union current position groups represented by coordinates 446 and 8, whose learned values are -0.0150183793 and -0.0148318876 (absolute difference 1.865e-04), using a multiplicity-weighted mean. Hypothesis: this preserves qualification and yields 1,874 parameters. It is more informative than the nearest untested alternative (difference 1.887e-04) because it is the minimum-distortion eligible union; exact pairs already rejected under the unchanged grouping are excluded. Acceptance and rollback remain solely governed by the official runner.	0	0
attempt-0078	nearest-position-unions-infra-repair	micro-0212	85b6ace5910644aa23f2578d30397527c14cfaa9	d9d2450ee457800aa22d3c7327b3e2332a2227fc	2026-08-17T00:50:14.995792+00:00	parameter tying	99.030000%	1873	keep	Union closest position groups 147 and 206	Family: parameter tying. Current retained frontier is 1,874 parameters at 99.030000%, a +0.030000 percentage-point margin over 99%. There have been 20 prior macro-attempts in this family and 232 prior micro-trials. The most recent accepted result is attempt-0078/micro-0211 at 1874 parameters and 99.030000%; the most recent failed result is attempt-0075/micro-0001 (error, no score). This is a parameterization-preserving compression: union current position groups represented by coordinates 147 and 206, whose learned values are -0.0253824405 and -0.0251937676 (absolute difference 1.887e-04), using a multiplicity-weighted mean. Hypothesis: this preserves qualification and yields 1,873 parameters. It is more informative than the nearest untested alternative (difference 1.900e-04) because it is the minimum-distortion eligible union; exact pairs already rejected under the unchanged grouping are excluded. Acceptance and rollback remain solely governed by the official runner.	0	0
attempt-0078	nearest-position-unions-infra-repair	micro-0213	a64cf504bfd2418dfb607142feb4ab4aab5813f1	85b6ace5910644aa23f2578d30397527c14cfaa9	2026-08-17T00:51:17.064725+00:00	parameter tying	99.030000%	1872	keep	Union closest position groups 5 and 15	Family: parameter tying. Current retained frontier is 1,873 parameters at 99.030000%, a +0.030000 percentage-point margin over 99%. There have been 20 prior macro-attempts in this family and 233 prior micro-trials. The most recent accepted result is attempt-0078/micro-0212 at 1873 parameters and 99.030000%; the most recent failed result is attempt-0075/micro-0001 (error, no score). This is a parameterization-preserving compression: union current position groups represented by coordinates 5 and 15, whose learned values are -0.0338471234 and -0.0336571336 (absolute difference 1.900e-04), using a multiplicity-weighted mean. Hypothesis: this preserves qualification and yields 1,872 parameters. It is more informative than the nearest untested alternative (difference 1.903e-04) because it is the minimum-distortion eligible union; exact pairs already rejected under the unchanged grouping are excluded. Acceptance and rollback remain solely governed by the official runner.	0	0
attempt-0078	nearest-position-unions-infra-repair	micro-0214	c2bd58bbb33d454ec2b0c8674f1381e1b602bfc3	a64cf504bfd2418dfb607142feb4ab4aab5813f1	2026-08-17T00:52:19.199951+00:00	parameter tying	99.030000%	1871	keep	Union closest position groups 151 and 162	Family: parameter tying. Current retained frontier is 1,872 parameters at 99.030000%, a +0.030000 percentage-point margin over 99%. There have been 20 prior macro-attempts in this family and 234 prior micro-trials. The most recent accepted result is attempt-0078/micro-0213 at 1872 parameters and 99.030000%; the most recent failed result is attempt-0075/micro-0001 (error, no score). This is a parameterization-preserving compression: union current position groups represented by coordinates 151 and 162, whose learned values are -0.0078378739 and -0.0076475656 (absolute difference 1.903e-04), using a multiplicity-weighted mean. Hypothesis: this preserves qualification and yields 1,871 parameters. It is more informative than the nearest untested alternative (difference 1.915e-04) because it is the minimum-distortion eligible union; exact pairs already rejected under the unchanged grouping are excluded. Acceptance and rollback remain solely governed by the official runner.	0	0
attempt-0078	nearest-position-unions-infra-repair	micro-0215	28041fc798f6a67eaf5a37aafb581f7297f6ece8	c2bd58bbb33d454ec2b0c8674f1381e1b602bfc3	2026-08-17T00:53:21.443091+00:00	parameter tying	99.030000%	1870	keep	Union closest position groups 38 and 62	Family: parameter tying. Current retained frontier is 1,871 parameters at 99.030000%, a +0.030000 percentage-point margin over 99%. There have been 20 prior macro-attempts in this family and 235 prior micro-trials. The most recent accepted result is attempt-0078/micro-0214 at 1871 parameters and 99.030000%; the most recent failed result is attempt-0075/micro-0001 (error, no score). This is a parameterization-preserving compression: union current position groups represented by coordinates 38 and 62, whose learned values are 0.0151349241 and 0.0153263900 (absolute difference 1.915e-04), using a multiplicity-weighted mean. Hypothesis: this preserves qualification and yields 1,870 parameters. It is more informative than the nearest untested alternative (difference 1.928e-04) because it is the minimum-distortion eligible union; exact pairs already rejected under the unchanged grouping are excluded. Acceptance and rollback remain solely governed by the official runner.	0	0
attempt-0078	nearest-position-unions-infra-repair	micro-0216	4980fe188b07dc4812778aad871f443f535208da	28041fc798f6a67eaf5a37aafb581f7297f6ece8	2026-08-17T00:54:23.606571+00:00	parameter tying	99.030000%	1869	keep	Union closest position groups 466 and 57	Family: parameter tying. Current retained frontier is 1,870 parameters at 99.030000%, a +0.030000 percentage-point margin over 99%. There have been 20 prior macro-attempts in this family and 236 prior micro-trials. The most recent accepted result is attempt-0078/micro-0215 at 1870 parameters and 99.030000%; the most recent failed result is attempt-0075/micro-0001 (error, no score). This is a parameterization-preserving compression: union current position groups represented by coordinates 466 and 57, whose learned values are -0.0208274741 and -0.0206346605 (absolute difference 1.928e-04), using a multiplicity-weighted mean. Hypothesis: this preserves qualification and yields 1,869 parameters. It is more informative than the nearest untested alternative (difference 1.951e-04) because it is the minimum-distortion eligible union; exact pairs already rejected under the unchanged grouping are excluded. Acceptance and rollback remain solely governed by the official runner.	0	0
attempt-0078	nearest-position-unions-infra-repair	micro-0217	6afecc4a1ab90d2f734ddb19ca4fbbdb0821a869	4980fe188b07dc4812778aad871f443f535208da	2026-08-17T00:55:26.645442+00:00	parameter tying	99.030000%	1868	keep	Union closest position groups 234 and 413	Family: parameter tying. Current retained frontier is 1,869 parameters at 99.030000%, a +0.030000 percentage-point margin over 99%. There have been 20 prior macro-attempts in this family and 237 prior micro-trials. The most recent accepted result is attempt-0078/micro-0216 at 1869 parameters and 99.030000%; the most recent failed result is attempt-0075/micro-0001 (error, no score). This is a parameterization-preserving compression: union current position groups represented by coordinates 234 and 413, whose learned values are 0.0239803586 and 0.0241754241 (absolute difference 1.951e-04), using a multiplicity-weighted mean. Hypothesis: this preserves qualification and yields 1,868 parameters. It is more informative than the nearest untested alternative (difference 2.038e-04) because it is the minimum-distortion eligible union; exact pairs already rejected under the unchanged grouping are excluded. Acceptance and rollback remain solely governed by the official runner.	0	0
attempt-0078	nearest-position-unions-infra-repair	micro-0218	64f168e637016b05e9597ff82dae18308bc1760b	6afecc4a1ab90d2f734ddb19ca4fbbdb0821a869	2026-08-17T00:56:29.897962+00:00	parameter tying	99.010000%	1867	keep	Union closest position groups 1 and 217	Family: parameter tying. Current retained frontier is 1,868 parameters at 99.030000%, a +0.030000 percentage-point margin over 99%. There have been 20 prior macro-attempts in this family and 238 prior micro-trials. The most recent accepted result is attempt-0078/micro-0217 at 1868 parameters and 99.030000%; the most recent failed result is attempt-0075/micro-0001 (error, no score). This is a parameterization-preserving compression: union current position groups represented by coordinates 1 and 217, whose learned values are 0.0021533589 and 0.0023571891 (absolute difference 2.038e-04), using a multiplicity-weighted mean. Hypothesis: this preserves qualification and yields 1,867 parameters. It is more informative than the nearest untested alternative (difference 2.042e-04) because it is the minimum-distortion eligible union; exact pairs already rejected under the unchanged grouping are excluded. Acceptance and rollback remain solely governed by the official runner.	0	0
