macro_attempt_id	automation_id	micro_attempt_id	commit	parent_commit	timestamp_utc	family	accuracy	parameters	status	description	proposal	train_exit	verify_exit
attempt-0083	next-shared-qkv-union-band	micro-0011	ec9e81e8656af9e3612c4f77d0b331ea32de4ac2	d212ca9f06af35da2ed38e3c7bbd71915b64e16b	2026-08-17T03:24:33.956951+00:00	parameter tying	99.010000%	1753	keep	Union closest shared-QKV scalar groups 259 and 488	Family: parameter tying. Current retained frontier is 1,754 parameters at 99.010000%, a +0.010000 percentage-point margin over 99%. There have been 25 prior macro-attempts in this family and 356 prior micro-trials. The most recent accepted result is attempt-0083/micro-0010 at 1754 parameters and 99.010000%; the most recent failed result is attempt-0081/micro-0007 (discard, 98.970000%). This is a parameterization-preserving compression of the depth-shared QKV transform: union flattened coordinates 259 and 488, whose learned values are -0.0164538883 and -0.0164204687 (difference 3.342e-05), with a multiplicity-weighted mean and integer reconstruction map. Hypothesis: the much larger attention tensor contains near-duplicate scalars below the token failure scale, so this union preserves qualification and yields 1,753 parameters. It is more informative than the next QKV union (difference 3.376e-05) because it is the minimum-distortion test at this new site. Acceptance and rollback remain solely governed by the official runner.	0	0
attempt-0083	next-shared-qkv-union-band	micro-0012	e3c84e69f78d0c39c99dfa368d1e893a4c3bfe65	ec9e81e8656af9e3612c4f77d0b331ea32de4ac2	2026-08-17T03:25:43.643930+00:00	parameter tying	99.010000%	1752	keep	Union closest shared-QKV scalar groups 657 and 538	Family: parameter tying. Current retained frontier is 1,753 parameters at 99.010000%, a +0.010000 percentage-point margin over 99%. There have been 25 prior macro-attempts in this family and 357 prior micro-trials. The most recent accepted result is attempt-0083/micro-0011 at 1753 parameters and 99.010000%; the most recent failed result is attempt-0081/micro-0007 (discard, 98.970000%). This is a parameterization-preserving compression of the depth-shared QKV transform: union flattened coordinates 657 and 538, whose learned values are -0.0061638812 and -0.0061301179 (difference 3.376e-05), with a multiplicity-weighted mean and integer reconstruction map. Hypothesis: the much larger attention tensor contains near-duplicate scalars below the token failure scale, so this union preserves qualification and yields 1,752 parameters. It is more informative than the next QKV union (difference 3.465e-05) because it is the minimum-distortion test at this new site. Acceptance and rollback remain solely governed by the official runner.	0	0
attempt-0083	next-shared-qkv-union-band	micro-0013	e30d0407563e0b47d6bf9b071bf55506338c8360	e3c84e69f78d0c39c99dfa368d1e893a4c3bfe65	2026-08-17T03:27:06.010462+00:00	parameter tying	99.010000%	1751	keep	Union closest shared-QKV scalar groups 567 and 744	Family: parameter tying. Current retained frontier is 1,752 parameters at 99.010000%, a +0.010000 percentage-point margin over 99%. There have been 25 prior macro-attempts in this family and 358 prior micro-trials. The most recent accepted result is attempt-0083/micro-0012 at 1752 parameters and 99.010000%; the most recent failed result is attempt-0081/micro-0007 (discard, 98.970000%). This is a parameterization-preserving compression of the depth-shared QKV transform: union flattened coordinates 567 and 744, whose learned values are 0.0261609796 and 0.0261956286 (difference 3.465e-05), with a multiplicity-weighted mean and integer reconstruction map. Hypothesis: the much larger attention tensor contains near-duplicate scalars below the token failure scale, so this union preserves qualification and yields 1,751 parameters. It is more informative than the next QKV union (difference 3.565e-05) because it is the minimum-distortion test at this new site. Acceptance and rollback remain solely governed by the official runner.	0	0
attempt-0083	next-shared-qkv-union-band	micro-0014	8b27c4e2b41214af33126f5ff266a83d5a03691d	e30d0407563e0b47d6bf9b071bf55506338c8360	2026-08-17T03:28:13.324201+00:00	parameter tying	99.010000%	1750	keep	Union closest shared-QKV scalar groups 622 and 746	Family: parameter tying. Current retained frontier is 1,751 parameters at 99.010000%, a +0.010000 percentage-point margin over 99%. There have been 25 prior macro-attempts in this family and 359 prior micro-trials. The most recent accepted result is attempt-0083/micro-0013 at 1751 parameters and 99.010000%; the most recent failed result is attempt-0081/micro-0007 (discard, 98.970000%). This is a parameterization-preserving compression of the depth-shared QKV transform: union flattened coordinates 622 and 746, whose learned values are 0.0043183765 and 0.0043540229 (difference 3.565e-05), with a multiplicity-weighted mean and integer reconstruction map. Hypothesis: the much larger attention tensor contains near-duplicate scalars below the token failure scale, so this union preserves qualification and yields 1,750 parameters. It is more informative than the next QKV union (difference 3.681e-05) because it is the minimum-distortion test at this new site. Acceptance and rollback remain solely governed by the official runner.	0	0
attempt-0083	next-shared-qkv-union-band	micro-0015	c0e4366fca6dd9d52daafc7e099b65434cec4602	8b27c4e2b41214af33126f5ff266a83d5a03691d	2026-08-17T03:29:21.999523+00:00	parameter tying	99.000000%	1749	keep	Union closest shared-QKV scalar groups 627 and 603	Family: parameter tying. Current retained frontier is 1,750 parameters at 99.010000%, a +0.010000 percentage-point margin over 99%. There have been 25 prior macro-attempts in this family and 360 prior micro-trials. The most recent accepted result is attempt-0083/micro-0014 at 1750 parameters and 99.010000%; the most recent failed result is attempt-0081/micro-0007 (discard, 98.970000%). This is a parameterization-preserving compression of the depth-shared QKV transform: union flattened coordinates 627 and 603, whose learned values are -0.0005102578 and -0.0004732470 (difference 3.701e-05), with a multiplicity-weighted mean and integer reconstruction map. Hypothesis: the much larger attention tensor contains near-duplicate scalars below the token failure scale, so this union preserves qualification and yields 1,749 parameters. It is more informative than the next QKV union (difference 3.796e-05) because it is the minimum-distortion test at this new site. Acceptance and rollback remain solely governed by the official runner.	0	0
attempt-0083	next-shared-qkv-union-band	micro-0016	8607c92356dba74f1e41edf55582e272ab44114c	c0e4366fca6dd9d52daafc7e099b65434cec4602	2026-08-17T03:30:36.301548+00:00	parameter tying	99.000000%	1748	keep	Union closest shared-QKV scalar groups 590 and 169	Family: parameter tying. Current retained frontier is 1,749 parameters at 99.000000%, a +0.000000 percentage-point margin over 99%. There have been 25 prior macro-attempts in this family and 361 prior micro-trials. The most recent accepted result is attempt-0083/micro-0015 at 1749 parameters and 99.000000%; the most recent failed result is attempt-0081/micro-0007 (discard, 98.970000%). This is a parameterization-preserving compression of the depth-shared QKV transform: union flattened coordinates 590 and 169, whose learned values are -0.0574221350 and -0.0573841706 (difference 3.796e-05), with a multiplicity-weighted mean and integer reconstruction map. Hypothesis: the much larger attention tensor contains near-duplicate scalars below the token failure scale, so this union preserves qualification and yields 1,748 parameters. It is more informative than the next QKV union (difference 3.890e-05) because it is the minimum-distortion test at this new site. Acceptance and rollback remain solely governed by the official runner.	0	0
attempt-0083	next-shared-qkv-union-band	micro-0017	991b7a840a8241552460046834316fa0dc0b3577	8607c92356dba74f1e41edf55582e272ab44114c	2026-08-17T03:31:56.713509+00:00	parameter tying	99.000000%	1747	keep	Union closest shared-QKV scalar groups 383 and 576	Family: parameter tying. Current retained frontier is 1,748 parameters at 99.000000%, a +0.000000 percentage-point margin over 99%. There have been 25 prior macro-attempts in this family and 362 prior micro-trials. The most recent accepted result is attempt-0083/micro-0016 at 1748 parameters and 99.000000%; the most recent failed result is attempt-0081/micro-0007 (discard, 98.970000%). This is a parameterization-preserving compression of the depth-shared QKV transform: union flattened coordinates 383 and 576, whose learned values are -0.0240265559 and -0.0239876583 (difference 3.890e-05), with a multiplicity-weighted mean and integer reconstruction map. Hypothesis: the much larger attention tensor contains near-duplicate scalars below the token failure scale, so this union preserves qualification and yields 1,747 parameters. It is more informative than the next QKV union (difference 3.918e-05) because it is the minimum-distortion test at this new site. Acceptance and rollback remain solely governed by the official runner.	0	0
attempt-0083	next-shared-qkv-union-band	micro-0018	8fd285fe055330f795bf1df2e8b507c3e5c68db9	991b7a840a8241552460046834316fa0dc0b3577	2026-08-17T03:33:04.835451+00:00	parameter tying	99.000000%	1746	keep	Union closest shared-QKV scalar groups 762 and 397	Family: parameter tying. Current retained frontier is 1,747 parameters at 99.000000%, a +0.000000 percentage-point margin over 99%. There have been 25 prior macro-attempts in this family and 363 prior micro-trials. The most recent accepted result is attempt-0083/micro-0017 at 1747 parameters and 99.000000%; the most recent failed result is attempt-0081/micro-0007 (discard, 98.970000%). This is a parameterization-preserving compression of the depth-shared QKV transform: union flattened coordinates 762 and 397, whose learned values are 0.0234324429 and 0.0234716218 (difference 3.918e-05), with a multiplicity-weighted mean and integer reconstruction map. Hypothesis: the much larger attention tensor contains near-duplicate scalars below the token failure scale, so this union preserves qualification and yields 1,746 parameters. It is more informative than the next QKV union (difference 4.082e-05) because it is the minimum-distortion test at this new site. Acceptance and rollback remain solely governed by the official runner.	0	0
attempt-0083	next-shared-qkv-union-band	micro-0019	31f11e9be71342562dceb21da3787f9835607c93	8fd285fe055330f795bf1df2e8b507c3e5c68db9	2026-08-17T03:34:17.899354+00:00	parameter tying	99.010000%	1745	keep	Union closest shared-QKV scalar groups 613 and 728	Family: parameter tying. Current retained frontier is 1,746 parameters at 99.000000%, a +0.000000 percentage-point margin over 99%. There have been 25 prior macro-attempts in this family and 364 prior micro-trials. The most recent accepted result is attempt-0083/micro-0018 at 1746 parameters and 99.000000%; the most recent failed result is attempt-0081/micro-0007 (discard, 98.970000%). This is a parameterization-preserving compression of the depth-shared QKV transform: union flattened coordinates 613 and 728, whose learned values are -0.0009917330 and -0.0009509124 (difference 4.082e-05), with a multiplicity-weighted mean and integer reconstruction map. Hypothesis: the much larger attention tensor contains near-duplicate scalars below the token failure scale, so this union preserves qualification and yields 1,745 parameters. It is more informative than the next QKV union (difference 4.096e-05) because it is the minimum-distortion test at this new site. Acceptance and rollback remain solely governed by the official runner.	0	0
attempt-0083	next-shared-qkv-union-band	micro-0020	8bc754bff8bd13f93e1726431a4973a0d16cf297	31f11e9be71342562dceb21da3787f9835607c93	2026-08-17T03:35:30.365732+00:00	parameter tying	99.010000%	1744	keep	Union closest shared-QKV scalar groups 727 and 683	Family: parameter tying. Current retained frontier is 1,745 parameters at 99.010000%, a +0.010000 percentage-point margin over 99%. There have been 25 prior macro-attempts in this family and 365 prior micro-trials. The most recent accepted result is attempt-0083/micro-0019 at 1745 parameters and 99.010000%; the most recent failed result is attempt-0081/micro-0007 (discard, 98.970000%). This is a parameterization-preserving compression of the depth-shared QKV transform: union flattened coordinates 727 and 683, whose learned values are 0.0101759788 and 0.0102169365 (difference 4.096e-05), with a multiplicity-weighted mean and integer reconstruction map. Hypothesis: the much larger attention tensor contains near-duplicate scalars below the token failure scale, so this union preserves qualification and yields 1,744 parameters. It is more informative than the next QKV union (difference 4.293e-05) because it is the minimum-distortion test at this new site. Acceptance and rollback remain solely governed by the official runner.	0	0
attempt-0084	nearest-shared-ff-input-unions	micro-0001	8079e0bc345c19772b6a46a702f52bec0fe91006	8bc754bff8bd13f93e1726431a4973a0d16cf297	2026-08-17T03:38:19.731013+00:00	parameter tying	99.010000%	1743	keep	Union closest shared FF-input scalar groups 160 and 185	Family: parameter tying. Current retained frontier is 1,744 parameters at 99.010000%, a +0.010000 percentage-point margin over 99%. There have been 26 prior macro-attempts in this family and 366 prior micro-trials. The most recent accepted result is attempt-0083/micro-0020 at 1744 parameters and 99.010000%; the most recent failed result is attempt-0081/micro-0007 (discard, 98.970000%). This is a parameterization-preserving compression of the depth-shared feed-forward input map: union flattened coordinates 160 and 185, values -0.1290749907 and -0.1290711761 (difference 3.815e-06), using a weighted mean and integer reconstruction. Hypothesis: nonlinear feature construction contains near-duplicate scalars independent of QKV redundancy, preserving qualification at 1,743 parameters. It is more informative than the next FF-input union (difference 1.338e-05) because it is the minimum-distortion isolated test at this new mechanism site. Official acceptance and rollback are unchanged.	0	0
attempt-0084	nearest-shared-ff-input-unions	micro-0002	432310cbf98a53954dddfc5466a38cec62cf7e48	8079e0bc345c19772b6a46a702f52bec0fe91006	2026-08-17T03:39:27.714677+00:00	parameter tying	99.010000%	1742	keep	Union closest shared FF-input scalar groups 170 and 101	Family: parameter tying. Current retained frontier is 1,743 parameters at 99.010000%, a +0.010000 percentage-point margin over 99%. There have been 26 prior macro-attempts in this family and 367 prior micro-trials. The most recent accepted result is attempt-0084/micro-0001 at 1743 parameters and 99.010000%; the most recent failed result is attempt-0081/micro-0007 (discard, 98.970000%). This is a parameterization-preserving compression of the depth-shared feed-forward input map: union flattened coordinates 170 and 101, values 0.0102203330 and 0.0102337152 (difference 1.338e-05), using a weighted mean and integer reconstruction. Hypothesis: nonlinear feature construction contains near-duplicate scalars independent of QKV redundancy, preserving qualification at 1,742 parameters. It is more informative than the next FF-input union (difference 2.955e-05) because it is the minimum-distortion isolated test at this new mechanism site. Official acceptance and rollback are unchanged.	0	0
attempt-0084	nearest-shared-ff-input-unions	micro-0003	0619f38caaabd6294c5b9981d7237004112dfef0	432310cbf98a53954dddfc5466a38cec62cf7e48	2026-08-17T03:40:35.830072+00:00	parameter tying	99.010000%	1741	keep	Union closest shared FF-input scalar groups 43 and 197	Family: parameter tying. Current retained frontier is 1,742 parameters at 99.010000%, a +0.010000 percentage-point margin over 99%. There have been 26 prior macro-attempts in this family and 368 prior micro-trials. The most recent accepted result is attempt-0084/micro-0002 at 1742 parameters and 99.010000%; the most recent failed result is attempt-0081/micro-0007 (discard, 98.970000%). This is a parameterization-preserving compression of the depth-shared feed-forward input map: union flattened coordinates 43 and 197, values 0.1286740452 and 0.1287035942 (difference 2.955e-05), using a weighted mean and integer reconstruction. Hypothesis: nonlinear feature construction contains near-duplicate scalars independent of QKV redundancy, preserving qualification at 1,741 parameters. It is more informative than the next FF-input union (difference 3.268e-05) because it is the minimum-distortion isolated test at this new mechanism site. Official acceptance and rollback are unchanged.	0	0
attempt-0084	nearest-shared-ff-input-unions	micro-0004	fee0342c95bc9a5e648c0a0b653e41751044e311	0619f38caaabd6294c5b9981d7237004112dfef0	2026-08-17T03:41:53.745565+00:00	parameter tying	99.010000%	1740	keep	Union closest shared FF-input scalar groups 83 and 59	Family: parameter tying. Current retained frontier is 1,741 parameters at 99.010000%, a +0.010000 percentage-point margin over 99%. There have been 26 prior macro-attempts in this family and 369 prior micro-trials. The most recent accepted result is attempt-0084/micro-0003 at 1741 parameters and 99.010000%; the most recent failed result is attempt-0081/micro-0007 (discard, 98.970000%). This is a parameterization-preserving compression of the depth-shared feed-forward input map: union flattened coordinates 83 and 59, values -0.2417872697 and -0.2417545915 (difference 3.268e-05), using a weighted mean and integer reconstruction. Hypothesis: nonlinear feature construction contains near-duplicate scalars independent of QKV redundancy, preserving qualification at 1,740 parameters. It is more informative than the next FF-input union (difference 3.604e-05) because it is the minimum-distortion isolated test at this new mechanism site. Official acceptance and rollback are unchanged.	0	0
attempt-0084	nearest-shared-ff-input-unions	micro-0005	37e98b306a57b2cd33c958e55d931da273a45ff1	fee0342c95bc9a5e648c0a0b653e41751044e311	2026-08-17T03:43:07.368237+00:00	parameter tying	99.010000%	1739	keep	Union closest shared FF-input scalar groups 79 and 80	Family: parameter tying. Current retained frontier is 1,740 parameters at 99.010000%, a +0.010000 percentage-point margin over 99%. There have been 26 prior macro-attempts in this family and 370 prior micro-trials. The most recent accepted result is attempt-0084/micro-0004 at 1740 parameters and 99.010000%; the most recent failed result is attempt-0081/micro-0007 (discard, 98.970000%). This is a parameterization-preserving compression of the depth-shared feed-forward input map: union flattened coordinates 79 and 80, values -0.0480845459 and -0.0480485037 (difference 3.604e-05), using a weighted mean and integer reconstruction. Hypothesis: nonlinear feature construction contains near-duplicate scalars independent of QKV redundancy, preserving qualification at 1,739 parameters. It is more informative than the next FF-input union (difference 5.056e-05) because it is the minimum-distortion isolated test at this new mechanism site. Official acceptance and rollback are unchanged.	0	0
attempt-0084	nearest-shared-ff-input-unions	micro-0006	f9211e961347a0cb37006cd217dfdab60920450b	37e98b306a57b2cd33c958e55d931da273a45ff1	2026-08-17T03:44:16.233778+00:00	parameter tying	99.010000%	1738	keep	Union closest shared FF-input scalar groups 25 and 107	Family: parameter tying. Current retained frontier is 1,739 parameters at 99.010000%, a +0.010000 percentage-point margin over 99%. There have been 26 prior macro-attempts in this family and 371 prior micro-trials. The most recent accepted result is attempt-0084/micro-0005 at 1739 parameters and 99.010000%; the most recent failed result is attempt-0081/micro-0007 (discard, 98.970000%). This is a parameterization-preserving compression of the depth-shared feed-forward input map: union flattened coordinates 25 and 107, values 0.0713531151 and 0.0714036748 (difference 5.056e-05), using a weighted mean and integer reconstruction. Hypothesis: nonlinear feature construction contains near-duplicate scalars independent of QKV redundancy, preserving qualification at 1,738 parameters. It is more informative than the next FF-input union (difference 6.380e-05) because it is the minimum-distortion isolated test at this new mechanism site. Official acceptance and rollback are unchanged.	0	0
attempt-0084	nearest-shared-ff-input-unions	micro-0007	017e06a8377695694961876aa263fbe0e843dd99	f9211e961347a0cb37006cd217dfdab60920450b	2026-08-17T03:45:25.913256+00:00	parameter tying	99.010000%	1737	keep	Union closest shared FF-input scalar groups 76 and 163	Family: parameter tying. Current retained frontier is 1,738 parameters at 99.010000%, a +0.010000 percentage-point margin over 99%. There have been 26 prior macro-attempts in this family and 372 prior micro-trials. The most recent accepted result is attempt-0084/micro-0006 at 1738 parameters and 99.010000%; the most recent failed result is attempt-0081/micro-0007 (discard, 98.970000%). This is a parameterization-preserving compression of the depth-shared feed-forward input map: union flattened coordinates 76 and 163, values 0.0639156252 and 0.0639794245 (difference 6.380e-05), using a weighted mean and integer reconstruction. Hypothesis: nonlinear feature construction contains near-duplicate scalars independent of QKV redundancy, preserving qualification at 1,737 parameters. It is more informative than the next FF-input union (difference 7.805e-05) because it is the minimum-distortion isolated test at this new mechanism site. Official acceptance and rollback are unchanged.	0	0
