macro_attempt_id	automation_id	micro_attempt_id	commit	parent_commit	timestamp_utc	family	accuracy	parameters	status	description	proposal	train_exit	verify_exit
attempt-0078	nearest-position-unions-infra-repair	micro-0270	f1c8803f9e58c38efca3e2204d817fdade3c5ac2	8c82e418621d92f85a6f327211c81cb794bb1320	2026-08-17T01:57:55.167274+00:00	parameter tying	99.150000%	1815	keep	Union closest position groups 71 and 311	Family: parameter tying. Current retained frontier is 1,816 parameters at 99.140000%, a +0.140000 percentage-point margin over 99%. There have been 20 prior macro-attempts in this family and 290 prior micro-trials. The most recent accepted result is attempt-0078/micro-0269 at 1816 parameters and 99.140000%; the most recent failed result is attempt-0075/micro-0001 (error, no score). This is a parameterization-preserving compression: union current position groups represented by coordinates 71 and 311, whose learned values are -0.0239045620 and -0.0235739518 (absolute difference 3.306e-04), using a multiplicity-weighted mean. Hypothesis: this preserves qualification and yields 1,815 parameters. It is more informative than the nearest untested alternative (difference 3.335e-04) because it is the minimum-distortion eligible union; exact pairs already rejected under the unchanged grouping are excluded. Acceptance and rollback remain solely governed by the official runner.	0	0
attempt-0078	nearest-position-unions-infra-repair	micro-0271	1640425740952987b4b44680fd0fb59115df49bc	f1c8803f9e58c38efca3e2204d817fdade3c5ac2	2026-08-17T01:59:06.108269+00:00	parameter tying	99.150000%	1814	keep	Union closest position groups 76 and 230	Family: parameter tying. Current retained frontier is 1,815 parameters at 99.150000%, a +0.150000 percentage-point margin over 99%. There have been 20 prior macro-attempts in this family and 291 prior micro-trials. The most recent accepted result is attempt-0078/micro-0270 at 1815 parameters and 99.150000%; the most recent failed result is attempt-0075/micro-0001 (error, no score). This is a parameterization-preserving compression: union current position groups represented by coordinates 76 and 230, whose learned values are 0.0110299708 and 0.0113634951 (absolute difference 3.335e-04), using a multiplicity-weighted mean. Hypothesis: this preserves qualification and yields 1,814 parameters. It is more informative than the nearest untested alternative (difference 3.355e-04) because it is the minimum-distortion eligible union; exact pairs already rejected under the unchanged grouping are excluded. Acceptance and rollback remain solely governed by the official runner.	0	0
attempt-0078	nearest-position-unions-infra-repair	micro-0272	ad5fd8bbaeb17f5fe978be0f50ed9d9e059cc94d	1640425740952987b4b44680fd0fb59115df49bc	2026-08-17T02:00:15.358292+00:00	parameter tying	99.150000%	1813	keep	Union closest position groups 159 and 104	Family: parameter tying. Current retained frontier is 1,814 parameters at 99.150000%, a +0.150000 percentage-point margin over 99%. There have been 20 prior macro-attempts in this family and 292 prior micro-trials. The most recent accepted result is attempt-0078/micro-0271 at 1814 parameters and 99.150000%; the most recent failed result is attempt-0075/micro-0001 (error, no score). This is a parameterization-preserving compression: union current position groups represented by coordinates 159 and 104, whose learned values are -0.0041033588 and -0.0037678701 (absolute difference 3.355e-04), using a multiplicity-weighted mean. Hypothesis: this preserves qualification and yields 1,813 parameters. It is more informative than the nearest untested alternative (difference 3.392e-04) because it is the minimum-distortion eligible union; exact pairs already rejected under the unchanged grouping are excluded. Acceptance and rollback remain solely governed by the official runner.	0	0
attempt-0078	nearest-position-unions-infra-repair	micro-0273	b33d80faba19d3a9553683a299ab397f69d9861e	ad5fd8bbaeb17f5fe978be0f50ed9d9e059cc94d	2026-08-17T02:01:25.527901+00:00	parameter tying	99.120000%	1812	keep	Union closest position groups 80 and 262	Family: parameter tying. Current retained frontier is 1,813 parameters at 99.150000%, a +0.150000 percentage-point margin over 99%. There have been 20 prior macro-attempts in this family and 293 prior micro-trials. The most recent accepted result is attempt-0078/micro-0272 at 1813 parameters and 99.150000%; the most recent failed result is attempt-0075/micro-0001 (error, no score). This is a parameterization-preserving compression: union current position groups represented by coordinates 80 and 262, whose learned values are 0.0096060485 and 0.0099452557 (absolute difference 3.392e-04), using a multiplicity-weighted mean. Hypothesis: this preserves qualification and yields 1,812 parameters. It is more informative than the nearest untested alternative (difference 3.402e-04) because it is the minimum-distortion eligible union; exact pairs already rejected under the unchanged grouping are excluded. Acceptance and rollback remain solely governed by the official runner.	0	0
attempt-0078	nearest-position-unions-infra-repair	micro-0274	30c16bc99f59382a9d338b8f0545c1badfaab304	b33d80faba19d3a9553683a299ab397f69d9861e	2026-08-17T02:02:47.598368+00:00	parameter tying	99.130000%	1811	keep	Union closest position groups 121 and 317	Family: parameter tying. Current retained frontier is 1,812 parameters at 99.120000%, a +0.120000 percentage-point margin over 99%. There have been 20 prior macro-attempts in this family and 294 prior micro-trials. The most recent accepted result is attempt-0078/micro-0273 at 1812 parameters and 99.120000%; the most recent failed result is attempt-0075/micro-0001 (error, no score). This is a parameterization-preserving compression: union current position groups represented by coordinates 121 and 317, whose learned values are -0.0214235056 and -0.0210832879 (absolute difference 3.402e-04), using a multiplicity-weighted mean. Hypothesis: this preserves qualification and yields 1,811 parameters. It is more informative than the nearest untested alternative (difference 3.456e-04) because it is the minimum-distortion eligible union; exact pairs already rejected under the unchanged grouping are excluded. Acceptance and rollback remain solely governed by the official runner.	0	0
attempt-0078	nearest-position-unions-infra-repair	micro-0275	211bfcfad0cb4de7ddc64b9c6dbd42b6736ca23e	30c16bc99f59382a9d338b8f0545c1badfaab304	2026-08-17T02:03:52.290191+00:00	parameter tying	99.130000%	1810	keep	Union closest position groups 140 and 53	Family: parameter tying. Current retained frontier is 1,811 parameters at 99.130000%, a +0.130000 percentage-point margin over 99%. There have been 20 prior macro-attempts in this family and 295 prior micro-trials. The most recent accepted result is attempt-0078/micro-0274 at 1811 parameters and 99.130000%; the most recent failed result is attempt-0075/micro-0001 (error, no score). This is a parameterization-preserving compression: union current position groups represented by coordinates 140 and 53, whose learned values are -0.0658296272 and -0.0654840469 (absolute difference 3.456e-04), using a multiplicity-weighted mean. Hypothesis: this preserves qualification and yields 1,810 parameters. It is more informative than the nearest untested alternative (difference 3.509e-04) because it is the minimum-distortion eligible union; exact pairs already rejected under the unchanged grouping are excluded. Acceptance and rollback remain solely governed by the official runner.	0	0
attempt-0078	nearest-position-unions-infra-repair	micro-0276	22f79668bb50cd582d74e603cc3d4971b3a6688f	211bfcfad0cb4de7ddc64b9c6dbd42b6736ca23e	2026-08-17T02:05:12.346265+00:00	parameter tying	99.130000%	1809	keep	Union closest position groups 156 and 437	Family: parameter tying. Current retained frontier is 1,810 parameters at 99.130000%, a +0.130000 percentage-point margin over 99%. There have been 20 prior macro-attempts in this family and 296 prior micro-trials. The most recent accepted result is attempt-0078/micro-0275 at 1810 parameters and 99.130000%; the most recent failed result is attempt-0075/micro-0001 (error, no score). This is a parameterization-preserving compression: union current position groups represented by coordinates 156 and 437, whose learned values are -0.0508579202 and -0.0505069867 (absolute difference 3.509e-04), using a multiplicity-weighted mean. Hypothesis: this preserves qualification and yields 1,809 parameters. It is more informative than the nearest untested alternative (difference 3.546e-04) because it is the minimum-distortion eligible union; exact pairs already rejected under the unchanged grouping are excluded. Acceptance and rollback remain solely governed by the official runner.	0	0
attempt-0078	nearest-position-unions-infra-repair	micro-0277	f29b9e183d92218fcf45d727488170cf1c617311	22f79668bb50cd582d74e603cc3d4971b3a6688f	2026-08-17T02:06:25.314676+00:00	parameter tying	99.130000%	1808	keep	Union closest position groups 360 and 0	Family: parameter tying. Current retained frontier is 1,809 parameters at 99.130000%, a +0.130000 percentage-point margin over 99%. There have been 20 prior macro-attempts in this family and 297 prior micro-trials. The most recent accepted result is attempt-0078/micro-0276 at 1809 parameters and 99.130000%; the most recent failed result is attempt-0075/micro-0001 (error, no score). This is a parameterization-preserving compression: union current position groups represented by coordinates 360 and 0, whose learned values are -0.0226636827 and -0.0223090947 (absolute difference 3.546e-04), using a multiplicity-weighted mean. Hypothesis: this preserves qualification and yields 1,808 parameters. It is more informative than the nearest untested alternative (difference 3.573e-04) because it is the minimum-distortion eligible union; exact pairs already rejected under the unchanged grouping are excluded. Acceptance and rollback remain solely governed by the official runner.	0	0
attempt-0078	nearest-position-unions-infra-repair	micro-0278	ecc558ae9c08cd2a3395cf13969907c997d47e33	f29b9e183d92218fcf45d727488170cf1c617311	2026-08-17T02:07:33.682793+00:00	parameter tying	99.140000%	1807	keep	Union closest position groups 505 and 119	Family: parameter tying. Current retained frontier is 1,808 parameters at 99.130000%, a +0.130000 percentage-point margin over 99%. There have been 20 prior macro-attempts in this family and 298 prior micro-trials. The most recent accepted result is attempt-0078/micro-0277 at 1808 parameters and 99.130000%; the most recent failed result is attempt-0075/micro-0001 (error, no score). This is a parameterization-preserving compression: union current position groups represented by coordinates 505 and 119, whose learned values are -0.0274741389 and -0.0271167904 (absolute difference 3.573e-04), using a multiplicity-weighted mean. Hypothesis: this preserves qualification and yields 1,807 parameters. It is more informative than the nearest untested alternative (difference 3.618e-04) because it is the minimum-distortion eligible union; exact pairs already rejected under the unchanged grouping are excluded. Acceptance and rollback remain solely governed by the official runner.	0	0
attempt-0078	nearest-position-unions-infra-repair	micro-0279	1fe51bc82974da88bcb77be5d71ace29aef9b82a	ecc558ae9c08cd2a3395cf13969907c997d47e33	2026-08-17T02:08:53.869516+00:00	parameter tying	99.140000%	1806	keep	Union closest position groups 19 and 460	Family: parameter tying. Current retained frontier is 1,807 parameters at 99.140000%, a +0.140000 percentage-point margin over 99%. There have been 20 prior macro-attempts in this family and 299 prior micro-trials. The most recent accepted result is attempt-0078/micro-0278 at 1807 parameters and 99.140000%; the most recent failed result is attempt-0075/micro-0001 (error, no score). This is a parameterization-preserving compression: union current position groups represented by coordinates 19 and 460, whose learned values are 0.0483582132 and 0.0487199835 (absolute difference 3.618e-04), using a multiplicity-weighted mean. Hypothesis: this preserves qualification and yields 1,806 parameters. It is more informative than the nearest untested alternative (difference 3.671e-04) because it is the minimum-distortion eligible union; exact pairs already rejected under the unchanged grouping are excluded. Acceptance and rollback remain solely governed by the official runner.	0	0
attempt-0078	nearest-position-unions-infra-repair	micro-0280	7bddd48239946f2e73f8c8f2bc7d0141ff8162e7	1fe51bc82974da88bcb77be5d71ace29aef9b82a	2026-08-17T02:10:04.592925+00:00	parameter tying	99.150000%	1805	keep	Union closest position groups 201 and 185	Family: parameter tying. Current retained frontier is 1,806 parameters at 99.140000%, a +0.140000 percentage-point margin over 99%. There have been 20 prior macro-attempts in this family and 300 prior micro-trials. The most recent accepted result is attempt-0078/micro-0279 at 1806 parameters and 99.140000%; the most recent failed result is attempt-0075/micro-0001 (error, no score). This is a parameterization-preserving compression: union current position groups represented by coordinates 201 and 185, whose learned values are -0.0073903534 and -0.0070232251 (absolute difference 3.671e-04), using a multiplicity-weighted mean. Hypothesis: this preserves qualification and yields 1,805 parameters. It is more informative than the nearest untested alternative (difference 3.672e-04) because it is the minimum-distortion eligible union; exact pairs already rejected under the unchanged grouping are excluded. Acceptance and rollback remain solely governed by the official runner.	0	0
attempt-0078	nearest-position-unions-infra-repair	micro-0281	76519606f08d3bc2516cc456ae46c44c5c525c9f	7bddd48239946f2e73f8c8f2bc7d0141ff8162e7	2026-08-17T02:11:12.780350+00:00	parameter tying	99.110000%	1804	keep	Union closest position groups 281 and 123	Family: parameter tying. Current retained frontier is 1,805 parameters at 99.150000%, a +0.150000 percentage-point margin over 99%. There have been 20 prior macro-attempts in this family and 301 prior micro-trials. The most recent accepted result is attempt-0078/micro-0280 at 1805 parameters and 99.150000%; the most recent failed result is attempt-0075/micro-0001 (error, no score). This is a parameterization-preserving compression: union current position groups represented by coordinates 281 and 123, whose learned values are 0.0135628441 and 0.0139300236 (absolute difference 3.672e-04), using a multiplicity-weighted mean. Hypothesis: this preserves qualification and yields 1,804 parameters. It is more informative than the nearest untested alternative (difference 3.697e-04) because it is the minimum-distortion eligible union; exact pairs already rejected under the unchanged grouping are excluded. Acceptance and rollback remain solely governed by the official runner.	0	0
attempt-0078	nearest-position-unions-infra-repair	micro-0282	36ba1066808a4283aba587478aeb1fd95cbb3e35	76519606f08d3bc2516cc456ae46c44c5c525c9f	2026-08-17T02:12:19.606162+00:00	parameter tying	99.110000%	1803	keep	Union closest position groups 265 and 93	Family: parameter tying. Current retained frontier is 1,804 parameters at 99.110000%, a +0.110000 percentage-point margin over 99%. There have been 20 prior macro-attempts in this family and 302 prior micro-trials. The most recent accepted result is attempt-0078/micro-0281 at 1804 parameters and 99.110000%; the most recent failed result is attempt-0075/micro-0001 (error, no score). This is a parameterization-preserving compression: union current position groups represented by coordinates 265 and 93, whose learned values are 0.0064621111 and 0.0068318392 (absolute difference 3.697e-04), using a multiplicity-weighted mean. Hypothesis: this preserves qualification and yields 1,803 parameters. It is more informative than the nearest untested alternative (difference 3.732e-04) because it is the minimum-distortion eligible union; exact pairs already rejected under the unchanged grouping are excluded. Acceptance and rollback remain solely governed by the official runner.	0	0
attempt-0078	nearest-position-unions-infra-repair	micro-0283	b98056618b7616cc3cd33fcb3552963cfadae2e1	36ba1066808a4283aba587478aeb1fd95cbb3e35	2026-08-17T02:13:26.194198+00:00	parameter tying	99.090000%	1802	keep	Union closest position groups 309 and 172	Family: parameter tying. Current retained frontier is 1,803 parameters at 99.110000%, a +0.110000 percentage-point margin over 99%. There have been 20 prior macro-attempts in this family and 303 prior micro-trials. The most recent accepted result is attempt-0078/micro-0282 at 1803 parameters and 99.110000%; the most recent failed result is attempt-0075/micro-0001 (error, no score). This is a parameterization-preserving compression: union current position groups represented by coordinates 309 and 172, whose learned values are -0.0548025481 and -0.0544293150 (absolute difference 3.732e-04), using a multiplicity-weighted mean. Hypothesis: this preserves qualification and yields 1,802 parameters. It is more informative than the nearest untested alternative (difference 3.764e-04) because it is the minimum-distortion eligible union; exact pairs already rejected under the unchanged grouping are excluded. Acceptance and rollback remain solely governed by the official runner.	0	0
attempt-0078	nearest-position-unions-infra-repair	micro-0284	b6e26438e137b6c89c5a5fc4a767c1955d3958ff	b98056618b7616cc3cd33fcb3552963cfadae2e1	2026-08-17T02:14:43.591429+00:00	parameter tying	99.090000%	1801	keep	Union closest position groups 147 and 24	Family: parameter tying. Current retained frontier is 1,802 parameters at 99.090000%, a +0.090000 percentage-point margin over 99%. There have been 20 prior macro-attempts in this family and 304 prior micro-trials. The most recent accepted result is attempt-0078/micro-0283 at 1802 parameters and 99.090000%; the most recent failed result is attempt-0075/micro-0001 (error, no score). This is a parameterization-preserving compression: union current position groups represented by coordinates 147 and 24, whose learned values are -0.0252881050 and -0.0249117035 (absolute difference 3.764e-04), using a multiplicity-weighted mean. Hypothesis: this preserves qualification and yields 1,801 parameters. It is more informative than the nearest untested alternative (difference 3.787e-04) because it is the minimum-distortion eligible union; exact pairs already rejected under the unchanged grouping are excluded. Acceptance and rollback remain solely governed by the official runner.	0	0
attempt-0078	nearest-position-unions-infra-repair	micro-0285	1abd88ebd2c5e3e4d02b70d151789c0261a51606	b6e26438e137b6c89c5a5fc4a767c1955d3958ff	2026-08-17T02:16:13.683386+00:00	parameter tying	99.050000%	1800	keep	Union closest position groups 9 and 64	Family: parameter tying. Current retained frontier is 1,801 parameters at 99.090000%, a +0.090000 percentage-point margin over 99%. There have been 20 prior macro-attempts in this family and 305 prior micro-trials. The most recent accepted result is attempt-0078/micro-0284 at 1801 parameters and 99.090000%; the most recent failed result is attempt-0075/micro-0001 (error, no score). This is a parameterization-preserving compression: union current position groups represented by coordinates 9 and 64, whose learned values are 0.0039699902 and 0.0043486552 (absolute difference 3.787e-04), using a multiplicity-weighted mean. Hypothesis: this preserves qualification and yields 1,800 parameters. It is more informative than the nearest untested alternative (difference 3.825e-04) because it is the minimum-distortion eligible union; exact pairs already rejected under the unchanged grouping are excluded. Acceptance and rollback remain solely governed by the official runner.	0	0
attempt-0078	nearest-position-unions-infra-repair	micro-0286	993baed7fbb2a8666b0a7cee7afd57f653418ef2	1abd88ebd2c5e3e4d02b70d151789c0261a51606	2026-08-17T02:17:20.576375+00:00	parameter tying	99.030000%	1799	keep	Union closest position groups 51 and 21	Family: parameter tying. Current retained frontier is 1,800 parameters at 99.050000%, a +0.050000 percentage-point margin over 99%. There have been 20 prior macro-attempts in this family and 306 prior micro-trials. The most recent accepted result is attempt-0078/micro-0285 at 1800 parameters and 99.050000%; the most recent failed result is attempt-0075/micro-0001 (error, no score). This is a parameterization-preserving compression: union current position groups represented by coordinates 51 and 21, whose learned values are -0.0114837876 and -0.0111012468 (absolute difference 3.825e-04), using a multiplicity-weighted mean. Hypothesis: this preserves qualification and yields 1,799 parameters. It is more informative than the nearest untested alternative (difference 3.969e-04) because it is the minimum-distortion eligible union; exact pairs already rejected under the unchanged grouping are excluded. Acceptance and rollback remain solely governed by the official runner.	0	0
