macro_attempt_id	automation_id	micro_attempt_id	commit	parent_commit	timestamp_utc	family	accuracy	parameters	status	description	proposal	train_exit	verify_exit
attempt-0141	qkv-unions-under-blended-gelu	micro-0001	3b401de2f056990aa632f1789a5317d6a25e5248	06d88307073db782499be4f6c2ff2d17294940e2	2026-08-17T07:22:50.051430+00:00	parameter tying	98.990000%	1670	discard	Union closest shared-QKV scalar groups 555 and 517	Family: parameter tying. Current retained frontier is 1,671 parameters at 99.000000%, a +0.000000 percentage-point margin over 99%. There have been 46 prior macro-attempts in this family and 450 prior micro-trials. The most recent accepted result is attempt-0139/micro-0001 at 1,671 parameters and 99.00%; the most recent failed result is attempt-0091/micro-0002 (pair 555/517 discarded at 98.99% under exact GELU). This is a parameterization-preserving compression of the depth-shared QKV transform: union flattened coordinates 555 and 517, whose learned values are 0.0067168260 and 0.0067673163 (difference 5.049e-05), with a multiplicity-weighted mean and integer reconstruction map. Hypothesis: the much larger attention tensor contains near-duplicate scalars below the token failure scale, so this union preserves qualification and yields 1,670 parameters. It is more informative than the next QKV union (difference 5.227e-05) because it is the minimum-distortion test at this new site. Acceptance and rollback remain solely governed by the official runner.	0	0
attempt-0142	qkv-union-gelu-compensation	micro-0001	4149f54bd806c8c7ecc08482762771630b71abe4	06d88307073db782499be4f6c2ff2d17294940e2	2026-08-17T07:25:13.169576+00:00	feed-forward width	98.990000%	1670	discard	Use GELU blend alpha 0.25 with QKV union 555/517	Family: feed-forward width. Current retained frontier is 1,671 parameters at 99.000000%, exactly threshold. There have been 21 prior macro-attempts and 0 prior micro-trials in this compensation policy. The most recent accepted result is attempt-0139/micro-0001 at 1,671/99.00%; the most recent failed result is attempt-0141/micro-0001, QKV pair 555/517 at 1,670/98.99% with alpha=0.5. Use the identical QKV union with blended-GELU alpha=0.25. This is more informative than the next scheduled alpha because it is the next widest untested point around the alpha=0 and alpha=0.5 failures. Official acceptance/rollback is unchanged; acceptance exhausts equal-count eligibility.	0	0
attempt-0142	qkv-union-gelu-compensation	micro-0002	eee16f0dfe3deed2152cf049be92e9a5cc88df19	06d88307073db782499be4f6c2ff2d17294940e2	2026-08-17T07:26:31.110647+00:00	feed-forward width	98.990000%	1670	discard	Use GELU blend alpha 0.75 with QKV union 555/517	Family: feed-forward width. Current retained frontier is 1,671 parameters at 99.000000%, exactly threshold. There have been 21 prior macro-attempts and 1 prior micro-trials in this compensation policy. The most recent accepted result is attempt-0139/micro-0001 at 1,671/99.00%; the most recent failed result is attempt-0141/micro-0001, QKV pair 555/517 at 1,670/98.99% with alpha=0.5. Use the identical QKV union with blended-GELU alpha=0.75. This is more informative than the next scheduled alpha because it is the next widest untested point around the alpha=0 and alpha=0.5 failures. Official acceptance/rollback is unchanged; acceptance exhausts equal-count eligibility.	0	0
attempt-0142	qkv-union-gelu-compensation	micro-0003	5e4084d32fd5f47b607a0237001be2c83d1cc3bc	06d88307073db782499be4f6c2ff2d17294940e2	2026-08-17T07:27:55.370380+00:00	feed-forward width	98.990000%	1670	discard	Use GELU blend alpha 0.125 with QKV union 555/517	Family: feed-forward width. Current retained frontier is 1,671 parameters at 99.000000%, exactly threshold. There have been 21 prior macro-attempts and 2 prior micro-trials in this compensation policy. The most recent accepted result is attempt-0139/micro-0001 at 1,671/99.00%; the most recent failed result is attempt-0141/micro-0001, QKV pair 555/517 at 1,670/98.99% with alpha=0.5. Use the identical QKV union with blended-GELU alpha=0.125. This is more informative than the next scheduled alpha because it is the next widest untested point around the alpha=0 and alpha=0.5 failures. Official acceptance/rollback is unchanged; acceptance exhausts equal-count eligibility.	0	0
attempt-0142	qkv-union-gelu-compensation	micro-0004	0e484b014f9f64f17c3e8e6c83e3ea38f75daa85	06d88307073db782499be4f6c2ff2d17294940e2	2026-08-17T07:29:06.830718+00:00	feed-forward width	98.990000%	1670	discard	Use GELU blend alpha 0.875 with QKV union 555/517	Family: feed-forward width. Current retained frontier is 1,671 parameters at 99.000000%, exactly threshold. There have been 21 prior macro-attempts and 3 prior micro-trials in this compensation policy. The most recent accepted result is attempt-0139/micro-0001 at 1,671/99.00%; the most recent failed result is attempt-0141/micro-0001, QKV pair 555/517 at 1,670/98.99% with alpha=0.5. Use the identical QKV union with blended-GELU alpha=0.875. This is more informative than the next scheduled alpha because it is the next widest untested point around the alpha=0 and alpha=0.5 failures. Official acceptance/rollback is unchanged; acceptance exhausts equal-count eligibility.	0	0
attempt-0143	qkv-union-temperature-compensation	micro-0001	2d5686777ba3be3cd47f9041b2d561231983359d	06d88307073db782499be4f6c2ff2d17294940e2	2026-08-17T07:31:37.450981+00:00	attention organization	98.890000%	1670	discard	Scale attention logits by 0.99 with QKV union 555/517	Family: attention organization. Current retained frontier is 1,671 parameters at 99.000000%, exactly threshold. There have been 17 prior macro-attempts and 0 prior micro-trials in this policy. The most recent accepted result is attempt-0020 at 3,168/99.94%; the most recent failed result is attempt-0142, where four GELU blends with QKV union 555/517 all scored 98.99% at 1,670. Use the identical union and multiply QK logits by 0.99 relative to retained temperature. This is more informative than the next scheduled multiplier because the ordering alternates the smallest untested deviations around one. Official acceptance/rollback remains unchanged; acceptance exhausts equal-count eligibility.	0	0
attempt-0143	qkv-union-temperature-compensation	micro-0002	5eb6f5782a6c1c8479afa160ec16cf74dda506a3	06d88307073db782499be4f6c2ff2d17294940e2	2026-08-17T07:32:50.016812+00:00	attention organization	99.040000%	1670	keep	Scale attention logits by 1.01 with QKV union 555/517	Family: attention organization. Current retained frontier is 1,671 parameters at 99.000000%, exactly threshold. There have been 17 prior macro-attempts and 1 prior micro-trials in this policy. The most recent accepted result is attempt-0020 at 3,168/99.94%; the most recent failed result is attempt-0142, where four GELU blends with QKV union 555/517 all scored 98.99% at 1,670. Use the identical union and multiply QK logits by 1.01 relative to retained temperature. This is more informative than the next scheduled multiplier because the ordering alternates the smallest untested deviations around one. Official acceptance/rollback remains unchanged; acceptance exhausts equal-count eligibility.	0	0
attempt-0144	next-qkv-unions-at-temperature-101	micro-0001	8602ebbd33ea368521fc746a4378c019fcd0f70c	5eb6f5782a6c1c8479afa160ec16cf74dda506a3	2026-08-17T07:34:53.073013+00:00	parameter tying	99.040000%	1669	keep	Union closest shared-QKV scalar groups 315 and 106	Family: parameter tying. Current retained frontier is 1,670 parameters at 99.040000%, a +0.040000 percentage-point margin over 99%. There have been 47 prior macro-attempts in this family and 451 prior micro-trials. The most recent accepted result is attempt-0143/micro-0002 at 1,670 parameters and 99.04%; the most recent failed result is attempt-0143/micro-0001 (temperature 0.99 discarded at 98.89%). This is a parameterization-preserving compression of the depth-shared QKV transform: union flattened coordinates 315 and 106, whose learned values are 0.3326149583 and 0.3326672316 (difference 5.227e-05), with a multiplicity-weighted mean and integer reconstruction map. Hypothesis: the much larger attention tensor contains near-duplicate scalars below the token failure scale, so this union preserves qualification and yields 1,669 parameters. It is more informative than the next QKV union (difference 5.247e-05) because it is the minimum-distortion test at this new site. Acceptance and rollback remain solely governed by the official runner.	0	0
attempt-0144	next-qkv-unions-at-temperature-101	micro-0002	f65974860a47f288c75b77e1eb2e79c77ab4db07	8602ebbd33ea368521fc746a4378c019fcd0f70c	2026-08-17T07:36:07.561931+00:00	parameter tying	99.050000%	1668	keep	Union closest shared-QKV scalar groups 135 and 643	Family: parameter tying. Current retained frontier is 1,669 parameters at 99.040000%, a +0.040000 percentage-point margin over 99%. There have been 47 prior macro-attempts in this family and 452 prior micro-trials. The most recent accepted result is attempt-0143/micro-0002 at 1,670 parameters and 99.04%; the most recent failed result is attempt-0143/micro-0001 (temperature 0.99 discarded at 98.89%). This is a parameterization-preserving compression of the depth-shared QKV transform: union flattened coordinates 135 and 643, whose learned values are 0.0169199090 and 0.0169723779 (difference 5.247e-05), with a multiplicity-weighted mean and integer reconstruction map. Hypothesis: the much larger attention tensor contains near-duplicate scalars below the token failure scale, so this union preserves qualification and yields 1,668 parameters. It is more informative than the next QKV union (difference 5.420e-05) because it is the minimum-distortion test at this new site. Acceptance and rollback remain solely governed by the official runner.	0	0
attempt-0144	next-qkv-unions-at-temperature-101	micro-0003	a9ffd4936d5815198812631e0c4224db596d3b95	f65974860a47f288c75b77e1eb2e79c77ab4db07	2026-08-17T07:37:29.932700+00:00	parameter tying	99.050000%	1667	keep	Union closest shared-QKV scalar groups 638 and 696	Family: parameter tying. Current retained frontier is 1,668 parameters at 99.050000%, a +0.050000 percentage-point margin over 99%. There have been 47 prior macro-attempts in this family and 453 prior micro-trials. The most recent accepted result is attempt-0143/micro-0002 at 1,670 parameters and 99.04%; the most recent failed result is attempt-0143/micro-0001 (temperature 0.99 discarded at 98.89%). This is a parameterization-preserving compression of the depth-shared QKV transform: union flattened coordinates 638 and 696, whose learned values are 0.0135017596 and 0.0135559570 (difference 5.420e-05), with a multiplicity-weighted mean and integer reconstruction map. Hypothesis: the much larger attention tensor contains near-duplicate scalars below the token failure scale, so this union preserves qualification and yields 1,667 parameters. It is more informative than the next QKV union (difference 5.464e-05) because it is the minimum-distortion test at this new site. Acceptance and rollback remain solely governed by the official runner.	0	0
attempt-0144	next-qkv-unions-at-temperature-101	micro-0004	a496605f5e3f635a5c9e45fa00462d60fa6d8bb7	a9ffd4936d5815198812631e0c4224db596d3b95	2026-08-17T07:38:55.839509+00:00	parameter tying	99.040000%	1666	keep	Union closest shared-QKV scalar groups 710 and 622	Family: parameter tying. Current retained frontier is 1,667 parameters at 99.050000%, a +0.050000 percentage-point margin over 99%. There have been 47 prior macro-attempts in this family and 454 prior micro-trials. The most recent accepted result is attempt-0143/micro-0002 at 1,670 parameters and 99.04%; the most recent failed result is attempt-0143/micro-0001 (temperature 0.99 discarded at 98.89%). This is a parameterization-preserving compression of the depth-shared QKV transform: union flattened coordinates 710 and 622, whose learned values are 0.0042815623 and 0.0043361997 (difference 5.464e-05), with a multiplicity-weighted mean and integer reconstruction map. Hypothesis: the much larger attention tensor contains near-duplicate scalars below the token failure scale, so this union preserves qualification and yields 1,666 parameters. It is more informative than the next QKV union (difference 5.659e-05) because it is the minimum-distortion test at this new site. Acceptance and rollback remain solely governed by the official runner.	0	0
attempt-0144	next-qkv-unions-at-temperature-101	micro-0005	371053e68c56efff4dc6f543f222136f16289374	a496605f5e3f635a5c9e45fa00462d60fa6d8bb7	2026-08-17T07:40:08.901713+00:00	parameter tying	99.020000%	1665	keep	Union closest shared-QKV scalar groups 547 and 691	Family: parameter tying. Current retained frontier is 1,666 parameters at 99.040000%, a +0.040000 percentage-point margin over 99%. There have been 47 prior macro-attempts in this family and 455 prior micro-trials. The most recent accepted result is attempt-0143/micro-0002 at 1,670 parameters and 99.04%; the most recent failed result is attempt-0143/micro-0001 (temperature 0.99 discarded at 98.89%). This is a parameterization-preserving compression of the depth-shared QKV transform: union flattened coordinates 547 and 691, whose learned values are 0.0448196195 and 0.0448762104 (difference 5.659e-05), with a multiplicity-weighted mean and integer reconstruction map. Hypothesis: the much larger attention tensor contains near-duplicate scalars below the token failure scale, so this union preserves qualification and yields 1,665 parameters. It is more informative than the next QKV union (difference 5.665e-05) because it is the minimum-distortion test at this new site. Acceptance and rollback remain solely governed by the official runner.	0	0
attempt-0144	next-qkv-unions-at-temperature-101	micro-0006	17d2f541dd752e7b571271b8df5cada948a74fc7	371053e68c56efff4dc6f543f222136f16289374	2026-08-17T07:41:19.131642+00:00	parameter tying	99.030000%	1664	keep	Union closest shared-QKV scalar groups 679 and 494	Family: parameter tying. Current retained frontier is 1,665 parameters at 99.020000%, a +0.020000 percentage-point margin over 99%. There have been 47 prior macro-attempts in this family and 456 prior micro-trials. The most recent accepted result is attempt-0143/micro-0002 at 1,670 parameters and 99.04%; the most recent failed result is attempt-0143/micro-0001 (temperature 0.99 discarded at 98.89%). This is a parameterization-preserving compression of the depth-shared QKV transform: union flattened coordinates 679 and 494, whose learned values are 0.0050093280 and 0.0050659757 (difference 5.665e-05), with a multiplicity-weighted mean and integer reconstruction map. Hypothesis: the much larger attention tensor contains near-duplicate scalars below the token failure scale, so this union preserves qualification and yields 1,664 parameters. It is more informative than the next QKV union (difference 5.721e-05) because it is the minimum-distortion test at this new site. Acceptance and rollback remain solely governed by the official runner.	0	0
attempt-0144	next-qkv-unions-at-temperature-101	micro-0007	882b1e74d8db39ae8cfa4bfab900c72203c0b8e3	17d2f541dd752e7b571271b8df5cada948a74fc7	2026-08-17T07:42:29.936003+00:00	parameter tying	99.050000%	1663	keep	Union closest shared-QKV scalar groups 765 and 639	Family: parameter tying. Current retained frontier is 1,664 parameters at 99.030000%, a +0.030000 percentage-point margin over 99%. There have been 47 prior macro-attempts in this family and 457 prior micro-trials. The most recent accepted result is attempt-0143/micro-0002 at 1,670 parameters and 99.04%; the most recent failed result is attempt-0143/micro-0001 (temperature 0.99 discarded at 98.89%). This is a parameterization-preserving compression of the depth-shared QKV transform: union flattened coordinates 765 and 639, whose learned values are -0.0999161750 and -0.0998589694 (difference 5.721e-05), with a multiplicity-weighted mean and integer reconstruction map. Hypothesis: the much larger attention tensor contains near-duplicate scalars below the token failure scale, so this union preserves qualification and yields 1,663 parameters. It is more informative than the next QKV union (difference 5.757e-05) because it is the minimum-distortion test at this new site. Acceptance and rollback remain solely governed by the official runner.	0	0
attempt-0144	next-qkv-unions-at-temperature-101	micro-0008	9a230948d30be754343a2f65e0bb8de211b7ee57	882b1e74d8db39ae8cfa4bfab900c72203c0b8e3	2026-08-17T07:43:40.293286+00:00	parameter tying	99.020000%	1662	keep	Union closest shared-QKV scalar groups 393 and 755	Family: parameter tying. Current retained frontier is 1,663 parameters at 99.050000%, a +0.050000 percentage-point margin over 99%. There have been 47 prior macro-attempts in this family and 458 prior micro-trials. The most recent accepted result is attempt-0143/micro-0002 at 1,670 parameters and 99.04%; the most recent failed result is attempt-0143/micro-0001 (temperature 0.99 discarded at 98.89%). This is a parameterization-preserving compression of the depth-shared QKV transform: union flattened coordinates 393 and 755, whose learned values are 0.0126741407 and 0.0127317067 (difference 5.757e-05), with a multiplicity-weighted mean and integer reconstruction map. Hypothesis: the much larger attention tensor contains near-duplicate scalars below the token failure scale, so this union preserves qualification and yields 1,662 parameters. It is more informative than the next QKV union (difference 5.865e-05) because it is the minimum-distortion test at this new site. Acceptance and rollback remain solely governed by the official runner.	0	0
attempt-0144	next-qkv-unions-at-temperature-101	micro-0009	5c8624b81fcad3cacc2a6116cbd18c574ad63429	9a230948d30be754343a2f65e0bb8de211b7ee57	2026-08-17T07:44:51.200465+00:00	parameter tying	99.020000%	1661	keep	Union closest shared-QKV scalar groups 535 and 321	Family: parameter tying. Current retained frontier is 1,662 parameters at 99.020000%, a +0.020000 percentage-point margin over 99%. There have been 47 prior macro-attempts in this family and 459 prior micro-trials. The most recent accepted result is attempt-0143/micro-0002 at 1,670 parameters and 99.04%; the most recent failed result is attempt-0143/micro-0001 (temperature 0.99 discarded at 98.89%). This is a parameterization-preserving compression of the depth-shared QKV transform: union flattened coordinates 535 and 321, whose learned values are 0.0606920719 and 0.0607507192 (difference 5.865e-05), with a multiplicity-weighted mean and integer reconstruction map. Hypothesis: the much larger attention tensor contains near-duplicate scalars below the token failure scale, so this union preserves qualification and yields 1,661 parameters. It is more informative than the next QKV union (difference 5.936e-05) because it is the minimum-distortion test at this new site. Acceptance and rollback remain solely governed by the official runner.	0	0
attempt-0144	next-qkv-unions-at-temperature-101	micro-0010	7dc317688349691421eac6d0f8c4d3094a3df74a	5c8624b81fcad3cacc2a6116cbd18c574ad63429	2026-08-17T07:46:03.155773+00:00	parameter tying	99.020000%	1660	keep	Union closest shared-QKV scalar groups 359 and 65	Family: parameter tying. Current retained frontier is 1,661 parameters at 99.020000%, a +0.020000 percentage-point margin over 99%. There have been 47 prior macro-attempts in this family and 460 prior micro-trials. The most recent accepted result is attempt-0143/micro-0002 at 1,670 parameters and 99.04%; the most recent failed result is attempt-0143/micro-0001 (temperature 0.99 discarded at 98.89%). This is a parameterization-preserving compression of the depth-shared QKV transform: union flattened coordinates 359 and 65, whose learned values are 0.0622520894 and 0.0623114444 (difference 5.936e-05), with a multiplicity-weighted mean and integer reconstruction map. Hypothesis: the much larger attention tensor contains near-duplicate scalars below the token failure scale, so this union preserves qualification and yields 1,660 parameters. It is more informative than the next QKV union (difference 5.959e-05) because it is the minimum-distortion test at this new site. Acceptance and rollback remain solely governed by the official runner.	0	0
attempt-0144	next-qkv-unions-at-temperature-101	micro-0011	371e4b2f37a7aa63b2068de3ea0ce4bdabc7904d	7dc317688349691421eac6d0f8c4d3094a3df74a	2026-08-17T07:47:22.602642+00:00	parameter tying	99.020000%	1659	keep	Union closest shared-QKV scalar groups 209 and 330	Family: parameter tying. Current retained frontier is 1,660 parameters at 99.020000%, a +0.020000 percentage-point margin over 99%. There have been 47 prior macro-attempts in this family and 461 prior micro-trials. The most recent accepted result is attempt-0143/micro-0002 at 1,670 parameters and 99.04%; the most recent failed result is attempt-0143/micro-0001 (temperature 0.99 discarded at 98.89%). This is a parameterization-preserving compression of the depth-shared QKV transform: union flattened coordinates 209 and 330, whose learned values are -0.1747345626 and -0.1746749729 (difference 5.959e-05), with a multiplicity-weighted mean and integer reconstruction map. Hypothesis: the much larger attention tensor contains near-duplicate scalars below the token failure scale, so this union preserves qualification and yields 1,659 parameters. It is more informative than the next QKV union (difference 6.145e-05) because it is the minimum-distortion test at this new site. Acceptance and rollback remain solely governed by the official runner.	0	0
