macro_attempt_id	automation_id	micro_attempt_id	commit	parent_commit	timestamp_utc	family	accuracy	parameters	status	description	proposal	train_exit	verify_exit
attempt-0078	nearest-position-unions-infra-repair	micro-0287	09f23c26a798ab78881a3206314ac0b1dcb682c4	993baed7fbb2a8666b0a7cee7afd57f653418ef2	2026-08-17T02:18:26.877881+00:00	parameter tying	99.030000%	1798	keep	Union closest position groups 50 and 25	Family: parameter tying. Current retained frontier is 1,799 parameters at 99.030000%, a +0.030000 percentage-point margin over 99%. There have been 20 prior macro-attempts in this family and 307 prior micro-trials. The most recent accepted result is attempt-0078/micro-0286 at 1799 parameters and 99.030000%; the most recent failed result is attempt-0075/micro-0001 (error, no score). This is a parameterization-preserving compression: union current position groups represented by coordinates 50 and 25, whose learned values are -0.0137723722 and -0.0133754695 (absolute difference 3.969e-04), using a multiplicity-weighted mean. Hypothesis: this preserves qualification and yields 1,798 parameters. It is more informative than the nearest untested alternative (difference 3.978e-04) because it is the minimum-distortion eligible union; exact pairs already rejected under the unchanged grouping are excluded. Acceptance and rollback remain solely governed by the official runner.	0	0
attempt-0078	nearest-position-unions-infra-repair	micro-0288	6320a1ea3f6cacb917179a520c2b53fd0342b848	09f23c26a798ab78881a3206314ac0b1dcb682c4	2026-08-17T02:19:33.374694+00:00	parameter tying	99.030000%	1797	keep	Union closest position groups 242 and 189	Family: parameter tying. Current retained frontier is 1,798 parameters at 99.030000%, a +0.030000 percentage-point margin over 99%. There have been 20 prior macro-attempts in this family and 308 prior micro-trials. The most recent accepted result is attempt-0078/micro-0287 at 1798 parameters and 99.030000%; the most recent failed result is attempt-0075/micro-0001 (error, no score). This is a parameterization-preserving compression: union current position groups represented by coordinates 242 and 189, whose learned values are -0.0066425842 and -0.0062447749 (absolute difference 3.978e-04), using a multiplicity-weighted mean. Hypothesis: this preserves qualification and yields 1,797 parameters. It is more informative than the nearest untested alternative (difference 4.010e-04) because it is the minimum-distortion eligible union; exact pairs already rejected under the unchanged grouping are excluded. Acceptance and rollback remain solely governed by the official runner.	0	0
attempt-0078	nearest-position-unions-infra-repair	micro-0289	e70a345b5def29af5c2e3b5480a8099adaa29edb	6320a1ea3f6cacb917179a520c2b53fd0342b848	2026-08-17T02:20:38.777771+00:00	parameter tying	99.030000%	1796	keep	Union closest position groups 168 and 4	Family: parameter tying. Current retained frontier is 1,797 parameters at 99.030000%, a +0.030000 percentage-point margin over 99%. There have been 20 prior macro-attempts in this family and 309 prior micro-trials. The most recent accepted result is attempt-0078/micro-0288 at 1797 parameters and 99.030000%; the most recent failed result is attempt-0075/micro-0001 (error, no score). This is a parameterization-preserving compression: union current position groups represented by coordinates 168 and 4, whose learned values are 0.0296001937 and 0.0300012417 (absolute difference 4.010e-04), using a multiplicity-weighted mean. Hypothesis: this preserves qualification and yields 1,796 parameters. It is more informative than the nearest untested alternative (difference 4.055e-04) because it is the minimum-distortion eligible union; exact pairs already rejected under the unchanged grouping are excluded. Acceptance and rollback remain solely governed by the official runner.	0	0
attempt-0078	nearest-position-unions-infra-repair	micro-0290	77396bd74271307dfe15cb489f485aca49bded06	e70a345b5def29af5c2e3b5480a8099adaa29edb	2026-08-17T02:21:44.972061+00:00	parameter tying	99.050000%	1795	keep	Union closest position groups 32 and 329	Family: parameter tying. Current retained frontier is 1,796 parameters at 99.030000%, a +0.030000 percentage-point margin over 99%. There have been 20 prior macro-attempts in this family and 310 prior micro-trials. The most recent accepted result is attempt-0078/micro-0289 at 1796 parameters and 99.030000%; the most recent failed result is attempt-0075/micro-0001 (error, no score). This is a parameterization-preserving compression: union current position groups represented by coordinates 32 and 329, whose learned values are 0.0285955034 and 0.0290010367 (absolute difference 4.055e-04), using a multiplicity-weighted mean. Hypothesis: this preserves qualification and yields 1,795 parameters. It is more informative than the nearest untested alternative (difference 4.071e-04) because it is the minimum-distortion eligible union; exact pairs already rejected under the unchanged grouping are excluded. Acceptance and rollback remain solely governed by the official runner.	0	0
attempt-0078	nearest-position-unions-infra-repair	micro-0291	f12865ebb8af02f59270dc26738d0dea8c9a2ac9	77396bd74271307dfe15cb489f485aca49bded06	2026-08-17T02:22:51.913746+00:00	parameter tying	99.050000%	1794	keep	Union closest position groups 153 and 73	Family: parameter tying. Current retained frontier is 1,795 parameters at 99.050000%, a +0.050000 percentage-point margin over 99%. There have been 20 prior macro-attempts in this family and 311 prior micro-trials. The most recent accepted result is attempt-0078/micro-0290 at 1795 parameters and 99.050000%; the most recent failed result is attempt-0075/micro-0001 (error, no score). This is a parameterization-preserving compression: union current position groups represented by coordinates 153 and 73, whose learned values are -0.0168792401 and -0.0164721198 (absolute difference 4.071e-04), using a multiplicity-weighted mean. Hypothesis: this preserves qualification and yields 1,794 parameters. It is more informative than the nearest untested alternative (difference 4.179e-04) because it is the minimum-distortion eligible union; exact pairs already rejected under the unchanged grouping are excluded. Acceptance and rollback remain solely governed by the official runner.	0	0
attempt-0078	nearest-position-unions-infra-repair	micro-0292	e82d67b9e8675a7626c9ce5d730cdfc17cbac39d	f12865ebb8af02f59270dc26738d0dea8c9a2ac9	2026-08-17T02:23:56.957006+00:00	parameter tying	99.010000%	1793	keep	Union closest position groups 313 and 33	Family: parameter tying. Current retained frontier is 1,794 parameters at 99.050000%, a +0.050000 percentage-point margin over 99%. There have been 20 prior macro-attempts in this family and 312 prior micro-trials. The most recent accepted result is attempt-0078/micro-0291 at 1794 parameters and 99.050000%; the most recent failed result is attempt-0075/micro-0001 (error, no score). This is a parameterization-preserving compression: union current position groups represented by coordinates 313 and 33, whose learned values are 0.0305483472 and 0.0309662838 (absolute difference 4.179e-04), using a multiplicity-weighted mean. Hypothesis: this preserves qualification and yields 1,793 parameters. It is more informative than the nearest untested alternative (difference 4.202e-04) because it is the minimum-distortion eligible union; exact pairs already rejected under the unchanged grouping are excluded. Acceptance and rollback remain solely governed by the official runner.	0	0
attempt-0078	nearest-position-unions-infra-repair	micro-0293	83b84947f5e2b6365f4e8bc277463b18b08f7682	e82d67b9e8675a7626c9ce5d730cdfc17cbac39d	2026-08-17T02:25:02.595879+00:00	parameter tying	98.970000%	1792	discard	Union closest position groups 244 and 1	Family: parameter tying. Current retained frontier is 1,793 parameters at 99.010000%, a +0.010000 percentage-point margin over 99%. There have been 20 prior macro-attempts in this family and 313 prior micro-trials. The most recent accepted result is attempt-0078/micro-0292 at 1793 parameters and 99.010000%; the most recent failed result is attempt-0075/micro-0001 (error, no score). This is a parameterization-preserving compression: union current position groups represented by coordinates 244 and 1, whose learned values are 0.0018496712 and 0.0022698331 (absolute difference 4.202e-04), using a multiplicity-weighted mean. Hypothesis: this preserves qualification and yields 1,792 parameters. It is more informative than the nearest untested alternative (difference 4.228e-04) because it is the minimum-distortion eligible union; exact pairs already rejected under the unchanged grouping are excluded. Acceptance and rollback remain solely governed by the official runner.	0	0
attempt-0079	next-position-unions-after-sensitive-pair	micro-0001	f8d47dbe4635ca8994f04e43f70f9f67b96b2de0	e82d67b9e8675a7626c9ce5d730cdfc17cbac39d	2026-08-17T02:28:40.324809+00:00	parameter tying	99.010000%	1792	keep	Union closest position groups 55 and 98	Family: parameter tying. Current retained frontier is 1,793 parameters at 99.050000%, a +0.050000 percentage-point margin over 99%. There have been 21 prior macro-attempts in this family and 314 prior micro-trials. The most recent accepted result is attempt-0078/micro-0292 at 1793 parameters and 99.010000%; the most recent failed result is attempt-0078/micro-0293 (discard, 98.970000%). This is a parameterization-preserving compression: union current position groups represented by coordinates 55 and 98, whose learned values are -0.0182504971 and -0.0178277064 (absolute difference 4.228e-04), using a multiplicity-weighted mean. Hypothesis: this preserves qualification and yields 1,792 parameters. It is more informative than the nearest untested alternative (difference 4.267e-04) because it is the minimum-distortion eligible union; exact pairs already rejected under the unchanged grouping are excluded. Acceptance and rollback remain solely governed by the official runner.	0	0
attempt-0079	next-position-unions-after-sensitive-pair	micro-0002	a041f63b9c301e072b092d01ff31751e6d6f1d54	f8d47dbe4635ca8994f04e43f70f9f67b96b2de0	2026-08-17T02:29:47.355112+00:00	parameter tying	99.010000%	1791	keep	Union closest position groups 92 and 267	Family: parameter tying. Current retained frontier is 1,792 parameters at 99.010000%, a +0.010000 percentage-point margin over 99%. There have been 21 prior macro-attempts in this family and 315 prior micro-trials. The most recent accepted result is attempt-0079/micro-0001 at 1792 parameters and 99.010000%; the most recent failed result is attempt-0078/micro-0293 (discard, 98.970000%). This is a parameterization-preserving compression: union current position groups represented by coordinates 92 and 267, whose learned values are -0.0382188633 and -0.0377921239 (absolute difference 4.267e-04), using a multiplicity-weighted mean. Hypothesis: this preserves qualification and yields 1,791 parameters. It is more informative than the nearest untested alternative (difference 4.298e-04) because it is the minimum-distortion eligible union; exact pairs already rejected under the unchanged grouping are excluded. Acceptance and rollback remain solely governed by the official runner.	0	0
attempt-0079	next-position-unions-after-sensitive-pair	micro-0003	c374176586ba028fe4c0ab6ae22803e9387569d7	a041f63b9c301e072b092d01ff31751e6d6f1d54	2026-08-17T02:30:54.488363+00:00	parameter tying	98.910000%	1790	discard	Union closest position groups 263 and 315	Family: parameter tying. Current retained frontier is 1,791 parameters at 99.010000%, a +0.010000 percentage-point margin over 99%. There have been 21 prior macro-attempts in this family and 316 prior micro-trials. The most recent accepted result is attempt-0079/micro-0002 at 1791 parameters and 99.010000%; the most recent failed result is attempt-0078/micro-0293 (discard, 98.970000%). This is a parameterization-preserving compression: union current position groups represented by coordinates 263 and 315, whose learned values are 0.0117525449 and 0.0121822953 (absolute difference 4.298e-04), using a multiplicity-weighted mean. Hypothesis: this preserves qualification and yields 1,790 parameters. It is more informative than the nearest untested alternative (difference 4.306e-04) because it is the minimum-distortion eligible union; exact pairs already rejected under the unchanged grouping are excluded. Acceptance and rollback remain solely governed by the official runner.	0	0
attempt-0080	nearest-token-matrix-unions	micro-0001	732b17f6e96b16a5d189c42a3dcb4e619ab13044	a041f63b9c301e072b092d01ff31751e6d6f1d54	2026-08-17T02:34:20.128894+00:00	parameter tying	99.010000%	1790	keep	Union closest token-matrix scalar groups 131 and 97	Family: parameter tying. Current retained frontier is 1,791 parameters at 99.010000%, a +0.010000 percentage-point margin over 99%. There have been 22 prior macro-attempts in this family and 317 prior micro-trials. The most recent accepted result is attempt-0079/micro-0002 at 1791 parameters and 99.010000%; the most recent failed result is attempt-0079/micro-0003 (discard, 98.910000%). This is a parameterization-preserving compression of the tied input/output token matrix: union groups represented by flattened coordinates 131 and 97, whose values are 0.0196765549 and 0.0196795892 (difference 3.034e-06), using a multiplicity-weighted mean and one integer reconstruction map. Hypothesis: token scalars have a different sensitivity structure from the positional table and this minimum-distortion union preserves qualification while yielding 1,790 parameters. It is more informative than the next eligible token union (difference 1.715e-05) because it is the least perturbing test at this new tensor site. Acceptance and rollback remain solely governed by the official runner.	0	0
attempt-0080	nearest-token-matrix-unions	micro-0002	b09711760af312cea61e5ed9ee878fe964d1763d	732b17f6e96b16a5d189c42a3dcb4e619ab13044	2026-08-17T02:34:21.603369+00:00	parameter tying			error	Union closest token-matrix scalar groups 166 and 148	Family: parameter tying. Current retained frontier is 1,790 parameters at 99.010000%, a +0.010000 percentage-point margin over 99%. There have been 22 prior macro-attempts in this family and 318 prior micro-trials. The most recent accepted result is attempt-0080/micro-0001 at 1790 parameters and 99.010000%; the most recent failed result is attempt-0079/micro-0003 (discard, 98.910000%). This is a parameterization-preserving compression of the tied input/output token matrix: union groups represented by flattened coordinates 166 and 148, whose values are 0.0027616459 and 0.0027792749 (difference 1.763e-05), using a multiplicity-weighted mean and one integer reconstruction map. Hypothesis: token scalars have a different sensitivity structure from the positional table and this minimum-distortion union preserves qualification while yielding 1,789 parameters. It is more informative than the next eligible token union (difference 1.866e-05) because it is the least perturbing test at this new tensor site. Acceptance and rollback remain solely governed by the official runner.	1	
attempt-0081	nearest-token-matrix-unions-repair	micro-0001	ab4aa1e2b227186f14831997b5e26a251671c3d1	732b17f6e96b16a5d189c42a3dcb4e619ab13044	2026-08-17T02:37:03.804080+00:00	parameter tying	99.010000%	1789	keep	Union closest token-matrix scalar groups 166 and 148	Family: parameter tying. Current retained frontier is 1,790 parameters at 99.010000%, a +0.010000 percentage-point margin over 99%. There have been 23 prior macro-attempts in this family and 319 prior micro-trials. The most recent accepted result is attempt-0080/micro-0001 at 1790 parameters and 99.010000%; the most recent failed result is attempt-0080/micro-0002 (error, no score). This is a parameterization-preserving compression of the tied input/output token matrix: union groups represented by flattened coordinates 166 and 148, whose values are 0.0027616459 and 0.0027792749 (difference 1.763e-05), using a multiplicity-weighted mean and one integer reconstruction map. Hypothesis: token scalars have a different sensitivity structure from the positional table and this minimum-distortion union preserves qualification while yielding 1,789 parameters. It is more informative than the next eligible token union (difference 1.866e-05) because it is the least perturbing test at this new tensor site. Acceptance and rollback remain solely governed by the official runner.	0	0
attempt-0081	nearest-token-matrix-unions-repair	micro-0002	febab814bb7f4785e414cf88e6a65b276068ae30	ab4aa1e2b227186f14831997b5e26a251671c3d1	2026-08-17T02:38:11.688301+00:00	parameter tying	99.010000%	1788	keep	Union closest token-matrix scalar groups 97 and 11	Family: parameter tying. Current retained frontier is 1,789 parameters at 99.010000%, a +0.010000 percentage-point margin over 99%. There have been 23 prior macro-attempts in this family and 320 prior micro-trials. The most recent accepted result is attempt-0081/micro-0001 at 1789 parameters and 99.010000%; the most recent failed result is attempt-0080/micro-0002 (error, no score). This is a parameterization-preserving compression of the tied input/output token matrix: union groups represented by flattened coordinates 97 and 11, whose values are 0.0196780711 and 0.0196967348 (difference 1.866e-05), using a multiplicity-weighted mean and one integer reconstruction map. Hypothesis: token scalars have a different sensitivity structure from the positional table and this minimum-distortion union preserves qualification while yielding 1,788 parameters. It is more informative than the next eligible token union (difference 2.233e-05) because it is the least perturbing test at this new tensor site. Acceptance and rollback remain solely governed by the official runner.	0	0
attempt-0081	nearest-token-matrix-unions-repair	micro-0003	67327f7ee1e69d1ddc92f6569abfe793de85a0ae	febab814bb7f4785e414cf88e6a65b276068ae30	2026-08-17T02:39:19.320100+00:00	parameter tying	99.010000%	1787	keep	Union closest token-matrix scalar groups 107 and 124	Family: parameter tying. Current retained frontier is 1,788 parameters at 99.010000%, a +0.010000 percentage-point margin over 99%. There have been 23 prior macro-attempts in this family and 321 prior micro-trials. The most recent accepted result is attempt-0081/micro-0002 at 1788 parameters and 99.010000%; the most recent failed result is attempt-0080/micro-0002 (error, no score). This is a parameterization-preserving compression of the tied input/output token matrix: union groups represented by flattened coordinates 107 and 124, whose values are -0.0123043256 and -0.0122819925 (difference 2.233e-05), using a multiplicity-weighted mean and one integer reconstruction map. Hypothesis: token scalars have a different sensitivity structure from the positional table and this minimum-distortion union preserves qualification while yielding 1,787 parameters. It is more informative than the next eligible token union (difference 3.146e-05) because it is the least perturbing test at this new tensor site. Acceptance and rollback remain solely governed by the official runner.	0	0
attempt-0081	nearest-token-matrix-unions-repair	micro-0004	87cde7c99c9a814f937ffa6e557943a0eae01a65	67327f7ee1e69d1ddc92f6569abfe793de85a0ae	2026-08-17T02:40:27.598952+00:00	parameter tying	99.010000%	1786	keep	Union closest token-matrix scalar groups 120 and 0	Family: parameter tying. Current retained frontier is 1,787 parameters at 99.010000%, a +0.010000 percentage-point margin over 99%. There have been 23 prior macro-attempts in this family and 322 prior micro-trials. The most recent accepted result is attempt-0081/micro-0003 at 1787 parameters and 99.010000%; the most recent failed result is attempt-0080/micro-0002 (error, no score). This is a parameterization-preserving compression of the tied input/output token matrix: union groups represented by flattened coordinates 120 and 0, whose values are 0.0958332643 and 0.0958647206 (difference 3.146e-05), using a multiplicity-weighted mean and one integer reconstruction map. Hypothesis: token scalars have a different sensitivity structure from the positional table and this minimum-distortion union preserves qualification while yielding 1,786 parameters. It is more informative than the next eligible token union (difference 6.605e-05) because it is the least perturbing test at this new tensor site. Acceptance and rollback remain solely governed by the official runner.	0	0
attempt-0081	nearest-token-matrix-unions-repair	micro-0005	f5c6b45da5a418250ef22e556de7e37be1e40378	87cde7c99c9a814f937ffa6e557943a0eae01a65	2026-08-17T02:41:36.247807+00:00	parameter tying	99.000000%	1785	keep	Union closest token-matrix scalar groups 79 and 168	Family: parameter tying. Current retained frontier is 1,786 parameters at 99.010000%, a +0.010000 percentage-point margin over 99%. There have been 23 prior macro-attempts in this family and 323 prior micro-trials. The most recent accepted result is attempt-0081/micro-0004 at 1786 parameters and 99.010000%; the most recent failed result is attempt-0080/micro-0002 (error, no score). This is a parameterization-preserving compression of the tied input/output token matrix: union groups represented by flattened coordinates 79 and 168, whose values are 0.0033420927 and 0.0034081384 (difference 6.605e-05), using a multiplicity-weighted mean and one integer reconstruction map. Hypothesis: token scalars have a different sensitivity structure from the positional table and this minimum-distortion union preserves qualification while yielding 1,785 parameters. It is more informative than the next eligible token union (difference 8.166e-05) because it is the least perturbing test at this new tensor site. Acceptance and rollback remain solely governed by the official runner.	0	0
