macro_attempt_id	automation_id	micro_attempt_id	commit	parent_commit	timestamp_utc	family	accuracy	parameters	status	description	proposal	train_exit	verify_exit
attempt-0078	nearest-position-unions-infra-repair	micro-0236	a8643db5ee3ef3756a8f92284f7823a4331bcde1	78f785a908e12cfda47d3d0cc3ed7ca485ccd845	2026-08-17T01:15:52.884185+00:00	parameter tying	99.070000%	1849	keep	Union closest position groups 26 and 84	Family: parameter tying. Current retained frontier is 1,850 parameters at 99.080000%, a +0.080000 percentage-point margin over 99%. There have been 20 prior macro-attempts in this family and 256 prior micro-trials. The most recent accepted result is attempt-0078/micro-0235 at 1850 parameters and 99.080000%; the most recent failed result is attempt-0075/micro-0001 (error, no score). This is a parameterization-preserving compression: union current position groups represented by coordinates 26 and 84, whose learned values are -0.0474665985 and -0.0472195335 (absolute difference 2.471e-04), using a multiplicity-weighted mean. Hypothesis: this preserves qualification and yields 1,849 parameters. It is more informative than the nearest untested alternative (difference 2.502e-04) because it is the minimum-distortion eligible union; exact pairs already rejected under the unchanged grouping are excluded. Acceptance and rollback remain solely governed by the official runner.	0	0
attempt-0078	nearest-position-unions-infra-repair	micro-0237	ded5d6a0c250a795ae56fbe21782aa6d1091f72b	a8643db5ee3ef3756a8f92284f7823a4331bcde1	2026-08-17T01:17:06.657176+00:00	parameter tying	99.070000%	1848	keep	Union closest position groups 404 and 252	Family: parameter tying. Current retained frontier is 1,849 parameters at 99.070000%, a +0.070000 percentage-point margin over 99%. There have been 20 prior macro-attempts in this family and 257 prior micro-trials. The most recent accepted result is attempt-0078/micro-0236 at 1849 parameters and 99.070000%; the most recent failed result is attempt-0075/micro-0001 (error, no score). This is a parameterization-preserving compression: union current position groups represented by coordinates 404 and 252, whose learned values are 0.0532870069 and 0.0535372086 (absolute difference 2.502e-04), using a multiplicity-weighted mean. Hypothesis: this preserves qualification and yields 1,848 parameters. It is more informative than the nearest untested alternative (difference 2.507e-04) because it is the minimum-distortion eligible union; exact pairs already rejected under the unchanged grouping are excluded. Acceptance and rollback remain solely governed by the official runner.	0	0
attempt-0078	nearest-position-unions-infra-repair	micro-0238	ccbea74aad938f0f2c21111a3c7bf8429e79fb70	ded5d6a0c250a795ae56fbe21782aa6d1091f72b	2026-08-17T01:18:17.278382+00:00	parameter tying	99.070000%	1847	keep	Union closest position groups 368 and 45	Family: parameter tying. Current retained frontier is 1,848 parameters at 99.070000%, a +0.070000 percentage-point margin over 99%. There have been 20 prior macro-attempts in this family and 258 prior micro-trials. The most recent accepted result is attempt-0078/micro-0237 at 1848 parameters and 99.070000%; the most recent failed result is attempt-0075/micro-0001 (error, no score). This is a parameterization-preserving compression: union current position groups represented by coordinates 368 and 45, whose learned values are -0.0398563594 and -0.0396056771 (absolute difference 2.507e-04), using a multiplicity-weighted mean. Hypothesis: this preserves qualification and yields 1,847 parameters. It is more informative than the nearest untested alternative (difference 2.548e-04) because it is the minimum-distortion eligible union; exact pairs already rejected under the unchanged grouping are excluded. Acceptance and rollback remain solely governed by the official runner.	0	0
attempt-0078	nearest-position-unions-infra-repair	micro-0239	3522bfe7e21d78693fa8e73ce86adad01a26db11	ccbea74aad938f0f2c21111a3c7bf8429e79fb70	2026-08-17T01:19:19.251540+00:00	parameter tying	99.080000%	1846	keep	Union closest position groups 119 and 339	Family: parameter tying. Current retained frontier is 1,847 parameters at 99.070000%, a +0.070000 percentage-point margin over 99%. There have been 20 prior macro-attempts in this family and 259 prior micro-trials. The most recent accepted result is attempt-0078/micro-0238 at 1847 parameters and 99.070000%; the most recent failed result is attempt-0075/micro-0001 (error, no score). This is a parameterization-preserving compression: union current position groups represented by coordinates 119 and 339, whose learned values are -0.0271804929 and -0.0269256849 (absolute difference 2.548e-04), using a multiplicity-weighted mean. Hypothesis: this preserves qualification and yields 1,846 parameters. It is more informative than the nearest untested alternative (difference 2.584e-04) because it is the minimum-distortion eligible union; exact pairs already rejected under the unchanged grouping are excluded. Acceptance and rollback remain solely governed by the official runner.	0	0
attempt-0078	nearest-position-unions-infra-repair	micro-0240	a048c90fed924a317f17f26bb7ab4e93fa692a3e	3522bfe7e21d78693fa8e73ce86adad01a26db11	2026-08-17T01:20:21.532017+00:00	parameter tying	99.080000%	1845	keep	Union closest position groups 130 and 98	Family: parameter tying. Current retained frontier is 1,846 parameters at 99.080000%, a +0.080000 percentage-point margin over 99%. There have been 20 prior macro-attempts in this family and 260 prior micro-trials. The most recent accepted result is attempt-0078/micro-0239 at 1846 parameters and 99.080000%; the most recent failed result is attempt-0075/micro-0001 (error, no score). This is a parameterization-preserving compression: union current position groups represented by coordinates 130 and 98, whose learned values are -0.0179568864 and -0.0176985264 (absolute difference 2.584e-04), using a multiplicity-weighted mean. Hypothesis: this preserves qualification and yields 1,845 parameters. It is more informative than the nearest untested alternative (difference 2.615e-04) because it is the minimum-distortion eligible union; exact pairs already rejected under the unchanged grouping are excluded. Acceptance and rollback remain solely governed by the official runner.	0	0
attempt-0078	nearest-position-unions-infra-repair	micro-0241	fa6e36c47aa646814abc68e7332dcfec2cd5b47d	a048c90fed924a317f17f26bb7ab4e93fa692a3e	2026-08-17T01:21:24.425361+00:00	parameter tying	99.070000%	1844	keep	Union closest position groups 92 and 358	Family: parameter tying. Current retained frontier is 1,845 parameters at 99.080000%, a +0.080000 percentage-point margin over 99%. There have been 20 prior macro-attempts in this family and 261 prior micro-trials. The most recent accepted result is attempt-0078/micro-0240 at 1845 parameters and 99.080000%; the most recent failed result is attempt-0075/micro-0001 (error, no score). This is a parameterization-preserving compression: union current position groups represented by coordinates 92 and 358, whose learned values are -0.0383496284 and -0.0380880944 (absolute difference 2.615e-04), using a multiplicity-weighted mean. Hypothesis: this preserves qualification and yields 1,844 parameters. It is more informative than the nearest untested alternative (difference 2.639e-04) because it is the minimum-distortion eligible union; exact pairs already rejected under the unchanged grouping are excluded. Acceptance and rollback remain solely governed by the official runner.	0	0
attempt-0078	nearest-position-unions-infra-repair	micro-0242	dd5857598160b8a300bbb2fe96bbebb5bea5d87d	fa6e36c47aa646814abc68e7332dcfec2cd5b47d	2026-08-17T01:22:26.487342+00:00	parameter tying	99.110000%	1843	keep	Union closest position groups 22 and 218	Family: parameter tying. Current retained frontier is 1,844 parameters at 99.070000%, a +0.070000 percentage-point margin over 99%. There have been 20 prior macro-attempts in this family and 262 prior micro-trials. The most recent accepted result is attempt-0078/micro-0241 at 1844 parameters and 99.070000%; the most recent failed result is attempt-0075/micro-0001 (error, no score). This is a parameterization-preserving compression: union current position groups represented by coordinates 22 and 218, whose learned values are 0.0212809164 and 0.0215447824 (absolute difference 2.639e-04), using a multiplicity-weighted mean. Hypothesis: this preserves qualification and yields 1,843 parameters. It is more informative than the nearest untested alternative (difference 2.642e-04) because it is the minimum-distortion eligible union; exact pairs already rejected under the unchanged grouping are excluded. Acceptance and rollback remain solely governed by the official runner.	0	0
attempt-0078	nearest-position-unions-infra-repair	micro-0243	4fd0f145c24262f5b352d84d670d3ec54bf929eb	dd5857598160b8a300bbb2fe96bbebb5bea5d87d	2026-08-17T01:23:28.485191+00:00	parameter tying	99.130000%	1842	keep	Union closest position groups 72 and 328	Family: parameter tying. Current retained frontier is 1,843 parameters at 99.110000%, a +0.110000 percentage-point margin over 99%. There have been 20 prior macro-attempts in this family and 263 prior micro-trials. The most recent accepted result is attempt-0078/micro-0242 at 1843 parameters and 99.110000%; the most recent failed result is attempt-0075/micro-0001 (error, no score). This is a parameterization-preserving compression: union current position groups represented by coordinates 72 and 328, whose learned values are -0.0102545694 and -0.0099903233 (absolute difference 2.642e-04), using a multiplicity-weighted mean. Hypothesis: this preserves qualification and yields 1,842 parameters. It is more informative than the nearest untested alternative (difference 2.645e-04) because it is the minimum-distortion eligible union; exact pairs already rejected under the unchanged grouping are excluded. Acceptance and rollback remain solely governed by the official runner.	0	0
attempt-0078	nearest-position-unions-infra-repair	micro-0244	aebd5642503c85dc23e08741089b6ea7bd4439f8	4fd0f145c24262f5b352d84d670d3ec54bf929eb	2026-08-17T01:24:31.051330+00:00	parameter tying	99.110000%	1841	keep	Union closest position groups 334 and 318	Family: parameter tying. Current retained frontier is 1,842 parameters at 99.130000%, a +0.130000 percentage-point margin over 99%. There have been 20 prior macro-attempts in this family and 264 prior micro-trials. The most recent accepted result is attempt-0078/micro-0243 at 1842 parameters and 99.130000%; the most recent failed result is attempt-0075/micro-0001 (error, no score). This is a parameterization-preserving compression: union current position groups represented by coordinates 334 and 318, whose learned values are 0.0252019484 and 0.0254664905 (absolute difference 2.645e-04), using a multiplicity-weighted mean. Hypothesis: this preserves qualification and yields 1,841 parameters. It is more informative than the nearest untested alternative (difference 2.688e-04) because it is the minimum-distortion eligible union; exact pairs already rejected under the unchanged grouping are excluded. Acceptance and rollback remain solely governed by the official runner.	0	0
attempt-0078	nearest-position-unions-infra-repair	micro-0245	b758cd5c8071c2e995a1d257bda7425f8e2c8ec6	aebd5642503c85dc23e08741089b6ea7bd4439f8	2026-08-17T01:25:33.044023+00:00	parameter tying	99.140000%	1840	keep	Union closest position groups 179 and 238	Family: parameter tying. Current retained frontier is 1,841 parameters at 99.110000%, a +0.110000 percentage-point margin over 99%. There have been 20 prior macro-attempts in this family and 265 prior micro-trials. The most recent accepted result is attempt-0078/micro-0244 at 1841 parameters and 99.110000%; the most recent failed result is attempt-0075/micro-0001 (error, no score). This is a parameterization-preserving compression: union current position groups represented by coordinates 179 and 238, whose learned values are -0.0129713835 and -0.0127026169 (absolute difference 2.688e-04), using a multiplicity-weighted mean. Hypothesis: this preserves qualification and yields 1,840 parameters. It is more informative than the nearest untested alternative (difference 2.689e-04) because it is the minimum-distortion eligible union; exact pairs already rejected under the unchanged grouping are excluded. Acceptance and rollback remain solely governed by the official runner.	0	0
attempt-0078	nearest-position-unions-infra-repair	micro-0246	7b4c6eb7927a0d8b6969f1d21eb76bd406b57160	b758cd5c8071c2e995a1d257bda7425f8e2c8ec6	2026-08-17T01:26:35.529726+00:00	parameter tying	99.180000%	1839	keep	Union closest position groups 96 and 198	Family: parameter tying. Current retained frontier is 1,840 parameters at 99.140000%, a +0.140000 percentage-point margin over 99%. There have been 20 prior macro-attempts in this family and 266 prior micro-trials. The most recent accepted result is attempt-0078/micro-0245 at 1840 parameters and 99.140000%; the most recent failed result is attempt-0075/micro-0001 (error, no score). This is a parameterization-preserving compression: union current position groups represented by coordinates 96 and 198, whose learned values are 0.0102921501 and 0.0105610117 (absolute difference 2.689e-04), using a multiplicity-weighted mean. Hypothesis: this preserves qualification and yields 1,839 parameters. It is more informative than the nearest untested alternative (difference 2.698e-04) because it is the minimum-distortion eligible union; exact pairs already rejected under the unchanged grouping are excluded. Acceptance and rollback remain solely governed by the official runner.	0	0
attempt-0078	nearest-position-unions-infra-repair	micro-0247	5556cfb2fabdcebe063d7c976a340e949be9c5ed	7b4c6eb7927a0d8b6969f1d21eb76bd406b57160	2026-08-17T01:27:38.597865+00:00	parameter tying	99.180000%	1838	keep	Union closest position groups 65 and 48	Family: parameter tying. Current retained frontier is 1,839 parameters at 99.180000%, a +0.180000 percentage-point margin over 99%. There have been 20 prior macro-attempts in this family and 267 prior micro-trials. The most recent accepted result is attempt-0078/micro-0246 at 1839 parameters and 99.180000%; the most recent failed result is attempt-0075/micro-0001 (error, no score). This is a parameterization-preserving compression: union current position groups represented by coordinates 65 and 48, whose learned values are 0.0027445606 and 0.0030143633 (absolute difference 2.698e-04), using a multiplicity-weighted mean. Hypothesis: this preserves qualification and yields 1,838 parameters. It is more informative than the nearest untested alternative (difference 2.723e-04) because it is the minimum-distortion eligible union; exact pairs already rejected under the unchanged grouping are excluded. Acceptance and rollback remain solely governed by the official runner.	0	0
attempt-0078	nearest-position-unions-infra-repair	micro-0248	fbe053a14b043238fcff13a988eb846691ef1d5c	5556cfb2fabdcebe063d7c976a340e949be9c5ed	2026-08-17T01:28:40.315603+00:00	parameter tying	99.170000%	1837	keep	Union closest position groups 249 and 6	Family: parameter tying. Current retained frontier is 1,838 parameters at 99.180000%, a +0.180000 percentage-point margin over 99%. There have been 20 prior macro-attempts in this family and 268 prior micro-trials. The most recent accepted result is attempt-0078/micro-0247 at 1838 parameters and 99.180000%; the most recent failed result is attempt-0075/micro-0001 (error, no score). This is a parameterization-preserving compression: union current position groups represented by coordinates 249 and 6, whose learned values are 0.0078154579 and 0.0080877319 (absolute difference 2.723e-04), using a multiplicity-weighted mean. Hypothesis: this preserves qualification and yields 1,837 parameters. It is more informative than the nearest untested alternative (difference 2.726e-04) because it is the minimum-distortion eligible union; exact pairs already rejected under the unchanged grouping are excluded. Acceptance and rollback remain solely governed by the official runner.	0	0
attempt-0078	nearest-position-unions-infra-repair	micro-0249	7d748262ca55f36ec3d03fe12e4dded87327f4e0	fbe053a14b043238fcff13a988eb846691ef1d5c	2026-08-17T01:29:41.954552+00:00	parameter tying	99.170000%	1836	keep	Union closest position groups 63 and 210	Family: parameter tying. Current retained frontier is 1,837 parameters at 99.170000%, a +0.170000 percentage-point margin over 99%. There have been 20 prior macro-attempts in this family and 269 prior micro-trials. The most recent accepted result is attempt-0078/micro-0248 at 1837 parameters and 99.170000%; the most recent failed result is attempt-0075/micro-0001 (error, no score). This is a parameterization-preserving compression: union current position groups represented by coordinates 63 and 210, whose learned values are -0.0016406956 and -0.0013681256 (absolute difference 2.726e-04), using a multiplicity-weighted mean. Hypothesis: this preserves qualification and yields 1,836 parameters. It is more informative than the nearest untested alternative (difference 2.726e-04) because it is the minimum-distortion eligible union; exact pairs already rejected under the unchanged grouping are excluded. Acceptance and rollback remain solely governed by the official runner.	0	0
attempt-0078	nearest-position-unions-infra-repair	micro-0250	e833763af93bbc4b65804d462245923924a20804	7d748262ca55f36ec3d03fe12e4dded87327f4e0	2026-08-17T01:30:44.540222+00:00	parameter tying	99.180000%	1835	keep	Union closest position groups 37 and 151	Family: parameter tying. Current retained frontier is 1,836 parameters at 99.170000%, a +0.170000 percentage-point margin over 99%. There have been 20 prior macro-attempts in this family and 270 prior micro-trials. The most recent accepted result is attempt-0078/micro-0249 at 1836 parameters and 99.170000%; the most recent failed result is attempt-0075/micro-0001 (error, no score). This is a parameterization-preserving compression: union current position groups represented by coordinates 37 and 151, whose learned values are -0.0080628954 and -0.0077902973 (absolute difference 2.726e-04), using a multiplicity-weighted mean. Hypothesis: this preserves qualification and yields 1,835 parameters. It is more informative than the nearest untested alternative (difference 2.740e-04) because it is the minimum-distortion eligible union; exact pairs already rejected under the unchanged grouping are excluded. Acceptance and rollback remain solely governed by the official runner.	0	0
attempt-0078	nearest-position-unions-infra-repair	micro-0251	e27eea5fe6bcb949a6fd7adea48f5d7a91cf8384	e833763af93bbc4b65804d462245923924a20804	2026-08-17T01:31:46.608659+00:00	parameter tying	99.170000%	1834	keep	Union closest position groups 221 and 122	Family: parameter tying. Current retained frontier is 1,835 parameters at 99.180000%, a +0.180000 percentage-point margin over 99%. There have been 20 prior macro-attempts in this family and 271 prior micro-trials. The most recent accepted result is attempt-0078/micro-0250 at 1835 parameters and 99.180000%; the most recent failed result is attempt-0075/micro-0001 (error, no score). This is a parameterization-preserving compression: union current position groups represented by coordinates 221 and 122, whose learned values are -0.0090625370 and -0.0087885810 (absolute difference 2.740e-04), using a multiplicity-weighted mean. Hypothesis: this preserves qualification and yields 1,834 parameters. It is more informative than the nearest untested alternative (difference 2.744e-04) because it is the minimum-distortion eligible union; exact pairs already rejected under the unchanged grouping are excluded. Acceptance and rollback remain solely governed by the official runner.	0	0
attempt-0078	nearest-position-unions-infra-repair	micro-0252	4a2c5fcebc0ca44cab08afebfbc15e1516c06b67	e27eea5fe6bcb949a6fd7adea48f5d7a91cf8384	2026-08-17T01:32:55.981501+00:00	parameter tying	99.170000%	1833	keep	Union closest position groups 390 and 153	Family: parameter tying. Current retained frontier is 1,834 parameters at 99.170000%, a +0.170000 percentage-point margin over 99%. There have been 20 prior macro-attempts in this family and 272 prior micro-trials. The most recent accepted result is attempt-0078/micro-0251 at 1834 parameters and 99.170000%; the most recent failed result is attempt-0075/micro-0001 (error, no score). This is a parameterization-preserving compression: union current position groups represented by coordinates 390 and 153, whose learned values are -0.0170621835 and -0.0167877674 (absolute difference 2.744e-04), using a multiplicity-weighted mean. Hypothesis: this preserves qualification and yields 1,833 parameters. It is more informative than the nearest untested alternative (difference 2.766e-04) because it is the minimum-distortion eligible union; exact pairs already rejected under the unchanged grouping are excluded. Acceptance and rollback remain solely governed by the official runner.	0	0
