macro_attempt_id	automation_id	micro_attempt_id	commit	parent_commit	timestamp_utc	family	accuracy	parameters	status	description	proposal	train_exit	verify_exit
attempt-0084	nearest-shared-ff-input-unions	micro-0008	ff68886d5684ee35554aa2f8b98ac9d2ce5d79ce	017e06a8377695694961876aa263fbe0e843dd99	2026-08-17T03:46:46.927981+00:00	parameter tying	99.010000%	1736	keep	Union closest shared FF-input scalar groups 207 and 30	Family: parameter tying. Current retained frontier is 1,737 parameters at 99.010000%, a +0.010000 percentage-point margin over 99%. There have been 26 prior macro-attempts in this family and 373 prior micro-trials. The most recent accepted result is attempt-0084/micro-0007 at 1737 parameters and 99.010000%; the most recent failed result is attempt-0081/micro-0007 (discard, 98.970000%). This is a parameterization-preserving compression of the depth-shared feed-forward input map: union flattened coordinates 207 and 30, values -0.0972653702 and -0.0971873179 (difference 7.805e-05), using a weighted mean and integer reconstruction. Hypothesis: nonlinear feature construction contains near-duplicate scalars independent of QKV redundancy, preserving qualification at 1,736 parameters. It is more informative than the next FF-input union (difference 1.174e-04) because it is the minimum-distortion isolated test at this new mechanism site. Official acceptance and rollback are unchanged.	0	0
attempt-0084	nearest-shared-ff-input-unions	micro-0009	7d88316b567ab7525082d8838ca9fc3a7f2ff643	ff68886d5684ee35554aa2f8b98ac9d2ce5d79ce	2026-08-17T03:48:04.434226+00:00	parameter tying	99.010000%	1735	keep	Union closest shared FF-input scalar groups 247 and 245	Family: parameter tying. Current retained frontier is 1,736 parameters at 99.010000%, a +0.010000 percentage-point margin over 99%. There have been 26 prior macro-attempts in this family and 374 prior micro-trials. The most recent accepted result is attempt-0084/micro-0008 at 1736 parameters and 99.010000%; the most recent failed result is attempt-0081/micro-0007 (discard, 98.970000%). This is a parameterization-preserving compression of the depth-shared feed-forward input map: union flattened coordinates 247 and 245, values 0.1725317240 and 0.1726491153 (difference 1.174e-04), using a weighted mean and integer reconstruction. Hypothesis: nonlinear feature construction contains near-duplicate scalars independent of QKV redundancy, preserving qualification at 1,735 parameters. It is more informative than the next FF-input union (difference 1.182e-04) because it is the minimum-distortion isolated test at this new mechanism site. Official acceptance and rollback are unchanged.	0	0
attempt-0084	nearest-shared-ff-input-unions	micro-0010	a8ea15439d8de88a40dfd82b9bd7183744761579	7d88316b567ab7525082d8838ca9fc3a7f2ff643	2026-08-17T03:49:17.398252+00:00	parameter tying	99.010000%	1734	keep	Union closest shared FF-input scalar groups 65 and 162	Family: parameter tying. Current retained frontier is 1,735 parameters at 99.010000%, a +0.010000 percentage-point margin over 99%. There have been 26 prior macro-attempts in this family and 375 prior micro-trials. The most recent accepted result is attempt-0084/micro-0009 at 1735 parameters and 99.010000%; the most recent failed result is attempt-0081/micro-0007 (discard, 98.970000%). This is a parameterization-preserving compression of the depth-shared feed-forward input map: union flattened coordinates 65 and 162, values -0.1751201153 and -0.1750019044 (difference 1.182e-04), using a weighted mean and integer reconstruction. Hypothesis: nonlinear feature construction contains near-duplicate scalars independent of QKV redundancy, preserving qualification at 1,734 parameters. It is more informative than the next FF-input union (difference 1.362e-04) because it is the minimum-distortion isolated test at this new mechanism site. Official acceptance and rollback are unchanged.	0	0
attempt-0084	nearest-shared-ff-input-unions	micro-0011	89b96790b1b72571aed6f98e4f880fe51be7b7d5	a8ea15439d8de88a40dfd82b9bd7183744761579	2026-08-17T03:50:29.077516+00:00	parameter tying	99.010000%	1733	keep	Union closest shared FF-input scalar groups 179 and 253	Family: parameter tying. Current retained frontier is 1,734 parameters at 99.010000%, a +0.010000 percentage-point margin over 99%. There have been 26 prior macro-attempts in this family and 376 prior micro-trials. The most recent accepted result is attempt-0084/micro-0010 at 1734 parameters and 99.010000%; the most recent failed result is attempt-0081/micro-0007 (discard, 98.970000%). This is a parameterization-preserving compression of the depth-shared feed-forward input map: union flattened coordinates 179 and 253, values -0.1336810291 and -0.1335448027 (difference 1.362e-04), using a weighted mean and integer reconstruction. Hypothesis: nonlinear feature construction contains near-duplicate scalars independent of QKV redundancy, preserving qualification at 1,733 parameters. It is more informative than the next FF-input union (difference 1.388e-04) because it is the minimum-distortion isolated test at this new mechanism site. Official acceptance and rollback are unchanged.	0	0
attempt-0084	nearest-shared-ff-input-unions	micro-0012	a6ff9a6905bff8c8fefd60a4a1c571896a318eeb	89b96790b1b72571aed6f98e4f880fe51be7b7d5	2026-08-17T03:51:40.772670+00:00	parameter tying	99.010000%	1732	keep	Union closest shared FF-input scalar groups 42 and 156	Family: parameter tying. Current retained frontier is 1,733 parameters at 99.010000%, a +0.010000 percentage-point margin over 99%. There have been 26 prior macro-attempts in this family and 377 prior micro-trials. The most recent accepted result is attempt-0084/micro-0011 at 1733 parameters and 99.010000%; the most recent failed result is attempt-0081/micro-0007 (discard, 98.970000%). This is a parameterization-preserving compression of the depth-shared feed-forward input map: union flattened coordinates 42 and 156, values -0.0990883633 and -0.0989495665 (difference 1.388e-04), using a weighted mean and integer reconstruction. Hypothesis: nonlinear feature construction contains near-duplicate scalars independent of QKV redundancy, preserving qualification at 1,732 parameters. It is more informative than the next FF-input union (difference 1.537e-04) because it is the minimum-distortion isolated test at this new mechanism site. Official acceptance and rollback are unchanged.	0	0
attempt-0084	nearest-shared-ff-input-unions	micro-0013	dc251313b3f5353b2696dc47558ef7de2cb7e0f2	a6ff9a6905bff8c8fefd60a4a1c571896a318eeb	2026-08-17T03:52:53.335938+00:00	parameter tying	99.020000%	1731	keep	Union closest shared FF-input scalar groups 252 and 184	Family: parameter tying. Current retained frontier is 1,732 parameters at 99.010000%, a +0.010000 percentage-point margin over 99%. There have been 26 prior macro-attempts in this family and 378 prior micro-trials. The most recent accepted result is attempt-0084/micro-0012 at 1732 parameters and 99.010000%; the most recent failed result is attempt-0081/micro-0007 (discard, 98.970000%). This is a parameterization-preserving compression of the depth-shared feed-forward input map: union flattened coordinates 252 and 184, values 0.1331697553 and 0.1333234459 (difference 1.537e-04), using a weighted mean and integer reconstruction. Hypothesis: nonlinear feature construction contains near-duplicate scalars independent of QKV redundancy, preserving qualification at 1,731 parameters. It is more informative than the next FF-input union (difference 1.541e-04) because it is the minimum-distortion isolated test at this new mechanism site. Official acceptance and rollback are unchanged.	0	0
attempt-0084	nearest-shared-ff-input-unions	micro-0014	e3b30c857abad04a61e01e9b0049255e43206ff1	dc251313b3f5353b2696dc47558ef7de2cb7e0f2	2026-08-17T03:54:11.899852+00:00	parameter tying	99.010000%	1730	keep	Union closest shared FF-input scalar groups 146 and 172	Family: parameter tying. Current retained frontier is 1,731 parameters at 99.020000%, a +0.020000 percentage-point margin over 99%. There have been 26 prior macro-attempts in this family and 379 prior micro-trials. The most recent accepted result is attempt-0084/micro-0013 at 1731 parameters and 99.020000%; the most recent failed result is attempt-0081/micro-0007 (discard, 98.970000%). This is a parameterization-preserving compression of the depth-shared feed-forward input map: union flattened coordinates 146 and 172, values 0.2025094181 and 0.2026635557 (difference 1.541e-04), using a weighted mean and integer reconstruction. Hypothesis: nonlinear feature construction contains near-duplicate scalars independent of QKV redundancy, preserving qualification at 1,730 parameters. It is more informative than the next FF-input union (difference 1.575e-04) because it is the minimum-distortion isolated test at this new mechanism site. Official acceptance and rollback are unchanged.	0	0
attempt-0084	nearest-shared-ff-input-unions	micro-0015	f4fdcb2d5cd46f156e70a17d84555aaeee7f515e	e3b30c857abad04a61e01e9b0049255e43206ff1	2026-08-17T03:55:28.458822+00:00	parameter tying	99.010000%	1729	keep	Union closest shared FF-input scalar groups 55 and 63	Family: parameter tying. Current retained frontier is 1,730 parameters at 99.010000%, a +0.010000 percentage-point margin over 99%. There have been 26 prior macro-attempts in this family and 380 prior micro-trials. The most recent accepted result is attempt-0084/micro-0014 at 1730 parameters and 99.010000%; the most recent failed result is attempt-0081/micro-0007 (discard, 98.970000%). This is a parameterization-preserving compression of the depth-shared feed-forward input map: union flattened coordinates 55 and 63, values 0.2853092849 and 0.2854667902 (difference 1.575e-04), using a weighted mean and integer reconstruction. Hypothesis: nonlinear feature construction contains near-duplicate scalars independent of QKV redundancy, preserving qualification at 1,729 parameters. It is more informative than the next FF-input union (difference 1.626e-04) because it is the minimum-distortion isolated test at this new mechanism site. Official acceptance and rollback are unchanged.	0	0
attempt-0084	nearest-shared-ff-input-unions	micro-0016	7f781c0cca083de0354a30364d8aadc9def98733	f4fdcb2d5cd46f156e70a17d84555aaeee7f515e	2026-08-17T03:56:41.601436+00:00	parameter tying	99.010000%	1728	keep	Union closest shared FF-input scalar groups 196 and 134	Family: parameter tying. Current retained frontier is 1,729 parameters at 99.010000%, a +0.010000 percentage-point margin over 99%. There have been 26 prior macro-attempts in this family and 381 prior micro-trials. The most recent accepted result is attempt-0084/micro-0015 at 1729 parameters and 99.010000%; the most recent failed result is attempt-0081/micro-0007 (discard, 98.970000%). This is a parameterization-preserving compression of the depth-shared feed-forward input map: union flattened coordinates 196 and 134, values 0.0289742015 and 0.0291367956 (difference 1.626e-04), using a weighted mean and integer reconstruction. Hypothesis: nonlinear feature construction contains near-duplicate scalars independent of QKV redundancy, preserving qualification at 1,728 parameters. It is more informative than the next FF-input union (difference 1.668e-04) because it is the minimum-distortion isolated test at this new mechanism site. Official acceptance and rollback are unchanged.	0	0
attempt-0084	nearest-shared-ff-input-unions	micro-0017	01a2a709cd4e00b5572cbb5a9554d28b0436374d	7f781c0cca083de0354a30364d8aadc9def98733	2026-08-17T03:57:56.679733+00:00	parameter tying	99.010000%	1727	keep	Union closest shared FF-input scalar groups 225 and 2	Family: parameter tying. Current retained frontier is 1,728 parameters at 99.010000%, a +0.010000 percentage-point margin over 99%. There have been 26 prior macro-attempts in this family and 382 prior micro-trials. The most recent accepted result is attempt-0084/micro-0016 at 1728 parameters and 99.010000%; the most recent failed result is attempt-0081/micro-0007 (discard, 98.970000%). This is a parameterization-preserving compression of the depth-shared feed-forward input map: union flattened coordinates 225 and 2, values 0.1963046491 and 0.1964714825 (difference 1.668e-04), using a weighted mean and integer reconstruction. Hypothesis: nonlinear feature construction contains near-duplicate scalars independent of QKV redundancy, preserving qualification at 1,727 parameters. It is more informative than the next FF-input union (difference 1.721e-04) because it is the minimum-distortion isolated test at this new mechanism site. Official acceptance and rollback are unchanged.	0	0
attempt-0084	nearest-shared-ff-input-unions	micro-0018	c17f3a713e58ee546f6650486b8a5c78401a7e5d	01a2a709cd4e00b5572cbb5a9554d28b0436374d	2026-08-17T03:59:11.653457+00:00	parameter tying	99.010000%	1726	keep	Union closest shared FF-input scalar groups 220 and 18	Family: parameter tying. Current retained frontier is 1,727 parameters at 99.010000%, a +0.010000 percentage-point margin over 99%. There have been 26 prior macro-attempts in this family and 383 prior micro-trials. The most recent accepted result is attempt-0084/micro-0017 at 1727 parameters and 99.010000%; the most recent failed result is attempt-0081/micro-0007 (discard, 98.970000%). This is a parameterization-preserving compression of the depth-shared feed-forward input map: union flattened coordinates 220 and 18, values 0.2642554641 and 0.2644275725 (difference 1.721e-04), using a weighted mean and integer reconstruction. Hypothesis: nonlinear feature construction contains near-duplicate scalars independent of QKV redundancy, preserving qualification at 1,726 parameters. It is more informative than the next FF-input union (difference 1.871e-04) because it is the minimum-distortion isolated test at this new mechanism site. Official acceptance and rollback are unchanged.	0	0
attempt-0084	nearest-shared-ff-input-unions	micro-0019	8104c9715b545460e441d70188d1ce2620a1776d	c17f3a713e58ee546f6650486b8a5c78401a7e5d	2026-08-17T04:00:24.260533+00:00	parameter tying	99.010000%	1725	keep	Union closest shared FF-input scalar groups 140 and 139	Family: parameter tying. Current retained frontier is 1,726 parameters at 99.010000%, a +0.010000 percentage-point margin over 99%. There have been 26 prior macro-attempts in this family and 384 prior micro-trials. The most recent accepted result is attempt-0084/micro-0018 at 1726 parameters and 99.010000%; the most recent failed result is attempt-0081/micro-0007 (discard, 98.970000%). This is a parameterization-preserving compression of the depth-shared feed-forward input map: union flattened coordinates 140 and 139, values 0.0396046415 and 0.0397917628 (difference 1.871e-04), using a weighted mean and integer reconstruction. Hypothesis: nonlinear feature construction contains near-duplicate scalars independent of QKV redundancy, preserving qualification at 1,725 parameters. It is more informative than the next FF-input union (difference 1.888e-04) because it is the minimum-distortion isolated test at this new mechanism site. Official acceptance and rollback are unchanged.	0	0
attempt-0084	nearest-shared-ff-input-unions	micro-0020	f2048e7224960779b1ee1f3f5cccc623f1392f07	8104c9715b545460e441d70188d1ce2620a1776d	2026-08-17T04:01:36.443246+00:00	parameter tying	99.020000%	1724	keep	Union closest shared FF-input scalar groups 210 and 119	Family: parameter tying. Current retained frontier is 1,725 parameters at 99.010000%, a +0.010000 percentage-point margin over 99%. There have been 26 prior macro-attempts in this family and 385 prior micro-trials. The most recent accepted result is attempt-0084/micro-0019 at 1725 parameters and 99.010000%; the most recent failed result is attempt-0081/micro-0007 (discard, 98.970000%). This is a parameterization-preserving compression of the depth-shared feed-forward input map: union flattened coordinates 210 and 119, values 0.0342347696 and 0.0344235338 (difference 1.888e-04), using a weighted mean and integer reconstruction. Hypothesis: nonlinear feature construction contains near-duplicate scalars independent of QKV redundancy, preserving qualification at 1,724 parameters. It is more informative than the next FF-input union (difference 1.898e-04) because it is the minimum-distortion isolated test at this new mechanism site. Official acceptance and rollback are unchanged.	0	0
attempt-0085	nearest-shared-ff-output-unions	micro-0001	832ad01d28df4fb58ad69391a2c0c959a13a7996	f2048e7224960779b1ee1f3f5cccc623f1392f07	2026-08-17T04:04:26.748754+00:00	parameter tying	99.020000%	1723	keep	Union closest shared FF-output scalar groups 199 and 228	Family: parameter tying. Current retained frontier is 1,724 parameters at 99.020000%, a +0.020000 percentage-point margin over 99%. There have been 27 prior macro-attempts in this family and 386 prior micro-trials. The most recent accepted result is attempt-0084/micro-0020 at 1724 parameters and 99.020000%; the most recent failed result is attempt-0081/micro-0007 (discard, 98.970000%). This is a parameterization-preserving compression of the depth-shared feed-forward output map: union flattened coordinates 199 and 228, values -0.0197353885 and -0.0197352841 (difference 1.043e-07), using a weighted mean and integer reconstruction. Hypothesis: residual-stream reconstruction contains near-duplicate scalars distinct from FF-input redundancy, preserving qualification at 1,723 parameters. It is more informative than the next FF-output union (difference 3.807e-06) because it is the minimum-distortion isolated test of the complementary FF map. Official acceptance and rollback are unchanged.	0	0
attempt-0085	nearest-shared-ff-output-unions	micro-0002	799dd97b8fc12e4a183c46cb90c9674dbc1f1d7a	832ad01d28df4fb58ad69391a2c0c959a13a7996	2026-08-17T04:05:50.915280+00:00	parameter tying	99.010000%	1722	keep	Union closest shared FF-output scalar groups 103 and 249	Family: parameter tying. Current retained frontier is 1,723 parameters at 99.020000%, a +0.020000 percentage-point margin over 99%. There have been 27 prior macro-attempts in this family and 387 prior micro-trials. The most recent accepted result is attempt-0085/micro-0001 at 1723 parameters and 99.020000%; the most recent failed result is attempt-0081/micro-0007 (discard, 98.970000%). This is a parameterization-preserving compression of the depth-shared feed-forward output map: union flattened coordinates 103 and 249, values 0.0410498828 and 0.0410536900 (difference 3.807e-06), using a weighted mean and integer reconstruction. Hypothesis: residual-stream reconstruction contains near-duplicate scalars distinct from FF-input redundancy, preserving qualification at 1,722 parameters. It is more informative than the next FF-output union (difference 5.979e-06) because it is the minimum-distortion isolated test of the complementary FF map. Official acceptance and rollback are unchanged.	0	0
attempt-0085	nearest-shared-ff-output-unions	micro-0003	b7052dc159bc5bfa6fd32b0da5dcedd825f61775	799dd97b8fc12e4a183c46cb90c9674dbc1f1d7a	2026-08-17T04:07:09.092979+00:00	parameter tying	99.010000%	1721	keep	Union closest shared FF-output scalar groups 5 and 251	Family: parameter tying. Current retained frontier is 1,722 parameters at 99.010000%, a +0.010000 percentage-point margin over 99%. There have been 27 prior macro-attempts in this family and 388 prior micro-trials. The most recent accepted result is attempt-0085/micro-0002 at 1722 parameters and 99.010000%; the most recent failed result is attempt-0081/micro-0007 (discard, 98.970000%). This is a parameterization-preserving compression of the depth-shared feed-forward output map: union flattened coordinates 5 and 251, values -0.0478998274 and -0.0478938483 (difference 5.979e-06), using a weighted mean and integer reconstruction. Hypothesis: residual-stream reconstruction contains near-duplicate scalars distinct from FF-input redundancy, preserving qualification at 1,721 parameters. It is more informative than the next FF-output union (difference 7.624e-06) because it is the minimum-distortion isolated test of the complementary FF map. Official acceptance and rollback are unchanged.	0	0
attempt-0085	nearest-shared-ff-output-unions	micro-0004	7b821e2f6b51456d08261a0a0ece50bff7c53d10	b7052dc159bc5bfa6fd32b0da5dcedd825f61775	2026-08-17T04:08:26.285314+00:00	parameter tying	99.010000%	1720	keep	Union closest shared FF-output scalar groups 202 and 83	Family: parameter tying. Current retained frontier is 1,721 parameters at 99.010000%, a +0.010000 percentage-point margin over 99%. There have been 27 prior macro-attempts in this family and 389 prior micro-trials. The most recent accepted result is attempt-0085/micro-0003 at 1721 parameters and 99.010000%; the most recent failed result is attempt-0081/micro-0007 (discard, 98.970000%). This is a parameterization-preserving compression of the depth-shared feed-forward output map: union flattened coordinates 202 and 83, values -0.0252074134 and -0.0251997896 (difference 7.624e-06), using a weighted mean and integer reconstruction. Hypothesis: residual-stream reconstruction contains near-duplicate scalars distinct from FF-input redundancy, preserving qualification at 1,720 parameters. It is more informative than the next FF-output union (difference 8.213e-06) because it is the minimum-distortion isolated test of the complementary FF map. Official acceptance and rollback are unchanged.	0	0
