attempt_id	commit	parent_commit	timestamp_utc	accuracy	parameters	status	description	proposal	train_exit	verify_exit
attempt-0087	28e517b2dcd2a7d2fa7f9b474399079bf38b15b2	2753ce4cf4b2ae0a180c09885939688102954562	2026-08-17T04:43:43.085909+00:00	99.030000%	1695	keep	[automation:next-shared-ff-output-union-band] Test the second 20-union difference band in the shared feed-forward output map | Evaluated 10 unions in the second FF-output band. The first 9 qualified and were retained, moving the frontier from 1,704 parameters at 99.01% to 1,695 parameters at 99.03%; micro-0010 proposed 1,694 parameters and scored 98.99%, so it was discarded and rolled back. Outcomes: 9 accepts, 1 scored discard, 0 errors. Compute used checkpoint migration plus 10 official verifications over 11m54s wall clock. Stop reason: first scored failure closed the FF-output path before the 20-trial/30-minute cap.	Family: parameter tying. Current retained frontier is 1,704 parameters at 99.010000%, a +0.010000 percentage-point margin over 99%. There have been 29 prior macro-attempts and 407 prior micro-trials in this family. The most recent accepted result is attempt-0085/micro-0020 at 1,704 parameters and 99.01%; the most recent failed result is attempt-0086/micro-0001, whose next FF-input union scored 3.82% at 1,703 parameters and was rolled back. Hypothesis: the sharp FF-input boundary is site-specific; the FF-output map's next pair has a lower distortion scale and residual reconstruction may tolerate a second band. Ordering remains ascending absolute current FF-output group difference, recomputed after each keep. This parameterization-preserving compression is more informative than excluding the failed FF-input pair because it tests the complementary path under a smaller perturbation and directly distinguishes input versus output sensitivity. Each micro-trial adds one FF-output union and the official runner alone accepts or rolls back. Stop on the first scored discard or error, at 20 micro-trials, or if no pair remains. Compute budget: at most 20 checkpoint migrations and official verifications or 30 wall-clock minutes.		
attempt-0088	28e517b2dcd2a7d2fa7f9b474399079bf38b15b2	28e517b2dcd2a7d2fa7f9b474399079bf38b15b2	2026-08-17T04:44:34.198742+00:00			discard	[automation:third-shared-qkv-union-band] Test a third 20-union difference band in the shared QKV transform | No candidate was scored. The first intended QKV union hit a reproducible implementation error during model construction because the QKV helper's source insertion boundary had become stale after adding FF scalar-pair constants and inserted QKV coordinates into the 256-entry FF-output list, causing an IndexError. This is not capacity evidence. Frontier remained 1,695 parameters at 99.03%; 0 accepts, 0 scored discards, 1 implementation error, negligible compute. Stop reason: recorded implementation error before the 20-trial/30-minute cap.	Family: parameter tying. Current retained frontier is 1,695 parameters at 99.030000%, a +0.030000 percentage-point margin over 99%. There have been 30 prior macro-attempts and 417 prior micro-trials in this family. The most recent accepted result is attempt-0087/micro-0009 at 1,695 parameters and 99.03%; the most recent failed result is attempt-0087/micro-0010, whose next FF-output union scored 98.99% at 1,694 parameters. Shared QKV has retained 40 ordered unions without a scored failure. Hypothesis: attention-transform redundancy extends beyond both measured feed-forward boundaries, so the next ascending-difference QKV band can still reduce parameters while preserving qualification. This parameterization-preserving compression is more informative than excluding either failed FF pair because it returns to the only large tensor site whose ordered path remains open and tests a new difference range. Each micro-trial adds one QKV union and the official runner alone accepts or rolls back. Stop on the first scored discard or error, at 20 micro-trials, or if no pair remains. Compute budget: at most 20 checkpoint migrations and official verifications or 30 wall-clock minutes.		
attempt-0089	971e8c08a289d9676a74c0fa343658ad82b76e2b	28e517b2dcd2a7d2fa7f9b474399079bf38b15b2	2026-08-17T04:56:13.537560+00:00	99.010000%	1687	keep	[automation:third-shared-qkv-union-band-repair] Repair the QKV source splice and resume the third nearest-union band | After repairing the splice, evaluated 9 unions in the third QKV band. The first 8 qualified and were retained, moving the frontier from 1,695 parameters at 99.03% to 1,687 parameters at 99.01%; micro-0009 proposed 1,686 parameters and scored 98.99%, so it was discarded and rolled back. Outcomes: 8 accepts, 1 scored discard, 0 errors after repair. Compute used checkpoint migration plus 9 official verifications over 10m56s wall clock. Stop reason: first scored failure closed the QKV path before the 20-trial/30-minute cap.	Family: parameter tying. Current retained frontier is 1,695 parameters at 99.030000%, a +0.030000 percentage-point margin over 99%. There have been 31 prior macro-attempts and 418 prior micro-trials in this family. The most recent accepted result is attempt-0087/micro-0009 at 1,695 parameters and 99.03%; the most recent failed result is attempt-0088/micro-0001, an implementation error with no score because the QKV helper inserted coordinates into the FF-output pair constant after the source layout changed, causing an IndexError before checkpoint migration. This is the permitted repair of the exact intended QKV candidate: the helper now terminates its splice at FF_IN_TIED_PAIRS; candidate (633,422), ordering, architecture, and official acceptance/rollback are unchanged. Hypothesis: the third nearest-difference QKV band continues the 40 accepted attention unions. Repairing the unscored candidate is more informative than the next alternative because it cleanly separates the implementation defect from QKV capacity at the exact minimum-difference pair. Stop on the first scored discard or further error, at 20 micro-trials, or if no pair remains. Compute budget: at most 20 checkpoint migrations and official verifications or 30 wall-clock minutes.		
attempt-0090	971e8c08a289d9676a74c0fa343658ad82b76e2b	971e8c08a289d9676a74c0fa343658ad82b76e2b	2026-08-17T04:58:18.618249+00:00			discard	[automation:token-unions-after-sensitive-pair] Resume nearest token-matrix unions after excluding its first scored-sensitive pair | The revised token branch stopped on its first eligible alternative. Excluding the prior (55,92) failure exposed groups (93,160); their union proposed 1,686 parameters but scored 0.77%, so it was discarded and rolled back. Frontier remained 1,687 parameters at 99.01%; 0 accepts, 1 scored discard, 0 errors. Compute used one checkpoint migration and one official verification over 1m19s wall clock. Stop reason: first scored failure closed the revised token path before the 20-trial/30-minute cap.	Family: parameter tying. Current retained frontier is 1,687 parameters at 99.010000%, a +0.010000 percentage-point margin over 99%. There have been 32 prior macro-attempts and 427 prior micro-trials in this family. The most recent accepted result is attempt-0089/micro-0008 at 1,687 parameters and 99.01%; the most recent failed result is attempt-0089/micro-0009, whose QKV union scored 98.99%. At the token site specifically, attempt-0081/micro-0006 retained 1,784 parameters and micro-0007's (55,92) union scored 98.97%. Hypothesis: that token failure is coordinate-specific rather than a universal token-difference boundary; excluding exactly (55,92) and resuming ascending current token-group difference can find a neutral alternative. This parameterization-preserving compression is more informative than another QKV exclusion branch because it revisits a distinct representation whose rejected pair and subsequent ordering have not been tested. Each micro-trial adds one eligible token union and the official runner alone accepts or rolls back. Stop on the first scored discard or error, at 20 micro-trials, or if no pair remains. Compute budget: at most 20 checkpoint migrations and official verifications or 30 wall-clock minutes.		
attempt-0091	dcb982756648394fef98bdcf433181b4e7385b32	971e8c08a289d9676a74c0fa343658ad82b76e2b	2026-08-17T05:01:27.193274+00:00	99.000000%	1686	keep	[automation:qkv-unions-after-sensitive-pair] Resume nearest QKV unions after excluding its first scored-sensitive pair | The revised QKV branch evaluated two eligible alternatives. The first qualified at 1,686 parameters and exactly 99.00% and was retained; the second proposed 1,685 parameters and scored 98.99%, so it was discarded and rolled back. Frontier moved from 1,687 to 1,686 parameters; 1 accept, 1 scored discard, 0 errors. Compute used two checkpoint migrations and two official verifications over 2m26s wall clock. Stop reason: first scored failure closed the revised QKV path before the 20-trial/30-minute cap.	Family: parameter tying. Current retained frontier is 1,687 parameters at 99.010000%, a +0.010000 percentage-point margin over 99%. There have been 33 prior macro-attempts and 428 prior micro-trials in this family. The most recent accepted result is attempt-0089/micro-0008 at 1,687 parameters and 99.01%; the most recent failed result is attempt-0090/micro-0001, whose revised token union scored 0.77%. At the QKV site, attempt-0089/micro-0009's (516,694) union scored 98.99%. Hypothesis: the first QKV failure is coordinate-specific rather than a global attention-difference boundary; excluding exactly that pair and resuming ascending current QKV-group difference can find a neutral alternative. This parameterization-preserving compression is more informative than further token exclusions because token alternatives now show a sharp repeated failure, whereas QKV has only one scored boundary after 48 accepted unions. Each micro-trial adds one eligible QKV union and the official runner alone accepts or rolls back. Stop on the first scored discard or error, at 20 micro-trials, or if no pair remains. Compute budget: at most 20 checkpoint migrations and official verifications or 30 wall-clock minutes.		
attempt-0092	e554eb1a7df61aea77cf31474dc370b1dfd7652c	dcb982756648394fef98bdcf433181b4e7385b32	2026-08-17T05:07:04.304930+00:00	99.000000%	1683	keep	[automation:position-unions-after-two-sensitive-pairs] Resume nearest positional unions after excluding both measured sensitive pairs | The positional branch beyond two excluded failures evaluated 4 alternatives. The first 3 qualified and were retained, moving the frontier from 1,686 parameters at 99.00% to 1,683 parameters at 99.00%; micro-0004 proposed 1,682 parameters and scored 98.98%, so it was discarded and rolled back. Outcomes: 3 accepts, 1 scored discard, 0 errors. Compute used four checkpoint migrations and official verifications over 5m01s wall clock. Stop reason: first scored failure closed this revised positional path before the 20-trial/30-minute cap.	Family: parameter tying. Current retained frontier is 1,686 parameters at 99.000000%, a +0.000000 percentage-point margin over 99%. There have been 34 prior macro-attempts and 430 prior micro-trials in this family. The most recent accepted result is attempt-0091/micro-0001 at 1,686 parameters and 99.00%; the most recent failed result is attempt-0091/micro-0002, whose next QKV union scored 98.99%. At the positional site, attempt-0079/micro-0002 retained the last eligible union and micro-0003's (263,315) pair scored 98.91%, following the earlier failed (1,244) pair. Hypothesis: after excluding both measured position-sensitive pairs, the next minimum-difference group union may affect a neutral coordinate set and preserve qualification. This parameterization-preserving compression is more informative than further QKV exclusions because QKV now has two nearby failures, while the positional search has not evaluated beyond its second site-specific boundary. Each micro-trial adds one eligible positional union and the official runner alone accepts or rolls back. Stop on the first scored discard or error, at 20 micro-trials, or if no pair remains. Compute budget: at most 20 checkpoint migrations and official verifications or 30 wall-clock minutes.		
attempt-0093	18a35879736439a6b66630cfa1c0127ae4ae019f	e554eb1a7df61aea77cf31474dc370b1dfd7652c	2026-08-17T05:20:48.469584+00:00	99.000000%	1674	keep	[automation:nearest-final-norm-scale-unions] Reconstruct final LayerNorm scales from groups and exhaust nearest-value unions | Evaluated 10 nearest unions in the complete final-LayerNorm scale search. The first 9 qualified and were retained, moving the frontier from 1,683 parameters at 99.00% to 1,674 parameters at 99.00%; micro-0010 proposed 1,673 parameters and scored 98.96%, so it was discarded and rolled back. Outcomes: 9 accepts, 1 scored discard, 0 errors. Compute used checkpoint migration plus 10 official verifications over 12m00s wall clock. Stop reason: first scored failure closed the final-scale path before the 15-trial/20-minute cap.	Family: parameter tying. Current retained frontier is 1,683 parameters at 99.000000%, a +0.000000 percentage-point margin over 99%. There have been 35 prior macro-attempts and 434 prior micro-trials in this family. The most recent accepted result is attempt-0092/micro-0003 at 1,683 parameters and 99.00%; the most recent failed result is attempt-0092/micro-0004, whose positional union scored 98.98%. Hypothesis: the final LayerNorm's 16 learned scales contain near-duplicate coordinate values independent of the now-bounded matrix, token, and position tensors; reconstructing this scale vector from groups and greedily unioning its closest values can remove parameters while preserving the exact normalization computation before the first union. Ordering is ascending absolute current scale-group difference. This parameterization-preserving normalization substitution is more informative than another exclusion branch because it opens a distinct complete 16-scalar site and can exhaust it within a valid 15-trial cap. Each micro-trial adds one scale union and the official runner alone accepts or rolls back. Stop on the first scored discard or error, at the complete-space cap of 15 micro-trials, or if no pair remains. Compute budget: at most 15 checkpoint migrations and official verifications or 20 wall-clock minutes.		
attempt-0094	df651e1438408b7b9cdfcedbc3b41f2c232aa812	18a35879736439a6b66630cfa1c0127ae4ae019f	2026-08-17T05:25:05.257413+00:00	99.040000%	1673	keep	[automation:nearest-block0-preff-scale-unions] Reconstruct block-0 pre-FF LayerNorm scales and exhaust nearest unions | The block-0 pre-FF scale search evaluated two nearest unions. The first qualified at 1,673 parameters and 99.04% and was retained; the second proposed 1,672 parameters and scored 97.90%, so it was discarded and rolled back. Frontier moved from 1,674 to 1,673 parameters; 1 accept, 1 scored discard, 0 errors. Compute used two checkpoint migrations and official verifications over 2m29s wall clock. Stop reason: first scored failure closed this scale path before the 15-trial/20-minute cap.	Family: parameter tying. Current retained frontier is 1,674 parameters at 99.000000%, a +0.000000 percentage-point margin over 99%. There have been 36 prior macro-attempts and 444 prior micro-trials in this family. The most recent accepted result is attempt-0093/micro-0009 at 1,674 parameters and 99.00%; the most recent failed result is attempt-0093/micro-0010, whose next final-normalization scale union scored 98.96%. Hypothesis: block 0's pre-feed-forward LayerNorm has local scale redundancy distinct from final rescaling; reconstructing its 16 scales from groups and unioning nearest values can reduce count while leaving all 16 biases independent. Ordering is ascending absolute current scale-group difference. This parameterization-preserving normalization substitution is more informative than excluding the failed final-scale pair because it opens a distinct upstream site and isolates scales from biases. Each micro-trial adds one scale union and the official runner alone accepts or rolls back. Stop on the first scored discard or error, at the complete-space cap of 15 micro-trials, or if no pair remains. Compute budget: at most 15 checkpoint migrations and official verifications or 20 wall-clock minutes.		
attempt-0095	a1dfac6cb503f577ebebcb35e93ea9788786fa40	df651e1438408b7b9cdfcedbc3b41f2c232aa812	2026-08-17T05:28:48.286694+00:00	99.010000%	1672	keep	[automation:nearest-block0-preff-bias-unions] Exhaust nearest unions in block-0 pre-FF LayerNorm biases with scales fixed | The block-0 pre-FF bias search evaluated two nearest unions. The first qualified at 1,672 parameters and 99.01% and was retained; the second proposed 1,671 parameters and scored 98.78%, so it was discarded and rolled back. Frontier moved from 1,673 to 1,672 parameters; 1 accept, 1 scored discard, 0 errors. Compute used two checkpoint migrations and official verifications over 2m33s wall clock. Stop reason: first scored failure closed this bias path before the 15-trial/20-minute cap.	Family: parameter tying. Current retained frontier is 1,673 parameters at 99.040000%, a +0.040000 percentage-point margin over 99%. There have been 37 prior macro-attempts and 446 prior micro-trials in this family. The most recent accepted result is attempt-0094/micro-0001 at 1,673 parameters and 99.04%; the most recent failed result is attempt-0094/micro-0002, whose second block-0 pre-FF scale union scored 97.90%. Hypothesis: the same LayerNorm's additive biases have local redundancy distinct from its sharp scale boundary; reconstructing the 16 biases from groups and unioning nearest values can reduce count while holding all learned scales fixed. Ordering is ascending absolute current bias-group difference. This parameterization-preserving normalization substitution is more informative than excluding the failed scale pair because it cleanly separates additive centering from multiplicative sensitivity. Each micro-trial adds one bias union and the official runner alone accepts or rolls back. Stop on the first scored discard or error, at the complete-space cap of 15 micro-trials, or if no pair remains. Compute budget: at most 15 checkpoint migrations and official verifications or 20 wall-clock minutes.		
attempt-0096	a1dfac6cb503f577ebebcb35e93ea9788786fa40	a1dfac6cb503f577ebebcb35e93ea9788786fa40	2026-08-17T05:32:13.746772+00:00			discard	[automation:nearest-block0-preattn-scale-unions] Reconstruct block-0 pre-attention LayerNorm scales and exhaust nearest unions | The block-0 pre-attention scale path stopped on its first union. The 1,671-parameter candidate scored 98.90%, so it was discarded and rolled back; frontier remained 1,672 parameters at 99.01%. Outcomes: 0 accepts, 1 scored discard, 0 errors. Compute used one checkpoint migration and official verification over 1m22s wall clock. Stop reason: first scored failure closed this scale path before the 15-trial/20-minute cap.	Family: parameter tying. Current retained frontier is 1,672 parameters at 99.010000%, a +0.010000 percentage-point margin over 99%. There have been 38 prior macro-attempts and 448 prior micro-trials in this family. The most recent accepted result is attempt-0095/micro-0001 at 1,672 parameters and 99.01%; the most recent failed result is attempt-0095/micro-0002, whose second block-0 pre-FF bias union scored 98.78%. Hypothesis: block 0's pre-attention LayerNorm has local scale redundancy distinct from the bounded pre-FF site; reconstructing its 16 scales from groups and unioning nearest values can reduce count while preserving its two already-fixed zero biases. Ordering is ascending absolute current scale-group difference. This parameterization-preserving normalization substitution is more informative than further pre-FF exclusions because it opens the complementary attention-input site and isolates scales. Each micro-trial adds one scale union and the official runner alone accepts or rolls back. Stop on the first scored discard or error, at the complete-space cap of 15 micro-trials, or if no pair remains. Compute budget: at most 15 checkpoint migrations and official verifications or 20 wall-clock minutes.		
