attempt_id	commit	parent_commit	timestamp_utc	accuracy	parameters	status	description	proposal	train_exit	verify_exit
attempt-0181	42fddbcd6337a8107d10fb87d967c054ecc5afcc	e722928891750bf9d4919708e3b08852d99a3b79	2026-08-17T12:45:42.834965+00:00	99.010000%	1486	keep	[automation:token-skip-three-sensitive-pairs] Continue token unions after four retained reductions | The third-skip token band evaluated seven ordered unions. Six qualified and reduced the frontier from 1,492 to 1,486 parameters; micro-0007 proposed 1,485, failed qualification, and was rolled back. Outcomes: 6 accepts, 1 scored nonqualification, 0 errors. Compute used seven official migrations/verifications over about 8m20s. Stop reason: first scored discard before the 20-trial/25-minute cap.	Family: parameter tying. Current retained frontier is 1,492 parameters at 99.000000%, exactly threshold. There have been 78 prior macro-attempts and 656 prior micro-trials in this family. The most recent accepted result is attempt-0180/micro-0004 at 1,492/99.00%; the most recent failed result is attempt-0180/micro-0005, where token pair 142/164 scored 98.99% at 1,491. Three measured token sensitive pairs are excluded. Hypothesis: the preceding four accepts show remaining token redundancy, so the next minimum-difference groups may qualify after skipping the one-example failure. The helper adds one ordered token union per official micro-trial with runner-only retention/rollback. Stop at first scored discard/error, no pair, 20 trials, or 25 minutes. This is more informative than changing mechanism immediately because the token skip-path just demonstrated positive yield.		
attempt-0182	42fddbcd6337a8107d10fb87d967c054ecc5afcc	42fddbcd6337a8107d10fb87d967c054ecc5afcc	2026-08-17T12:47:40.188995+00:00			discard	[automation:token-skip-four-sensitive-pairs] Continue token unions after six retained reductions | The next eligible token union was tested once at 1,485 parameters and did not qualify, so it was discarded and the 1,486/99.01% incumbent restored. Outcomes: 0 accepts, 1 scored nonqualification, 0 errors; one official migration/verification in about 1m10s. Stop reason: first scored discard before the 20-trial/25-minute cap. The zero-yield band closes the immediate token path and motivates a normalization-tensor rotation.	Family: parameter tying. Current retained frontier is 1,486 parameters at 99.010000%, a +0.010000-point margin. There have been 79 prior macro-attempts and 663 prior micro-trials in this family. The most recent accepted result is attempt-0181/micro-0006 at 1,486/99.01%; the most recent failed result is attempt-0181/micro-0007, where token pair 21/44 scored 98.98% at 1,485. Four measured token sensitive pairs are excluded. Hypothesis: the preceding six accepts show another adjacent token band may qualify after skipping this isolated failure. The helper adds one minimum-difference token union per official micro-trial with runner-only retention/rollback. Stop at first scored discard/error, no pair, 20 trials, or 25 minutes. This is more informative than rotating after one failure because current token yield remains high.		
attempt-0183	b4fadadb0c015d081ae83a98708d3ee4027f54bf	42fddbcd6337a8107d10fb87d967c054ecc5afcc	2026-08-17T12:55:16.903803+00:00	99.110000%	1481	keep	[automation:final-norm-skip-sensitive-pair] Probe final-normalization scales beyond the measured failure | The final-normalization skip-path evaluated four eligible scale unions; all four qualified, reducing the frontier from 1,486 to 1,482 parameters. No scored discards or errors occurred. After micro-0004, no eligible adjacent scale pair remained because the only remaining boundary is the excluded measured failure. Compute used four official migrations/verifications over about 5m10s. Stop reason: exhausted the declared eligible search space before the six-trial cap.	Family: parameter tying. Current retained frontier is 1,486 parameters at 99.010000%, a +0.010000-point margin. There have been 80 prior macro-attempts and 664 prior micro-trials in this family. The most recent accepted result is attempt-0181/micro-0006 at 1,486/99.01%; the most recent failed result is attempt-0182/micro-0001, where a token union scored 98.99%. In final normalization, pair 0/2 scored 98.96% in attempt-0093/micro-0010 and is excluded. Hypothesis: that failure is coordinate-specific, so another remaining final-scale group pair may qualify after the model’s extensive matrix compression. The helper’s insertion boundary is proactively corrected to the delimiter before BLOCK0_LN2_WEIGHT_TIED_PAIRS, then it adds one ordered scale union per official micro-trial with runner-only retention/rollback. Stop at first scored discard/error, no pair, six trials (the complete remaining group-pair path), or 10 minutes. This is more informative than another zero-yield token skip because it opens a small, exactly bounded normalization site.		
attempt-0184	b4fadadb0c015d081ae83a98708d3ee4027f54bf	b4fadadb0c015d081ae83a98708d3ee4027f54bf	2026-08-17T12:57:30.284322+00:00			discard	[automation:block0-preff-scale-skip-sensitive-pair] Probe block-0 pre-FF scales beyond their measured failure | The next eligible block-0 pre-FF scale union was tested once at 1,480 parameters and did not qualify, so it was discarded and the corrected 1,481/99.11% incumbent restored. Outcomes: 0 accepts, 1 scored nonqualification, 0 errors; one official migration/verification in about 1m05s. Stop reason: first scored discard before the 14-trial/18-minute cap.	Family: parameter tying. Corrected current retained frontier is 1,481 parameters at 99.110000%, a +0.110000-point margin; attempt 183 retained five unions despite its end summary understating four. There have been 81 prior macro-attempts and 669 prior micro-trials in this family. The most recent accepted result is attempt-0183/micro-0005 at 1,481/99.11%; the most recent failed result is attempt-0182/micro-0001, where a token union scored 98.99%. In block-0 pre-FF scales, pair 2/8 scored 97.90% in attempt-0094 and is excluded. Hypothesis: the recovered margin and changed matrix frontier make another scale pair compressible while the prior failure remains coordinate-specific. The helper adds one ordered scale union per official micro-trial with runner-only retention/rollback. Stop at first scored discard/error, no pair, 14 trials, or 18 minutes. This is more informative than revisiting exhausted final scales because it opens a distinct normalization site with one prior accept.		
attempt-0185	05875f033cfc959c59f855cfc2b634ebb11116fc	b4fadadb0c015d081ae83a98708d3ee4027f54bf	2026-08-17T13:02:00.934052+00:00	99.200000%	1479	keep	[automation:block0-preff-bias-skip-sensitive-pair] Probe block-0 pre-FF biases beyond their measured failure | The block-0 pre-FF bias skip-path evaluated three ordered unions. Two qualified and reduced the frontier from 1,481 to 1,479 parameters; micro-0003 proposed 1,478, failed qualification, and was rolled back. Outcomes: 2 accepts, 1 scored nonqualification, 0 errors. Compute used three official migrations/verifications over about 3m10s. Stop reason: first scored discard before the 13-trial/17-minute cap.	Family: parameter tying. Current retained frontier is 1,481 parameters at 99.110000%, a +0.110000-point margin. There have been 82 prior macro-attempts and 670 prior micro-trials in this family. The most recent accepted result is attempt-0183/micro-0005 at 1,481/99.11%; the most recent failed result is attempt-0184/micro-0001, where a block-0 pre-FF scale union scored 98.04%. In this bias tensor, pair 5/8 scored 98.78% in attempt-0095 and is excluded. Hypothesis: additive centering has a different sensitivity structure from scales, and the recovered margin may support the next bias union. The helper adds one ordered bias union per official micro-trial with runner-only retention/rollback. Stop at first scored discard/error, no pair, 13 trials, or 17 minutes. This is more informative than another scale skip because the last scale candidate failed by nearly a full point.		
attempt-0186	05875f033cfc959c59f855cfc2b634ebb11116fc	05875f033cfc959c59f855cfc2b634ebb11116fc	2026-08-17T13:03:53.300501+00:00			discard	[automation:block0-preff-bias-skip-two-sensitive-pairs] Continue block-0 pre-FF bias unions with recovered margin | The next eligible block-0 pre-FF bias union was tested once at 1,478 parameters and did not qualify, so it was discarded and the 1,479/99.20% incumbent restored. Outcomes: 0 accepts, 1 scored nonqualification, 0 errors; one official migration/verification in about 1m05s. Stop reason: first scored discard before the 12-trial/16-minute cap.	Family: parameter tying. Current retained frontier is 1,479 parameters at 99.200000%, a +0.200000-point margin. There have been 83 prior macro-attempts and 673 prior micro-trials in this family. The most recent accepted result is attempt-0185/micro-0002 at 1,479/99.20%; the most recent failed result is attempt-0185/micro-0003, where bias pair 14/1 scored 98.75% at 1,478. Two measured sensitive bias pairs are excluded. Hypothesis: the large recovered margin and two prior accepts support another distinct bias union after skipping the sharp coordinate-specific failure. The helper adds one ordered bias union per official micro-trial with runner-only retention/rollback. Stop at first scored discard/error, no pair, 12 trials, or 16 minutes. This is more informative than switching immediately because current conditions changed accuracy by +0.09 points within the last macro.		
attempt-0187	a86d68b523740a382c63e2c86f61f40af5539686	05875f033cfc959c59f855cfc2b634ebb11116fc	2026-08-17T13:31:29.379834+00:00	99.210000%	1459	keep	[automation:qkv-revisit-after-cross-tensor-compression] Revisit QKV unions after 117 cross-tensor reductions | The QKV revisit reached its declared 20-trial cap with all 20 ordered unions qualifying. The retained frontier moved from 1,479 to 1,459 parameters; no scored discards or errors occurred. Compute used 20 official migrations/verifications over about 24m20s. Stop reason: hard micro-trial cap, not a measured failure boundary. This confirms cross-tensor compression materially reopened QKV redundancy.	Family: parameter tying. Current retained frontier is 1,479 parameters at 99.200000%, a +0.200000-point margin. There have been 84 prior macro-attempts and 674 prior micro-trials in this family. The most recent accepted result is attempt-0185/micro-0002 at 1,479/99.20%; the most recent failed result is attempt-0186/micro-0001, where a normalization-bias union scored 98.08%. The most recent QKV band ended in attempt-0165 after pair 571/651 scored 98.99%; that pair and all earlier sensitive QKV pairs are excluded. Hypothesis: 117 retained reductions in FF, token, and normalization tensors plus recovered margin materially changed residual routing enough to reopen QKV compression. The helper adds one minimum-difference eligible QKV union per official micro-trial with runner-only retention/rollback. Stop at first scored discard/error, no pair, 20 trials, or 25 minutes. This is more informative than another normalization variant because it retests a high-capacity tensor only after materially changed conditions.		
attempt-0188	e3da88bd751cbdc51b33f9fe0c581ac995dc0c90	a86d68b523740a382c63e2c86f61f40af5539686	2026-08-17T13:38:30.728446+00:00	99.210000%	1454	keep	[automation:qkv-five-trial-continuation] Continue reopened QKV compression in a five-trial band | All five QKV unions in the shortened continuation qualified, reducing the frontier from 1,459 to 1,454 parameters. No scored discards or errors occurred. Compute used five official migrations/verifications over about 6m10s. Stop reason: predeclared five-trial cap, preserving remaining macro budget for cross-tensor tests.	Family: parameter tying. Current retained frontier is 1,459 parameters at 99.210000%, a +0.210000-point margin. There have been 85 prior macro-attempts and 694 prior micro-trials in this family. The most recent accepted result is attempt-0187/micro-0020 at 1,459/99.21%; the most recent failed result remains attempt-0186/micro-0001 because attempt 187 had no failures. Hypothesis: the fully qualifying prior band indicates the next QKV groups remain compressible. The helper adds one ordered eligible union per official micro-trial with runner-only retention/rollback. Stop at first scored discard/error, no pair, five trials, or seven minutes. The shorter cap is more informative for the remaining run budget than another 20-trial band because it preserves room to test reopened FF and token tensors while still sampling the strongest current path.		
attempt-0189	d0fc15a7c5df0b40e5a915af616d83a5a4575072	e3da88bd751cbdc51b33f9fe0c581ac995dc0c90	2026-08-17T13:46:09.467123+00:00	99.040000%	1450	keep	[automation:ff-output-five-trial-revisit] Revisit FF-output unions in a five-trial cross-tensor band | The five-trial FF-output revisit evaluated five ordered unions. Four qualified and reduced the frontier from 1,454 to 1,450 parameters; the fifth proposed 1,449, failed qualification, and was rolled back. Outcomes: 4 accepts, 1 scored nonqualification, 0 errors. Compute used five official migrations/verifications over about 6m05s. Stop reason: first scored discard on the final scheduled trial.	Family: parameter tying. Current retained frontier is 1,454 parameters at 99.210000%, a +0.210000-point margin. There have been 86 prior macro-attempts and 699 prior micro-trials in this family. The most recent accepted result is attempt-0188/micro-0005 at 1,454/99.21%; the most recent failed result is attempt-0186/micro-0001, while the last FF-output failure was attempt-0174/micro-0001 pair 109/123 at 98.98%. That pair and seven earlier sensitive FF-output pairs are excluded. Hypothesis: 64 cross-tensor reductions and recovered margin reopen the next FF-output band. The helper adds one ordered eligible union per official micro-trial with runner-only retention/rollback. Stop at first scored discard/error, no pair, five trials, or seven minutes. This is more informative than another longer QKV band because it tests whether reopening generalizes across tensors within the remaining macro budget.		
attempt-0190	00947b23ac6e15be44538474fa0868c7504e55fe	d0fc15a7c5df0b40e5a915af616d83a5a4575072	2026-08-17T13:53:36.128911+00:00	99.040000%	1445	keep	[automation:ff-input-five-trial-revisit] Revisit FF-input unions in a five-trial cross-tensor band | All five FF-input revisit unions qualified, reducing the frontier from 1,450 to 1,445 parameters. No scored discards or errors occurred. Compute used five official migrations/verifications over about 6m10s. Stop reason: predeclared five-trial cap, preserving the final ten macro-attempts for alternating boundary probes.	Family: parameter tying. Current retained frontier is 1,450 parameters at 99.040000%, a +0.040000-point margin. There have been 87 prior macro-attempts and 704 prior micro-trials in this family. The most recent accepted result is attempt-0189/micro-0004 at 1,450/99.04%; the most recent failed result is attempt-0189/micro-0005, while the last FF-input failure was attempt-0178/micro-0002 pair 153/71 at 98.99%. That pair and two earlier sensitive FF-input pairs are excluded. Hypothesis: 46 subsequent cross-tensor reductions reopen FF-input redundancy. The helper adds one ordered eligible union per official micro-trial with runner-only retention/rollback. Stop at first scored discard/error, no pair, five trials, or seven minutes. This is more informative than immediately continuing FF output because it tests the generality of reopening within the final macro budget.		
attempt-0191	923ed6b3d0d7741d502c582ed5656aecf15c37a0	00947b23ac6e15be44538474fa0868c7504e55fe	2026-08-17T13:58:28.248249+00:00	99.060000%	1442	keep	[automation:token-three-trial-revisit] Revisit token unions in a three-trial cross-tensor band | All three token revisit unions qualified, reducing the frontier from 1,445 to 1,442 parameters. No scored discards or errors occurred. Compute used three official migrations/verifications over about 3m40s. Stop reason: predeclared three-trial cap.	Family: parameter tying. Current retained frontier is 1,445 parameters at 99.040000%, a +0.040000-point margin. There have been 88 prior macro-attempts and 709 prior micro-trials in this family. The most recent accepted result is attempt-0190/micro-0005 at 1,445/99.04%; the most recent failed result is attempt-0189/micro-0005, while the last token failure was attempt-0182/micro-0001 pair 16/18 at 98.99%. That pair and four earlier token failures are excluded. Hypothesis: 41 cross-tensor reductions reopen the next token boundary. The helper adds one ordered eligible token union per official micro-trial with runner-only retention/rollback. Stop at first scored discard/error, no pair, three trials, or five minutes. The three-trial cap balances direct boundary evidence with breadth across the final macro budget.		
attempt-0192	08de250fbf12c37ab353e602a524027af53cbbc7	923ed6b3d0d7741d502c582ed5656aecf15c37a0	2026-08-17T14:04:03.930665+00:00	99.060000%	1439	keep	[automation:position-three-trial-revisit] Revisit position unions in a three-trial cross-tensor band | All three positional revisit unions qualified, reducing the frontier from 1,442 to 1,439 parameters. No scored discards or errors occurred. Compute used three official migrations/verifications over about 3m40s. Stop reason: predeclared three-trial cap; cross-tensor reopening generalized to the positional table.	Family: parameter tying. Current retained frontier is 1,442 parameters at 99.060000%, a +0.060000-point margin. There have been 89 prior macro-attempts and 712 prior micro-trials in this family. The most recent accepted result is attempt-0191/micro-0003 at 1,442/99.06%; the most recent failed result is attempt-0189/micro-0005, while the last positional failure was attempt-0179/micro-0001 pair 182/70 at 98.97%. That pair and two earlier positional failures are excluded. Hypothesis: 54 intervening cross-tensor reductions reopen positional scalar redundancy. The helper adds one ordered eligible position union per official micro-trial with runner-only retention/rollback. Stop at first scored discard/error, no pair, three trials, or five minutes. This is more informative than repeating another already-positive tensor because it tests the generality of boundary reopening.		
attempt-0193	4741929407b3884858779a29fc2c44f701564092	08de250fbf12c37ab353e602a524027af53cbbc7	2026-08-17T14:09:51.923665+00:00	99.130000%	1436	keep	[automation:qkv-final-band-one] Run the first final three-trial QKV band | Three bounded QKV trials all qualified, reducing the observed retained frontier from 1,439 to 1,436 parameters; the last trial retained 99.130000%. The cap stopped the automation after exactly three official micro-trials.	Family: parameter tying. Current retained frontier is 1,439 parameters at 99.060000%, a +0.060000-point margin. There have been 90 prior macro-attempts and 715 prior micro-trials in this family. The most recent accepted result is attempt-0192/micro-0003 at 1,439/99.06%; the most recent failed result remains attempt-0189/micro-0005 because attempts 190-192 had no failures. Hypothesis: QKV remains compressible after another 20 cross-tensor reductions. The helper adds one ordered eligible QKV union per official micro-trial with runner-only retention/rollback. Stop at first scored discard/error, no pair, three trials, or five minutes. This is more informative than a longer band because the final macro budget is explicitly alternating sites to measure breadth.		
attempt-0194	52b4742d0d8905544e124e414cde7543004cb092	4741929407b3884858779a29fc2c44f701564092	2026-08-17T14:14:02.262206+00:00	99.090000%	1435	keep	[automation:ffout-final-band-one] Bounded three-trial nearest-union probe of the shared FF-output map | The first FF-output union qualified at 1,435 parameters and 99.090000%; the next minimum-distance eligible union was discarded at 1,434 parameters and 98.910000%. The official runner restored the accepted 1,435-parameter incumbent and the stop-on-discard rule closed this path after two trials.	Family: parameter tying. Current retained frontier is 1,436 parameters at 99.130000%, a +0.130000 percentage-point margin over 99%. There have been 91 prior macro-attempts in this family and 718 prior micro-trials. The most recent accepted result is attempt-0193/micro-0003 at 1,436 parameters and 99.13%; the most recent failed result is attempt-0189/micro-0005, an FF-output union discarded at 98.96%. This macro tests at most three sequential minimum-distance scalar unions in the depth-shared FF-output map, excluding every unchanged pair already rejected. Hypothesis: cross-tensor compression since the earlier FF-output boundary may have altered the verification realization enough to expose a narrow remaining redundancy band. This is more informative than the nearest untested alternative because each micro-trial selects the least-distorting eligible FF-output union before the runner result is known, directly measuring the current local boundary while limiting adaptive multiplicity to three. Stop at the first discard/error, exhaustion, or the declared cap; official acceptance and rollback remain solely controlled by the runner.		
