attempt_id	commit	parent_commit	timestamp_utc	accuracy	parameters	status	description	proposal	train_exit	verify_exit
attempt-0141	06d88307073db782499be4f6c2ff2d17294940e2	06d88307073db782499be4f6c2ff2d17294940e2	2026-08-17T07:23:09.593396+00:00			discard	[automation:qkv-unions-under-blended-gelu] Retest nearest QKV scalar unions under retained blended GELU | Under retained blended GELU, QKV pair 555/517 again scored 98.99% at 1,670 parameters and was discarded. Outcomes: 0 accepts, 1 scored nonqualification, 0 errors; frontier remained 1,671/99.00%. Compute used one migration and official verification in about 1m22s. Stop reason: first scored discard before the 20-trial/25-minute cap; the activation change did not shift this one-example QKV boundary.	Family: parameter tying. Current retained frontier is 1,671 parameters at 99.000000%, exactly threshold (+0.000000 margin). There have been 46 prior macro-attempts and 450 prior micro-trials in this family. The most recent accepted relevant result is attempt-0139/micro-0001 at 1,671/99.00%; the most recent failed QKV result is attempt-0091/micro-0002, where pair 555/517 scored 98.99% under exact GELU. Hypothesis: the retained activation blend changes downstream residual reconstruction enough to recover that one-example QKV boundary. The helper excludes already measured pair 516/694, orders remaining QKV group pairs by absolute current difference, adds one union per official micro-trial, and relies exclusively on runner retention/rollback. Stop on first scored discard or error, no pair, 20 micro-trials, or 25 wall-clock minutes. This is more informative than the next QKV pair because 555/517 is both minimum-distortion and previously only one example below qualification.		
attempt-0142	06d88307073db782499be4f6c2ff2d17294940e2	06d88307073db782499be4f6c2ff2d17294940e2	2026-08-17T07:29:32.938215+00:00			discard	[automation:qkv-union-gelu-compensation] Scan four GELU blends around the one-example QKV-union boundary | Tested QKV union 555/517 with GELU-blend alphas 0.25, 0.75, 0.125, and 0.875. Every 1,670-parameter candidate scored exactly 98.99%, so all were discarded and rolled back; frontier stayed 1,671/99.00%. Outcomes: 0 accepts, 4 scored nonqualifications, 0 errors. Compute used four migrations and official verifications over about 5m10s. Stop reason: reached the declared four-point/eight-minute boundary, demonstrating this failed example is insensitive to the tested activation blend.	Family: feed-forward width. Current retained frontier is 1,671 parameters at 99.000000%, exactly threshold (+0.000000 margin). There have been 21 prior macro-attempts in this family. The most recent accepted result is attempt-0139/micro-0001 at 1,671/99.00%; the most recent failed result is attempt-0141/micro-0001, where QKV pair 555/517 scored 98.99% at 1,670 under alpha=0.5; the same pair scored 98.99% under exact GELU in attempt-0091. Hypothesis: a modest off-center activation blend can compensate the single changed QKV scalar while preserving the learned function. The helper tests fixed alphas 0.25, 0.75, 0.125, 0.875, one official micro-trial each. Stop on first acceptance because all candidates share 1,670 parameters, after four trials, on error, or after eight wall-clock minutes. This is more informative than a dense activation grid because the symmetric widening order samples the largest distinct offsets around measured alpha=0/0.5 failures within a strict cap.		
attempt-0143	5eb6f5782a6c1c8479afa160ec16cf74dda506a3	06d88307073db782499be4f6c2ff2d17294940e2	2026-08-17T07:33:08.873956+00:00	99.040000%	1670	keep	[automation:qkv-union-temperature-compensation] Scan attention temperature around one-example QKV-union boundary | Tested attention-temperature multipliers 0.99 and 1.01 with QKV union 555/517. The 0.99 candidate scored 98.89% and was discarded; 1.01 scored 99.04% at 1,670 parameters and was retained, moving the frontier down one parameter and restoring +0.04 points of margin. Outcomes: 1 accept, 1 scored nonqualification, 0 errors. Compute used two migrations/verifications over about 2m35s. Stop reason: acceptance left no eligible equal-count multiplier before the eight-trial/12-minute cap.	Family: attention organization. Current retained frontier is 1,671 parameters at 99.000000%, exactly threshold (+0.000000 margin). There have been 17 prior macro-attempts in this family. The most recent accepted result is attempt-0020 at 3,168 parameters/99.94%; the most recent failed result is attempt-0142, where four activation blends with QKV union 555/517 all scored 98.99% at 1,670. Hypothesis: that stable single failure reflects an attention-routing margin that a small temperature change can correct. The helper tests fixed logit multipliers 0.99, 1.01, 0.98, 1.02, 0.95, 1.05, 0.90, 1.10, alternating outward from one; each uses the identical QKV union and official runner. Stop on first acceptance because all share 1,670 parameters, after eight trials, on error, or after 12 wall-clock minutes. This is more informative than changing another model component because it directly calibrates the mechanism affected by the tie.		
attempt-0144	8e78fee8a3ce57b537915369632113a02c38470e	5eb6f5782a6c1c8479afa160ec16cf74dda506a3	2026-08-17T07:57:59.017524+00:00	99.020000%	1652	keep	[automation:next-qkv-unions-at-temperature-101] Continue nearest QKV unions at retained 1.01 attention temperature | At retained 1.01 attention temperature, the minimum-difference QKV policy evaluated 19 pairs. The first 18 qualified and reduced the frontier from 1,670 to 1,652 parameters; retained accuracy ended at 99.02%. Micro-0019, pair 564/699 (difference 6.846e-05), proposed 1,651 and scored 98.99%, so it was discarded and rolled back. Outcomes: 18 accepts, 1 scored nonqualification, 0 errors. Compute used 19 migrations/verifications over about 24 minutes. Stop reason: first scored discard, just before the 20-trial/25-minute cap.	Family: parameter tying. Current retained frontier is 1,670 parameters at 99.040000%, a +0.040000 percentage-point margin over 99%. There have been 47 prior macro-attempts and 451 prior micro-trials in this family. The most recent accepted relevant result is attempt-0143/micro-0002 at 1,670/99.04%; the most recent failed result is attempt-0143/micro-0001, where temperature 0.99 scored 98.89%. QKV pair 555/517 is now retained, and previously failed pair 516/694 remains excluded. Hypothesis: the calibrated 1.01 temperature and restored margin make the next minimum-difference QKV groups compressible. The helper orders adjacent current scalar groups by absolute difference, adds one union per official micro-trial, and relies only on runner acceptance/rollback. Stop on first scored discard or error, no pair, 20 trials, or 25 wall-clock minutes. The next pair is more informative than any later alternative because it is the least checkpoint perturbation under the new retained conditions.		
attempt-0145	826490268493d9f986aab30be6f6e73cbe5374c3	8e78fee8a3ce57b537915369632113a02c38470e	2026-08-17T08:01:59.457916+00:00	99.020000%	1651	keep	[automation:next-qkv-temperature-calibration] Calibrate temperature around QKV pair 564/699 boundary | Calibrated QKV pair 564/699 around temperature 1.01. Absolute multiplier 1.005 scored 98.98% and was discarded; 1.015 scored 99.02% at 1,651 parameters and was retained. Frontier improved by one parameter with unchanged retained accuracy. Outcomes: 1 accept, 1 scored nonqualification, 0 errors; two migrations/verifications over about 2m35s. Stop reason: acceptance exhausted equal-count eligibility before the six-trial/nine-minute cap.	Family: attention organization. Current retained frontier is 1,652 parameters at 99.020000%, a +0.020000 percentage-point margin over 99%. There have been 18 prior macro-attempts in this family. The most recent accepted relevant result is attempt-0144/micro-0018 at 1,652/99.02%; the most recent failed result is attempt-0144/micro-0019, where QKV pair 564/699 scored 98.99% at 1,651 under temperature 1.01. Hypothesis: the next tied scalar shifts one routing margin that a local temperature adjustment can restore. The helper tests absolute multipliers 1.005, 1.015, 1.000, 1.020, 0.995, 1.025, ordered outward around 1.01, using the identical tie and official runner. Stop on first acceptance because all share 1,651 parameters, after six trials, on error, or after nine wall-clock minutes. This is more informative than a wider temperature because it resolves the measured local boundary with the smallest changes first.		
attempt-0146	462c6c42e25b52b5c63baa6f55133167cf5e9205	826490268493d9f986aab30be6f6e73cbe5374c3	2026-08-17T08:17:47.674943+00:00	99.000000%	1640	keep	[automation:next-qkv-unions-at-temperature-1015] Continue nearest QKV unions at retained 1.015 temperature | At retained temperature 1.015, the next QKV band evaluated 12 pairs. Eleven qualified, reducing the frontier from 1,651 to 1,640 parameters; retained accuracy ended exactly at 99.00%. Micro-0012, pair 608/539 (difference 7.761e-05), proposed 1,639 and scored 98.99%, so it was discarded. Outcomes: 11 accepts, 1 scored nonqualification, 0 errors. Compute used 12 migrations/verifications over about 15m30s. Stop reason: first scored discard before the 20-trial/25-minute cap.	Family: parameter tying. Current retained frontier is 1,651 parameters at 99.020000%, a +0.020000 percentage-point margin over 99%. There have been 48 prior macro-attempts and 470 prior micro-trials in this family. The most recent accepted relevant result is attempt-0145/micro-0002 at 1,651/99.02%; the most recent failed result is attempt-0145/micro-0001 at 98.98% with temperature 1.005. QKV pair 564/699 is now retained and pair 516/694 remains excluded. Hypothesis: the calibrated 1.015 temperature supports another bounded band of minimum-difference QKV unions. The helper adds one nearest adjacent scalar-group union per official micro-trial with runner-only retention/rollback. Stop on first scored discard or error, no pair, 20 trials, or 25 wall-clock minutes. The next pair is more informative than later alternatives because it is the least checkpoint perturbation under current retained conditions.		
attempt-0147	462c6c42e25b52b5c63baa6f55133167cf5e9205	462c6c42e25b52b5c63baa6f55133167cf5e9205	2026-08-17T08:26:22.425688+00:00			discard	[automation:qkv-608-539-temperature-calibration] Calibrate temperature around QKV pair 608/539 boundary | Tested QKV pair 608/539 at absolute temperatures 1.0125, 1.0175, 1.010, 1.020, 1.005, and 1.025. Scores ranged from 98.92% to 98.99%; none qualified, so all were discarded and the 1,640/99.00% incumbent was restored. Outcomes: 0 accepts, 6 scored nonqualifications, 0 errors. Compute used six migrations/verifications over about 7m45s. Stop reason: reached the declared six-trial/nine-minute boundary, closing local temperature compensation for this pair.	Family: attention organization. Current retained frontier is 1,640 parameters at 99.000000%, exactly threshold (+0.000000 margin). There have been 19 prior macro-attempts in this family. The most recent accepted relevant result is attempt-0146/micro-0011 at 1,640/99.00%; the most recent failed result is attempt-0146/micro-0012, where QKV pair 608/539 scored 98.99% at 1,639 under temperature 1.015. Hypothesis: a local upward or downward temperature shift can recover the single routing error. The helper tests 1.0125, 1.0175, 1.010, 1.020, 1.005, 1.025, ordered outward around 1.015, with the identical tie and official runner. Stop on first acceptance because all share 1,639 parameters, after six trials, on error, or after nine wall-clock minutes. This is more informative than a new tensor tie because it resolves the measured boundary with smaller functional changes first.		
attempt-0148	462c6c42e25b52b5c63baa6f55133167cf5e9205	462c6c42e25b52b5c63baa6f55133167cf5e9205	2026-08-17T08:28:44.238366+00:00			discard	[automation:ff-output-after-attention-calibration] Retest nearest FF-output unions after retained attention recalibration | Retested FF-output pair 143/100 after attention recalibration. The 1,639-parameter candidate scored 98.95%, lower than its prior 98.97%, so it was discarded. Outcomes: 0 accepts, 1 scored nonqualification, 0 errors; frontier remained 1,640/99.00%. Compute used one migration/verification in about 1m22s. Stop reason: first scored discard before the 20-trial/25-minute cap; this cross-tensor path is closed.	Family: parameter tying. Current retained frontier is 1,640 parameters at 99.000000%, exactly threshold (+0.000000 margin). There have been 49 prior macro-attempts and 482 prior micro-trials in this family. The most recent accepted result is attempt-0146/micro-0011 at 1,640/99.00%; the most recent failed same-tensor result is attempt-0140/micro-0001, where FF-output pair 143/100 scored 98.97% before 31 additional QKV unions and temperature 1.015 were retained. Hypothesis: the recalibrated attention residual changes downstream synthesis sensitivity enough for the nearest FF-output union to qualify. The helper orders current scalar pairs by absolute difference, adds one union per official micro-trial, and uses runner-only retention/rollback. Stop on first scored discard or error, no pair, 20 trials, or 25 wall-clock minutes. Retesting the minimum-difference prior boundary is more informative than a later FF pair because conditions have materially changed.		
attempt-0149	462c6c42e25b52b5c63baa6f55133167cf5e9205	462c6c42e25b52b5c63baa6f55133167cf5e9205	2026-08-17T08:31:17.047281+00:00			discard	[automation:qkv-after-two-sensitive-pairs] Continue nearest QKV unions excluding two measured sensitive pairs | The intended revised QKV path did not reach a new candidate: the exclusion set stored pair 608/539 unsorted while the helper compares sorted coordinate tuples, so micro-0001 redundantly rescored the known 1,639-parameter pair at 98.99% and discarded it. Outcomes: 0 accepts, 1 scored duplicate nonqualification, 0 runner errors; frontier unchanged at 1,640/99.00%. Stop reason: first discard. This is an automation-policy implementation error; the sorted exclusion has been repaired and no new architectural inference is drawn.	Family: parameter tying. Current retained frontier is 1,640 parameters at 99.000000%, exactly threshold (+0.000000 margin). There have been 50 prior macro-attempts and 483 prior micro-trials in this family. The most recent accepted result is attempt-0146/micro-0011 at 1,640/99.00%; the most recent failed QKV path is attempt-0147, where six temperatures could not make pair 608/539 qualify (best 98.99%). Pairs 516/694 and 608/539 are now excluded under unchanged grouping. Hypothesis: those are pair-specific sensitivity boundaries rather than a global QKV floor, so the next-nearest eligible group union can qualify. The helper orders remaining adjacent groups by absolute difference, one official micro-trial per union, with runner-only retention/rollback. Stop on first scored discard or error, no pair, 20 trials, or 25 wall-clock minutes. This is more informative than another calibration because it changes the tied coordinates while preserving the retained temperature.		
attempt-0150	462c6c42e25b52b5c63baa6f55133167cf5e9205	462c6c42e25b52b5c63baa6f55133167cf5e9205	2026-08-17T08:33:37.306678+00:00			discard	[automation:repair-qkv-sensitive-pair-filter] Repair sorted QKV exclusions and test next eligible unions | The repaired eligibility filter reached the intended next pair, QKV coordinates 766/708 (difference 7.888e-05). Its 1,639-parameter candidate scored 98.97% and was discarded. Outcomes: 0 accepts, 1 scored nonqualification, 0 errors after repair; frontier remained 1,640/99.00%. Compute used one migration/verification in about 1m22s. Stop reason: first scored discard before the 20-trial/25-minute cap, showing the next eligible pair is also sensitive.	Family: parameter tying. Current retained frontier is 1,640 parameters at 99.000000%, exactly threshold (+0.000000 margin). There have been 51 prior macro-attempts and 484 prior micro-trials in this family. The most recent accepted result is attempt-0146/micro-0011 at 1,640/99.00%; the most recent failed result is attempt-0149/micro-0001, a redundant 98.99% score caused by an exclusion-order implementation error. This is the permitted exact repair of the intended policy: store sensitive pair 608/539 in the sorted form the helper compares; retained model, temperature, ranking, and all candidate conditions are unchanged. The helper now excludes 516/694 and 539/608, adds the next minimum-difference eligible QKV union per official micro-trial, and uses runner-only retention/rollback. Stop on first scored discard/error, no pair, 20 trials, or 25 minutes. Repairing the filter is more informative than choosing a different tensor because the prior macro never evaluated its intended candidate.		
attempt-0151	70ab4d89352dd2037d480ad682cc2dab79dec27a	462c6c42e25b52b5c63baa6f55133167cf5e9205	2026-08-17T08:35:45.819698+00:00	0.000000%	1639	discard	Use cosine-normalized attention with one QKV union	Family: attention organization. Current retained frontier is 1,640 parameters at 99.000000%, exactly threshold (+0.000000 margin). There have been 20 prior macro-attempts in this family. The most recent accepted relevant result is attempt-0146/micro-0011 at 1,640/99.00%; the most recent failed result is attempt-0150/micro-0001, whose next QKV union scored 98.97% at 1,639. The nearest same-pair boundary is QKV 608/539 at best 98.99%. Hypothesis: learned query/key vector norms amplify sensitivity to one tied scalar; cosine-normalizing Q and K preserves angular routing while removing norm dependence. Add pair 608/539, normalize each head's Q/K vectors, retain causal softmax and values, yielding 1,639 parameters. This is more informative than another temperature calibration because it changes the score geometry directly after six local temperatures failed.	0	0
attempt-0152	030c69efdeec3874cbf84a5b61fa6f4c7da87f0b	462c6c42e25b52b5c63baa6f55133167cf5e9205	2026-08-17T08:37:39.125315+00:00	0.000000%	1639	discard	Use normalized sigmoid attention with one QKV union	Family: attention organization. Current retained frontier is 1,640 parameters at 99.000000%, exactly threshold. There have been 21 prior macro-attempts in this family. The most recent accepted result is attempt-0146/micro-0011 at 1,640/99.00%; the most recent failed result is attempt-0151, whose cosine-normalized Q/K attention scored 0.00% at 1,639. Hypothesis: vector norms are essential but exponential winner competition may not be; normalized sigmoid gates preserve incumbent dot products while bounding each causal compatibility weight. Add QKV pair 608/539 and replace only softmax with sigmoid followed by row normalization, yielding 1,639 parameters. This is more informative than ReLU-normalized attention because sigmoid is smooth and strictly positive, making it the closest non-exponential normalized alternative.	0	0
attempt-0153	8b6b888e1466efd780835be48bf3bc9695e24c55	462c6c42e25b52b5c63baa6f55133167cf5e9205	2026-08-17T08:39:31.354419+00:00	0.000000%	1639	discard	Use squared-ReLU normalized attention with one QKV union	Family: attention organization. Current retained frontier is 1,640 parameters at 99.000000%, exactly threshold. There have been 22 prior macro-attempts in this family. The most recent accepted result is attempt-0146/micro-0011 at 1,640/99.00%; the most recent failed result is attempt-0152, whose normalized sigmoid attention scored 0.00% at 1,639. Hypothesis: sigmoid failed because it compresses strong compatibilities, while squared ReLU preserves positive score magnitude and sparsifies negative routes. Add QKV pair 608/539, keep incumbent dot products and temperature, replace softmax by squared-ReLU row normalization, yielding 1,639 parameters. This is more informative than plain ReLU because squaring restores a sharper winner preference closer to softmax.	0	0
attempt-0154	d4346a239d584b8a3794f4de96922a57d39bb81b	462c6c42e25b52b5c63baa6f55133167cf5e9205	2026-08-17T08:42:02.082535+00:00	1.240000%	1639	discard	Keep only top-eight causal attention logits with one QKV union	Family: attention organization. Current retained frontier is 1,640 parameters at 99.000000%, exactly threshold. There have been 23 prior macro-attempts in this family. The most recent accepted result is attempt-0146/micro-0011 at 1,640/99.00%; the most recent failed result is attempt-0153, whose squared-ReLU attention scored 0.00% at 1,639. Hypothesis: exponential competition is essential, but its diffuse low-probability tail is redundant; retaining the top eight causal logits preserves the strongest column/carry routes. Add QKV pair 608/539, mask all but the top eight available logits when T>8, and retain incumbent softmax/temperature, yielding 1,639 parameters. This is more informative than top four because eight is the least restrictive sparsification that materially affects later sequence positions.	0	0
