attempt_id	commit	parent_commit	timestamp_utc	accuracy	parameters	status	description	proposal	train_exit	verify_exit
attempt-0111	64c296768ca77f7d32ecc7e24c8076e5ddcaf55a	a1dfac6cb503f577ebebcb35e93ea9788786fa40	2026-08-17T06:10:23.774871+00:00	0.000000%	1629	discard	Replace all LayerNorm sites with per-coordinate RMSNorm	Family: normalization. Current retained frontier is 1,672 parameters at 99.010000%, a +0.010000 percentage-point margin over 99%. There have been 2 prior attempts in this family. The most recent accepted result is attempt-0018, which removed only the final LayerNorm bias and qualified at 3,360 parameters and 99.07%; the most recent failed result is attempt-0019, whose residual LayerNorm bias-group removal scored 0.01%. Hypothesis: learned per-coordinate scales are essential but explicit mean centering and additive shifts are redundant across the pre-normalized residual stack. This is a major normalization substitution, not scalar pruning: all four block normalizers and the final normalizer become RMSNorm with migrated dense scale vectors, removing every learned normalization bias and fixed/learned centering parameter while yielding 1,629 parameters. It is more informative than ScaleNorm because RMSNorm retains the full per-coordinate scaling capacity and changes only centering/bias behavior, the least restrictive operation-level alternative. Causal self-attention, feed-forward paths, token/position representations, autoregressive logits, and generic decoding remain unchanged.	0	0
attempt-0112	d268f8d6dff22b0aacfdb05826793cf4cd7045c0	a1dfac6cb503f577ebebcb35e93ea9788786fa40	2026-08-17T06:12:22.264557+00:00	0.000000%	1658	discard	Use RMSNorm only at block 0's pre-feed-forward site	Family: normalization. Current retained frontier is 1,672 parameters at 99.010000%, a +0.010000 percentage-point margin over 99%. There have been 3 prior attempts in this family. The most recent accepted result is attempt-0018, which removed the final LayerNorm bias and qualified at 3,360 parameters and 99.07%; the most recent failed result is attempt-0111, whose all-site RMSNorm substitution scored 0.00% at 1,629 parameters. Hypothesis: attempt-0111 failed because centering was removed globally, but block 0's pre-feed-forward site can use RMS normalization locally; this is the only site where both one scale tie and one bias tie qualified in attempts 0094-0095. This operation-level change restores retained LayerNorm at the other four sites, migrates the 16 reconstructed scales into one RMSNorm, removes its 15 learned bias groups, and yields 1,658 parameters. It is more informative than testing a less-supported site because prior local tying provides positive evidence specifically here and isolates whether mean centering, rather than affine redundancy, is essential. Attention, feed-forward transforms, representations, and generic autoregressive decoding remain unchanged.	0	0
attempt-0113	7bd05e4407c0e67d402605260185c40b8b7f2796	a1dfac6cb503f577ebebcb35e93ea9788786fa40	2026-08-17T06:14:30.055380+00:00	0.000000%	1465	discard	Use one eight-dimensional attention head with a learned residual projection	Family: attention organization. Current retained frontier is 1,672 parameters at 99.010000%, a +0.010000 percentage-point margin over 99%. There have been 9 prior attempts in this family. The most recent accepted result is attempt-0020, which removed attention output projections and qualified at 3,168 parameters and 99.94%; the most recent failed result is attempt-0102, whose global rank-6 value map scored 0.00% at 1,657 parameters. Hypothesis: two distinct attention maps may be redundant if one full eight-dimensional head can redistribute its attended values through a learned 8x16 residual projection. This major attention substitution retains the first checkpoint head's full Q/K/V rows, adds a learned output projection initialized as its original residual embedding, shares both transforms across depth, and yields 1,465 parameters. It is more informative than simply deleting a head because the learned projection preserves the ability to write into every residual coordinate and isolates the number of attention maps rather than output dimensionality. Causal softmax self-attention, feed-forward paths, representations, autoregressive logits, and generic decoding remain intact.	0	0
attempt-0114	05f98ca37a7da31e9c2be0a7e5c105bd7ddf58ad	a1dfac6cb503f577ebebcb35e93ea9788786fa40	2026-08-17T06:18:05.030754+00:00	28.800000%	1663	discard	Encode digits with Chebyshev features and independent control-token indicators	Family token representation (8 prior: attempts 0005, 0013-0017, 0107; current retained 1672 parameters at 99.01%, +0.01 over the 99% threshold). Most recent accepted same-family result was attempt 0016 at 3376 parameters/99.18%; most recent failed result was attempt 0107, whose rank-6 token factor scored 0.02% at 1655 parameters. Fit the retained 12x16 tied token matrix to an 11-feature task-aligned basis: digit rows use Chebyshev orders 0-8 and the two control tokens get independent indicators, giving 1663 total parameters. This is more informative than the nearest untested rank-7/8 generic factorization because it preserves rank up to 11, isolates whether numeric order is exploitable, and risks only nine parameters while directly addressing the rank-6 collapse.	0	0
attempt-0115	a1dfac6cb503f577ebebcb35e93ea9788786fa40	a1dfac6cb503f577ebebcb35e93ea9788786fa40	2026-08-17T06:23:42.760549+00:00			discard	[automation:nearest-block0-preattn-bias-pruning] Prune block-0 pre-attention LayerNorm biases in nearest-neutral order | One micro-trial attempted block-0 pre-attention bias coordinate 3, but training never started because the helper generated an invalid tuple by omitting a separator before the new coordinate. Outcomes: 0 accepts, 0 scored discards, 1 implementation error, no official verification, and no frontier change. Stop reason: the declared first-error boundary. The syntax defect is reproducible and has been corrected in the helper; architectural capacity remains untested.	Family: scalar pruning. Current retained frontier is 1,672 parameters at 99.010000%, a +0.010000 percentage-point margin over 99%. There have been 23 prior attempts in this family. The most recent accepted result was attempt-0059, which fixed block-1 pre-FF scale coordinate 12 at 2,118 parameters/99.05%; the most recent failed result was attempt-0061, whose second block-1 pre-FF scale prune scored 54.19% at 2,117 parameters. The current checkpoint's nearest remaining normalization bias to zero is block 0 pre-attention coordinate 3 at magnitude 1.045e-02, slightly below the nearest block-1 pre-attention alternative at 1.108e-02. Hypothesis: after later scalar unions changed the frontier, this isolated residual bias remains dispensable. The helper orders eligible coordinates by current absolute bias, fixes one to zero per micro-trial, and the official runner alone accepts or rolls back. Stop on the first scored discard or error, when no coordinate remains, at 14 micro-trials, or after 20 wall-clock minutes. This is more informative than opening block 1 first because it is the globally least checkpoint perturbation among untested sparse-normalization biases.		
attempt-0116	a1dfac6cb503f577ebebcb35e93ea9788786fa40	a1dfac6cb503f577ebebcb35e93ea9788786fa40	2026-08-17T06:26:11.709239+00:00			discard	[automation:repair-block0-preattn-bias-pruning] Repair tuple insertion and prune block-0 pre-attention LayerNorm biases | The repaired block-0 pre-attention bias policy evaluated its least-magnitude remaining coordinate, index 3 at -0.0104501. The 1,671-parameter candidate scored 97.30%, so it was discarded and rolled back. Outcomes: 0 accepts, 1 scored nonqualification, 0 errors after repair; frontier stayed 1,672 parameters/99.01%. Compute used one checkpoint migration and one official verification in about 1m23s. Stop reason: the first scored discard closed this site before the 14-trial/20-minute cap.	Family: scalar pruning. Current retained frontier is 1,672 parameters at 99.010000%, a +0.010000 percentage-point margin over 99%. There have been 24 prior macro-attempts in this family. The most recent accepted result is attempt-0059 at 2,118 parameters/99.05%; the most recent failed result is attempt-0115, an implementation error with no score because the helper omitted a tuple separator. This is the permitted exact repair: candidate, checkpoint, coordinate-3 zero constraint, ranking, and evaluation conditions are unchanged; only insertion syntax now emits a valid tuple. The helper orders remaining block-0 pre-attention biases by current absolute magnitude, fixes one per micro-trial, and the official runner alone accepts or rolls back. Stop at the first scored discard or error, no eligible coordinate, 14 micro-trials, or 20 wall-clock minutes. Repairing the unscored least-magnitude coordinate is more informative than moving to the next coordinate or another site because it isolates infrastructure from the original hypothesis.		
attempt-0117	a1dfac6cb503f577ebebcb35e93ea9788786fa40	a1dfac6cb503f577ebebcb35e93ea9788786fa40	2026-08-17T06:28:10.951150+00:00			discard	[automation:nearest-block1-preattn-bias-pruning] Prune block-1 pre-attention LayerNorm biases in nearest-neutral order | The block-1 pre-attention bias policy evaluated its least-magnitude remaining coordinate, index 13 at +0.0110794. The 1,671-parameter candidate scored 98.58% and was discarded. Outcomes: 0 accepts, 1 scored nonqualification, 0 errors; frontier remained 1,672/99.01%. Compute used one checkpoint migration and official verification in about 1m22s. Stop reason: first scored discard before the 12-trial/18-minute cap.	Family: scalar pruning. Current retained frontier is 1,672 parameters at 99.010000%, a +0.010000 percentage-point margin over 99%. There have been 25 prior macro-attempts in this family. The most recent accepted result is attempt-0059 at 2,118 parameters/99.05%; the most recent failed result is attempt-0116, whose block-0 pre-attention bias coordinate 3 scored 97.30% at 1,671 parameters. Hypothesis: sensitivity at block 0 does not imply the recurrent block-1 pre-attention site is equally sensitive; its nearest remaining bias, coordinate 13 at +0.0110794, was not part of the earlier pruning boundary and may be neutral. The helper orders the 12 eligible biases by current absolute magnitude, fixes one to zero per micro-trial, and the official runner alone accepts or rolls back. Stop on first scored discard or error, no coordinate, 12 micro-trials, or 18 wall-clock minutes. This is more informative than the nearest scale alternative because the bias perturbation is smaller and directly tests whether the block-0 failure is site-specific.		
attempt-0118	a1dfac6cb503f577ebebcb35e93ea9788786fa40	a1dfac6cb503f577ebebcb35e93ea9788786fa40	2026-08-17T06:30:17.461406+00:00			discard	[automation:nearest-block1-preff-bias-pruning] Prune block-1 pre-feed-forward LayerNorm biases in nearest-neutral order | The block-1 pre-FF bias policy evaluated its least-magnitude eligible coordinate, index 6 at -0.0638468. The 1,671-parameter candidate scored 95.22% and was discarded. Outcomes: 0 accepts, 1 scored nonqualification, 0 errors; frontier stayed 1,672/99.01%. Compute used one migration and one official verification in about 1m22s. Stop reason: first scored discard before the 14-trial/20-minute cap.	Family: scalar pruning. Current retained frontier is 1,672 parameters at 99.010000%, a +0.010000 percentage-point margin over 99%. There have been 26 prior macro-attempts in this family. The most recent accepted result is attempt-0059 at 2,118 parameters/99.05%; the most recent failed result is attempt-0117, whose block-1 pre-attention bias coordinate 13 scored 98.58% at 1,671 parameters. Block 1 pre-FF previously tolerated individual bias pruning, and its current nearest eligible coordinate is bias 6 at -0.0638468. Hypothesis: that downstream pre-FF centering site remains more redundant than either now-bounded pre-attention site. The helper orders its 14 eligible biases by current magnitude, fixes one per micro-trial, and uses only official runner acceptance/rollback. Stop on first scored discard or error, no candidate, 14 micro-trials, or 20 wall-clock minutes. This is more informative than revisiting a failed pre-attention coordinate because it changes site while following positive historical evidence.		
attempt-0119	a1dfac6cb503f577ebebcb35e93ea9788786fa40	a1dfac6cb503f577ebebcb35e93ea9788786fa40	2026-08-17T06:32:20.363418+00:00			discard	[automation:nearest-block1-preattn-scale-pruning] Prune block-1 pre-attention LayerNorm scales in nearest-neutral order | The block-1 pre-attention scale policy tested its closest-to-one eligible scale, coordinate 4 at 0.952516. The 1,671-parameter candidate scored 96.55% and was discarded. Outcomes: 0 accepts, 1 scored nonqualification, 0 errors; frontier remained 1,672/99.01%. Compute used one migration and official verification in about 1m22s. Stop reason: first scored discard before the 15-trial/20-minute cap.	Family: scalar pruning. Current retained frontier is 1,672 parameters at 99.010000%, a +0.010000 percentage-point margin over 99%. There have been 27 prior macro-attempts in this family. The most recent accepted result is attempt-0059 at 2,118 parameters/99.05%; the most recent failed result is attempt-0118, whose block-1 pre-FF bias coordinate 6 scored 95.22% at 1,671 parameters. The closest remaining learned normalization scale to neutral is block-1 pre-attention coordinate 4 at 0.952516, distance 0.047484 from one. Hypothesis: multiplicative scaling has a different sensitivity structure from the now-bounded additive biases. The helper orders 15 eligible scales by current distance to one, fixes one per micro-trial, and the official runner alone accepts or rolls back. Stop on first scored discard or error, no coordinate, 15 micro-trials, or 20 wall-clock minutes. This is more informative than block-0 scale coordinate 4 (distance 0.1433) because it is the minimum-neutral perturbation across remaining sparse normalization scales.		
attempt-0120	a1dfac6cb503f577ebebcb35e93ea9788786fa40	a1dfac6cb503f577ebebcb35e93ea9788786fa40	2026-08-17T06:34:18.533613+00:00			discard	[automation:nearest-block0-preattn-scale-neutral] Fix block-0 pre-attention LayerNorm scales to one in nearest-neutral order | The block-0 pre-attention scale policy tested closest-to-one coordinate 4 at 1.143266. The 1,671-parameter candidate scored 91.96% and was discarded. Outcomes: 0 accepts, 1 scored nonqualification, 0 errors; frontier stayed 1,672/99.01%. Compute used one migration and official verification in about 1m22s. Stop reason: first scored discard before the 16-trial/22-minute cap.	Family: scalar pruning. Current retained frontier is 1,672 parameters at 99.010000%, a +0.010000 percentage-point margin over 99%. There have been 28 prior macro-attempts in this family. The most recent accepted result is attempt-0059 at 2,118 parameters/99.05%; the most recent failed result is attempt-0119, whose block-1 pre-attention scale coordinate 4 scored 96.55% at 1,671 parameters. The block-0 site retains all 16 learned scales; its nearest-to-one coordinate is 4 at 1.143266. Hypothesis: block-specific scaling sensitivity may differ even though block 1 failed, and neutral fixing tests a different constraint from attempt-0096's failed pairwise scale union. The helper orders scales by distance to one, fixes one per micro-trial, and delegates all acceptance/rollback to the official runner. Stop on first scored discard or error, no coordinate, 16 micro-trials, or 22 wall-clock minutes. This is more informative than another block-1 coordinate because it isolates site and constraint type.		
attempt-0121	a1dfac6cb503f577ebebcb35e93ea9788786fa40	a1dfac6cb503f577ebebcb35e93ea9788786fa40	2026-08-17T06:36:31.399610+00:00			discard	[automation:next-block1-preff-scale-neutral] Fix remaining block-1 pre-feed-forward LayerNorm scales to one in nearest-neutral order | The block-1 pre-FF scale policy tested its nearest remaining scale to one, coordinate 5 at 0.747436. The 1,671-parameter candidate scored 53.38% and was discarded. Outcomes: 0 accepts, 1 scored nonqualification, 0 errors; frontier remained 1,672/99.01%. Compute used one migration and official verification in about 1m22s. Stop reason: first scored discard before the 15-trial/20-minute cap, closing the remaining sparse-normalization neutral-scale paths.	Family: scalar pruning. Current retained frontier is 1,672 parameters at 99.010000%, a +0.010000 percentage-point margin over 99%. There have been 29 prior macro-attempts in this family. The most recent accepted result is attempt-0059, which already fixed block-1 pre-FF scale coordinate 12 at 2,118 parameters/99.05%; the most recent failed result is attempt-0120, whose block-0 pre-attention scale coordinate 4 scored 91.96% at 1,671 parameters. The closest remaining scale in that positively supported block-1 pre-FF site is coordinate 5 at 0.747436. Hypothesis: a second neutral scale may remain dispensable specifically where one such prune already qualified. The helper orders the 15 remaining learned scales by distance to one, fixes one per micro-trial, and the official runner alone accepts or rolls back. Stop on first scored discard or error, no coordinate, 15 micro-trials, or 20 wall-clock minutes. This is more informative than another pre-attention scale because it is the only residual scale site with a prior accepted neutral constraint.		
attempt-0122	58e37360f583f4eda333346e5b4e5169b487d180	a1dfac6cb503f577ebebcb35e93ea9788786fa40	2026-08-17T06:38:39.214290+00:00	0.000000%	1593	discard	Share only the key map across two attention heads	Family: attention organization. Current retained frontier is 1,672 parameters at 99.010000%, a +0.010000 percentage-point margin over 99%. There have been 12 prior attempts in this family. The most recent accepted result is attempt-0020, which removed attention output projections at 3,168 parameters/99.94%; the most recent failed result is attempt-0113, whose single-head attention with learned output projection scored 0.00% at 1,465 parameters. Hypothesis: two query-dependent attention maps are essential, but their key feature map can be shared across heads. Keep both 8D query heads and the full 16D value transform, replace only the two key maps by their checkpoint-average 8x16 map, and share the resulting attention parameters across depth, yielding 1,593 parameters. This major attention-organization change is more informative than full multi-query sharing because it is the least restrictive head-sharing substitution and isolates key diversity from query and value diversity. Causal softmax attention and generic autoregressive decoding remain intact.	0	0
attempt-0123	3c6800ef5fe8c6fdcd683d483c43212449a9fa74	a1dfac6cb503f577ebebcb35e93ea9788786fa40	2026-08-17T06:40:41.744053+00:00	0.000000%	1593	discard	Share only the query map across two attention heads	Family: attention organization. Current retained frontier is 1,672 parameters at 99.010000%, a +0.010000 percentage-point margin over 99%. There have been 13 prior attempts in this family. The most recent accepted result is attempt-0020 at 3,168 parameters/99.94%; the most recent failed result is attempt-0122, whose key-shared two-head attention scored 0.00% at 1,593 parameters. Hypothesis: attempt-0122 failed specifically because distinct keys are needed to expose different memory features, while a shared query can still compare against both key heads. Preserve both full key heads and the full value transform, replace only the two query maps by their checkpoint-average 8x16 map, and share parameters across depth, yielding 1,593 parameters. This is more informative than sharing values next because it is the exact query/key complement of the measured failure at identical count and isolates which side of compatibility needs head-specific features. Causal softmax and generic decoding remain unchanged.	0	0
attempt-0124	6b5b7b11f720447fe61144da2e45c819a3443c22	a1dfac6cb503f577ebebcb35e93ea9788786fa40	2026-08-17T06:42:42.894944+00:00	0.000000%	1593	discard	Share only the value map across two attention heads	Family: attention organization. Current retained frontier is 1,672 parameters at 99.010000%, a +0.010000 percentage-point margin over 99%. There have been 14 prior attempts in this family. The most recent accepted result is attempt-0020 at 3,168 parameters/99.94%; the most recent failed result is attempt-0123, whose query-shared candidate scored 0.00% at 1,593 parameters. Hypothesis: both query and key maps require head-specific routing geometry, but the content feature map can be common because different attention weights still produce distinct head outputs. Preserve all 32 Q/K rows, replace the two value maps by their checkpoint-average 8x16 map broadcast across heads, and share across depth, yielding 1,593 parameters. This is more informative than full multi-query attention because attempts 0122-0123 already bound Q/K sharing and this exact complement isolates value-head diversity at the same parameter count. Causal softmax and generic autoregressive decoding remain unchanged.	0	0
