attempt_id	commit	parent_commit	timestamp_utc	accuracy	parameters	status	description	proposal	train_exit	verify_exit
attempt-0125	fbf57386fe0827b0991dffad87c3448dd2fac000	a1dfac6cb503f577ebebcb35e93ea9788786fa40	2026-08-17T06:44:38.144004+00:00	0.000000%	1465	discard	Keep only the second attention head with learned residual projection	Family: attention organization. Current retained frontier is 1,672 parameters at 99.010000%, a +0.010000 percentage-point margin over 99%. There have been 15 prior attempts in this family. The most recent accepted result is attempt-0020 at 3,168 parameters/99.94%; the most recent failed result is attempt-0124, whose value-shared two-head candidate scored 0.00% at 1,593 parameters. The nearest directly comparable failed result is attempt-0113, which kept only the first head and scored 0.00% at 1,465 parameters. Hypothesis: the two learned heads may be asymmetric and the second may carry the essential carry-routing pattern. Retain its Q/K/V rows, add an 8x16 learned output projection initialized into the second residual half, and share both across depth, yielding 1,465 parameters. This is more informative than another mixed head-sharing scheme because it is the exact untested categorical complement of attempt-0113; after it, single-head deletion is closed. Causal softmax and generic decoding remain intact.	0	0
attempt-0126	e3d1efabfb55b1648a78aab23878751c6f6d058c	a1dfac6cb503f577ebebcb35e93ea9788786fa40	2026-08-17T06:47:38.080863+00:00	0.010000%	1644	discard	Remove least-salient feed-forward hidden unit while preserving surviving ties	Family: feed-forward width. Current retained frontier is 1,672 parameters at 99.010000%, a +0.010000 percentage-point margin over 99%. There have been 17 prior attempts in this family. The most recent accepted result is attempt-0022, which retained projection-free feed-forward width 10 at 3,040 parameters/99.85%; the most recent failed result is attempt-0106, whose rank-7 output factorization scored 0.01% at 1,669 parameters. Hypothesis: full matrix rank is important, but one of the 16 nonlinear hidden units is redundant. Checkpoint inspection ranks unit 2 lowest by input-row norm times output-column norm (0.1482); delete exactly that row and column, remap all surviving scalar ties, retain GELU and the other 15 units, yielding 1,644 parameters. This is more informative than another low-rank factorization because it preserves unrestricted mixing among surviving features and tests nonlinear width rather than linear rank; it is more informative than deleting the next unit because it is the least-salient checkpoint-local perturbation.	0	0
attempt-0127	5d06d956d11848ff80b4ba81a169f7b902603784	a1dfac6cb503f577ebebcb35e93ea9788786fa40	2026-08-17T06:49:39.797327+00:00	0.000000%	1572	discard	Constrain the shared feed-forward input map to be symmetric	Family: parameter tying. Current retained frontier is 1,672 parameters at 99.010000%, a +0.010000 percentage-point margin over 99%. There have been 41 prior macro-attempts in this family. The most recent accepted result is attempt-0095/micro-0001 at 1,672 parameters/99.01%; the most recent failed result is attempt-0104, whose same-orientation whole-map FF reuse scored 0.00% at 1,465 parameters. Hypothesis: the input transform needs an independent output transform but not directed feature-to-feature coefficients. Constrain only the 16x16 shared FF input map to a learned symmetric matrix, initialized by averaging transpose pairs; retain all 16 GELU units and the independent retained output map, yielding 1,572 parameters. This is more informative than symmetric output first because feature construction precedes the nonlinearity and symmetry preserves reciprocal interactions without tying analysis to synthesis, directly separating matrix geometry from the failed whole-map reuse.	0	0
attempt-0128	0e23d257f88f5bdc008f0fbcb24cdc9ca3df7d2d	a1dfac6cb503f577ebebcb35e93ea9788786fa40	2026-08-17T06:51:54.201473+00:00	0.000000%	1581	discard	Constrain the shared feed-forward output map to be symmetric	Family: parameter tying. Current retained frontier is 1,672 parameters at 99.010000%, a +0.010000 percentage-point margin over 99%. There have been 42 prior macro-attempts in this family. The most recent accepted result is attempt-0095/micro-0001 at 1,672 parameters/99.01%; the most recent failed result is attempt-0127, whose symmetric FF input map scored 0.00% at 1,572 parameters. Hypothesis: directed feature construction is essential, but residual reconstruction after GELU may tolerate reciprocal feature geometry. Preserve the current 236-group input transform exactly, constrain only the 16x16 output transform to a learned symmetric matrix initialized by transpose-pair averaging, and retain width 16, yielding 1,581 parameters. This is more informative than a triangular output map because it is the exact input/output complement of attempt-0127 at comparable capacity and tests geometry without deleting one direction outright.	0	0
attempt-0129	632710ffa9e596c0ed494247c27ec35cfe1c8219	a1dfac6cb503f577ebebcb35e93ea9788786fa40	2026-08-17T06:55:07.667831+00:00	0.000000%	1669	discard	Model FF output as input transpose plus rank-7 residual	Family: parameter tying. Current retained frontier is 1,672 parameters at 99.010000%, a +0.010000 percentage-point margin over 99%. There have been 43 prior macro-attempts in this family. The most recent accepted result is attempt-0095/micro-0001 at 1,672 parameters/99.01%; the most recent failed result is attempt-0128, whose symmetric output map scored 0.00% at 1,581 parameters. Hypothesis: attempts 0103 and 0128 failed because a pure transpose/symmetric relation erased directional synthesis, but the two FF maps share a transpose-aligned base plus a lower-rank directional correction. Preserve the retained 236-group input map exactly and reconstruct output as its transpose plus the best rank-7 SVD correction of the checkpoint residual; 224 correction parameters replace 227 output groups, yielding 1,669 total. This is more informative than rank 6 because rank 7 is the largest eligible correction and therefore the minimum-loss test of cross-map structure, while all 16 GELU units remain.	0	0
attempt-0130	b0e802ec504e4e64f5d43fce8d5c61edcab20df0	a1dfac6cb503f577ebebcb35e93ea9788786fa40	2026-08-17T06:57:15.210558+00:00	0.000000%	1669	discard	Model FF output as input map plus rank-7 residual	Family: parameter tying. Current retained frontier is 1,672 parameters at 99.010000%, a +0.010000 percentage-point margin over 99%. There have been 44 prior macro-attempts in this family. The most recent accepted result is attempt-0095/micro-0001 at 1,672 parameters/99.01%; the most recent failed result is attempt-0129, whose transpose-base plus rank-7 residual scored 0.00% at 1,669 parameters. Hypothesis: the correction rank was adequate but transposition selected the wrong shared coordinate geometry. Preserve the retained input map exactly and reconstruct output as the same-orientation input map plus the best rank-7 SVD residual, again replacing 227 output groups with 224 correction parameters for 1,669 total. This is more informative than lowering residual rank because it is the exact orientation complement at identical capacity and minimum eligible compression; all nonlinear width remains intact.	0	0
attempt-0131	3951626769f538627125498fc399519d29cbe192	a1dfac6cb503f577ebebcb35e93ea9788786fa40	2026-08-17T06:59:15.707122+00:00	15.910000%	1656	discard	Tie the first aligned operand-position pair coordinate-wise	Family: position representation. Current retained frontier is 1,672 parameters at 99.010000%, a +0.010000 percentage-point margin over 99%. There have been 8 prior attempts in this family. The most recent accepted result is attempt-0030, which removed the unused final positional row at 2,128 parameters/99.14%; the most recent failed result is attempt-0110, whose fixed Fourier/parity basis scored 0.00% at 1,666 parameters. Hypothesis: the model needs absolute column identity but not separate positional vectors for the two operand roles within an aligned digit column. Tie only positions 1 and 2 coordinate-wise, corresponding to a0 and b0, by checkpoint averaging while leaving the other 30 positions exact; scalar groups already common to both are deduplicated, yielding 1,656 parameters. This is more informative than tying all ten operand pairs because it is the least extensive role-invariance probe and localizes the first carry column before imposing a global symmetry.	0	0
attempt-0132	a1dfac6cb503f577ebebcb35e93ea9788786fa40	a1dfac6cb503f577ebebcb35e93ea9788786fa40	2026-08-17T07:01:55.190077+00:00			discard	[automation:remaining-operand-position-row-ties] Test remaining aligned operand-position row ties by checkpoint distance | The distance-ordered operand-row policy tested positions 19/20, the nearest remaining aligned pair (L2 distance 0.007489). The 1,659-parameter candidate scored 98.44% and was discarded. Outcomes: 0 accepts, 1 scored nonqualification, 0 errors; frontier remained 1,672/99.01%. Compute used one checkpoint migration and official verification in about 1m22s. Stop reason: first scored discard before the 9-trial/14-minute cap, showing even the closest remaining operand-role pair is sensitive.	Family: position representation. Current retained frontier is 1,672 parameters at 99.010000%, a +0.010000 percentage-point margin over 99%. There have been 9 prior macro-attempts in this family. The most recent accepted result is attempt-0030 at 2,128 parameters/99.14%; the most recent failed result is attempt-0131, whose first-column operand-position tie scored 15.91% at 1,656 parameters. Hypothesis: operand-role identity may be critical at the least-significant carry origin but redundant in a later column. The helper excludes measured rows 1/2, orders the nine remaining aligned operand row pairs by current L2 distance, ties one full 16D pair per micro-trial, and uses only official runner acceptance/rollback. Stop at first scored discard or error, no pair, nine micro-trials, or 14 wall-clock minutes. This is more informative than selecting the next numeric column because checkpoint distance gives the least disruptive remaining categorical test.		
attempt-0133	e43cc02981a5eda6e227692b2ab1957a03ca6eff	a1dfac6cb503f577ebebcb35e93ea9788786fa40	2026-08-17T07:03:53.798822+00:00	16.350000%	1663	discard	Preserve digit rows and merge only the two control-token embeddings	Family: token representation. Current retained frontier is 1,672 parameters at 99.010000%, a +0.010000 percentage-point margin over 99%. There have been 9 prior attempts in this family. The most recent accepted result is attempt-0016 at 3,376 parameters/99.18%; the most recent failed result is attempt-0114, whose Chebyshev digit basis scored 28.80% at 1,663 parameters. Hypothesis: attempt-0114 failed because it projected the ten digit classifier rows, while the BOS and equals controls—which are never target outputs—can share one input feature. Use ten one-hot digit features plus one shared control feature and fit the 11x16 projection by least squares; this preserves every digit row exactly and averages only control rows, yielding 1,663 parameters. This is more informative than another polynomial digit basis because it isolates control-token identity without altering digit geometry at the same count.	0	0
attempt-0134	9eaf040753f938f1bf3de8372691150f59acfd2c	a1dfac6cb503f577ebebcb35e93ea9788786fa40	2026-08-17T07:06:14.209337+00:00	0.030000%	1658	discard	Use RMSNorm only at block 0 pre-attention	Family: normalization. Current retained frontier is 1,672 parameters at 99.010000%, a +0.010000 percentage-point margin over 99%. There have been 4 prior attempts in this family. The most recent accepted result is attempt-0018, which removed the final LayerNorm bias at 3,360 parameters/99.07%; the most recent failed result is attempt-0112, whose block-0 pre-FF-only RMSNorm scored 0.00% at 1,658 parameters. Hypothesis: mean centering may be essential for nonlinear feature construction but redundant before the first attention routing operation. Replace only block 0 pre-attention LayerNorm with per-coordinate RMSNorm, migrate its 16 scales, retain all other LayerNorm sites, and remove its 14 learned bias values for 1,658 parameters. This is more informative than block 1 first because block 0 directly processes token-plus-position inputs and cleanly isolates whether initial attention needs centering, complementing attempt-0112 at identical count.	0	0
attempt-0135	3473e7bdf5f14a10cac50a93c5ea91ac1ed2e1f2	a1dfac6cb503f577ebebcb35e93ea9788786fa40	2026-08-17T07:08:05.263144+00:00	0.000000%	1661	discard	Use RMSNorm only at block 1 pre-attention	Family: normalization. Current retained frontier is 1,672 parameters at 99.010000%, a +0.010000 percentage-point margin over 99%. There have been 5 prior attempts in this family. The most recent accepted result is attempt-0018 at 3,360 parameters/99.07%; the most recent failed result is attempt-0134, whose block-0 pre-attention RMSNorm scored 0.03% at 1,658 parameters. Hypothesis: centering is essential when attention first consumes token-plus-position embeddings, but may be redundant after one complete transformer block. Replace only block 1 pre-attention LayerNorm with per-coordinate RMSNorm, reconstruct its 16 scales including the one fixed-neutral coordinate, retain all other sites, and remove the 12 learned biases net of the restored scale for 1,661 parameters. This is more informative than block-1 pre-FF because depth is the only changed factor relative to attempt-0134.	0	0
attempt-0136	85beeb53f54fea830ff5430cb7ea952128c60ad8	a1dfac6cb503f577ebebcb35e93ea9788786fa40	2026-08-17T07:10:11.892645+00:00	0.000000%	1659	discard	Use RMSNorm only at block 1 pre-feed-forward	Family: normalization. Current retained frontier is 1,672 parameters at 99.010000%, a +0.010000 percentage-point margin over 99%. There have been 6 prior attempts in this family. The most recent accepted result is attempt-0018 at 3,360 parameters/99.07%; the most recent failed result is attempt-0135, whose block-1 pre-attention RMSNorm scored 0.00% at 1,661 parameters. The nearest same-operation failed result is attempt-0112, block-0 pre-FF RMSNorm at 0.00%. Hypothesis: the second block's nonlinear path may tolerate uncentered normalization because its scale coordinate 12 was previously fixed to one successfully and it operates on a more processed residual stream. Replace only that LayerNorm by RMSNorm, reconstruct 16 scales, remove 14 biases net of one restored scale, yielding 1,659 parameters. This completes the untested depth complement and is more informative than a global normalization retry because every other site remains exact.	0	0
attempt-0137	7b6daba497b49534052db09f50f5829619b8fc71	a1dfac6cb503f577ebebcb35e93ea9788786fa40	2026-08-17T07:12:48.089996+00:00	0.010000%	1671	discard	Use SiLU with one new FF-output scalar union	Family: feed-forward width. Current retained frontier is 1,672 parameters at 99.010000%, a +0.010000 percentage-point margin over 99%. There have been 18 prior attempts in this family. The most recent accepted result is attempt-0022 at 3,040 parameters/99.85%; the most recent failed result is attempt-0126, whose least-salient hidden-unit deletion scored 0.01% at 1,644 parameters. In the adjacent tying evidence, attempt-0087's next GELU output union (143,100) failed at 1,694, while current checkpoint pair (82,85) is the least-difference untested output union (1.454e-4). Hypothesis: SiLU's smooth multiplicative gate can tolerate this one-scalar synthesis compression better than GELU while preserving width 16. Replace GELU by SiLU and union only output coordinates 82/85, yielding 1,671 parameters. This is more informative than ReLU because SiLU is the closest smooth, nonmonotonicity-reduced alternative and changes activation geometry minimally.	0	0
attempt-0138	bde6e5a305f2ea78ff72bd9a40753118835e4421	a1dfac6cb503f577ebebcb35e93ea9788786fa40	2026-08-17T07:14:38.686678+00:00	98.990000%	1671	discard	Use tanh-approximated GELU with one FF-output scalar union	Family: feed-forward width. Current retained frontier is 1,672 parameters at 99.010000%, a +0.010000 percentage-point margin over 99%. There have been 19 prior attempts in this family. The most recent accepted result is attempt-0022 at 3,040 parameters/99.85%; the most recent failed result is attempt-0137, whose SiLU plus output union 82/85 scored 0.01% at 1,671 parameters. Hypothesis: the failure was caused by changing to SiLU's qualitatively different gate, while the standard tanh approximation to GELU preserves the incumbent activation shape closely enough to absorb the same minimum-difference output union. Keep width 16, change only exact GELU to its tanh approximation, union coordinates 82/85, and yield 1,671 parameters. This is more informative than ReLU because it is the nearest functional activation alternative and cleanly tests curve-level robustness under identical compression.	0	0
attempt-0139	06d88307073db782499be4f6c2ff2d17294940e2	a1dfac6cb503f577ebebcb35e93ea9788786fa40	2026-08-17T07:18:09.313138+00:00	99.000000%	1671	keep	[automation:gelu-blend-with-output-union] Bracket exact-to-tanh GELU interpolation with one FF-output union | The monotone GELU interpolation tested alpha=0.5 first with FF-output union 82/85. It qualified at exactly 99.00% with 1,671 parameters and was retained, moving the frontier down by one parameter. Outcomes: 1 accept, 0 scored discards, 0 errors; one official checkpoint migration and verification in about 1m22s. Stop reason: after acceptance, every remaining blend had the same 1,671 count and therefore no eligible strict frontier improvement remained, before the four-trial/eight-minute cap.	Family: feed-forward width. Current retained frontier is 1,672 parameters at 99.010000%, a +0.010000 percentage-point margin over 99%. There have been 20 prior macro-attempts in this family. The most recent accepted result is attempt-0022 at 3,040 parameters/99.85%; the most recent failed result is attempt-0138, whose alpha=1 tanh-GELU plus output union 82/85 scored 98.99% at 1,671 parameters, while alpha=0 without that new union is the retained exact-GELU frontier. Hypothesis: reducing activation perturbation inside this measured bracket can recover one example while retaining the scalar union. The helper tests alpha 0.5, 0.25, 0.125, then 0 in decreasing order; one candidate per official micro-trial, same 1,671 count, same checkpoint migration. A scored failure makes the next smaller alpha eligible. Stop on the first accepted candidate because equal-count alternatives can no longer improve it, after all four trials, on error, or after eight wall-clock minutes. This is more informative than a new activation because it resolves the near-threshold local boundary.		
attempt-0140	06d88307073db782499be4f6c2ff2d17294940e2	06d88307073db782499be4f6c2ff2d17294940e2	2026-08-17T07:20:58.494968+00:00			discard	[automation:ff-output-unions-under-blended-gelu] Test nearest FF-output scalar unions under retained blended GELU | Under retained blended GELU, the nearest FF-output union 143/100 produced a 1,670-parameter candidate at 98.97%, versus 98.96% under exact GELU, and was discarded. Outcomes: 0 accepts, 1 scored nonqualification, 0 errors; frontier remained 1,671/99.00%. Compute used one migration and official verification in about 1m22s. Stop reason: first scored discard before the 20-trial/25-minute cap, so the FF-output path remains bounded.	Family: parameter tying. Current retained frontier is 1,671 parameters at 99.000000%, exactly the 99% threshold (+0.000000 margin). There have been 45 prior macro-attempts and 449 prior micro-trials in this family. The most recent accepted relevant result is attempt-0139/micro-0001, which retained blended GELU plus output union 82/85 at 1,671/99.00%; the most recent failed same-tensor result is attempt-0087/micro-0010, where pair 143/100 scored 98.96% under exact GELU. Hypothesis: the retained half-tanh GELU changes output sensitivity enough for the current nearest FF-output pair to qualify. The helper orders adjacent learned scalar groups by absolute current difference, adds one union per official micro-trial, and accepts/rolls back only through the runner. Stop on first scored discard or error, no pair, 20 micro-trials, or 25 wall-clock minutes. This is more informative than the next pair because it tests the minimum-distortion candidate under the newly retained activation conditions.		
