attempt_id	commit	parent_commit	timestamp_utc	accuracy	parameters	status	description	proposal	train_exit	verify_exit
attempt-0168	3bd65bc6a0e8f2d103841ceb9048b6ce68906426	a7cc9394a6258e9e469ff4e65bb344b32b3eb7ec	2026-08-17T10:18:38.342282+00:00	99.020000%	1586	keep	[automation:ff-output-final-plateau-check] Check one more FF-output skip before switching tensors | The FF-output plateau check evaluated five ordered unions. Four qualified and reduced the frontier from 1,590 to 1,586 parameters; micro-0005 proposed 1,585, failed qualification, and was rolled back. Outcomes: 4 accepts, 1 scored nonqualification, 0 errors. Compute used five official migrations/verifications over about 6m20s. Stop reason: first scored discard; the proposed two-empty-band plateau was falsified.	Family: parameter tying. Current retained frontier is 1,590 parameters at 99.020000%, a +0.020000-point margin. There have been 65 prior macro-attempts and 548 prior micro-trials in this family. The most recent accepted result is attempt-0166/micro-0006 at 1,590/99.02%; the most recent failed result is attempt-0167/micro-0001, where FF-output pair 180/59 scored 98.96% at 1,589. Three measured FF-output sensitive pairs are excluded. Hypothesis: one further skip may reopen the qualifying band; if its first pair also fails, two consecutive no-accept macros define a bounded local plateau. The helper adds one nearest eligible union per official micro-trial with runner-only retention/rollback. Stop at first discard/error, no pair, 20 trials, or 25 minutes. This is more informative than switching now because it applies the same replication-based stopping criterion that previously avoided a false QKV plateau.		
attempt-0169	f2c8c1d61ff77b8a26d1c24035b599960fc4616f	3bd65bc6a0e8f2d103841ceb9048b6ce68906426	2026-08-17T10:44:38.740319+00:00	99.020000%	1566	keep	[automation:ff-output-skip-four-sensitive-pairs] Continue FF-output unions after four retained reductions | The fourth-skip FF-output band reached its declared 20-trial cap with all 20 ordered unions qualifying. The retained frontier moved from 1,586 to 1,566 parameters; no scored discards or errors occurred. Compute used 20 official migrations/verifications over about 24m40s. Stop reason: hard micro-trial cap, not a measured failure boundary.	Family: parameter tying. Current retained frontier is 1,586 parameters at 99.020000%, a +0.020000-point margin. There have been 66 prior macro-attempts and 553 prior micro-trials in this family. The most recent accepted result is attempt-0168/micro-0004 at 1,586/99.02%; the most recent failed result is attempt-0168/micro-0005, where FF-output pair 183/223 scored 98.99% at 1,585. Four measured FF-output sensitive pairs are excluded. Hypothesis: four preceding accepts and recovered margin indicate another adjacent band of unmeasured FF-output groups can qualify after skipping this isolated boundary. The helper adds one nearest eligible scalar union per official micro-trial with runner-only retention/rollback. Stop at first scored discard/error, no pair, 20 trials, or 25 minutes. This is more informative than moving to FF input because the current tensor still has replicated positive yield.		
attempt-0170	ae5fb49ae4d2ed0cd73cfd14d49c3f14c583446d	f2c8c1d61ff77b8a26d1c24035b599960fc4616f	2026-08-17T11:03:52.859415+00:00	99.010000%	1552	keep	[automation:ff-output-continuation-after-cap] Continue FF-output unions after a fully qualifying capped band | The FF-output continuation evaluated 15 ordered unions. Fourteen qualified and reduced the frontier from 1,566 to 1,552 parameters; micro-0015 proposed 1,551, failed qualification, and was rolled back. Outcomes: 14 accepts, 1 scored nonqualification, 0 errors. Compute used 15 official migrations/verifications over about 18m30s. Stop reason: first scored discard before the 20-trial/25-minute cap.	Family: parameter tying. Current retained frontier is 1,566 parameters at 99.020000%, a +0.020000-point margin. There have been 67 prior macro-attempts and 573 prior micro-trials in this family. The most recent accepted result is attempt-0169/micro-0020 at 1,566/99.02%; the most recent failed result remains attempt-0168/micro-0005, where FF-output pair 183/223 scored 98.99% at 1,585, because attempt 169 had no failures. Four measured sensitive FF-output pairs remain excluded. Hypothesis: the fully qualifying 20-trial band ended only at its hard cap, so the next minimum-difference unions should be tested under a new bounded macro rather than treating the administrative cap as a scientific boundary. The helper adds one ordered union per official micro-trial with runner-only retention/rollback. Stop at first scored discard/error, no pair, 20 trials, or 25 minutes. This is more informative than switching tensors because the immediately preceding policy had 100% yield.		
attempt-0171	2b3ee03870671d541c7c99f7f7ce0851420f6080	ae5fb49ae4d2ed0cd73cfd14d49c3f14c583446d	2026-08-17T11:21:11.751211+00:00	99.020000%	1540	keep	[automation:ff-output-skip-five-sensitive-pairs] Continue high-yield FF-output compression after its fifth failure | The fifth-skip FF-output band evaluated 13 ordered unions. Twelve qualified and reduced the frontier from 1,552 to 1,540 parameters; micro-0013 proposed 1,539, failed qualification, and was rolled back. Outcomes: 12 accepts, 1 scored nonqualification, 0 errors. Compute used 13 official migrations/verifications over about 16m15s. Stop reason: first scored discard before the 20-trial/25-minute cap.	Family: parameter tying. Current retained frontier is 1,552 parameters at 99.010000%, a +0.010000-point margin. There have been 68 prior macro-attempts and 588 prior micro-trials in this family. The most recent accepted result is attempt-0170/micro-0014 at 1,552/99.01%; the most recent failed result is attempt-0170/micro-0015, where FF-output pair 10/223 scored 98.95% at 1,551. Five measured FF-output sensitive pairs are excluded. Hypothesis: the preceding 14/15 yield shows substantial remaining local redundancy, so the next eligible minimum-difference groups can qualify after skipping this isolated failure. The helper adds one ordered scalar union per official micro-trial with runner-only retention/rollback. Stop at first scored discard/error, no pair, 20 trials, or 25 minutes. This is more informative than switching tensors while current positive yield remains high.		
attempt-0172	b771b38e65ae8311a1b237b5497159b3fde5ce4d	2b3ee03870671d541c7c99f7f7ce0851420f6080	2026-08-17T11:46:52.122437+00:00	99.120000%	1520	keep	[automation:ff-output-skip-six-sensitive-pairs] Continue FF-output unions after twelve more reductions | The sixth-skip FF-output band reached its declared 20-trial cap with all 20 ordered unions qualifying. The retained frontier moved from 1,540 to 1,520 parameters; no scored discards or errors occurred. Compute used 20 official migrations/verifications over about 24m45s. Stop reason: hard micro-trial cap, not a measured failure boundary.	Family: parameter tying. Current retained frontier is 1,540 parameters at 99.020000%, a +0.020000-point margin. There have been 69 prior macro-attempts and 601 prior micro-trials in this family. The most recent accepted result is attempt-0171/micro-0012 at 1,540/99.02%; the most recent failed result is attempt-0171/micro-0013, where FF-output pair 236/180 scored 98.98% at 1,539. Six measured sensitive FF-output pairs are excluded. Hypothesis: the preceding 12/13 yield and retained margin indicate another unmeasured band can qualify after skipping the isolated failure. The helper adds one nearest eligible scalar union per official micro-trial with runner-only retention/rollback. Stop at first scored discard/error, no pair, 20 trials, or 25 minutes. This is more informative than switching tensors because the current policy continues to demonstrate high replicated yield.		
attempt-0173	496e414bb0fce193091d544e161282ead684ff5c	b771b38e65ae8311a1b237b5497159b3fde5ce4d	2026-08-17T11:51:10.177365+00:00	99.010000%	1518	keep	[automation:ff-output-second-cap-continuation] Continue FF-output unions after a second fully qualifying capped band | The second-cap FF-output continuation evaluated three ordered unions. Two qualified and reduced the frontier from 1,520 to 1,518 parameters; micro-0003 proposed 1,517, failed qualification, and was rolled back. Outcomes: 2 accepts, 1 scored nonqualification, 0 errors. Compute used three official migrations/verifications over about 3m10s. Stop reason: first scored discard before the 20-trial/25-minute cap.	Family: parameter tying. Current retained frontier is 1,520 parameters at 99.120000%, a +0.120000-point margin. There have been 70 prior macro-attempts and 621 prior micro-trials in this family. The most recent accepted result is attempt-0172/micro-0020 at 1,520/99.12%; the most recent failed result remains attempt-0171/micro-0013, where FF-output pair 236/180 scored 98.98%, because attempt 172 had no failures. Six measured sensitive pairs remain excluded. Hypothesis: the second fully qualifying 20-trial band and increased accuracy margin indicate additional nearest FF-output groups can be merged; an administrative cap is not a scientific boundary. The helper adds one ordered scalar union per official micro-trial with runner-only retention/rollback. Stop at first scored discard/error, no pair, 20 trials, or 25 minutes. This is more informative than switching tensors because the immediately preceding policy again had 100% yield.		
attempt-0174	496e414bb0fce193091d544e161282ead684ff5c	496e414bb0fce193091d544e161282ead684ff5c	2026-08-17T11:53:07.283281+00:00			discard	[automation:ff-output-skip-seven-sensitive-pairs] Probe FF-output unions beyond the seventh sensitive pair | The next eligible FF-output union was tested once at 1,517 parameters and did not qualify, so it was discarded and the 1,518/99.01% incumbent restored. Outcomes: 0 accepts, 1 scored nonqualification, 0 errors; one official migration/verification in about 1m10s. Stop reason: first scored discard before the 20-trial/25-minute cap.	Family: parameter tying. Current retained frontier is 1,518 parameters at 99.010000%, a +0.010000-point margin. There have been 71 prior macro-attempts and 624 prior micro-trials in this family. The most recent accepted result is attempt-0173/micro-0002 at 1,518/99.01%; the most recent failed result is attempt-0173/micro-0003, where FF-output pair 124/234 scored 98.96% at 1,517. Seven measured FF-output sensitive pairs are excluded. Hypothesis: the latest failure is coordinate-specific and the next minimum-difference groups may reopen another qualifying band, as observed after previous skips. The helper adds one ordered union per official micro-trial with runner-only retention/rollback. Stop at first scored discard/error, no pair, 20 trials, or 25 minutes. This is more informative than abandoning the tensor after a single failure because multiple earlier skips exposed long accepted bands.		
attempt-0175	496e414bb0fce193091d544e161282ead684ff5c	496e414bb0fce193091d544e161282ead684ff5c	2026-08-17T11:54:31.812483+00:00			discard	[automation:ff-input-skip-sensitive-pair] Probe FF-input unions beyond its measured sensitive pair | The intended FF-input candidate did not reach official verification. The helper searched for the final constant-list boundary before the first class and inserted pair 147/40 into the block-0 LayerNorm bias list rather than FF_IN_TIED_PAIRS, causing a training-time IndexError. Outcomes: 0 accepts, 0 scored nonqualifications, 1 automation implementation error. The official runner recorded the error and restored the 1,518/99.01% incumbent. Stop reason: first error. No architectural inference is drawn; the boundary selector will be repaired exactly before retrying the unchanged candidate.	Family: parameter tying. Current retained frontier is 1,518 parameters at 99.010000%, a +0.010000-point margin. There have been 72 prior macro-attempts and 625 prior micro-trials in this family. The most recent accepted result is attempt-0173/micro-0002 at 1,518/99.01%; the most recent failed result is attempt-0174/micro-0001, where an FF-output union scored 98.98%. In FF input, pair 233/91 scored 3.82% in attempt-0086 and is excluded. Hypothesis: that catastrophic pair was coordinate-specific; after 186 further retained parameter reductions, the next-nearest unmeasured FF-input scalar groups may still be redundant. The helper orders eligible adjacent groups by absolute difference and adds one union per official micro-trial with runner-only retention/rollback. Stop at first scored discard/error, no pair, 20 trials, or 25 minutes. This is more informative than another FF-output skip because its last band produced no accepts, while FF input has not received the successful skip-path treatment.		
attempt-0176	7046765701f2fd2b3d886ae4cb6bf9c886b58d0e	496e414bb0fce193091d544e161282ead684ff5c	2026-08-17T12:20:05.008835+00:00	99.010000%	1498	keep	[automation:repair-ff-input-boundary-selector] Repair FF-input insertion boundary and retry the unchanged pair | After the exact boundary repair, all 20 ordered FF-input unions in the capped band qualified. The retained frontier moved from 1,518 to 1,498 parameters; no scored discards or runner errors occurred in the repaired macro. Compute used 20 official migrations/verifications over about 24m30s. Stop reason: hard micro-trial cap, not a measured failure boundary. This confirms attempt 175 was an automation-only error.	Family: parameter tying. Current retained frontier is 1,518 parameters at 99.010000%, a +0.010000-point margin. There have been 73 prior macro-attempts and 626 prior micro-trials in this family. The most recent accepted result is attempt-0173/micro-0002 at 1,518/99.01%; the most recent failed result is attempt-0175/micro-0001, an unscored automation error caused by inserting candidate pair 147/40 into the LayerNorm bias tie list. This is the permitted exact repair: change only the helper boundary to the closing delimiter immediately before FF_OUT_TIED_PAIRS, while retaining pair ranking, exclusion set, incumbent, and candidate conditions. Hypothesis remains that FF-input pair 147/40 can qualify after excluding catastrophic pair 233/91. The helper adds one ordered FF-input union per official micro-trial with runner-only retention/rollback. Stop at first scored discard/error, no pair, 20 trials, or 25 minutes. Repairing the untested candidate is more informative than choosing a new pair because attempt 175 produced no architectural evidence.		
attempt-0177	f5fbfe4c5bf44d8f04dc99a08c312805e89b29e8	7046765701f2fd2b3d886ae4cb6bf9c886b58d0e	2026-08-17T12:23:11.357459+00:00	99.000000%	1497	keep	[automation:ff-input-continuation-after-cap] Continue FF-input unions after a fully qualifying repaired band | The FF-input continuation evaluated two ordered unions. The first qualified and reduced the frontier from 1,498 to 1,497 parameters; the second proposed 1,496, failed qualification, and was rolled back. Outcomes: 1 accept, 1 scored nonqualification, 0 errors. Compute used two official migrations/verifications over about 2m25s. Stop reason: first scored discard before the 20-trial/25-minute cap.	Family: parameter tying. Current retained frontier is 1,498 parameters at 99.010000%, a +0.010000-point margin. There have been 74 prior macro-attempts and 646 prior micro-trials in this family. The most recent accepted result is attempt-0176/micro-0020 at 1,498/99.01%; the most recent failed result is attempt-0175/micro-0001, an unscored helper error, while the most recent scored failure is attempt-0174/micro-0001 at 98.98%. FF-input pair 233/91 remains excluded. Hypothesis: all 20 repaired FF-input candidates qualified, so the next minimum-difference groups should be tested under a new macro rather than treating the cap as a boundary. The helper adds one ordered union per official micro-trial with runner-only retention/rollback. Stop at first scored discard/error, no pair, 20 trials, or 25 minutes. This is more informative than switching tensors because the immediately preceding repaired policy had 100% yield.		
attempt-0178	693827426022588c59b4db6defe4efb7725c8c57	f5fbfe4c5bf44d8f04dc99a08c312805e89b29e8	2026-08-17T12:26:26.066804+00:00	99.010000%	1496	keep	[automation:ff-input-skip-two-sensitive-pairs] Continue FF-input unions after the second sensitive pair | The second-skip FF-input band evaluated two ordered unions. The first qualified and reduced the frontier from 1,497 to 1,496 parameters; the second proposed 1,495, failed qualification, and was rolled back. Outcomes: 1 accept, 1 scored nonqualification, 0 errors. Compute used two official migrations/verifications over about 2m20s. Stop reason: first scored discard before the 20-trial/25-minute cap; recent one-accept yield supports rotating tensors.	Family: parameter tying. Current retained frontier is 1,497 parameters at 99.000000%, exactly threshold. There have been 75 prior macro-attempts and 648 prior micro-trials in this family. The most recent accepted result is attempt-0177/micro-0001 at 1,497/99.00%; the most recent failed result is attempt-0177/micro-0002, where FF-input pair 231/0 scored 98.99% at 1,496. FF-input pairs 233/91 and 231/0 are excluded. Hypothesis: the one-example failure is coordinate-specific and the next minimum-difference groups may reopen a qualifying band, as in the other shared tensors. The helper adds one ordered union per official micro-trial with runner-only retention/rollback. Stop at first scored discard/error, no pair, 20 trials, or 25 minutes. This is more informative than switching immediately because it directly tests whether the newly measured failure is isolated.		
attempt-0179	693827426022588c59b4db6defe4efb7725c8c57	693827426022588c59b4db6defe4efb7725c8c57	2026-08-17T12:28:31.533099+00:00			discard	[automation:position-skip-two-sensitive-pairs] Reopen positional scalar unions beyond two measured failures | The next eligible positional scalar union was tested once at 1,495 parameters and did not qualify, so it was discarded and the 1,496/99.01% incumbent restored. Outcomes: 0 accepts, 1 scored nonqualification, 0 errors; one official migration/verification in about 1m10s. Stop reason: first scored discard before the 20-trial/25-minute cap. The positional skip-path showed no immediate yield, so the search will rotate tensors.	Family: parameter tying. Current retained frontier is 1,496 parameters at 99.010000%, a +0.010000-point margin. There have been 76 prior macro-attempts and 650 prior micro-trials in this family. The most recent accepted result is attempt-0178/micro-0001 at 1,496/99.01%; the most recent failed result is attempt-0178/micro-0002, where an FF-input union scored 98.99%. In positional scalars, pairs 1/244 and 263/315 are measured sensitive pairs and remain excluded. Hypothesis: as in QKV and both FF maps, those positional failures may be coordinate-specific, so the next minimum-difference unmeasured position groups can qualify under the much smaller retained model. The helper adds one ordered position-group union per official micro-trial with runner-only retention/rollback. Stop at first scored discard/error, no pair, 20 trials, or 25 minutes. This is more informative than another FF-input skip because recent FF-input yield fell to one accept per macro while positional skip-path breadth is untested.		
attempt-0180	e722928891750bf9d4919708e3b08852d99a3b79	693827426022588c59b4db6defe4efb7725c8c57	2026-08-17T12:35:44.916711+00:00	99.000000%	1492	keep	[automation:token-skip-two-sensitive-pairs] Reopen token scalar unions beyond two measured failures | The token skip-path evaluated five ordered unions. Four qualified and reduced the frontier from 1,496 to 1,492 parameters; micro-0005 proposed 1,491, failed qualification, and was rolled back. Outcomes: 4 accepts, 1 scored nonqualification, 0 errors. Compute used five official migrations/verifications over about 5m40s. Stop reason: first scored discard before the 20-trial/25-minute cap.	Family: parameter tying. Current retained frontier is 1,496 parameters at 99.010000%, a +0.010000-point margin. There have been 77 prior macro-attempts and 651 prior micro-trials in this family. The most recent accepted result is attempt-0178/micro-0001 at 1,496/99.01%; the most recent failed result is attempt-0179/micro-0001, where a positional union scored 98.97%. Token pairs 92/55 and 93/160 are measured sensitive pairs and remain excluded. Hypothesis: those failures are coordinate-specific, so the next minimum-difference unmeasured token groups can qualify under the much smaller retained model. The helper’s insertion boundary is proactively corrected to the delimiter before QKV_TIED_PAIRS; no candidate condition changes. It adds one ordered token union per official micro-trial with runner-only retention/rollback. Stop at first scored discard/error, no pair, 20 trials, or 25 minutes. This is more informative than extending the zero-yield positional path because token skip-path breadth beyond its second failure has not been tested.		
