attempt_id	commit	parent_commit	timestamp_utc	accuracy	parameters	status	description	proposal	train_exit	verify_exit
attempt-0077	6edffd5ebc428d9bff44da2632a74481fa540447	6edffd5ebc428d9bff44da2632a74481fa540447	2026-08-16T20:55:37.671303+00:00			error	[automation:nearest-position-unions-exhaust] Continue minimum-distortion positional unions to the first scored boundary | No micro-trial was recorded. Before source archival, training, or verification, sandboxed Git-index access failed after the runner created micro-0001; the permitted rerun then encountered that pre-existing directory and could not reuse it. This is an infrastructure error, not capacity evidence. Frontier remained 2,085 parameters at 99.04%; 0 accepted, 0 scored failures, 0 training compute. Stop reason: the active automation could not legally advance without editing an archived runner artifact.	Family: parameter tying. Current retained frontier is 2,085 parameters at 99.040000%, a +0.040000 percentage-point margin over 99%. There have been 19 prior macro-attempts in this family and 21 prior micro-trials. The most recent accepted result is attempt-0076, whose 20 checkpoint-migrated nearest positional unions moved the frontier from 2,105 to 2,085 parameters while retaining 99.04%; the most recent failed result is attempt-0075/micro-0001, an implementation error before training or scoring caused by a malformed source splice, repaired in attempt-0076. Hypothesis: further parameterization-preserving unions of the numerically closest learned positional scalar groups can remove parameters while preserving the checkpoint closely enough to qualify. Candidate ordering is ascending absolute difference between current group values, recomputed after each accepted union; this is more informative than the nearest untested alternative because the selected candidate is the minimum-distortion remaining union. Each micro-trial changes one union and is accepted or rolled back solely by run_attempt.py. Stop on the first scored failure because it closes this declared greedy path, on any reproducible error for inspection, or when no pair remains. The cap of 478 covers all possible unions among the 479 current positional groups. Compute budget: at most 478 checkpoint migrations and official verifications or 10 wall-clock hours, with the first qualifying stop condition taking precedence.		
attempt-0078	e82d67b9e8675a7626c9ce5d730cdfc17cbac39d	6edffd5ebc428d9bff44da2632a74481fa540447	2026-08-17T02:25:39.172539+00:00	99.010000%	1793	keep	[automation:nearest-position-unions-infra-repair] Repair infrastructure launch and exhaust minimum-distortion positional unions | Evaluated 293 consecutive minimum-difference positional group unions (micro-0001 through micro-0293). The first 292 qualified and were retained, moving the frontier from 2,085 parameters at 99.04% to 1,793 parameters at 99.01%; micro-0293 proposed 1,792 parameters and scored 98.97%, so it was discarded and rolled back. There were 0 errors. Compute used checkpoint migration plus 293 official verifications, no fresh optimization, over 5h29m09s wall clock from automation start to the scored boundary. Stop reason: the first scored failure closed the declared greedy minimum-distortion path before the 478-trial/10-hour cap.	Family: parameter tying. Current retained frontier is 2,085 parameters at 99.040000%, a +0.040000 percentage-point margin over 99%. There have been 20 prior macro-attempts in this family and 21 prior micro-trials. The most recent accepted result is attempt-0076, whose 20 nearest positional unions reduced the frontier from 2,105 to 2,085 parameters at 99.04%; the most recent failed result is attempt-0077, an infrastructure error before source archival, training, scoring, or micro-trial recording because sandboxed Git access left an unusable micro directory. This is the permitted repair of the same intended candidate: run with repository-write permission established before the first micro-trial; architecture, candidate ordering, acceptance, and stopping conditions are unchanged. Hypothesis: further parameterization-preserving minimum-difference positional unions can reduce count while preserving qualification. Ordering is ascending absolute difference between current group values, recomputed after every accepted union, and is more informative than the nearest untested alternative because each chosen pair has minimum current distortion. The official runner alone accepts or rolls back. Stop at the first scored failure, any further reproducible error, or no remaining pair. The 478-trial cap covers all possible unions among 479 current groups. Compute budget: at most 478 checkpoint migrations and official verifications or 10 wall-clock hours, with the first stop condition taking precedence.		
attempt-0079	a041f63b9c301e072b092d01ff31751e6d6f1d54	e82d67b9e8675a7626c9ce5d730cdfc17cbac39d	2026-08-17T02:31:08.605954+00:00	99.010000%	1791	keep	[automation:next-position-unions-after-sensitive-pair] Test next-nearest positional unions after excluding the first scored-sensitive pair | Evaluated the three next-minimum-difference positional unions after excluding attempt-0078's rejected (1,244) pair. micro-0001 and micro-0002 qualified and were retained, moving the frontier from 1,793 parameters at 99.01% to 1,791 parameters at 99.01%; micro-0003 proposed 1,790 parameters and scored 98.91%, so it was discarded and rolled back. There were 2 accepts, 1 scored discard, and 0 errors. Compute used checkpoint migration plus 3 official verifications, no fresh optimization, over 3m32s wall clock. Stop reason: the first scored failure closed this revised nearest-eligible path before the 20-trial/30-minute cap.	Family: parameter tying. Current retained frontier is 1,793 parameters at 99.010000%, a +0.010000 percentage-point margin over 99%. There have been 21 prior macro-attempts and 314 prior micro-trials in this family. The most recent accepted result is attempt-0078/micro-0292, which retained 1,793 parameters at 99.01%; the most recent failed result is attempt-0078/micro-0293, whose union of positional groups represented by coordinates 244 and 1 produced 1,792 parameters but scored 98.97% and was rolled back. Hypothesis: that failure reflects coordinate-specific sensitivity rather than a universal pairwise-difference floor, so excluding exactly (1,244) and ordering all remaining candidates by ascending current absolute group-value difference can identify a still-neutral union. This parameterization-preserving compression is more informative than the nearest untested alternative of changing tensor family immediately because it directly discriminates pair sensitivity from the measured 4.202e-4 distortion boundary. Each micro-trial adds exactly one eligible union; the official runner alone accepts or rolls back. Stop at the first scored discard or error, at the 20-micro-trial cap, or if no eligible pair remains. Compute budget: at most 20 checkpoint migrations and official verifications or 30 wall-clock minutes, whichever boundary occurs first.		
attempt-0080	732b17f6e96b16a5d189c42a3dcb4e619ab13044	a041f63b9c301e072b092d01ff31751e6d6f1d54	2026-08-17T02:34:48.503456+00:00	99.010000%	1790	keep	[automation:nearest-token-matrix-unions] Reconstruct the tied token matrix from scalar groups and test nearest-value unions | Evaluated two nearest token-matrix scalar unions. micro-0001 qualified at 1,790 parameters and 99.01% and was retained. micro-0002 was not scored: training exited with a reproducible implementation error because checkpoint migration still indexed the removed dense token_emb.weight key after the first sparse token checkpoint; it is not capacity evidence. Frontier moved from 1,791 to 1,790 parameters; 1 accept, 1 implementation error, 0 scored discards. Compute used one checkpoint migration and one official verification plus a negligible failed launch over 1m17s wall clock. Stop reason: recorded implementation error before the 20-trial/30-minute cap.	Family: parameter tying. Current retained frontier is 1,791 parameters at 99.010000%, a +0.010000 percentage-point margin over 99%. There have been 22 prior macro-attempts and 317 prior micro-trials in this family. The most recent accepted result is attempt-0079/micro-0002 at 1,791 parameters and 99.01%; the most recent failed result is attempt-0079/micro-0003, a positional union candidate at 1,790 parameters that scored 98.91% and was rolled back. Hypothesis: scalar sensitivity is tensor-site-specific, so reconstructing the tied input/output token matrix from honestly counted scalar groups and unioning its closest values can compress a different representation without crossing the positional failure boundary. Ordering is ascending absolute difference among current token-matrix groups, recomputed after each keep. This parameterization-preserving compression is more informative than a third positional exclusion branch because it tests whether fragility is localized to position encoding while preserving the token matrix exactly before the first union. Each micro-trial changes exactly one union; the official runner alone accepts or rolls back. Stop at the first scored discard or error, after 20 micro-trials, or if no token pair remains. Compute budget: at most 20 checkpoint migrations and official verifications or 30 wall-clock minutes, whichever boundary occurs first.		
attempt-0081	76b797df9fd2d9b42b82d99720958d50ba25fc7e	732b17f6e96b16a5d189c42a3dcb4e619ab13044	2026-08-17T02:44:08.137784+00:00	99.000000%	1784	keep	[automation:nearest-token-matrix-unions-repair] Repair sparse-token checkpoint migration and resume nearest token scalar unions | Repaired sparse-token checkpoint migration and evaluated 7 nearest token-matrix unions. The first 6 qualified and were retained, moving the frontier from 1,790 parameters at 99.01% to 1,784 parameters at exactly 99.00%; micro-0007 proposed 1,783 parameters and scored 98.97%, so it was discarded and rolled back. There were 6 accepts, 1 scored discard, and 0 errors after repair. Compute used checkpoint migration plus 7 official verifications, no fresh optimization, over 8m38s wall clock. Stop reason: first scored failure closed the repaired nearest-token path before the 20-trial/30-minute cap.	Family: parameter tying. Current retained frontier is 1,790 parameters at 99.010000%, a +0.010000 percentage-point margin over 99%. There have been 23 prior macro-attempts and 319 prior micro-trials in this family. The most recent accepted result is attempt-0080/micro-0001, whose closest token-matrix scalar union retained 1,790 parameters at 99.01%; the most recent failed result is attempt-0080/micro-0002, an implementation error before verification because train.py indexed the obsolete dense token_emb.weight key after migration to token_emb.values. This is the permitted repair of the same intended candidate: checkpoint metadata now obtains vocabulary size from token_emb.value_indices when the incumbent is sparse; architecture, second union, ordering, acceptance, and stopping conditions are unchanged. Hypothesis: minimum-difference unions in the tied input/output token matrix preserve qualification beyond the first retained union. Ordering is ascending absolute current token-group difference and is more informative than the next untested alternative because repairing micro-0002 isolates implementation from capacity at the exact candidate that was never scored. The official runner alone accepts or rolls back. Stop at the first scored discard or further error, at 20 micro-trials, or if no pair remains. Compute budget: at most 20 checkpoint migrations and official verifications or 30 wall-clock minutes.		
attempt-0082	0adaf7fa3562f141d80ab9757d484949c2cd4d53	76b797df9fd2d9b42b82d99720958d50ba25fc7e	2026-08-17T03:10:41.701500+00:00	99.010000%	1764	keep	[automation:nearest-shared-qkv-unions] Reconstruct the depth-shared QKV matrix from scalar groups and test nearest-value unions | Completed the declared 20 nearest shared-QKV scalar unions. All 20 qualified and were retained, moving the frontier from 1,784 parameters at 99.00% to 1,764 parameters at 99.01%; 20 accepts, 0 discards, 0 errors. Pairwise differences rose through 1.892e-5. Compute used checkpoint migration plus 20 official verifications, no fresh optimization, over 24m37s wall clock. Stop reason: fixed 20-micro-trial cap; no scored boundary was reached.	Family: parameter tying. Current retained frontier is 1,784 parameters at 99.000000%, a +0.000000 percentage-point margin over 99%. There have been 24 prior macro-attempts and 326 prior micro-trials in this family. The most recent accepted result is attempt-0081/micro-0006 at 1,784 parameters and 99.00%; the most recent failed result is attempt-0081/micro-0007, whose next token-matrix union proposed 1,783 parameters and scored 98.97%. Hypothesis: the already depth-shared 768-scalar QKV transform contains much closer duplicate values than the token matrix, so reconstructing it from scalar groups and unioning the least-separated groups can compress the attention parameterization without the token site's measured sensitivity. Ordering is ascending absolute current QKV-group difference, recomputed after every keep. This parameterization-preserving attention substitution is more informative than excluding the failed token pair because it tests a new large tensor with smaller perturbations and separates tensor sensitivity from the zero observed accuracy margin. Each micro-trial changes one QKV union; the official runner alone accepts or rolls back. Stop on the first scored discard or error, at the 20-micro-trial cap, or when no group pair remains. Compute budget: at most 20 checkpoint migrations and official verifications or 30 wall-clock minutes.		
attempt-0083	8bc754bff8bd13f93e1726431a4973a0d16cf297	0adaf7fa3562f141d80ab9757d484949c2cd4d53	2026-08-17T03:35:44.826086+00:00	99.010000%	1744	keep	[automation:next-shared-qkv-union-band] Test the next 20 minimum-difference unions in the shared QKV matrix | Completed the second declared band of 20 nearest shared-QKV scalar unions. All 20 qualified and were retained, moving the frontier from 1,764 parameters at 99.01% to 1,744 parameters at 99.01%; 20 accepts, 0 discards, 0 errors. Pairwise differences rose through 4.096e-5. Compute used checkpoint migration plus 20 official verifications, no fresh optimization, over 24m01s wall clock. Stop reason: fixed 20-micro-trial cap; no scored QKV boundary was reached.	Family: parameter tying. Current retained frontier is 1,764 parameters at 99.010000%, a +0.010000 percentage-point margin over 99%. There have been 25 prior macro-attempts and 346 prior micro-trials in this family. The most recent accepted result is attempt-0082/micro-0020 at 1,764 parameters and 99.01%; the most recent failed result is attempt-0081/micro-0007, a token-matrix union at 1,783 parameters that scored 98.97%. Hypothesis: the shared QKV matrix contains a broader band of near-duplicate scalars beyond the first 20 accepted unions, so continuing the recomputed ascending-difference ordering for one additional fixed band can reduce count while preserving qualification. This parameterization-preserving compression is more informative than switching immediately to feed-forward scalars because it measures whether the prior cap, rather than a QKV sensitivity boundary, stopped progress; the next current QKV union is the nearest untested candidate in that site. Each micro-trial adds one union and the official runner alone accepts or rolls back. Stop on the first scored discard or error, at the 20-micro-trial cap, or if no pair remains. Compute budget: at most 20 checkpoint migrations and official verifications or 30 wall-clock minutes.		
attempt-0084	f2048e7224960779b1ee1f3f5cccc623f1392f07	8bc754bff8bd13f93e1726431a4973a0d16cf297	2026-08-17T04:01:51.562936+00:00	99.020000%	1724	keep	[automation:nearest-shared-ff-input-unions] Reconstruct the shared feed-forward input map from scalar groups and test nearest unions | Completed the declared 20 nearest shared feed-forward input scalar unions. All 20 qualified and were retained, moving the frontier from 1,744 parameters at 99.01% to 1,724 parameters at 99.02%; 20 accepts, 0 discards, 0 errors. Pairwise differences rose through 1.888e-4. Compute used checkpoint migration plus 20 official verifications, no fresh optimization, over 24m33s wall clock. Stop reason: fixed 20-micro-trial cap; no scored FF-input boundary was reached.	Family: parameter tying. Current retained frontier is 1,744 parameters at 99.010000%, a +0.010000 percentage-point margin over 99%. There have been 26 prior macro-attempts and 366 prior micro-trials in this family. The most recent accepted result is attempt-0083/micro-0020 at 1,744 parameters and 99.01%; the most recent failed result is attempt-0081/micro-0007, whose token-matrix union scored 98.97%. Hypothesis: the depth-shared feed-forward input map contains near-duplicate learned scalars independent of the two accepted QKV bands, so reconstructing only this nonlinear feature-construction matrix from scalar groups and greedily unioning its closest values can reduce count without perturbing attention or the FF output map. Ordering is ascending absolute current group-value difference, recomputed after every keep. This parameterization-preserving substitution is more informative than a third QKV band because it tests whether redundancy transfers to a different mechanism while isolating the input side of the FF path. Each micro-trial adds one union and the official runner alone accepts or rolls back. Stop on the first scored discard or error, at the 20-micro-trial cap, or if no pair remains. Compute budget: at most 20 checkpoint migrations and official verifications or 30 wall-clock minutes.		
attempt-0085	2753ce4cf4b2ae0a180c09885939688102954562	f2048e7224960779b1ee1f3f5cccc623f1392f07	2026-08-17T04:28:58.229000+00:00	99.010000%	1704	keep	[automation:nearest-shared-ff-output-unions] Reconstruct the shared feed-forward output map from scalar groups and test nearest unions | Completed the declared 20 nearest shared feed-forward output scalar unions. All 20 qualified and were retained, moving the frontier from 1,724 parameters at 99.02% to 1,704 parameters at 99.01%; 20 accepts, 0 discards, 0 errors. Pairwise differences rose through 1.006e-4. Compute used checkpoint migration plus 20 official verifications, no fresh optimization, over 25m41s wall clock. Stop reason: fixed 20-micro-trial cap; no scored FF-output boundary was reached.	Family: parameter tying. Current retained frontier is 1,724 parameters at 99.020000%, a +0.020000 percentage-point margin over 99%. There have been 27 prior macro-attempts and 386 prior micro-trials in this family. The most recent accepted result is attempt-0084/micro-0020 at 1,724 parameters and 99.02%; the most recent failed result is attempt-0081/micro-0007, whose token-matrix union scored 98.97%. Hypothesis: the depth-shared feed-forward output map contains near-duplicate scalars distinct from the accepted input-map band, so reconstructing only residual-stream synthesis from scalar groups and greedily unioning its closest values can reduce count without perturbing feature construction or attention. Ordering is ascending absolute current group-value difference, recomputed after every keep. This parameterization-preserving substitution is more informative than another FF-input band because it separates the complementary output transformation and identifies which side of the nonlinear path first becomes sensitive. Each micro-trial adds one union and the official runner alone accepts or rolls back. Stop on the first scored discard or error, at the 20-micro-trial cap, or if no pair remains. Compute budget: at most 20 checkpoint migrations and official verifications or 30 wall-clock minutes.		
attempt-0086	2753ce4cf4b2ae0a180c09885939688102954562	2753ce4cf4b2ae0a180c09885939688102954562	2026-08-17T04:31:15.739022+00:00			discard	[automation:next-shared-ff-input-union-band] Test the second 20-union difference band in the shared feed-forward input map | The second FF-input band stopped on its first micro-trial. Unioning the next closest FF-input groups proposed 1,703 parameters but scored 3.82%, so it was discarded and rolled back; the frontier remained 1,704 parameters at 99.01%. Outcomes: 0 accepts, 1 scored discard, 0 errors. Compute used one checkpoint migration and one official verification over 1m32s wall clock. Stop reason: the first scored failure closed this larger-difference FF-input path before the 20-trial/30-minute cap.	Family: parameter tying. Current retained frontier is 1,704 parameters at 99.010000%, a +0.010000 percentage-point margin over 99%. There have been 28 prior macro-attempts and 406 prior micro-trials in this family. The most recent accepted result is attempt-0085/micro-0020 at 1,704 parameters and 99.01%; the most recent failed result remains attempt-0081/micro-0007, whose token-matrix union scored 98.97%. The first FF-input band in attempt-0084 retained all 20 unions. Hypothesis: feature-construction redundancy extends into the next, larger-difference band, and continuing ascending current group difference for one fixed band will reveal its boundary while leaving QKV and FF-output groups unchanged. This parameterization-preserving compression is more informative than immediately taking a second FF-output band because its next untested difference scale is higher and therefore provides a stronger sensitivity test. Each micro-trial adds one FF-input union and the official runner alone accepts or rolls back. Stop on the first scored discard or error, at 20 micro-trials, or if no pair remains. Compute budget: at most 20 checkpoint migrations and official verifications or 30 wall-clock minutes.		
