attempt_id	commit	parent_commit	timestamp_utc	accuracy	parameters	status	description	proposal	train_exit	verify_exit
attempt-0195	1e7f82f56cad50c70442178db8ace6201121936d	52b4742d0d8905544e124e414cde7543004cb092	2026-08-17T14:19:42.221153+00:00	99.060000%	1432	keep	[automation:ffin-final-band-one] Bounded three-trial nearest-union probe of the shared FF-input map | All three bounded FF-input unions qualified, reducing the retained frontier from 1,435 to 1,432 parameters; the final authorized trial retained 99.060000%. The automation stopped exactly at its declared three-trial cap.	Family: parameter tying. Current retained frontier is 1,435 parameters at 99.090000%, a +0.090000 percentage-point margin over 99%. There have been 92 prior macro-attempts in this family and 720 prior micro-trials. The most recent accepted result is attempt-0194/micro-0001 at 1,435 parameters and 99.09%; the most recent failed result is attempt-0194/micro-0002, an FF-output union discarded at 98.91%. This macro tests at most three sequential minimum-distance scalar unions in the depth-shared FF-input map, excluding every unchanged pair already rejected at this site. Hypothesis: nonlinear feature construction may retain near-duplicate scalars after the complementary FF-output boundary was reached. This is more informative than the nearest untested alternative because each micro-trial selects the least-distorting eligible FF-input union, separating this tensor site from the just-observed FF-output failure while bounding adaptation to three official trials. Stop at the first discard/error, exhaustion, or declared cap; official acceptance and rollback remain solely controlled by the runner.		
attempt-0196	57876961063cdf322f8b6f115306c220088b0df0	1e7f82f56cad50c70442178db8ace6201121936d	2026-08-17T14:24:57.791694+00:00	99.080000%	1429	keep	[automation:token-final-band-one] Bounded three-trial nearest-union probe of the tied token matrix | All three bounded token-matrix unions qualified, reducing the retained frontier from 1,432 to 1,429 parameters; the final authorized trial retained 99.080000%. The automation stopped exactly at its declared three-trial cap.	Family: parameter tying. Current retained frontier is 1,432 parameters at 99.060000%, a +0.060000 percentage-point margin over 99%. There have been 93 prior macro-attempts in this family and 723 prior micro-trials. The most recent accepted result is attempt-0195/micro-0003 at 1,432 parameters and 99.06%; the most recent failed result is attempt-0194/micro-0002, an FF-output union discarded at 98.91%. This macro tests at most three sequential minimum-distance scalar unions in the tied input/output token matrix, excluding unchanged token pairs already rejected. Hypothesis: the embedding matrix may retain a small redundancy band independent of the two shared FF maps. This is more informative than the nearest untested alternative because each candidate is the current least-distorting eligible token union, directly contrasting tensor-specific sensitivity with the preceding FF-input successes under a strict three-trial bound. Stop on the first discard/error, exhaustion, or cap; official acceptance and rollback remain solely controlled by the runner.		
attempt-0197	34420fca22080a8b9a0270fe9d1b03dd30ab5081	57876961063cdf322f8b6f115306c220088b0df0	2026-08-17T14:30:58.575771+00:00	99.100000%	1426	keep	[automation:position-final-band-two] Bounded three-trial nearest-union probe of the tied positional table | All three bounded positional unions qualified, reducing the retained frontier from 1,429 to 1,426 parameters; the final authorized trial retained 99.100000%. The automation stopped exactly at its declared three-trial cap.	Family: parameter tying. Current retained frontier is 1,429 parameters at 99.080000%, a +0.080000 percentage-point margin over 99%. There have been 94 prior macro-attempts in this family and 726 prior micro-trials. The most recent accepted result is attempt-0196/micro-0003 at 1,429 parameters and 99.08%; the most recent failed result is attempt-0194/micro-0002, an FF-output union discarded at 98.91%. This macro tests at most three sequential minimum-distance scalar unions in the tied positional table, excluding unchanged positional pairs already rejected. Hypothesis: the positional encoding has a distinct sensitivity profile and may contain additional low-distortion redundancy after token and FF-input compression. This is more informative than the nearest untested alternative because each trial selects the current least-distorting eligible positional union, offering a tensor-site contrast with the token successes under a strict three-trial adaptive bound. Stop at the first discard/error, exhaustion, or cap; official acceptance and rollback remain solely controlled by the runner.		
attempt-0198	70c2609476d6ccaa4c1c3308ba011571d88a7f23	34420fca22080a8b9a0270fe9d1b03dd30ab5081	2026-08-17T14:35:57.738150+00:00	99.080000%	1423	keep	[automation:qkv-final-band-two] Second bounded three-trial nearest-union probe of the shared QKV map | All three bounded QKV unions qualified, reducing the retained frontier from 1,426 to 1,423 parameters; the final authorized trial retained 99.080000%. The automation stopped exactly at its declared three-trial cap.	Family: parameter tying. Current retained frontier is 1,426 parameters at 99.100000%, a +0.100000 percentage-point margin over 99%. There have been 95 prior macro-attempts in this family and 729 prior micro-trials. The most recent accepted result is attempt-0197/micro-0003 at 1,426 parameters and 99.10%; the most recent failed result is attempt-0194/micro-0002, an FF-output union discarded at 98.91%. This macro tests at most three sequential minimum-distance scalar unions in the depth-shared QKV transform, excluding unchanged QKV pairs already rejected. Hypothesis: the largest tied tensor may still contain very close scalar groups after embedding-site compression. This is more informative than the nearest untested alternative because each candidate is the current minimum-distortion eligible QKV union and directly tests whether the earlier QKV success band continues after independent positional reductions, while bounding adaptation to three trials. Stop on the first discard/error, exhaustion, or cap; official acceptance and rollback remain solely controlled by the runner.		
attempt-0199	66e7669074bd7d135324b92fc42925a7c95dd86f	70c2609476d6ccaa4c1c3308ba011571d88a7f23	2026-08-17T14:40:54.277659+00:00	99.050000%	1420	keep	[automation:ffout-final-band-two] Second bounded three-trial nearest-union probe of the shared FF-output map | All three bounded FF-output unions qualified after excluding the earlier rejected exact pair, reducing the retained frontier from 1,423 to 1,420 parameters; the final authorized trial retained 99.050000%. The automation stopped exactly at its declared cap.	Family: parameter tying. Current retained frontier is 1,423 parameters at 99.080000%, a +0.080000 percentage-point margin over 99%. There have been 96 prior macro-attempts in this family and 732 prior micro-trials. The most recent accepted result is attempt-0198/micro-0003 at 1,423 parameters and 99.08%; the most recent failed result is attempt-0194/micro-0002, FF-output pair 106/12 discarded at 98.91%. This macro tests at most three sequential minimum-distance scalar unions in the depth-shared FF-output map, excluding every unchanged FF-output pair already rejected, including 106/12. Hypothesis: subsequent FF-input, token, positional, and QKV compression may reveal another isolated admissible FF-output union beyond the earlier local failure. This is more informative than the nearest untested alternative because the rejected exact pair is held out and each trial selects the next least-distorting eligible FF-output union, directly separating pair-specific sensitivity from a global tensor boundary under a three-trial cap. Stop at the first discard/error, exhaustion, or cap; official acceptance and rollback remain solely controlled by the runner.		
attempt-0200	553f9516e9e7deed44b63d56a58f41296dc07460	66e7669074bd7d135324b92fc42925a7c95dd86f	2026-08-17T14:45:23.883436+00:00	99.030000%	1417	keep	[automation:ffin-final-band-two] Second bounded three-trial nearest-union probe of the shared FF-input map | All three bounded FF-input unions qualified, reducing the retained frontier from 1,420 to 1,417 parameters; the final authorized trial retained 99.030000%. The automation stopped exactly at its declared three-trial cap, completing macro attempt 200.	Family: parameter tying. Current retained frontier is 1,420 parameters at 99.050000%, a +0.050000 percentage-point margin over 99%. There have been 97 prior macro-attempts in this family and 735 prior micro-trials. The most recent accepted result is attempt-0199/micro-0003 at 1,420 parameters and 99.05%; the most recent failed result is attempt-0194/micro-0002, an FF-output union discarded at 98.91%. This final macro tests at most three sequential minimum-distance scalar unions in the depth-shared FF-input map, excluding every unchanged FF-input pair previously rejected. Hypothesis: FF-input feature construction may retain another narrow redundancy band after the later QKV and FF-output reductions. This is more informative than the nearest untested alternative because each trial selects the current least-distorting eligible FF-input union, complementing the immediately preceding FF-output band while keeping adaptive multiplicity strictly bounded. Stop at the first discard/error, exhaustion, or declared cap; official acceptance and rollback remain solely controlled by the runner.		
