attempt_id	commit	parent_commit	timestamp_utc	accuracy	parameters	status	description	proposal	train_exit	verify_exit
attempt-0097	cbdac9b799e0090fae5f4aa80f151d046c06bb65	a1dfac6cb503f577ebebcb35e93ea9788786fa40	2026-08-17T05:37:13.288194+00:00	0.000000%	1481	discard	Repair ref collision and test per-head symmetric bilinear attention	Family: attention organization. Current retained frontier is 1,672 parameters at 99.010000%, a +0.010000 percentage-point margin over 99%. There have been 3 prior logged attempts in this family. The most recent accepted result is attempt-0020, which removed attention output projections and qualified at 3,168 parameters and 99.94%; the most recent failed result is attempt-0036, an optimization failure for a 14-dimensional query-key bottleneck with no official score. The immediately preceding launch of this exact candidate was an infrastructure failure before archival, training, scoring, result recording, or budget consumption: an unrelated stale attempt-0097/micro-0001 ref and empty directory blocked the regular attempt ref; its commit was preserved under refs/autoresearch/recovered and the conflicting artifacts were removed. Candidate and conditions are unchanged. Hypothesis: query/key factors primarily identify a per-head bilinear form, and constraining that form to be symmetric retains task-relevant compatibility geometry while removing factorization redundancy. This is a major representational change, not scalar pruning: each head stores 136 triangular bilinear coefficients plus a shared 16x16 value map, replacing 719 learned QKV groups and yielding 1,481 parameters by checkpoint projection. It is more informative than a full bilinear alternative because the full form would exceed the retained QKV count and could not satisfy strict reduction; symmetry is the least restrictive directly compressive bilinear substitution. Generic causal softmax self-attention and autoregressive decoding remain intact.	0	0
attempt-0098	74038cf0fae2538628bac01d72327f283d342726	a1dfac6cb503f577ebebcb35e93ea9788786fa40	2026-08-17T05:41:50.842258+00:00	0.030000%	1465	discard	Repair legacy refs and test head-shared asymmetric bilinear attention	Family: attention organization. Current retained frontier is 1,672 parameters at 99.010000%, a +0.010000 percentage-point margin over 99%. There have been 4 prior logged attempts in this family. The most recent accepted result is attempt-0020, which removed attention output projections and qualified at 3,168 parameters and 99.94%; the most recent failed result is attempt-0097, whose per-head symmetric bilinear substitution was a valid nonqualification at 1,481 parameters and 0.00%. The immediately preceding launch of this exact candidate was an infrastructure failure before archival, training, scoring, result recording, or budget consumption: a legacy attempt-0098/micro-0001 ref blocked the regular ref. An audit found the same unrecorded legacy pattern through attempt 0200; all 103 commits were atomically preserved under refs/autoresearch/recovered/legacy-* and only their conflicting names plus the empty attempt-0098 directory were removed. Candidate and conditions are unchanged. Hypothesis: attempt-0097 failed because addition requires directed query-to-key compatibility, not because separate Q/K factors or head-specific forms are essential. This major representational change preserves a full asymmetric 16x16 bilinear form, shares it across heads, retains the 16x16 value transform, and yields 1,465 parameters by averaging the checkpoint-derived head forms. It is more informative than a low-rank per-head alternative because it isolates head-specific geometry while restoring every asymmetric interaction removed by the failed symmetric candidate. Generic causal softmax self-attention and autoregressive greedy decoding remain intact.	0	0
attempt-0099	c4c2ffc99d9eda87d7f0c84c1c0de316bed4e36a	a1dfac6cb503f577ebebcb35e93ea9788786fa40	2026-08-17T05:44:23.436207+00:00	0.050000%	1585	discard	Share symmetric query-key geometry while retaining head-specific skew components	Family: attention organization. Current retained frontier is 1,672 parameters at 99.010000%, a +0.010000 percentage-point margin over 99%. There have been 5 prior attempts in this family. The most recent accepted result is attempt-0020, which removed attention output projections and qualified at 3,168 parameters and 99.94%; the most recent failed result is attempt-0098, whose fully head-shared asymmetric bilinear form scored 0.03% at 1,465 parameters. Together with attempt-0097's 0.00% symmetric per-head result, the evidence indicates both directionality and head identity matter. Hypothesis: head identity is carried primarily by the directed antisymmetric component, while undirected similarity geometry can be shared. This major representational change stores one shared 136-scalar symmetric form, two head-specific 120-scalar skew forms, and the 256-scalar value map, yielding 1,585 parameters by checkpoint decomposition. It is more informative than an arbitrary low-rank factorization because it preserves the two exact structural components separately falsified by attempts 0097 and 0098, changing only whether the symmetric component is head-specific. Generic causal softmax self-attention and autoregressive decoding remain intact.	0	0
attempt-0100	8c7aae2a7a347c9e72ccd2263f1a6e27c160c348	a1dfac6cb503f577ebebcb35e93ea9788786fa40	2026-08-17T05:46:45.221056+00:00	0.130000%	1601	discard	Retain head-specific symmetric geometry while sharing query-key skew	Family: attention organization. Current retained frontier is 1,672 parameters at 99.010000%, a +0.010000 percentage-point margin over 99%. There have been 6 prior attempts in this family. The most recent accepted result is attempt-0020, which removed attention output projections and qualified at 3,168 parameters and 99.94%; the most recent failed result is attempt-0099, whose shared-symmetric/head-specific-skew decomposition scored 0.05% at 1,585 parameters. Hypothesis: head identity is carried by undirected similarity geometry rather than by the directed component. This major representational change tests the exact complement of attempt-0099: two head-specific 136-scalar symmetric forms, one shared 120-scalar skew form, and the 256-scalar value map, yielding 1,601 parameters by checkpoint decomposition. It is more informative than another generic low-rank alternative because attempts 0097-0099 separately establish that symmetry-only, full head-sharing, and head-specific skew are insufficient; this candidate uniquely preserves head-specific symmetric structure while restoring directionality. Generic causal softmax self-attention and autoregressive decoding remain intact.	0	0
attempt-0101	99eb00d9b9b6eedb8d14a9a99bbdfa359031928c	a1dfac6cb503f577ebebcb35e93ea9788786fa40	2026-08-17T05:49:09.137935+00:00	0.000000%	1593	discard	Use block-diagonal per-head value maps with full retained query-key maps	Family: attention organization. Current retained frontier is 1,672 parameters at 99.010000%, a +0.010000 percentage-point margin over 99%. There have been 7 prior attempts in this family. The most recent accepted result is attempt-0020, which removed attention output projections and qualified at 3,168 parameters and 99.94%; the most recent failed result is attempt-0100, whose head-specific-symmetric/shared-skew QK decomposition scored 0.13% at 1,601 parameters. Attempts 0097-0100 collectively close direct Q/K bilinear compression. Hypothesis: each value head primarily reads its corresponding eight-dimensional residual subspace, so cross-half value weights are redundant even though full retained Q/K geometry is necessary. This major attention-organization change preserves the reconstructed 32x16 Q/K maps exactly, replaces the 16x16 value map with two learned 8x8 diagonal blocks migrated from the checkpoint, and yields 1,593 parameters. It is more informative than a diagonal value map because it retains all within-head mixing while isolating whether cross-head residual input mixing is needed. Generic two-head causal softmax self-attention and autoregressive decoding remain intact.	0	0
attempt-0102	d8e920be72655e23618bea7cdb13879570c3f5b4	a1dfac6cb503f577ebebcb35e93ea9788786fa40	2026-08-17T05:51:18.552919+00:00	0.000000%	1657	discard	Replace the value map with a global rank-6 SVD factorization	Family: attention organization. Current retained frontier is 1,672 parameters at 99.010000%, a +0.010000 percentage-point margin over 99%. There have been 8 prior attempts in this family. The most recent accepted result is attempt-0020, which removed attention output projections and qualified at 3,168 parameters and 99.94%; the most recent failed result is attempt-0101, whose block-diagonal per-head value maps scored 0.00% at 1,593 parameters. Hypothesis: attempt-0101 failed because it removed global cross-half value mixing, whereas the learned value transform may still have low intrinsic rank. This major representational change preserves the reconstructed 32x16 Q/K maps exactly and replaces the global 16x16 value map with its best rank-6 SVD factorization (16x6 and 6x16), yielding 1,657 parameters. It is more informative than a rank-5 candidate because rank 6 is the highest integer rank that produces a strict parameter reduction once full Q/K maps are retained; it therefore tests value-rank compression with minimum representational loss. Generic two-head causal softmax self-attention and autoregressive decoding remain intact.	0	0
attempt-0103	ec91a64554b3424ff8bd3bcc65770559361b0142	a1dfac6cb503f577ebebcb35e93ea9788786fa40	2026-08-17T05:53:31.175393+00:00	0.000000%	1465	discard	Use one transpose-tied square transform for both feed-forward projections	Family: parameter tying. Current retained frontier is 1,672 parameters at 99.010000%, a +0.010000 percentage-point margin over 99%. There have been 39 prior macro-attempts and 449 prior micro-trials in this family. The most recent accepted result is attempt-0095/micro-0001, a block-0 pre-FF bias union retained at 1,672 parameters and 99.01%; the most recent failed result is attempt-0096/micro-0001, whose pre-attention scale union scored 98.90%. Hypothesis: the square width-16 GELU feed-forward path can use one learned feature transform and its transpose for residual reconstruction, eliminating an independently learned output map while preserving nonlinear width and depth sharing. This is a major representational tying change, not scalar pruning: the two current grouped 16x16 maps are projected to one dense 16x16 matrix by averaging the input map with the output transpose, yielding 1,465 parameters. It is more informative than the nearest untested same-orientation tie because transpose tying aligns analysis and synthesis coordinates and is the least disruptive autoencoder-like constraint for a square bottleneck. Attention, normalization, autoregressive logits, and generic decoding remain unchanged.	0	0
attempt-0104	8abb8ff909c23b191aeda43f49879f0a3b3343b1	a1dfac6cb503f577ebebcb35e93ea9788786fa40	2026-08-17T05:55:30.349776+00:00	0.000000%	1465	discard	Reuse one square feed-forward map in the same orientation around GELU	Family: parameter tying. Current retained frontier is 1,672 parameters at 99.010000%, a +0.010000 percentage-point margin over 99%. There have been 40 prior macro-attempts and 449 prior micro-trials in this family. The most recent accepted result is attempt-0095/micro-0001 at 1,672 parameters and 99.01%; the most recent failed result is attempt-0103, whose transpose-tied feed-forward substitution scored 0.00% at 1,465 parameters. Hypothesis: attempt-0103 failed because transposition misaligned learned feature coordinates, while the same square transform may be reusable in the same orientation before and after GELU. This major representational tying change averages the two reconstructed 16x16 maps without transposition and reuses the resulting matrix twice, yielding 1,465 parameters while preserving nonlinear width and shared depth. It is more informative than an untied low-rank factorization because it is the exact categorical complement of the failed transpose geometry and directly tests whether independence or orientation caused the failure. Attention, normalization, autoregressive logits, and generic decoding remain unchanged.	0	0
attempt-0105	9eafb391bc0b1b7a8066b9135c4771d1dda50b32	a1dfac6cb503f577ebebcb35e93ea9788786fa40	2026-08-17T05:57:57.727278+00:00	0.010000%	1660	discard	Factor only the shared feed-forward input transform at rank 7	Family: feed-forward width. Current retained frontier is 1,672 parameters at 99.010000%, a +0.010000 percentage-point margin over 99%. There have been 15 prior attempts in this family. The most recent accepted result is attempt-0022, which retained projection-free feed-forward width 10 at 3,040 parameters and 99.85%; the most recent failed result is attempt-0032, an optimization failure with no official score for the fully shared width-15 model after correcting shifted teacher forcing. Hypothesis: the present width-16 nonlinear state is useful, but its shared input transform has intrinsic rank 7 and can be factorized without tying it to the independent output map. This is a representational rank change rather than unit deletion: replace the current 236-group 16x16 input map with its best rank-7 SVD factors (7x16 and 16x7), keep GELU width 16 and the retained output map unchanged, yielding 1,660 parameters. It is more informative than rank 8 because rank-8 factors require 256 parameters and would not be strictly smaller than the current grouped input map; rank 7 is the least lossy eligible factorization. Attention, output synthesis, normalization, and generic autoregressive decoding remain unchanged.	0	0
attempt-0106	368cd074c1634660a695d297c56324a81da68b77	a1dfac6cb503f577ebebcb35e93ea9788786fa40	2026-08-17T06:00:02.412687+00:00	0.010000%	1669	discard	Factor only the shared feed-forward output transform at rank 7	Family: feed-forward width. Current retained frontier is 1,672 parameters at 99.010000%, a +0.010000 percentage-point margin over 99%. There have been 16 prior attempts in this family. The most recent accepted result is attempt-0022, which retained projection-free feed-forward width 10 at 3,040 parameters and 99.85%; the most recent failed result is attempt-0105, whose rank-7 input-transform factorization validly scored 0.01% at 1,660 parameters. Hypothesis: feature construction is full-rank-sensitive, but residual reconstruction may tolerate a rank-7 output transform. This complementary representational change keeps the current 236-group input map and GELU width 16 exact, replacing only the 227-group output map with its best rank-7 SVD factors (7x16 and 16x7), yielding 1,669 parameters. It is more informative than rank 6 because rank 7 is the highest and least lossy factorization that is strictly smaller than the current output map, and it cleanly localizes rank sensitivity to the output side. Attention, normalization, token/position representations, and generic autoregressive decoding remain unchanged.	0	0
attempt-0107	d11b726d3e343b8141632221fd728bf3655f8730	a1dfac6cb503f577ebebcb35e93ea9788786fa40	2026-08-17T06:02:21.689717+00:00	0.020000%	1655	discard	Factor the tied token matrix through a learned rank-6 code	Family: token representation. Current retained frontier is 1,672 parameters at 99.010000%, a +0.010000 percentage-point margin over 99%. There have been 6 prior attempts in this family. The most recent accepted result is attempt-0016, which removed the fixed-length EOS row and unused final position at 3,376 parameters and 99.18%; the most recent failed result is attempt-0017, whose BOS removal scored 0.02%. Hypothesis: the 12 token vectors and tied output classifiers occupy a six-dimensional learned subspace even though the transformer residual stream remains 16-dimensional. This is a major token representational change: replace the current 185 grouped token scalars with a 12x6 code matrix and 6x16 shared projection initialized by the best rank-6 SVD, retaining exact input/output weight tying and yielding 1,655 parameters. It is more informative than rank 7 because rank-7 factors require 196 parameters and would not be strictly smaller than the current grouped matrix; rank 6 is the highest eligible subspace. Token streams, positional representation, attention, autoregressive logits, and generic greedy decoding remain otherwise unchanged.	0	0
attempt-0108	98e46ec87dfb3bf07e1d5bfbd40243324a1c7979	a1dfac6cb503f577ebebcb35e93ea9788786fa40	2026-08-17T06:04:39.593096+00:00	0.000000%	1634	discard	Factor learned absolute positions through a rank-3 code	Family: position representation. Current retained frontier is 1,672 parameters at 99.010000%, a +0.010000 percentage-point margin over 99%. There have been 5 prior attempts in this family. The most recent accepted result is attempt-0030, which removed the never-forwarded positional row and qualified at 2,128 parameters and 99.14%; the most recent failed result is attempt-0025, whose centered affine rank-10 positional SVD scored 32.44% at 3,018 parameters. Hypothesis: after 329 retained scalar unions have compressed the absolute table to 182 groups, its task-relevant geometry may now lie in a three-dimensional learned subspace even though earlier dense-table rank-10 projections failed. This is a major representational change: replace grouped absolute scalars with 32x3 learned codes and a 3x16 projection initialized by best rank-3 SVD, yielding 1,634 parameters. It is more informative than rank 4 because rank-4 factors require 192 parameters and are not strictly smaller than the current 182-group table; rank 3 is the highest eligible learned positional factorization under the current frontier. Token representation, attention, autoregressive logits, and generic decoding remain unchanged.	0	0
attempt-0109	207093e2d24e44f506926db172f2f078bebd15cf	a1dfac6cb503f577ebebcb35e93ea9788786fa40	2026-08-17T06:06:08.069820+00:00			error	Project eleven fixed Fourier and parity position features into the residual stream	Family: position representation. Current retained frontier is 1,672 parameters at 99.010000%, a +0.010000 percentage-point margin over 99%. There have been 6 prior attempts in this family. The most recent accepted result is attempt-0030, which removed the never-forwarded positional row and qualified at 2,128 parameters and 99.14%; the most recent failed result is attempt-0108, whose rank-3 learned positional factorization scored 0.00% at 1,634 parameters. Hypothesis: attempt-0108 failed because unconstrained low-rank codes erased smooth order and operand-pair parity, whereas addition positions can be represented by fixed multiscale phase plus parity features. This major positional substitution replaces 182 grouped scalars with eleven deterministic features (constant, linear phase, four sine/cosine pairs, parity) and one learned 11x16 projection fitted by least squares, yielding 1,666 parameters. It is more informative than a smaller Fourier basis because eleven is the largest feature count that remains strictly below the current position parameterization and therefore minimizes projection loss while directly encoding column alternation. Token streams, attention, autoregressive logits, and generic decoding remain unchanged.	1	
attempt-0110	740fcfff47af998c8741ac5a9be0c24ebfe85aea	a1dfac6cb503f577ebebcb35e93ea9788786fa40	2026-08-17T06:08:13.918397+00:00	0.000000%	1666	discard	Repair CPU projection fit for eleven-feature Fourier and parity positions	Family: position representation. Current retained frontier is 1,672 parameters at 99.010000%, a +0.010000 percentage-point margin over 99%. There have been 7 prior attempts in this family. The most recent accepted result is attempt-0030, which removed the never-forwarded positional row and qualified at 2,128 parameters and 99.14%; the most recent failed result is attempt-0109, an infrastructure error with no official score because MPS does not implement torch.linalg.lstsq. This is the permitted repair of the identical 1,666-parameter candidate: the same eleven-feature matrix and retained positional target are solved on CPU and transferred back to the training device; architecture, fitted objective, and evaluation are unchanged. Hypothesis: fixed multiscale phase plus parity preserves smooth order and operand-pair alternation better than attempt-0108's failed unconstrained rank-3 codes. Repairing the exact unscored candidate is more informative than a smaller basis because eleven features are the largest eligible projection and isolate infrastructure from representational capacity. Token streams, attention, autoregressive logits, and generic decoding remain unchanged.	0	0
