attempt_id	commit	parent_commit	timestamp_utc	accuracy	parameters	status	description	proposal	train_exit	verify_exit
attempt-0037	7f7ed20a5f9936e6c78725323a4e4c03c69c9abb	45b925ebdb16adb119d086aa1ac8f1151cb28705	2026-08-16T07:39:02.775478+00:00			error	Train shared width 15 on full-range operands	Family: training control. Current retained frontier is 2,128 parameters at 99.140000%, a +0.140000 percentage-point margin over 99%. There has been 1 prior attempt in this family: attempt-0002 is the accepted 45k-step schedule extension under an older architecture, and there is no failed in-family result. The most recent experiment, attempt-0036 in attention organization, peaked at 93.45% internal validation. Crucially, attempt-0032 showed the fully shared width-15 model reaching 98.75% while its training sampler chose operand digit lengths uniformly from 1 through 10, heavily overrepresenting short numbers relative to uniform sampling over the official 0..10^10 range. Hypothesis: training both operands directly over the full 10-digit range focuses limited width-15 capacity on the evaluated distribution and crosses 99%, yielding 2,096 parameters. This is more informative than simply extending the schedule because the prior curve had already annealed to zero learning rate; distribution alignment changes the information seen within the same bounded 45k budget.	0	
attempt-0038	082d5fe6487e0e907a3e1e1c2c176abf50094c7f	45b925ebdb16adb119d086aa1ac8f1151cb28705	2026-08-16T07:44:25.484140+00:00			error	Use mixed-length warmup then full-range curriculum at width 15	Family: training control. Current retained frontier is 2,128 parameters at 99.140000%, a +0.140000 percentage-point margin over 99%. There have been 2 prior attempts in this family. The most recent accepted in-family result is attempt-0002, the 45k schedule extension; the most recent failed result is attempt-0037, full-range-only width-15 training, which remained at 0% validation and hit the 20k abort. Attempt-0032 had previously reached 98.75% at width 15 using mixed digit lengths throughout. Hypothesis: mixed lengths for the first 20k steps teach local addition and carry mechanics, after which full-range sampling for 25k steps concentrates refinement on the evaluated scale; model size remains 2,096. This is more informative than the nearest untested fixed mixture because the two measured extremes identify distinct learnability and distribution-allocation phases, and the staged switch tests their causal combination within the same budget.	0	
attempt-0039	cd0312bf1963f4930b2658a8d9203391a947a9ee	45b925ebdb16adb119d086aa1ac8f1151cb28705	2026-08-16T07:46:56.548017+00:00	99.140000%	2127	keep	Zero the least-magnitude LayerNorm bias scalar	Family: scalar pruning. Current retained frontier is 2,128 parameters at 99.140000%, a +0.140000 percentage-point margin over 99%. There have been 0 prior attempts in this family, so there is no accepted or failed in-family result. The most recent experiment, attempt-0038 in training control, hit the 20k abort at 27.85% and was rolled back. Retained-checkpoint inspection finds the smallest absolute block-normalization bias is blocks.1.ln2 coordinate 9 at -0.0004392121, over eight times smaller than the next candidate. Hypothesis: fixing exactly this coordinate to zero while retaining the other 15 bias coordinates as trainable parameters preserves behavior above threshold and yields 2,127 parameters. This is more informative than the nearest untested second-smallest scalar because it tests the uniquely least-salient coordinate first with the smallest possible honest parameter reduction and no retraining variance.	0	0
attempt-0040	5884c9143b0adf9b79a126bf5af6baa2afb6f3d4	cd0312bf1963f4930b2658a8d9203391a947a9ee	2026-08-16T07:48:47.553989+00:00	99.170000%	2126	keep	Zero the second-smallest LayerNorm bias scalar	Family: scalar pruning. Current retained frontier is 2,127 parameters at 99.140000%, a +0.140000 percentage-point margin over 99%. There has been 1 prior attempt in this family: attempt-0039 is accepted after zeroing blocks.1.ln2 coordinate 9, with 2,127 parameters and unchanged 99.14%; there is no failed in-family result. Among remaining dense block-normalization biases, the smallest absolute value is blocks.1.ln1 coordinate 10 at +0.003641318. Hypothesis: fixing this second scalar to zero while preserving the already accepted first zero retains qualification and yields 2,126 parameters. This is more informative than the nearest untested third-smallest scalar because it follows the predeclared ascending-magnitude ordering, making each perturbation minimal and cumulative without retraining variance.	0	0
attempt-0041	c2edc32194dc5ec2a9e6f4c6915f4c5d6419bd67	5884c9143b0adf9b79a126bf5af6baa2afb6f3d4	2026-08-16T07:50:24.957678+00:00	99.220000%	2125	keep	Zero the third-smallest LayerNorm bias scalar	Family: scalar pruning. Current retained frontier is 2,126 parameters at 99.170000%, a +0.170000 percentage-point margin over 99%. There have been 2 prior attempts in this family, both accepted; the most recent accepted result is attempt-0040 at 2,126 parameters and 99.17%, and there is no failed in-family result. The next remaining scalar in the predeclared absolute-magnitude order is blocks.0.ln1 coordinate 8 at -0.006458512. Hypothesis: fixing this third coordinate to zero while retaining the two accepted zeros preserves qualification and yields 2,125 parameters. This is more informative than the nearest untested fourth scalar because it maintains the monotone salience sequence and applies the smallest remaining checkpoint perturbation without retraining variance.	0	0
attempt-0042	d73f640f45f7e910d5082c58da35222f7bc03a3d	c2edc32194dc5ec2a9e6f4c6915f4c5d6419bd67	2026-08-16T07:52:10.340879+00:00	99.230000%	2124	keep	Zero the fourth-smallest LayerNorm bias scalar	Family: scalar pruning. Current retained frontier is 2,125 parameters at 99.220000%, a +0.220000 percentage-point margin over 99%. There have been 3 prior attempts in this family, all accepted; the most recent accepted result is attempt-0041 at 2,125 parameters and 99.22%, and there is no failed in-family result. The next remaining scalar in ascending original absolute magnitude is blocks.0.ln1 coordinate 7 at -0.008146917. Hypothesis: fixing this fourth coordinate to zero, alongside the three accepted zeros, preserves qualification and yields 2,124 parameters. This is more informative than the nearest untested fifth scalar because it continues the minimal cumulative salience path and specifically validates sparse-to-sparser checkpoint migration without changing any other learned value.	0	0
attempt-0043	69d84aa9b9ee6032bb019fa7fd5dc396daa8cc87	d73f640f45f7e910d5082c58da35222f7bc03a3d	2026-08-16T07:53:47.635313+00:00	99.040000%	2123	keep	Zero the fifth-smallest LayerNorm bias scalar	Family: scalar pruning. Current retained frontier is 2,124 parameters at 99.230000%, a +0.230000 percentage-point margin over 99%. There have been 4 prior attempts in this family, all accepted; the most recent accepted result is attempt-0042 at 2,124 parameters and 99.23%, and there is no failed in-family result. The fifth scalar in ascending original absolute magnitude is blocks.1.ln1 coordinate 6 at -0.008413289. Hypothesis: fixing this coordinate to zero while retaining the four accepted zeros preserves qualification and yields 2,123 parameters. This is more informative than the nearest untested sixth scalar because it continues the deterministic least-magnitude sequence and changes exactly one additional trainable degree of freedom.	0	0
attempt-0044	41a50b18cac9e1fcb48aa61b5b330a449ebb48e3	69d84aa9b9ee6032bb019fa7fd5dc396daa8cc87	2026-08-16T07:55:31.381743+00:00	99.060000%	2122	keep	Zero the sixth-smallest LayerNorm bias scalar	Family: scalar pruning. Current retained frontier is 2,123 parameters at 99.040000%, a +0.040000 percentage-point margin over 99%. There have been 5 prior attempts in this family, all accepted; the most recent accepted result is attempt-0043 at 2,123 parameters and 99.04%, and there is no failed in-family result. The sixth scalar in ascending original absolute magnitude is blocks.1.ln1 coordinate 5 at +0.008873722. Hypothesis: fixing this one additional coordinate to zero may retain the four-correct-case qualification slack and yields 2,122 parameters; if it does not, the official runner will roll back to attempt-0043 and close this cumulative branch. This is more informative than the nearest untested seventh scalar because it is the smallest remaining perturbation and directly locates the first qualification boundary.	0	0
attempt-0045	fba7f87cf89c6f48104cee51c8e34718428614c8	41a50b18cac9e1fcb48aa61b5b330a449ebb48e3	2026-08-16T07:57:15.205831+00:00	97.630000%	2121	discard	Zero the seventh-smallest LayerNorm bias scalar	Family: scalar pruning. Current retained frontier is 2,122 parameters at 99.060000%, a +0.060000 percentage-point margin over 99%. There have been 6 prior attempts in this family, all accepted; the most recent accepted result is attempt-0044 at 2,122 parameters and 99.06%, and there is no failed in-family result. The seventh scalar in ascending original absolute magnitude is blocks.0.ln1 coordinate 3 at -0.010450120. Hypothesis: fixing this one additional coordinate to zero preserves qualification and yields 2,121 parameters. This is more informative than the nearest untested eighth scalar because it maintains the deterministic minimal-perturbation order while the runner can atomically roll back if the narrow margin is crossed.	0	0
attempt-0046	7bf4e50ce59a00d2e3c52643f2e39a3059771a58	41a50b18cac9e1fcb48aa61b5b330a449ebb48e3	2026-08-16T07:59:04.124326+00:00	98.990000%	2121	discard	Test next LayerNorm scalar after sensitive-coordinate rollback	Family: scalar pruning. Current retained frontier is 2,122 parameters at 99.060000%, a +0.060000 percentage-point margin over 99%. There have been 7 prior attempts in this family. The most recent accepted result is attempt-0044 with six cumulative zeros at 2,122 parameters and 99.06%; the most recent failed result is attempt-0045, where additionally zeroing blocks.0.ln1 coordinate 3 scored 97.63%. Hypothesis: that coordinate is specifically carry-sensitive rather than proving all further bias pruning impossible; independently zeroing the next-magnitude candidate, blocks.1.ln1 coordinate 13 at +0.011079432, while omitting the failed coordinate, may preserve qualification and yields 2,121 parameters. This is more informative than testing a still larger scalar because it is the closest untested alternative and separates magnitude ranking from coordinate-specific functional sensitivity.	0	0
attempt-0047	53085e94a1e6c7bb3ed7dff6dc074c6963f5c7c0	41a50b18cac9e1fcb48aa61b5b330a449ebb48e3	2026-08-16T08:00:49.155075+00:00	99.100000%	2121	keep	Test a block-1 pre-FF bias scalar independently	Family: scalar pruning. Current retained frontier is 2,122 parameters at 99.060000%, a +0.060000 percentage-point margin over 99%. There have been 8 prior attempts in this family. The most recent accepted result is attempt-0044 at 2,122 parameters and 99.06%; the most recent failed result is attempt-0046, where independently zeroing blocks.1.ln1 coordinate 13 scored 98.99%, one case below qualification. Hypothesis: blocks.1.ln2 coordinate 11 at -0.012189634 may be less functionally leveraged because it affects the pre-feed-forward rather than pre-attention normalization; zeroing it alongside only the six accepted coordinates yields 2,121 parameters. This is more informative than the nearest untested larger scalar because it is the next magnitude candidate and changes normalization site after two pre-attention failures.	0	0
attempt-0048	8e0176ef055a980f1adc4fc0a4cf765c353a5dac	53085e94a1e6c7bb3ed7dff6dc074c6963f5c7c0	2026-08-16T08:02:34.451196+00:00	99.200000%	2120	keep	Prune the next block-1 pre-attention bias scalar	Family: scalar pruning. Current retained frontier is 2,121 parameters at 99.100000%, a +0.100000 percentage-point margin over 99%. There have been 9 prior attempts in this family. The most recent accepted result is attempt-0047, which pruned blocks.1.ln2 coordinate 11 and retained 99.10% at 2,121 parameters; the most recent failed result is attempt-0046, where blocks.1.ln1 coordinate 13 scored 98.99%. The next untested scalar by original magnitude is blocks.1.ln1 coordinate 4 at +0.012331018. Hypothesis: coordinate-specific sensitivity varies within ln1, so this coordinate may preserve the ten-case slack while yielding 2,120 parameters. This is more informative than moving to a larger scalar or another family because it resolves the nearest untested coordinate under the improved attempt-0047 incumbent.	0	0
attempt-0049	b62783c72cc0bff314524a0dbb5c67fd31d33cbe	8e0176ef055a980f1adc4fc0a4cf765c353a5dac	2026-08-16T08:04:13.146324+00:00	81.600000%	2119	discard	Prune block-0 pre-attention bias coordinate 15	Family: scalar pruning. Current retained frontier is 2,120 parameters at 99.200000%, a +0.200000 percentage-point margin over 99%. There have been 10 prior attempts in this family. The most recent accepted result is attempt-0048 at 2,120 parameters and 99.20%; the most recent failed result is attempt-0046 at 2,121 parameters and 98.99%. The next untested scalar by original absolute magnitude is blocks.0.ln1 coordinate 15 at +0.014814317. Hypothesis: the larger recovered margin can absorb zeroing this coordinate, yielding 2,119 parameters while preserving all eight accepted zeros and excluding known-sensitive coordinates. This is more informative than the nearest untested larger scalar because it is the minimal remaining checkpoint perturbation in the ordered scan.	0	0
attempt-0050	a3677700225d2a7203381be8cc52c72f53ec1001	8e0176ef055a980f1adc4fc0a4cf765c353a5dac	2026-08-16T08:05:57.327591+00:00	98.680000%	2119	discard	Test block-0 pre-attention bias coordinate 4 independently	Family: scalar pruning. Current retained frontier is 2,120 parameters at 99.200000%, a +0.200000 percentage-point margin over 99%. There have been 11 prior attempts in this family. The most recent accepted result is attempt-0048 at 2,120 parameters and 99.20%; the most recent failed result is attempt-0049, where blocks.0.ln1 coordinate 15 caused a valid 81.60% score. The next original-magnitude candidate is blocks.0.ln1 coordinate 4 at -0.015220259. Hypothesis: coordinate 15 is uniquely sensitive and coordinate 4 can be fixed to zero alongside the eight accepted zeros, yielding 2,119 parameters. This is more informative than the next larger coordinate because it continues an independent coordinate scan after excluding the failed coordinate rather than assuming magnitude alone predicts function.	0	0
attempt-0051	41fbb1762e4df71c7026c2fc53766b3fab777072	8e0176ef055a980f1adc4fc0a4cf765c353a5dac	2026-08-16T08:07:46.012915+00:00	96.800000%	2119	discard	Test block-0 pre-attention bias coordinate 1 independently	Family: scalar pruning. Current retained frontier is 2,120 parameters at 99.200000%, a +0.200000 percentage-point margin over 99%. There have been 12 prior attempts in this family. The most recent accepted result is attempt-0048 at 2,120 parameters and 99.20%; the most recent failed result is attempt-0050, where blocks.0.ln1 coordinate 4 scored 98.68%. The next untested original-magnitude candidate is blocks.0.ln1 coordinate 1 at -0.016125478. Hypothesis: independently fixing coordinate 1 to zero may be less damaging than coordinates 15 and 4, yielding 2,119 parameters while preserving the eight accepted zeros. This is more informative than abandoning the site before testing its final low-magnitude candidate, because coordinate-specific results have already overturned a simple magnitude rule.	0	0
attempt-0052	66619dc9191d8f6a30dc90fe2dd83f2cb76621ba	8e0176ef055a980f1adc4fc0a4cf765c353a5dac	2026-08-16T08:09:40.305493+00:00	98.990000%	2119	discard	Test block-0 pre-FF bias coordinate 13	Family: scalar pruning. Current retained frontier is 2,120 parameters at 99.200000%, a +0.200000 percentage-point margin over 99%. There have been 13 prior attempts in this family. The most recent accepted result is attempt-0048 at 2,120 parameters and 99.20%; the most recent failed result is attempt-0051, where a third additional block-0 pre-attention coordinate scored 96.80%. Three failures now close further low-magnitude pruning at blocks.0.ln1. Hypothesis: blocks.0.ln2 coordinate 13 at +0.019908736 is less sensitive because it modulates the feed-forward path; independently zeroing it alongside the eight accepted coordinates yields 2,119 parameters. This is more informative than the slightly smaller untested scalar remaining at the repeatedly sensitive ln1 site because it tests the cross-site pattern suggested by attempt-0047's successful block-1 ln2 pruning.	0	0
attempt-0053	0f69341151b0b444c0933967201a5c26c658216c	8e0176ef055a980f1adc4fc0a4cf765c353a5dac	2026-08-16T08:11:22.490459+00:00	83.090000%	2119	discard	Test adjacent block-0 pre-FF bias coordinate 2	Family: scalar pruning. Current retained frontier is 2,120 parameters at 99.200000%, a +0.200000 percentage-point margin over 99%. There have been 14 prior attempts in this family. The most recent accepted result is attempt-0048 at 2,120 parameters and 99.20%; the most recent failed result is attempt-0052, where blocks.0.ln2 coordinate 13 scored 98.99%, one case below qualification. The adjacent original-magnitude candidate is blocks.0.ln2 coordinate 2 at -0.019955626. Hypothesis: nearly equal magnitude does not imply equal functional leverage, and independently zeroing coordinate 2 may preserve qualification while yielding 2,119 parameters. This is more informative than moving to a larger-magnitude site because it provides a controlled within-layer, within-normalizer comparison against attempt-0052.	0	0
attempt-0054	f4bb7d3bce6376145ff509c73c8f1a5e26ff3208	8e0176ef055a980f1adc4fc0a4cf765c353a5dac	2026-08-16T08:13:04.532975+00:00	98.370000%	2119	discard	Test block-1 pre-attention bias coordinate 8	Family: scalar pruning. Current retained frontier is 2,120 parameters at 99.200000%, a +0.200000 percentage-point margin over 99%. There have been 15 prior attempts in this family. The most recent accepted result is attempt-0048 at 2,120 parameters and 99.20%; the most recent failed result is attempt-0053, where blocks.0.ln2 coordinate 2 scored 83.09%, closing the second block-0 normalization site after repeated failures. The next untested scalar at a site with prior accepted removals is blocks.1.ln1 coordinate 8 at -0.020058658. Hypothesis: block-1 pre-attention normalization retains additional coordinate redundancy, and zeroing coordinate 8 alongside the eight accepted zeros yields 2,119 parameters. This is more informative than continuing at either failed block-0 site because it tests the site-specific redundancy pattern established by attempts 0040, 0043, and 0048.	0	0
attempt-0055	e98d2082b6b5a5d2cdc1238e364a02a10cc0b184	8e0176ef055a980f1adc4fc0a4cf765c353a5dac	2026-08-16T08:14:50.852409+00:00	97.530000%	2119	discard	Test block-1 pre-attention bias coordinate 14	Family: scalar pruning. Current retained frontier is 2,120 parameters at 99.200000%, a +0.200000 percentage-point margin over 99%. There have been 16 prior attempts in this family. The most recent accepted result is attempt-0048 at 2,120 parameters and 99.20%; the most recent failed result is attempt-0054, where blocks.1.ln1 coordinate 8 scored 98.37%. The next same-site candidate by original magnitude is blocks.1.ln1 coordinate 14 at -0.023484299. Hypothesis: coordinate 8 may be specifically sensitive and coordinate 14 can be zeroed alongside the eight accepted coordinates, yielding 2,119 parameters. This is more informative than the following coordinate 15 because it is the closest remaining same-site candidate and completes another local sensitivity comparison before closing the site.	0	0
attempt-0056	6c951306f0bac1dad9efa6f74913b52be372abea	8e0176ef055a980f1adc4fc0a4cf765c353a5dac	2026-08-16T08:16:37.995270+00:00	96.410000%	2119	discard	Test final nearby block-1 pre-attention bias coordinate 15	Family: scalar pruning. Current retained frontier is 2,120 parameters at 99.200000%, a +0.200000 percentage-point margin over 99%. There have been 17 prior attempts in this family. The most recent accepted result is attempt-0048 at 2,120 parameters and 99.20%; the most recent failed result is attempt-0055, where blocks.1.ln1 coordinate 14 scored 97.53%. The final nearby same-site candidate is blocks.1.ln1 coordinate 15 at -0.024701780. Hypothesis: coordinate 15 may be less leveraged than coordinates 8 and 14 and can be zeroed alongside the eight accepted coordinates, yielding 2,119 parameters. This is more informative than continuing to much larger magnitudes because it completes the contiguous low-magnitude scan at this site; another failure will close further block-1 ln1 pruning.	0	0
