attempt_id	commit	parent_commit	timestamp_utc	accuracy	parameters	status	description	proposal	train_exit	verify_exit
attempt-0019	e2e38c74ad2ab04f790e16eea72ba8a5effd2496	81effb202f6962ef53608bef94839f0303cf352e	2026-08-16T05:20:11.340939+00:00	0.010000%	3344	discard	Remove lowest-norm residual LayerNorm bias group	Family: normalization. Current retained frontier is 3,360 parameters at 99.070000%, a +0.070000 percentage-point margin over 99%. There has been 1 prior attempt in this family. The most recent accepted result is attempt-0018, final-LayerNorm bias removal at 3,360 parameters and 99.07% official accuracy; there is no failed in-family result. Retained bias inspection ranks blocks.1.ln1.bias lowest by L2 norm at 0.2636, versus 0.3906, 0.6519, and 0.6638 for the other residual LayerNorm biases. Hypothesis: this least-magnitude additive group is the safest remaining affine redundancy; deleting it via checkpoint surgery yields 3,344 parameters. This parameterization-preserving, importance-ranked ablation is more informative than the nearest untested all-bias or RMSNorm substitution because it isolates one empirically weakest group under only seven-case qualification slack.	0	0
attempt-0020	0ade2c0f31543a316d6be4bc7c536332319336cf	81effb202f6962ef53608bef94839f0303cf352e	2026-08-16T05:30:45.535830+00:00	99.940000%	3168	keep	Replace both attention output projections with identity and widen FF to 12	Family: attention organization. Current retained frontier is 3,360 parameters at 99.070000%, a +0.070000 percentage-point margin over 99%. There are 0 prior attempts in this family, so no most recent accepted or failed in-family result exists. Attempt-0019 in normalization was a scored nonqualification at 0.01%, showing that another affine-bias deletion is not a safe local path. Hypothesis: concatenated two-head attention already returns a 16D residual-compatible vector, so learned 16x16 output mixing in both blocks can be replaced by identity; reallocating part of the 512-parameter saving to widen each FF bottleneck from 7 to 12 yields a 3,168-parameter representational substitution with more nonlinear capacity. This is more informative than the nearest untested one-block projection removal because it tests a coherent projection-free attention organization across depth while controlling for lost expressivity via budget reallocation.	0	0
attempt-0021	daafae2dc089658d4b0ce0e3236f4a2823819f7c	0ade2c0f31543a316d6be4bc7c536332319336cf	2026-08-16T05:42:55.108177+00:00	98.860000%	2912	discard	Reduce projection-free model feed-forward width from 12 to 8	Family: feed-forward width. Current retained frontier is 3,168 parameters at 99.940000%, a +0.940000 percentage-point margin over 99%. There have been 8 prior attempts in this family. The most recent accepted in-family result is attempt-0012, ff_dim=7 with conventional output projections at 3,424 parameters and 99.18% official accuracy; the most recent failed result is attempt-0011, ff_dim=6 under that architecture, an optimization failure reaching 98.65% internal validation without an official score. Attempt-0020 then established a projection-free attention architecture with ff_dim=12 and 99.94% official accuracy. Hypothesis: that architecture retains enough margin to reduce ff_dim 12->8, a parameterization-preserving compression removing 256 parameters and yielding 2,912. This is more informative than the nearest untested width 10 because it tests whether the previously viable half-width nonlinear state survives the major attention substitution.	0	0
attempt-0022	0f238238b535303ba022d3f231fcb8bfaf797056	0ade2c0f31543a316d6be4bc7c536332319336cf	2026-08-16T05:55:49.140526+00:00	99.850000%	3040	keep	Test projection-free feed-forward midpoint width 10	Family: feed-forward width. Current retained frontier is 3,168 parameters at 99.940000%, a +0.940000 percentage-point margin over 99%. There have been 9 prior attempts in this family. The most recent accepted in-family result is attempt-0012, width 7 under conventional attention at 99.18%; the most recent failed result is attempt-0021, the projection-free width-8 candidate, a valid scored nonqualification at 98.86% with 2,912 parameters. The projection-free width-12 result from attempt-0020 is accepted at 99.94%. Hypothesis: the capacity transition for projection-free attention lies between widths 8 and 12; ff_dim=10 removes 128 parameters for a 3,040-parameter midpoint. This parameterization-preserving midpoint is more informative than the nearest untested width 11 because it bisects the measured same-architecture bracket.	0	0
attempt-0023	3e89b2f6c91aec8489a2b9e7c285815e9bdb6e2e	0f238238b535303ba022d3f231fcb8bfaf797056	2026-08-16T06:07:03.226129+00:00			error	Test final projection-free feed-forward boundary at width 9	Family: feed-forward width. Current retained frontier is 3,040 parameters at 99.850000%, a +0.850000 percentage-point margin over 99%. There have been 10 prior attempts in this family. The most recent accepted result is attempt-0022, projection-free ff_dim=10 at 3,040 parameters and 99.85% official accuracy; the most recent failed result is attempt-0021, projection-free ff_dim=8 at 2,912 parameters and a scored 98.86% nonqualification. Hypothesis: the same-architecture capacity transition may lie at the sole remaining integer width 9; reducing ff_dim 10->9 removes 64 parameters for a 2,976-parameter model. This parameterization-preserving test is more informative than any nearest alternative in the family because it completes the exact accepted/failed projection-free bracket under identical training conditions.	0	
attempt-0024	2e948ff0bf9af207f2be45038df7a473eb420815	0f238238b535303ba022d3f231fcb8bfaf797056	2026-08-16T06:09:03.465099+00:00	25.180000%	3002	discard	Factor retained position table at highest compressive SVD rank 10	Family: position representation. Current retained frontier is 3,040 parameters at 99.850000%, a +0.850000 percentage-point margin over 99%. There have been 2 prior attempts in this family. There is no accepted in-family result; the most recent failed result is attempt-0004, an optimization failure where a freshly trained direct 8D positional subspace reached only 9.35% validation before aborting, under the older separated-token architecture. Attempt-0023 in feed-forward width was also an optimization failure (width 9 reached 98.35% validation without checkpoint), so width 10 remains retained. Hypothesis: the trained positional table itself is approximately low-rank; its top 10 singular components retain 99.6198% of squared energy, and rank 10 is the highest rank that reduces position parameters (528->490), yielding 3,002 total. This representational compression is more informative than the nearest untested rank 9 because it tests the least lossy parameter-saving boundary and uses checkpoint SVD to separate approximation error from fresh-training instability.	0	0
attempt-0025	09365a9f08da8b067c137cb3d767caea7165373e	0f238238b535303ba022d3f231fcb8bfaf797056	2026-08-16T06:10:53.643809+00:00	32.440000%	3018	discard	Use centered affine rank-10 positional SVD factorization	Family: position representation. Current retained frontier is 3,040 parameters at 99.850000%, a +0.850000 percentage-point margin over 99%. There have been 3 prior attempts in this family. There is no accepted in-family result; the most recent failed result is attempt-0024, a valid rank-10 uncentered SVD candidate that scored 25.18% official accuracy at 3,002 parameters. Hypothesis: the uncentered factor spent rank on the table mean; preserving that mean exactly as a 16D projection bias and applying rank-10 SVD to centered residuals raises retained residual energy to 99.7506% while still yielding 3,018 parameters. This is a changed affine factorization, not a retry of the failed approximation. It is more informative than the nearest untested centered rank 9 because rank 10 is the least-lossy centered factor that remains strictly smaller than the incumbent.	0	0
attempt-0026	c2b2ae3f502f532d584ad7a4ee4f79ee4b7c765c	0f238238b535303ba022d3f231fcb8bfaf797056	2026-08-16T06:20:08.218038+00:00	99.980000%	2656	keep	Share QKV transform across depth and widen feed-forward paths	Family: parameter tying. Current retained frontier is 3,040 parameters at 99.850000%, a +0.850000 percentage-point margin over 99%. There have been 0 prior attempts in this family, so there is no accepted or failed in-family result. The most recent experiment, attempt-0025 in position representation, was a scored nonqualification at 32.44%, while attempt-0022 remains retained. Hypothesis: both blocks can reuse one 16x48 QKV transform because their inputs, normalizers, attention maps, residual states, and feed-forward paths remain layer-specific; widening each feed-forward path from 10 to 16 reallocates 384 of the 768 saved parameters. The resulting 2,656-parameter model is a genuine parameter-sharing architecture. This is more informative than the nearest untested tying alternative, sharing the feed-forward matrices, because QKV sharing saves more capacity while retaining independent nonlinear computation in each block.	0	0
attempt-0027	6ba03c988eeedab7e704215bce121587b4c4ef9d	c2b2ae3f502f532d584ad7a4ee4f79ee4b7c765c	2026-08-16T06:22:10.010039+00:00	0.000000%	2528	discard	Prune two lowest-salience feed-forward units per block	Family: feed-forward width. Current retained frontier is 2,656 parameters at 99.980000%, a +0.980000 percentage-point margin over 99%. There have been 11 prior attempts in this family. The most recent accepted in-family result is attempt-0022, projection-free width 10 at 3,040 parameters and 99.85%; the most recent failed in-family result is attempt-0023, width 9, an optimization failure peaking at 98.35% internal validation. Attempt-0026 has since established a shared-QKV architecture at width 16 and 99.98%. Hypothesis: its larger feed-forward paths contain removable units; rank each unit by the product of its incoming-row and outgoing-column norms, then retain 14 of 16 independently per block. This checkpoint-derived, parameterization-preserving reduction yields 2,528 parameters and isolates functional redundancy from training noise. It is more informative than the nearest untested width 15 because removing two units is the smallest material step that tests whether the new architecture's large margin corresponds to redundant nonlinear channels.	0	0
attempt-0028	688cb7250c2dd359ac56b08459c0b91780bded6f	c2b2ae3f502f532d584ad7a4ee4f79ee4b7c765c	2026-08-16T06:24:06.904619+00:00	0.000000%	2592	discard	Prune one lowest-salience feed-forward unit per block	Family: feed-forward width. Current retained frontier is 2,656 parameters at 99.980000%, a +0.980000 percentage-point margin over 99%. There have been 12 prior attempts in this family. The most recent accepted in-family result is attempt-0022, width 10 under independent QKV at 3,040 parameters and 99.85%; the most recent failed in-family result is attempt-0027, salience-pruned width 14 under shared QKV, which validly scored 0.00%. Hypothesis: attempt-0027 may have crossed a discrete sensitivity boundary by removing two units per block; retaining 15 of 16 using the same two-sided norm score removes only 64 parameters and yields 2,592. This parameterization-preserving exact-boundary test is more informative than fresh width-15 retraining because it directly determines whether any individual trained feed-forward channel is dispensable, and it is more informative than another width below 14 because the measured width-14 checkpoint failed catastrophically.	0	0
attempt-0029	950da517c072298f15a04ada56d1842e37b26312	c2b2ae3f502f532d584ad7a4ee4f79ee4b7c765c	2026-08-16T06:36:13.412721+00:00	99.140000%	2144	keep	Share feed-forward transforms as well as QKV across depth	Family: parameter tying. Current retained frontier is 2,656 parameters at 99.980000%, a +0.980000 percentage-point margin over 99%. There has been 1 prior attempt in this family: attempt-0026 is the accepted shared-QKV result at 2,656 parameters and 99.98%, and there is no failed in-family result. The most recent failures, attempts 0027 and 0028 in feed-forward width, show that direct deletion of even one trained unit per block destroys exact-sequence accuracy. Hypothesis: instead of deleting nonlinear channels, both depth steps can reuse the complete width-16 feed-forward transform while retaining independent pre-attention and pre-FF LayerNorm affine parameters and distinct residual states. Fresh training can co-adapt this recurrent transform, yielding 2,144 unique parameters. This is more informative than the nearest untested partial tie of only one feed-forward matrix because it directly tests whether layer specialization resides in normalization/residual state rather than either half of the nonlinear transform, with a larger measurable compression.	0	0
attempt-0030	45b925ebdb16adb119d086aa1ac8f1151cb28705	950da517c072298f15a04ada56d1842e37b26312	2026-08-16T06:38:28.529270+00:00	99.140000%	2128	keep	Remove the never-forwarded final positional row	Family: position representation. Current retained frontier is 2,144 parameters at 99.140000%, a +0.140000 percentage-point margin over 99%. There have been 4 prior attempts in this family. There is no accepted in-family result; the most recent failed result is attempt-0025, whose centered rank-10 positional approximation scored 32.44% at 3,018 parameters. Attempt-0029 has since established the 2,144-parameter fully shared-transform frontier. Hypothesis: row 32 of the 33-row positional table is provably unused: teacher-forced inputs have length 32 after shifting, and the eleventh generation token is appended after the final length-32 forward pass. Cropping that row and attention masks exactly preserves every evaluated computation while yielding 2,128 parameters. This is more informative than the nearest untested lossy positional factorization because it removes a structurally unreachable parameter row with zero approximation error, crucial given the incumbent's narrow margin.	0	0
attempt-0031	a390a18a1713cc0e69ae8c548a97b295a4a48e11	45b925ebdb16adb119d086aa1ac8f1151cb28705	2026-08-16T06:40:13.240863+00:00			error	Train the fully shared transform at feed-forward width 15	Family: feed-forward width. Current retained frontier is 2,128 parameters at 99.140000%, a +0.140000 percentage-point margin over 99%. There have been 13 prior attempts in this family. The most recent accepted in-family result is attempt-0022, projection-free width 10 with independent feed-forward paths at 3,040 parameters and 99.85%; the most recent failed in-family result is attempt-0028, direct width-15 pruning under shared QKV but independent feed-forward paths, which scored 0.00%. Attempts 0029 and 0030 have since established a fully shared-transform architecture. Hypothesis: fresh training can distribute the recurrent feed-forward computation across 15 channels even though deleting a channel from a specialized independent-path checkpoint failed; reducing the single shared width 16->15 yields 2,096 parameters. This is more informative than width 14 because width 15 is the exact nearest capacity boundary, and more informative than another checkpoint prune because it tests learnability under the retained sharing topology.	1	
attempt-0032	579b9625292f189a9e6a73bae9df6c7d57522632	45b925ebdb16adb119d086aa1ac8f1151cb28705	2026-08-16T06:51:01.069603+00:00			error	Train shared width 15 with corrected shifted teacher forcing	Family: feed-forward width. Current retained frontier is 2,128 parameters at 99.140000%, a +0.140000 percentage-point margin over 99%. There have been 14 prior attempts in this family. The most recent accepted in-family result is attempt-0022 at width 10 under an older topology; the most recent failed result is attempt-0031, an execution error before optimization because fresh training forwarded 33 tokens after the model's exact maximum had become 32. The traceback was inspected and classified as a pipeline shape defect, not model evidence. Hypothesis: with intended shifted teacher forcing now forwarding the 32 input tokens and predicting the 32 following targets, the fully shared width-15 model can co-adapt and qualify at 2,096 parameters. This repaired executable test is more informative than the nearest untested width 14 because width 15 is the exact capacity boundary and attempt-0031 produced no accuracy observation.	0	
attempt-0033	3c5c19efeb4349d77f69ea2b28446231d3126b2b	45b925ebdb16adb119d086aa1ac8f1151cb28705	2026-08-16T07:01:24.547657+00:00			error	Share corresponding LayerNorm affines across recurrent depth	Family: parameter tying. Current retained frontier is 2,128 parameters at 99.140000%, a +0.140000 percentage-point margin over 99%. There have been 2 prior attempts in this family, both accepted: the most recent accepted result is attempt-0029, which shared QKV and both feed-forward matrices at 2,144 parameters and 99.14%; there is no failed in-family result. Attempt-0032 most recently showed shared feed-forward width 15 peaking at 98.75% internal validation, so width 16 is restored. Hypothesis: because both depth steps already reuse attention and feed-forward transforms, corresponding pre-attention and pre-FF LayerNorm affine parameters can also be shared while the residual state changes between applications; this yields a fully recurrent block with 2,064 unique parameters. This is more informative than the nearest untested partial tie of LayerNorm weights alone because it directly tests whether any depth-specific normalization affine state is required and realizes the complete 64-parameter saving.	0	
attempt-0034	2734bbfa9b9c35c8dd93151c1f9a2cd856f2a958	45b925ebdb16adb119d086aa1ac8f1151cb28705	2026-08-16T07:11:55.990173+00:00			error	Share only corresponding LayerNorm biases across depth	Family: parameter tying. Current retained frontier is 2,128 parameters at 99.140000%, a +0.140000 percentage-point margin over 99%. There have been 3 prior attempts in this family. The most recent accepted in-family result is attempt-0029, full attention/feed-forward sharing at 2,144 parameters and 99.14%; the most recent failed result is attempt-0033, which shared both LayerNorm scales and biases and peaked at 77.55% internal validation. Hypothesis: depth-specific normalization scale is necessary but additive offsets are less expressive and can be shared; tying only corresponding ln1 and ln2 bias vectors while retaining separate scale vectors yields 2,096 parameters. This is more informative than the nearest untested scale-only tie because the earlier successful deletion of the final LayerNorm bias suggests bias is the lower-risk affine component, while the full-affine failure establishes that both components cannot be tied together.	0	
attempt-0035	80276959207bddd03cef7f78c8ec911977d26515	45b925ebdb16adb119d086aa1ac8f1151cb28705	2026-08-16T07:22:55.201326+00:00			error	Reduce shared query-key width to 12 while retaining full values	Family: attention organization. Current retained frontier is 2,128 parameters at 99.140000%, a +0.140000 percentage-point margin over 99%. There has been 1 prior attempt in this family: attempt-0020 is the accepted projection-free attention result at 3,168 parameters and 99.94%, and there is no failed in-family result. The most recent experiment, attempt-0034 in parameter tying, peaked at 93.95% internal validation, closing LayerNorm bias sharing. Hypothesis: attention routing requires fewer features than the value/residual stream; reduce shared query and key width 16->12, retain the full 16D value stream and two heads, and save 128 parameters for a 2,000-parameter model. This is more informative than the nearest untested width 14 because a 25% routing-width reduction cleanly separates similarity capacity from value capacity while remaining conservative relative to halving query/key width to 8.	0	
attempt-0036	102b555caf1feb1b1a89c881e8df0dc9e6093587	45b925ebdb16adb119d086aa1ac8f1151cb28705	2026-08-16T07:33:40.328299+00:00			error	Test midpoint query-key width 14 with full values	Family: attention organization. Current retained frontier is 2,128 parameters at 99.140000%, a +0.140000 percentage-point margin over 99%. There have been 2 prior attempts in this family. The most recent accepted in-family result is attempt-0020, projection-free full-width attention at 3,168 parameters and 99.94%; the most recent failed result is attempt-0035, shared query/key width 12 with full values, which peaked at 97.85% internal validation. The retained full-width shared attention uses query/key width 16. Hypothesis: the routing-capacity transition lies between widths 12 and 16; width 14 restores one feature per head, saves 64 parameters, and yields 2,064. This parameterization-preserving midpoint is more informative than the nearest alternative because it exactly bisects the measured same-topology accepted/failed bracket while leaving values, residuals, normalizers, data, and training unchanged.	0	
